experiments/depr/rq1_data/attention/kernel1_blockReduce_cache.json
{
"device_name": "NVIDIA RTX 5000 Ada Generation",
"kernel_name": "kernel1_blockReduce",
"problem_size": [
1024,
1
],
"tune_params_keys": [
"block_size_x",
"nvml_pwr_limit"
],
"tune_params": {
"block_size_x": [
16,
32,
64,
128,
256
],
"nvml_pwr_limit": [
100,
105,
110,
115,
120,
125,
130,
135,
140,
145,
150,
155,
160,
165,
170,
175,
180,
185,
190,
195,
200,
205,
210,
215,
220,
225,
230,
235,
240,
245,
250
]
},
"objective": "time",
"cache": {
"32,100": {"block_size_x": 32, "nvml_pwr_limit": 100, "time": "RuntimeFailedConfig", "compile_time": 1184.4457809929736, "verification_time": 0, "benchmark_time": 37.39985596621409, "strategy_time": 0, "framework_time": 0, "timestamp": "2025-02-13 05:48:32.832030+00:00"},
"32,105": {"block_size_x": 32, "nvml_pwr_limit": 105, "time": "RuntimeFailedConfig", "compile_time": 1197.9168599937111, "verification_time": 0, "benchmark_time": 43.455313018057495, "strategy_time": 0, "framework_time": 49.77360094198957, "timestamp": "2025-02-13 05:48:34.123202+00:00"},
"32,110": {"block_size_x": 32, "nvml_pwr_limit": 110, "time": "RuntimeFailedConfig", "compile_time": 1199.2314140079543, "verification_time": 0, "benchmark_time": 42.83807100728154, "strategy_time": 0, "framework_time": 49.975120986346155, "timestamp": "2025-02-13 05:48:35.415267+00:00"},
"32,115": {"block_size_x": 32, "nvml_pwr_limit": 115, "time": "RuntimeFailedConfig", "compile_time": 1203.187016013544, "verification_time": 0, "benchmark_time": 40.522154013160616, "strategy_time": 0, "framework_time": 54.55120396800339, "timestamp": "2025-02-13 05:48:36.713548+00:00"},
"32,120": {"block_size_x": 32, "nvml_pwr_limit": 120, "time": "RuntimeFailedConfig", "compile_time": 1199.8732259962708, "verification_time": 0, "benchmark_time": 42.806211044080555, "strategy_time": 0, "framework_time": 51.0428249835968, "timestamp": "2025-02-13 05:48:38.007291+00:00"},
"32,125": {"block_size_x": 32, "nvml_pwr_limit": 125, "time": "RuntimeFailedConfig", "compile_time": 1195.1815329957753, "verification_time": 0, "benchmark_time": 42.005158960819244, "strategy_time": 0, "framework_time": 50.127092050388455, "timestamp": "2025-02-13 05:48:39.294626+00:00"},
"32,130": {"block_size_x": 32, "nvml_pwr_limit": 130, "time": "RuntimeFailedConfig", "compile_time": 1203.1022050068714, "verification_time": 0, "benchmark_time": 40.94926599645987, "strategy_time": 0, "framework_time": 50.966434995643795, "timestamp": "2025-02-13 05:48:40.589665+00:00"},
"32,135": {"block_size_x": 32, "nvml_pwr_limit": 135, "time": "RuntimeFailedConfig", "compile_time": 1199.4226810056716, "verification_time": 0, "benchmark_time": 37.139596010092646, "strategy_time": 0, "framework_time": 0, "timestamp": "2025-02-13 05:54:41.424218+00:00"},
"32,140": {"block_size_x": 32, "nvml_pwr_limit": 140, "time": "RuntimeFailedConfig", "compile_time": 1198.9700000267476, "verification_time": 0, "benchmark_time": 41.26870899926871, "strategy_time": 0, "framework_time": 48.852459935005754, "timestamp": "2025-02-13 05:54:42.713329+00:00"},
"32,145": {"block_size_x": 32, "nvml_pwr_limit": 145, "time": "RuntimeFailedConfig", "compile_time": 1197.7906860411167, "verification_time": 0, "benchmark_time": 42.36050200415775, "strategy_time": 0, "framework_time": 48.93099993932992, "timestamp": "2025-02-13 05:54:44.002431+00:00"},
"32,150": {"block_size_x": 32, "nvml_pwr_limit": 150, "time": "RuntimeFailedConfig", "compile_time": 1208.1676159868948, "verification_time": 0, "benchmark_time": 42.26656100945547, "strategy_time": 0, "framework_time": 50.016123976092786, "timestamp": "2025-02-13 05:54:45.302901+00:00"},
"32,155": {"block_size_x": 32, "nvml_pwr_limit": 155, "time": "RuntimeFailedConfig", "compile_time": 1199.1391999763437, "verification_time": 0, "benchmark_time": 41.457898973021656, "strategy_time": 0, "framework_time": 50.80767604522407, "timestamp": "2025-02-13 05:54:46.594326+00:00"},
"32,160": {"block_size_x": 32, "nvml_pwr_limit": 160, "time": "RuntimeFailedConfig", "compile_time": 1200.9204850182869, "verification_time": 0, "benchmark_time": 42.40379203110933, "strategy_time": 0, "framework_time": 53.50644391728565, "timestamp": "2025-02-13 05:54:47.891177+00:00"},
"32,165": {"block_size_x": 32, "nvml_pwr_limit": 165, "time": "RuntimeFailedConfig", "compile_time": 1200.4817490233108, "verification_time": 0, "benchmark_time": 37.172347016166896, "strategy_time": 0, "framework_time": 0, "timestamp": "2025-02-13 06:01:49.396987+00:00"},
"32,170": {"block_size_x": 32, "nvml_pwr_limit": 170, "time": "RuntimeFailedConfig", "compile_time": 1197.4380600149743, "verification_time": 0, "benchmark_time": 41.179959021974355, "strategy_time": 0, "framework_time": 50.161964958533645, "timestamp": "2025-02-13 06:01:50.685786+00:00"},
"32,175": {"block_size_x": 32, "nvml_pwr_limit": 175, "time": "RuntimeFailedConfig", "compile_time": 1200.3089479985647, "verification_time": 0, "benchmark_time": 43.16671402193606, "strategy_time": 0, "framework_time": 50.35146698355675, "timestamp": "2025-02-13 06:01:51.979633+00:00"},
"32,180": {"block_size_x": 32, "nvml_pwr_limit": 180, "time": "RuntimeFailedConfig", "compile_time": 1199.2616659845226, "verification_time": 0, "benchmark_time": 41.354368964675814, "strategy_time": 0, "framework_time": 49.72901404835284, "timestamp": "2025-02-13 06:01:53.269999+00:00"},
"32,185": {"block_size_x": 32, "nvml_pwr_limit": 185, "time": "RuntimeFailedConfig", "compile_time": 1208.1899819895625, "verification_time": 0, "benchmark_time": 43.94925700034946, "strategy_time": 0, "framework_time": 50.049773999489844, "timestamp": "2025-02-13 06:01:54.572209+00:00"},
"32,190": {"block_size_x": 32, "nvml_pwr_limit": 190, "time": "RuntimeFailedConfig", "compile_time": 1198.9294750383124, "verification_time": 0, "benchmark_time": 41.42571002012119, "strategy_time": 0, "framework_time": 49.5023729163222, "timestamp": "2025-02-13 06:01:55.862087+00:00"},
"32,195": {"block_size_x": 32, "nvml_pwr_limit": 195, "time": "RuntimeFailedConfig", "compile_time": 1200.7844190229662, "verification_time": 0, "benchmark_time": 42.33653302071616, "strategy_time": 0, "framework_time": 54.020426934584975, "timestamp": "2025-02-13 06:01:57.159250+00:00"},
"32,200": {"block_size_x": 32, "nvml_pwr_limit": 200, "time": "RuntimeFailedConfig", "compile_time": 1188.5093959863298, "verification_time": 0, "benchmark_time": 37.3149779625237, "strategy_time": 0, "framework_time": 0, "timestamp": "2025-02-13 06:02:35.754943+00:00"},
"32,205": {"block_size_x": 32, "nvml_pwr_limit": 205, "time": "RuntimeFailedConfig", "compile_time": 1203.6482399562374, "verification_time": 0, "benchmark_time": 43.5726759606041, "strategy_time": 0, "framework_time": 53.172684099990875, "timestamp": "2025-02-13 06:02:37.055355+00:00"},
"32,210": {"block_size_x": 32, "nvml_pwr_limit": 210, "time": "RuntimeFailedConfig", "compile_time": 1198.9413990522735, "verification_time": 0, "benchmark_time": 38.32384099951014, "strategy_time": 0, "framework_time": 0, "timestamp": "2025-02-13 06:04:09.502246+00:00"},
"32,215": {"block_size_x": 32, "nvml_pwr_limit": 215, "time": "RuntimeFailedConfig", "compile_time": 1200.086371973157, "verification_time": 0, "benchmark_time": 43.69086603401229, "strategy_time": 0, "framework_time": 53.5798060009256, "timestamp": "2025-02-13 06:04:10.799623+00:00"},
"32,220": {"block_size_x": 32, "nvml_pwr_limit": 220, "time": "RuntimeFailedConfig", "compile_time": 1199.0442390087992, "verification_time": 0, "benchmark_time": 43.28631499083713, "strategy_time": 0, "framework_time": 48.15076000522822, "timestamp": "2025-02-13 06:04:12.090124+00:00"},
"32,225": {"block_size_x": 32, "nvml_pwr_limit": 225, "time": "RuntimeFailedConfig", "compile_time": 1197.8788480046205, "verification_time": 0, "benchmark_time": 38.47972099902108, "strategy_time": 0, "framework_time": 0, "timestamp": "2025-02-13 06:04:57.390176+00:00"},
"32,230": {"block_size_x": 32, "nvml_pwr_limit": 230, "time": "RuntimeFailedConfig", "compile_time": 1200.3103739698417, "verification_time": 0, "benchmark_time": 42.487093014642596, "strategy_time": 0, "framework_time": 49.953655048739165, "timestamp": "2025-02-13 06:04:58.682948+00:00"},
"32,235": {"block_size_x": 32, "nvml_pwr_limit": 235, "time": "RuntimeFailedConfig", "compile_time": 1196.4603529777378, "verification_time": 0, "benchmark_time": 45.048200991004705, "strategy_time": 0, "framework_time": 52.86484298994765, "timestamp": "2025-02-13 06:04:59.977340+00:00"},
"32,240": {"block_size_x": 32, "nvml_pwr_limit": 240, "time": "RuntimeFailedConfig", "compile_time": 1204.8445270047523, "verification_time": 0, "benchmark_time": 42.85512398928404, "strategy_time": 0, "framework_time": 50.21976603893563, "timestamp": "2025-02-13 06:05:01.275280+00:00"},
"32,245": {"block_size_x": 32, "nvml_pwr_limit": 245, "time": "RuntimeFailedConfig", "compile_time": 1198.8145500072278, "verification_time": 0, "benchmark_time": 46.870565973222256, "strategy_time": 0, "framework_time": 51.16901802830398, "timestamp": "2025-02-13 06:05:02.572155+00:00"},
"32,250": {"block_size_x": 32, "nvml_pwr_limit": 250, "time": "RuntimeFailedConfig", "compile_time": 1197.7215770166367, "verification_time": 0, "benchmark_time": 42.6258229999803, "strategy_time": 0, "framework_time": 51.07956798747182, "timestamp": "2025-02-13 06:05:03.863602+00:00"},
"64,100": {"block_size_x": 64, "nvml_pwr_limit": 100, "time": "RuntimeFailedConfig", "compile_time": 1199.4275220204145, "verification_time": 0, "benchmark_time": 42.68124303780496, "strategy_time": 0, "framework_time": 49.62389398133382, "timestamp": "2025-02-13 06:05:05.155354+00:00"},
"64,105": {"block_size_x": 64, "nvml_pwr_limit": 105, "time": "RuntimeFailedConfig", "compile_time": 1203.397824021522, "verification_time": 0, "benchmark_time": 42.66919399378821, "strategy_time": 0, "framework_time": 50.35379494074732, "timestamp": "2025-02-13 06:05:06.451795+00:00"},
"64,110": {"block_size_x": 64, "nvml_pwr_limit": 110, "time": "RuntimeFailedConfig", "compile_time": 1203.360723971855, "verification_time": 0, "benchmark_time": 44.577209977433085, "strategy_time": 0, "framework_time": 50.45303504448384, "timestamp": "2025-02-13 06:05:07.750207+00:00"},
"64,115": {"block_size_x": 64, "nvml_pwr_limit": 115, "time": "RuntimeFailedConfig", "compile_time": 1207.8158959629945, "verification_time": 0, "benchmark_time": 42.76629298692569, "strategy_time": 0, "framework_time": 54.49410807341337, "timestamp": "2025-02-13 06:05:09.055303+00:00"},