experiments/data/run3/bayes_opt_float16.json
{
"device_name": "NVIDIA RTX 5000 Ada Generation",
"kernel_name": "tuned_matmul<__half>",
"problem_size": [
4096,
4096
],
"tune_params_keys": [
"block_size_x",
"block_size_y",
"tile_size_x",
"tile_size_y",
"nvml_pwr_limit"
],
"tune_params": {
"block_size_x": [
32,
64,
128,
256,
512,
1024
],
"block_size_y": [
32,
64,
128,
256,
512,
1024
],
"tile_size_x": [
2,
4,
8,
16,
32
],
"tile_size_y": [
2,
4,
8,
16,
32
],
"nvml_pwr_limit": [
100,
140,
175,
210,
250
]
},
"objective": "objective",
"cache": {
"32,32,16,32,250": {"block_size_x": 32, "block_size_y": 32, "tile_size_x": 16, "tile_size_y": 32, "nvml_pwr_limit": 250, "sm__warps_active.avg.pct_of_peak_sustained_active": 66.05016778491556, "dram__bytes.sum.per_second": 1577626841.2286074, "time": 34.08277457101004, "times": [34.374942779541016, 34.21958541870117, 34.08591842651367, 34.088191986083984, 34.009185791015625, 33.902687072753906, 33.89891052246094], "nvml_power": 251.644, "nvml_energy": 8.57672572414725, "compile_time": 245.96566706895828, "verification_time": 0, "benchmark_time": 1320.0788809917867, "edp": 292.31860941349356, "throughput_penalty": 1000000.0, "objective": 1000292.3186094135, "strategy_time": 40.372263989411294, "framework_time": 0, "timestamp": "2025-02-20 05:57:32.662741+00:00"},
"32,32,8,32,100": {"block_size_x": 32, "block_size_y": 32, "tile_size_x": 8, "tile_size_y": 32, "nvml_pwr_limit": 100, "sm__warps_active.avg.pct_of_peak_sustained_active": 65.96752413728767, "dram__bytes.sum.per_second": 582282632.7842209, "time": 71.58772604806083, "times": [75.41276550292969, 70.5992660522461, 71.02153778076172, 71.02438354492188, 71.01779174804688, 71.01958465576172, 71.01875305175781], "nvml_power": 101.416, "nvml_energy": 7.2601408248901365, "compile_time": 269.2698269383982, "verification_time": 0, "benchmark_time": 1603.5602999618277, "edp": 519.7369724425774, "throughput_penalty": 1000000.0, "objective": 1000519.7369724426, "strategy_time": 0.1338010188192129, "framework_time": 47.93622705619782, "timestamp": "2025-02-20 05:57:34.583671+00:00"},
"32,32,16,8,140": {"block_size_x": 32, "block_size_y": 32, "tile_size_x": 16, "tile_size_y": 8, "nvml_pwr_limit": 140, "sm__warps_active.avg.pct_of_peak_sustained_active": 66.04963116402894, "dram__bytes.sum.per_second": 207863359.51884466, "time": 45.86519840785435, "times": [46.626529693603516, 45.810081481933594, 45.88617706298828, 45.68252944946289, 45.683807373046875, 45.68412780761719, 45.683135986328125], "nvml_power": 140.757, "nvml_energy": 6.455847732294355, "compile_time": 261.02252304553986, "verification_time": 0, "benchmark_time": 1443.7398361042142, "edp": 296.0987371325772, "throughput_penalty": 1000000.0, "objective": 1000296.0987371326, "strategy_time": 0.13426004443317652, "framework_time": 51.0143768042326, "timestamp": "2025-02-20 05:57:36.339608+00:00"},
"32,32,2,4,175": {"block_size_x": 32, "block_size_y": 32, "tile_size_x": 2, "tile_size_y": 4, "nvml_pwr_limit": 175, "sm__warps_active.avg.pct_of_peak_sustained_active": 66.04387228485224, "dram__bytes.sum.per_second": 190839.15907285846, "time": 38.84879084995815, "times": [39.70937728881836, 38.82233428955078, 38.654335021972656, 38.660640716552734, 38.656673431396484, 38.6572151184082, 38.78096008300781], "nvml_power": 178.228, "nvml_energy": 6.923942295606341, "compile_time": 252.4579259334132, "verification_time": 0, "benchmark_time": 1361.6400730097666, "edp": 268.9867860991898, "throughput_penalty": 1000000.0, "objective": 1000268.9867860992, "strategy_time": 0.1326599158346653, "framework_time": 53.07168315630406, "timestamp": "2025-02-20 05:57:38.006935+00:00"},
"32,32,16,2,140": {"block_size_x": 32, "block_size_y": 32, "tile_size_x": 16, "tile_size_y": 2, "nvml_pwr_limit": 140, "sm__warps_active.avg.pct_of_peak_sustained_active": 66.0434880468067, "dram__bytes.sum.per_second": 447484.7323344398, "time": 45.637874603271484, "times": [47.55235290527344, 45.7017936706543, 45.516353607177734, 45.33145523071289, 45.07273483276367, 44.981441497802734, 45.308990478515625], "nvml_power": 142.362, "nvml_energy": 6.4970991042709345, "compile_time": 268.34730396512896, "verification_time": 0, "benchmark_time": 1427.0350519800559, "edp": 296.5137942057444, "throughput_penalty": 1000000.0, "objective": 1000296.5137942057, "strategy_time": 0.13609998859465122, "framework_time": 49.687413149513304, "timestamp": "2025-02-20 05:57:39.752166+00:00"},
"32,32,8,2,210": {"block_size_x": 32, "block_size_y": 32, "tile_size_x": 8, "tile_size_y": 2, "nvml_pwr_limit": 210, "sm__warps_active.avg.pct_of_peak_sustained_active": 66.04673064625881, "dram__bytes.sum.per_second": 0.0, "time": 35.83499417986189, "times": [36.4466552734375, 35.78246307373047, 35.69935989379883, 35.601375579833984, 35.772159576416016, 35.77046585083008, 35.77248001098633], "nvml_power": 216.816, "nvml_energy": 7.769600098100934, "compile_time": 267.9786829976365, "verification_time": 0, "benchmark_time": 1331.491376971826, "edp": 278.4235742953013, "throughput_penalty": 1000000.0, "objective": 1000278.4235742952, "strategy_time": 0.1330800587311387, "framework_time": 53.68942499626428, "timestamp": "2025-02-20 05:57:41.405483+00:00"},
"32,32,2,8,175": {"block_size_x": 32, "block_size_y": 32, "tile_size_x": 2, "tile_size_y": 8, "nvml_pwr_limit": 175, "sm__warps_active.avg.pct_of_peak_sustained_active": 66.04360476140883, "dram__bytes.sum.per_second": 155062.94355616556, "time": 39.15684182303293, "times": [39.856544494628906, 39.61958312988281, 38.987552642822266, 38.91401672363281, 38.90857696533203, 38.90585708618164, 38.90576171875], "nvml_power": 180.356, "nvml_energy": 7.062171363834926, "compile_time": 267.2373609384522, "verification_time": 0, "benchmark_time": 1362.0585589669645, "edp": 276.53232702083693, "throughput_penalty": 1000000.0, "objective": 1000276.5323270209, "strategy_time": 0.13298995327204466, "framework_time": 84.22983915079385, "timestamp": "2025-02-20 05:57:43.119166+00:00"},
"32,32,8,2,140": {"block_size_x": 32, "block_size_y": 32, "tile_size_x": 8, "tile_size_y": 2, "nvml_pwr_limit": 140, "sm__warps_active.avg.pct_of_peak_sustained_active": 66.03972509626915, "dram__bytes.sum.per_second": 7234.836461043571, "time": 46.26149041312082, "times": [47.74256134033203, 45.81679916381836, 46.05446243286133, 46.05241775512695, 46.05411148071289, 46.05766296386719, 46.05241775512695], "nvml_power": 145.176, "nvml_energy": 6.7160581322152275, "compile_time": 251.3410709798336, "verification_time": 0, "benchmark_time": 1447.0701380632818, "edp": 310.69485889743686, "throughput_penalty": 1000000.0, "objective": 1000310.6948588975, "strategy_time": 0.14062004629522562, "framework_time": 50.315444939769804, "timestamp": "2025-02-20 05:57:44.868057+00:00"},
"32,32,8,4,140": {"block_size_x": 32, "block_size_y": 32, "tile_size_x": 8, "tile_size_y": 4, "nvml_pwr_limit": 140, "sm__warps_active.avg.pct_of_peak_sustained_active": 66.01389491553643, "dram__bytes.sum.per_second": 143529.14239628738, "time": 46.75044141496931, "times": [47.801536560058594, 45.84880065917969, 46.42915344238281, 46.76870346069336, 46.80195236206055, 46.80207824707031, 46.800865173339844], "nvml_power": 139.587, "nvml_energy": 6.52575386579132, "compile_time": 268.051132094115, "verification_time": 0, "benchmark_time": 1466.6940569877625, "edp": 305.08187379118664, "throughput_penalty": 1000000.0, "objective": 1000305.0818737912, "strategy_time": 0.13370008673518896, "framework_time": 0.5340517964214087, "timestamp": "2025-02-20 05:57:46.603494+00:00"},
"32,32,32,8,175": {"block_size_x": 32, "block_size_y": 32, "tile_size_x": 32, "tile_size_y": 8, "nvml_pwr_limit": 175, "sm__warps_active.avg.pct_of_peak_sustained_active": 66.06849951830975, "dram__bytes.sum.per_second": 752925406.4881849, "time": 38.33883884974888, "times": [36.63273620605469, 38.40009689331055, 38.60105514526367, 38.77983856201172, 38.65216064453125, 38.65091323852539, 38.65507125854492], "nvml_power": 178.695, "nvml_energy": 6.850958808255876, "compile_time": 268.8998950179666, "verification_time": 0, "benchmark_time": 1389.0425669960678, "edp": 262.6578057159897, "throughput_penalty": 1000000.0, "objective": 1000262.657805716, "strategy_time": 0.1325600314885378, "framework_time": 56.96332501247525, "timestamp": "2025-02-20 05:57:48.318556+00:00"},
"32,32,4,4,250": {"block_size_x": 32, "block_size_y": 32, "tile_size_x": 4, "tile_size_y": 4, "nvml_pwr_limit": 250, "sm__warps_active.avg.pct_of_peak_sustained_active": 66.05028724142798, "dram__bytes.sum.per_second": 640077.1104660138, "time": 34.05360467093332, "times": [34.336769104003906, 34.04140853881836, 34.020992279052734, 33.99651336669922, 34.007774353027344, 33.99440002441406, 33.97737503051758], "nvml_power": 252.027, "nvml_energy": 8.58242782440131, "compile_time": 243.64197603426874, "verification_time": 0, "benchmark_time": 1328.9284820202738, "edp": 292.26260424898055, "throughput_penalty": 1000000.0, "objective": 1000292.262604249, "strategy_time": 0.13031007256358862, "framework_time": 56.48068385198712, "timestamp": "2025-02-20 05:57:49.947761+00:00"},
"32,32,32,32,100": {"block_size_x": 32, "block_size_y": 32, "tile_size_x": 32, "tile_size_y": 32, "nvml_pwr_limit": 100, "sm__warps_active.avg.pct_of_peak_sustained_active": 65.98188712161964, "dram__bytes.sum.per_second": 1711677229.8290741, "time": 74.4573473249163, "times": [78.753662109375, 73.79666900634766, 73.7833251953125, 73.78067016601562, 73.77808380126953, 73.78134155273438, 73.52767944335938], "nvml_power": 101.777, "nvml_energy": 7.578045438688006, "compile_time": 271.1239809868857, "verification_time": 0, "benchmark_time": 1661.309888935648, "edp": 564.2411612723906, "throughput_penalty": 1000000.0, "objective": 1000564.2411612724, "strategy_time": 0.12997107114642859, "framework_time": 48.900507972575724, "timestamp": "2025-02-20 05:57:51.929249+00:00"},
"32,32,16,32,175": {"block_size_x": 32, "block_size_y": 32, "tile_size_x": 16, "tile_size_y": 32, "nvml_pwr_limit": 175, "sm__warps_active.avg.pct_of_peak_sustained_active": 66.05369232924018, "dram__bytes.sum.per_second": 2022219484.416924, "time": 39.09199033464704, "times": [39.79779052734375, 39.1163215637207, 38.94019317626953, 39.02819061279297, 38.924991607666016, 38.91999816894531, 38.916446685791016], "nvml_power": 178.243, "nvml_energy": 6.967873633218494, "compile_time": 252.9624350136146, "verification_time": 0, "benchmark_time": 1361.8286980781704, "edp": 272.38804872281935, "throughput_penalty": 1000000.0, "objective": 1000272.3880487229, "strategy_time": 0.1316610723733902, "framework_time": 54.92162681184709, "timestamp": "2025-02-20 05:57:53.599117+00:00"},
"32,32,8,8,175": {"block_size_x": 32, "block_size_y": 32, "tile_size_x": 8, "tile_size_y": 8, "nvml_pwr_limit": 175, "sm__warps_active.avg.pct_of_peak_sustained_active": 66.04794372181276, "dram__bytes.sum.per_second": 301309271.054494, "time": 39.104535239083425, "times": [39.65907287597656, 39.45084762573242, 38.93587112426758, 38.916255950927734, 38.91993713378906, 38.92099380493164, 38.928768157958984], "nvml_power": 178.644, "nvml_energy": 6.985790593250819, "compile_time": 268.6932630604133, "verification_time": 0, "benchmark_time": 1357.180753024295, "edp": 273.17609442663417, "throughput_penalty": 1000000.0, "objective": 1000273.1760944267, "strategy_time": 0.1319199800491333, "framework_time": 0.5322518991306424, "timestamp": "2025-02-20 05:57:55.225682+00:00"},
"32,32,16,16,210": {"block_size_x": 32, "block_size_y": 32, "tile_size_x": 16, "tile_size_y": 16, "nvml_pwr_limit": 210, "sm__warps_active.avg.pct_of_peak_sustained_active": 66.06421312578608, "dram__bytes.sum.per_second": 430487351.6466724, "time": 36.29040036882673, "times": [37.15683364868164, 36.817630767822266, 36.02489471435547, 36.0120964050293, 36.01478576660156, 36.00582504272461, 36.000736236572266], "nvml_power": 212.64499999999998, "nvml_energy": 7.71697218642916, "compile_time": 270.5839980626479, "verification_time": 0, "benchmark_time": 1334.2615610454232, "edp": 280.0520102806144, "throughput_penalty": 1000000.0, "objective": 1000280.0520102807, "strategy_time": 0.2386809792369604, "framework_time": 62.642292003147304, "timestamp": "2025-02-20 05:57:56.893440+00:00"},
"32,32,8,8,250": {"block_size_x": 32, "block_size_y": 32, "tile_size_x": 8, "tile_size_y": 8, "nvml_pwr_limit": 250, "sm__warps_active.avg.pct_of_peak_sustained_active": 66.0500032866156, "dram__bytes.sum.per_second": 206991.22263129122, "time": 34.0444711957659, "times": [34.39491271972656, 34.0252799987793, 33.99919891357422, 33.99824142456055, 33.9736328125, 33.95017623901367, 33.96985626220703], "nvml_power": 250.884, "nvml_energy": 8.541213111478532, "compile_time": 248.4199800528586, "verification_time": 0, "benchmark_time": 1323.3171770116314, "edp": 290.7810837506289, "throughput_penalty": 1000000.0, "objective": 1000290.7810837507, "strategy_time": 0.13095000758767128, "framework_time": 56.430831900797784, "timestamp": "2025-02-20 05:57:58.521762+00:00"},
"32,32,2,4,140": {"block_size_x": 32, "block_size_y": 32, "tile_size_x": 2, "tile_size_y": 4, "nvml_pwr_limit": 140, "sm__warps_active.avg.pct_of_peak_sustained_active": 66.04757114000195, "dram__bytes.sum.per_second": 252140.84512342673, "time": 46.60206168038504, "times": [42.61667251586914, 47.12972640991211, 47.572479248046875, 47.35865783691406, 47.179744720458984, 47.17737579345703, 47.17977523803711], "nvml_power": 142.534, "nvml_energy": 6.642378259552001, "compile_time": 252.25765199866146, "verification_time": 0, "benchmark_time": 1481.60265898332, "edp": 309.548521356091, "throughput_penalty": 1000000.0, "objective": 1000309.5485213561, "strategy_time": 0.13110099826008081, "framework_time": 55.122997029684484, "timestamp": "2025-02-20 05:58:00.310901+00:00"},
"32,32,8,4,250": {"block_size_x": 32, "block_size_y": 32, "tile_size_x": 8, "tile_size_y": 4, "nvml_pwr_limit": 250, "sm__warps_active.avg.pct_of_peak_sustained_active": 66.05020181412058, "dram__bytes.sum.per_second": 33871.76900958947, "time": 33.98813738141741, "times": [33.982208251953125, 34.0120964050293, 34.001312255859375, 33.9725456237793, 33.97897720336914, 33.97769546508789, 33.99212646484375], "nvml_power": 251.309, "nvml_energy": 8.541524817186628, "compile_time": 252.23167100921273, "verification_time": 0, "benchmark_time": 1330.0622249953449, "edp": 290.31051893332534, "throughput_penalty": 1000000.0, "objective": 1000290.3105189333, "strategy_time": 0.1309600193053484, "framework_time": 54.62680698838085, "timestamp": "2025-02-20 05:58:01.947977+00:00"},
"32,32,4,4,140": {"block_size_x": 32, "block_size_y": 32, "tile_size_x": 4, "tile_size_y": 4, "nvml_pwr_limit": 140, "sm__warps_active.avg.pct_of_peak_sustained_active": 66.04220910645769, "dram__bytes.sum.per_second": 0.0, "time": 48.616905212402344, "times": [51.2512321472168, 48.60038375854492, 48.3721923828125, 48.18703842163086, 47.96819305419922, 47.967647552490234, 47.971649169921875], "nvml_power": 141.659, "nvml_energy": 6.887022175483703, "compile_time": 253.42924403958023, "verification_time": 0, "benchmark_time": 1449.6961779659614, "edp": 334.82570430120415, "throughput_penalty": 1000000.0, "objective": 1000334.8257043012, "strategy_time": 0.13275002129375935, "framework_time": 63.8622558908537, "timestamp": "2025-02-20 05:58:03.715122+00:00"},
"32,32,8,8,100": {"block_size_x": 32, "block_size_y": 32, "tile_size_x": 8, "tile_size_y": 8, "nvml_pwr_limit": 100, "sm__warps_active.avg.pct_of_peak_sustained_active": 65.9768992050906, "dram__bytes.sum.per_second": 14768.158373730399, "time": 74.41811261858258, "times": [78.40473937988281, 73.76729583740234, 73.75484466552734, 73.75702667236328, 73.74960327148438, 73.7481918334961, 73.74508666992188], "nvml_power": 101.963, "nvml_energy": 7.587894016928535, "compile_time": 254.7400980256498, "verification_time": 0, "benchmark_time": 1671.680174069479, "edp": 564.6767514896567, "throughput_penalty": 1000000.0, "objective": 1000564.6767514896, "strategy_time": 0.13268098700791597, "framework_time": 51.199375884607434, "timestamp": "2025-02-20 05:58:05.692899+00:00"},
"32,32,16,4,175": {"block_size_x": 32, "block_size_y": 32, "tile_size_x": 16, "tile_size_y": 4, "nvml_pwr_limit": 175, "sm__warps_active.avg.pct_of_peak_sustained_active": 66.05260617409868, "dram__bytes.sum.per_second": 56491.85575746163, "time": 39.12877219063895, "times": [39.58448028564453, 38.775550842285156, 38.87539291381836, 39.15631866455078, 39.16851043701172, 39.17232131958008, 39.16883087158203], "nvml_power": 181.11, "nvml_energy": 7.086611931446621, "compile_time": 278.8899519946426, "verification_time": 0, "benchmark_time": 1367.8003650857136, "edp": 277.2904238690387, "throughput_penalty": 1000000.0, "objective": 1000277.290423869, "strategy_time": 2.1839969558641315, "framework_time": 49.56944996956736, "timestamp": "2025-02-20 05:58:07.391367+00:00"},
"32,32,8,32,210": {"block_size_x": 32, "block_size_y": 32, "tile_size_x": 8, "tile_size_y": 32, "nvml_pwr_limit": 210, "sm__warps_active.avg.pct_of_peak_sustained_active": 66.04955849933138, "dram__bytes.sum.per_second": 765553.1121235093, "time": 36.36547688075474, "times": [36.755489349365234, 36.34239959716797, 36.34419250488281, 36.32160186767578, 36.29267120361328, 36.252384185791016, 36.24959945678711], "nvml_power": 214.253, "nvml_energy": 7.791412518132345, "compile_time": 241.30141106434166, "verification_time": 0, "benchmark_time": 1360.9196320176125, "edp": 283.33843179656486, "throughput_penalty": 1000000.0, "objective": 1000283.3384317965, "strategy_time": 40.98969395272434, "framework_time": 0, "timestamp": "2025-02-20 05:58:44.592568+00:00"},
"32,32,32,8,100": {"block_size_x": 32, "block_size_y": 32, "tile_size_x": 32, "tile_size_y": 8, "nvml_pwr_limit": 100, "sm__warps_active.avg.pct_of_peak_sustained_active": 65.97793306317227, "dram__bytes.sum.per_second": 1082468958.0607815, "time": 74.34312220982143, "times": [77.9234848022461, 73.76038360595703, 73.74697875976562, 73.74358367919922, 73.74406433105469, 73.74230194091797, 73.74105834960938], "nvml_power": 101.954, "nvml_energy": 7.579578681780134, "compile_time": 251.04298000223935, "verification_time": 0, "benchmark_time": 1661.3316599978134, "edp": 563.4895442385377, "throughput_penalty": 1000000.0, "objective": 1000563.4895442385, "strategy_time": 0.13357109855860472, "framework_time": 49.378607887774706, "timestamp": "2025-02-20 05:58:46.554485+00:00"},
"32,32,2,4,100": {"block_size_x": 32, "block_size_y": 32, "tile_size_x": 2, "tile_size_y": 4, "nvml_pwr_limit": 100, "sm__warps_active.avg.pct_of_peak_sustained_active": 65.98309005343435, "dram__bytes.sum.per_second": 1126054.6178822555, "time": 76.71946498325893, "times": [83.21903991699219, 75.89199829101562, 75.68707275390625, 75.44290924072266, 75.6849594116211, 75.42797088623047, 75.68230438232422], "nvml_power": 100.412, "nvml_energy": 7.703554917898996, "compile_time": 250.93288999050856, "verification_time": 0, "benchmark_time": 1708.6166510125622, "edp": 591.0126117703642, "throughput_penalty": 1000000.0, "objective": 1000591.0126117704, "strategy_time": 0.1319199800491333, "framework_time": 0.5779719213023782, "timestamp": "2025-02-20 05:58:48.514772+00:00"},
"32,32,16,16,175": {"block_size_x": 32, "block_size_y": 32, "tile_size_x": 16, "tile_size_y": 16, "nvml_pwr_limit": 175, "sm__warps_active.avg.pct_of_peak_sustained_active": 66.06129175800675, "dram__bytes.sum.per_second": 477149103.218072, "time": 39.49332046508789, "times": [40.85798263549805, 39.4345588684082, 39.18889617919922, 39.306270599365234, 39.16835021972656, 39.31654357910156, 39.180641174316406], "nvml_power": 179.226, "nvml_energy": 7.078229853675842, "compile_time": 250.96308893989772, "verification_time": 0, "benchmark_time": 1372.9068539105356, "edp": 279.5427999367722, "throughput_penalty": 1000000.0, "objective": 1000279.5427999367, "strategy_time": 0.13377005234360695, "framework_time": 56.519872043281794, "timestamp": "2025-02-20 05:58:50.195321+00:00"},
"32,32,16,16,250": {"block_size_x": 32, "block_size_y": 32, "tile_size_x": 16, "tile_size_y": 16, "nvml_pwr_limit": 250, "sm__warps_active.avg.pct_of_peak_sustained_active": 66.05322304885595, "dram__bytes.sum.per_second": 991928.7923361242, "time": 34.26671545846121, "times": [34.919681549072266, 34.526206970214844, 34.089439392089844, 34.079647064208984, 34.079551696777344, 34.09177780151367, 34.08070373535156], "nvml_power": 248.8745, "nvml_energy": 8.528111676366807, "compile_time": 250.01334690023214, "verification_time": 0, "benchmark_time": 1335.946580977179, "edp": 292.230376212042, "throughput_penalty": 1000000.0, "objective": 1000292.230376212, "strategy_time": 0.13755098916590214, "framework_time": 51.21796322055161, "timestamp": "2025-02-20 05:58:51.832663+00:00"},
"32,32,16,2,175": {"block_size_x": 32, "block_size_y": 32, "tile_size_x": 16, "tile_size_y": 2, "nvml_pwr_limit": 175, "sm__warps_active.avg.pct_of_peak_sustained_active": 66.05348696714482, "dram__bytes.sum.per_second": 15085.046664649042, "time": 39.44173649379185, "times": [39.90070343017578, 39.44620895385742, 39.29804611206055, 39.44172668457031, 39.39936065673828, 39.40147018432617, 39.20463943481445], "nvml_power": 177.282, "nvml_energy": 6.992309929092408, "compile_time": 248.66858101449907, "verification_time": 0, "benchmark_time": 1375.0424969475716, "edp": 275.78884570618715, "throughput_penalty": 1000000.0, "objective": 1000275.7888457061, "strategy_time": 0.13352103997021914, "framework_time": 52.02977708540857, "timestamp": "2025-02-20 05:58:53.508560+00:00"},
"32,32,4,8,140": {"block_size_x": 32, "block_size_y": 32, "tile_size_x": 4, "tile_size_y": 8, "nvml_pwr_limit": 140, "sm__warps_active.avg.pct_of_peak_sustained_active": 66.04609246064479, "dram__bytes.sum.per_second": 165611.3543144518, "time": 49.06375776018415, "times": [51.530174255371094, 49.46847915649414, 48.91532897949219, 48.427040100097656, 48.37363052368164, 48.36524963378906, 48.36640167236328], "nvml_power": 139.775, "nvml_energy": 6.85788674092974, "compile_time": 270.6873288843781, "verification_time": 0, "benchmark_time": 1481.737608090043, "edp": 336.47369380375557, "throughput_penalty": 1000000.0, "objective": 1000336.4736938038, "strategy_time": 0.1336099812760949, "framework_time": 49.843061016872525, "timestamp": "2025-02-20 05:58:55.310986+00:00"},
"32,32,2,16,210": {"block_size_x": 32, "block_size_y": 32, "tile_size_x": 2, "tile_size_y": 16, "nvml_pwr_limit": 210, "sm__warps_active.avg.pct_of_peak_sustained_active": 66.04755359525163, "dram__bytes.sum.per_second": 0.0, "time": 36.519409724644255, "times": [36.931968688964844, 36.448734283447266, 36.45491027832031, 36.450111389160156, 36.45334243774414, 36.449951171875, 36.44684982299805], "nvml_power": 211.678, "nvml_energy": 7.730355611693247, "compile_time": 268.45828106161207, "verification_time": 0, "benchmark_time": 1356.3345579896122, "edp": 282.30802390062865, "throughput_penalty": 1000000.0, "objective": 1000282.3080239006, "strategy_time": 0.13983005192130804, "framework_time": 62.22724891267717, "timestamp": "2025-02-20 05:58:56.998171+00:00"},
"32,32,4,8,210": {"block_size_x": 32, "block_size_y": 32, "tile_size_x": 4, "tile_size_y": 8, "nvml_pwr_limit": 210, "sm__warps_active.avg.pct_of_peak_sustained_active": 66.04720856534794, "dram__bytes.sum.per_second": 122400.72327700119, "time": 36.82406834193638, "times": [37.350399017333984, 36.91532897949219, 36.760128021240234, 36.68531036376953, 36.69027328491211, 36.684288024902344, 36.6827507019043], "nvml_power": 213.432, "nvml_energy": 7.859434554356166, "compile_time": 252.6260829763487, "verification_time": 0, "benchmark_time": 1354.0387001121417, "edp": 289.41635515858775, "throughput_penalty": 1000000.0, "objective": 1000289.4163551586, "strategy_time": 0.13597100041806698, "framework_time": 0.5753709701821208, "timestamp": "2025-02-20 05:58:58.605571+00:00"},
"32,32,32,2,250": {"block_size_x": 32, "block_size_y": 32, "tile_size_x": 32, "tile_size_y": 2, "nvml_pwr_limit": 250, "sm__warps_active.avg.pct_of_peak_sustained_active": 66.06072459809752, "dram__bytes.sum.per_second": 140147500.91917726, "time": 34.11053248814174, "times": [34.53839874267578, 33.91926574707031, 33.99679946899414, 34.081695556640625, 34.07894515991211, 34.08028793334961, 34.07833480834961], "nvml_power": 252.604, "nvml_energy": 8.616456948634557, "compile_time": 269.70007503405213, "verification_time": 0, "benchmark_time": 1341.3096700096503, "edp": 293.91193467907374, "throughput_penalty": 1000000.0, "objective": 1000293.911934679, "strategy_time": 0.13078097254037857, "framework_time": 55.64205697737634, "timestamp": "2025-02-20 05:59:00.272377+00:00"},
"32,32,32,32,140": {"block_size_x": 32, "block_size_y": 32, "tile_size_x": 32, "tile_size_y": 32, "nvml_pwr_limit": 140, "sm__warps_active.avg.pct_of_peak_sustained_active": 66.06140531013834, "dram__bytes.sum.per_second": 2017556555.3912466, "time": 50.71452822004046, "times": [55.08329772949219, 50.950111389160156, 50.17497634887695, 49.829856872558594, 49.653343200683594, 49.65459060668945, 49.655521392822266], "nvml_power": 144.85, "nvml_energy": 7.34599941267286, "compile_time": 253.29421495553106, "verification_time": 0, "benchmark_time": 1462.8569550113752, "edp": 372.5488945183984, "throughput_penalty": 1000000.0, "objective": 1000372.5488945184, "strategy_time": 0.1324809854850173, "framework_time": 54.711724049411714, "timestamp": "2025-02-20 05:59:02.043396+00:00"},
"32,32,8,16,210": {"block_size_x": 32, "block_size_y": 32, "tile_size_x": 8, "tile_size_y": 16, "nvml_pwr_limit": 210, "sm__warps_active.avg.pct_of_peak_sustained_active": 66.06603522717975, "dram__bytes.sum.per_second": 964580850.3493189, "time": 36.82344709123884, "times": [37.127681732177734, 36.57612609863281, 36.91795349121094, 36.89654541015625, 36.901790618896484, 36.783935546875, 36.560096740722656], "nvml_power": 211.167, "nvml_energy": 7.775896851915632, "compile_time": 268.3764899848029, "verification_time": 0, "benchmark_time": 1362.3626210028306, "edp": 286.33532631344593, "throughput_penalty": 1000000.0, "objective": 1000286.3353263134, "strategy_time": 0.13172999024391174, "framework_time": 57.967455009929836, "timestamp": "2025-02-20 05:59:03.732258+00:00"},
"32,32,4,32,100": {"block_size_x": 32, "block_size_y": 32, "tile_size_x": 4, "tile_size_y": 32, "nvml_pwr_limit": 100, "sm__warps_active.avg.pct_of_peak_sustained_active": 65.94674786422252, "dram__bytes.sum.per_second": 428727651.5617215, "time": 78.77489798409599, "times": [84.7811508178711, 77.78348541259766, 77.99075317382812, 77.71830749511719, 77.7182388305664, 77.71673583984375, 77.71561431884766], "nvml_power": 101.262, "nvml_energy": 7.976903719665527, "compile_time": 262.2527020284906, "verification_time": 0, "benchmark_time": 1674.7017320012674, "edp": 628.3797767456077, "throughput_penalty": 1000000.0, "objective": 1000628.3797767456, "strategy_time": 0.05546095781028271, "framework_time": 50.62779097352177, "timestamp": "2025-02-20 05:59:05.720386+00:00"},
"32,32,16,2,100": {"block_size_x": 32, "block_size_y": 32, "tile_size_x": 16, "tile_size_y": 2, "nvml_pwr_limit": 100, "sm__warps_active.avg.pct_of_peak_sustained_active": 65.95437801342236, "dram__bytes.sum.per_second": 155699154.1207458, "time": 77.33962140764508, "times": [81.27958679199219, 76.6923828125, 76.68473815917969, 76.67993927001953, 76.68051147460938, 76.68156433105469, 76.67862701416016], "nvml_power": 101.918, "nvml_energy": 7.882299534624372, "compile_time": 247.5319269578904, "verification_time": 0, "benchmark_time": 1643.3987240307033, "edp": 609.614061829506, "throughput_penalty": 1000000.0, "objective": 1000609.6140618295, "strategy_time": 0.1310599036514759, "framework_time": 0.5280921468511224, "timestamp": "2025-02-20 05:59:07.612000+00:00"},
"32,32,2,16,140": {"block_size_x": 32, "block_size_y": 32, "tile_size_x": 2, "tile_size_y": 16, "nvml_pwr_limit": 140, "sm__warps_active.avg.pct_of_peak_sustained_active": 66.03923728847441, "dram__bytes.sum.per_second": 30389405.049428113, "time": 50.30420521327427, "times": [51.82124710083008, 50.06060791015625, 50.054622650146484, 50.04787063598633, 50.04947280883789, 50.04966354370117, 50.04595184326172], "nvml_power": 141.562, "nvml_energy": 7.121163898401533, "compile_time": 251.21466792188585, "verification_time": 0, "benchmark_time": 1451.5512749785557, "edp": 358.22449010255093, "throughput_penalty": 1000000.0, "objective": 1000358.2244901025, "strategy_time": 0.05661998875439167, "framework_time": 50.44197116512805, "timestamp": "2025-02-20 05:59:09.365737+00:00"},
"32,32,8,2,250": {"block_size_x": 32, "block_size_y": 32, "tile_size_x": 8, "tile_size_y": 2, "nvml_pwr_limit": 250, "sm__warps_active.avg.pct_of_peak_sustained_active": 66.05180118896189, "dram__bytes.sum.per_second": 67665.3572166983, "time": 34.499698638916016, "times": [35.052513122558594, 34.768959045410156, 34.486656188964844, 34.29814529418945, 34.29359817504883, 34.301856994628906, 34.29616165161133], "nvml_power": 255.717, "nvml_energy": 8.822159436847686, "compile_time": 253.41191294137388, "verification_time": 0, "benchmark_time": 1321.6744019882753, "edp": 304.3618419157142, "throughput_penalty": 1000000.0, "objective": 1000304.3618419158, "strategy_time": 0.055579934269189835, "framework_time": 53.90447413083166, "timestamp": "2025-02-20 05:59:10.995256+00:00"},
"32,32,2,2,100": {"block_size_x": 32, "block_size_y": 32, "tile_size_x": 2, "tile_size_y": 2, "nvml_pwr_limit": 100, "sm__warps_active.avg.pct_of_peak_sustained_active": 65.94530488775574, "dram__bytes.sum.per_second": 35151.737205612655, "time": 79.37293243408203, "times": [82.83984375, 78.8071060180664, 78.79798126220703, 78.79347229003906, 78.79106903076172, 78.79033660888672, 78.79071807861328], "nvml_power": 101.79, "nvml_energy": 8.07937079246521, "compile_time": 253.41775303240865, "verification_time": 0, "benchmark_time": 1686.6502709453925, "edp": 641.283352020237, "throughput_penalty": 1000000.0, "objective": 1000641.2833520202, "strategy_time": 0.13114104513078928, "framework_time": 56.062608025968075, "timestamp": "2025-02-20 05:59:12.991542+00:00"},
"32,32,32,32,210": {"block_size_x": 32, "block_size_y": 32, "tile_size_x": 32, "tile_size_y": 32, "nvml_pwr_limit": 210, "sm__warps_active.avg.pct_of_peak_sustained_active": 66.06533961128882, "dram__bytes.sum.per_second": 2728955084.0919757, "time": 36.87396076747349, "times": [37.111839294433594, 36.93379211425781, 36.813663482666016, 36.7305908203125, 36.716766357421875, 36.90188980102539, 36.909183502197266], "nvml_power": 210.862, "nvml_energy": 7.775317115350995, "compile_time": 248.92903002910316, "verification_time": 0, "benchmark_time": 1361.866459948942, "edp": 286.7067382661177, "throughput_penalty": 1000000.0, "objective": 1000286.7067382662, "strategy_time": 2.2928270045667887, "framework_time": 40.73488211724907, "timestamp": "2025-02-20 05:59:14.645389+00:00"},
"32,32,32,16,210": {"block_size_x": 32, "block_size_y": 32, "tile_size_x": 32, "tile_size_y": 16, "nvml_pwr_limit": 210, "sm__warps_active.avg.pct_of_peak_sustained_active": 66.08560890421123, "dram__bytes.sum.per_second": 1542696039.498191, "time": 36.836524963378906, "times": [37.39478302001953, 37.00796890258789, 36.730751037597656, 36.67670440673828, 36.67897415161133, 36.678558349609375, 36.68793487548828], "nvml_power": 211.233, "nvml_energy": 7.781089677589417, "compile_time": 247.85533698741347, "verification_time": 0, "benchmark_time": 1355.7055910350755, "edp": 286.6283041508125, "throughput_penalty": 1000000.0, "objective": 1000286.6283041508, "strategy_time": 0.28491101693362, "framework_time": 0.4988509463146329, "timestamp": "2025-02-20 05:59:16.249757+00:00"},
"32,32,32,32,250": {"block_size_x": 32, "block_size_y": 32, "tile_size_x": 32, "tile_size_y": 32, "nvml_pwr_limit": 250, "sm__warps_active.avg.pct_of_peak_sustained_active": 66.06226063024091, "dram__bytes.sum.per_second": 2688579543.687023, "time": 34.61518096923828, "times": [35.07603073120117, 34.40697479248047, 34.49542236328125, 34.577919006347656, 34.57680130004883, 34.56681442260742, 34.60630416870117], "nvml_power": 251.344, "nvml_energy": 8.700318045532226, "compile_time": 251.43738696351647, "verification_time": 0, "benchmark_time": 1321.8221480492502, "edp": 301.1630836360275, "throughput_penalty": 1000000.0, "objective": 1000301.1630836361, "strategy_time": 0.15980098396539688, "framework_time": 51.610394031740725, "timestamp": "2025-02-20 05:59:17.874812+00:00"},
"32,32,16,8,175": {"block_size_x": 32, "block_size_y": 32, "tile_size_x": 16, "tile_size_y": 8, "nvml_pwr_limit": 175, "sm__warps_active.avg.pct_of_peak_sustained_active": 66.05226360594148, "dram__bytes.sum.per_second": 570341595.3756382, "time": 39.949842180524556, "times": [40.23923110961914, 39.5530891418457, 40.01737594604492, 40.00166320800781, 40.00028610229492, 39.98390579223633, 39.85334396362305], "nvml_power": 174.394, "nvml_energy": 6.967012777230399, "compile_time": 259.13484999909997, "verification_time": 0, "benchmark_time": 1391.8261569924653, "edp": 278.3310609200525, "throughput_penalty": 1000000.0, "objective": 1000278.33106092, "strategy_time": 0.19170099403709173, "framework_time": 45.63611699268222, "timestamp": "2025-02-20 05:59:19.573748+00:00"},
"32,32,8,4,175": {"block_size_x": 32, "block_size_y": 32, "tile_size_x": 8, "tile_size_y": 4, "nvml_pwr_limit": 175, "sm__warps_active.avg.pct_of_peak_sustained_active": 66.03962857462365, "dram__bytes.sum.per_second": 789873.0342215197, "time": 39.99074717930385, "times": [39.88963317871094, 39.98659133911133, 40.01494216918945, 40.06105422973633, 39.93443298339844, 39.94300842285156, 40.105567932128906], "nvml_power": 176.951, "nvml_energy": 7.0764027041249955, "compile_time": 242.72729898802936, "verification_time": 0, "benchmark_time": 1391.2245430983603, "edp": 282.9906314796048, "throughput_penalty": 1000000.0, "objective": 1000282.9906314797, "strategy_time": 0.16083999071270227, "framework_time": 0.5660339957103133, "timestamp": "2025-02-20 05:59:21.208451+00:00"},
"32,32,32,4,175": {"block_size_x": 32, "block_size_y": 32, "tile_size_x": 32, "tile_size_y": 4, "nvml_pwr_limit": 175, "sm__warps_active.avg.pct_of_peak_sustained_active": 66.06306624410695, "dram__bytes.sum.per_second": 104042271.38491204, "time": 39.77932793753488, "times": [40.05302429199219, 39.48188781738281, 39.71196746826172, 39.70140838623047, 39.97020721435547, 39.751583099365234, 39.78521728515625], "nvml_power": 175.098, "nvml_energy": 6.965280763206483, "compile_time": 274.3633840000257, "verification_time": 0, "benchmark_time": 1385.4851949727163, "edp": 277.0741876565939, "throughput_penalty": 1000000.0, "objective": 1000277.0741876566, "strategy_time": 1.803855993784964, "framework_time": 0.5386420525610447, "timestamp": "2025-02-20 05:59:22.870667+00:00"},
"32,32,32,2,175": {"block_size_x": 32, "block_size_y": 32, "tile_size_x": 32, "tile_size_y": 2, "nvml_pwr_limit": 175, "sm__warps_active.avg.pct_of_peak_sustained_active": 66.05844182370909, "dram__bytes.sum.per_second": 179073.908092182, "time": 40.08778054373605, "times": [41.08118438720703, 40.41206359863281, 39.712608337402344, 39.830177307128906, 39.872222900390625, 39.84636688232422, 39.859840393066406], "nvml_power": 177.051, "nvml_energy": 7.097581633049011, "compile_time": 232.00925788842142, "verification_time": 0, "benchmark_time": 1347.9427309939638, "edp": 284.5262948969205, "throughput_penalty": 1000000.0, "objective": 1000284.526294897, "strategy_time": 0.2907109446823597, "framework_time": 0.5547711625695229, "timestamp": "2025-02-20 05:59:24.451489+00:00"},
"32,32,4,8,175": {"block_size_x": 32, "block_size_y": 32, "tile_size_x": 4, "tile_size_y": 8, "nvml_pwr_limit": 175, "sm__warps_active.avg.pct_of_peak_sustained_active": 66.04844393571668, "dram__bytes.sum.per_second": 155547.3461122885, "time": 40.41050011771066, "times": [40.95420837402344, 40.57807922363281, 40.27119827270508, 40.26704025268555, 40.26995086669922, 40.26643371582031, 40.2665901184082], "nvml_power": 176.708, "nvml_energy": 7.140858654800415, "compile_time": 237.5003939960152, "verification_time": 0, "benchmark_time": 1360.4184070136398, "edp": 288.5656695103674, "throughput_penalty": 1000000.0, "objective": 1000288.5656695104, "strategy_time": 0.16139005310833454, "framework_time": 0.5232119001448154, "timestamp": "2025-02-20 05:59:26.050118+00:00"},
"32,32,2,32,250": {"block_size_x": 32, "block_size_y": 32, "tile_size_x": 2, "tile_size_y": 32, "nvml_pwr_limit": 250, "sm__warps_active.avg.pct_of_peak_sustained_active": 66.05030583449334, "dram__bytes.sum.per_second": 1103974137.2403946, "time": 34.781156812395366, "times": [35.11225509643555, 34.53664016723633, 34.71171188354492, 34.78489685058594, 34.775169372558594, 34.779296875, 34.76812744140625], "nvml_power": 254.011, "nvml_energy": 8.83479642307336, "compile_time": 279.90866103209555, "verification_time": 0, "benchmark_time": 1325.4481710027903, "edp": 307.2844397965042, "throughput_penalty": 1000000.0, "objective": 1000307.2844397965, "strategy_time": 1.6518349293619394, "framework_time": 44.698173995129764, "timestamp": "2025-02-20 05:59:27.701848+00:00"},
"32,32,4,32,250": {"block_size_x": 32, "block_size_y": 32, "tile_size_x": 4, "tile_size_y": 32, "nvml_pwr_limit": 250, "sm__warps_active.avg.pct_of_peak_sustained_active": 66.05591738817706, "dram__bytes.sum.per_second": 47199881.15408411, "time": 34.7708990914481, "times": [34.31622314453125, 34.65641784667969, 34.89961624145508, 34.913665771484375, 34.82771301269531, 34.88889694213867, 34.893760681152344], "nvml_power": 250.511, "nvml_energy": 8.710492702297755, "compile_time": 247.92097404133528, "verification_time": 0, "benchmark_time": 1321.5241680154577, "edp": 302.8716627883903, "throughput_penalty": 1000000.0, "objective": 1000302.8716627884, "strategy_time": 0.29250094667077065, "framework_time": 0.5281929625198245, "timestamp": "2025-02-20 05:59:29.272139+00:00"},
"32,32,32,16,175": {"block_size_x": 32, "block_size_y": 32, "tile_size_x": 32, "tile_size_y": 16, "nvml_pwr_limit": 175, "sm__warps_active.avg.pct_of_peak_sustained_active": 66.09171985803575, "dram__bytes.sum.per_second": 1907344407.5845869, "time": 40.14164188929966, "times": [40.90732955932617, 40.02409744262695, 40.01603317260742, 40.01615905761719, 40.007232666015625, 40.01795196533203, 40.002689361572266], "nvml_power": 177.949, "nvml_energy": 7.1431650325589855, "compile_time": 243.41246101539582, "verification_time": 0, "benchmark_time": 1362.2694390360266, "edp": 286.7383726931504, "throughput_penalty": 1000000.0, "objective": 1000286.7383726932, "strategy_time": 0.15540095046162605, "framework_time": 51.81840492878109, "timestamp": "2025-02-20 05:59:30.929819+00:00"},
"32,32,2,2,250": {"block_size_x": 32, "block_size_y": 32, "tile_size_x": 2, "tile_size_y": 2, "nvml_pwr_limit": 250, "sm__warps_active.avg.pct_of_peak_sustained_active": 66.05031883635436, "dram__bytes.sum.per_second": 99948413.35840313, "time": 34.98818697248186, "times": [35.745086669921875, 35.0153923034668, 34.782623291015625, 34.7685432434082, 34.76844787597656, 34.920318603515625, 34.91689682006836], "nvml_power": 254.559, "nvml_energy": 8.906557887528011, "compile_time": 253.368180943653, "verification_time": 0, "benchmark_time": 1331.712736049667, "edp": 311.62431265006313, "throughput_penalty": 1000000.0, "objective": 1000311.6243126501, "strategy_time": 1.7044650157913566, "framework_time": 45.1901649357751, "timestamp": "2025-02-20 05:59:32.561818+00:00"},
"32,32,2,4,250": {"block_size_x": 32, "block_size_y": 32, "tile_size_x": 2, "tile_size_y": 4, "nvml_pwr_limit": 250, "sm__warps_active.avg.pct_of_peak_sustained_active": 66.04745859416225, "dram__bytes.sum.per_second": 47984066.63181399, "time": 34.9022216796875, "times": [35.27961730957031, 34.69472122192383, 34.762718200683594, 34.84953689575195, 34.82444763183594, 34.981727600097656, 34.92278289794922], "nvml_power": 252.164, "nvml_energy": 8.801083827636718, "compile_time": 235.20273598842323, "verification_time": 0, "benchmark_time": 1325.5899669602513, "edp": 307.1773787736893, "throughput_penalty": 1000000.0, "objective": 1000307.1773787737, "strategy_time": 0.2745609963312745, "framework_time": 0.5015610950067639, "timestamp": "2025-02-20 05:59:34.123412+00:00"},
"32,32,32,8,210": {"block_size_x": 32, "block_size_y": 32, "tile_size_x": 32, "tile_size_y": 8, "nvml_pwr_limit": 210, "sm__warps_active.avg.pct_of_peak_sustained_active": 66.06712195891217, "dram__bytes.sum.per_second": 416116070.88335514, "time": 37.349412645612446, "times": [38.39583969116211, 38.011905670166016, 36.99932861328125, 36.94838333129883, 36.913150787353516, 37.027198791503906, 37.150081634521484], "nvml_power": 214.699, "nvml_energy": 8.018881545600346, "compile_time": 241.2558530922979, "verification_time": 0, "benchmark_time": 1341.231273021549, "edp": 299.5005158029138, "throughput_penalty": 1000000.0, "objective": 1000299.5005158029, "strategy_time": 0.15711993910372257, "framework_time": 67.02414201572537, "timestamp": "2025-02-20 05:59:35.773105+00:00"},
"32,32,16,32,210": {"block_size_x": 32, "block_size_y": 32, "tile_size_x": 16, "tile_size_y": 32, "nvml_pwr_limit": 210, "sm__warps_active.avg.pct_of_peak_sustained_active": 66.04676616688401, "dram__bytes.sum.per_second": 1253113184.5767236, "time": 37.20616204398019, "times": [37.42153549194336, 37.172542572021484, 37.17839813232422, 37.17923355102539, 37.16409683227539, 37.16569519042969, 37.1616325378418], "nvml_power": 215.944, "nvml_energy": 8.034447456425259, "compile_time": 252.06307601183653, "verification_time": 0, "benchmark_time": 1337.6341799739748, "edp": 298.93095399760267, "throughput_penalty": 1000000.0, "objective": 1000298.9309539977, "strategy_time": 1.7272549448534846, "framework_time": 0.5548220360651612, "timestamp": "2025-02-20 05:59:37.365108+00:00"},
"32,32,8,2,175": {"block_size_x": 32, "block_size_y": 32, "tile_size_x": 8, "tile_size_y": 2, "nvml_pwr_limit": 175, "sm__warps_active.avg.pct_of_peak_sustained_active": 66.05084057656256, "dram__bytes.sum.per_second": 107594728.40371062, "time": 40.647652762276785, "times": [42.29945755004883, 40.90553665161133, 40.2690544128418, 40.26448059082031, 40.2630729675293, 40.262046813964844, 40.269920349121094], "nvml_power": 178.249, "nvml_energy": 7.245403457223074, "compile_time": 242.18381592072546, "verification_time": 0, "benchmark_time": 1376.042824005708, "edp": 294.50864385180324, "throughput_penalty": 1000000.0, "objective": 1000294.5086438518, "strategy_time": 1.5601450577378273, "framework_time": 50.13860110193491, "timestamp": "2025-02-20 05:59:39.035803+00:00"},
"32,32,2,8,210": {"block_size_x": 32, "block_size_y": 32, "tile_size_x": 2, "tile_size_y": 8, "nvml_pwr_limit": 210, "sm__warps_active.avg.pct_of_peak_sustained_active": 66.04601617542318, "dram__bytes.sum.per_second": 167703229.75159773, "time": 37.17807606288365, "times": [37.43948745727539, 37.02694320678711, 37.11222457885742, 37.181121826171875, 37.14252853393555, 37.162017822265625, 37.18220901489258], "nvml_power": 214.146, "nvml_energy": 7.961536276562281, "compile_time": 234.83148403465748, "verification_time": 0, "benchmark_time": 1336.1447140341625, "edp": 295.99460126744, "throughput_penalty": 1000000.0, "objective": 1000295.9946012674, "strategy_time": 0.278530060313642, "framework_time": 44.126562774181366, "timestamp": "2025-02-20 05:59:40.651209+00:00"},
"32,32,2,16,175": {"block_size_x": 32, "block_size_y": 32, "tile_size_x": 2, "tile_size_y": 16, "nvml_pwr_limit": 175, "sm__warps_active.avg.pct_of_peak_sustained_active": 66.0380793316684, "dram__bytes.sum.per_second": 158713202.7440763, "time": 41.06251852852957, "times": [43.13587188720703, 41.59987258911133, 40.54079818725586, 40.540958404541016, 40.54083251953125, 40.542144775390625, 40.53715133666992], "nvml_power": 178.981, "nvml_energy": 7.349410628754751, "compile_time": 247.78612307272851, "verification_time": 0, "benchmark_time": 1386.227592942305, "edp": 301.78531011701415, "throughput_penalty": 1000000.0, "objective": 1000301.7853101171, "strategy_time": 0.16041100025177002, "framework_time": 48.60527394339442, "timestamp": "2025-02-20 05:59:42.334013+00:00"},
"32,32,2,16,250": {"block_size_x": 32, "block_size_y": 32, "tile_size_x": 2, "tile_size_y": 16, "nvml_pwr_limit": 250, "sm__warps_active.avg.pct_of_peak_sustained_active": 66.0475204197334, "dram__bytes.sum.per_second": 281933.95415190037, "time": 35.070501055036274, "times": [35.47545623779297, 35.31568145751953, 34.956321716308594, 34.96828842163086, 34.91788864135742, 34.94121551513672, 34.91865539550781], "nvml_power": 255.453, "nvml_energy": 8.95886470601218, "compile_time": 248.79166402388364, "verification_time": 0, "benchmark_time": 1330.9589750133455, "edp": 314.1918741241274, "throughput_penalty": 1000000.0, "objective": 1000314.1918741241, "strategy_time": 1.7742960480973125, "framework_time": 43.2285099523142, "timestamp": "2025-02-20 05:59:43.958791+00:00"},
"32,32,4,16,250": {"block_size_x": 32, "block_size_y": 32, "tile_size_x": 4, "tile_size_y": 16, "nvml_pwr_limit": 250, "sm__warps_active.avg.pct_of_peak_sustained_active": 66.05110476060774, "dram__bytes.sum.per_second": 24874715.34710133, "time": 35.03877421787807, "times": [35.27356719970703, 34.861568450927734, 35.05315017700195, 34.970558166503906, 35.019039154052734, 35.11568069458008, 34.97785568237305], "nvml_power": 257.644, "nvml_energy": 9.027529944590977, "compile_time": 275.9900860255584, "verification_time": 0, "benchmark_time": 1333.9964740443975, "edp": 316.3135834736566, "throughput_penalty": 1000000.0, "objective": 1000316.3135834737, "strategy_time": 0.3026010235771537, "framework_time": 0.5235119024291635, "timestamp": "2025-02-20 05:59:45.569629+00:00"},
"32,32,4,16,210": {"block_size_x": 32, "block_size_y": 32, "tile_size_x": 4, "tile_size_y": 16, "nvml_pwr_limit": 210, "sm__warps_active.avg.pct_of_peak_sustained_active": 66.04852703571875, "dram__bytes.sum.per_second": 67251.06597609785, "time": 37.56006840297154, "times": [37.94956970214844, 37.590816497802734, 37.537567138671875, 37.40412902832031, 37.5266227722168, 37.448158264160156, 37.46361541748047], "nvml_power": 211.675, "nvml_energy": 7.9505274791990015, "compile_time": 249.33362600859255, "verification_time": 0, "benchmark_time": 1349.92903994862, "edp": 298.62235595841935, "throughput_penalty": 1000000.0, "objective": 1000298.6223559584, "strategy_time": 0.15609001275151968, "framework_time": 57.891804026439786, "timestamp": "2025-02-20 05:59:47.226963+00:00"},
"32,32,4,4,210": {"block_size_x": 32, "block_size_y": 32, "tile_size_x": 4, "tile_size_y": 4, "nvml_pwr_limit": 210, "sm__warps_active.avg.pct_of_peak_sustained_active": 66.04381822289085, "dram__bytes.sum.per_second": 213172.20454975642, "time": 37.391657148088726, "times": [37.466590881347656, 37.28169631958008, 37.270687103271484, 37.31206512451172, 37.48976135253906, 37.406654357910156, 37.51414489746094], "nvml_power": 213.441, "nvml_energy": 7.980912693345205, "compile_time": 264.6178409922868, "verification_time": 0, "benchmark_time": 1344.3542530294508, "edp": 298.4195511583933, "throughput_penalty": 1000000.0, "objective": 1000298.4195511584, "strategy_time": 1.6142049571499228, "framework_time": 0.49916200805455446, "timestamp": "2025-02-20 05:59:48.838074+00:00"},
"32,32,2,32,210": {"block_size_x": 32, "block_size_y": 32, "tile_size_x": 2, "tile_size_y": 32, "nvml_pwr_limit": 210, "sm__warps_active.avg.pct_of_peak_sustained_active": 66.04699870163941, "dram__bytes.sum.per_second": 118717731.3274765, "time": 36.96577344621931, "times": [34.03900909423828, 36.61548614501953, 37.75801467895508, 37.73222351074219, 37.71049499511719, 37.495391845703125, 37.409793853759766], "nvml_power": 213.349, "nvml_energy": 7.886610798977443, "compile_time": 240.9573009936139, "verification_time": 0, "benchmark_time": 1377.879771986045, "edp": 291.53466805350683, "throughput_penalty": 1000000.0, "objective": 1000291.5346680535, "strategy_time": 0.2727400278672576, "framework_time": 0.5204620538279414, "timestamp": "2025-02-20 05:59:50.457729+00:00"},
"32,32,8,8,210": {"block_size_x": 32, "block_size_y": 32, "tile_size_x": 8, "tile_size_y": 8, "nvml_pwr_limit": 210, "sm__warps_active.avg.pct_of_peak_sustained_active": 66.04905750879989, "dram__bytes.sum.per_second": 24517680.76899072, "time": 37.51641246250698, "times": [37.91721725463867, 37.654945373535156, 37.44902420043945, 37.397857666015625, 37.39926528930664, 37.39484786987305, 37.401729583740234], "nvml_power": 214.707, "nvml_energy": 8.055036370587485, "compile_time": 263.03801708854735, "verification_time": 0, "benchmark_time": 1344.7110409615561, "edp": 302.1960668794553, "throughput_penalty": 1000000.0, "objective": 1000302.1960668794, "strategy_time": 1.546755083836615, "framework_time": 0.3224508836865425, "timestamp": "2025-02-20 05:59:52.067835+00:00"},
"32,32,8,16,175": {"block_size_x": 32, "block_size_y": 32, "tile_size_x": 8, "tile_size_y": 16, "nvml_pwr_limit": 175, "sm__warps_active.avg.pct_of_peak_sustained_active": 66.05037084212466, "dram__bytes.sum.per_second": 37228045.67754875, "time": 40.989952087402344, "times": [42.61180877685547, 41.49068832397461, 40.57148742675781, 40.57120132446289, 40.55936050415039, 40.569759368896484, 40.55535888671875], "nvml_power": 177.3745, "nvml_energy": 7.270572256526948, "compile_time": 238.14148094970733, "verification_time": 0, "benchmark_time": 1381.307779927738, "edp": 298.02040844303633, "throughput_penalty": 1000000.0, "objective": 1000298.0204084431, "strategy_time": 0.26260106824338436, "framework_time": 45.27378501370549, "timestamp": "2025-02-20 05:59:53.732844+00:00"},
"32,32,4,32,210": {"block_size_x": 32, "block_size_y": 32, "tile_size_x": 4, "tile_size_y": 32, "nvml_pwr_limit": 210, "sm__warps_active.avg.pct_of_peak_sustained_active": 66.05005441085878, "dram__bytes.sum.per_second": 18198031.109556686, "time": 37.39855521065848, "times": [37.818206787109375, 37.297119140625, 37.27417755126953, 37.28121566772461, 37.2874870300293, 37.42985534667969, 37.401824951171875], "nvml_power": 214.383, "nvml_energy": 8.017614461726597, "compile_time": 243.32290701568127, "verification_time": 0, "benchmark_time": 1349.4569329777732, "edp": 299.847197104656, "throughput_penalty": 1000000.0, "objective": 1000299.8471971047, "strategy_time": 0.1628299942240119, "framework_time": 46.768160071223974, "timestamp": "2025-02-20 05:59:55.372579+00:00"},
"32,32,8,32,250": {"block_size_x": 32, "block_size_y": 32, "tile_size_x": 8, "tile_size_y": 32, "nvml_pwr_limit": 250, "sm__warps_active.avg.pct_of_peak_sustained_active": 66.05029501776251, "dram__bytes.sum.per_second": 29820922.20412406, "time": 34.95063727242606, "times": [35.356544494628906, 34.76015853881836, 34.795230865478516, 34.970558166503906, 34.93404769897461, 34.91244888305664, 34.925472259521484], "nvml_power": 257.181, "nvml_energy": 8.988639844359806, "compile_time": 267.1467289328575, "verification_time": 0, "benchmark_time": 1341.5951780043542, "edp": 314.1586907726958, "throughput_penalty": 1000000.0, "objective": 1000314.1586907727, "strategy_time": 1.6160550294443965, "framework_time": 51.2388430070132, "timestamp": "2025-02-20 05:59:57.034200+00:00"},
"32,32,32,2,210": {"block_size_x": 32, "block_size_y": 32, "tile_size_x": 32, "tile_size_y": 2, "nvml_pwr_limit": 210, "sm__warps_active.avg.pct_of_peak_sustained_active": 66.06361021213284, "dram__bytes.sum.per_second": 911296322.0517281, "time": 37.39839553833008, "times": [38.03587341308594, 37.752864837646484, 37.26639938354492, 37.223297119140625, 37.15727996826172, 37.21033477783203, 37.14271926879883], "nvml_power": 216.135, "nvml_energy": 8.08310221967697, "compile_time": 237.13221796788275, "verification_time": 0, "benchmark_time": 1342.3880300251767, "edp": 302.2950539882332, "throughput_penalty": 1000000.0, "objective": 1000302.2950539882, "strategy_time": 0.27407100424170494, "framework_time": 53.678389987908304, "timestamp": "2025-02-20 05:59:58.667697+00:00"},
"32,32,4,4,175": {"block_size_x": 32, "block_size_y": 32, "tile_size_x": 4, "tile_size_y": 4, "nvml_pwr_limit": 175, "sm__warps_active.avg.pct_of_peak_sustained_active": 66.03997721639831, "dram__bytes.sum.per_second": 83956658.8905559, "time": 40.26392255510603, "times": [37.854209899902344, 40.696895599365234, 40.55503845214844, 40.684513092041016, 40.68550491333008, 40.68044662475586, 40.69084930419922], "nvml_power": 179.389, "nvml_energy": 7.222904803237916, "compile_time": 244.29119902197272, "verification_time": 0, "benchmark_time": 1375.9279979858547, "edp": 290.8224796204748, "throughput_penalty": 1000000.0, "objective": 1000290.8224796205, "strategy_time": 0.15896011609584093, "framework_time": 47.37523291260004, "timestamp": "2025-02-20 06:00:00.335474+00:00"},
"32,32,32,16,250": {"block_size_x": 32, "block_size_y": 32, "tile_size_x": 32, "tile_size_y": 16, "nvml_pwr_limit": 250, "sm__warps_active.avg.pct_of_peak_sustained_active": 66.08323610268275, "dram__bytes.sum.per_second": 1062061883.2039632, "time": 34.831365312848774, "times": [34.24528121948242, 34.92540740966797, 34.92758560180664, 34.920833587646484, 34.92060852050781, 34.93395233154297, 34.94588851928711], "nvml_power": 255.976, "nvml_energy": 8.91599356732178, "compile_time": 258.0105100059882, "verification_time": 0, "benchmark_time": 1341.5714339353144, "edp": 310.55622907039464, "throughput_penalty": 1000000.0, "objective": 1000310.5562290704, "strategy_time": 1.6391740646213293, "framework_time": 45.13161606155336, "timestamp": "2025-02-20 06:00:01.981851+00:00"},
"32,32,32,8,250": {"block_size_x": 32, "block_size_y": 32, "tile_size_x": 32, "tile_size_y": 8, "nvml_pwr_limit": 250, "sm__warps_active.avg.pct_of_peak_sustained_active": 66.06582072596338, "dram__bytes.sum.per_second": 592427900.8383449, "time": 34.857801709856304, "times": [34.17494583129883, 34.43996810913086, 34.99932861328125, 35.08256149291992, 35.11052703857422, 35.12364959716797, 35.073631286621094], "nvml_power": 253.36200000000002, "nvml_energy": 8.831642356812614, "compile_time": 247.44781793560833, "verification_time": 0, "benchmark_time": 1332.3138060513884, "edp": 307.85163804614206, "throughput_penalty": 1000000.0, "objective": 1000307.8516380461, "strategy_time": 0.2902509877458215, "framework_time": 0.5226420471444726, "timestamp": "2025-02-20 06:00:03.562450+00:00"},
"32,32,2,4,210": {"block_size_x": 32, "block_size_y": 32, "tile_size_x": 2, "tile_size_y": 4, "nvml_pwr_limit": 210, "sm__warps_active.avg.pct_of_peak_sustained_active": 66.04635411292077, "dram__bytes.sum.per_second": 2098079.6015147385, "time": 37.77554212297712, "times": [38.203582763671875, 37.743038177490234, 37.72844696044922, 37.735679626464844, 37.733760833740234, 37.63679885864258, 37.64748764038086], "nvml_power": 213.532, "nvml_energy": 8.066287060603551, "compile_time": 250.34588703420013, "verification_time": 0, "benchmark_time": 1356.0434159589931, "edp": 304.7083666338548, "throughput_penalty": 1000000.0, "objective": 1000304.7083666339, "strategy_time": 0.1521310769021511, "framework_time": 46.94444895721972, "timestamp": "2025-02-20 06:00:05.215960+00:00"},
"32,32,16,4,250": {"block_size_x": 32, "block_size_y": 32, "tile_size_x": 16, "tile_size_y": 4, "nvml_pwr_limit": 250, "sm__warps_active.avg.pct_of_peak_sustained_active": 66.04999346057492, "dram__bytes.sum.per_second": 52484.77941396995, "time": 34.996498107910156, "times": [34.23961639404297, 35.021278381347656, 35.08870315551758, 35.123809814453125, 35.0819206237793, 35.21731185913086, 35.20284652709961], "nvml_power": 253.053, "nvml_energy": 8.855968835700988, "compile_time": 271.30614896304905, "verification_time": 0, "benchmark_time": 1342.9405250353739, "edp": 309.92789660232097, "throughput_penalty": 1000000.0, "objective": 1000309.9278966023, "strategy_time": 1.6399850137531757, "framework_time": 46.642848988994956, "timestamp": "2025-02-20 06:00:06.878515+00:00"},
"32,32,2,2,140": {"block_size_x": 32, "block_size_y": 32, "tile_size_x": 2, "tile_size_y": 2, "nvml_pwr_limit": 140, "sm__warps_active.avg.pct_of_peak_sustained_active": 66.03428515363274, "dram__bytes.sum.per_second": 3565.2498660803017, "time": 53.61324855259487, "times": [56.2242546081543, 54.23155212402344, 53.52659225463867, 52.92348861694336, 52.796417236328125, 52.794273376464844, 52.79616165161133], "nvml_power": 141.333, "nvml_energy": 7.577321257683891, "compile_time": 234.33669900987297, "verification_time": 0, "benchmark_time": 1494.0931249875575, "edp": 406.2448079510672, "throughput_penalty": 1000000.0, "objective": 1000406.244807951, "strategy_time": 0.2754509914666414, "framework_time": 55.27588399127126, "timestamp": "2025-02-20 06:00:08.662520+00:00"},
"32,32,16,8,210": {"block_size_x": 32, "block_size_y": 32, "tile_size_x": 16, "tile_size_y": 8, "nvml_pwr_limit": 210, "sm__warps_active.avg.pct_of_peak_sustained_active": 66.0504662522585, "dram__bytes.sum.per_second": 3750.269550623951, "time": 37.02333232334682, "times": [34.4769287109375, 37.51219177246094, 37.41059112548828, 37.45017623901367, 37.49728012084961, 37.39759826660156, 37.41856002807617], "nvml_power": 213.474, "nvml_energy": 7.903518844394139, "compile_time": 250.73730701114982, "verification_time": 0, "benchmark_time": 1385.2669189218432, "edp": 292.61460469983825, "throughput_penalty": 1000000.0, "objective": 1000292.6146046999, "strategy_time": 0.16809103544801474, "framework_time": 47.02916007954627, "timestamp": "2025-02-20 06:00:10.345746+00:00"},
"32,32,2,2,175": {"block_size_x": 32, "block_size_y": 32, "tile_size_x": 2, "tile_size_y": 2, "nvml_pwr_limit": 175, "sm__warps_active.avg.pct_of_peak_sustained_active": 66.0464763052232, "dram__bytes.sum.per_second": 0.0, "time": 39.76256397792271, "times": [34.2770881652832, 39.70771026611328, 41.012542724609375, 40.83292770385742, 40.84028625488281, 40.83232116699219, 40.8350715637207], "nvml_power": 178.341, "nvml_energy": 7.091295422386714, "compile_time": 245.53679197560996, "verification_time": 0, "benchmark_time": 1429.779220954515, "edp": 281.96808791900213, "throughput_penalty": 1000000.0, "objective": 1000281.968087919, "strategy_time": 0.12700993102043867, "framework_time": 42.197056114673615, "timestamp": "2025-02-20 06:00:12.065306+00:00"},
"32,32,32,32,175": {"block_size_x": 32, "block_size_y": 32, "tile_size_x": 32, "tile_size_y": 32, "nvml_pwr_limit": 175, "sm__warps_active.avg.pct_of_peak_sustained_active": 66.04973153844772, "dram__bytes.sum.per_second": 2003349199.9975045, "time": 40.8540164402553, "times": [40.90604782104492, 40.749568939208984, 40.839263916015625, 40.871585845947266, 40.871681213378906, 40.86671829223633, 40.87324905395508], "nvml_power": 178.535, "nvml_energy": 7.29387182516098, "compile_time": 244.76968904491514, "verification_time": 0, "benchmark_time": 1398.1570550240576, "edp": 297.9839594582416, "throughput_penalty": 1000000.0, "objective": 1000297.9839594582, "strategy_time": 0.15344098210334778, "framework_time": 0.5261709447950125, "timestamp": "2025-02-20 06:00:13.708935+00:00"},
"32,32,2,2,210": {"block_size_x": 32, "block_size_y": 32, "tile_size_x": 2, "tile_size_y": 2, "nvml_pwr_limit": 210, "sm__warps_active.avg.pct_of_peak_sustained_active": 66.04707787591113, "dram__bytes.sum.per_second": 128704909.42332555, "time": 37.193604060581755, "times": [34.29094314575195, 37.70003128051758, 37.72505569458008, 37.72102355957031, 37.639198303222656, 37.64064025878906, 37.638336181640625], "nvml_power": 213.33550000000002, "nvml_energy": 7.934716119066239, "compile_time": 249.59597294218838, "verification_time": 0, "benchmark_time": 1345.8742270013317, "edp": 295.12068966566557, "throughput_penalty": 1000000.0, "objective": 1000295.1206896657, "strategy_time": 1.6325849574059248, "framework_time": 47.72792314179242, "timestamp": "2025-02-20 06:00:15.353790+00:00"},
"32,32,4,2,210": {"block_size_x": 32, "block_size_y": 32, "tile_size_x": 4, "tile_size_y": 2, "nvml_pwr_limit": 210, "sm__warps_active.avg.pct_of_peak_sustained_active": 66.04472809180278, "dram__bytes.sum.per_second": 7415192.172486524, "time": 37.35943821498326, "times": [36.520320892333984, 37.54716873168945, 37.59532928466797, 37.585601806640625, 37.421695709228516, 37.42115020751953, 37.424800872802734], "nvml_power": 215.339, "nvml_energy": 8.04494406577628, "compile_time": 249.20745205599815, "verification_time": 0, "benchmark_time": 1350.4485409939662, "edp": 300.55459076836513, "throughput_penalty": 1000000.0, "objective": 1000300.5545907684, "strategy_time": 0.26569096371531487, "framework_time": 0.5228210939094424, "timestamp": "2025-02-20 06:00:16.954258+00:00"},
"32,32,4,2,175": {"block_size_x": 32, "block_size_y": 32, "tile_size_x": 4, "tile_size_y": 2, "nvml_pwr_limit": 175, "sm__warps_active.avg.pct_of_peak_sustained_active": 66.04229812469782, "dram__bytes.sum.per_second": 1026967.9961928829, "time": 41.06031962803432, "times": [42.47865676879883, 41.00505447387695, 40.83900833129883, 40.69190216064453, 40.8383674621582, 40.83555221557617, 40.73369598388672], "nvml_power": 179.394, "nvml_energy": 7.36597497935159, "compile_time": 250.85554702673107, "verification_time": 0, "benchmark_time": 1401.7546720569953, "edp": 302.4492870242798, "throughput_penalty": 1000000.0, "objective": 1000302.4492870243, "strategy_time": 0.15444098971784115, "framework_time": 52.00728389900178, "timestamp": "2025-02-20 06:00:18.659054+00:00"},
"32,32,16,8,250": {"block_size_x": 32, "block_size_y": 32, "tile_size_x": 16, "tile_size_y": 8, "nvml_pwr_limit": 250, "sm__warps_active.avg.pct_of_peak_sustained_active": 66.0591522450023, "dram__bytes.sum.per_second": 447098019.9713835, "time": 35.115962982177734, "times": [35.90092849731445, 35.219486236572266, 34.91203308105469, 34.934654235839844, 34.94953536987305, 34.969566345214844, 34.925537109375], "nvml_power": 256.868, "nvml_energy": 9.02016717930603, "compile_time": 244.57605800125748, "verification_time": 0, "benchmark_time": 1342.469935072586, "edp": 316.75185676156514, "throughput_penalty": 1000000.0, "objective": 1000316.7518567615, "strategy_time": 0.06403995212167501, "framework_time": 45.87324592284858, "timestamp": "2025-02-20 06:00:20.294281+00:00"},
"32,32,16,2,250": {"block_size_x": 32, "block_size_y": 32, "tile_size_x": 16, "tile_size_y": 2, "nvml_pwr_limit": 250, "sm__warps_active.avg.pct_of_peak_sustained_active": 66.0497995881635, "dram__bytes.sum.per_second": 37444.453493520705, "time": 35.040658133370535, "times": [35.27811050415039, 34.84947204589844, 34.97859191894531, 34.92851257324219, 35.03062438964844, 35.111328125, 35.107967376708984], "nvml_power": 256.889, "nvml_energy": 9.001559627223424, "compile_time": 241.6857989737764, "verification_time": 0, "benchmark_time": 1337.4223191058263, "edp": 315.4205735646863, "throughput_penalty": 1000000.0, "objective": 1000315.4205735647, "strategy_time": 1.707104966044426, "framework_time": 0.5311719141900539, "timestamp": "2025-02-20 06:00:21.875652+00:00"},
"32,32,2,8,100": {"block_size_x": 32, "block_size_y": 32, "tile_size_x": 2, "tile_size_y": 8, "nvml_pwr_limit": 100, "sm__warps_active.avg.pct_of_peak_sustained_active": 65.95216636296864, "dram__bytes.sum.per_second": 238181.68991203458, "time": 88.05422101702008, "times": [91.8603515625, 88.47535705566406, 87.53644561767578, 87.12764739990234, 87.1270751953125, 87.12480163574219, 87.12786865234375], "nvml_power": 101.306, "nvml_energy": 8.920420914350236, "compile_time": 238.04927803575993, "verification_time": 0, "benchmark_time": 1780.9572370024398, "edp": 785.4807147570441, "throughput_penalty": 1000000.0, "objective": 1000785.480714757, "strategy_time": 0.2723609795793891, "framework_time": 52.32452508062124, "timestamp": "2025-02-20 06:00:23.947281+00:00"},
