experiments/data/run3/bayes_opt_float64.json
{
"device_name": "NVIDIA RTX 5000 Ada Generation",
"kernel_name": "tuned_matmul<double>",
"problem_size": [
4096,
4096
],
"tune_params_keys": [
"block_size_x",
"block_size_y",
"tile_size_x",
"tile_size_y",
"nvml_pwr_limit"
],
"tune_params": {
"block_size_x": [
32,
64,
128,
256,
512,
1024
],
"block_size_y": [
32,
64,
128,
256,
512,
1024
],
"tile_size_x": [
2,
4,
8,
16,
32
],
"tile_size_y": [
2,
4,
8,
16,
32
],
"nvml_pwr_limit": [
100,
140,
175,
210,
250
]
},
"objective": "objective",
"cache": {
"32,32,16,2,250": {"block_size_x": 32, "block_size_y": 32, "tile_size_x": 16, "tile_size_y": 2, "nvml_pwr_limit": 250, "sm__warps_active.avg.pct_of_peak_sustained_active": 65.97572945356818, "dram__bytes.sum.per_second": 22365811673.295715, "time": 138.3051539829799, "times": [138.27626037597656, 138.3209991455078, 138.30458068847656, 138.3106231689453, 138.29855346679688, 138.31190490722656, 138.3131561279297], "nvml_power": 198.713, "nvml_energy": 27.483032063419884, "compile_time": 234.94912986643612, "verification_time": 0, "benchmark_time": 2243.8912158831954, "edp": 3801.044981450461, "throughput_penalty": 1000000.0, "objective": 1003801.0449814504, "strategy_time": 60.02813810482621, "framework_time": 0, "timestamp": "2025-02-20 07:39:09.229863+00:00"},
"32,32,2,16,210": {"block_size_x": 32, "block_size_y": 32, "tile_size_x": 2, "tile_size_y": 16, "nvml_pwr_limit": 210, "sm__warps_active.avg.pct_of_peak_sustained_active": 65.97592103021658, "dram__bytes.sum.per_second": 587274742.4769214, "time": 138.38634163992745, "times": [138.36679077148438, 138.3909454345703, 138.39820861816406, 138.4049530029297, 138.3724822998047, 138.3839111328125, 138.38710021972656], "nvml_power": 191.854, "nvml_energy": 26.54997318898664, "compile_time": 249.52890304848552, "verification_time": 0, "benchmark_time": 2245.0442898552865, "edp": 3674.1536602620195, "throughput_penalty": 1000000.0, "objective": 1003674.153660262, "strategy_time": 0.23579993285238743, "framework_time": 49.31394918821752, "timestamp": "2025-02-20 07:39:11.774018+00:00"},
"32,32,8,2,140": {"block_size_x": 32, "block_size_y": 32, "tile_size_x": 8, "tile_size_y": 2, "nvml_pwr_limit": 140, "sm__warps_active.avg.pct_of_peak_sustained_active": 65.97701683704476, "dram__bytes.sum.per_second": 254051439.92730644, "time": 156.71045793805803, "times": [156.64178466796875, 154.9800567626953, 154.6952667236328, 154.69798278808594, 158.03919982910156, 159.1107177734375, 158.80819702148438], "nvml_power": 138.908, "nvml_energy": 21.76833629125976, "compile_time": 257.5674639083445, "verification_time": 0, "benchmark_time": 2381.2819151207805, "edp": 3411.325948752965, "throughput_penalty": 1000000.0, "objective": 1003411.3259487529, "strategy_time": 0.13058003969490528, "framework_time": 48.997178906574845, "timestamp": "2025-02-20 07:39:14.462019+00:00"},
"32,32,8,8,210": {"block_size_x": 32, "block_size_y": 32, "tile_size_x": 8, "tile_size_y": 8, "nvml_pwr_limit": 210, "sm__warps_active.avg.pct_of_peak_sustained_active": 65.97688772968759, "dram__bytes.sum.per_second": 279664616.67024684, "time": 138.3873552594866, "times": [138.35548400878906, 138.40374755859375, 138.389892578125, 138.3948211669922, 138.3858184814453, 138.39561462402344, 138.3861083984375], "nvml_power": 187.862, "nvml_energy": 25.997725333757675, "compile_time": 267.0040570665151, "verification_time": 0, "benchmark_time": 2247.508002910763, "edp": 3597.7564517012784, "throughput_penalty": 1000000.0, "objective": 1003597.7564517013, "strategy_time": 0.1289199572056532, "framework_time": 60.81073917448521, "timestamp": "2025-02-20 07:39:17.037495+00:00"},
"32,32,4,32,210": {"block_size_x": 32, "block_size_y": 32, "tile_size_x": 4, "tile_size_y": 32, "nvml_pwr_limit": 210, "sm__warps_active.avg.pct_of_peak_sustained_active": 65.97202727720192, "dram__bytes.sum.per_second": 1237034965.5521479, "time": 138.39305114746094, "times": [138.37161254882812, 138.41506958007812, 138.38800048828125, 138.40847778320312, 138.38525390625, 138.39007568359375, 138.3928680419922], "nvml_power": 192.995, "nvml_energy": 26.709166906204228, "compile_time": 267.08253799006343, "verification_time": 0, "benchmark_time": 2246.997579932213, "edp": 3696.3631017563926, "throughput_penalty": 1000000.0, "objective": 1003696.3631017564, "strategy_time": 0.12650992721319199, "framework_time": 0.5349901039153337, "timestamp": "2025-02-20 07:39:19.552261+00:00"},
"32,32,16,16,100": {"block_size_x": 32, "block_size_y": 32, "tile_size_x": 16, "tile_size_y": 16, "nvml_pwr_limit": 100, "sm__warps_active.avg.pct_of_peak_sustained_active": 65.97705645782756, "dram__bytes.sum.per_second": 13250207638.615604, "time": 248.6637202671596, "times": [241.4661407470703, 240.25103759765625, 256.0270080566406, 260.3372497558594, 247.33847045898438, 241.5675811767578, 253.65855407714844], "nvml_power": 99.88, "nvml_energy": 24.8365323802839, "compile_time": 260.82715997472405, "verification_time": 0, "benchmark_time": 3273.7502129748464, "edp": 6175.944540217167, "throughput_penalty": 1000000.0, "objective": 1006175.9445402172, "strategy_time": 0.1279599964618683, "framework_time": 47.894550021737814, "timestamp": "2025-02-20 07:39:23.134885+00:00"},
"32,32,4,8,175": {"block_size_x": 32, "block_size_y": 32, "tile_size_x": 4, "tile_size_y": 8, "nvml_pwr_limit": 175, "sm__warps_active.avg.pct_of_peak_sustained_active": 65.97136137849135, "dram__bytes.sum.per_second": 337179901.0831757, "time": 141.7803475516183, "times": [141.5826873779297, 140.89260864257812, 140.76083374023438, 140.7568359375, 141.42813110351562, 143.58338928222656, 143.45794677734375], "nvml_power": 174.488, "nvml_energy": 24.73896928358677, "compile_time": 266.81277295574546, "verification_time": 0, "benchmark_time": 2303.949638037011, "edp": 3507.4996630957417, "throughput_penalty": 1000000.0, "objective": 1003507.4996630957, "strategy_time": 0.12883986346423626, "framework_time": 50.997970160096884, "timestamp": "2025-02-20 07:39:25.756798+00:00"},
"32,32,4,16,140": {"block_size_x": 32, "block_size_y": 32, "tile_size_x": 4, "tile_size_y": 16, "nvml_pwr_limit": 140, "sm__warps_active.avg.pct_of_peak_sustained_active": 65.97675411302878, "dram__bytes.sum.per_second": 319045203.5181018, "time": 157.10907200404577, "times": [157.4803466796875, 156.03663635253906, 155.00335693359375, 154.84991455078125, 158.13058471679688, 159.1556854248047, 159.1069793701172], "nvml_power": 139.313, "nvml_energy": 21.887336148099628, "compile_time": 264.8864740040153, "verification_time": 0, "benchmark_time": 2390.3520479798317, "edp": 3438.6990708685385, "throughput_penalty": 1000000.0, "objective": 1003438.6990708685, "strategy_time": 0.13495003804564476, "framework_time": 51.09104118309915, "timestamp": "2025-02-20 07:39:28.463286+00:00"},
"32,32,8,2,100": {"block_size_x": 32, "block_size_y": 32, "tile_size_x": 8, "tile_size_y": 2, "nvml_pwr_limit": 100, "sm__warps_active.avg.pct_of_peak_sustained_active": 65.976499152809, "dram__bytes.sum.per_second": 142103354.75574535, "time": 219.0270058768136, "times": [215.47251892089844, 212.33322143554688, 219.4600067138672, 229.90928649902344, 227.99180603027344, 214.6192626953125, 213.40293884277344], "nvml_power": 100.25, "nvml_energy": 21.95745733915056, "compile_time": 251.90118583850563, "verification_time": 0, "benchmark_time": 2901.4522610232234, "edp": 4809.276137662014, "throughput_penalty": 1000000.0, "objective": 1004809.276137662, "strategy_time": 0.13018003664910793, "framework_time": 48.85894013568759, "timestamp": "2025-02-20 07:39:31.665652+00:00"},
"32,32,8,8,175": {"block_size_x": 32, "block_size_y": 32, "tile_size_x": 8, "tile_size_y": 8, "nvml_pwr_limit": 175, "sm__warps_active.avg.pct_of_peak_sustained_active": 65.97432007238348, "dram__bytes.sum.per_second": 275805243.6792293, "time": 141.65260532924108, "times": [141.95706176757812, 141.0134735107422, 140.6327362060547, 140.86630249023438, 140.8668212890625, 142.9310760498047, 143.30076599121094], "nvml_power": 174.16, "nvml_energy": 24.67021774414063, "compile_time": 253.3961080480367, "verification_time": 0, "benchmark_time": 2303.0808318872005, "edp": 3494.6006174971926, "throughput_penalty": 1000000.0, "objective": 1003494.6006174972, "strategy_time": 0.1281800214201212, "framework_time": 54.56926207989454, "timestamp": "2025-02-20 07:39:34.276851+00:00"},
"32,32,4,8,250": {"block_size_x": 32, "block_size_y": 32, "tile_size_x": 4, "tile_size_y": 8, "nvml_pwr_limit": 250, "sm__warps_active.avg.pct_of_peak_sustained_active": 65.97603034923353, "dram__bytes.sum.per_second": 316842577.8192442, "time": 138.38434055873327, "times": [138.34521484375, 138.40643310546875, 138.39698791503906, 138.3883819580078, 138.38172912597656, 138.38479614257812, 138.3868408203125], "nvml_power": 189.318, "nvml_energy": 26.198646585898267, "compile_time": 248.36069997400045, "verification_time": 0, "benchmark_time": 2247.77719611302, "edp": 3625.4824313208405, "throughput_penalty": 1000000.0, "objective": 1003625.4824313208, "strategy_time": 0.12631993740797043, "framework_time": 57.309962110593915, "timestamp": "2025-02-20 07:39:36.830448+00:00"},
"32,32,16,2,210": {"block_size_x": 32, "block_size_y": 32, "tile_size_x": 16, "tile_size_y": 2, "nvml_pwr_limit": 210, "sm__warps_active.avg.pct_of_peak_sustained_active": 65.97289608918125, "dram__bytes.sum.per_second": 22079565544.460396, "time": 138.33736092703683, "times": [138.49990844726562, 138.3240966796875, 138.3080596923828, 138.3077392578125, 138.30636596679688, 138.3164520263672, 138.2989044189453], "nvml_power": 199.023, "nvml_energy": 27.53231658378165, "compile_time": 253.50257102400064, "verification_time": 0, "benchmark_time": 2245.7406411413103, "edp": 3808.748016408044, "throughput_penalty": 1000000.0, "objective": 1003808.7480164081, "strategy_time": 0.1314799301326275, "framework_time": 63.78103280439973, "timestamp": "2025-02-20 07:39:39.393628+00:00"},
"32,32,2,32,210": {"block_size_x": 32, "block_size_y": 32, "tile_size_x": 2, "tile_size_y": 32, "nvml_pwr_limit": 210, "sm__warps_active.avg.pct_of_peak_sustained_active": 65.97181169298956, "dram__bytes.sum.per_second": 1137009236.98058, "time": 138.39086042131697, "times": [138.3582763671875, 138.4058837890625, 138.4088592529297, 138.392578125, 138.39065551757812, 138.39500427246094, 138.384765625], "nvml_power": 192.946, "nvml_energy": 26.701962954851428, "compile_time": 270.4703451599926, "verification_time": 0, "benchmark_time": 2242.0369449537247, "edp": 3695.3076282600205, "throughput_penalty": 1000000.0, "objective": 1003695.30762826, "strategy_time": 0.12878980487585068, "framework_time": 0.523880124092102, "timestamp": "2025-02-20 07:39:41.906812+00:00"},
"32,32,16,32,175": {"block_size_x": 32, "block_size_y": 32, "tile_size_x": 16, "tile_size_y": 32, "nvml_pwr_limit": 175, "sm__warps_active.avg.pct_of_peak_sustained_active": 65.97237949543286, "dram__bytes.sum.per_second": 26981579133.930733, "time": 146.2161581856864, "times": [145.9292755126953, 145.06227111816406, 144.96949768066406, 145.09024047851562, 145.78271484375, 148.68167114257812, 147.9974365234375], "nvml_power": 175.608, "nvml_energy": 25.67672710667202, "compile_time": 265.9599659964442, "verification_time": 0, "benchmark_time": 2230.7823209557682, "edp": 3754.3523923198577, "throughput_penalty": 1000000.0, "objective": 1003754.3523923198, "strategy_time": 0.1290501095354557, "framework_time": 56.39360286295414, "timestamp": "2025-02-20 07:39:44.460101+00:00"},
"32,32,4,2,210": {"block_size_x": 32, "block_size_y": 32, "tile_size_x": 4, "tile_size_y": 2, "nvml_pwr_limit": 210, "sm__warps_active.avg.pct_of_peak_sustained_active": 65.97546338788601, "dram__bytes.sum.per_second": 139469481.43046334, "time": 138.41840035574776, "times": [138.39308166503906, 138.4396209716797, 138.41273498535156, 138.42611694335938, 138.41661071777344, 138.41871643066406, 138.4219207763672], "nvml_power": 188.614, "nvml_energy": 26.107648164699008, "compile_time": 251.7325161024928, "verification_time": 0, "benchmark_time": 2267.633518204093, "edp": 3613.7788960083108, "throughput_penalty": 1000000.0, "objective": 1003613.7788960083, "strategy_time": 0.13017980381846428, "framework_time": 57.586563751101494, "timestamp": "2025-02-20 07:39:47.037208+00:00"},
"32,32,4,2,175": {"block_size_x": 32, "block_size_y": 32, "tile_size_x": 4, "tile_size_y": 2, "nvml_pwr_limit": 175, "sm__warps_active.avg.pct_of_peak_sustained_active": 65.97100682092245, "dram__bytes.sum.per_second": 9748.497623582147, "time": 142.2205548967634, "times": [143.19427490234375, 141.06640625, 140.91818237304688, 140.91506958007812, 140.90768432617188, 144.13833618164062, 144.4039306640625], "nvml_power": 174.59, "nvml_energy": 24.83028667942592, "compile_time": 253.03589808754623, "verification_time": 0, "benchmark_time": 2314.458816079423, "edp": 3531.377149793667, "throughput_penalty": 1000000.0, "objective": 1003531.3771497937, "strategy_time": 0.1271599903702736, "framework_time": 58.964254800230265, "timestamp": "2025-02-20 07:39:49.663817+00:00"},
"32,32,32,16,140": {"block_size_x": 32, "block_size_y": 32, "tile_size_x": 32, "tile_size_y": 16, "nvml_pwr_limit": 140, "sm__warps_active.avg.pct_of_peak_sustained_active": 65.97853176918895, "dram__bytes.sum.per_second": 91477523818.23775, "time": 183.91778564453125, "times": [177.89596557617188, 176.8011474609375, 176.12620544433594, 187.9778289794922, 192.8535614013672, 192.07530212402344, 183.69448852539062], "nvml_power": 139.873, "nvml_energy": 25.72513243145752, "compile_time": 270.5451420042664, "verification_time": 0, "benchmark_time": 2624.1542799398303, "edp": 4731.309392205983, "throughput_penalty": 1000000.0, "objective": 1004731.309392206, "strategy_time": 0.13230997137725353, "framework_time": 54.548954125493765, "timestamp": "2025-02-20 07:39:52.613221+00:00"},
"32,32,8,2,210": {"block_size_x": 32, "block_size_y": 32, "tile_size_x": 8, "tile_size_y": 2, "nvml_pwr_limit": 210, "sm__warps_active.avg.pct_of_peak_sustained_active": 65.97671553909231, "dram__bytes.sum.per_second": 342427815.32877785, "time": 138.34519740513392, "times": [138.3134765625, 138.3654022216797, 138.35618591308594, 138.34979248046875, 138.34361267089844, 138.32730102539062, 138.36061096191406], "nvml_power": 189.97, "nvml_energy": 26.281437151053293, "compile_time": 249.58685180172324, "verification_time": 0, "benchmark_time": 2247.2485350444913, "edp": 3635.9106107530883, "throughput_penalty": 1000000.0, "objective": 1003635.9106107531, "strategy_time": 0.13125990517437458, "framework_time": 54.84055425040424, "timestamp": "2025-02-20 07:39:55.165052+00:00"},
"32,32,8,16,250": {"block_size_x": 32, "block_size_y": 32, "tile_size_x": 8, "tile_size_y": 16, "nvml_pwr_limit": 250, "sm__warps_active.avg.pct_of_peak_sustained_active": 65.97792198809853, "dram__bytes.sum.per_second": 648605177.27323, "time": 138.35842895507812, "times": [138.31808471679688, 138.36489868164062, 138.42349243164062, 138.35385131835938, 138.3625946044922, 138.34457397460938, 138.3415069580078], "nvml_power": 191.628, "nvml_energy": 26.51334902380371, "compile_time": 264.5860349293798, "verification_time": 0, "benchmark_time": 2246.776949148625, "edp": 3668.3453172711356, "throughput_penalty": 1000000.0, "objective": 1003668.3453172712, "strategy_time": 0.13150996528565884, "framework_time": 56.92616477608681, "timestamp": "2025-02-20 07:39:57.733505+00:00"},
"32,32,32,2,175": {"block_size_x": 32, "block_size_y": 32, "tile_size_x": 32, "tile_size_y": 2, "nvml_pwr_limit": 175, "sm__warps_active.avg.pct_of_peak_sustained_active": 65.97239590898528, "dram__bytes.sum.per_second": 113238686026.78293, "time": 153.39679173060827, "times": [152.0075225830078, 151.6164093017578, 151.80348205566406, 151.79498291015625, 154.43238830566406, 156.30496215820312, 155.8177947998047], "nvml_power": 174.831, "nvml_energy": 26.81851449505397, "compile_time": 267.60180690325797, "verification_time": 0, "benchmark_time": 2335.6922240927815, "edp": 4113.874082522093, "throughput_penalty": 1000000.0, "objective": 1004113.8740825221, "strategy_time": 0.13232999481260777, "framework_time": 54.85620489344001, "timestamp": "2025-02-20 07:40:00.391811+00:00"},
"32,32,8,2,175": {"block_size_x": 32, "block_size_y": 32, "tile_size_x": 8, "tile_size_y": 2, "nvml_pwr_limit": 175, "sm__warps_active.avg.pct_of_peak_sustained_active": 65.97481588756496, "dram__bytes.sum.per_second": 325395402.9199671, "time": 141.99937220982142, "times": [142.2295379638672, 140.9947509765625, 140.84185791015625, 140.8698272705078, 140.8824920654297, 144.4915771484375, 143.68556213378906], "nvml_power": 174.167, "nvml_energy": 24.73160465966797, "compile_time": 276.8675999250263, "verification_time": 0, "benchmark_time": 2306.6796550992876, "edp": 3511.872335414346, "throughput_penalty": 1000000.0, "objective": 1003511.8723354144, "strategy_time": 1.7799199558794498, "framework_time": 0.5234400741755962, "timestamp": "2025-02-20 07:40:02.977684+00:00"},
"32,32,2,16,140": {"block_size_x": 32, "block_size_y": 32, "tile_size_x": 2, "tile_size_y": 16, "nvml_pwr_limit": 140, "sm__warps_active.avg.pct_of_peak_sustained_active": 65.97602583913012, "dram__bytes.sum.per_second": 446048899.63958514, "time": 158.34034729003906, "times": [158.05197143554688, 156.98159790039062, 156.97439575195312, 156.98521423339844, 160.0223388671875, 160.12371826171875, 159.24319458007812], "nvml_power": 138.886, "nvml_energy": 21.991257473724364, "compile_time": 230.89477699249983, "verification_time": 0, "benchmark_time": 2405.9605130460113, "edp": 3482.1033457341828, "throughput_penalty": 1000000.0, "objective": 1003482.1033457342, "strategy_time": 0.2966001629829407, "framework_time": 42.94776380993426, "timestamp": "2025-02-20 07:40:05.657807+00:00"},
"32,32,32,32,250": {"block_size_x": 32, "block_size_y": 32, "tile_size_x": 32, "tile_size_y": 32, "nvml_pwr_limit": 250, "sm__warps_active.avg.pct_of_peak_sustained_active": 65.97918581176427, "dram__bytes.sum.per_second": 126898296022.05229, "time": 138.3480006626674, "times": [138.40255737304688, 138.34605407714844, 138.34483337402344, 138.3368377685547, 138.33743286132812, 138.3336639404297, 138.33462524414062], "nvml_power": 222.912, "nvml_energy": 30.839429523716515, "compile_time": 262.4515120405704, "verification_time": 0, "benchmark_time": 2245.9306789096445, "edp": 4266.573416183417, "throughput_penalty": 1000000.0, "objective": 1004266.5734161835, "strategy_time": 0.1624799333512783, "framework_time": 51.704806042835116, "timestamp": "2025-02-20 07:40:08.218080+00:00"},
"32,32,4,16,175": {"block_size_x": 32, "block_size_y": 32, "tile_size_x": 4, "tile_size_y": 16, "nvml_pwr_limit": 175, "sm__warps_active.avg.pct_of_peak_sustained_active": 65.97451159936884, "dram__bytes.sum.per_second": 717077849.3484026, "time": 142.94088091169084, "times": [143.9974365234375, 141.72933959960938, 141.720703125, 141.72377014160156, 141.70681762695312, 144.49789428710938, 145.210205078125], "nvml_power": 176.636, "nvml_energy": 25.24850544071742, "compile_time": 258.1062929239124, "verification_time": 0, "benchmark_time": 2177.087443880737, "edp": 3609.043609399767, "throughput_penalty": 1000000.0, "objective": 1003609.0436093998, "strategy_time": 1.6069100238382816, "framework_time": 82.3901800904423, "timestamp": "2025-02-20 07:40:10.737294+00:00"},
"32,32,8,16,175": {"block_size_x": 32, "block_size_y": 32, "tile_size_x": 8, "tile_size_y": 16, "nvml_pwr_limit": 175, "sm__warps_active.avg.pct_of_peak_sustained_active": 65.97681709577505, "dram__bytes.sum.per_second": 848821881.6755806, "time": 142.56006949288505, "times": [142.5109405517578, 141.57061767578125, 141.6926727294922, 141.7022705078125, 141.70310974121094, 144.32131958007812, 144.4195556640625], "nvml_power": 174.949, "nvml_energy": 24.940741597710748, "compile_time": 236.20550194755197, "verification_time": 0, "benchmark_time": 2310.502785956487, "edp": 3555.553855373733, "throughput_penalty": 1000000.0, "objective": 1003555.5538553738, "strategy_time": 0.2790701109915972, "framework_time": 0.5088499747216702, "timestamp": "2025-02-20 07:40:13.284814+00:00"},
"32,32,4,32,175": {"block_size_x": 32, "block_size_y": 32, "tile_size_x": 4, "tile_size_y": 32, "nvml_pwr_limit": 175, "sm__warps_active.avg.pct_of_peak_sustained_active": 65.9692574275941, "dram__bytes.sum.per_second": 1195224369.1924543, "time": 143.66730608258928, "times": [144.15382385253906, 142.3784942626953, 142.1396484375, 142.36195373535156, 142.6031036376953, 145.97488403320312, 146.05923461914062], "nvml_power": 176.886, "nvml_energy": 25.412735103724888, "compile_time": 247.50319519080222, "verification_time": 0, "benchmark_time": 2183.8996619917452, "edp": 3650.979192542605, "throughput_penalty": 1000000.0, "objective": 1003650.9791925426, "strategy_time": 0.17146999016404152, "framework_time": 0.5483997520059347, "timestamp": "2025-02-20 07:40:15.716961+00:00"},
"32,32,8,4,175": {"block_size_x": 32, "block_size_y": 32, "tile_size_x": 8, "tile_size_y": 4, "nvml_pwr_limit": 175, "sm__warps_active.avg.pct_of_peak_sustained_active": 65.97305889073516, "dram__bytes.sum.per_second": 314317694.2449398, "time": 142.32756696428572, "times": [143.2123565673828, 141.75881958007812, 141.10333251953125, 141.6962890625, 141.55413818359375, 143.79379272460938, 143.1742401123047], "nvml_power": 174.661, "nvml_energy": 24.85907517354911, "compile_time": 273.28189997933805, "verification_time": 0, "benchmark_time": 2308.8693539611995, "edp": 3538.1316864335236, "throughput_penalty": 1000000.0, "objective": 1003538.1316864336, "strategy_time": 1.6505999956279993, "framework_time": 0.5485001020133495, "timestamp": "2025-02-20 07:40:18.301335+00:00"},
"32,32,4,4,175": {"block_size_x": 32, "block_size_y": 32, "tile_size_x": 4, "tile_size_y": 4, "nvml_pwr_limit": 175, "sm__warps_active.avg.pct_of_peak_sustained_active": 65.97101462989951, "dram__bytes.sum.per_second": 8917218.546701802, "time": 142.58809334891183, "times": [142.7015380859375, 141.73062133789062, 141.49288940429688, 141.72119140625, 141.71961975097656, 144.7387237548828, 144.01206970214844], "nvml_power": 174.667, "nvml_energy": 24.90543450097438, "compile_time": 235.94521591439843, "verification_time": 0, "benchmark_time": 2312.217199942097, "edp": 3551.218419520144, "throughput_penalty": 1000000.0, "objective": 1003551.2184195202, "strategy_time": 0.29959995299577713, "framework_time": 0.4934612661600113, "timestamp": "2025-02-20 07:40:20.850313+00:00"},
"32,32,4,8,140": {"block_size_x": 32, "block_size_y": 32, "tile_size_x": 4, "tile_size_y": 8, "nvml_pwr_limit": 140, "sm__warps_active.avg.pct_of_peak_sustained_active": 65.97492789115657, "dram__bytes.sum.per_second": 141603739.5894002, "time": 158.35696847098214, "times": [158.01516723632812, 156.97174072265625, 156.97293090820312, 156.94601440429688, 160.47305297851562, 160.36611938476562, 158.75375366210938], "nvml_power": 139.746, "nvml_energy": 22.12975291594587, "compile_time": 245.96329894848168, "verification_time": 0, "benchmark_time": 2407.648070016876, "edp": 3504.400584781065, "throughput_penalty": 1000000.0, "objective": 1003504.4005847811, "strategy_time": 0.16483990475535393, "framework_time": 51.78959807381034, "timestamp": "2025-02-20 07:40:23.555903+00:00"},
"32,32,2,2,250": {"block_size_x": 32, "block_size_y": 32, "tile_size_x": 2, "tile_size_y": 2, "nvml_pwr_limit": 250, "sm__warps_active.avg.pct_of_peak_sustained_active": 65.97213786779243, "dram__bytes.sum.per_second": 5770232.595151931, "time": 138.38548496791296, "times": [138.3486785888672, 138.406982421875, 138.39999389648438, 138.3863983154297, 138.39010620117188, 138.3922576904297, 138.3739776611328], "nvml_power": 192.888, "nvml_energy": 26.692899424490793, "compile_time": 278.81991607137024, "verification_time": 0, "benchmark_time": 2247.2244689706713, "edp": 3693.9098320578832, "throughput_penalty": 1000000.0, "objective": 1003693.9098320579, "strategy_time": 1.5729598235338926, "framework_time": 46.834818087518215, "timestamp": "2025-02-20 07:40:26.130380+00:00"},
"32,32,2,8,140": {"block_size_x": 32, "block_size_y": 32, "tile_size_x": 2, "tile_size_y": 8, "nvml_pwr_limit": 140, "sm__warps_active.avg.pct_of_peak_sustained_active": 65.97430269915188, "dram__bytes.sum.per_second": 15227790.190661214, "time": 158.70884486607142, "times": [158.1782684326172, 157.3745880126953, 157.08738708496094, 157.10140991210938, 161.1216583251953, 161.0707244873047, 159.0278778076172], "nvml_power": 139.206, "nvml_energy": 22.093223458426337, "compile_time": 265.6926258932799, "verification_time": 0, "benchmark_time": 2408.8811909314245, "edp": 3506.3899744548353, "throughput_penalty": 1000000.0, "objective": 1003506.3899744549, "strategy_time": 0.2919000107795, "framework_time": 46.81019810959697, "timestamp": "2025-02-20 07:40:28.852081+00:00"},
"32,32,4,2,140": {"block_size_x": 32, "block_size_y": 32, "tile_size_x": 4, "tile_size_y": 2, "nvml_pwr_limit": 140, "sm__warps_active.avg.pct_of_peak_sustained_active": 65.97561591024949, "dram__bytes.sum.per_second": 7705349.146082957, "time": 157.9546661376953, "times": [157.77609252929688, 156.7196807861328, 156.9285125732422, 156.94659423828125, 159.98867797851562, 159.2198028564453, 158.10330200195312], "nvml_power": 139.79, "nvml_energy": 22.08048277938843, "compile_time": 247.71026405505836, "verification_time": 0, "benchmark_time": 2396.374334814027, "edp": 3487.71528557743, "throughput_penalty": 1000000.0, "objective": 1003487.7152855775, "strategy_time": 0.16449997201561928, "framework_time": 0.5646301433444023, "timestamp": "2025-02-20 07:40:31.496920+00:00"},
"32,32,2,2,175": {"block_size_x": 32, "block_size_y": 32, "tile_size_x": 2, "tile_size_y": 2, "nvml_pwr_limit": 175, "sm__warps_active.avg.pct_of_peak_sustained_active": 65.97061728475279, "dram__bytes.sum.per_second": 6197.060778337554, "time": 142.6286359514509, "times": [142.6214141845703, 141.75503540039062, 141.50682067871094, 141.74000549316406, 141.7316131591797, 144.75625610351562, 144.289306640625], "nvml_power": 174.922, "nvml_energy": 24.948886257899694, "compile_time": 264.99983901157975, "verification_time": 0, "benchmark_time": 2322.0635461620986, "edp": 3558.4256154721315, "throughput_penalty": 1000000.0, "objective": 1003558.4256154721, "strategy_time": 1.579740084707737, "framework_time": 40.28084664605558, "timestamp": "2025-02-20 07:40:34.125867+00:00"},
"32,32,2,32,140": {"block_size_x": 32, "block_size_y": 32, "tile_size_x": 2, "tile_size_y": 32, "nvml_pwr_limit": 140, "sm__warps_active.avg.pct_of_peak_sustained_active": 65.97128826853563, "dram__bytes.sum.per_second": 766203840.5205114, "time": 158.94755118233817, "times": [157.99334716796875, 156.82476806640625, 157.4365692138672, 157.28131103515625, 161.70156860351562, 161.5286102294922, 159.86668395996094], "nvml_power": 139.935, "nvml_energy": 22.24232557470049, "compile_time": 244.85734710469842, "verification_time": 0, "benchmark_time": 2421.5838899835944, "edp": 3535.363182698936, "throughput_penalty": 1000000.0, "objective": 1003535.363182699, "strategy_time": 0.2836701460182667, "framework_time": 49.3289886508137, "timestamp": "2025-02-20 07:40:36.841944+00:00"},
"32,32,4,4,140": {"block_size_x": 32, "block_size_y": 32, "tile_size_x": 4, "tile_size_y": 4, "nvml_pwr_limit": 140, "sm__warps_active.avg.pct_of_peak_sustained_active": 65.97594891157122, "dram__bytes.sum.per_second": 196151567.65893435, "time": 157.4679892403739, "times": [157.8047332763672, 155.97775268554688, 155.88294982910156, 155.87049865722656, 159.52041625976562, 159.2632293701172, 157.9563446044922], "nvml_power": 140.541, "nvml_energy": 22.130708675831386, "compile_time": 247.73201905190945, "verification_time": 0, "benchmark_time": 2392.698348965496, "edp": 3484.878195647666, "throughput_penalty": 1000000.0, "objective": 1003484.8781956476, "strategy_time": 0.16371998935937881, "framework_time": 0.5207699723541737, "timestamp": "2025-02-20 07:40:39.483082+00:00"},
"32,32,16,16,210": {"block_size_x": 32, "block_size_y": 32, "tile_size_x": 16, "tile_size_y": 16, "nvml_pwr_limit": 210, "sm__warps_active.avg.pct_of_peak_sustained_active": 65.97559461632572, "dram__bytes.sum.per_second": 24300180540.33142, "time": 138.35649980817522, "times": [138.6124725341797, 138.3205108642578, 138.31663513183594, 138.30812072753906, 138.2957763671875, 138.30067443847656, 138.34130859375], "nvml_power": 202.71, "nvml_energy": 28.0462460761152, "compile_time": 263.31470301374793, "verification_time": 0, "benchmark_time": 2246.5441739186645, "edp": 3880.3804398500674, "throughput_penalty": 1000000.0, "objective": 1003880.38043985, "strategy_time": 1.5758799854665995, "framework_time": 43.86562993749976, "timestamp": "2025-02-20 07:40:42.038407+00:00"},
"32,32,2,8,175": {"block_size_x": 32, "block_size_y": 32, "tile_size_x": 2, "tile_size_y": 8, "nvml_pwr_limit": 175, "sm__warps_active.avg.pct_of_peak_sustained_active": 65.97147227311535, "dram__bytes.sum.per_second": 295047255.4390794, "time": 142.8842293875558, "times": [142.63046264648438, 141.74908447265625, 141.71446228027344, 141.7097625732422, 141.83120727539062, 145.24954223632812, 145.30508422851562], "nvml_power": 177.162, "nvml_energy": 25.31365584675816, "compile_time": 235.9060300514102, "verification_time": 0, "benchmark_time": 2174.3533220142126, "edp": 3616.922208645836, "throughput_penalty": 1000000.0, "objective": 1003616.9222086458, "strategy_time": 0.2812498714774847, "framework_time": 47.37576004117727, "timestamp": "2025-02-20 07:40:44.496347+00:00"},
"32,32,2,4,140": {"block_size_x": 32, "block_size_y": 32, "tile_size_x": 2, "tile_size_y": 4, "nvml_pwr_limit": 140, "sm__warps_active.avg.pct_of_peak_sustained_active": 65.97448630339288, "dram__bytes.sum.per_second": 28275.470948165406, "time": 158.54984174455916, "times": [158.06349182128906, 156.99180603027344, 156.9845733642578, 156.96701049804688, 160.3372802734375, 161.20069885253906, 159.3040313720703], "nvml_power": 140.293, "nvml_energy": 22.24343294786944, "compile_time": 243.19692188873887, "verification_time": 0, "benchmark_time": 2408.844695892185, "edp": 3526.6927737404126, "throughput_penalty": 1000000.0, "objective": 1003526.6927737404, "strategy_time": 0.16052019782364368, "framework_time": 50.986460875719786, "timestamp": "2025-02-20 07:40:47.199559+00:00"},
"32,32,2,32,250": {"block_size_x": 32, "block_size_y": 32, "tile_size_x": 2, "tile_size_y": 32, "nvml_pwr_limit": 250, "sm__warps_active.avg.pct_of_peak_sustained_active": 65.97081252142632, "dram__bytes.sum.per_second": 846516583.6706264, "time": 138.38077218191964, "times": [138.35743713378906, 138.3910369873047, 138.3919677734375, 138.38409423828125, 138.38006591796875, 138.3750457763672, 138.38575744628906], "nvml_power": 194.896, "nvml_energy": 26.969858975167405, "compile_time": 257.4368768837303, "verification_time": 0, "benchmark_time": 2243.4791640844196, "edp": 3732.1099106211414, "throughput_penalty": 1000000.0, "objective": 1003732.1099106212, "strategy_time": 1.6664110589772463, "framework_time": 48.61034103669226, "timestamp": "2025-02-20 07:40:49.750777+00:00"},
"32,32,2,16,250": {"block_size_x": 32, "block_size_y": 32, "tile_size_x": 2, "tile_size_y": 16, "nvml_pwr_limit": 250, "sm__warps_active.avg.pct_of_peak_sustained_active": 65.9752617611445, "dram__bytes.sum.per_second": 587564275.1941758, "time": 138.37730625697546, "times": [138.3657989501953, 138.39053344726562, 138.3889617919922, 138.3765411376953, 138.38330078125, 138.36752319335938, 138.3684844970703], "nvml_power": 194.287, "nvml_energy": 26.88491170074899, "compile_time": 236.38722277246416, "verification_time": 0, "benchmark_time": 2241.6826270055026, "edp": 3720.261660106286, "throughput_penalty": 1000000.0, "objective": 1003720.2616601062, "strategy_time": 0.2822801470756531, "framework_time": 0.5078001413494349, "timestamp": "2025-02-20 07:40:52.229661+00:00"},
"32,32,2,4,175": {"block_size_x": 32, "block_size_y": 32, "tile_size_x": 2, "tile_size_y": 4, "nvml_pwr_limit": 175, "sm__warps_active.avg.pct_of_peak_sustained_active": 65.97126312521507, "dram__bytes.sum.per_second": 138679039.41245395, "time": 142.97811017717635, "times": [143.4106903076172, 141.75149536132812, 141.73805236816406, 141.73898315429688, 141.74024963378906, 145.23388671875, 145.23341369628906], "nvml_power": 175.922, "nvml_energy": 25.152995098589216, "compile_time": 237.75303503498435, "verification_time": 0, "benchmark_time": 2175.1985831651837, "edp": 3596.3277044920655, "throughput_penalty": 1000000.0, "objective": 1003596.327704492, "strategy_time": 0.16419007442891598, "framework_time": 49.254791578277946, "timestamp": "2025-02-20 07:40:54.692056+00:00"},
"32,32,4,2,250": {"block_size_x": 32, "block_size_y": 32, "tile_size_x": 4, "tile_size_y": 2, "nvml_pwr_limit": 250, "sm__warps_active.avg.pct_of_peak_sustained_active": 65.97578852943585, "dram__bytes.sum.per_second": 70949842.08603652, "time": 138.37394060407365, "times": [138.35888671875, 138.38511657714844, 138.38726806640625, 138.37193298339844, 138.37277221679688, 138.37046813964844, 138.3711395263672], "nvml_power": 193.063, "nvml_energy": 26.71488809484427, "compile_time": 261.8681830354035, "verification_time": 0, "benchmark_time": 2242.766932118684, "edp": 3696.644338480455, "throughput_penalty": 1000000.0, "objective": 1003696.6443384804, "strategy_time": 1.6821599565446377, "framework_time": 50.06556282751262, "timestamp": "2025-02-20 07:40:57.248463+00:00"},
"32,32,2,2,140": {"block_size_x": 32, "block_size_y": 32, "tile_size_x": 2, "tile_size_y": 2, "nvml_pwr_limit": 140, "sm__warps_active.avg.pct_of_peak_sustained_active": 65.97463487770356, "dram__bytes.sum.per_second": 0.0, "time": 158.7324436732701, "times": [158.00390625, 157.31304931640625, 157.25648498535156, 157.35574340820312, 161.02854919433594, 161.50210571289062, 158.66726684570312], "nvml_power": 139.555, "nvml_energy": 22.15190617682321, "compile_time": 239.57204795442522, "verification_time": 0, "benchmark_time": 2407.485466916114, "edp": 3516.2261994681544, "throughput_penalty": 1000000.0, "objective": 1003516.2261994681, "strategy_time": 0.2871300093829632, "framework_time": 45.915761962533, "timestamp": "2025-02-20 07:40:59.941747+00:00"},
"32,32,2,32,175": {"block_size_x": 32, "block_size_y": 32, "tile_size_x": 2, "tile_size_y": 32, "nvml_pwr_limit": 175, "sm__warps_active.avg.pct_of_peak_sustained_active": 65.96922461730931, "dram__bytes.sum.per_second": 945902851.3831099, "time": 143.78949628557478, "times": [143.21705627441406, 142.36813354492188, 142.59616088867188, 142.61386108398438, 143.2874298095703, 146.2460479736328, 146.19778442382812], "nvml_power": 175.678, "nvml_energy": 25.260651128457205, "compile_time": 242.6072210073471, "verification_time": 0, "benchmark_time": 2189.961585914716, "edp": 3632.216301606498, "throughput_penalty": 1000000.0, "objective": 1003632.2163016065, "strategy_time": 0.15968992374837399, "framework_time": 48.16949227824807, "timestamp": "2025-02-20 07:41:02.422670+00:00"},
"32,32,8,4,250": {"block_size_x": 32, "block_size_y": 32, "tile_size_x": 8, "tile_size_y": 4, "nvml_pwr_limit": 250, "sm__warps_active.avg.pct_of_peak_sustained_active": 65.97535145758128, "dram__bytes.sum.per_second": 375882893.07216024, "time": 138.3355233328683, "times": [138.33042907714844, 138.3434600830078, 138.34002685546875, 138.3326416015625, 138.33602905273438, 138.33206176757812, 138.33401489257812], "nvml_power": 192.777, "nvml_energy": 26.66790718154035, "compile_time": 255.10480487719178, "verification_time": 0, "benchmark_time": 2242.2270118258893, "edp": 3689.118896150741, "throughput_penalty": 1000000.0, "objective": 1003689.1188961507, "strategy_time": 2.471779938787222, "framework_time": 47.728013480082154, "timestamp": "2025-02-20 07:41:04.970229+00:00"},
"32,32,2,2,100": {"block_size_x": 32, "block_size_y": 32, "tile_size_x": 2, "tile_size_y": 2, "nvml_pwr_limit": 100, "sm__warps_active.avg.pct_of_peak_sustained_active": 65.97747295524806, "dram__bytes.sum.per_second": 3519808.0911225937, "time": 218.61306762695312, "times": [215.4707794189453, 212.41705322265625, 216.6807098388672, 229.25689697265625, 228.14834594726562, 216.5985870361328, 211.71910095214844], "nvml_power": 100.574, "nvml_energy": 21.986790663513183, "compile_time": 245.09830493479967, "verification_time": 0, "benchmark_time": 2890.2232688851655, "edp": 4806.599754222269, "throughput_penalty": 1000000.0, "objective": 1004806.5997542223, "strategy_time": 0.3136098384857178, "framework_time": 53.08718327432871, "timestamp": "2025-02-20 07:41:08.158975+00:00"},
"32,32,2,16,175": {"block_size_x": 32, "block_size_y": 32, "tile_size_x": 2, "tile_size_y": 16, "nvml_pwr_limit": 175, "sm__warps_active.avg.pct_of_peak_sustained_active": 65.97226124107269, "dram__bytes.sum.per_second": 431005131.4773638, "time": 142.91490827287947, "times": [142.74163818359375, 141.7698211669922, 141.75897216796875, 141.7505645751953, 141.98486328125, 145.1656036376953, 145.23289489746094], "nvml_power": 175.61849999999998, "nvml_energy": 25.09850181852068, "compile_time": 241.35013506747782, "verification_time": 0, "benchmark_time": 2181.740844156593, "edp": 3586.950085180582, "throughput_penalty": 1000000.0, "objective": 1003586.9500851806, "strategy_time": 0.15968014486134052, "framework_time": 56.881924625486135, "timestamp": "2025-02-20 07:41:10.639130+00:00"},
"32,32,8,32,210": {"block_size_x": 32, "block_size_y": 32, "tile_size_x": 8, "tile_size_y": 32, "nvml_pwr_limit": 210, "sm__warps_active.avg.pct_of_peak_sustained_active": 65.97334333763632, "dram__bytes.sum.per_second": 1667020525.9989514, "time": 138.35464695521765, "times": [138.32754516601562, 138.3729248046875, 138.35699462890625, 138.35760498046875, 138.36143493652344, 138.35440063476562, 138.35162353515625], "nvml_power": 194.456, "nvml_energy": 26.903891228323804, "compile_time": 286.4724178798497, "verification_time": 0, "benchmark_time": 2246.0628650151193, "edp": 3722.2783726163166, "throughput_penalty": 1000000.0, "objective": 1003722.2783726163, "strategy_time": 1.6146209090948105, "framework_time": 44.70556206069887, "timestamp": "2025-02-20 07:41:13.218009+00:00"},
"32,32,2,2,210": {"block_size_x": 32, "block_size_y": 32, "tile_size_x": 2, "tile_size_y": 2, "nvml_pwr_limit": 210, "sm__warps_active.avg.pct_of_peak_sustained_active": 65.97231203136008, "dram__bytes.sum.per_second": 87862136.98407073, "time": 138.37999834333147, "times": [138.3567657470703, 138.38864135742188, 138.3846435546875, 138.37762451171875, 138.38648986816406, 138.38243103027344, 138.38339233398438], "nvml_power": 193.906, "nvml_energy": 26.832711958762033, "compile_time": 229.47022481821477, "verification_time": 0, "benchmark_time": 2244.068424915895, "edp": 3713.1106364005805, "throughput_penalty": 1000000.0, "objective": 1003713.1106364005, "strategy_time": 0.285919988527894, "framework_time": 0.5034201312810183, "timestamp": "2025-02-20 07:41:15.692360+00:00"},
"32,32,8,32,175": {"block_size_x": 32, "block_size_y": 32, "tile_size_x": 8, "tile_size_y": 32, "nvml_pwr_limit": 175, "sm__warps_active.avg.pct_of_peak_sustained_active": 65.9709616920746, "dram__bytes.sum.per_second": 1347319369.9145706, "time": 143.24864414760046, "times": [143.3146514892578, 141.8515167236328, 141.80140686035156, 141.80120849609375, 141.8151092529297, 145.9896697998047, 146.1669464111328], "nvml_power": 173.313, "nvml_energy": 24.82685226315308, "compile_time": 236.42665799707174, "verification_time": 0, "benchmark_time": 2186.0184718389064, "edp": 3556.4129251494646, "throughput_penalty": 1000000.0, "objective": 1003556.4129251494, "strategy_time": 0.16618985682725906, "framework_time": 51.770195132121444, "timestamp": "2025-02-20 07:41:18.166765+00:00"},
"32,32,4,32,140": {"block_size_x": 32, "block_size_y": 32, "tile_size_x": 4, "tile_size_y": 32, "nvml_pwr_limit": 140, "sm__warps_active.avg.pct_of_peak_sustained_active": 65.9751170201906, "dram__bytes.sum.per_second": 1091397982.557144, "time": 159.6933310372489, "times": [159.93228149414062, 158.18663024902344, 157.82569885253906, 157.9495391845703, 161.9965057373047, 161.48109436035156, 160.4815673828125], "nvml_power": 140.792, "nvml_energy": 22.483543463396348, "compile_time": 262.8403869457543, "verification_time": 0, "benchmark_time": 2428.876634920016, "edp": 3590.4719491905266, "throughput_penalty": 1000000.0, "objective": 1003590.4719491905, "strategy_time": 1.692179823294282, "framework_time": 44.37395324930549, "timestamp": "2025-02-20 07:41:20.904570+00:00"},
"32,32,2,4,100": {"block_size_x": 32, "block_size_y": 32, "tile_size_x": 2, "tile_size_y": 4, "nvml_pwr_limit": 100, "sm__warps_active.avg.pct_of_peak_sustained_active": 65.9789778203399, "dram__bytes.sum.per_second": 97973934.45214917, "time": 222.28931318010603, "times": [217.57618713378906, 215.82911682128906, 223.6933135986328, 232.21356201171875, 229.9388427734375, 217.9036102294922, 218.8705596923828], "nvml_power": 100.33, "nvml_energy": 22.30228679136004, "compile_time": 238.15933987498283, "verification_time": 0, "benchmark_time": 2936.127313878387, "edp": 4957.560013197174, "throughput_penalty": 1000000.0, "objective": 1004957.5600131971, "strategy_time": 0.2783599775284529, "framework_time": 49.81066519394517, "timestamp": "2025-02-20 07:41:24.128970+00:00"},
"32,32,4,16,250": {"block_size_x": 32, "block_size_y": 32, "tile_size_x": 4, "tile_size_y": 16, "nvml_pwr_limit": 250, "sm__warps_active.avg.pct_of_peak_sustained_active": 65.9767974825099, "dram__bytes.sum.per_second": 497588027.8515392, "time": 138.41575186593192, "times": [138.38624572753906, 138.4338836669922, 138.41900634765625, 138.41273498535156, 138.4176025390625, 138.41448974609375, 138.42630004882812], "nvml_power": 191.58, "nvml_energy": 26.517689742475238, "compile_time": 245.81688409671187, "verification_time": 0, "benchmark_time": 2250.5610820371658, "edp": 3670.465963452221, "throughput_penalty": 1000000.0, "objective": 1003670.4659634522, "strategy_time": 0.16733980737626553, "framework_time": 55.15685793943703, "timestamp": "2025-02-20 07:41:26.680696+00:00"},
"32,32,2,4,250": {"block_size_x": 32, "block_size_y": 32, "tile_size_x": 2, "tile_size_y": 4, "nvml_pwr_limit": 250, "sm__warps_active.avg.pct_of_peak_sustained_active": 65.97256677065778, "dram__bytes.sum.per_second": 155052186.31198475, "time": 138.37787301199776, "times": [138.3645477294922, 138.38092041015625, 138.38287353515625, 138.3738250732422, 138.38662719726562, 138.37612915039062, 138.38018798828125], "nvml_power": 193.621, "nvml_energy": 26.792862150456024, "compile_time": 257.1869499515742, "verification_time": 0, "benchmark_time": 2242.3247119877487, "edp": 3707.539276283765, "throughput_penalty": 1000000.0, "objective": 1003707.5392762838, "strategy_time": 1.7108500469475985, "framework_time": 0.5388502031564713, "timestamp": "2025-02-20 07:41:29.182482+00:00"},
"32,32,2,4,210": {"block_size_x": 32, "block_size_y": 32, "tile_size_x": 2, "tile_size_y": 4, "nvml_pwr_limit": 210, "sm__warps_active.avg.pct_of_peak_sustained_active": 65.97300931767911, "dram__bytes.sum.per_second": 33308.81434499605, "time": 138.37985229492188, "times": [138.3552703857422, 138.38998413085938, 138.38525390625, 138.3835906982422, 138.38400268554688, 138.38319396972656, 138.37767028808594], "nvml_power": 193.957, "nvml_energy": 26.839741011566158, "compile_time": 237.4979150481522, "verification_time": 0, "benchmark_time": 2242.82000400126, "edp": 3714.079396814482, "throughput_penalty": 1000000.0, "objective": 1003714.0793968145, "strategy_time": 0.2783900126814842, "framework_time": 57.79247800819576, "timestamp": "2025-02-20 07:41:31.720895+00:00"},
"32,32,8,8,250": {"block_size_x": 32, "block_size_y": 32, "tile_size_x": 8, "tile_size_y": 8, "nvml_pwr_limit": 250, "sm__warps_active.avg.pct_of_peak_sustained_active": 65.97715797720977, "dram__bytes.sum.per_second": 366475740.3744895, "time": 138.33964320591517, "times": [138.31776428222656, 138.3546905517578, 138.3409881591797, 138.3469696044922, 138.3348846435547, 138.33657836914062, 138.3456268310547], "nvml_power": 193.636, "nvml_energy": 26.787535151820588, "compile_time": 246.91581912338734, "verification_time": 0, "benchmark_time": 2248.949488857761, "edp": 3705.778055268771, "throughput_penalty": 1000000.0, "objective": 1003705.7780552688, "strategy_time": 0.16104010865092278, "framework_time": 48.213694943115115, "timestamp": "2025-02-20 07:41:34.265159+00:00"},
"32,32,32,4,250": {"block_size_x": 32, "block_size_y": 32, "tile_size_x": 32, "tile_size_y": 4, "nvml_pwr_limit": 250, "sm__warps_active.avg.pct_of_peak_sustained_active": 65.97767233146199, "dram__bytes.sum.per_second": 126389828210.62256, "time": 138.33678981236048, "times": [138.31106567382812, 138.35296630859375, 138.33599853515625, 138.3356170654297, 138.33497619628906, 138.3399658203125, 138.34693908691406], "nvml_power": 225.463, "nvml_energy": 31.189827641464227, "compile_time": 281.71448200009763, "verification_time": 0, "benchmark_time": 2241.10707687214, "edp": 4314.700630720988, "throughput_penalty": 1000000.0, "objective": 1004314.7006307209, "strategy_time": 1.604550052434206, "framework_time": 0.4955602344125509, "timestamp": "2025-02-20 07:41:36.790104+00:00"},
"32,32,2,8,100": {"block_size_x": 32, "block_size_y": 32, "tile_size_x": 2, "tile_size_y": 8, "nvml_pwr_limit": 100, "sm__warps_active.avg.pct_of_peak_sustained_active": 65.97634033895875, "dram__bytes.sum.per_second": 208262337.7165778, "time": 221.9700186593192, "times": [219.0831298828125, 216.0747528076172, 220.98037719726562, 232.58297729492188, 230.75491333007812, 218.0860137939453, 216.22796630859375], "nvml_power": 100.25, "nvml_energy": 22.25249437059675, "compile_time": 238.14492812380195, "verification_time": 0, "benchmark_time": 2933.4873140323907, "edp": 4939.386590657757, "throughput_penalty": 1000000.0, "objective": 1004939.3865906578, "strategy_time": 0.2795599866658449, "framework_time": 46.929686795920134, "timestamp": "2025-02-20 07:41:40.008968+00:00"},
"32,32,4,8,210": {"block_size_x": 32, "block_size_y": 32, "tile_size_x": 4, "tile_size_y": 8, "nvml_pwr_limit": 210, "sm__warps_active.avg.pct_of_peak_sustained_active": 65.97428720299602, "dram__bytes.sum.per_second": 102537308.49853046, "time": 138.41160583496094, "times": [138.38546752929688, 138.4411163330078, 138.41775512695312, 138.4202880859375, 138.39283752441406, 138.4140167236328, 138.40975952148438], "nvml_power": 191.237, "nvml_energy": 26.46942026506042, "compile_time": 248.01777303218842, "verification_time": 0, "benchmark_time": 2250.1846191007644, "edp": 3663.6749644074703, "throughput_penalty": 1000000.0, "objective": 1003663.6749644075, "strategy_time": 0.1598598901182413, "framework_time": 53.11346799135208, "timestamp": "2025-02-20 07:41:42.560468+00:00"},
"32,32,8,4,140": {"block_size_x": 32, "block_size_y": 32, "tile_size_x": 8, "tile_size_y": 4, "nvml_pwr_limit": 140, "sm__warps_active.avg.pct_of_peak_sustained_active": 65.9777297444641, "dram__bytes.sum.per_second": 276734968.04507923, "time": 158.46198163713728, "times": [157.85459899902344, 156.9212188720703, 156.91561889648438, 156.9165802001953, 160.76380920410156, 161.0662078857422, 158.79583740234375], "nvml_power": 139.921, "nvml_energy": 22.172158932649886, "compile_time": 247.538594994694, "verification_time": 0, "benchmark_time": 2401.515082921833, "edp": 3513.4442416412558, "throughput_penalty": 1000000.0, "objective": 1003513.4442416412, "strategy_time": 1.7166309989988804, "framework_time": 83.95711798220873, "timestamp": "2025-02-20 07:41:45.295220+00:00"},
"32,32,2,8,210": {"block_size_x": 32, "block_size_y": 32, "tile_size_x": 2, "tile_size_y": 8, "nvml_pwr_limit": 210, "sm__warps_active.avg.pct_of_peak_sustained_active": 65.97442730406188, "dram__bytes.sum.per_second": 162624592.82013395, "time": 138.3756059919085, "times": [138.35740661621094, 138.38319396972656, 138.37026977539062, 138.3783416748047, 138.37554931640625, 138.37721252441406, 138.38726806640625], "nvml_power": 193.895, "nvml_energy": 26.8303381238011, "compile_time": 227.75029996410012, "verification_time": 0, "benchmark_time": 2242.5114600919187, "edp": 3712.6642968487818, "throughput_penalty": 1000000.0, "objective": 1003712.6642968488, "strategy_time": 0.27222977951169014, "framework_time": 49.746687058359385, "timestamp": "2025-02-20 07:41:47.815526+00:00"},
"32,32,8,4,210": {"block_size_x": 32, "block_size_y": 32, "tile_size_x": 8, "tile_size_y": 4, "nvml_pwr_limit": 210, "sm__warps_active.avg.pct_of_peak_sustained_active": 65.97462351274295, "dram__bytes.sum.per_second": 315848949.2108959, "time": 138.3438437325614, "times": [138.31776428222656, 138.35653686523438, 138.36102294921875, 138.34255981445312, 138.355712890625, 138.34054565429688, 138.332763671875], "nvml_power": 193.374, "nvml_energy": 26.752102437940326, "compile_time": 245.53158786147833, "verification_time": 0, "benchmark_time": 2241.1270800512284, "edp": 3700.988679191891, "throughput_penalty": 1000000.0, "objective": 1003700.9886791919, "strategy_time": 0.1680399291217327, "framework_time": 0.5403500981628895, "timestamp": "2025-02-20 07:41:50.302916+00:00"},
"32,32,16,4,175": {"block_size_x": 32, "block_size_y": 32, "tile_size_x": 16, "tile_size_y": 4, "nvml_pwr_limit": 175, "sm__warps_active.avg.pct_of_peak_sustained_active": 65.97070119861232, "dram__bytes.sum.per_second": 21096778525.001583, "time": 146.43401881626673, "times": [146.1162567138672, 145.30703735351562, 145.19891357421875, 145.30172729492188, 146.0076141357422, 149.2263641357422, 147.88021850585938], "nvml_power": 175.279, "nvml_energy": 25.666808384096413, "compile_time": 286.0830929130316, "verification_time": 0, "benchmark_time": 2231.6706890705973, "edp": 3758.4939018702867, "throughput_penalty": 1000000.0, "objective": 1003758.4939018703, "strategy_time": 1.6037810128182173, "framework_time": 50.448938040062785, "timestamp": "2025-02-20 07:41:52.872747+00:00"},
"32,32,2,8,250": {"block_size_x": 32, "block_size_y": 32, "tile_size_x": 2, "tile_size_y": 8, "nvml_pwr_limit": 250, "sm__warps_active.avg.pct_of_peak_sustained_active": 65.97419805589973, "dram__bytes.sum.per_second": 295610322.18094563, "time": 138.38450404575892, "times": [138.35769653320312, 138.40028381347656, 138.39205932617188, 138.38400268554688, 138.38694763183594, 138.38621520996094, 138.3843231201172], "nvml_power": 194.383, "nvml_energy": 26.899595049926756, "compile_time": 234.02454587630928, "verification_time": 0, "benchmark_time": 2261.116582201794, "edp": 3722.4871200158655, "throughput_penalty": 1000000.0, "objective": 1003722.4871200159, "strategy_time": 0.2862699329853058, "framework_time": 76.86090795323253, "timestamp": "2025-02-20 07:41:55.445066+00:00"},
"32,32,8,16,210": {"block_size_x": 32, "block_size_y": 32, "tile_size_x": 8, "tile_size_y": 16, "nvml_pwr_limit": 210, "sm__warps_active.avg.pct_of_peak_sustained_active": 65.97825600938542, "dram__bytes.sum.per_second": 919871935.0152794, "time": 138.34519958496094, "times": [138.32730102539062, 138.36329650878906, 138.34384155273438, 138.34950256347656, 138.35279846191406, 138.34713745117188, 138.33251953125], "nvml_power": 194.678, "nvml_energy": 26.932766764801027, "compile_time": 250.24355319328606, "verification_time": 0, "benchmark_time": 2246.964808087796, "edp": 3726.0189934516006, "throughput_penalty": 1000000.0, "objective": 1003726.0189934516, "strategy_time": 0.1591700129210949, "framework_time": 51.74062866717577, "timestamp": "2025-02-20 07:41:57.994198+00:00"},
"32,32,8,32,250": {"block_size_x": 32, "block_size_y": 32, "tile_size_x": 8, "tile_size_y": 32, "nvml_pwr_limit": 250, "sm__warps_active.avg.pct_of_peak_sustained_active": 65.97295458193479, "dram__bytes.sum.per_second": 1501198041.2216852, "time": 138.35210963657923, "times": [138.32858276367188, 138.3671417236328, 138.36019897460938, 138.3579864501953, 138.34031677246094, 138.3493194580078, 138.36122131347656], "nvml_power": 196.476, "nvml_energy": 27.18286909295654, "compile_time": 249.05396299436688, "verification_time": 0, "benchmark_time": 2260.629314929247, "edp": 3760.8072849855043, "throughput_penalty": 1000000.0, "objective": 1003760.8072849856, "strategy_time": 1.6189110465347767, "framework_time": 57.2399920783937, "timestamp": "2025-02-20 07:42:00.562764+00:00"},
"32,32,2,16,100": {"block_size_x": 32, "block_size_y": 32, "tile_size_x": 2, "tile_size_y": 16, "nvml_pwr_limit": 100, "sm__warps_active.avg.pct_of_peak_sustained_active": 65.97654956953197, "dram__bytes.sum.per_second": 357892463.88972783, "time": 232.9452907017299, "times": [228.22134399414062, 225.8093719482422, 235.45692443847656, 244.1098175048828, 238.90252685546875, 226.4081573486328, 231.70889282226562], "nvml_power": 99.381, "nvml_energy": 23.150335935228618, "compile_time": 245.12296286411583, "verification_time": 0, "benchmark_time": 3074.721791082993, "edp": 5392.761734274534, "throughput_penalty": 1000000.0, "objective": 1005392.7617342746, "strategy_time": 0.28001004830002785, "framework_time": 52.69894003868103, "timestamp": "2025-02-20 07:42:03.935611+00:00"},
"32,32,8,2,250": {"block_size_x": 32, "block_size_y": 32, "tile_size_x": 8, "tile_size_y": 2, "nvml_pwr_limit": 250, "sm__warps_active.avg.pct_of_peak_sustained_active": 65.97869220224692, "dram__bytes.sum.per_second": 286452833.1990274, "time": 138.38422502790178, "times": [138.36143493652344, 138.39248657226562, 138.38169860839844, 138.39126586914062, 138.38458251953125, 138.39065551757812, 138.387451171875], "nvml_power": 190.583, "nvml_energy": 26.3736807584926, "compile_time": 243.2154540438205, "verification_time": 0, "benchmark_time": 2247.9962981306016, "edp": 3649.7013728972834, "throughput_penalty": 1000000.0, "objective": 1003649.7013728973, "strategy_time": 0.15182001516222954, "framework_time": 50.660119857639074, "timestamp": "2025-02-20 07:42:06.477659+00:00"},
"32,32,4,4,250": {"block_size_x": 32, "block_size_y": 32, "tile_size_x": 4, "tile_size_y": 4, "nvml_pwr_limit": 250, "sm__warps_active.avg.pct_of_peak_sustained_active": 65.97533504853617, "dram__bytes.sum.per_second": 77326097.07232401, "time": 138.38255746023995, "times": [138.3618927001953, 138.39120483398438, 138.39234924316406, 138.3870086669922, 138.38336181640625, 138.3757781982422, 138.3863067626953], "nvml_power": 193.95, "nvml_energy": 26.839297019413536, "compile_time": 277.50035910867155, "verification_time": 0, "benchmark_time": 2242.480305954814, "edp": 3714.0905619814403, "throughput_penalty": 1000000.0, "objective": 1003714.0905619814, "strategy_time": 1.6384499613195658, "framework_time": 0.5304710939526558, "timestamp": "2025-02-20 07:42:08.999832+00:00"},
"32,32,2,32,100": {"block_size_x": 32, "block_size_y": 32, "tile_size_x": 2, "tile_size_y": 32, "nvml_pwr_limit": 100, "sm__warps_active.avg.pct_of_peak_sustained_active": 65.97508032847688, "dram__bytes.sum.per_second": 591427193.1826413, "time": 233.18298993791853, "times": [229.24131774902344, 225.86441040039062, 235.97625732421875, 243.49197387695312, 238.38400268554688, 227.1959991455078, 232.12696838378906], "nvml_power": 99.44200000000001, "nvml_energy": 23.188182885406494, "compile_time": 247.84684902988374, "verification_time": 0, "benchmark_time": 3079.983245115727, "edp": 5407.089816446357, "throughput_penalty": 1000000.0, "objective": 1005407.0898164463, "strategy_time": 0.2625999040901661, "framework_time": 55.9182520955801, "timestamp": "2025-02-20 07:42:12.383866+00:00"},
"32,32,4,4,210": {"block_size_x": 32, "block_size_y": 32, "tile_size_x": 4, "tile_size_y": 4, "nvml_pwr_limit": 210, "sm__warps_active.avg.pct_of_peak_sustained_active": 65.97356018369787, "dram__bytes.sum.per_second": 223000285.76263943, "time": 138.3879852294922, "times": [138.357666015625, 138.3987579345703, 138.39817810058594, 138.38400268554688, 138.3908233642578, 138.391845703125, 138.39462280273438], "nvml_power": 193.19, "nvml_energy": 26.735174866485597, "compile_time": 251.43118179403245, "verification_time": 0, "benchmark_time": 2247.984664980322, "edp": 3699.8269845310997, "throughput_penalty": 1000000.0, "objective": 1003699.8269845311, "strategy_time": 0.15128985978662968, "framework_time": 56.84347334317863, "timestamp": "2025-02-20 07:42:14.940301+00:00"},
"32,32,16,2,175": {"block_size_x": 32, "block_size_y": 32, "tile_size_x": 16, "tile_size_y": 2, "nvml_pwr_limit": 175, "sm__warps_active.avg.pct_of_peak_sustained_active": 65.97087938508706, "dram__bytes.sum.per_second": 21673036301.412914, "time": 146.26245335170202, "times": [145.95814514160156, 144.80975341796875, 145.089599609375, 145.31146240234375, 145.9758758544922, 148.84732055664062, 147.8450164794922], "nvml_power": 173.648, "nvml_energy": 25.39818249961635, "compile_time": 250.8742529898882, "verification_time": 0, "benchmark_time": 2232.2223789524287, "edp": 3714.800483068151, "throughput_penalty": 1000000.0, "objective": 1003714.8004830681, "strategy_time": 1.6238000243902206, "framework_time": 48.561610048636794, "timestamp": "2025-02-20 07:42:17.473606+00:00"},
"32,32,4,2,100": {"block_size_x": 32, "block_size_y": 32, "tile_size_x": 4, "tile_size_y": 2, "nvml_pwr_limit": 100, "sm__warps_active.avg.pct_of_peak_sustained_active": 65.97638828861353, "dram__bytes.sum.per_second": 79713666.39912027, "time": 222.82781982421875, "times": [218.77944946289062, 215.91171264648438, 223.4753875732422, 233.4814453125, 230.2208251953125, 218.52146911621094, 219.40444946289062], "nvml_power": 100.68, "nvml_energy": 22.434304899902347, "compile_time": 241.4411900099367, "verification_time": 0, "benchmark_time": 2953.2414339482784, "edp": 4998.987250117028, "throughput_penalty": 1000000.0, "objective": 1004998.987250117, "strategy_time": 0.26665092445909977, "framework_time": 54.6577419154346, "timestamp": "2025-02-20 07:42:20.723237+00:00"},
"32,32,4,32,250": {"block_size_x": 32, "block_size_y": 32, "tile_size_x": 4, "tile_size_y": 32, "nvml_pwr_limit": 250, "sm__warps_active.avg.pct_of_peak_sustained_active": 65.97024182292682, "dram__bytes.sum.per_second": 1141422820.0702558, "time": 138.4007306780134, "times": [138.38426208496094, 138.40762329101562, 138.40579223632812, 138.39651489257812, 138.4014129638672, 138.40467834472656, 138.4048309326172], "nvml_power": 194.751, "nvml_energy": 26.953680700273786, "compile_time": 249.26380394026637, "verification_time": 0, "benchmark_time": 2250.0347818713635, "edp": 3730.4091033797595, "throughput_penalty": 1000000.0, "objective": 1003730.4091033798, "strategy_time": 0.15244982205331326, "framework_time": 48.17189136520028, "timestamp": "2025-02-20 07:42:23.270886+00:00"},
"32,32,16,2,140": {"block_size_x": 32, "block_size_y": 32, "tile_size_x": 16, "tile_size_y": 2, "nvml_pwr_limit": 140, "sm__warps_active.avg.pct_of_peak_sustained_active": 65.97710650131566, "dram__bytes.sum.per_second": 19516009541.986618, "time": 163.3006112234933, "times": [161.9644775390625, 161.05337524414062, 161.04672241210938, 161.03237915039062, 165.86927795410156, 166.54783630371094, 165.5902099609375], "nvml_power": 138.676, "nvml_energy": 22.645875562029154, "compile_time": 247.54729494452477, "verification_time": 0, "benchmark_time": 2483.1044329330325, "edp": 3698.0853209705306, "throughput_penalty": 1000000.0, "objective": 1003698.0853209705, "strategy_time": 1.6211709007620811, "framework_time": 49.67864113859832, "timestamp": "2025-02-20 07:42:26.052863+00:00"},
"32,32,4,4,100": {"block_size_x": 32, "block_size_y": 32, "tile_size_x": 4, "tile_size_y": 4, "nvml_pwr_limit": 100, "sm__warps_active.avg.pct_of_peak_sustained_active": 65.97680639037613, "dram__bytes.sum.per_second": 123561665.51728036, "time": 223.97672598702567, "times": [219.6611785888672, 217.25625610351562, 226.06944274902344, 234.36997985839844, 230.5594940185547, 218.91644287109375, 221.00428771972656], "nvml_power": 99.612, "nvml_energy": 22.3107696290196, "compile_time": 235.889941919595, "verification_time": 0, "benchmark_time": 2965.838707983494, "edp": 4997.093135758577, "throughput_penalty": 1000000.0, "objective": 1004997.0931357585, "strategy_time": 0.26730005629360676, "framework_time": 54.768714122474194, "timestamp": "2025-02-20 07:42:29.309651+00:00"},
"32,32,4,16,210": {"block_size_x": 32, "block_size_y": 32, "tile_size_x": 4, "tile_size_y": 16, "nvml_pwr_limit": 210, "sm__warps_active.avg.pct_of_peak_sustained_active": 65.97525805816169, "dram__bytes.sum.per_second": 473266454.19586676, "time": 138.41880580357142, "times": [138.39263916015625, 138.43251037597656, 138.427001953125, 138.42063903808594, 138.4169921875, 138.41696166992188, 138.42489624023438], "nvml_power": 191.319, "nvml_energy": 26.482147507533476, "compile_time": 250.8770499844104, "verification_time": 0, "benchmark_time": 2247.6345179602504, "edp": 3665.627233106809, "throughput_penalty": 1000000.0, "objective": 1003665.6272331068, "strategy_time": 0.14847004786133766, "framework_time": 55.91504415497184, "timestamp": "2025-02-20 07:42:31.864250+00:00"},
"32,32,16,8,175": {"block_size_x": 32, "block_size_y": 32, "tile_size_x": 16, "tile_size_y": 8, "nvml_pwr_limit": 175, "sm__warps_active.avg.pct_of_peak_sustained_active": 65.97163734190813, "dram__bytes.sum.per_second": 22422926149.526516, "time": 146.23912266322546, "times": [145.83865356445312, 144.7999725341797, 144.9705352783203, 144.9439697265625, 146.11865234375, 148.63221740722656, 148.36985778808594], "nvml_power": 174.62, "nvml_energy": 25.536275599452427, "compile_time": 267.1096879057586, "verification_time": 0, "benchmark_time": 2231.303252046928, "edp": 3734.4025397502546, "throughput_penalty": 1000000.0, "objective": 1003734.4025397502, "strategy_time": 1.6349200159311295, "framework_time": 52.24927398376167, "timestamp": "2025-02-20 07:42:34.416570+00:00"},
"32,32,4,8,100": {"block_size_x": 32, "block_size_y": 32, "tile_size_x": 4, "tile_size_y": 8, "nvml_pwr_limit": 100, "sm__warps_active.avg.pct_of_peak_sustained_active": 65.97647726432689, "dram__bytes.sum.per_second": 216296105.46524101, "time": 223.0470472063337, "times": [219.84445190429688, 215.93128967285156, 224.1071319580078, 233.0893096923828, 230.89727783203125, 217.46864318847656, 219.99122619628906], "nvml_power": 99.66, "nvml_energy": 22.228868724583215, "compile_time": 243.49180818535388, "verification_time": 0, "benchmark_time": 2960.945972939953, "edp": 4958.0835317555075, "throughput_penalty": 1000000.0, "objective": 1004958.0835317555, "strategy_time": 0.2798300702124834, "framework_time": 54.20523486100137, "timestamp": "2025-02-20 07:42:37.675517+00:00"},
"32,32,8,8,140": {"block_size_x": 32, "block_size_y": 32, "tile_size_x": 8, "tile_size_y": 8, "nvml_pwr_limit": 140, "sm__warps_active.avg.pct_of_peak_sustained_active": 65.97747080138183, "dram__bytes.sum.per_second": 448623570.2941541, "time": 156.9737265450614, "times": [156.69126892089844, 154.9596405029297, 154.69570922851562, 155.23190307617188, 159.10800170898438, 159.10089111328125, 159.02867126464844], "nvml_power": 138.557, "nvml_energy": 21.74980862890407, "compile_time": 251.8612639978528, "verification_time": 0, "benchmark_time": 2393.725140951574, "edp": 3414.1485121210044, "throughput_penalty": 1000000.0, "objective": 1003414.148512121, "strategy_time": 0.15241000801324844, "framework_time": 55.424104910343885, "timestamp": "2025-02-20 07:42:40.376704+00:00"},
