experiments/data/run3/bayes_opt_float32.json
{
"device_name": "NVIDIA RTX 5000 Ada Generation",
"kernel_name": "tuned_matmul<float>",
"problem_size": [
4096,
4096
],
"tune_params_keys": [
"block_size_x",
"block_size_y",
"tile_size_x",
"tile_size_y",
"nvml_pwr_limit"
],
"tune_params": {
"block_size_x": [
32,
64,
128,
256,
512,
1024
],
"block_size_y": [
32,
64,
128,
256,
512,
1024
],
"tile_size_x": [
2,
4,
8,
16,
32
],
"tile_size_y": [
2,
4,
8,
16,
32
],
"nvml_pwr_limit": [
100,
140,
175,
210,
250
]
},
"objective": "objective",
"cache": {
"32,32,32,16,100": {"block_size_x": 32, "block_size_y": 32, "tile_size_x": 32, "tile_size_y": 16, "nvml_pwr_limit": 100, "sm__warps_active.avg.pct_of_peak_sustained_active": 66.16383621664134, "dram__bytes.sum.per_second": 15981226745.751831, "time": 81.95165361676898, "times": [86.60050964355469, 81.18732452392578, 81.17862701416016, 81.17565155029297, 81.1743392944336, 81.1732177734375, 81.17190551757812], "nvml_power": 101.667, "nvml_energy": 8.331778768256052, "compile_time": 236.78155802190304, "verification_time": 0, "benchmark_time": 1741.8761220760643, "edp": 682.8030476276701, "throughput_penalty": 1000000.0, "objective": 1000682.8030476277, "strategy_time": 47.913179034367204, "framework_time": 0, "timestamp": "2025-02-20 07:36:10.712750+00:00"},
"32,32,2,2,175": {"block_size_x": 32, "block_size_y": 32, "tile_size_x": 2, "tile_size_y": 2, "nvml_pwr_limit": 175, "sm__warps_active.avg.pct_of_peak_sustained_active": 66.075815452368, "dram__bytes.sum.per_second": 197263528.6908434, "time": 40.08629880632673, "times": [40.99382400512695, 40.1926383972168, 39.92879867553711, 39.804256439208984, 39.81574249267578, 39.92153549194336, 39.947296142578125], "nvml_power": 178.485, "nvml_energy": 7.154803042447227, "compile_time": 246.05028401128948, "verification_time": 0, "benchmark_time": 1350.8796710520983, "edp": 286.80957265995517, "throughput_penalty": 1000000.0, "objective": 1000286.8095726599, "strategy_time": 0.14059897512197495, "framework_time": 3944.6122108493, "timestamp": "2025-02-20 07:36:16.254456+00:00"},
"32,32,4,4,175": {"block_size_x": 32, "block_size_y": 32, "tile_size_x": 4, "tile_size_y": 4, "nvml_pwr_limit": 175, "sm__warps_active.avg.pct_of_peak_sustained_active": 66.06081299786739, "dram__bytes.sum.per_second": 202049155.8844101, "time": 39.80889565604074, "times": [39.892799377441406, 39.88265609741211, 39.80281448364258, 39.81123352050781, 39.87046432495117, 39.72959899902344, 39.67270278930664], "nvml_power": 176.9, "nvml_energy": 7.042193641553607, "compile_time": 246.695248875767, "verification_time": 0, "benchmark_time": 1386.472517857328, "edp": 280.3419518662411, "throughput_penalty": 1000000.0, "objective": 1000280.3419518663, "strategy_time": 0.13333000242710114, "framework_time": 0.5516002420336008, "timestamp": "2025-02-20 07:36:17.888334+00:00"},
"32,32,8,16,100": {"block_size_x": 32, "block_size_y": 32, "tile_size_x": 8, "tile_size_y": 16, "nvml_pwr_limit": 100, "sm__warps_active.avg.pct_of_peak_sustained_active": 66.02988485094086, "dram__bytes.sum.per_second": 996978975.3937433, "time": 76.54234422956195, "times": [80.74928283691406, 75.85308837890625, 75.84294128417969, 75.83999633789062, 75.8371810913086, 75.8370590209961, 75.83686065673828], "nvml_power": 100.688, "nvml_energy": 7.706895555786134, "compile_time": 267.1752190217376, "verification_time": 0, "benchmark_time": 1702.4392578750849, "edp": 589.9038525722634, "throughput_penalty": 1000000.0, "objective": 1000589.9038525723, "strategy_time": 0.1279488205909729, "framework_time": 50.25948025286198, "timestamp": "2025-02-20 07:36:19.908360+00:00"},
"32,32,16,16,100": {"block_size_x": 32, "block_size_y": 32, "tile_size_x": 16, "tile_size_y": 16, "nvml_pwr_limit": 100, "sm__warps_active.avg.pct_of_peak_sustained_active": 66.04924883465635, "dram__bytes.sum.per_second": 2098616600.790514, "time": 77.51800646100726, "times": [81.50281524658203, 76.86544036865234, 76.85379028320312, 76.85020446777344, 76.85536193847656, 76.84928131103516, 76.84915161132812], "nvml_power": 101.333, "nvml_energy": 7.855132148713249, "compile_time": 263.8276929501444, "verification_time": 0, "benchmark_time": 1643.1636468041688, "edp": 608.9141846560195, "throughput_penalty": 1000000.0, "objective": 1000608.914184656, "strategy_time": 0.12847012840211391, "framework_time": 0.5285600200295448, "timestamp": "2025-02-20 07:36:21.816033+00:00"},
"32,32,32,4,100": {"block_size_x": 32, "block_size_y": 32, "tile_size_x": 32, "tile_size_y": 4, "nvml_pwr_limit": 100, "sm__warps_active.avg.pct_of_peak_sustained_active": 66.14420224311877, "dram__bytes.sum.per_second": 11551931337.028559, "time": 79.73585946219308, "times": [82.8104019165039, 78.87379455566406, 79.38534545898438, 79.11862182617188, 79.08748626708984, 79.49878692626953, 79.37657928466797], "nvml_power": 101.219, "nvml_energy": 8.070783958903721, "compile_time": 264.1621339134872, "verification_time": 0, "benchmark_time": 1707.8802220057696, "edp": 643.5308954968693, "throughput_penalty": 1000000.0, "objective": 1000643.5308954968, "strategy_time": 0.13015000149607658, "framework_time": 0.5439100787043571, "timestamp": "2025-02-20 07:36:23.788773+00:00"},
"32,32,8,32,140": {"block_size_x": 32, "block_size_y": 32, "tile_size_x": 8, "tile_size_y": 32, "nvml_pwr_limit": 140, "sm__warps_active.avg.pct_of_peak_sustained_active": 66.07234084010994, "dram__bytes.sum.per_second": 2985351976.6675587, "time": 51.55630275181362, "times": [56.27395248413086, 51.42988967895508, 50.69660949707031, 50.62416076660156, 50.62406539916992, 50.623329162597656, 50.62211227416992], "nvml_power": 142.386, "nvml_energy": 7.340895723619734, "compile_time": 260.18217811360955, "verification_time": 0, "benchmark_time": 1473.6031899228692, "edp": 378.4694423964329, "throughput_penalty": 1000000.0, "objective": 1000378.4694423964, "strategy_time": 0.13648997992277145, "framework_time": 52.51393001526594, "timestamp": "2025-02-20 07:36:25.575233+00:00"},
"32,32,2,8,140": {"block_size_x": 32, "block_size_y": 32, "tile_size_x": 2, "tile_size_y": 8, "nvml_pwr_limit": 140, "sm__warps_active.avg.pct_of_peak_sustained_active": 66.04699556089297, "dram__bytes.sum.per_second": 611946472.0194647, "time": 49.813682556152344, "times": [50.931488037109375, 49.06729507446289, 49.71760177612305, 49.72665786743164, 49.72515106201172, 49.726593017578125, 49.80099105834961], "nvml_power": 141.614, "nvml_energy": 7.054314841506958, "compile_time": 265.03883791156113, "verification_time": 0, "benchmark_time": 1489.423569990322, "edp": 351.4014001659817, "throughput_penalty": 1000000.0, "objective": 1000351.401400166, "strategy_time": 0.12940890155732632, "framework_time": 0.5315202288329601, "timestamp": "2025-02-20 07:36:27.330379+00:00"},
"32,32,2,32,100": {"block_size_x": 32, "block_size_y": 32, "tile_size_x": 2, "tile_size_y": 32, "nvml_pwr_limit": 100, "sm__warps_active.avg.pct_of_peak_sustained_active": 66.06591757878765, "dram__bytes.sum.per_second": 1833240884.498421, "time": 79.79000636509487, "times": [84.62319946289062, 78.9846420288086, 79.02963256835938, 78.98095703125, 78.97510528564453, 78.96697235107422, 78.96953582763672], "nvml_power": 101.909, "nvml_energy": 8.131319758660453, "compile_time": 271.6079358942807, "verification_time": 0, "benchmark_time": 1684.3993121292442, "edp": 648.7980553001393, "throughput_penalty": 1000000.0, "objective": 1000648.7980553001, "strategy_time": 0.1277499832212925, "framework_time": 50.987971015274525, "timestamp": "2025-02-20 07:36:29.337526+00:00"},
"32,32,32,8,210": {"block_size_x": 32, "block_size_y": 32, "tile_size_x": 32, "tile_size_y": 8, "nvml_pwr_limit": 210, "sm__warps_active.avg.pct_of_peak_sustained_active": 66.31827761934048, "dram__bytes.sum.per_second": 19166169750.347374, "time": 37.21563393729074, "times": [37.803009033203125, 37.237152099609375, 37.15315246582031, 37.11238479614258, 37.09193420410156, 37.05215835571289, 37.05964660644531], "nvml_power": 213.791, "nvml_energy": 7.956367595087325, "compile_time": 266.7862311936915, "verification_time": 0, "benchmark_time": 1345.07284197025, "edp": 296.10126388929217, "throughput_penalty": 1000000.0, "objective": 1000296.1012638893, "strategy_time": 0.1315500121563673, "framework_time": 57.84656689502299, "timestamp": "2025-02-20 07:36:31.007389+00:00"},
"32,32,8,2,210": {"block_size_x": 32, "block_size_y": 32, "tile_size_x": 8, "tile_size_y": 2, "nvml_pwr_limit": 210, "sm__warps_active.avg.pct_of_peak_sustained_active": 66.0677060423539, "dram__bytes.sum.per_second": 375491178.90253985, "time": 36.94026511056082, "times": [36.91561508178711, 37.16495895385742, 36.985408782958984, 36.99833679199219, 36.883296966552734, 36.80710220336914, 36.8271369934082], "nvml_power": 211.966, "nvml_energy": 7.830080234425136, "compile_time": 268.2308219373226, "verification_time": 0, "benchmark_time": 1360.483932076022, "edp": 289.24523969662675, "throughput_penalty": 1000000.0, "objective": 1000289.2452396966, "strategy_time": 0.24753902107477188, "framework_time": 0.9438700508326292, "timestamp": "2025-02-20 07:36:32.637328+00:00"},
"32,32,32,2,175": {"block_size_x": 32, "block_size_y": 32, "tile_size_x": 32, "tile_size_y": 2, "nvml_pwr_limit": 175, "sm__warps_active.avg.pct_of_peak_sustained_active": 66.30727455404593, "dram__bytes.sum.per_second": 15661855362.618721, "time": 40.59424427577427, "times": [41.83103942871094, 40.492225646972656, 40.36991882324219, 40.36713409423828, 40.3671989440918, 40.36579132080078, 40.36640167236328], "nvml_power": 175.554, "nvml_energy": 7.1264819595892765, "compile_time": 262.50441605225205, "verification_time": 0, "benchmark_time": 1367.8361980710179, "edp": 289.2941494944656, "throughput_penalty": 1000000.0, "objective": 1000289.2941494945, "strategy_time": 0.13042986392974854, "framework_time": 57.59365810081363, "timestamp": "2025-02-20 07:36:34.325417+00:00"},
"32,32,8,16,250": {"block_size_x": 32, "block_size_y": 32, "tile_size_x": 8, "tile_size_y": 16, "nvml_pwr_limit": 250, "sm__warps_active.avg.pct_of_peak_sustained_active": 66.09056793837708, "dram__bytes.sum.per_second": 1505579141.7137609, "time": 34.62412370954241, "times": [35.17536163330078, 34.75468826293945, 34.64089584350586, 34.36383819580078, 34.36336135864258, 34.36735916137695, 34.70336151123047], "nvml_power": 252.052, "nvml_energy": 8.727079629237583, "compile_time": 250.3433250822127, "verification_time": 0, "benchmark_time": 1327.819345984608, "edp": 302.1674847057496, "throughput_penalty": 1000000.0, "objective": 1000302.1674847058, "strategy_time": 0.13056001625955105, "framework_time": 54.95883012190461, "timestamp": "2025-02-20 07:36:35.958694+00:00"},
"32,32,4,32,175": {"block_size_x": 32, "block_size_y": 32, "tile_size_x": 4, "tile_size_y": 32, "nvml_pwr_limit": 175, "sm__warps_active.avg.pct_of_peak_sustained_active": 66.06176129318278, "dram__bytes.sum.per_second": 1486343561.344556, "time": 40.91074316842215, "times": [43.03203201293945, 41.281471252441406, 40.39606475830078, 40.41667175292969, 40.41622543334961, 40.395423889160156, 40.437313079833984], "nvml_power": 176.329, "nvml_energy": 7.2137504321447095, "compile_time": 260.19569113850594, "verification_time": 0, "benchmark_time": 1374.9086398165673, "edp": 295.1198912105665, "throughput_penalty": 1000000.0, "objective": 1000295.1198912106, "strategy_time": 0.12831995263695717, "framework_time": 51.015333039686084, "timestamp": "2025-02-20 07:36:37.644966+00:00"},
"32,32,4,2,175": {"block_size_x": 32, "block_size_y": 32, "tile_size_x": 4, "tile_size_y": 2, "nvml_pwr_limit": 175, "sm__warps_active.avg.pct_of_peak_sustained_active": 66.06682804970083, "dram__bytes.sum.per_second": 185718940.92930028, "time": 40.46480451311384, "times": [41.542945861816406, 40.46985626220703, 40.362815856933594, 40.360862731933594, 40.30070495605469, 40.082271575927734, 40.13417434692383], "nvml_power": 176.341, "nvml_energy": 7.135604092647008, "compile_time": 250.37496793083847, "verification_time": 0, "benchmark_time": 1356.674448121339, "edp": 288.74082469193627, "throughput_penalty": 1000000.0, "objective": 1000288.740824692, "strategy_time": 0.1289199572056532, "framework_time": 0.5765799432992935, "timestamp": "2025-02-20 07:36:39.252745+00:00"},
"32,32,2,16,140": {"block_size_x": 32, "block_size_y": 32, "tile_size_x": 2, "tile_size_y": 16, "nvml_pwr_limit": 140, "sm__warps_active.avg.pct_of_peak_sustained_active": 66.06811749645706, "dram__bytes.sum.per_second": 1006034342.8471352, "time": 51.585055759974885, "times": [54.54249572753906, 51.3197135925293, 51.04671859741211, 51.047550201416016, 51.04467010498047, 51.042945861816406, 51.05129623413086], "nvml_power": 141.836, "nvml_energy": 7.316617968771799, "compile_time": 267.5517010502517, "verification_time": 0, "benchmark_time": 1481.648572953418, "edp": 377.4281458935274, "throughput_penalty": 1000000.0, "objective": 1000377.4281458935, "strategy_time": 0.1428700052201748, "framework_time": 58.42795898206532, "timestamp": "2025-02-20 07:36:41.060540+00:00"},
"32,32,16,4,140": {"block_size_x": 32, "block_size_y": 32, "tile_size_x": 16, "tile_size_y": 4, "nvml_pwr_limit": 140, "sm__warps_active.avg.pct_of_peak_sustained_active": 66.05727481763783, "dram__bytes.sum.per_second": 1085441127.5731182, "time": 50.54296657017299, "times": [53.52912139892578, 51.05487823486328, 50.370880126953125, 49.84572982788086, 49.54828643798828, 49.72719955444336, 49.72467041015625], "nvml_power": 141.052, "nvml_energy": 7.129186520656041, "compile_time": 267.5498330499977, "verification_time": 0, "benchmark_time": 1459.5677331089973, "edp": 360.3302359860462, "throughput_penalty": 1000000.0, "objective": 1000360.330235986, "strategy_time": 0.12847990728914738, "framework_time": 0.542348949238658, "timestamp": "2025-02-20 07:36:42.788352+00:00"},
"32,32,2,16,175": {"block_size_x": 32, "block_size_y": 32, "tile_size_x": 2, "tile_size_y": 16, "nvml_pwr_limit": 175, "sm__warps_active.avg.pct_of_peak_sustained_active": 66.07416420848486, "dram__bytes.sum.per_second": 843403016.3585284, "time": 40.68189675467355, "times": [42.25632095336914, 40.71100616455078, 40.36604690551758, 40.36012649536133, 40.36064147949219, 40.35878372192383, 40.3603515625], "nvml_power": 177.601, "nvml_energy": 7.225145545526778, "compile_time": 248.45002288930118, "verification_time": 0, "benchmark_time": 1371.7720780987293, "edp": 293.9326251206099, "throughput_penalty": 1000000.0, "objective": 1000293.9326251206, "strategy_time": 0.12967991642653942, "framework_time": 52.99125425517559, "timestamp": "2025-02-20 07:36:44.461719+00:00"},
"32,32,16,16,210": {"block_size_x": 32, "block_size_y": 32, "tile_size_x": 16, "tile_size_y": 16, "nvml_pwr_limit": 210, "sm__warps_active.avg.pct_of_peak_sustained_active": 66.10554363695972, "dram__bytes.sum.per_second": 2359092233.2377954, "time": 37.16810553414481, "times": [37.71564865112305, 37.11439895629883, 37.12460708618164, 37.11404800415039, 37.06147384643555, 37.01750564575195, 37.029056549072266], "nvml_power": 213.829, "nvml_energy": 7.94761883826065, "compile_time": 250.45513384975493, "verification_time": 0, "benchmark_time": 1341.5320911444724, "edp": 295.39793572562917, "throughput_penalty": 1000000.0, "objective": 1000295.3979357256, "strategy_time": 0.13015000149607658, "framework_time": 56.49390094913542, "timestamp": "2025-02-20 07:36:46.110354+00:00"},
"32,32,2,32,250": {"block_size_x": 32, "block_size_y": 32, "tile_size_x": 2, "tile_size_y": 32, "nvml_pwr_limit": 250, "sm__warps_active.avg.pct_of_peak_sustained_active": 66.0652332691735, "dram__bytes.sum.per_second": 2427856122.2354927, "time": 35.1674793788365, "times": [35.59990310668945, 35.288448333740234, 35.074241638183594, 35.0316162109375, 35.069664001464844, 35.06099319458008, 35.047489166259766], "nvml_power": 251.368, "nvml_energy": 8.839978956499372, "compile_time": 252.67203501425683, "verification_time": 0, "benchmark_time": 1341.636179946363, "edp": 310.8797776620402, "throughput_penalty": 1000000.0, "objective": 1000310.879777662, "strategy_time": 0.1276999246329069, "framework_time": 54.98000211082399, "timestamp": "2025-02-20 07:36:47.759794+00:00"},
"32,32,32,2,210": {"block_size_x": 32, "block_size_y": 32, "tile_size_x": 32, "tile_size_y": 2, "nvml_pwr_limit": 210, "sm__warps_active.avg.pct_of_peak_sustained_active": 66.3065543379036, "dram__bytes.sum.per_second": 16451058561.808, "time": 37.376991271972656, "times": [37.679073333740234, 37.36867141723633, 37.38185501098633, 37.37004852294922, 37.30207824707031, 37.2756462097168, 37.261566162109375], "nvml_power": 213.175, "nvml_energy": 7.9678401144027715, "compile_time": 268.8854190055281, "verification_time": 0, "benchmark_time": 1341.9909479562193, "edp": 297.813890412506, "throughput_penalty": 1000000.0, "objective": 1000297.8138904124, "strategy_time": 1.8324898555874825, "framework_time": 45.69626529701054, "timestamp": "2025-02-20 07:36:49.418224+00:00"},
"32,32,16,4,210": {"block_size_x": 32, "block_size_y": 32, "tile_size_x": 16, "tile_size_y": 4, "nvml_pwr_limit": 210, "sm__warps_active.avg.pct_of_peak_sustained_active": 66.08831619046909, "dram__bytes.sum.per_second": 871531450.433217, "time": 36.61476080758231, "times": [34.062015533447266, 37.179710388183594, 37.063743591308594, 37.00172805786133, 36.998817443847656, 36.99919891357422, 36.998111724853516], "nvml_power": 210.72, "nvml_energy": 7.715462397373744, "compile_time": 236.67823593132198, "verification_time": 0, "benchmark_time": 1366.4717329666018, "edp": 282.4998101997352, "throughput_penalty": 1000000.0, "objective": 1000282.4998101997, "strategy_time": 0.2808389253914356, "framework_time": 0.5177701823413372, "timestamp": "2025-02-20 07:36:51.022197+00:00"},
"32,32,32,2,250": {"block_size_x": 32, "block_size_y": 32, "tile_size_x": 32, "tile_size_y": 2, "nvml_pwr_limit": 250, "sm__warps_active.avg.pct_of_peak_sustained_active": 66.30584161957167, "dram__bytes.sum.per_second": 15298652069.95831, "time": 35.121416909354075, "times": [35.599422454833984, 35.47846221923828, 34.88083267211914, 34.89574432373047, 35.08099365234375, 34.99862289428711, 34.91584014892578], "nvml_power": 253.171, "nvml_energy": 8.89172424035808, "compile_time": 240.02678506076336, "verification_time": 0, "benchmark_time": 1334.1765271034092, "edp": 312.2899540886258, "throughput_penalty": 1000000.0, "objective": 1000312.2899540886, "strategy_time": 0.16186991706490517, "framework_time": 50.08486704900861, "timestamp": "2025-02-20 07:36:52.646670+00:00"},
"32,32,4,16,210": {"block_size_x": 32, "block_size_y": 32, "tile_size_x": 4, "tile_size_y": 16, "nvml_pwr_limit": 210, "sm__warps_active.avg.pct_of_peak_sustained_active": 66.08578380382036, "dram__bytes.sum.per_second": 1182728546.082734, "time": 37.2983638218471, "times": [37.819679260253906, 37.16444778442383, 37.142337799072266, 37.26019287109375, 37.23612976074219, 37.233726501464844, 37.232032775878906], "nvml_power": 215.471, "nvml_energy": 8.036715751057216, "compile_time": 270.1325330417603, "verification_time": 0, "benchmark_time": 1342.581921024248, "edp": 299.7563480157012, "throughput_penalty": 1000000.0, "objective": 1000299.7563480157, "strategy_time": 1.6219289973378181, "framework_time": 45.274428091943264, "timestamp": "2025-02-20 07:36:54.306304+00:00"},
"32,32,16,2,175": {"block_size_x": 32, "block_size_y": 32, "tile_size_x": 16, "tile_size_y": 2, "nvml_pwr_limit": 175, "sm__warps_active.avg.pct_of_peak_sustained_active": 66.08149854304065, "dram__bytes.sum.per_second": 968761429.7740997, "time": 40.383292061941965, "times": [41.1798095703125, 40.12374496459961, 40.121376037597656, 40.2151985168457, 40.34979248046875, 40.34467315673828, 40.34844970703125], "nvml_power": 175.897, "nvml_energy": 7.103299923819406, "compile_time": 254.47368202731013, "verification_time": 0, "benchmark_time": 1364.4537290092558, "edp": 286.85463542716917, "throughput_penalty": 1000000.0, "objective": 1000286.8546354271, "strategy_time": 0.27482002042233944, "framework_time": 52.606724901124835, "timestamp": "2025-02-20 07:36:55.978136+00:00"},
"32,32,4,8,210": {"block_size_x": 32, "block_size_y": 32, "tile_size_x": 4, "tile_size_y": 8, "nvml_pwr_limit": 210, "sm__warps_active.avg.pct_of_peak_sustained_active": 66.07637096667752, "dram__bytes.sum.per_second": 436924040.0628665, "time": 37.55570765904018, "times": [38.595489501953125, 38.109249114990234, 37.23961639404297, 37.251678466796875, 37.2309455871582, 37.233726501464844, 37.229248046875], "nvml_power": 215.1945, "nvml_energy": 8.081781731833322, "compile_time": 256.9211421068758, "verification_time": 0, "benchmark_time": 1342.8987569641322, "edp": 303.5170320849037, "throughput_penalty": 1000000.0, "objective": 1000303.5170320849, "strategy_time": 0.15720981173217297, "framework_time": 49.23141817562282, "timestamp": "2025-02-20 07:36:57.627369+00:00"},
"32,32,8,32,210": {"block_size_x": 32, "block_size_y": 32, "tile_size_x": 8, "tile_size_y": 32, "nvml_pwr_limit": 210, "sm__warps_active.avg.pct_of_peak_sustained_active": 66.07227606075085, "dram__bytes.sum.per_second": 2243476852.958993, "time": 37.57676805768694, "times": [37.859649658203125, 37.54252624511719, 37.53318405151367, 37.51958465576172, 37.52924728393555, 37.5269775390625, 37.526206970214844], "nvml_power": 216.657, "nvml_energy": 8.14126983707428, "compile_time": 260.9495010692626, "verification_time": 0, "benchmark_time": 1355.214280076325, "edp": 305.92260836278297, "throughput_penalty": 1000000.0, "objective": 1000305.9226083627, "strategy_time": 1.5817400999367237, "framework_time": 0.5262999329715967, "timestamp": "2025-02-20 07:36:59.245663+00:00"},
"32,32,8,4,175": {"block_size_x": 32, "block_size_y": 32, "tile_size_x": 8, "tile_size_y": 4, "nvml_pwr_limit": 175, "sm__warps_active.avg.pct_of_peak_sustained_active": 66.07682349656532, "dram__bytes.sum.per_second": 392632859.1884367, "time": 40.51270457676479, "times": [41.39779281616211, 40.40108871459961, 40.35753631591797, 40.35808181762695, 40.359649658203125, 40.36284637451172, 40.35193634033203], "nvml_power": 177.867, "nvml_energy": 7.205873224955423, "compile_time": 255.46131609007716, "verification_time": 0, "benchmark_time": 1373.3108998276293, "edp": 291.9294131802384, "throughput_penalty": 1000000.0, "objective": 1000291.9294131802, "strategy_time": 0.290790107101202, "framework_time": 51.75159592181444, "timestamp": "2025-02-20 07:37:00.926502+00:00"},
"32,32,16,4,175": {"block_size_x": 32, "block_size_y": 32, "tile_size_x": 16, "tile_size_y": 4, "nvml_pwr_limit": 175, "sm__warps_active.avg.pct_of_peak_sustained_active": 66.071939104214, "dram__bytes.sum.per_second": 657887813.2093056, "time": 40.30993815830776, "times": [40.27657699584961, 40.14748764038086, 40.32255935668945, 40.3559684753418, 40.354976654052734, 40.356990814208984, 40.35500717163086], "nvml_power": 180.176, "nvml_energy": 7.262883417611258, "compile_time": 239.4446050748229, "verification_time": 0, "benchmark_time": 1380.9336749836802, "edp": 292.7663814149087, "throughput_penalty": 1000000.0, "objective": 1000292.766381415, "strategy_time": 0.16168877482414246, "framework_time": 0.5509702023118734, "timestamp": "2025-02-20 07:37:02.547618+00:00"},
"32,32,2,2,210": {"block_size_x": 32, "block_size_y": 32, "tile_size_x": 2, "tile_size_y": 2, "nvml_pwr_limit": 210, "sm__warps_active.avg.pct_of_peak_sustained_active": 66.06950136710775, "dram__bytes.sum.per_second": 729507.1617962711, "time": 37.77625111171177, "times": [38.64134216308594, 38.38195037841797, 37.484161376953125, 37.4813117980957, 37.4813117980957, 37.480289459228516, 37.48339080810547], "nvml_power": 215.362, "nvml_energy": 8.13556899192047, "compile_time": 254.78132884018123, "verification_time": 0, "benchmark_time": 1351.99737502262, "edp": 307.33129717544347, "throughput_penalty": 1000000.0, "objective": 1000307.3312971755, "strategy_time": 1.5903091989457607, "framework_time": 50.527828047052026, "timestamp": "2025-02-20 07:37:04.206539+00:00"},
"32,32,2,4,175": {"block_size_x": 32, "block_size_y": 32, "tile_size_x": 2, "tile_size_y": 4, "nvml_pwr_limit": 175, "sm__warps_active.avg.pct_of_peak_sustained_active": 66.07038800262653, "dram__bytes.sum.per_second": 1016926.5739612386, "time": 40.90637806483677, "times": [42.329185485839844, 40.77667236328125, 40.665889739990234, 40.544193267822266, 40.73871994018555, 40.638912200927734, 40.65107345581055], "nvml_power": 178.327, "nvml_energy": 7.294711681168147, "compile_time": 244.79470495134592, "verification_time": 0, "benchmark_time": 1390.886367065832, "edp": 298.4002339038453, "throughput_penalty": 1000000.0, "objective": 1000298.4002339039, "strategy_time": 0.2928399480879307, "framework_time": 45.099551090970635, "timestamp": "2025-02-20 07:37:05.887639+00:00"},
"32,32,2,4,210": {"block_size_x": 32, "block_size_y": 32, "tile_size_x": 2, "tile_size_y": 4, "nvml_pwr_limit": 210, "sm__warps_active.avg.pct_of_peak_sustained_active": 66.07093954396696, "dram__bytes.sum.per_second": 7514.721809695307, "time": 37.570075443812776, "times": [38.062625885009766, 37.48988723754883, 37.494014739990234, 37.4826545715332, 37.488128662109375, 37.49164962768555, 37.4815673828125], "nvml_power": 215.366, "nvml_energy": 8.091316868032182, "compile_time": 243.76768595539033, "verification_time": 0, "benchmark_time": 1352.4588618893176, "edp": 303.99138517176397, "throughput_penalty": 1000000.0, "objective": 1000303.9913851718, "strategy_time": 0.15585008077323437, "framework_time": 54.60029700770974, "timestamp": "2025-02-20 07:37:07.538654+00:00"},
"32,32,16,8,250": {"block_size_x": 32, "block_size_y": 32, "tile_size_x": 16, "tile_size_y": 8, "nvml_pwr_limit": 250, "sm__warps_active.avg.pct_of_peak_sustained_active": 66.0846062949501, "dram__bytes.sum.per_second": 477409844.8333214, "time": 34.8382944379534, "times": [34.05238342285156, 34.53046417236328, 35.114078521728516, 35.03529739379883, 35.019264221191406, 35.05206298828125, 35.064510345458984], "nvml_power": 252.035, "nvml_energy": 8.780469538669585, "compile_time": 256.6651329398155, "verification_time": 0, "benchmark_time": 1329.5522690750659, "edp": 305.8965830916519, "throughput_penalty": 1000000.0, "objective": 1000305.8965830917, "strategy_time": 1.576548907905817, "framework_time": 47.35005018301308, "timestamp": "2025-02-20 07:37:09.173822+00:00"},
"32,32,16,8,210": {"block_size_x": 32, "block_size_y": 32, "tile_size_x": 16, "tile_size_y": 8, "nvml_pwr_limit": 210, "sm__warps_active.avg.pct_of_peak_sustained_active": 66.08524803897156, "dram__bytes.sum.per_second": 246300341.4058562, "time": 37.46151787894113, "times": [37.88700866699219, 37.3985595703125, 37.374977111816406, 37.37712097167969, 37.34284973144531, 37.35139083862305, 37.49871826171875], "nvml_power": 212.839, "nvml_energy": 7.973272003835951, "compile_time": 244.07599889673293, "verification_time": 0, "benchmark_time": 1349.178828066215, "edp": 298.69087172536126, "throughput_penalty": 1000000.0, "objective": 1000298.6908717253, "strategy_time": 0.29905978590250015, "framework_time": 45.9162222687155, "timestamp": "2025-02-20 07:37:10.813315+00:00"},
"32,32,4,16,175": {"block_size_x": 32, "block_size_y": 32, "tile_size_x": 4, "tile_size_y": 16, "nvml_pwr_limit": 175, "sm__warps_active.avg.pct_of_peak_sustained_active": 66.07221657248714, "dram__bytes.sum.per_second": 787644304.2787064, "time": 41.046652112688335, "times": [42.8502082824707, 41.034976959228516, 40.6864013671875, 40.67113494873047, 40.65913772583008, 40.64147186279297, 40.783233642578125], "nvml_power": 177.879, "nvml_energy": 7.301337431152888, "compile_time": 242.29846196249127, "verification_time": 0, "benchmark_time": 1402.7378549799323, "edp": 299.6954574938821, "throughput_penalty": 1000000.0, "objective": 1000299.6954574939, "strategy_time": 0.15866989269852638, "framework_time": 48.25357114896178, "timestamp": "2025-02-20 07:37:12.506787+00:00"},
"32,32,32,32,250": {"block_size_x": 32, "block_size_y": 32, "tile_size_x": 32, "tile_size_y": 32, "nvml_pwr_limit": 250, "sm__warps_active.avg.pct_of_peak_sustained_active": 66.32576247303199, "dram__bytes.sum.per_second": 33673970138.247482, "time": 35.811821528843474, "times": [34.519840240478516, 35.93596649169922, 36.058719635009766, 36.052833557128906, 36.033729553222656, 36.036991119384766, 36.04467010498047], "nvml_power": 251.829, "nvml_energy": 9.018455203787124, "compile_time": 267.9562319535762, "verification_time": 0, "benchmark_time": 1329.5492029283196, "edp": 322.9673082238942, "throughput_penalty": 1000000.0, "objective": 1000322.967308224, "strategy_time": 1.6624887939542532, "framework_time": 47.35079244710505, "timestamp": "2025-02-20 07:37:14.153329+00:00"},
"32,32,32,16,250": {"block_size_x": 32, "block_size_y": 32, "tile_size_x": 32, "tile_size_y": 16, "nvml_pwr_limit": 250, "sm__warps_active.avg.pct_of_peak_sustained_active": 66.32913338528776, "dram__bytes.sum.per_second": 22746268601.74879, "time": 35.68754250662668, "times": [36.00476837158203, 35.764225006103516, 35.60172653198242, 35.623905181884766, 35.68899154663086, 35.56137466430664, 35.567806243896484], "nvml_power": 256.123, "nvml_energy": 9.140400449424742, "compile_time": 241.55823490582407, "verification_time": 0, "benchmark_time": 1357.0526689291, "edp": 326.1984295664351, "throughput_penalty": 1000000.0, "objective": 1000326.1984295665, "strategy_time": 0.28446014039218426, "framework_time": 0.5087398458272219, "timestamp": "2025-02-20 07:37:15.752756+00:00"},
"32,32,16,2,210": {"block_size_x": 32, "block_size_y": 32, "tile_size_x": 16, "tile_size_y": 2, "nvml_pwr_limit": 210, "sm__warps_active.avg.pct_of_peak_sustained_active": 66.08867480506512, "dram__bytes.sum.per_second": 656577311.3562611, "time": 37.62275641305106, "times": [38.03619384765625, 37.70307159423828, 37.65961456298828, 37.485694885253906, 37.501407623291016, 37.48179244995117, 37.491519927978516], "nvml_power": 213.601, "nvml_energy": 8.03625839258412, "compile_time": 240.5828759074211, "verification_time": 0, "benchmark_time": 1354.8423778265715, "edp": 302.34619197652955, "throughput_penalty": 1000000.0, "objective": 1000302.3461919766, "strategy_time": 0.17229001969099045, "framework_time": 47.950702253729105, "timestamp": "2025-02-20 07:37:17.396330+00:00"},
"32,32,32,4,210": {"block_size_x": 32, "block_size_y": 32, "tile_size_x": 32, "tile_size_y": 4, "nvml_pwr_limit": 210, "sm__warps_active.avg.pct_of_peak_sustained_active": 66.32044695520145, "dram__bytes.sum.per_second": 16892612125.150211, "time": 37.345955984933035, "times": [34.18694305419922, 37.47200012207031, 38.2523193359375, 37.938846588134766, 37.8201904296875, 37.9477424621582, 37.80364990234375], "nvml_power": 214.519, "nvml_energy": 8.01141713193185, "compile_time": 251.77621422335505, "verification_time": 0, "benchmark_time": 1357.8661628998816, "edp": 299.1940315860653, "throughput_penalty": 1000000.0, "objective": 1000299.194031586, "strategy_time": 1.6928589902818203, "framework_time": 0.5356299225240946, "timestamp": "2025-02-20 07:37:19.008225+00:00"},
"32,32,8,4,210": {"block_size_x": 32, "block_size_y": 32, "tile_size_x": 8, "tile_size_y": 4, "nvml_pwr_limit": 210, "sm__warps_active.avg.pct_of_peak_sustained_active": 66.08320400777325, "dram__bytes.sum.per_second": 516218766.1457592, "time": 37.87636620657785, "times": [38.91984176635742, 38.1973762512207, 37.69193649291992, 37.666622161865234, 37.67961502075195, 37.49296188354492, 37.486209869384766], "nvml_power": 214.079, "nvml_energy": 8.108534601137979, "compile_time": 231.97784298099577, "verification_time": 0, "benchmark_time": 1355.1240330561996, "edp": 307.12182595140973, "throughput_penalty": 1000000.0, "objective": 1000307.1218259514, "strategy_time": 0.28317002579569817, "framework_time": 0.5154798272997141, "timestamp": "2025-02-20 07:37:20.596150+00:00"},
"32,32,8,2,175": {"block_size_x": 32, "block_size_y": 32, "tile_size_x": 8, "tile_size_y": 2, "nvml_pwr_limit": 175, "sm__warps_active.avg.pct_of_peak_sustained_active": 66.06484106025083, "dram__bytes.sum.per_second": 3670.0345350249745, "time": 41.117152622767854, "times": [42.46422576904297, 41.00454330444336, 40.922080993652344, 40.92851257324219, 40.79487991333008, 40.78547286987305, 40.920352935791016], "nvml_power": 179.568, "nvml_energy": 7.383324862165178, "compile_time": 239.75628102198243, "verification_time": 0, "benchmark_time": 1394.696346949786, "edp": 303.58129522112205, "throughput_penalty": 1000000.0, "objective": 1000303.5812952211, "strategy_time": 0.158409820869565, "framework_time": 63.19711613468826, "timestamp": "2025-02-20 07:37:22.293981+00:00"},
"32,32,2,16,210": {"block_size_x": 32, "block_size_y": 32, "tile_size_x": 2, "tile_size_y": 16, "nvml_pwr_limit": 210, "sm__warps_active.avg.pct_of_peak_sustained_active": 66.07571050381708, "dram__bytes.sum.per_second": 801873499.5615988, "time": 37.859336853027344, "times": [38.488319396972656, 37.86457443237305, 37.733760833740234, 37.73129653930664, 37.73148727416992, 37.737953186035156, 37.72796630859375], "nvml_power": 214.018, "nvml_energy": 8.102579554611205, "compile_time": 250.17177895642817, "verification_time": 0, "benchmark_time": 1366.3284650538117, "edp": 306.7582887364779, "throughput_penalty": 1000000.0, "objective": 1000306.7582887365, "strategy_time": 1.5780990943312645, "framework_time": 49.349100794643164, "timestamp": "2025-02-20 07:37:23.961431+00:00"},
"32,32,2,32,210": {"block_size_x": 32, "block_size_y": 32, "tile_size_x": 2, "tile_size_y": 32, "nvml_pwr_limit": 210, "sm__warps_active.avg.pct_of_peak_sustained_active": 66.06670765859477, "dram__bytes.sum.per_second": 1212665368.876882, "time": 38.18082700456892, "times": [38.64371109008789, 38.259422302246094, 38.25900650024414, 38.15126419067383, 38.03023910522461, 37.948097229003906, 37.97404861450195], "nvml_power": 212.606, "nvml_energy": 8.11747290613338, "compile_time": 238.5431551374495, "verification_time": 0, "benchmark_time": 1375.44273911044, "edp": 309.9318287433539, "throughput_penalty": 1000000.0, "objective": 1000309.9318287433, "strategy_time": 0.2791900187730789, "framework_time": 0.5424197297543287, "timestamp": "2025-02-20 07:37:25.576263+00:00"},
"32,32,4,8,175": {"block_size_x": 32, "block_size_y": 32, "tile_size_x": 4, "tile_size_y": 8, "nvml_pwr_limit": 175, "sm__warps_active.avg.pct_of_peak_sustained_active": 66.070139416517, "dram__bytes.sum.per_second": 726633114.9246927, "time": 41.35250309535435, "times": [43.05305480957031, 41.32195281982422, 40.841697692871094, 40.93247985839844, 40.932064056396484, 41.167518615722656, 41.218753814697266], "nvml_power": 179.313, "nvml_energy": 7.415041387537274, "compile_time": 243.58267383649945, "verification_time": 0, "benchmark_time": 1411.5132139995694, "edp": 306.63052193031575, "throughput_penalty": 1000000.0, "objective": 1000306.6305219303, "strategy_time": 0.15746918506920338, "framework_time": 52.748341811820865, "timestamp": "2025-02-20 07:37:27.284289+00:00"},
"32,32,4,2,210": {"block_size_x": 32, "block_size_y": 32, "tile_size_x": 4, "tile_size_y": 2, "nvml_pwr_limit": 210, "sm__warps_active.avg.pct_of_peak_sustained_active": 66.06804157076392, "dram__bytes.sum.per_second": 286847.84025928064, "time": 37.357530866350444, "times": [34.834590911865234, 37.795902252197266, 37.82387161254883, 37.79248046875, 37.72409439086914, 37.73660659790039, 37.795169830322266], "nvml_power": 214.73, "nvml_energy": 8.021782602931431, "compile_time": 251.66197190992534, "verification_time": 0, "benchmark_time": 1356.381641002372, "edp": 299.67399119216395, "throughput_penalty": 1000000.0, "objective": 1000299.6739911921, "strategy_time": 1.654159976169467, "framework_time": 50.78174313530326, "timestamp": "2025-02-20 07:37:28.944792+00:00"},
"32,32,8,2,250": {"block_size_x": 32, "block_size_y": 32, "tile_size_x": 8, "tile_size_y": 2, "nvml_pwr_limit": 250, "sm__warps_active.avg.pct_of_peak_sustained_active": 66.07268186963266, "dram__bytes.sum.per_second": 285907179.93985546, "time": 35.53541019984654, "times": [36.36697769165039, 36.144351959228516, 35.20915222167969, 35.20569610595703, 35.2022705078125, 35.21100616455078, 35.408416748046875], "nvml_power": 248.2905, "nvml_energy": 8.823104766224997, "compile_time": 236.7512488272041, "verification_time": 0, "benchmark_time": 1353.1689101364464, "edp": 313.53264710402635, "throughput_penalty": 1000000.0, "objective": 1000313.532647104, "strategy_time": 0.29209000058472157, "framework_time": 55.71854091249406, "timestamp": "2025-02-20 07:37:30.590748+00:00"},
"32,32,8,32,175": {"block_size_x": 32, "block_size_y": 32, "tile_size_x": 8, "tile_size_y": 32, "nvml_pwr_limit": 175, "sm__warps_active.avg.pct_of_peak_sustained_active": 66.04569518569042, "dram__bytes.sum.per_second": 2116836382.5861607, "time": 42.043816157749724, "times": [43.84028625488281, 42.65039825439453, 41.576927185058594, 41.56060791015625, 41.55990219116211, 41.5590705871582, 41.55952072143555], "nvml_power": 177.896, "nvml_energy": 7.479426719199044, "compile_time": 240.5359090771526, "verification_time": 0, "benchmark_time": 1387.929457006976, "edp": 314.4636419473658, "throughput_penalty": 1000000.0, "objective": 1000314.4636419474, "strategy_time": 0.15965010970830917, "framework_time": 76.86467375606298, "timestamp": "2025-02-20 07:37:32.296262+00:00"},
"32,32,4,32,250": {"block_size_x": 32, "block_size_y": 32, "tile_size_x": 4, "tile_size_y": 32, "nvml_pwr_limit": 250, "sm__warps_active.avg.pct_of_peak_sustained_active": 66.06988125537508, "dram__bytes.sum.per_second": 2637276306.6700606, "time": 36.1109858921596, "times": [36.680416107177734, 36.551841735839844, 35.96316909790039, 35.95881652832031, 35.8818244934082, 35.878047943115234, 35.86278533935547], "nvml_power": 252.392, "nvml_energy": 9.114123951293944, "compile_time": 256.94899493828416, "verification_time": 0, "benchmark_time": 1328.1549839302897, "edp": 329.1200014245695, "throughput_penalty": 1000000.0, "objective": 1000329.1200014246, "strategy_time": 1.6464600339531898, "framework_time": 41.3590760435909, "timestamp": "2025-02-20 07:37:33.924398+00:00"},
"32,32,8,32,250": {"block_size_x": 32, "block_size_y": 32, "tile_size_x": 8, "tile_size_y": 32, "nvml_pwr_limit": 250, "sm__warps_active.avg.pct_of_peak_sustained_active": 66.0716900665786, "dram__bytes.sum.per_second": 3177146876.125106, "time": 35.64031546456473, "times": [34.14912033081055, 35.737342834472656, 35.952640533447266, 35.90959930419922, 35.91734313964844, 35.91596984863281, 35.90019226074219], "nvml_power": 252.596, "nvml_energy": 9.002601125087192, "compile_time": 241.74647103063762, "verification_time": 0, "benchmark_time": 1360.7797310687602, "edp": 320.8555440997529, "throughput_penalty": 1000000.0, "objective": 1000320.8555440997, "strategy_time": 0.501289963722229, "framework_time": 0.913349911570549, "timestamp": "2025-02-20 07:37:35.528370+00:00"},
"32,32,4,32,210": {"block_size_x": 32, "block_size_y": 32, "tile_size_x": 4, "tile_size_y": 32, "nvml_pwr_limit": 210, "sm__warps_active.avg.pct_of_peak_sustained_active": 66.06942683458243, "dram__bytes.sum.per_second": 2624610591.9003115, "time": 38.362815856933594, "times": [38.600257873535156, 38.35667037963867, 38.364288330078125, 38.297119140625, 38.2503662109375, 38.34281539916992, 38.32819366455078], "nvml_power": 213.483, "nvml_energy": 8.189809017585755, "compile_time": 243.6559519264847, "verification_time": 0, "benchmark_time": 1376.5796129591763, "edp": 314.18413524509657, "throughput_penalty": 1000000.0, "objective": 1000314.184135245, "strategy_time": 0.15645893290638924, "framework_time": 52.66815423965454, "timestamp": "2025-02-20 07:37:37.201453+00:00"},
"32,32,2,8,250": {"block_size_x": 32, "block_size_y": 32, "tile_size_x": 2, "tile_size_y": 8, "nvml_pwr_limit": 250, "sm__warps_active.avg.pct_of_peak_sustained_active": 66.06861141280662, "dram__bytes.sum.per_second": 601645202.1141964, "time": 35.820531027657644, "times": [36.54265594482422, 36.109825134277344, 35.480735778808594, 35.52016067504883, 35.62694549560547, 35.62636947631836, 35.8370246887207], "nvml_power": 249.06150000000002, "nvml_energy": 8.921515188544955, "compile_time": 250.90439105406404, "verification_time": 0, "benchmark_time": 1321.2225690949708, "edp": 319.5734116249935, "throughput_penalty": 1000000.0, "objective": 1000319.573411625, "strategy_time": 1.6730499919503927, "framework_time": 49.504393711686134, "timestamp": "2025-02-20 07:37:38.824781+00:00"},
"32,32,8,16,210": {"block_size_x": 32, "block_size_y": 32, "tile_size_x": 8, "tile_size_y": 16, "nvml_pwr_limit": 210, "sm__warps_active.avg.pct_of_peak_sustained_active": 66.08500252039799, "dram__bytes.sum.per_second": 1102729444.4790845, "time": 37.988133021763396, "times": [38.37456130981445, 37.95363235473633, 37.81516647338867, 37.92550277709961, 37.87974548339844, 37.988929748535156, 37.979393005371094], "nvml_power": 214.007, "nvml_energy": 8.129726383588519, "compile_time": 233.03486686199903, "verification_time": 0, "benchmark_time": 1364.0570731367916, "edp": 308.8331272903001, "throughput_penalty": 1000000.0, "objective": 1000308.8331272902, "strategy_time": 0.2706400118768215, "framework_time": 46.67988605797291, "timestamp": "2025-02-20 07:37:40.468846+00:00"},
"32,32,2,8,175": {"block_size_x": 32, "block_size_y": 32, "tile_size_x": 2, "tile_size_y": 8, "nvml_pwr_limit": 175, "sm__warps_active.avg.pct_of_peak_sustained_active": 66.06389032942289, "dram__bytes.sum.per_second": 84467612.70392895, "time": 41.62831115722656, "times": [43.65436935424805, 41.62617492675781, 41.22723388671875, 41.22835159301758, 41.22159957885742, 41.21993637084961, 41.22051239013672], "nvml_power": 180.68, "nvml_energy": 7.521403259887695, "compile_time": 242.06401593983173, "verification_time": 0, "benchmark_time": 1430.2544209640473, "edp": 313.1033152415832, "throughput_penalty": 1000000.0, "objective": 1000313.1033152416, "strategy_time": 0.16694003716111183, "framework_time": 53.07242413982749, "timestamp": "2025-02-20 07:37:42.194430+00:00"},
"32,32,16,32,210": {"block_size_x": 32, "block_size_y": 32, "tile_size_x": 16, "tile_size_y": 32, "nvml_pwr_limit": 210, "sm__warps_active.avg.pct_of_peak_sustained_active": 66.08037961555078, "dram__bytes.sum.per_second": 3920899019.768754, "time": 38.393211364746094, "times": [38.56079864501953, 38.3851203918457, 38.43862533569336, 38.34454345703125, 38.342079162597656, 38.345985412597656, 38.3353271484375], "nvml_power": 212.54, "nvml_energy": 8.160093143463135, "compile_time": 273.86470790952444, "verification_time": 0, "benchmark_time": 1381.8862929474562, "edp": 313.29218081299547, "throughput_penalty": 1000000.0, "objective": 1000313.292180813, "strategy_time": 1.8180091865360737, "framework_time": 42.90123796090484, "timestamp": "2025-02-20 07:37:43.894932+00:00"},
"32,32,2,2,140": {"block_size_x": 32, "block_size_y": 32, "tile_size_x": 2, "tile_size_y": 2, "nvml_pwr_limit": 140, "sm__warps_active.avg.pct_of_peak_sustained_active": 66.04176175941491, "dram__bytes.sum.per_second": 197099894.8963272, "time": 56.330111912318635, "times": [57.43622589111328, 55.98134231567383, 56.48691177368164, 56.534080505371094, 56.13129425048828, 56.12028884887695, 55.62063980102539], "nvml_power": 141.642, "nvml_energy": 7.978709711484636, "compile_time": 232.2136030998081, "verification_time": 0, "benchmark_time": 1494.1498080734164, "edp": 449.44161096383306, "throughput_penalty": 1000000.0, "objective": 1000449.4416109638, "strategy_time": 0.27822889387607574, "framework_time": 58.21154289878905, "timestamp": "2025-02-20 07:37:45.679809+00:00"},
"32,32,4,4,210": {"block_size_x": 32, "block_size_y": 32, "tile_size_x": 4, "tile_size_y": 4, "nvml_pwr_limit": 210, "sm__warps_active.avg.pct_of_peak_sustained_active": 66.06893599087593, "dram__bytes.sum.per_second": 192191598.90967548, "time": 38.09037235804966, "times": [38.637569427490234, 37.977630615234375, 37.83843231201172, 37.88275146484375, 38.022430419921875, 38.025760650634766, 38.24803161621094], "nvml_power": 213.502, "nvml_energy": 8.13237067918832, "compile_time": 242.7772709634155, "verification_time": 0, "benchmark_time": 1370.1439518481493, "edp": 309.76502732396835, "throughput_penalty": 1000000.0, "objective": 1000309.765027324, "strategy_time": 0.15464983880519867, "framework_time": 51.93838546983898, "timestamp": "2025-02-20 07:37:47.344847+00:00"},
"32,32,16,4,250": {"block_size_x": 32, "block_size_y": 32, "tile_size_x": 16, "tile_size_y": 4, "nvml_pwr_limit": 250, "sm__warps_active.avg.pct_of_peak_sustained_active": 66.0811144270064, "dram__bytes.sum.per_second": 123833307.49503624, "time": 35.693568638392854, "times": [36.316192626953125, 36.22748947143555, 35.46931076049805, 35.460384368896484, 35.46307373046875, 35.459808349609375, 35.45872116088867], "nvml_power": 249.543, "nvml_energy": 8.907080198730469, "compile_time": 252.8734588995576, "verification_time": 0, "benchmark_time": 1351.4942349866033, "edp": 317.9254784410559, "throughput_penalty": 1000000.0, "objective": 1000317.9254784411, "strategy_time": 1.6745699103921652, "framework_time": 44.18888734653592, "timestamp": "2025-02-20 07:37:48.995102+00:00"},
"32,32,32,4,250": {"block_size_x": 32, "block_size_y": 32, "tile_size_x": 32, "tile_size_y": 4, "nvml_pwr_limit": 250, "sm__warps_active.avg.pct_of_peak_sustained_active": 66.30011250365378, "dram__bytes.sum.per_second": 16416317192.655964, "time": 35.89481571742466, "times": [35.74604797363281, 35.95094299316406, 35.97273635864258, 35.899105072021484, 35.8900146484375, 35.9516487121582, 35.853214263916016], "nvml_power": 251.111, "nvml_energy": 9.013583069618225, "compile_time": 240.28771417215466, "verification_time": 0, "benchmark_time": 1329.1450079996139, "edp": 323.54090323764507, "throughput_penalty": 1000000.0, "objective": 1000323.5409032376, "strategy_time": 0.2723799552768469, "framework_time": 0.5462500266730785, "timestamp": "2025-02-20 07:37:50.565376+00:00"},
"32,32,16,16,250": {"block_size_x": 32, "block_size_y": 32, "tile_size_x": 16, "tile_size_y": 16, "nvml_pwr_limit": 250, "sm__warps_active.avg.pct_of_peak_sustained_active": 66.1003319535405, "dram__bytes.sum.per_second": 2233198884.868616, "time": 35.97210965837751, "times": [36.71062469482422, 36.228031158447266, 36.06515121459961, 35.89651107788086, 35.63532638549805, 35.63542556762695, 35.633697509765625], "nvml_power": 251.464, "nvml_energy": 9.045690583134244, "compile_time": 235.01341603696346, "verification_time": 0, "benchmark_time": 1324.9226859770715, "edp": 325.39257359225786, "throughput_penalty": 1000000.0, "objective": 1000325.3925735923, "strategy_time": 0.15790993347764015, "framework_time": 0.5638801958411932, "timestamp": "2025-02-20 07:37:52.126058+00:00"},
"32,32,32,16,210": {"block_size_x": 32, "block_size_y": 32, "tile_size_x": 32, "tile_size_y": 16, "nvml_pwr_limit": 210, "sm__warps_active.avg.pct_of_peak_sustained_active": 66.32767765068029, "dram__bytes.sum.per_second": 23292770947.313526, "time": 38.80233219691685, "times": [39.60563278198242, 38.80838394165039, 38.67027282714844, 38.6734733581543, 38.66041564941406, 38.5970573425293, 38.60108947753906], "nvml_power": 214.395, "nvml_energy": 8.31902601135799, "compile_time": 258.2943709567189, "verification_time": 0, "benchmark_time": 1355.7385948952287, "edp": 322.79761084750487, "throughput_penalty": 1000000.0, "objective": 1000322.7976108475, "strategy_time": 1.6358699649572372, "framework_time": 49.91008713841438, "timestamp": "2025-02-20 07:37:53.791662+00:00"},
"32,32,8,8,250": {"block_size_x": 32, "block_size_y": 32, "tile_size_x": 8, "tile_size_y": 8, "nvml_pwr_limit": 250, "sm__warps_active.avg.pct_of_peak_sustained_active": 66.08050490319783, "dram__bytes.sum.per_second": 839757279.0249492, "time": 35.553667885916575, "times": [34.204254150390625, 35.822784423828125, 35.88934326171875, 35.7720947265625, 35.73651123046875, 35.73158264160156, 35.7191047668457], "nvml_power": 251.783, "nvml_energy": 8.951809161319732, "compile_time": 262.5222720671445, "verification_time": 0, "benchmark_time": 1361.6382218897343, "edp": 318.2696498996671, "throughput_penalty": 1000000.0, "objective": 1000318.2696498997, "strategy_time": 0.27518998831510544, "framework_time": 50.84902606904507, "timestamp": "2025-02-20 07:37:55.466970+00:00"},
"32,32,4,16,250": {"block_size_x": 32, "block_size_y": 32, "tile_size_x": 4, "tile_size_y": 16, "nvml_pwr_limit": 250, "sm__warps_active.avg.pct_of_peak_sustained_active": 66.07091862996931, "dram__bytes.sum.per_second": 571933680.4507912, "time": 36.04528972080776, "times": [36.724769592285156, 36.05644989013672, 35.96828842163086, 35.964351654052734, 35.880096435546875, 35.900577545166016, 35.82249450683594], "nvml_power": 250.806, "nvml_energy": 9.040374933716912, "compile_time": 245.3514370135963, "verification_time": 0, "benchmark_time": 1324.5001069735736, "edp": 325.8629336705543, "throughput_penalty": 1000000.0, "objective": 1000325.8629336705, "strategy_time": 0.1558701042085886, "framework_time": 0.5489299073815346, "timestamp": "2025-02-20 07:37:57.037551+00:00"},
"32,32,16,8,175": {"block_size_x": 32, "block_size_y": 32, "tile_size_x": 16, "tile_size_y": 8, "nvml_pwr_limit": 175, "sm__warps_active.avg.pct_of_peak_sustained_active": 66.09030650863855, "dram__bytes.sum.per_second": 1470803350.680578, "time": 41.74731881277902, "times": [44.08707046508789, 41.9411506652832, 41.30819320678711, 41.222591400146484, 41.22572708129883, 41.21916961669922, 41.22732925415039], "nvml_power": 178.036, "nvml_energy": 7.432525652151926, "compile_time": 257.05083599314094, "verification_time": 0, "benchmark_time": 1365.5823240987957, "edp": 310.28801798454475, "throughput_penalty": 1000000.0, "objective": 1000310.2880179846, "strategy_time": 1.6257399693131447, "framework_time": 47.413598746061325, "timestamp": "2025-02-20 07:37:58.709246+00:00"},
"32,32,8,8,175": {"block_size_x": 32, "block_size_y": 32, "tile_size_x": 8, "tile_size_y": 8, "nvml_pwr_limit": 175, "sm__warps_active.avg.pct_of_peak_sustained_active": 66.05219252500464, "dram__bytes.sum.per_second": 122455883.77809298, "time": 41.125535692487446, "times": [40.48313522338867, 41.22886276245117, 41.23820877075195, 41.25859069824219, 41.22963333129883, 41.21907043457031, 41.221248626708984], "nvml_power": 180.728, "nvml_energy": 7.432535814631872, "compile_time": 228.91783388331532, "verification_time": 0, "benchmark_time": 1415.6918788794428, "edp": 305.6670169303343, "throughput_penalty": 1000000.0, "objective": 1000305.6670169303, "strategy_time": 0.2725899685174227, "framework_time": 0.528600299730897, "timestamp": "2025-02-20 07:38:00.354681+00:00"},
"32,32,2,8,210": {"block_size_x": 32, "block_size_y": 32, "tile_size_x": 2, "tile_size_y": 8, "nvml_pwr_limit": 210, "sm__warps_active.avg.pct_of_peak_sustained_active": 66.05986135282659, "dram__bytes.sum.per_second": 1457442.3172231503, "time": 38.646253858293804, "times": [39.043392181396484, 38.652862548828125, 38.611358642578125, 38.618560791015625, 38.543487548828125, 38.5269775390625, 38.527137756347656], "nvml_power": 211.601, "nvml_energy": 8.177585962668827, "compile_time": 238.62586403265595, "verification_time": 0, "benchmark_time": 1345.5230928957462, "edp": 316.0330630613194, "throughput_penalty": 1000000.0, "objective": 1000316.0330630613, "strategy_time": 0.15091011300683022, "framework_time": 51.05857690796256, "timestamp": "2025-02-20 07:38:01.990063+00:00"},
"32,32,32,4,175": {"block_size_x": 32, "block_size_y": 32, "tile_size_x": 32, "tile_size_y": 4, "nvml_pwr_limit": 175, "sm__warps_active.avg.pct_of_peak_sustained_active": 66.29940450099323, "dram__bytes.sum.per_second": 16961689911.596231, "time": 41.22318158830915, "times": [37.28518295288086, 41.557857513427734, 42.430912017822266, 41.82032012939453, 41.82051086425781, 41.824798583984375, 41.822689056396484], "nvml_power": 177.847, "nvml_energy": 7.331419175936019, "compile_time": 246.48178298957646, "verification_time": 0, "benchmark_time": 1434.380130842328, "edp": 302.2244239896224, "throughput_penalty": 1000000.0, "objective": 1000302.2244239897, "strategy_time": 1.6628799494355917, "framework_time": 48.075569327920675, "timestamp": "2025-02-20 07:38:03.720687+00:00"},
"32,32,2,2,100": {"block_size_x": 32, "block_size_y": 32, "tile_size_x": 2, "tile_size_y": 2, "nvml_pwr_limit": 100, "sm__warps_active.avg.pct_of_peak_sustained_active": 65.92650861390284, "dram__bytes.sum.per_second": 118351823.00166334, "time": 90.89349147251674, "times": [94.41149139404297, 91.46902465820312, 90.23436737060547, 90.03437042236328, 90.03488159179688, 90.03858947753906, 90.0317153930664], "nvml_power": 100.751, "nvml_energy": 9.157610159347534, "compile_time": 232.82049712724984, "verification_time": 0, "benchmark_time": 1852.860535029322, "edp": 832.3671609272878, "throughput_penalty": 1000000.0, "objective": 1000832.3671609273, "strategy_time": 0.28178002685308456, "framework_time": 46.53518879786134, "timestamp": "2025-02-20 07:38:05.853209+00:00"},
"32,32,8,8,210": {"block_size_x": 32, "block_size_y": 32, "tile_size_x": 8, "tile_size_y": 8, "nvml_pwr_limit": 210, "sm__warps_active.avg.pct_of_peak_sustained_active": 66.07994484004925, "dram__bytes.sum.per_second": 744700028.3062437, "time": 38.13594491141183, "times": [38.836830139160156, 38.244224548339844, 37.911903381347656, 38.0153923034668, 37.99270248413086, 37.968544006347656, 37.982017517089844], "nvml_power": 213.904, "nvml_energy": 8.157431160330637, "compile_time": 238.7595868203789, "verification_time": 0, "benchmark_time": 1370.499401818961, "edp": 311.09134534900346, "throughput_penalty": 1000000.0, "objective": 1000311.091345349, "strategy_time": 0.1523501705378294, "framework_time": 48.171690199524164, "timestamp": "2025-02-20 07:38:07.510815+00:00"},
"32,32,2,2,250": {"block_size_x": 32, "block_size_y": 32, "tile_size_x": 2, "tile_size_y": 2, "nvml_pwr_limit": 250, "sm__warps_active.avg.pct_of_peak_sustained_active": 66.06481950851382, "dram__bytes.sum.per_second": 0.0, "time": 35.95826666695731, "times": [36.49318313598633, 36.485694885253906, 35.77356719970703, 35.72351837158203, 35.736961364746094, 35.71043014526367, 35.78451156616211], "nvml_power": 250.79649999999998, "nvml_energy": 9.018207426139558, "compile_time": 238.45143895596266, "verification_time": 0, "benchmark_time": 1324.9994788784534, "edp": 324.2791074870609, "throughput_penalty": 1000000.0, "objective": 1000324.2791074871, "strategy_time": 1.6640899702906609, "framework_time": 44.69575034454465, "timestamp": "2025-02-20 07:38:09.120649+00:00"},
"32,32,2,32,175": {"block_size_x": 32, "block_size_y": 32, "tile_size_x": 2, "tile_size_y": 32, "nvml_pwr_limit": 175, "sm__warps_active.avg.pct_of_peak_sustained_active": 66.06411694407015, "dram__bytes.sum.per_second": 1793206023.4492211, "time": 40.65658024379185, "times": [34.25676727294922, 40.757503509521484, 42.476383209228516, 41.85136032104492, 41.703712463378906, 41.8551025390625, 41.69523239135742], "nvml_power": 178.336, "nvml_energy": 7.250531894356865, "compile_time": 248.63447807729244, "verification_time": 0, "benchmark_time": 1427.9437640216202, "edp": 294.781831773092, "throughput_penalty": 1000000.0, "objective": 1000294.7818317731, "strategy_time": 0.279709929600358, "framework_time": 55.90996891260147, "timestamp": "2025-02-20 07:38:10.853441+00:00"},
"32,32,8,16,175": {"block_size_x": 32, "block_size_y": 32, "tile_size_x": 8, "tile_size_y": 16, "nvml_pwr_limit": 175, "sm__warps_active.avg.pct_of_peak_sustained_active": 66.07925568988252, "dram__bytes.sum.per_second": 1698793740.0580485, "time": 41.6967408316476, "times": [43.8502082824707, 41.87180709838867, 41.277503967285156, 41.22140884399414, 41.219200134277344, 41.216896057128906, 41.22016143798828], "nvml_power": 180.943, "nvml_energy": 7.544733376300813, "compile_time": 237.6939810346812, "verification_time": 0, "benchmark_time": 1369.7813639882952, "edp": 314.59079223549656, "throughput_penalty": 1000000.0, "objective": 1000314.5907922355, "strategy_time": 0.15552015975117683, "framework_time": 0.5515497177839279, "timestamp": "2025-02-20 07:38:12.461648+00:00"},
"32,32,2,4,250": {"block_size_x": 32, "block_size_y": 32, "tile_size_x": 2, "tile_size_y": 4, "nvml_pwr_limit": 250, "sm__warps_active.avg.pct_of_peak_sustained_active": 66.0635634593946, "dram__bytes.sum.per_second": 52796311.932370596, "time": 36.1193733215332, "times": [36.7327995300293, 36.55094528198242, 35.96303939819336, 35.96700668334961, 35.83491134643555, 35.88972854614258, 35.89718246459961], "nvml_power": 249.544, "nvml_energy": 9.013372896148683, "compile_time": 252.47765984386206, "verification_time": 0, "benchmark_time": 1331.7465579602867, "edp": 325.55738052218317, "throughput_penalty": 1000000.0, "objective": 1000325.5573805221, "strategy_time": 1.6206400468945503, "framework_time": 46.70253908261657, "timestamp": "2025-02-20 07:38:14.094220+00:00"},
"32,32,2,4,100": {"block_size_x": 32, "block_size_y": 32, "tile_size_x": 2, "tile_size_y": 4, "nvml_pwr_limit": 100, "sm__warps_active.avg.pct_of_peak_sustained_active": 65.9303670725478, "dram__bytes.sum.per_second": 108127.75639506662, "time": 90.24355643136161, "times": [94.07478332519531, 90.13938903808594, 90.03670501708984, 89.72665405273438, 90.03059387207031, 89.04934692382812, 88.64742279052734], "nvml_power": 100.74, "nvml_energy": 9.091135874895368, "compile_time": 232.1356248576194, "verification_time": 0, "benchmark_time": 1824.1852119099349, "edp": 820.4164333512962, "throughput_penalty": 1000000.0, "objective": 1000820.4164333513, "strategy_time": 0.27032988145947456, "framework_time": 50.99645140580833, "timestamp": "2025-02-20 07:38:16.201833+00:00"},
"32,32,32,8,250": {"block_size_x": 32, "block_size_y": 32, "tile_size_x": 32, "tile_size_y": 8, "nvml_pwr_limit": 250, "sm__warps_active.avg.pct_of_peak_sustained_active": 66.31255042580261, "dram__bytes.sum.per_second": 18734202777.23385, "time": 35.63268607003348, "times": [34.256160736083984, 35.61840057373047, 35.94895935058594, 35.8955192565918, 35.907840728759766, 35.903873443603516, 35.898048400878906], "nvml_power": 251.401, "nvml_energy": 8.958092910692486, "compile_time": 235.51057698205113, "verification_time": 0, "benchmark_time": 1361.993207829073, "edp": 319.2009124728978, "throughput_penalty": 1000000.0, "objective": 1000319.2009124729, "strategy_time": 0.1538789365440607, "framework_time": 51.003060303628445, "timestamp": "2025-02-20 07:38:17.850519+00:00"},
"32,32,16,2,250": {"block_size_x": 32, "block_size_y": 32, "tile_size_x": 16, "tile_size_y": 2, "nvml_pwr_limit": 250, "sm__warps_active.avg.pct_of_peak_sustained_active": 66.0821509061641, "dram__bytes.sum.per_second": 666243057.3861088, "time": 35.97923224312918, "times": [36.563838958740234, 36.22585678100586, 35.76777648925781, 35.70982360839844, 35.913089752197266, 35.93635177612305, 35.73788833618164], "nvml_power": 250.21949999999998, "nvml_energy": 9.002705502259662, "compile_time": 237.83363681286573, "verification_time": 0, "benchmark_time": 1321.6025331057608, "edp": 323.91043208229735, "throughput_penalty": 1000000.0, "objective": 1000323.9104320823, "strategy_time": 1.5871990472078323, "framework_time": 0.49854000099003315, "timestamp": "2025-02-20 07:38:19.412063+00:00"},
"32,32,2,4,140": {"block_size_x": 32, "block_size_y": 32, "tile_size_x": 2, "tile_size_y": 4, "nvml_pwr_limit": 140, "sm__warps_active.avg.pct_of_peak_sustained_active": 66.04118916597692, "dram__bytes.sum.per_second": 122901976.27779543, "time": 55.7371335710798, "times": [57.391231536865234, 55.49625778198242, 55.46080017089844, 55.456031799316406, 55.45423889160156, 55.45004653930664, 55.45132827758789], "nvml_power": 141.809, "nvml_energy": 7.904027174581255, "compile_time": 239.25689700990915, "verification_time": 0, "benchmark_time": 1503.071787999943, "edp": 440.5478183790799, "throughput_penalty": 1000000.0, "objective": 1000440.5478183791, "strategy_time": 0.2695999573916197, "framework_time": 48.686291091144085, "timestamp": "2025-02-20 07:38:21.203370+00:00"},
"32,32,2,16,250": {"block_size_x": 32, "block_size_y": 32, "tile_size_x": 2, "tile_size_y": 16, "nvml_pwr_limit": 250, "sm__warps_active.avg.pct_of_peak_sustained_active": 66.06877279494795, "dram__bytes.sum.per_second": 841929395.2904263, "time": 35.98141261509487, "times": [36.27862548828125, 35.98819351196289, 35.95753479003906, 35.947486877441406, 35.950687408447266, 35.86188888549805, 35.88547134399414], "nvml_power": 250.7005, "nvml_energy": 9.02055813331059, "compile_time": 238.65032009780407, "verification_time": 0, "benchmark_time": 1328.217884991318, "edp": 324.5724242130983, "throughput_penalty": 1000000.0, "objective": 1000324.572424213, "strategy_time": 0.1545189879834652, "framework_time": 47.41102200932801, "timestamp": "2025-02-20 07:38:22.817828+00:00"},
"32,32,4,2,250": {"block_size_x": 32, "block_size_y": 32, "tile_size_x": 4, "tile_size_y": 2, "nvml_pwr_limit": 250, "sm__warps_active.avg.pct_of_peak_sustained_active": 66.06904253460067, "dram__bytes.sum.per_second": 71109454.70638932, "time": 35.3692752293178, "times": [34.08224105834961, 34.86991882324219, 35.773311614990234, 35.731327056884766, 35.7237434387207, 35.71401596069336, 35.69036865234375], "nvml_power": 251.982, "nvml_energy": 8.912420710833958, "compile_time": 248.91496892087162, "verification_time": 0, "benchmark_time": 1355.0270171836019, "edp": 315.22586108095845, "throughput_penalty": 1000000.0, "objective": 1000315.2258610809, "strategy_time": 1.6054990701377392, "framework_time": 0.530109740793705, "timestamp": "2025-02-20 07:38:24.423930+00:00"},
"32,32,2,8,100": {"block_size_x": 32, "block_size_y": 32, "tile_size_x": 2, "tile_size_y": 8, "nvml_pwr_limit": 100, "sm__warps_active.avg.pct_of_peak_sustained_active": 65.94669847805979, "dram__bytes.sum.per_second": 25572.66793251373, "time": 91.55237470354352, "times": [94.55120086669922, 91.48291015625, 91.47132873535156, 90.8380126953125, 91.46611022949219, 90.387939453125, 90.66912078857422], "nvml_power": 101.848, "nvml_energy": 9.3244262588065, "compile_time": 232.24894213490188, "verification_time": 0, "benchmark_time": 1763.8955188449472, "edp": 853.6733667418132, "throughput_penalty": 1000000.0, "objective": 1000853.6733667419, "strategy_time": 0.2732600551098585, "framework_time": 46.94585292600095, "timestamp": "2025-02-20 07:38:26.467317+00:00"},
"32,32,16,32,250": {"block_size_x": 32, "block_size_y": 32, "tile_size_x": 16, "tile_size_y": 32, "nvml_pwr_limit": 250, "sm__warps_active.avg.pct_of_peak_sustained_active": 66.08047374625015, "dram__bytes.sum.per_second": 3847054846.4270325, "time": 36.15625599452427, "times": [36.81097412109375, 36.667903900146484, 35.954593658447266, 35.95452880859375, 35.901214599609375, 35.92329788208008, 35.88127899169922], "nvml_power": 251.039, "nvml_energy": 9.07663034860938, "compile_time": 240.62347318977118, "verification_time": 0, "benchmark_time": 1333.3780949469656, "edp": 328.17697045198884, "throughput_penalty": 1000000.0, "objective": 1000328.176970452, "strategy_time": 0.15190988779067993, "framework_time": 52.02311184257269, "timestamp": "2025-02-20 07:38:28.093518+00:00"},
"32,32,16,16,175": {"block_size_x": 32, "block_size_y": 32, "tile_size_x": 16, "tile_size_y": 16, "nvml_pwr_limit": 175, "sm__warps_active.avg.pct_of_peak_sustained_active": 66.09338709207002, "dram__bytes.sum.per_second": 2046732832.4383461, "time": 40.4202515738351, "times": [34.11289596557617, 40.523136138916016, 41.96758270263672, 41.64716720581055, 41.5511360168457, 41.619361877441406, 41.52048110961914], "nvml_power": 176.273, "nvml_energy": 7.124999005674635, "compile_time": 248.3107631560415, "verification_time": 0, "benchmark_time": 1434.7781271208078, "edp": 287.9942522726937, "throughput_penalty": 1000000.0, "objective": 1000287.9942522726, "strategy_time": 1.5816199593245983, "framework_time": 46.28098290413618, "timestamp": "2025-02-20 07:38:29.824493+00:00"},
