experiments/data/run1/power_tuning_float64.json
{
"device_name": "NVIDIA RTX 5000 Ada Generation",
"kernel_name": "tuned_matmul<double>",
"problem_size": [
4096,
4096
],
"tune_params_keys": [
"block_size_x",
"block_size_y",
"tile_size_x",
"tile_size_y"
],
"tune_params": {
"block_size_x": [
1,
2,
4,
8,
16,
32,
64,
128,
256
],
"block_size_y": [
1,
2,
4,
8,
16,
32,
64,
128,
256
],
"tile_size_x": [
1,
2,
4
],
"tile_size_y": [
1,
2,
4
]
},
"objective": "time",
"cache": {
"1,32,1,1": {"block_size_x": 1, "block_size_y": 32, "tile_size_x": 1, "tile_size_y": 1, "sm__warps_active.avg.pct_of_peak_sustained_active": 49.957711577989606, "sm__maximum_warps_per_active_cycle_pct": 49.957711577989606, "time": 940.470232282366, "times": [933.8280029296875, 934.04931640625, 939.7969970703125, 943.5897216796875, 943.8971557617188, 939.8106079101562, 948.31982421875], "nvml_power": 114.985, "nvml_energy": 108.13996965898785, "compile_time": 248.64750902634114, "verification_time": 0, "benchmark_time": 9439.828902017325, "edp": 101702.42238419632, "flops_watt": 1270935.750263335, "occupancy": 49.957711577989606, "strategy_time": 0, "framework_time": 0, "timestamp": "2025-02-18 03:00:16.544888+00:00"},
"1,32,1,2": {"block_size_x": 1, "block_size_y": 32, "tile_size_x": 1, "tile_size_y": 2, "sm__warps_active.avg.pct_of_peak_sustained_active": 49.957619040770005, "sm__maximum_warps_per_active_cycle_pct": 49.957619040770005, "time": 940.9322858537946, "times": [933.3206787109375, 939.73291015625, 939.6500854492188, 939.6738891601562, 943.8370971679688, 942.0247802734375, 948.2865600585938], "nvml_power": 114.8095, "nvml_energy": 108.02796527273124, "compile_time": 248.60410997644067, "verification_time": 0, "benchmark_time": 9448.543293983676, "edp": 101647.00030020534, "flops_watt": 1272253.468118341, "occupancy": 49.957619040770005, "strategy_time": 0, "framework_time": 0.4012200515717268, "timestamp": "2025-02-18 03:00:26.242461+00:00"},
"1,32,1,4": {"block_size_x": 1, "block_size_y": 32, "tile_size_x": 1, "tile_size_y": 4, "sm__warps_active.avg.pct_of_peak_sustained_active": 49.95775981312824, "sm__maximum_warps_per_active_cycle_pct": 49.95775981312824, "time": 936.1790422712054, "times": [926.7693481445312, 930.7407836914062, 931.5087890625, 935.5079956054688, 938.885498046875, 943.2217407226562, 946.619140625], "nvml_power": 114.859, "nvml_energy": 107.52858861622838, "compile_time": 254.08075493760407, "verification_time": 0, "benchmark_time": 9402.86358189769, "edp": 100666.01110751512, "flops_watt": 1278161.977579026, "occupancy": 49.95775981312824, "strategy_time": 0, "framework_time": 0.4020101623609662, "timestamp": "2025-02-18 03:00:35.899832+00:00"},
"1,32,2,1": {"block_size_x": 1, "block_size_y": 32, "tile_size_x": 2, "tile_size_y": 1, "sm__warps_active.avg.pct_of_peak_sustained_active": 49.915578350765585, "sm__maximum_warps_per_active_cycle_pct": 49.915578350765585, "time": 560.8603254045759, "times": [568.8973999023438, 536.4398193359375, 576.1178588867188, 547.808349609375, 573.8124389648438, 565.4050903320312, 557.5413208007812], "nvml_power": 115.093, "nvml_energy": 64.55109743178885, "compile_time": 249.91751904599369, "verification_time": 0, "benchmark_time": 5587.685570004396, "edp": 36204.14951081557, "flops_watt": 2129149.7579453513, "occupancy": 49.915578350765585, "strategy_time": 0, "framework_time": 0.40722894482314587, "timestamp": "2025-02-18 03:00:41.737867+00:00"},
"1,32,2,2": {"block_size_x": 1, "block_size_y": 32, "tile_size_x": 2, "tile_size_y": 2, "sm__warps_active.avg.pct_of_peak_sustained_active": 49.9173464413311, "sm__maximum_warps_per_active_cycle_pct": 49.9173464413311, "time": 563.1009783063616, "times": [572.1759643554688, 542.4652709960938, 584.4844360351562, 550.0049438476562, 572.34033203125, 561.197998046875, 559.0379028320312], "nvml_power": 114.674, "nvml_energy": 64.57304158630372, "compile_time": 251.92416599020362, "verification_time": 0, "benchmark_time": 5603.390778996982, "edp": 36361.142889464994, "flops_watt": 2128426.199164072, "occupancy": 49.9173464413311, "strategy_time": 0, "framework_time": 0.3956700675189495, "timestamp": "2025-02-18 03:00:47.593602+00:00"},
"1,32,2,4": {"block_size_x": 1, "block_size_y": 32, "tile_size_x": 2, "tile_size_y": 4, "sm__warps_active.avg.pct_of_peak_sustained_active": 49.91713281806841, "sm__maximum_warps_per_active_cycle_pct": 49.91713281806841, "time": 562.1142054966518, "times": [569.0045776367188, 534.3290405273438, 581.6946411132812, 549.4664916992188, 574.5891723632812, 563.081298828125, 562.6342163085938], "nvml_power": 114.926, "nvml_energy": 64.60153718090821, "compile_time": 248.19889897480607, "verification_time": 0, "benchmark_time": 5604.1293280432, "edp": 36313.44174630863, "flops_watt": 2127487.3550937353, "occupancy": 49.91713281806841, "strategy_time": 0, "framework_time": 0.4072700394317508, "timestamp": "2025-02-18 03:00:53.446362+00:00"},
"1,32,4,1": {"block_size_x": 1, "block_size_y": 32, "tile_size_x": 4, "tile_size_y": 1, "sm__warps_active.avg.pct_of_peak_sustained_active": 49.83112138868582, "sm__maximum_warps_per_active_cycle_pct": 49.83112138868582, "time": 333.9229082380022, "times": [311.5267639160156, 343.7138977050781, 349.2384033203125, 318.2076416015625, 348.23321533203125, 344.37298583984375, 322.1674499511719], "nvml_power": 115.268, "nvml_energy": 38.49062578677804, "compile_time": 251.47947703953832, "verification_time": 0, "benchmark_time": 3646.5909380931407, "edp": 12852.901702621564, "flops_watt": 3570712.366001901, "occupancy": 49.83112138868582, "strategy_time": 0, "framework_time": 0.39414886850863695, "timestamp": "2025-02-18 03:00:57.344852+00:00"},
"1,32,4,2": {"block_size_x": 1, "block_size_y": 32, "tile_size_x": 4, "tile_size_y": 2, "sm__warps_active.avg.pct_of_peak_sustained_active": 49.831972185803686, "sm__maximum_warps_per_active_cycle_pct": 49.831972185803686, "time": 331.3511265345982, "times": [311.7113342285156, 342.08026123046875, 344.91790771484375, 317.963623046875, 344.94305419921875, 338.8228454589844, 319.01885986328125], "nvml_power": 115.368, "nvml_energy": 38.22731676604352, "compile_time": 251.89377705100924, "verification_time": 0, "benchmark_time": 3968.410706962459, "edp": 12666.664474823456, "flops_watt": 3595307.363923695, "occupancy": 49.831972185803686, "strategy_time": 0, "framework_time": 0.4116490017622709, "timestamp": "2025-02-18 03:01:01.565593+00:00"},
"1,32,4,4": {"block_size_x": 1, "block_size_y": 32, "tile_size_x": 4, "tile_size_y": 4, "sm__warps_active.avg.pct_of_peak_sustained_active": 49.833279369713416, "sm__maximum_warps_per_active_cycle_pct": 49.833279369713416, "time": 336.1772155761719, "times": [312.9802551269531, 346.3736877441406, 354.6865234375, 318.68829345703125, 351.2033386230469, 347.1996765136719, 322.1087341308594], "nvml_power": 115.297, "nvml_energy": 38.76022442428589, "compile_time": 251.55377702321857, "verification_time": 0, "benchmark_time": 3665.8837109571323, "edp": 13030.30432206396, "flops_watt": 3545876.101426421, "occupancy": 49.833279369713416, "strategy_time": 0, "framework_time": 0.40315999649465084, "timestamp": "2025-02-18 03:01:05.483457+00:00"},
"1,64,1,1": {"block_size_x": 1, "block_size_y": 64, "tile_size_x": 1, "tile_size_y": 1, "sm__warps_active.avg.pct_of_peak_sustained_active": 98.81775172492571, "sm__maximum_warps_per_active_cycle_pct": 98.81775172492571, "time": 886.4103044782366, "times": [872.9974365234375, 885.2593994140625, 892.2210083007812, 891.4911499023438, 893.3236083984375, 886.1585083007812, 883.4210205078125], "nvml_power": 115.67, "nvml_energy": 102.53107991899763, "compile_time": 250.3739179810509, "verification_time": 0, "benchmark_time": 8881.31774298381, "edp": 90884.6057694811, "flops_watt": 1340461.3857630345, "occupancy": 98.81775172492571, "strategy_time": 0, "framework_time": 0.3885800251737237, "timestamp": "2025-02-18 03:01:14.615561+00:00"},
"1,64,1,2": {"block_size_x": 1, "block_size_y": 64, "tile_size_x": 1, "tile_size_y": 2, "sm__warps_active.avg.pct_of_peak_sustained_active": 98.72457214915373, "sm__maximum_warps_per_active_cycle_pct": 98.72457214915373, "time": 873.3077043805804, "times": [861.5817260742188, 870.7057495117188, 875.4599609375, 881.5992431640625, 878.4613647460938, 871.3707275390625, 873.9751586914062], "nvml_power": 114.898, "nvml_energy": 100.34130861791992, "compile_time": 253.28840501606464, "verification_time": 0, "benchmark_time": 8765.170566970482, "edp": 87628.837883659, "flops_watt": 1369714.5808147734, "occupancy": 98.72457214915373, "strategy_time": 0, "framework_time": 0.4109300207346678, "timestamp": "2025-02-18 03:01:23.634455+00:00"},
"1,64,1,4": {"block_size_x": 1, "block_size_y": 64, "tile_size_x": 1, "tile_size_y": 4, "sm__warps_active.avg.pct_of_peak_sustained_active": 98.75175095318087, "sm__maximum_warps_per_active_cycle_pct": 98.75175095318087, "time": 875.8092825753348, "times": [864.090576171875, 875.3984375, 881.2267456054688, 881.8934326171875, 879.7384033203125, 873.6506958007812, 874.6666870117188], "nvml_power": 114.744, "nvml_energy": 100.49386031982422, "compile_time": 252.80362600460649, "verification_time": 0, "benchmark_time": 8790.776906069368, "edp": 88013.45570993116, "flops_watt": 1367635.3265224074, "occupancy": 98.75175095318087, "strategy_time": 0, "framework_time": 0.4245189484208822, "timestamp": "2025-02-18 03:01:32.678484+00:00"},
"1,64,2,1": {"block_size_x": 1, "block_size_y": 64, "tile_size_x": 2, "tile_size_y": 1, "sm__warps_active.avg.pct_of_peak_sustained_active": 96.03817639501455, "sm__maximum_warps_per_active_cycle_pct": 96.03817639501455, "time": 521.0866219656808, "times": [526.5433959960938, 507.0295104980469, 531.55078125, 506.90911865234375, 536.2588500976562, 504.97540283203125, 534.3392944335938], "nvml_power": 114.645, "nvml_energy": 59.73997577525547, "compile_time": 251.44553708378226, "verification_time": 0, "benchmark_time": 5200.381233007647, "edp": 31129.702173039477, "flops_watt": 2300619.5045851986, "occupancy": 96.03817639501455, "strategy_time": 0, "framework_time": 0.39827998261898756, "timestamp": "2025-02-18 03:01:38.130734+00:00"},
"1,64,2,2": {"block_size_x": 1, "block_size_y": 64, "tile_size_x": 2, "tile_size_y": 2, "sm__warps_active.avg.pct_of_peak_sustained_active": 96.19269205348141, "sm__maximum_warps_per_active_cycle_pct": 96.19269205348141, "time": 527.4014587402344, "times": [531.664306640625, 516.071533203125, 540.5310668945312, 508.4992370605469, 541.984375, 508.54547119140625, 544.5142211914062], "nvml_power": 114.922, "nvml_energy": 60.61003044134521, "compile_time": 251.17142696399242, "verification_time": 0, "benchmark_time": 5267.427818966098, "edp": 31965.818469055474, "flops_watt": 2267594.199692826, "occupancy": 96.19269205348141, "strategy_time": 0, "framework_time": 0.40118000470101833, "timestamp": "2025-02-18 03:01:43.649758+00:00"},
"1,64,2,4": {"block_size_x": 1, "block_size_y": 64, "tile_size_x": 2, "tile_size_y": 4, "sm__warps_active.avg.pct_of_peak_sustained_active": 96.16468920782863, "sm__maximum_warps_per_active_cycle_pct": 96.16468920782863, "time": 527.7841535295759, "times": [530.35791015625, 514.4530639648438, 538.2478637695312, 508.8662414550781, 545.5802001953125, 509.9149475097656, 547.06884765625], "nvml_power": 114.948, "nvml_energy": 60.66773287991768, "compile_time": 252.30453594122082, "verification_time": 0, "benchmark_time": 5273.668854963034, "edp": 32019.46804458577, "flops_watt": 2265437.440097506, "occupancy": 96.16468920782863, "strategy_time": 0, "framework_time": 0.3938201116397977, "timestamp": "2025-02-18 03:01:49.176149+00:00"},
"1,64,4,1": {"block_size_x": 1, "block_size_y": 64, "tile_size_x": 4, "tile_size_y": 1, "sm__warps_active.avg.pct_of_peak_sustained_active": 95.65753001689976, "sm__maximum_warps_per_active_cycle_pct": 95.65753001689976, "time": 312.168709891183, "times": [296.052001953125, 314.2734375, 329.3854675292969, 300.6671447753906, 315.4370422363281, 326.782958984375, 302.5829162597656], "nvml_power": 115.889, "nvml_energy": 36.176919620579305, "compile_time": 251.859697047621, "verification_time": 0, "benchmark_time": 3734.950175974518, "edp": 11293.30232579327, "flops_watt": 3799078.3879182907, "occupancy": 95.65753001689976, "strategy_time": 0, "framework_time": 0.4029190167784691, "timestamp": "2025-02-18 03:01:53.163387+00:00"},
"1,64,4,2": {"block_size_x": 1, "block_size_y": 64, "tile_size_x": 4, "tile_size_y": 2, "sm__warps_active.avg.pct_of_peak_sustained_active": 95.4286718849664, "sm__maximum_warps_per_active_cycle_pct": 95.4286718849664, "time": 311.41319056919644, "times": [293.3708801269531, 317.6951904296875, 325.3266906738281, 299.3721923828125, 316.0927734375, 326.80645751953125, 301.2281494140625], "nvml_power": 115.2, "nvml_energy": 35.87479955357143, "compile_time": 249.75890899077058, "verification_time": 0, "benchmark_time": 3740.414001978934, "edp": 11171.885790008062, "flops_watt": 3831072.373429264, "occupancy": 95.4286718849664, "strategy_time": 0, "framework_time": 0.41925907135009766, "timestamp": "2025-02-18 03:01:57.154005+00:00"},
"1,64,4,4": {"block_size_x": 1, "block_size_y": 64, "tile_size_x": 4, "tile_size_y": 4, "sm__warps_active.avg.pct_of_peak_sustained_active": 95.22865668451117, "sm__maximum_warps_per_active_cycle_pct": 95.22865668451117, "time": 313.08703177315846, "times": [296.50506591796875, 317.41943359375, 329.8285217285156, 299.51800537109375, 317.7676696777344, 327.9306335449219, 302.639892578125], "nvml_power": 114.845, "nvml_energy": 35.95648016398838, "compile_time": 251.26929709222168, "verification_time": 0, "benchmark_time": 3745.5143879633397, "edp": 11257.507647553572, "flops_watt": 3822369.5101738493, "occupancy": 95.22865668451117, "strategy_time": 0, "framework_time": 0.4035989986732602, "timestamp": "2025-02-18 03:02:01.151217+00:00"},
"1,128,1,1": {"block_size_x": 1, "block_size_y": 128, "tile_size_x": 1, "tile_size_y": 1, "sm__warps_active.avg.pct_of_peak_sustained_active": 98.62296094732767, "sm__maximum_warps_per_active_cycle_pct": 98.62296094732767, "time": 823.4764578683036, "times": [820.2870483398438, 832.6688232421875, 833.0090942382812, 822.0784912109375, 811.952392578125, 816.8968505859375, 827.4425048828125], "nvml_power": 114.464, "nvml_energy": 94.25840927343751, "compile_time": 252.43808596860617, "verification_time": 0, "benchmark_time": 8264.098700950854, "edp": 77619.58099279118, "flops_watt": 1458108.1362544382, "occupancy": 98.62296094732767, "strategy_time": 0, "framework_time": 0.4083891399204731, "timestamp": "2025-02-18 03:02:09.668187+00:00"},
"1,128,1,2": {"block_size_x": 1, "block_size_y": 128, "tile_size_x": 1, "tile_size_y": 2, "sm__warps_active.avg.pct_of_peak_sustained_active": 98.59911005336002, "sm__maximum_warps_per_active_cycle_pct": 98.59911005336002, "time": 826.0334908621652, "times": [821.2880249023438, 833.468994140625, 837.8308715820312, 826.7659912109375, 818.844482421875, 816.3987426757812, 827.6373291015625], "nvml_power": 114.151, "nvml_energy": 94.292549015407, "compile_time": 251.72080704942346, "verification_time": 0, "benchmark_time": 8295.112975989468, "edp": 77888.80342548847, "flops_watt": 1457580.2108132963, "occupancy": 98.59911005336002, "strategy_time": 0, "framework_time": 0.40186988189816475, "timestamp": "2025-02-18 03:02:18.215446+00:00"},
"1,128,1,4": {"block_size_x": 1, "block_size_y": 128, "tile_size_x": 1, "tile_size_y": 4, "sm__warps_active.avg.pct_of_peak_sustained_active": 98.62489220630847, "sm__maximum_warps_per_active_cycle_pct": 98.62489220630847, "time": 828.0381382533482, "times": [826.3387451171875, 839.8982543945312, 839.55322265625, 826.7923583984375, 817.1922607421875, 815.6848754882812, 830.8072509765625], "nvml_power": 114.328, "nvml_energy": 94.66794427022879, "compile_time": 249.96839801315218, "verification_time": 0, "benchmark_time": 8317.71176692564, "edp": 78388.66832579196, "flops_watt": 1451800.3378174321, "occupancy": 98.62489220630847, "strategy_time": 0, "framework_time": 0.4024800145998597, "timestamp": "2025-02-18 03:02:26.783554+00:00"},
"1,128,2,1": {"block_size_x": 1, "block_size_y": 128, "tile_size_x": 2, "tile_size_y": 1, "sm__warps_active.avg.pct_of_peak_sustained_active": 98.63550290068427, "sm__maximum_warps_per_active_cycle_pct": 98.63550290068427, "time": 469.31319318498885, "times": [465.06671142578125, 477.5218811035156, 460.5644226074219, 484.6363830566406, 456.95361328125, 486.0498962402344, 454.3994445800781], "nvml_power": 114.197, "nvml_energy": 53.594158722146176, "compile_time": 252.37134599592537, "verification_time": 0, "benchmark_time": 5181.505159009248, "edp": 25152.445765953544, "flops_watt": 2564439.049869953, "occupancy": 98.63550290068427, "strategy_time": 0, "framework_time": 0.4088899586349726, "timestamp": "2025-02-18 03:02:32.217864+00:00"},
"1,128,2,2": {"block_size_x": 1, "block_size_y": 128, "tile_size_x": 2, "tile_size_y": 2, "sm__warps_active.avg.pct_of_peak_sustained_active": 98.58137069146716, "sm__maximum_warps_per_active_cycle_pct": 98.58137069146716, "time": 468.7310529436384, "times": [465.2094421386719, 477.89324951171875, 460.5063781738281, 480.0262756347656, 456.2306823730469, 484.865478515625, 456.3858642578125], "nvml_power": 114.131, "nvml_energy": 53.4967438035104, "compile_time": 251.50050700176507, "verification_time": 0, "benchmark_time": 5186.517155030742, "edp": 25075.585052075494, "flops_watt": 2569108.7662606747, "occupancy": 98.58137069146716, "strategy_time": 0, "framework_time": 0.4216788802295923, "timestamp": "2025-02-18 03:02:37.656329+00:00"},
"1,128,2,4": {"block_size_x": 1, "block_size_y": 128, "tile_size_x": 2, "tile_size_y": 4, "sm__warps_active.avg.pct_of_peak_sustained_active": 98.58665729857086, "sm__maximum_warps_per_active_cycle_pct": 98.58665729857086, "time": 462.6401585170201, "times": [457.3401794433594, 468.0394287109375, 454.39910888671875, 473.7043151855469, 453.61761474609375, 480.32745361328125, 451.0530090332031], "nvml_power": 114.326, "nvml_energy": 52.89179876261684, "compile_time": 252.21781595610082, "verification_time": 0, "benchmark_time": 5118.57465992216, "edp": 24469.870163787382, "flops_watt": 2598492.7094054488, "occupancy": 98.58665729857086, "strategy_time": 0, "framework_time": 0.4041700158268213, "timestamp": "2025-02-18 03:02:43.027550+00:00"},
"1,128,4,1": {"block_size_x": 1, "block_size_y": 128, "tile_size_x": 4, "tile_size_y": 1, "sm__warps_active.avg.pct_of_peak_sustained_active": 98.44610317815535, "sm__maximum_warps_per_active_cycle_pct": 98.44610317815535, "time": 270.8654000418527, "times": [258.5263977050781, 260.2625427246094, 290.8197021484375, 269.1291198730469, 259.0269775390625, 275.6790771484375, 282.6139831542969], "nvml_power": 114.731, "nvml_energy": 31.076658212201803, "compile_time": 252.84498604014516, "verification_time": 0, "benchmark_time": 3265.613685012795, "edp": 8417.591458611969, "flops_watt": 4422578.275100267, "occupancy": 98.44610317815535, "strategy_time": 0, "framework_time": 0.4024988738819957, "timestamp": "2025-02-18 03:02:46.546435+00:00"},
"1,128,4,2": {"block_size_x": 1, "block_size_y": 128, "tile_size_x": 4, "tile_size_y": 2, "sm__warps_active.avg.pct_of_peak_sustained_active": 98.44409464169907, "sm__maximum_warps_per_active_cycle_pct": 98.44409464169907, "time": 270.76682826450894, "times": [257.75244140625, 260.26983642578125, 290.6974792480469, 270.2555236816406, 258.3204345703125, 277.223388671875, 280.84869384765625], "nvml_power": 114.683, "nvml_energy": 31.05235216585868, "compile_time": 254.4754750560969, "verification_time": 0, "benchmark_time": 3257.4334209784865, "edp": 8407.94690610211, "flops_watt": 4426040.022279241, "occupancy": 98.44409464169907, "strategy_time": 0, "framework_time": 0.39885903242975473, "timestamp": "2025-02-18 03:02:50.058767+00:00"},
"1,128,4,4": {"block_size_x": 1, "block_size_y": 128, "tile_size_x": 4, "tile_size_y": 4, "sm__warps_active.avg.pct_of_peak_sustained_active": 98.50381961800433, "sm__maximum_warps_per_active_cycle_pct": 98.50381961800433, "time": 273.9117736816406, "times": [258.26123046875, 260.7740783691406, 294.7435607910156, 275.0819396972656, 261.3544921875, 277.2925720214844, 289.8745422363281], "nvml_power": 114.4355, "nvml_energy": 31.345230777145385, "compile_time": 250.92312798369676, "verification_time": 0, "benchmark_time": 3294.25292101223, "edp": 8585.827758628244, "flops_watt": 4384684.68932793, "occupancy": 98.50381961800433, "strategy_time": 0, "framework_time": 0.3951600519940257, "timestamp": "2025-02-18 03:02:53.604362+00:00"},
"1,256,1,1": {"block_size_x": 1, "block_size_y": 256, "tile_size_x": 1, "tile_size_y": 1, "sm__warps_active.avg.pct_of_peak_sustained_active": 97.75947101277886, "sm__maximum_warps_per_active_cycle_pct": 97.75947101277886, "time": 779.0494123186384, "times": [780.8468017578125, 789.7437744140625, 777.6282958984375, 761.83984375, 772.8215942382812, 786.5875244140625, 783.8780517578125], "nvml_power": 116.214, "nvml_energy": 90.53644840319824, "compile_time": 250.03133795689791, "verification_time": 0, "benchmark_time": 7781.308910925873, "edp": 70532.3669219283, "flops_watt": 1518051.0821445577, "occupancy": 97.75947101277886, "strategy_time": 0, "framework_time": 0.4064900567755103, "timestamp": "2025-02-18 03:03:01.636132+00:00"},
"1,256,1,2": {"block_size_x": 1, "block_size_y": 256, "tile_size_x": 1, "tile_size_y": 2, "sm__warps_active.avg.pct_of_peak_sustained_active": 97.70423248707374, "sm__maximum_warps_per_active_cycle_pct": 97.70423248707374, "time": 781.2244001116071, "times": [783.4989624023438, 790.38427734375, 780.04833984375, 765.1324462890625, 773.0196533203125, 787.4163818359375, 789.0707397460938], "nvml_power": 115.253, "nvml_energy": 90.03845578606305, "compile_time": 252.39670695737004, "verification_time": 0, "benchmark_time": 7810.612136032432, "edp": 70340.23860844257, "flops_watt": 1526447.2527001514, "occupancy": 97.70423248707374, "strategy_time": 0, "framework_time": 0.39887905586510897, "timestamp": "2025-02-18 03:03:09.699563+00:00"},
"1,256,1,4": {"block_size_x": 1, "block_size_y": 256, "tile_size_x": 1, "tile_size_y": 4, "sm__warps_active.avg.pct_of_peak_sustained_active": 97.69765829625511, "sm__maximum_warps_per_active_cycle_pct": 97.69765829625511, "time": 769.3427385602679, "times": [771.152099609375, 778.3250732421875, 765.2097778320312, 760.21240234375, 764.8115234375, 776.939208984375, 768.7490844726562], "nvml_power": 115.338, "nvml_energy": 88.73445278006417, "compile_time": 252.58363597095013, "verification_time": 0, "benchmark_time": 7692.116913036443, "edp": 68267.20690646135, "flops_watt": 1548879.2590252855, "occupancy": 97.69765829625511, "strategy_time": 0, "framework_time": 0.4092899616807699, "timestamp": "2025-02-18 03:03:17.644697+00:00"},
"1,256,2,1": {"block_size_x": 1, "block_size_y": 256, "tile_size_x": 2, "tile_size_y": 1, "sm__warps_active.avg.pct_of_peak_sustained_active": 97.77760137814732, "sm__maximum_warps_per_active_cycle_pct": 97.77760137814732, "time": 412.37842232840404, "times": [396.7719421386719, 430.5308532714844, 396.5079345703125, 424.2444152832031, 405.93585205078125, 406.393798828125, 426.26416015625], "nvml_power": 114.913, "nvml_energy": 47.38764164502389, "compile_time": 249.56474802456796, "verification_time": 0, "benchmark_time": 4534.536989987828, "edp": 19541.640899438728, "flops_watt": 2900312.163697479, "occupancy": 97.77760137814732, "strategy_time": 0, "framework_time": 0.4131499445065856, "timestamp": "2025-02-18 03:03:22.429237+00:00"},
"1,256,2,2": {"block_size_x": 1, "block_size_y": 256, "tile_size_x": 2, "tile_size_y": 2, "sm__warps_active.avg.pct_of_peak_sustained_active": 97.75795581874401, "sm__maximum_warps_per_active_cycle_pct": 97.75795581874401, "time": 412.52535574776783, "times": [399.9900207519531, 428.3933410644531, 396.46337890625, 424.69024658203125, 407.1322326660156, 408.35919189453125, 422.6490783691406], "nvml_power": 114.869, "nvml_energy": 47.38637508939034, "compile_time": 252.07588693592697, "verification_time": 0, "benchmark_time": 4532.446152064949, "edp": 19548.081241347914, "flops_watt": 2900389.684012191, "occupancy": 97.75795581874401, "strategy_time": 0, "framework_time": 0.40447001811116934, "timestamp": "2025-02-18 03:03:27.214189+00:00"},
"1,256,2,4": {"block_size_x": 1, "block_size_y": 256, "tile_size_x": 2, "tile_size_y": 4, "sm__warps_active.avg.pct_of_peak_sustained_active": 97.71078411640917, "sm__maximum_warps_per_active_cycle_pct": 97.71078411640917, "time": 421.89200701032365, "times": [404.9413146972656, 441.71185302734375, 403.1166076660156, 435.29534912109375, 418.6119079589844, 418.7225341796875, 430.844482421875], "nvml_power": 115.514, "nvml_energy": 48.734433297790524, "compile_time": 254.68853395432234, "verification_time": 0, "benchmark_time": 4627.212716033682, "edp": 20560.66787451559, "flops_watt": 2820161.109336857, "occupancy": 97.71078411640917, "strategy_time": 0, "framework_time": 0.40267000440508127, "timestamp": "2025-02-18 03:03:32.096518+00:00"},
"1,256,4,1": {"block_size_x": 1, "block_size_y": 256, "tile_size_x": 4, "tile_size_y": 1, "sm__warps_active.avg.pct_of_peak_sustained_active": 97.75897159992944, "sm__maximum_warps_per_active_cycle_pct": 97.75897159992944, "time": 226.67001342773438, "times": [219.349853515625, 218.61865234375, 233.0338897705078, 243.30117797851562, 224.38461303710938, 219.34072875976562, 228.6611785888672], "nvml_power": 115.622, "nvml_energy": 26.208040292541504, "compile_time": 252.30389600619674, "verification_time": 0, "benchmark_time": 2983.346932916902, "edp": 5940.576845024986, "flops_watt": 5244152.250144147, "occupancy": 97.75897159992944, "strategy_time": 0, "framework_time": 0.41574006900191307, "timestamp": "2025-02-18 03:03:35.332610+00:00"},
"1,256,4,2": {"block_size_x": 1, "block_size_y": 256, "tile_size_x": 4, "tile_size_y": 2, "sm__warps_active.avg.pct_of_peak_sustained_active": 97.79789106695993, "sm__maximum_warps_per_active_cycle_pct": 97.79789106695993, "time": 230.49596296037947, "times": [221.55970764160156, 221.41778564453125, 238.544677734375, 249.40194702148438, 230.1910400390625, 222.2881317138672, 230.06845092773438], "nvml_power": 114.413, "nvml_energy": 26.371734610185896, "compile_time": 251.6637770459056, "verification_time": 0, "benchmark_time": 3030.0989149836823, "edp": 6078.578363910366, "flops_watt": 5211600.81062378, "occupancy": 97.79789106695993, "strategy_time": 0, "framework_time": 0.4087889101356268, "timestamp": "2025-02-18 03:03:38.614807+00:00"},
"1,256,4,4": {"block_size_x": 1, "block_size_y": 256, "tile_size_x": 4, "tile_size_y": 4, "sm__warps_active.avg.pct_of_peak_sustained_active": 97.7082279088267, "sm__maximum_warps_per_active_cycle_pct": 97.7082279088267, "time": 230.37755257742745, "times": [220.2380828857422, 220.14743041992188, 238.84518432617188, 249.5048370361328, 229.92083740234375, 222.07423400878906, 231.91226196289062], "nvml_power": 114.321, "nvml_energy": 26.336992188204082, "compile_time": 250.72246696799994, "verification_time": 0, "benchmark_time": 3030.8653250103816, "edp": 6067.451802569282, "flops_watt": 5218475.689625511, "occupancy": 97.7082279088267, "strategy_time": 0, "framework_time": 0.4033490549772978, "timestamp": "2025-02-18 03:03:41.896822+00:00"},
"2,16,1,1": {"block_size_x": 2, "block_size_y": 16, "tile_size_x": 1, "tile_size_y": 1, "sm__warps_active.avg.pct_of_peak_sustained_active": 49.95474444731438, "sm__maximum_warps_per_active_cycle_pct": 49.95474444731438, "time": 407.4849068777902, "times": [388.32177734375, 429.7722473144531, 388.9418029785156, 416.0794372558594, 407.919921875, 398.5142517089844, 422.84490966796875], "nvml_power": 114.718, "nvml_energy": 46.74585354720634, "compile_time": 250.84975792560726, "verification_time": 0, "benchmark_time": 4481.569772935472, "edp": 19048.229779606194, "flops_watt": 2940131.435041766, "occupancy": 49.95474444731438, "strategy_time": 0, "framework_time": 0.4150201566517353, "timestamp": "2025-02-18 03:03:46.629681+00:00"},
"2,16,1,2": {"block_size_x": 2, "block_size_y": 16, "tile_size_x": 1, "tile_size_y": 2, "sm__warps_active.avg.pct_of_peak_sustained_active": 49.955211163162375, "sm__maximum_warps_per_active_cycle_pct": 49.955211163162375, "time": 403.9198259626116, "times": [387.2725830078125, 422.4819030761719, 390.0907897949219, 412.0672912597656, 404.7007751464844, 394.0386047363281, 416.7868347167969], "nvml_power": 114.662, "nvml_energy": 46.314255084524966, "compile_time": 251.64165708702058, "verification_time": 0, "benchmark_time": 4452.67591602169, "edp": 18707.24585332932, "flops_watt": 2967530.2608488384, "occupancy": 49.955211163162375, "strategy_time": 0, "framework_time": 0.4042398650199175, "timestamp": "2025-02-18 03:03:51.334427+00:00"},
"2,16,1,4": {"block_size_x": 2, "block_size_y": 16, "tile_size_x": 1, "tile_size_y": 4, "sm__warps_active.avg.pct_of_peak_sustained_active": 49.955114979494844, "sm__maximum_warps_per_active_cycle_pct": 49.955114979494844, "time": 406.35403878348217, "times": [388.5509948730469, 425.6153564453125, 392.56085205078125, 416.96075439453125, 404.4317321777344, 397.36492919921875, 418.99365234375], "nvml_power": 115.022, "nvml_energy": 46.739654248953684, "compile_time": 250.87285798508674, "verification_time": 0, "benchmark_time": 4472.624480025843, "edp": 18992.84727540587, "flops_watt": 2940521.3983814768, "occupancy": 49.955114979494844, "strategy_time": 0, "framework_time": 0.40492997504770756, "timestamp": "2025-02-18 03:03:56.058354+00:00"},
"2,16,2,1": {"block_size_x": 2, "block_size_y": 16, "tile_size_x": 2, "tile_size_y": 1, "sm__warps_active.avg.pct_of_peak_sustained_active": 49.95498536574142, "sm__maximum_warps_per_active_cycle_pct": 49.95498536574142, "time": 731.6188703264509, "times": [738.3632202148438, 732.6314697265625, 715.7708129882812, 724.551025390625, 746.9957275390625, 733.9490966796875, 729.0707397460938], "nvml_power": 114.762, "nvml_energy": 83.96204479640416, "compile_time": 252.17267603147775, "verification_time": 0, "benchmark_time": 7246.020942926407, "edp": 61428.21636424407, "flops_watt": 1636917.6549388433, "occupancy": 49.95498536574142, "strategy_time": 0, "framework_time": 0.40251004975289106, "timestamp": "2025-02-18 03:04:03.556975+00:00"},
"2,16,2,2": {"block_size_x": 2, "block_size_y": 16, "tile_size_x": 2, "tile_size_y": 2, "sm__warps_active.avg.pct_of_peak_sustained_active": 49.95526491997339, "sm__maximum_warps_per_active_cycle_pct": 49.95526491997339, "time": 745.3441336495536, "times": [755.345703125, 752.282958984375, 726.0667114257812, 735.6761474609375, 760.0623168945312, 749.6307373046875, 738.3443603515625], "nvml_power": 114.7135, "nvml_energy": 85.50103427540806, "compile_time": 248.94833902362734, "verification_time": 0, "benchmark_time": 7366.081935004331, "edp": 63727.69431814481, "flops_watt": 1607453.6949961833, "occupancy": 49.95526491997339, "strategy_time": 0, "framework_time": 0.41574996430426836, "timestamp": "2025-02-18 03:04:11.172445+00:00"},
"2,16,2,4": {"block_size_x": 2, "block_size_y": 16, "tile_size_x": 2, "tile_size_y": 4, "sm__warps_active.avg.pct_of_peak_sustained_active": 49.95505868321778, "sm__maximum_warps_per_active_cycle_pct": 49.95505868321778, "time": 732.712908063616, "times": [739.976318359375, 732.5615844726562, 713.0596313476562, 731.7260131835938, 748.00537109375, 734.41455078125, 729.2468872070312], "nvml_power": 114.742, "nvml_energy": 84.07294449703544, "compile_time": 252.92448606342077, "verification_time": 0, "benchmark_time": 7259.059051983058, "edp": 61601.33165189382, "flops_watt": 1634758.4147816584, "occupancy": 49.95505868321778, "strategy_time": 0, "framework_time": 0.4278599517419934, "timestamp": "2025-02-18 03:04:18.684883+00:00"},
"2,16,4,1": {"block_size_x": 2, "block_size_y": 16, "tile_size_x": 4, "tile_size_y": 1, "sm__warps_active.avg.pct_of_peak_sustained_active": 49.91036730729248, "sm__maximum_warps_per_active_cycle_pct": 49.91036730729248, "time": 440.0558602469308, "times": [412.8856201171875, 346.7657165527344, 498.8193054199219, 436.73895263671875, 469.0614929199219, 454.1261291503906, 461.9938049316406], "nvml_power": 115.037, "nvml_energy": 50.622705995226184, "compile_time": 251.6766870394349, "verification_time": 0, "benchmark_time": 4832.65742007643, "edp": 22276.818434756722, "flops_watt": 2714966.5504835076, "occupancy": 49.91036730729248, "strategy_time": 0, "framework_time": 0.7265688618645072, "timestamp": "2025-02-18 03:04:23.769978+00:00"},
"2,16,4,2": {"block_size_x": 2, "block_size_y": 16, "tile_size_x": 4, "tile_size_y": 2, "sm__warps_active.avg.pct_of_peak_sustained_active": 49.910044026046066, "sm__maximum_warps_per_active_cycle_pct": 49.910044026046066, "time": 402.3818097795759, "times": [412.6118469238281, 390.5458679199219, 309.8680419921875, 500.58782958984375, 408.2654113769531, 470.8930969238281, 323.90057373046875], "nvml_power": 113.933, "nvml_energy": 45.844566733616425, "compile_time": 254.63992496952415, "verification_time": 0, "benchmark_time": 4516.156224999577, "edp": 18447.01973083312, "flops_watt": 2997933.305174421, "occupancy": 49.910044026046066, "strategy_time": 0, "framework_time": 0.40725001599639654, "timestamp": "2025-02-18 03:04:28.541206+00:00"},
"2,16,4,4": {"block_size_x": 2, "block_size_y": 16, "tile_size_x": 4, "tile_size_y": 4, "sm__warps_active.avg.pct_of_peak_sustained_active": 49.909830584385126, "sm__maximum_warps_per_active_cycle_pct": 49.909830584385126, "time": 436.59912545340404, "times": [425.75689697265625, 333.2790222167969, 485.93212890625, 431.7996826171875, 468.9283752441406, 448.3670654296875, 462.1307067871094], "nvml_power": 114.798, "nvml_energy": 50.12070640379988, "compile_time": 250.00124797224998, "verification_time": 0, "benchmark_time": 4809.980648104101, "edp": 21882.656583005853, "flops_watt": 2742159.146056651, "occupancy": 49.909830584385126, "strategy_time": 0, "framework_time": 0.421629985794425, "timestamp": "2025-02-18 03:04:33.601633+00:00"},
"2,32,1,1": {"block_size_x": 2, "block_size_y": 32, "tile_size_x": 1, "tile_size_y": 1, "sm__warps_active.avg.pct_of_peak_sustained_active": 98.87787837038813, "sm__maximum_warps_per_active_cycle_pct": 98.87787837038813, "time": 491.6515328543527, "times": [491.6286315917969, 490.4544677734375, 495.2507019042969, 486.61614990234375, 493.97930908203125, 487.2327880859375, 496.398681640625], "nvml_power": 115.213, "nvml_energy": 56.64464805474854, "compile_time": 254.4604940339923, "verification_time": 0, "benchmark_time": 5394.912417046726, "edp": 27849.428044112447, "flops_watt": 2426336.0827868795, "occupancy": 98.87787837038813, "strategy_time": 0, "framework_time": 0.3977399319410324, "timestamp": "2025-02-18 03:04:39.251428+00:00"},
"2,32,1,2": {"block_size_x": 2, "block_size_y": 32, "tile_size_x": 1, "tile_size_y": 2, "sm__warps_active.avg.pct_of_peak_sustained_active": 98.82967385807858, "sm__maximum_warps_per_active_cycle_pct": 98.82967385807858, "time": 491.57779366629467, "times": [492.6536865234375, 486.3727111816406, 494.5408935546875, 487.87939453125, 493.6027526855469, 493.3263244628906, 492.6687927246094], "nvml_power": 114.864, "nvml_energy": 56.46459169168527, "compile_time": 252.92389595415443, "verification_time": 0, "benchmark_time": 5406.047997996211, "edp": 27756.739404066837, "flops_watt": 2434073.2723697117, "occupancy": 98.82967385807858, "strategy_time": 0, "framework_time": 0.41149905882775784, "timestamp": "2025-02-18 03:04:44.910836+00:00"},
"2,32,1,4": {"block_size_x": 2, "block_size_y": 32, "tile_size_x": 1, "tile_size_y": 4, "sm__warps_active.avg.pct_of_peak_sustained_active": 98.7988683307008, "sm__maximum_warps_per_active_cycle_pct": 98.7988683307008, "time": 498.3373805454799, "times": [499.2918395996094, 494.56439208984375, 501.8253479003906, 494.20428466796875, 501.12725830078125, 495.5377502441406, 501.810791015625], "nvml_power": 114.845, "nvml_energy": 57.23155646874564, "compile_time": 253.5932050086558, "verification_time": 0, "benchmark_time": 5467.723677982576, "edp": 28520.623935175416, "flops_watt": 2401454.057029812, "occupancy": 98.7988683307008, "strategy_time": 0, "framework_time": 0.39622001349925995, "timestamp": "2025-02-18 03:04:50.632572+00:00"},
"2,32,2,1": {"block_size_x": 2, "block_size_y": 32, "tile_size_x": 2, "tile_size_y": 1, "sm__warps_active.avg.pct_of_peak_sustained_active": 98.86397020574802, "sm__maximum_warps_per_active_cycle_pct": 98.86397020574802, "time": 704.9311785016741, "times": [713.4395141601562, 709.2609252929688, 689.4342041015625, 707.7086181640625, 715.5601196289062, 700.9080810546875, 698.206787109375], "nvml_power": 115.057, "nvml_energy": 81.10726660486714, "compile_time": 251.9865270005539, "verification_time": 0, "benchmark_time": 7041.633186978288, "edp": 57175.041032818466, "flops_watt": 1694533.168545375, "occupancy": 98.86397020574802, "strategy_time": 0, "framework_time": 0.40055892895907164, "timestamp": "2025-02-18 03:04:57.926617+00:00"},
"2,32,2,2": {"block_size_x": 2, "block_size_y": 32, "tile_size_x": 2, "tile_size_y": 2, "sm__warps_active.avg.pct_of_peak_sustained_active": 98.89393466737012, "sm__maximum_warps_per_active_cycle_pct": 98.89393466737012, "time": 712.5859810965402, "times": [722.136962890625, 718.6864624023438, 698.6240844726562, 710.0220947265625, 721.796630859375, 709.7205810546875, 707.1150512695312], "nvml_power": 114.978, "nvml_energy": 81.931710934518, "compile_time": 254.65763499960303, "verification_time": 0, "benchmark_time": 7104.045356973074, "edp": 58383.38861919163, "flops_watt": 1677481.7943426676, "occupancy": 98.89393466737012, "strategy_time": 0, "framework_time": 0.4184700082987547, "timestamp": "2025-02-18 03:05:05.285762+00:00"},
"2,32,2,4": {"block_size_x": 2, "block_size_y": 32, "tile_size_x": 2, "tile_size_y": 4, "sm__warps_active.avg.pct_of_peak_sustained_active": 98.92395798971995, "sm__maximum_warps_per_active_cycle_pct": 98.92395798971995, "time": 718.2727399553571, "times": [731.296630859375, 723.02392578125, 701.2890014648438, 720.1570434570312, 733.1867065429688, 713.5498657226562, 705.406005859375], "nvml_power": 114.501, "nvml_energy": 82.24294699762835, "compile_time": 254.69105504453182, "verification_time": 0, "benchmark_time": 7153.885447070934, "edp": 59072.86688198973, "flops_watt": 1671133.6167946819, "occupancy": 98.92395798971995, "strategy_time": 0, "framework_time": 0.4104889230802655, "timestamp": "2025-02-18 03:05:12.694775+00:00"},
"2,32,4,1": {"block_size_x": 2, "block_size_y": 32, "tile_size_x": 4, "tile_size_y": 1, "sm__warps_active.avg.pct_of_peak_sustained_active": 98.1071831869579, "sm__maximum_warps_per_active_cycle_pct": 98.1071831869579, "time": 414.8651210239955, "times": [385.55804443359375, 441.1332702636719, 394.15814208984375, 430.6577453613281, 411.1273498535156, 412.59173583984375, 428.8295593261719], "nvml_power": 115.317, "nvml_energy": 47.84100116112409, "compile_time": 254.4621949782595, "verification_time": 0, "benchmark_time": 4498.373190057464, "edp": 19847.562736618856, "flops_watt": 2872827.7029387043, "occupancy": 98.1071831869579, "strategy_time": 0, "framework_time": 0.40945899672806263, "timestamp": "2025-02-18 03:05:17.448044+00:00"},
"2,32,4,2": {"block_size_x": 2, "block_size_y": 32, "tile_size_x": 4, "tile_size_y": 2, "sm__warps_active.avg.pct_of_peak_sustained_active": 98.09903352894926, "sm__maximum_warps_per_active_cycle_pct": 98.09903352894926, "time": 416.72916521344865, "times": [391.010986328125, 442.9362487792969, 397.34930419921875, 430.6708984375, 412.5660095214844, 414.3516540527344, 428.21905517578125], "nvml_power": 114.94, "nvml_energy": 47.89885024963379, "compile_time": 253.41243506409228, "verification_time": 0, "benchmark_time": 4506.778332986869, "edp": 19960.847879213874, "flops_watt": 2869358.090136011, "occupancy": 98.09903352894926, "strategy_time": 0, "framework_time": 0.4146798746660352, "timestamp": "2025-02-18 03:05:22.208675+00:00"},
"2,32,4,4": {"block_size_x": 2, "block_size_y": 32, "tile_size_x": 4, "tile_size_y": 4, "sm__warps_active.avg.pct_of_peak_sustained_active": 98.14898471123466, "sm__maximum_warps_per_active_cycle_pct": 98.14898471123466, "time": 421.5259704589844, "times": [388.7369384765625, 451.2768859863281, 403.2811279296875, 433.276611328125, 421.2166748046875, 415.9134521484375, 436.9801025390625], "nvml_power": 115.451, "nvml_energy": 48.6655948154602, "compile_time": 252.76266608852893, "verification_time": 0, "benchmark_time": 4545.297521981411, "edp": 20513.81208255058, "flops_watt": 2824150.2850867873, "occupancy": 98.14898471123466, "strategy_time": 0, "framework_time": 0.4109499277547002, "timestamp": "2025-02-18 03:05:27.007171+00:00"},
"2,64,1,1": {"block_size_x": 2, "block_size_y": 64, "tile_size_x": 1, "tile_size_y": 1, "sm__warps_active.avg.pct_of_peak_sustained_active": 97.71139736348002, "sm__maximum_warps_per_active_cycle_pct": 97.71139736348002, "time": 487.1763610839844, "times": [487.6437683105469, 482.91082763671875, 486.0569152832031, 490.3463439941406, 486.3899230957031, 490.411376953125, 486.4753723144531], "nvml_power": 114.695, "nvml_energy": 55.87669273452759, "compile_time": 250.2337290206924, "verification_time": 0, "benchmark_time": 5364.030560944229, "edp": 27221.80383581506, "flops_watt": 2459683.040386409, "occupancy": 97.71139736348002, "strategy_time": 0, "framework_time": 0.40953897405415773, "timestamp": "2025-02-18 03:05:32.621870+00:00"},
"2,64,1,2": {"block_size_x": 2, "block_size_y": 64, "tile_size_x": 1, "tile_size_y": 2, "sm__warps_active.avg.pct_of_peak_sustained_active": 97.56280753947028, "sm__maximum_warps_per_active_cycle_pct": 97.56280753947028, "time": 488.36558750697543, "times": [491.21502685546875, 483.25360107421875, 488.5890808105469, 490.3388366699219, 485.79266357421875, 493.7520446777344, 485.61785888671875], "nvml_power": 114.748, "nvml_energy": 56.038974435250424, "compile_time": 251.4818769413978, "verification_time": 0, "benchmark_time": 5379.899799008854, "edp": 27367.50667335945, "flops_watt": 2452560.1129764114, "occupancy": 97.56280753947028, "strategy_time": 0, "framework_time": 0.41542912367731333, "timestamp": "2025-02-18 03:05:38.253692+00:00"},
"2,64,1,4": {"block_size_x": 2, "block_size_y": 64, "tile_size_x": 1, "tile_size_y": 4, "sm__warps_active.avg.pct_of_peak_sustained_active": 97.56152979917346, "sm__maximum_warps_per_active_cycle_pct": 97.56152979917346, "time": 492.00548008510043, "times": [493.1799621582031, 490.4398193359375, 489.8826599121094, 496.6233215332031, 487.9212341308594, 497.6946105957031, 488.2967529296875], "nvml_power": 114.629, "nvml_energy": 56.398096176674976, "compile_time": 254.23538498580456, "verification_time": 0, "benchmark_time": 5422.970643034205, "edp": 27748.17238529064, "flops_watt": 2436943.137964323, "occupancy": 97.56152979917346, "strategy_time": 0, "framework_time": 0.4106400301679969, "timestamp": "2025-02-18 03:05:43.931333+00:00"},
"2,64,2,1": {"block_size_x": 2, "block_size_y": 64, "tile_size_x": 2, "tile_size_y": 1, "sm__warps_active.avg.pct_of_peak_sustained_active": 97.53360004530491, "sm__maximum_warps_per_active_cycle_pct": 97.53360004530491, "time": 603.3286917550223, "times": [615.5012817382812, 580.2411499023438, 616.8104858398438, 605.3142700195312, 596.0110473632812, 619.1646118164062, 590.2579956054688], "nvml_power": 113.878, "nvml_energy": 68.70586475967843, "compile_time": 250.27576799038798, "verification_time": 0, "benchmark_time": 6030.805163085461, "edp": 41452.21950135428, "flops_watt": 2000396.2391382216, "occupancy": 97.53360004530491, "strategy_time": 0, "framework_time": 0.4107499262318015, "timestamp": "2025-02-18 03:05:50.212850+00:00"},
"2,64,2,2": {"block_size_x": 2, "block_size_y": 64, "tile_size_x": 2, "tile_size_y": 2, "sm__warps_active.avg.pct_of_peak_sustained_active": 97.58665512402038, "sm__maximum_warps_per_active_cycle_pct": 97.58665512402038, "time": 612.2439313616071, "times": [624.48779296875, 589.9951171875, 623.6370239257812, 615.6558837890625, 600.0432739257812, 628.7080688476562, 603.1803588867188], "nvml_power": 113.958, "nvml_energy": 69.77009393010603, "compile_time": 249.12963900715113, "verification_time": 0, "benchmark_time": 6114.393225987442, "edp": 42716.316599236714, "flops_watt": 1969883.4519225813, "occupancy": 97.58665512402038, "strategy_time": 0, "framework_time": 0.4339400911703706, "timestamp": "2025-02-18 03:05:56.576831+00:00"},
"2,64,2,4": {"block_size_x": 2, "block_size_y": 64, "tile_size_x": 2, "tile_size_y": 4, "sm__warps_active.avg.pct_of_peak_sustained_active": 97.65911437106436, "sm__maximum_warps_per_active_cycle_pct": 97.65911437106436, "time": 615.4268537248884, "times": [626.9158935546875, 592.9013671875, 628.4239501953125, 617.7986450195312, 605.53466796875, 632.1072387695312, 604.3062133789062], "nvml_power": 114.164, "nvml_energy": 70.25959132864816, "compile_time": 253.05787601973861, "verification_time": 0, "benchmark_time": 6135.546509060077, "edp": 43239.639235386385, "flops_watt": 1956159.3068355871, "occupancy": 97.65911437106436, "strategy_time": 0, "framework_time": 0.41628896724432707, "timestamp": "2025-02-18 03:06:02.965877+00:00"},
"2,64,4,1": {"block_size_x": 2, "block_size_y": 64, "tile_size_x": 4, "tile_size_y": 1, "sm__warps_active.avg.pct_of_peak_sustained_active": 97.66637290174107, "sm__maximum_warps_per_active_cycle_pct": 97.66637290174107, "time": 359.84535435267856, "times": [340.1007080078125, 377.9885559082031, 353.3210754394531, 347.54742431640625, 383.6324768066406, 350.2407531738281, 366.08648681640625], "nvml_power": 114.545, "nvml_energy": 41.21848611432757, "compile_time": 251.69417704455554, "verification_time": 0, "benchmark_time": 3946.4628939749673, "edp": 14832.280741691164, "flops_watt": 3334400.809646091, "occupancy": 97.66637290174107, "strategy_time": 0, "framework_time": 0.4102899692952633, "timestamp": "2025-02-18 03:06:07.164469+00:00"},
"2,64,4,2": {"block_size_x": 2, "block_size_y": 64, "tile_size_x": 4, "tile_size_y": 2, "sm__warps_active.avg.pct_of_peak_sustained_active": 97.7300672265737, "sm__maximum_warps_per_active_cycle_pct": 97.7300672265737, "time": 353.3808157784598, "times": [335.8805236816406, 372.5780944824219, 352.59918212890625, 342.3732604980469, 372.60357666015625, 345.1162109375, 352.5148620605469], "nvml_power": 114.324, "nvml_energy": 40.39990838305664, "compile_time": 249.50079899281263, "verification_time": 0, "benchmark_time": 3880.4094080114737, "edp": 14276.552581779593, "flops_watt": 3401962.008647541, "occupancy": 97.7300672265737, "strategy_time": 0, "framework_time": 0.40492997504770756, "timestamp": "2025-02-18 03:06:11.294809+00:00"},
"2,64,4,4": {"block_size_x": 2, "block_size_y": 64, "tile_size_x": 4, "tile_size_y": 4, "sm__warps_active.avg.pct_of_peak_sustained_active": 97.72805893331909, "sm__maximum_warps_per_active_cycle_pct": 97.72805893331909, "time": 359.6471732003348, "times": [340.78143310546875, 375.85516357421875, 357.9263916015625, 348.0193786621094, 380.6407470703125, 354.58197021484375, 359.7251281738281], "nvml_power": 113.985, "nvml_energy": 40.99438303724016, "compile_time": 251.1629379587248, "verification_time": 0, "benchmark_time": 3935.121973976493, "edp": 14743.513976435179, "flops_watt": 3352628.903992714, "occupancy": 97.72805893331909, "strategy_time": 0, "framework_time": 0.40177011396735907, "timestamp": "2025-02-18 03:06:15.481520+00:00"},
"2,128,1,1": {"block_size_x": 2, "block_size_y": 128, "tile_size_x": 1, "tile_size_y": 1, "sm__warps_active.avg.pct_of_peak_sustained_active": 94.77000509372795, "sm__maximum_warps_per_active_cycle_pct": 94.77000509372795, "time": 446.0335431780134, "times": [441.4684143066406, 454.27496337890625, 434.3896179199219, 463.9091796875, 430.44012451171875, 461.7759704589844, 435.9765319824219], "nvml_power": 115.203, "nvml_energy": 51.38440227473668, "compile_time": 248.56623890809715, "verification_time": 0, "benchmark_time": 4929.427801980637, "edp": 22919.167010685174, "flops_watt": 2674721.2653590087, "occupancy": 94.77000509372795, "strategy_time": 0, "framework_time": 0.39554014801979065, "timestamp": "2025-02-18 03:06:20.659933+00:00"},
"2,128,1,2": {"block_size_x": 2, "block_size_y": 128, "tile_size_x": 1, "tile_size_y": 2, "sm__warps_active.avg.pct_of_peak_sustained_active": 94.62630045006922, "sm__maximum_warps_per_active_cycle_pct": 94.62630045006922, "time": 444.5880344935826, "times": [439.41473388671875, 454.0582275390625, 431.3911437988281, 464.015869140625, 429.38555908203125, 457.6467590332031, 436.2039489746094], "nvml_power": 114.896, "nvml_energy": 51.08138681117467, "compile_time": 250.02830801531672, "verification_time": 0, "benchmark_time": 4907.854388933629, "edp": 22710.17336158656, "flops_watt": 2690587.747354063, "occupancy": 94.62630045006922, "strategy_time": 0, "framework_time": 0.40155998431146145, "timestamp": "2025-02-18 03:06:25.818242+00:00"},
"2,128,1,4": {"block_size_x": 2, "block_size_y": 128, "tile_size_x": 1, "tile_size_y": 4, "sm__warps_active.avg.pct_of_peak_sustained_active": 94.35662183223877, "sm__maximum_warps_per_active_cycle_pct": 94.35662183223877, "time": 453.57354736328125, "times": [442.29779052734375, 467.9167175292969, 436.68927001953125, 475.2091369628906, 438.43780517578125, 472.2289733886719, 442.2351379394531], "nvml_power": 115.306, "nvml_energy": 52.299751452270506, "compile_time": 254.80851402971894, "verification_time": 0, "benchmark_time": 5003.05080297403, "edp": 23721.783792424252, "flops_watt": 2627908.348616699, "occupancy": 94.35662183223877, "strategy_time": 0, "framework_time": 0.4077800549566746, "timestamp": "2025-02-18 03:06:31.076533+00:00"},
"2,128,2,1": {"block_size_x": 2, "block_size_y": 128, "tile_size_x": 2, "tile_size_y": 1, "sm__warps_active.avg.pct_of_peak_sustained_active": 92.62711926228178, "sm__maximum_warps_per_active_cycle_pct": 92.62711926228178, "time": 498.19717843191967, "times": [493.46649169921875, 498.57098388671875, 499.3389587402344, 498.7676086425781, 497.5287780761719, 502.0419616699219, 497.66546630859375], "nvml_power": 114.046, "nvml_energy": 56.81739541144672, "compile_time": 252.23220710176975, "verification_time": 0, "benchmark_time": 5485.836533014663, "edp": 28306.266079833455, "flops_watt": 2418959.061335481, "occupancy": 92.62711926228178, "strategy_time": 0, "framework_time": 0.4221088020130992, "timestamp": "2025-02-18 03:06:36.815049+00:00"},
"2,128,2,2": {"block_size_x": 2, "block_size_y": 128, "tile_size_x": 2, "tile_size_y": 2, "sm__warps_active.avg.pct_of_peak_sustained_active": 92.30333383833823, "sm__maximum_warps_per_active_cycle_pct": 92.30333383833823, "time": 496.2449733189174, "times": [493.37689208984375, 499.5845947265625, 491.8863830566406, 501.5072937011719, 494.39727783203125, 501.93157958984375, 491.0307922363281], "nvml_power": 114.382, "nvml_energy": 56.76149253816442, "compile_time": 252.62349599506706, "verification_time": 0, "benchmark_time": 5470.050396048464, "edp": 28167.60535014333, "flops_watt": 2421341.4293077462, "occupancy": 92.30333383833823, "strategy_time": 0, "framework_time": 0.40996994357556105, "timestamp": "2025-02-18 03:06:42.538157+00:00"},
"2,128,2,4": {"block_size_x": 2, "block_size_y": 128, "tile_size_x": 2, "tile_size_y": 4, "sm__warps_active.avg.pct_of_peak_sustained_active": 92.00017423132032, "sm__maximum_warps_per_active_cycle_pct": 92.00017423132032, "time": 486.8196541922433, "times": [482.5905456542969, 488.2817077636719, 484.2438659667969, 491.79901123046875, 481.92059326171875, 496.9515075683594, 481.9503479003906], "nvml_power": 113.996, "nvml_energy": 55.495493299298964, "compile_time": 254.89040499087423, "verification_time": 0, "benchmark_time": 5380.611578002572, "edp": 27016.29685719268, "flops_watt": 2476578.642715411, "occupancy": 92.00017423132032, "strategy_time": 0, "framework_time": 0.41004910599440336, "timestamp": "2025-02-18 03:06:48.174095+00:00"},
"2,128,4,1": {"block_size_x": 2, "block_size_y": 128, "tile_size_x": 4, "tile_size_y": 1, "sm__warps_active.avg.pct_of_peak_sustained_active": 93.11911370958352, "sm__maximum_warps_per_active_cycle_pct": 93.11911370958352, "time": 279.7007620675223, "times": [264.9641418457031, 268.8664855957031, 302.14190673828125, 274.20391845703125, 265.2698669433594, 291.14227294921875, 291.3167419433594], "nvml_power": 114.626, "nvml_energy": 32.06097955275182, "compile_time": 252.0423970418051, "verification_time": 0, "benchmark_time": 3347.3138789413497, "edp": 8967.480413535934, "flops_watt": 4286798.325854754, "occupancy": 93.11911370958352, "strategy_time": 0, "framework_time": 0.4153390182182193, "timestamp": "2025-02-18 03:06:51.773892+00:00"},
"2,128,4,2": {"block_size_x": 2, "block_size_y": 128, "tile_size_x": 4, "tile_size_y": 2, "sm__warps_active.avg.pct_of_peak_sustained_active": 92.7989751402078, "sm__maximum_warps_per_active_cycle_pct": 92.7989751402078, "time": 277.2015904017857, "times": [264.2512512207031, 265.55914306640625, 296.3932189941406, 274.9533386230469, 264.88189697265625, 285.69158935546875, 288.6806945800781], "nvml_power": 114.485, "nvml_energy": 31.735424077148437, "compile_time": 255.44784392695874, "verification_time": 0, "benchmark_time": 3325.263866921887, "edp": 8797.11002626067, "flops_watt": 4330774.126033027, "occupancy": 92.7989751402078, "strategy_time": 0, "framework_time": 0.4018991021439433, "timestamp": "2025-02-18 03:06:55.355030+00:00"},
"2,128,4,4": {"block_size_x": 2, "block_size_y": 128, "tile_size_x": 4, "tile_size_y": 4, "sm__warps_active.avg.pct_of_peak_sustained_active": 92.51575370154875, "sm__maximum_warps_per_active_cycle_pct": 92.51575370154875, "time": 277.2972412109375, "times": [263.40655517578125, 266.0575866699219, 297.63153076171875, 277.9617004394531, 264.2742919921875, 282.4267883300781, 289.3222351074219], "nvml_power": 114.529, "nvml_energy": 31.758575738647462, "compile_time": 254.41312498878688, "verification_time": 0, "benchmark_time": 3318.1451320415363, "edp": 8806.565437115552, "flops_watt": 4327617.038088663, "occupancy": 92.51575370154875, "strategy_time": 0, "framework_time": 0.4126789281144738, "timestamp": "2025-02-18 03:06:58.928026+00:00"},
"2,256,1,1": {"block_size_x": 2, "block_size_y": 256, "tile_size_x": 1, "tile_size_y": 1, "sm__warps_active.avg.pct_of_peak_sustained_active": 92.60900137356467, "sm__maximum_warps_per_active_cycle_pct": 92.60900137356467, "time": 414.0514657156808, "times": [397.7086486816406, 432.93695068359375, 397.06085205078125, 427.3641662597656, 409.72174072265625, 407.9525146484375, 425.6153869628906], "nvml_power": 115.461, "nvml_energy": 47.80679628299822, "compile_time": 250.1985679846257, "verification_time": 0, "benchmark_time": 4547.626950079575, "edp": 19794.474072146375, "flops_watt": 2874883.1580014937, "occupancy": 92.60900137356467, "strategy_time": 0, "framework_time": 0.4041698994114995, "timestamp": "2025-02-18 03:07:03.726280+00:00"},
"2,256,1,2": {"block_size_x": 2, "block_size_y": 256, "tile_size_x": 1, "tile_size_y": 2, "sm__warps_active.avg.pct_of_peak_sustained_active": 92.44358882251045, "sm__maximum_warps_per_active_cycle_pct": 92.44358882251045, "time": 406.9191414969308, "times": [388.90155029296875, 422.1038818359375, 392.1353454589844, 416.75506591796875, 407.8525695800781, 399.8546142578125, 420.8309631347656], "nvml_power": 114.815, "nvml_energy": 46.72042123097011, "compile_time": 254.90275397896767, "verification_time": 0, "benchmark_time": 4475.903769023716, "edp": 19011.433697681336, "flops_watt": 2941731.8990457696, "occupancy": 92.44358882251045, "strategy_time": 0, "framework_time": 0.4087400157004595, "timestamp": "2025-02-18 03:07:08.457519+00:00"},
"2,256,1,4": {"block_size_x": 2, "block_size_y": 256, "tile_size_x": 1, "tile_size_y": 4, "sm__warps_active.avg.pct_of_peak_sustained_active": 92.55262972406284, "sm__maximum_warps_per_active_cycle_pct": 92.55262972406284, "time": 407.52357700892856, "times": [391.46282958984375, 423.8394775390625, 395.60107421875, 416.4366149902344, 408.343505859375, 398.12237548828125, 418.8591613769531], "nvml_power": 115.109, "nvml_energy": 46.90963142592076, "compile_time": 252.20676697790623, "verification_time": 0, "benchmark_time": 4476.867187069729, "edp": 19116.780794861672, "flops_watt": 2929866.4111024253, "occupancy": 92.55262972406284, "strategy_time": 0, "framework_time": 0.4074889002367854, "timestamp": "2025-02-18 03:07:13.187025+00:00"},
"2,256,2,1": {"block_size_x": 2, "block_size_y": 256, "tile_size_x": 2, "tile_size_y": 1, "sm__warps_active.avg.pct_of_peak_sustained_active": 89.67676604423198, "sm__maximum_warps_per_active_cycle_pct": 89.67676604423198, "time": 434.5061732700893, "times": [422.3509216308594, 449.45037841796875, 418.1871643066406, 451.2431640625, 422.5011901855469, 442.45611572265625, 435.3542785644531], "nvml_power": 115.695, "nvml_energy": 50.27019171648298, "compile_time": 250.54176698904485, "verification_time": 0, "benchmark_time": 4785.48329800833, "edp": 21842.70863228276, "flops_watt": 2734004.9595819516, "occupancy": 89.67676604423198, "strategy_time": 0, "framework_time": 0.4060500068590045, "timestamp": "2025-02-18 03:07:18.223481+00:00"},
"2,256,2,2": {"block_size_x": 2, "block_size_y": 256, "tile_size_x": 2, "tile_size_y": 2, "sm__warps_active.avg.pct_of_peak_sustained_active": 89.5841248131406, "sm__maximum_warps_per_active_cycle_pct": 89.5841248131406, "time": 433.1055385044643, "times": [422.79266357421875, 444.0040588378906, 418.04095458984375, 448.0634460449219, 421.6553039550781, 441.04962158203125, 436.1327209472656], "nvml_power": 115.22, "nvml_energy": 49.902420146484374, "compile_time": 252.71945598069578, "verification_time": 0, "benchmark_time": 4766.999403014779, "edp": 21613.01455021914, "flops_watt": 2754154.0684511787, "occupancy": 89.5841248131406, "strategy_time": 0, "framework_time": 0.39930001366883516, "timestamp": "2025-02-18 03:07:23.243623+00:00"},
"2,256,2,4": {"block_size_x": 2, "block_size_y": 256, "tile_size_x": 2, "tile_size_y": 4, "sm__warps_active.avg.pct_of_peak_sustained_active": 89.24268203608278, "sm__maximum_warps_per_active_cycle_pct": 89.24268203608278, "time": 433.31062970842635, "times": [419.6074523925781, 447.29193115234375, 416.69830322265625, 450.8105163574219, 422.7566833496094, 440.89715576171875, 435.11236572265625], "nvml_power": 115.404, "nvml_energy": 50.005779910871226, "compile_time": 250.34641800448298, "verification_time": 0, "benchmark_time": 4767.4796029459685, "edp": 21668.035982240588, "flops_watt": 2748461.3522070246, "occupancy": 89.24268203608278, "strategy_time": 0, "framework_time": 0.40965911466628313, "timestamp": "2025-02-18 03:07:28.261883+00:00"},
"2,256,4,1": {"block_size_x": 2, "block_size_y": 256, "tile_size_x": 4, "tile_size_y": 1, "sm__warps_active.avg.pct_of_peak_sustained_active": 90.84876359406692, "sm__maximum_warps_per_active_cycle_pct": 90.84876359406692, "time": 237.7704315185547, "times": [227.6853485107422, 227.11619567871094, 247.91949462890625, 253.56118774414062, 233.1516876220703, 227.10333251953125, 247.85577392578125], "nvml_power": 113.277, "nvml_energy": 26.933921171127317, "compile_time": 251.5418870607391, "verification_time": 0, "benchmark_time": 3115.411245962605, "edp": 6404.090059345678, "flops_watt": 5102820.068372819, "occupancy": 90.84876359406692, "strategy_time": 0, "framework_time": 0.40258001536130905, "timestamp": "2025-02-18 03:07:31.629263+00:00"},
"2,256,4,2": {"block_size_x": 2, "block_size_y": 256, "tile_size_x": 4, "tile_size_y": 2, "sm__warps_active.avg.pct_of_peak_sustained_active": 91.57378769231987, "sm__maximum_warps_per_active_cycle_pct": 91.57378769231987, "time": 236.9511217389788, "times": [227.56626892089844, 227.1261444091797, 246.69078063964844, 250.31788635253906, 233.42044067382812, 228.8296356201172, 244.70669555664062], "nvml_power": 113.261, "nvml_energy": 26.83732099927848, "compile_time": 251.98135699611157, "verification_time": 0, "benchmark_time": 3099.2974479449913, "edp": 6359.133315248087, "flops_watt": 5121187.523735885, "occupancy": 91.57378769231987, "strategy_time": 0, "framework_time": 0.4025300731882453, "timestamp": "2025-02-18 03:07:34.980969+00:00"},
"2,256,4,4": {"block_size_x": 2, "block_size_y": 256, "tile_size_x": 4, "tile_size_y": 4, "sm__warps_active.avg.pct_of_peak_sustained_active": 90.33640119863637, "sm__maximum_warps_per_active_cycle_pct": 90.33640119863637, "time": 235.3616899762835, "times": [227.77459716796875, 227.10479736328125, 243.0891876220703, 250.0075225830078, 231.7689971923828, 227.52493286132812, 240.2617950439453], "nvml_power": 114.285, "nvml_energy": 26.898310738939557, "compile_time": 248.6916290363297, "verification_time": 0, "benchmark_time": 3091.487215948291, "edp": 6330.831873024029, "flops_watt": 5109575.646065959, "occupancy": 90.33640119863637, "strategy_time": 0, "framework_time": 0.4025599919259548, "timestamp": "2025-02-18 03:07:38.321575+00:00"},
"4,8,1,1": {"block_size_x": 4, "block_size_y": 8, "tile_size_x": 1, "tile_size_y": 1, "sm__warps_active.avg.pct_of_peak_sustained_active": 49.94532205251181, "sm__maximum_warps_per_active_cycle_pct": 49.94532205251181, "time": 290.6352975027902, "times": [277.1424255371094, 288.1510314941406, 308.1809387207031, 284.832763671875, 279.8062744140625, 302.1608581542969, 294.17279052734375], "nvml_power": 115.067, "nvml_energy": 33.44253177775356, "compile_time": 254.03193605598062, "verification_time": 0, "benchmark_time": 3499.560786993243, "edp": 9719.580172473921, "flops_watt": 4109705.4010553802, "occupancy": 49.94532205251181, "strategy_time": 0, "framework_time": 0.4004779038950801, "timestamp": "2025-02-18 03:07:42.075592+00:00"},
"4,8,1,2": {"block_size_x": 4, "block_size_y": 8, "tile_size_x": 1, "tile_size_y": 2, "sm__warps_active.avg.pct_of_peak_sustained_active": 49.94539365353553, "sm__maximum_warps_per_active_cycle_pct": 49.94539365353553, "time": 291.031014578683, "times": [278.2090759277344, 289.40118408203125, 308.2279052734375, 284.72149658203125, 279.97381591796875, 305.0966491699219, 291.58697509765625], "nvml_power": 115.737, "nvml_energy": 33.68305653429304, "compile_time": 252.48953700065613, "verification_time": 0, "benchmark_time": 3504.802761017345, "edp": 9802.814117286442, "flops_watt": 4080358.7207732205, "occupancy": 49.94539365353553, "strategy_time": 0, "framework_time": 0.4141289973631501, "timestamp": "2025-02-18 03:07:45.833323+00:00"},
"4,8,1,4": {"block_size_x": 4, "block_size_y": 8, "tile_size_x": 1, "tile_size_y": 4, "sm__warps_active.avg.pct_of_peak_sustained_active": 49.9458201878357, "sm__maximum_warps_per_active_cycle_pct": 49.9458201878357, "time": 292.3171168736049, "times": [278.98016357421875, 290.3280334472656, 308.853515625, 286.6934509277344, 280.4762878417969, 304.10711669921875, 296.78125], "nvml_power": 114.925, "nvml_energy": 33.59454465669904, "compile_time": 248.64356906618923, "verification_time": 0, "benchmark_time": 3517.649180954322, "edp": 9820.260436727833, "flops_watt": 4091109.282071888, "occupancy": 49.9458201878357, "strategy_time": 0, "framework_time": 0.40411995723843575, "timestamp": "2025-02-18 03:07:49.600045+00:00"},
"4,8,2,1": {"block_size_x": 4, "block_size_y": 8, "tile_size_x": 2, "tile_size_y": 1, "sm__warps_active.avg.pct_of_peak_sustained_active": 49.949481871403464, "sm__maximum_warps_per_active_cycle_pct": 49.949481871403464, "time": 346.96891130719865, "times": [333.2848205566406, 365.62786865234375, 347.474853515625, 334.92596435546875, 362.8318176269531, 344.46795654296875, 340.1690979003906], "nvml_power": 114.498, "nvml_energy": 39.727246406851634, "compile_time": 253.2111459877342, "verification_time": 0, "benchmark_time": 3844.0002179704607, "edp": 13784.11943501813, "flops_watt": 3459564.049933658, "occupancy": 49.949481871403464, "strategy_time": 0, "framework_time": 0.39913004729896784, "timestamp": "2025-02-18 03:07:53.697678+00:00"},
