experiments/data/run1/power_tuning_float16.json
{
"device_name": "NVIDIA RTX 5000 Ada Generation",
"kernel_name": "tuned_matmul<__half>",
"problem_size": [
4096,
4096
],
"tune_params_keys": [
"block_size_x",
"block_size_y",
"tile_size_x",
"tile_size_y"
],
"tune_params": {
"block_size_x": [
1,
2,
4,
8,
16,
32,
64,
128,
256
],
"block_size_y": [
1,
2,
4,
8,
16,
32,
64,
128,
256
],
"tile_size_x": [
1,
2,
4
],
"tile_size_y": [
1,
2,
4
]
},
"objective": "time",
"cache": {
"1,32,1,1": {"block_size_x": 1, "block_size_y": 32, "tile_size_x": 1, "tile_size_y": 1, "sm__warps_active.avg.pct_of_peak_sustained_active": 49.9546302674983, "sm__maximum_warps_per_active_cycle_pct": 49.9546302674983, "time": 319.2240687779018, "times": [318.6733093261719, 320.14434814453125, 319.4523620605469, 317.84393310546875, 320.0179748535156, 319.7208557128906, 318.7156982421875], "nvml_power": 115.042, "nvml_energy": 36.72417532034738, "compile_time": 246.86472001485527, "verification_time": 0, "benchmark_time": 3868.093910976313, "edp": 11723.240668274295, "flops_watt": 3742465.3453239193, "occupancy": 49.9546302674983, "strategy_time": 0, "framework_time": 0, "timestamp": "2025-02-18 02:30:27.996706+00:00"},
"1,32,1,2": {"block_size_x": 1, "block_size_y": 32, "tile_size_x": 1, "tile_size_y": 2, "sm__warps_active.avg.pct_of_peak_sustained_active": 49.954646054263975, "sm__maximum_warps_per_active_cycle_pct": 49.954646054263975, "time": 319.55076817103793, "times": [316.31201171875, 320.5769958496094, 320.7245788574219, 319.7587890625, 319.24395751953125, 321.8028259277344, 318.43621826171875], "nvml_power": 114.495, "nvml_energy": 36.58696520174299, "compile_time": 244.70407201442868, "verification_time": 0, "benchmark_time": 3873.357067001052, "edp": 11691.392835264007, "flops_watt": 3756500.5108828335, "occupancy": 49.954646054263975, "strategy_time": 0, "framework_time": 0.43890997767448425, "timestamp": "2025-02-18 02:30:32.115237+00:00"},
"1,32,1,4": {"block_size_x": 1, "block_size_y": 32, "tile_size_x": 1, "tile_size_y": 4, "sm__warps_active.avg.pct_of_peak_sustained_active": 49.95527960317878, "sm__maximum_warps_per_active_cycle_pct": 49.95527960317878, "time": 320.3903241838728, "times": [318.96441650390625, 321.2440490722656, 321.7871398925781, 317.41058349609375, 320.6242370605469, 323.5829772949219, 319.1188659667969], "nvml_power": 115.598, "nvml_energy": 37.03648069500733, "compile_time": 250.95889810472727, "verification_time": 0, "benchmark_time": 3883.330359007232, "edp": 11866.130056503143, "flops_watt": 3710907.4861566788, "occupancy": 49.95527960317878, "strategy_time": 0, "framework_time": 0.42469892650842667, "timestamp": "2025-02-18 02:30:36.249976+00:00"},
"1,32,2,1": {"block_size_x": 1, "block_size_y": 32, "tile_size_x": 2, "tile_size_y": 1, "sm__warps_active.avg.pct_of_peak_sustained_active": 49.91110889782034, "sm__maximum_warps_per_active_cycle_pct": 49.91110889782034, "time": 161.4783652169364, "times": [160.50210571289062, 159.5792999267578, 159.33030700683594, 159.55165100097656, 164.20608520507812, 164.9628448486328, 162.2162628173828], "nvml_power": 115.046, "nvml_energy": 18.577440004747665, "compile_time": 251.62141700275242, "verification_time": 0, "benchmark_time": 2450.7523679640144, "edp": 2999.854641882368, "flops_watt": 7398164.302340689, "occupancy": 49.91110889782034, "strategy_time": 0, "framework_time": 0.4129389999434352, "timestamp": "2025-02-18 02:30:38.952787+00:00"},
"1,32,2,2": {"block_size_x": 1, "block_size_y": 32, "tile_size_x": 2, "tile_size_y": 2, "sm__warps_active.avg.pct_of_peak_sustained_active": 49.911883337031696, "sm__maximum_warps_per_active_cycle_pct": 49.911883337031696, "time": 161.54519871303015, "times": [160.7269744873047, 159.63133239746094, 159.61203002929688, 159.48675537109375, 164.5430450439453, 164.9525146484375, 161.86373901367188], "nvml_power": 115.692, "nvml_energy": 18.68948712950788, "compile_time": 251.55752710998058, "verification_time": 0, "benchmark_time": 2452.0230169873685, "edp": 3019.1969121809702, "flops_watt": 7353810.862739226, "occupancy": 49.911883337031696, "strategy_time": 0, "framework_time": 0.42277888860553503, "timestamp": "2025-02-18 02:30:41.656816+00:00"},
"1,32,2,4": {"block_size_x": 1, "block_size_y": 32, "tile_size_x": 2, "tile_size_y": 4, "sm__warps_active.avg.pct_of_peak_sustained_active": 49.91184933723841, "sm__maximum_warps_per_active_cycle_pct": 49.91184933723841, "time": 161.8935786655971, "times": [160.3687744140625, 159.67286682128906, 159.87059020996094, 160.17910766601562, 165.3119354248047, 165.45718383789062, 162.39459228515625], "nvml_power": 115.61, "nvml_energy": 18.71651662952968, "compile_time": 252.58020602632314, "verification_time": 0, "benchmark_time": 2451.266656978987, "edp": 3030.083857308719, "flops_watt": 7343190.840071059, "occupancy": 49.91184933723841, "strategy_time": 0, "framework_time": 0.43761893175542355, "timestamp": "2025-02-18 02:30:44.361125+00:00"},
"1,32,4,1": {"block_size_x": 1, "block_size_y": 32, "tile_size_x": 4, "tile_size_y": 1, "sm__warps_active.avg.pct_of_peak_sustained_active": 49.82264057100103, "sm__maximum_warps_per_active_cycle_pct": 49.82264057100103, "time": 80.1815163748605, "times": [81.29385375976562, 79.84489440917969, 79.93353271484375, 80.00348663330078, 79.98355102539062, 80.0027847290039, 80.20851135253906], "nvml_power": 116.715, "nvml_energy": 9.358385683691843, "compile_time": 251.94750598166138, "verification_time": 0, "benchmark_time": 1718.8695599325001, "edp": 750.3695549391975, "flops_watt": 14686181.796450702, "occupancy": 49.82264057100103, "strategy_time": 0, "framework_time": 0.43888005893677473, "timestamp": "2025-02-18 02:30:46.332407+00:00"},
"1,32,4,2": {"block_size_x": 1, "block_size_y": 32, "tile_size_x": 4, "tile_size_y": 2, "sm__warps_active.avg.pct_of_peak_sustained_active": 49.82370050203081, "sm__maximum_warps_per_active_cycle_pct": 49.82370050203081, "time": 80.25047411237445, "times": [80.96995544433594, 80.1530532836914, 80.02957153320312, 80.28956604003906, 80.01561737060547, 80.25526428222656, 80.04029083251953], "nvml_power": 117.191, "nvml_energy": 9.404633311703273, "compile_time": 252.75023595895618, "verification_time": 0, "benchmark_time": 1719.67246895656, "edp": 754.7262821172179, "flops_watt": 14613961.96074639, "occupancy": 49.82370050203081, "strategy_time": 0, "framework_time": 0.41347008664160967, "timestamp": "2025-02-18 02:30:48.305268+00:00"},
"1,32,4,4": {"block_size_x": 1, "block_size_y": 32, "tile_size_x": 4, "tile_size_y": 4, "sm__warps_active.avg.pct_of_peak_sustained_active": 49.82386990769379, "sm__maximum_warps_per_active_cycle_pct": 49.82386990769379, "time": 80.35697065080915, "times": [81.5189437866211, 79.87382507324219, 79.9734115600586, 80.27699279785156, 80.2589111328125, 80.31680297851562, 80.2799072265625], "nvml_power": 116.69, "nvml_energy": 9.376854905242919, "compile_time": 249.2145278956741, "verification_time": 0, "benchmark_time": 1724.7900350484997, "edp": 753.495654417501, "flops_watt": 14657255.002970474, "occupancy": 49.82386990769379, "strategy_time": 0, "framework_time": 0.40841998998075724, "timestamp": "2025-02-18 02:30:50.279707+00:00"},
"1,64,1,1": {"block_size_x": 1, "block_size_y": 64, "tile_size_x": 1, "tile_size_y": 1, "sm__warps_active.avg.pct_of_peak_sustained_active": 98.72516830727062, "sm__maximum_warps_per_active_cycle_pct": 98.72516830727062, "time": 331.3061305454799, "times": [327.7674255371094, 333.4701232910156, 334.39892578125, 328.2354431152344, 332.83111572265625, 334.6231994628906, 327.8166809082031], "nvml_power": 115.434, "nvml_energy": 38.243991873386925, "compile_time": 249.40431804861873, "verification_time": 0, "benchmark_time": 4014.956653001718, "edp": 12670.468964184602, "flops_watt": 3593739.74157861, "occupancy": 98.72516830727062, "strategy_time": 0, "framework_time": 0.3999900072813034, "timestamp": "2025-02-18 02:30:54.544493+00:00"},
"1,64,1,2": {"block_size_x": 1, "block_size_y": 64, "tile_size_x": 1, "tile_size_y": 2, "sm__warps_active.avg.pct_of_peak_sustained_active": 98.7333400010837, "sm__maximum_warps_per_active_cycle_pct": 98.7333400010837, "time": 331.2071097237723, "times": [328.30023193359375, 332.7797546386719, 333.85205078125, 327.73828125, 332.665771484375, 334.90582275390625, 328.2078552246094], "nvml_power": 114.829, "nvml_energy": 38.03218120247105, "compile_time": 250.43817691039294, "verification_time": 0, "benchmark_time": 4018.084259936586, "edp": 12596.52881256122, "flops_watt": 3613754.171508581, "occupancy": 98.7333400010837, "strategy_time": 0, "framework_time": 0.39942015428096056, "timestamp": "2025-02-18 02:30:58.813439+00:00"},
"1,64,1,4": {"block_size_x": 1, "block_size_y": 64, "tile_size_x": 1, "tile_size_y": 4, "sm__warps_active.avg.pct_of_peak_sustained_active": 98.70624388827665, "sm__maximum_warps_per_active_cycle_pct": 98.70624388827665, "time": 330.5874459402902, "times": [326.98663330078125, 332.4267578125, 333.8068542480469, 327.8922119140625, 332.57672119140625, 333.2770690917969, 327.1458740234375], "nvml_power": 114.562, "nvml_energy": 37.87275898181153, "compile_time": 251.1003870749846, "verification_time": 0, "benchmark_time": 4003.264391911216, "edp": 12520.258662509259, "flops_watt": 3628965.9683363796, "occupancy": 98.70624388827665, "strategy_time": 0, "framework_time": 0.43707003351300955, "timestamp": "2025-02-18 02:31:03.068263+00:00"},
"1,64,2,1": {"block_size_x": 1, "block_size_y": 64, "tile_size_x": 2, "tile_size_y": 1, "sm__warps_active.avg.pct_of_peak_sustained_active": 96.46062762655147, "sm__maximum_warps_per_active_cycle_pct": 96.46062762655147, "time": 177.52684674944197, "times": [173.8566436767578, 170.5397491455078, 170.8019561767578, 177.3311309814453, 186.67213439941406, 186.7730255126953, 176.71328735351562], "nvml_power": 115.179, "nvml_energy": 20.447364681753978, "compile_time": 250.6842470029369, "verification_time": 0, "benchmark_time": 2522.240350022912, "edp": 3629.9561762876906, "flops_watt": 6721597.409305387, "occupancy": 96.46062762655147, "strategy_time": 0, "framework_time": 0.3986599622294307, "timestamp": "2025-02-18 02:31:05.841611+00:00"},
"1,64,2,2": {"block_size_x": 1, "block_size_y": 64, "tile_size_x": 2, "tile_size_y": 2, "sm__warps_active.avg.pct_of_peak_sustained_active": 96.46833983890168, "sm__maximum_warps_per_active_cycle_pct": 96.46833983890168, "time": 176.80439104352678, "times": [173.68553161621094, 170.06668090820312, 170.05596923828125, 176.46786499023438, 184.87158203125, 185.6488037109375, 176.8343048095703], "nvml_power": 115.07, "nvml_energy": 20.344881277378626, "compile_time": 253.00022505689412, "verification_time": 0, "benchmark_time": 2514.488626969978, "edp": 3597.0643450997773, "flops_watt": 6755456.156179083, "occupancy": 96.46833983890168, "strategy_time": 0, "framework_time": 0.3990399418398738, "timestamp": "2025-02-18 02:31:08.609524+00:00"},
"1,64,2,4": {"block_size_x": 1, "block_size_y": 64, "tile_size_x": 2, "tile_size_y": 4, "sm__warps_active.avg.pct_of_peak_sustained_active": 96.53220865264555, "sm__maximum_warps_per_active_cycle_pct": 96.53220865264555, "time": 177.01483590262276, "times": [173.93157958984375, 170.9697265625, 170.7198028564453, 177.9457244873047, 185.1676788330078, 185.3616943359375, 175.0076446533203], "nvml_power": 114.39, "nvml_energy": 20.24872707890102, "compile_time": 251.78168597631156, "verification_time": 0, "benchmark_time": 2516.5170149412006, "edp": 3584.325101108658, "flops_watt": 6787535.479956668, "occupancy": 96.53220865264555, "strategy_time": 0, "framework_time": 0.3999000182375312, "timestamp": "2025-02-18 02:31:11.378247+00:00"},
"1,64,4,1": {"block_size_x": 1, "block_size_y": 64, "tile_size_x": 4, "tile_size_y": 1, "sm__warps_active.avg.pct_of_peak_sustained_active": 95.69420033645713, "sm__maximum_warps_per_active_cycle_pct": 95.69420033645713, "time": 86.63949257986886, "times": [89.09907531738281, 86.16044616699219, 86.30400085449219, 86.18153381347656, 86.56572723388672, 86.20134735107422, 85.96431732177734], "nvml_power": 115.998, "nvml_energy": 10.050007860279628, "compile_time": 252.68120598047972, "verification_time": 0, "benchmark_time": 1789.504821994342, "edp": 870.7275814383205, "flops_watt": 13675507.062556263, "occupancy": 95.69420033645713, "strategy_time": 0, "framework_time": 0.40560902561992407, "timestamp": "2025-02-18 02:31:13.420862+00:00"},
"1,64,4,2": {"block_size_x": 1, "block_size_y": 64, "tile_size_x": 4, "tile_size_y": 2, "sm__warps_active.avg.pct_of_peak_sustained_active": 95.56215228346925, "sm__maximum_warps_per_active_cycle_pct": 95.56215228346925, "time": 86.93780953543526, "times": [89.3832015991211, 85.9521255493164, 86.15817260742188, 86.56543731689453, 86.56086730957031, 87.01654052734375, 86.9283218383789], "nvml_power": 116.032, "nvml_energy": 10.087567916015624, "compile_time": 250.0595779856667, "verification_time": 0, "benchmark_time": 1806.0610999818891, "edp": 876.991058158334, "flops_watt": 13624587.672296481, "occupancy": 95.56215228346925, "strategy_time": 0, "framework_time": 0.40565000381320715, "timestamp": "2025-02-18 02:31:15.477412+00:00"},
"1,64,4,4": {"block_size_x": 1, "block_size_y": 64, "tile_size_x": 4, "tile_size_y": 4, "sm__warps_active.avg.pct_of_peak_sustained_active": 95.40838422668838, "sm__maximum_warps_per_active_cycle_pct": 95.40838422668838, "time": 87.00314222063336, "times": [89.4290542602539, 86.66777801513672, 86.81219482421875, 86.28457641601562, 86.88317108154297, 86.56761932373047, 86.37760162353516], "nvml_power": 116.722, "nvml_energy": 10.155180766276768, "compile_time": 252.76126607786864, "verification_time": 0, "benchmark_time": 1806.6218890016899, "edp": 883.5326364846181, "flops_watt": 13533875.628133181, "occupancy": 95.40838422668838, "strategy_time": 0, "framework_time": 0.4017589380964637, "timestamp": "2025-02-18 02:31:17.537221+00:00"},
"1,128,1,1": {"block_size_x": 1, "block_size_y": 128, "tile_size_x": 1, "tile_size_y": 1, "sm__warps_active.avg.pct_of_peak_sustained_active": 99.06586459113093, "sm__maximum_warps_per_active_cycle_pct": 99.06586459113093, "time": 338.6220921107701, "times": [334.2109069824219, 346.4666442871094, 342.29388427734375, 335.4774169921875, 342.4603576660156, 336.4956359863281, 332.9497985839844], "nvml_power": 115.242, "nvml_energy": 39.02348713902937, "compile_time": 251.67715596035123, "verification_time": 0, "benchmark_time": 3776.237256010063, "edp": 13214.214856475855, "flops_watt": 3521954.688015063, "occupancy": 99.06586459113093, "strategy_time": 0, "framework_time": 0.39439997635781765, "timestamp": "2025-02-18 02:31:21.565554+00:00"},
"1,128,1,2": {"block_size_x": 1, "block_size_y": 128, "tile_size_x": 1, "tile_size_y": 2, "sm__warps_active.avg.pct_of_peak_sustained_active": 99.06877318108639, "sm__maximum_warps_per_active_cycle_pct": 99.06877318108639, "time": 339.03113228934154, "times": [335.2179260253906, 344.08831787109375, 340.0157165527344, 334.16986083984375, 343.2359924316406, 340.56768798828125, 335.92242431640625], "nvml_power": 114.895, "nvml_energy": 38.9529819443839, "compile_time": 251.7593060620129, "verification_time": 0, "benchmark_time": 3764.7185359383, "edp": 13206.273574650751, "flops_watt": 3528329.4528832715, "occupancy": 99.06877318108639, "strategy_time": 0, "framework_time": 0.3969999961555004, "timestamp": "2025-02-18 02:31:25.582455+00:00"},
"1,128,1,4": {"block_size_x": 1, "block_size_y": 128, "tile_size_x": 1, "tile_size_y": 4, "sm__warps_active.avg.pct_of_peak_sustained_active": 99.05807134557423, "sm__maximum_warps_per_active_cycle_pct": 99.05807134557423, "time": 338.69464111328125, "times": [334.5487365722656, 343.2470703125, 337.4979248046875, 334.417236328125, 344.80712890625, 340.5688171386719, 335.77557373046875], "nvml_power": 115.013, "nvml_energy": 38.95428675836182, "compile_time": 253.92407400067896, "verification_time": 0, "benchmark_time": 3775.8055770536885, "edp": 13193.608173447199, "flops_watt": 3528211.2678522533, "occupancy": 99.05807134557423, "strategy_time": 0, "framework_time": 0.3992499550804496, "timestamp": "2025-02-18 02:31:29.612608+00:00"},
"1,128,2,1": {"block_size_x": 1, "block_size_y": 128, "tile_size_x": 2, "tile_size_y": 1, "sm__warps_active.avg.pct_of_peak_sustained_active": 98.88793273402567, "sm__maximum_warps_per_active_cycle_pct": 98.88793273402567, "time": 182.8991481236049, "times": [179.74339294433594, 176.8582763671875, 177.04086303710938, 187.1880340576172, 193.9850616455078, 186.31015014648438, 179.1682586669922], "nvml_power": 116.096, "nvml_energy": 21.233859500558037, "compile_time": 253.49625502713025, "verification_time": 0, "benchmark_time": 2606.1583230039105, "edp": 3883.6548140283794, "flops_watt": 6472631.763829277, "occupancy": 98.88793273402567, "strategy_time": 0, "framework_time": 0.4003189969807863, "timestamp": "2025-02-18 02:31:32.472687+00:00"},
"1,128,2,2": {"block_size_x": 1, "block_size_y": 128, "tile_size_x": 2, "tile_size_y": 2, "sm__warps_active.avg.pct_of_peak_sustained_active": 98.88104481606155, "sm__maximum_warps_per_active_cycle_pct": 98.88104481606155, "time": 181.8445325578962, "times": [178.9652862548828, 176.0902099609375, 175.88992309570312, 185.15887451171875, 192.9626922607422, 186.05133056640625, 177.7934112548828], "nvml_power": 116.228, "nvml_energy": 21.135426330139158, "compile_time": 250.35560701508075, "verification_time": 0, "benchmark_time": 2588.2014569360763, "edp": 3843.3617214160067, "flops_watt": 6502776.491241711, "occupancy": 98.88104481606155, "strategy_time": 0, "framework_time": 0.42134011164307594, "timestamp": "2025-02-18 02:31:35.311690+00:00"},
"1,128,2,4": {"block_size_x": 1, "block_size_y": 128, "tile_size_x": 2, "tile_size_y": 4, "sm__warps_active.avg.pct_of_peak_sustained_active": 98.86141277922798, "sm__maximum_warps_per_active_cycle_pct": 98.86141277922798, "time": 181.8222438267299, "times": [178.6727294921875, 175.83999633789062, 176.48223876953125, 186.3190460205078, 192.50563049316406, 186.094970703125, 176.84109497070312], "nvml_power": 116.185, "nvml_energy": 21.125017399008613, "compile_time": 253.1764650484547, "verification_time": 0, "benchmark_time": 2586.6876690415666, "edp": 3840.9980643664553, "flops_watt": 6505980.60470473, "occupancy": 98.86141277922798, "strategy_time": 0, "framework_time": 0.3978799795731902, "timestamp": "2025-02-18 02:31:38.151977+00:00"},
"1,128,4,1": {"block_size_x": 1, "block_size_y": 128, "tile_size_x": 4, "tile_size_y": 1, "sm__warps_active.avg.pct_of_peak_sustained_active": 98.40866848541404, "sm__maximum_warps_per_active_cycle_pct": 98.40866848541404, "time": 92.21717725481305, "times": [94.5163803100586, 91.87606048583984, 91.71676635742188, 91.7228775024414, 91.87718200683594, 91.61222076416016, 92.1987533569336], "nvml_power": 116.803, "nvml_energy": 10.771242954893928, "compile_time": 250.45298703480512, "verification_time": 0, "benchmark_time": 1807.2158590657637, "edp": 993.2936208261096, "flops_watt": 12759804.420673143, "occupancy": 98.40866848541404, "strategy_time": 0, "framework_time": 0.3958689048886299, "timestamp": "2025-02-18 02:31:40.210067+00:00"},
"1,128,4,2": {"block_size_x": 1, "block_size_y": 128, "tile_size_x": 4, "tile_size_y": 2, "sm__warps_active.avg.pct_of_peak_sustained_active": 98.4308848033986, "sm__maximum_warps_per_active_cycle_pct": 98.4308848033986, "time": 91.26512472970145, "times": [93.53679656982422, 90.90409851074219, 90.77094268798828, 90.82073974609375, 91.25606536865234, 90.78684997558594, 90.78038024902344], "nvml_power": 116.732, "nvml_energy": 10.65356053994751, "compile_time": 253.1073649879545, "verification_time": 0, "benchmark_time": 1792.6953400019556, "edp": 972.298531493735, "flops_watt": 12900753.035254931, "occupancy": 98.4308848033986, "strategy_time": 0, "framework_time": 0.3988799871876836, "timestamp": "2025-02-18 02:31:42.256293+00:00"},
"1,128,4,4": {"block_size_x": 1, "block_size_y": 128, "tile_size_x": 4, "tile_size_y": 4, "sm__warps_active.avg.pct_of_peak_sustained_active": 98.38593130985531, "sm__maximum_warps_per_active_cycle_pct": 98.38593130985531, "time": 91.33645738874164, "times": [94.35814666748047, 91.10985565185547, 90.69071960449219, 90.89766693115234, 90.92243194580078, 91.20028686523438, 90.17609405517578], "nvml_power": 116.76, "nvml_energy": 10.664444764709474, "compile_time": 253.2504959963262, "verification_time": 0, "benchmark_time": 1806.537477998063, "edp": 974.0526048264757, "flops_watt": 12887586.41488863, "occupancy": 98.38593130985531, "strategy_time": 0, "framework_time": 0.39901002310216427, "timestamp": "2025-02-18 02:31:44.316503+00:00"},
"1,256,1,1": {"block_size_x": 1, "block_size_y": 256, "tile_size_x": 1, "tile_size_y": 1, "sm__warps_active.avg.pct_of_peak_sustained_active": 98.7288527118891, "sm__maximum_warps_per_active_cycle_pct": 98.7288527118891, "time": 327.4504699707031, "times": [324.8020935058594, 330.17840576171875, 329.5653076171875, 324.84954833984375, 329.1192626953125, 327.9857177734375, 325.6529541015625], "nvml_power": 115.316, "nvml_energy": 37.760278395141604, "compile_time": 248.0807499960065, "verification_time": 0, "benchmark_time": 3967.0021820347756, "edp": 12364.620906713706, "flops_watt": 3639775.95805235, "occupancy": 98.7288527118891, "strategy_time": 0, "framework_time": 0.4145299317315221, "timestamp": "2025-02-18 02:31:48.532025+00:00"},
"1,256,1,2": {"block_size_x": 1, "block_size_y": 256, "tile_size_x": 1, "tile_size_y": 2, "sm__warps_active.avg.pct_of_peak_sustained_active": 98.78375091165614, "sm__maximum_warps_per_active_cycle_pct": 98.78375091165614, "time": 327.79736328125, "times": [324.3673400878906, 329.9127502441406, 330.4046325683594, 325.59521484375, 328.29425048828125, 327.65771484375, 328.3496398925781], "nvml_power": 115.241, "nvml_energy": 37.775695941894526, "compile_time": 251.19526602793485, "verification_time": 0, "benchmark_time": 3970.2999000437558, "edp": 12382.773525867242, "flops_watt": 3638290.441648106, "occupancy": 98.78375091165614, "strategy_time": 0, "framework_time": 0.40915992576628923, "timestamp": "2025-02-18 02:31:52.753953+00:00"},
"1,256,1,4": {"block_size_x": 1, "block_size_y": 256, "tile_size_x": 1, "tile_size_y": 4, "sm__warps_active.avg.pct_of_peak_sustained_active": 98.9151015746814, "sm__maximum_warps_per_active_cycle_pct": 98.9151015746814, "time": 327.504638671875, "times": [325.8341064453125, 329.70098876953125, 326.1982727050781, 325.61688232421875, 330.2026672363281, 328.6951599121094, 326.2843933105469], "nvml_power": 115.21, "nvml_energy": 37.73180942138672, "compile_time": 255.45717298518866, "verification_time": 0, "benchmark_time": 3973.7049370305613, "edp": 12357.342610987307, "flops_watt": 3642522.200223411, "occupancy": 98.9151015746814, "strategy_time": 0, "framework_time": 0.39616995491087437, "timestamp": "2025-02-18 02:31:56.983536+00:00"},
"1,256,2,1": {"block_size_x": 1, "block_size_y": 256, "tile_size_x": 2, "tile_size_y": 1, "sm__warps_active.avg.pct_of_peak_sustained_active": 97.8940934952946, "sm__maximum_warps_per_active_cycle_pct": 97.8940934952946, "time": 172.84001813616072, "times": [171.46759033203125, 168.7046661376953, 169.16400146484375, 173.56112670898438, 179.46214294433594, 176.9404754638672, 170.5801239013672], "nvml_power": 115.344, "nvml_energy": 19.936059051897324, "compile_time": 251.81689707096666, "verification_time": 0, "benchmark_time": 2457.2858839528635, "edp": 3445.7488080935045, "flops_watt": 6893988.080303157, "occupancy": 97.8940934952946, "strategy_time": 0, "framework_time": 0.40874897968024015, "timestamp": "2025-02-18 02:31:59.693072+00:00"},
"1,256,2,2": {"block_size_x": 1, "block_size_y": 256, "tile_size_x": 2, "tile_size_y": 2, "sm__warps_active.avg.pct_of_peak_sustained_active": 97.90644904485517, "sm__maximum_warps_per_active_cycle_pct": 97.90644904485517, "time": 172.00679452078683, "times": [169.98489379882812, 168.4949493408203, 169.18643188476562, 172.39881896972656, 177.8145294189453, 174.93072509765625, 171.23721313476562], "nvml_power": 115.64, "nvml_energy": 19.89086571838379, "compile_time": 253.28884494956583, "verification_time": 0, "benchmark_time": 2445.713402936235, "edp": 3421.3640524626035, "flops_watt": 6909651.667145609, "occupancy": 97.90644904485517, "strategy_time": 0, "framework_time": 0.39949011988937855, "timestamp": "2025-02-18 02:32:02.392498+00:00"},
"1,256,2,4": {"block_size_x": 1, "block_size_y": 256, "tile_size_x": 2, "tile_size_y": 4, "sm__warps_active.avg.pct_of_peak_sustained_active": 97.96224680860928, "sm__maximum_warps_per_active_cycle_pct": 97.96224680860928, "time": 173.09005083356584, "times": [171.76275634765625, 169.1254425048828, 170.84442138671875, 172.73606872558594, 179.2512664794922, 176.80323791503906, 171.10716247558594], "nvml_power": 115.506, "nvml_energy": 19.992939411581858, "compile_time": 248.13774996437132, "verification_time": 0, "benchmark_time": 2459.881330956705, "edp": 3460.578899063106, "flops_watt": 6874374.530059446, "occupancy": 97.96224680860928, "strategy_time": 0, "framework_time": 0.3995790611952543, "timestamp": "2025-02-18 02:32:05.100940+00:00"},
"1,256,4,1": {"block_size_x": 1, "block_size_y": 256, "tile_size_x": 4, "tile_size_y": 1, "sm__warps_active.avg.pct_of_peak_sustained_active": 97.45388097631462, "sm__maximum_warps_per_active_cycle_pct": 97.45388097631462, "time": 85.45777784075055, "times": [87.39852905273438, 84.7270736694336, 85.0816650390625, 85.36185455322266, 85.3325424194336, 85.33631896972656, 84.96646118164062], "nvml_power": 116.436, "nvml_energy": 9.950361820665632, "compile_time": 250.6426670588553, "verification_time": 0, "benchmark_time": 1767.7287110127509, "edp": 850.3358099055298, "flops_watt": 13812457.87329631, "occupancy": 97.45388097631462, "strategy_time": 0, "framework_time": 0.4337399732321501, "timestamp": "2025-02-18 02:32:07.119770+00:00"},
"1,256,4,2": {"block_size_x": 1, "block_size_y": 256, "tile_size_x": 4, "tile_size_y": 2, "sm__warps_active.avg.pct_of_peak_sustained_active": 97.38043596183668, "sm__maximum_warps_per_active_cycle_pct": 97.38043596183668, "time": 85.19581821986607, "times": [87.17584228515625, 84.60089874267578, 84.72035217285156, 85.12576293945312, 84.85564422607422, 84.84352111816406, 85.0487060546875], "nvml_power": 116.323, "nvml_energy": 9.910233162789481, "compile_time": 253.95349401514977, "verification_time": 0, "benchmark_time": 1754.9440709408373, "edp": 844.310423053501, "flops_watt": 13868387.475286644, "occupancy": 97.38043596183668, "strategy_time": 0, "framework_time": 0.397720024921, "timestamp": "2025-02-18 02:32:09.129090+00:00"},
"1,256,4,4": {"block_size_x": 1, "block_size_y": 256, "tile_size_x": 4, "tile_size_y": 4, "sm__warps_active.avg.pct_of_peak_sustained_active": 97.42992160140123, "sm__maximum_warps_per_active_cycle_pct": 97.42992160140123, "time": 85.58380453927177, "times": [87.34223937988281, 85.71110534667969, 85.67680358886719, 84.81587219238281, 84.90972900390625, 85.4516830444336, 85.17919921875], "nvml_power": 116.519, "nvml_energy": 9.972139321111408, "compile_time": 252.54268501885235, "verification_time": 0, "benchmark_time": 1760.4828970506787, "edp": 853.453622496385, "flops_watt": 13782293.753260784, "occupancy": 97.42992160140123, "strategy_time": 0, "framework_time": 0.3957098815590143, "timestamp": "2025-02-18 02:32:11.142537+00:00"},
"2,16,1,1": {"block_size_x": 2, "block_size_y": 16, "tile_size_x": 1, "tile_size_y": 1, "sm__warps_active.avg.pct_of_peak_sustained_active": 49.952416134382865, "sm__maximum_warps_per_active_cycle_pct": 49.952416134382865, "time": 183.13640921456474, "times": [178.5834503173828, 176.1337890625, 176.0359344482422, 184.81459045410156, 193.13848876953125, 193.15049743652344, 180.09811401367188], "nvml_power": 114.853, "nvml_energy": 21.033766007520402, "compile_time": 254.8162939492613, "verification_time": 0, "benchmark_time": 2600.4803269170225, "edp": 3852.048378876658, "flops_watt": 6534205.687315346, "occupancy": 49.952416134382865, "strategy_time": 0, "framework_time": 0.39722013752907515, "timestamp": "2025-02-18 02:32:13.998255+00:00"},
"2,16,1,2": {"block_size_x": 2, "block_size_y": 16, "tile_size_x": 1, "tile_size_y": 2, "sm__warps_active.avg.pct_of_peak_sustained_active": 49.951690873303065, "sm__maximum_warps_per_active_cycle_pct": 49.951690873303065, "time": 182.0566144670759, "times": [177.42153930664062, 174.94090270996094, 175.3389434814453, 183.6393280029297, 192.6854705810547, 190.74493408203125, 179.62518310546875], "nvml_power": 115.207, "nvml_energy": 20.97419638290841, "compile_time": 248.0849389685318, "verification_time": 0, "benchmark_time": 2591.6555849835277, "edp": 3818.491184639894, "flops_watt": 6552763.737064899, "occupancy": 49.951690873303065, "strategy_time": 0, "framework_time": 0.39388006553053856, "timestamp": "2025-02-18 02:32:16.838412+00:00"},
"2,16,1,4": {"block_size_x": 2, "block_size_y": 16, "tile_size_x": 1, "tile_size_y": 4, "sm__warps_active.avg.pct_of_peak_sustained_active": 49.95240257831387, "sm__maximum_warps_per_active_cycle_pct": 49.95240257831387, "time": 182.8996124267578, "times": [178.22317504882812, 176.06239318847656, 175.86679077148438, 185.0293731689453, 193.19369506835938, 192.34906005859375, 179.5727996826172], "nvml_power": 115.042, "nvml_energy": 21.04113721279907, "compile_time": 252.4131949758157, "verification_time": 0, "benchmark_time": 2605.3501239512116, "edp": 3848.415841239181, "flops_watt": 6531916.6013706485, "occupancy": 49.95240257831387, "strategy_time": 0, "framework_time": 0.4078800557181239, "timestamp": "2025-02-18 02:32:19.696607+00:00"},
"2,16,2,1": {"block_size_x": 2, "block_size_y": 16, "tile_size_x": 2, "tile_size_y": 1, "sm__warps_active.avg.pct_of_peak_sustained_active": 49.95232864745738, "sm__maximum_warps_per_active_cycle_pct": 49.95232864745738, "time": 183.88079833984375, "times": [179.3573760986328, 176.17913818359375, 176.59024047851562, 186.71090698242188, 194.87152099609375, 193.35125732421875, 180.1051483154297], "nvml_power": 115.217, "nvml_energy": 21.186193942321776, "compile_time": 253.58094600960612, "verification_time": 0, "benchmark_time": 2616.769304033369, "edp": 3895.73425589689, "flops_watt": 6487194.153238181, "occupancy": 49.95232864745738, "strategy_time": 0, "framework_time": 0.3990589175373316, "timestamp": "2025-02-18 02:32:22.567381+00:00"},
"2,16,2,2": {"block_size_x": 2, "block_size_y": 16, "tile_size_x": 2, "tile_size_y": 2, "sm__warps_active.avg.pct_of_peak_sustained_active": 49.95217755575389, "sm__maximum_warps_per_active_cycle_pct": 49.95217755575389, "time": 182.84605625697546, "times": [179.7410888671875, 174.60902404785156, 175.468505859375, 186.42247009277344, 193.88124084472656, 190.7001953125, 179.09986877441406], "nvml_power": 115.488, "nvml_energy": 21.11652534500558, "compile_time": 254.27185406442732, "verification_time": 0, "benchmark_time": 2602.105817059055, "edp": 3861.0733811847385, "flops_watt": 6508596.9981565485, "occupancy": 49.95217755575389, "strategy_time": 0, "framework_time": 0.4013899015262723, "timestamp": "2025-02-18 02:32:25.424185+00:00"},
"2,16,2,4": {"block_size_x": 2, "block_size_y": 16, "tile_size_x": 2, "tile_size_y": 4, "sm__warps_active.avg.pct_of_peak_sustained_active": 49.953081910870765, "sm__maximum_warps_per_active_cycle_pct": 49.953081910870765, "time": 186.3829105922154, "times": [181.7481231689453, 177.94277954101562, 178.04885864257812, 191.0245819091797, 196.5094757080078, 196.18736267089844, 183.2191925048828], "nvml_power": 115.216, "nvml_energy": 21.474293426792688, "compile_time": 253.79975500982255, "verification_time": 0, "benchmark_time": 2645.975479972549, "edp": 4002.4413117969007, "flops_watt": 6400161.846560338, "occupancy": 49.953081910870765, "strategy_time": 0, "framework_time": 0.3984590293839574, "timestamp": "2025-02-18 02:32:28.324383+00:00"},
"2,16,4,1": {"block_size_x": 2, "block_size_y": 16, "tile_size_x": 4, "tile_size_y": 1, "sm__warps_active.avg.pct_of_peak_sustained_active": 49.907937228152655, "sm__maximum_warps_per_active_cycle_pct": 49.907937228152655, "time": 89.18407658168248, "times": [93.45311737060547, 88.35212707519531, 88.89993286132812, 88.32915496826172, 88.4708480834961, 88.36579132080078, 88.41756439208984], "nvml_power": 116.609, "nvml_energy": 10.399665986113412, "compile_time": 253.71673505287617, "verification_time": 0, "benchmark_time": 1854.840051033534, "edp": 927.4846077294569, "flops_watt": 13215708.432897855, "occupancy": 49.907937228152655, "strategy_time": 0, "framework_time": 0.3881698939949274, "timestamp": "2025-02-18 02:32:30.433351+00:00"},
"2,16,4,2": {"block_size_x": 2, "block_size_y": 16, "tile_size_x": 4, "tile_size_y": 2, "sm__warps_active.avg.pct_of_peak_sustained_active": 49.905725959872235, "sm__maximum_warps_per_active_cycle_pct": 49.905725959872235, "time": 88.99576786586216, "times": [92.76185607910156, 88.18134307861328, 88.45024108886719, 88.17110443115234, 88.42169952392578, 88.45964813232422, 88.52448272705078], "nvml_power": 116.986, "nvml_energy": 10.411258899555751, "compile_time": 250.46748702879995, "verification_time": 0, "benchmark_time": 1852.2961620474234, "edp": 926.5579802162551, "flops_watt": 13200992.77118779, "occupancy": 49.905725959872235, "strategy_time": 0, "framework_time": 0.406289822421968, "timestamp": "2025-02-18 02:32:32.536546+00:00"},
"2,16,4,4": {"block_size_x": 2, "block_size_y": 16, "tile_size_x": 4, "tile_size_y": 4, "sm__warps_active.avg.pct_of_peak_sustained_active": 49.90797367158434, "sm__maximum_warps_per_active_cycle_pct": 49.90797367158434, "time": 90.05396161760602, "times": [92.23798370361328, 89.15443420410156, 89.75785827636719, 89.5225601196289, 89.72886657714844, 89.92098999023438, 90.05503845214844], "nvml_power": 114.878, "nvml_energy": 10.345219002707346, "compile_time": 253.17565503064543, "verification_time": 0, "benchmark_time": 1887.3181940289214, "edp": 931.6279549955358, "flops_watt": 13285262.828755217, "occupancy": 49.90797367158434, "strategy_time": 0, "framework_time": 0.4154099151492119, "timestamp": "2025-02-18 02:32:34.677480+00:00"},
"2,32,1,1": {"block_size_x": 2, "block_size_y": 32, "tile_size_x": 1, "tile_size_y": 1, "sm__warps_active.avg.pct_of_peak_sustained_active": 99.23482100318111, "sm__maximum_warps_per_active_cycle_pct": 99.23482100318111, "time": 220.4235098702567, "times": [213.25672912597656, 211.9634552001953, 220.43980407714844, 235.76797485351562, 233.11404418945312, 214.59552001953125, 213.82704162597656], "nvml_power": 115.164, "nvml_energy": 25.384853090698243, "compile_time": 253.637615009211, "verification_time": 0, "benchmark_time": 2919.263059971854, "edp": 5595.418415792541, "flops_watt": 5414211.103800387, "occupancy": 99.23482100318111, "strategy_time": 0, "framework_time": 0.400940072722733, "timestamp": "2025-02-18 02:32:37.850806+00:00"},
"2,32,1,2": {"block_size_x": 2, "block_size_y": 32, "tile_size_x": 1, "tile_size_y": 2, "sm__warps_active.avg.pct_of_peak_sustained_active": 99.23635882450412, "sm__maximum_warps_per_active_cycle_pct": 99.23635882450412, "time": 217.37766592843192, "times": [212.42477416992188, 210.30105590820312, 217.96893310546875, 234.7232666015625, 223.6868438720703, 210.96348571777344, 211.57530212402344], "nvml_power": 114.917, "nvml_energy": 24.98038923549761, "compile_time": 255.92718296684325, "verification_time": 0, "benchmark_time": 2868.4985210420564, "edp": 5430.178705996197, "flops_watt": 5501873.977075449, "occupancy": 99.23635882450412, "strategy_time": 0, "framework_time": 0.4042399814352393, "timestamp": "2025-02-18 02:32:40.975661+00:00"},
"2,32,1,4": {"block_size_x": 2, "block_size_y": 32, "tile_size_x": 1, "tile_size_y": 4, "sm__warps_active.avg.pct_of_peak_sustained_active": 99.2443397849641, "sm__maximum_warps_per_active_cycle_pct": 99.2443397849641, "time": 217.48729814801897, "times": [213.1293182373047, 210.9516143798828, 216.98019409179688, 233.85379028320312, 223.91395568847656, 211.15005493164062, 212.43215942382812], "nvml_power": 115.935, "nvml_energy": 25.21438991079058, "compile_time": 254.3574549490586, "verification_time": 0, "benchmark_time": 2878.434553043917, "edp": 5483.809536148512, "flops_watt": 5450814.156450503, "occupancy": 99.2443397849641, "strategy_time": 0, "framework_time": 0.39214896969497204, "timestamp": "2025-02-18 02:32:44.108869+00:00"},
"2,32,2,1": {"block_size_x": 2, "block_size_y": 32, "tile_size_x": 2, "tile_size_y": 1, "sm__warps_active.avg.pct_of_peak_sustained_active": 99.32651039517158, "sm__maximum_warps_per_active_cycle_pct": 99.32651039517158, "time": 218.29858616420202, "times": [213.52406311035156, 211.14678955078125, 220.22210693359375, 235.02581787109375, 223.47442626953125, 211.41734313964844, 213.27955627441406], "nvml_power": 116.033, "nvml_energy": 25.329839848390854, "compile_time": 252.47256504371762, "verification_time": 0, "benchmark_time": 2887.1564959408715, "edp": 5529.468226669389, "flops_watt": 5425970.09276911, "occupancy": 99.32651039517158, "strategy_time": 0, "framework_time": 0.40315999649465084, "timestamp": "2025-02-18 02:32:47.248926+00:00"},
"2,32,2,2": {"block_size_x": 2, "block_size_y": 32, "tile_size_x": 2, "tile_size_y": 2, "sm__warps_active.avg.pct_of_peak_sustained_active": 99.33022184734313, "sm__maximum_warps_per_active_cycle_pct": 99.33022184734313, "time": 218.68040684291296, "times": [213.9448699951172, 211.62579345703125, 224.7790069580078, 231.7310333251953, 221.57504272460938, 211.9199981689453, 215.18710327148438], "nvml_power": 114.47, "nvml_energy": 25.032346171308244, "compile_time": 250.5532370414585, "verification_time": 0, "benchmark_time": 2871.6923790052533, "edp": 5474.083644974321, "flops_watt": 5490454.331824908, "occupancy": 99.33022184734313, "strategy_time": 0, "framework_time": 0.4157099174335599, "timestamp": "2025-02-18 02:32:50.371611+00:00"},
"2,32,2,4": {"block_size_x": 2, "block_size_y": 32, "tile_size_x": 2, "tile_size_y": 4, "sm__warps_active.avg.pct_of_peak_sustained_active": 99.32809907472948, "sm__maximum_warps_per_active_cycle_pct": 99.32809907472948, "time": 218.50254821777344, "times": [214.1320037841797, 212.11392211914062, 219.5869140625, 234.6570281982422, 224.4420166015625, 212.0281982421875, 212.55775451660156], "nvml_power": 115.859, "nvml_energy": 25.31548673396301, "compile_time": 251.42674706876278, "verification_time": 0, "benchmark_time": 2890.456374036148, "edp": 5531.498360744156, "flops_watt": 5429046.453513897, "occupancy": 99.32809907472948, "strategy_time": 0, "framework_time": 0.4007489187642932, "timestamp": "2025-02-18 02:32:53.513919+00:00"},
"2,32,4,1": {"block_size_x": 2, "block_size_y": 32, "tile_size_x": 4, "tile_size_y": 1, "sm__warps_active.avg.pct_of_peak_sustained_active": 97.4133250387686, "sm__maximum_warps_per_active_cycle_pct": 97.4133250387686, "time": 106.45283726283482, "times": [106.64457702636719, 105.1454086303711, 105.1968994140625, 105.23420715332031, 105.21833801269531, 105.12226867675781, 112.60816192626953], "nvml_power": 114.946, "nvml_energy": 12.23632783201381, "compile_time": 255.35398407373577, "verification_time": 0, "benchmark_time": 1988.377982052043, "edp": 1302.5918153960624, "flops_watt": 11232042.43616451, "occupancy": 97.4133250387686, "strategy_time": 0, "framework_time": 0.3933398984372616, "timestamp": "2025-02-18 02:32:55.758068+00:00"},
"2,32,4,2": {"block_size_x": 2, "block_size_y": 32, "tile_size_x": 4, "tile_size_y": 2, "sm__warps_active.avg.pct_of_peak_sustained_active": 97.39046229113609, "sm__maximum_warps_per_active_cycle_pct": 97.39046229113609, "time": 106.1249280657087, "times": [107.19430541992188, 104.27196502685547, 104.6165771484375, 104.68281555175781, 104.96729278564453, 104.5618896484375, 112.57965087890625], "nvml_power": 114.036, "nvml_energy": 12.102062296901156, "compile_time": 255.35463402047753, "verification_time": 0, "benchmark_time": 1984.3138660071418, "edp": 1284.3304907053607, "flops_watt": 11356655.59308784, "occupancy": 97.39046229113609, "strategy_time": 0, "framework_time": 0.396809889934957, "timestamp": "2025-02-18 02:32:57.998158+00:00"},
"2,32,4,4": {"block_size_x": 2, "block_size_y": 32, "tile_size_x": 4, "tile_size_y": 4, "sm__warps_active.avg.pct_of_peak_sustained_active": 97.4047297091189, "sm__maximum_warps_per_active_cycle_pct": 97.4047297091189, "time": 106.22169603620257, "times": [106.3826904296875, 105.13263702392578, 104.90022277832031, 105.13225555419922, 104.50393676757812, 105.12518310546875, 112.37494659423828], "nvml_power": 115.209, "nvml_energy": 12.237695378634863, "compile_time": 251.48408696986735, "verification_time": 0, "benchmark_time": 1981.1283079907298, "edp": 1299.9087586929934, "flops_watt": 11230787.269958306, "occupancy": 97.4047297091189, "strategy_time": 0, "framework_time": 0.3888290375471115, "timestamp": "2025-02-18 02:33:00.231184+00:00"},
"2,64,1,1": {"block_size_x": 2, "block_size_y": 64, "tile_size_x": 1, "tile_size_y": 1, "sm__warps_active.avg.pct_of_peak_sustained_active": 98.0841661127118, "sm__maximum_warps_per_active_cycle_pct": 98.0841661127118, "time": 220.50094604492188, "times": [215.3750762939453, 212.8194580078125, 222.0743408203125, 237.21688842773438, 225.78041076660156, 214.58627319335938, 215.6541748046875], "nvml_power": 114.951, "nvml_energy": 25.346804248809814, "compile_time": 254.16359503287822, "verification_time": 0, "benchmark_time": 2917.426120955497, "edp": 5588.994316078009, "flops_watt": 5422338.537153203, "occupancy": 98.0841661127118, "strategy_time": 0, "framework_time": 0.4005599766969681, "timestamp": "2025-02-18 02:33:03.403199+00:00"},
"2,64,1,2": {"block_size_x": 2, "block_size_y": 64, "tile_size_x": 1, "tile_size_y": 2, "sm__warps_active.avg.pct_of_peak_sustained_active": 98.02852746100503, "sm__maximum_warps_per_active_cycle_pct": 98.02852746100503, "time": 220.5149427141462, "times": [214.56687927246094, 213.42713928222656, 223.08615112304688, 236.8816375732422, 226.28871154785156, 213.48410034179688, 215.86997985839844], "nvml_power": 114.641, "nvml_energy": 25.280053547692436, "compile_time": 254.28105401806533, "verification_time": 0, "benchmark_time": 2917.291991994716, "edp": 5574.629559879946, "flops_watt": 5436655.947453301, "occupancy": 98.02852746100503, "strategy_time": 0, "framework_time": 0.4056199686601758, "timestamp": "2025-02-18 02:33:06.575202+00:00"},
"2,64,1,4": {"block_size_x": 2, "block_size_y": 64, "tile_size_x": 1, "tile_size_y": 4, "sm__warps_active.avg.pct_of_peak_sustained_active": 97.98189112164481, "sm__maximum_warps_per_active_cycle_pct": 97.98189112164481, "time": 220.76809692382812, "times": [215.7718048095703, 213.05564880371094, 223.00265502929688, 236.75299072265625, 226.9486083984375, 213.91754150390625, 215.92742919921875], "nvml_power": 115.544, "nvml_energy": 25.508428990966795, "compile_time": 252.3500359384343, "verification_time": 0, "benchmark_time": 2923.96958603058, "edp": 5631.447323852345, "flops_watt": 5387981.891031813, "occupancy": 97.98189112164481, "strategy_time": 0, "framework_time": 0.40849996730685234, "timestamp": "2025-02-18 02:33:09.751955+00:00"},
"2,64,2,1": {"block_size_x": 2, "block_size_y": 64, "tile_size_x": 2, "tile_size_y": 1, "sm__warps_active.avg.pct_of_peak_sustained_active": 98.0233274686448, "sm__maximum_warps_per_active_cycle_pct": 98.0233274686448, "time": 222.49723597935267, "times": [216.99594116210938, 215.53018188476562, 225.68946838378906, 238.7373809814453, 225.14720153808594, 216.2262420654297, 219.15423583984375], "nvml_power": 115.313, "nvml_energy": 25.656823772487094, "compile_time": 254.8194540431723, "verification_time": 0, "benchmark_time": 2953.944292035885, "edp": 5708.572373387727, "flops_watt": 5356818.704090008, "occupancy": 98.0233274686448, "strategy_time": 0, "framework_time": 0.4036600003018975, "timestamp": "2025-02-18 02:33:12.961148+00:00"},
"2,64,2,2": {"block_size_x": 2, "block_size_y": 64, "tile_size_x": 2, "tile_size_y": 2, "sm__warps_active.avg.pct_of_peak_sustained_active": 97.98910613093229, "sm__maximum_warps_per_active_cycle_pct": 97.98910613093229, "time": 222.9048810686384, "times": [217.58761596679688, 215.27842712402344, 226.79750061035156, 238.830078125, 228.6077423095703, 215.36941528320312, 217.86338806152344], "nvml_power": 115.406, "nvml_energy": 25.724560704607285, "compile_time": 250.64454693347216, "verification_time": 0, "benchmark_time": 2952.979792957194, "edp": 5734.130144403455, "flops_watt": 5342713.333385888, "occupancy": 97.98910613093229, "strategy_time": 0, "framework_time": 0.39951002690941095, "timestamp": "2025-02-18 02:33:16.165196+00:00"},
"2,64,2,4": {"block_size_x": 2, "block_size_y": 64, "tile_size_x": 2, "tile_size_y": 4, "sm__warps_active.avg.pct_of_peak_sustained_active": 97.94222161466935, "sm__maximum_warps_per_active_cycle_pct": 97.94222161466935, "time": 223.66173008510046, "times": [217.78585815429688, 216.26800537109375, 227.84527587890625, 240.982177734375, 226.5370635986328, 216.59957885742188, 219.61415100097656], "nvml_power": 114.383, "nvml_energy": 25.583099672324046, "compile_time": 250.08650706149638, "verification_time": 0, "benchmark_time": 2968.887501046993, "edp": 5721.960333651563, "flops_watt": 5372255.716952168, "occupancy": 97.94222161466935, "strategy_time": 0, "framework_time": 0.4273399244993925, "timestamp": "2025-02-18 02:33:19.384625+00:00"},
"2,64,4,1": {"block_size_x": 2, "block_size_y": 64, "tile_size_x": 4, "tile_size_y": 1, "sm__warps_active.avg.pct_of_peak_sustained_active": 97.83693588062422, "sm__maximum_warps_per_active_cycle_pct": 97.83693588062422, "time": 111.25659942626953, "times": [111.26659393310547, 109.136962890625, 109.07830047607422, 109.27760314941406, 109.57727813720703, 109.63721466064453, 120.8222427368164], "nvml_power": 114.385, "nvml_energy": 12.726086125373842, "compile_time": 250.68119703792036, "verification_time": 0, "benchmark_time": 1951.7795729916543, "edp": 1415.861066314924, "flops_watt": 10799781.811783282, "occupancy": 97.83693588062422, "strategy_time": 0, "framework_time": 0.7302789017558098, "timestamp": "2025-02-18 02:33:21.587850+00:00"},
"2,64,4,2": {"block_size_x": 2, "block_size_y": 64, "tile_size_x": 4, "tile_size_y": 2, "sm__warps_active.avg.pct_of_peak_sustained_active": 97.80323553936222, "sm__maximum_warps_per_active_cycle_pct": 97.80323553936222, "time": 110.96717834472656, "times": [110.54393768310547, 108.83647918701172, 109.18045043945312, 109.06118774414062, 108.88365173339844, 109.86329650878906, 120.4012451171875], "nvml_power": 114.435, "nvml_energy": 12.698529053878785, "compile_time": 251.6523270169273, "verification_time": 0, "benchmark_time": 2069.374568061903, "edp": 1409.1199382374589, "flops_watt": 10823218.41284594, "occupancy": 97.80323553936222, "strategy_time": 0, "framework_time": 0.4023489309474826, "timestamp": "2025-02-18 02:33:23.909303+00:00"},
"2,64,4,4": {"block_size_x": 2, "block_size_y": 64, "tile_size_x": 4, "tile_size_y": 4, "sm__warps_active.avg.pct_of_peak_sustained_active": 97.76447073436117, "sm__maximum_warps_per_active_cycle_pct": 97.76447073436117, "time": 109.65999058314732, "times": [110.46259307861328, 107.49091339111328, 108.0362548828125, 107.96163177490234, 107.64959716796875, 108.01757049560547, 118.00137329101562], "nvml_power": 114.624, "nvml_energy": 12.569666760602678, "compile_time": 253.055815002881, "verification_time": 0, "benchmark_time": 2036.0069849994034, "edp": 1378.3895386009895, "flops_watt": 10934176.385867069, "occupancy": 97.76447073436117, "strategy_time": 0, "framework_time": 0.3996990853920579, "timestamp": "2025-02-18 02:33:26.198791+00:00"},
"2,128,1,1": {"block_size_x": 2, "block_size_y": 128, "tile_size_x": 1, "tile_size_y": 1, "sm__warps_active.avg.pct_of_peak_sustained_active": 98.41922262223865, "sm__maximum_warps_per_active_cycle_pct": 98.41922262223865, "time": 186.08534676688058, "times": [185.0668182373047, 181.07766723632812, 181.62051391601562, 192.3594207763672, 193.1727752685547, 186.51776123046875, 182.782470703125], "nvml_power": 115.938, "nvml_energy": 21.574362933458602, "compile_time": 252.439665957354, "verification_time": 0, "benchmark_time": 2646.95329091046, "edp": 4014.672807747179, "flops_watt": 6370475.637955122, "occupancy": 98.41922262223865, "strategy_time": 0, "framework_time": 0.4067691043019295, "timestamp": "2025-02-18 02:33:29.098616+00:00"},
"2,128,1,2": {"block_size_x": 2, "block_size_y": 128, "tile_size_x": 1, "tile_size_y": 2, "sm__warps_active.avg.pct_of_peak_sustained_active": 98.52707502067545, "sm__maximum_warps_per_active_cycle_pct": 98.52707502067545, "time": 187.87260219029017, "times": [184.87974548339844, 183.11705017089844, 183.9267578125, 194.097412109375, 194.3871612548828, 188.183837890625, 186.51625061035156], "nvml_power": 115.671, "nvml_energy": 21.731411767953055, "compile_time": 252.4229750270024, "verification_time": 0, "benchmark_time": 2661.7404189892113, "edp": 4082.736878114035, "flops_watt": 6324437.406072205, "occupancy": 98.52707502067545, "strategy_time": 0, "framework_time": 0.3995699808001518, "timestamp": "2025-02-18 02:33:32.013203+00:00"},
"2,128,1,4": {"block_size_x": 2, "block_size_y": 128, "tile_size_x": 1, "tile_size_y": 4, "sm__warps_active.avg.pct_of_peak_sustained_active": 97.9312266413607, "sm__maximum_warps_per_active_cycle_pct": 97.9312266413607, "time": 189.78323364257812, "times": [188.63270568847656, 186.7109832763672, 185.89187622070312, 196.5708465576172, 192.94435119628906, 189.7879638671875, 187.94390869140625], "nvml_power": 114.679, "nvml_energy": 21.764151450897216, "compile_time": 252.40542693063617, "verification_time": 0, "benchmark_time": 2716.350044007413, "edp": 4130.471039838082, "flops_watt": 6314923.592683148, "occupancy": 97.9312266413607, "strategy_time": 0, "framework_time": 0.3888290375471115, "timestamp": "2025-02-18 02:33:34.982370+00:00"},
"2,128,2,1": {"block_size_x": 2, "block_size_y": 128, "tile_size_x": 2, "tile_size_y": 1, "sm__warps_active.avg.pct_of_peak_sustained_active": 96.33709316917928, "sm__maximum_warps_per_active_cycle_pct": 96.33709316917928, "time": 205.2957305908203, "times": [201.10488891601562, 199.8738555908203, 205.32969665527344, 215.5795135498047, 214.20809936523438, 201.05917358398438, 199.91488647460938], "nvml_power": 115.924, "nvml_energy": 23.798702273010257, "compile_time": 254.74950496573, "verification_time": 0, "benchmark_time": 2721.4904400752857, "edp": 4885.771970251057, "flops_watt": 5775060.837156125, "occupancy": 96.33709316917928, "strategy_time": 0, "framework_time": 0.42190891690552235, "timestamp": "2025-02-18 02:33:37.959057+00:00"},
"2,128,2,2": {"block_size_x": 2, "block_size_y": 128, "tile_size_x": 2, "tile_size_y": 2, "sm__warps_active.avg.pct_of_peak_sustained_active": 96.073526242867, "sm__maximum_warps_per_active_cycle_pct": 96.073526242867, "time": 204.8798588344029, "times": [201.35731506347656, 199.40240478515625, 203.98294067382812, 213.6183319091797, 213.5865020751953, 202.094970703125, 200.11654663085938], "nvml_power": 115.669, "nvml_energy": 23.69824839151655, "compile_time": 253.9934739470482, "verification_time": 0, "benchmark_time": 2709.1051009483635, "edp": 4855.293785076527, "flops_watt": 5799540.5905695595, "occupancy": 96.073526242867, "strategy_time": 0, "framework_time": 0.4064200911670923, "timestamp": "2025-02-18 02:33:40.922586+00:00"},
"2,128,2,4": {"block_size_x": 2, "block_size_y": 128, "tile_size_x": 2, "tile_size_y": 4, "sm__warps_active.avg.pct_of_peak_sustained_active": 95.84142638730985, "sm__maximum_warps_per_active_cycle_pct": 95.84142638730985, "time": 204.93468366350447, "times": [200.5608367919922, 198.2671356201172, 204.98150634765625, 216.15487670898438, 212.27078247070312, 202.08998107910156, 200.21766662597656], "nvml_power": 116.517, "nvml_energy": 23.87837453642055, "compile_time": 252.50755599699914, "verification_time": 0, "benchmark_time": 2715.720475069247, "edp": 4893.507132020026, "flops_watt": 5755791.84681817, "occupancy": 95.84142638730985, "strategy_time": 0, "framework_time": 0.40419900324195623, "timestamp": "2025-02-18 02:33:43.891243+00:00"},
"2,128,4,1": {"block_size_x": 2, "block_size_y": 128, "tile_size_x": 4, "tile_size_y": 1, "sm__warps_active.avg.pct_of_peak_sustained_active": 96.40928136820962, "sm__maximum_warps_per_active_cycle_pct": 96.40928136820962, "time": 97.38071659633091, "times": [98.91142272949219, 97.38899230957031, 97.01983642578125, 96.93350219726562, 97.29468536376953, 96.98246765136719, 97.13410949707031], "nvml_power": 115.438, "nvml_energy": 11.241435162447248, "compile_time": 252.91246501728892, "verification_time": 0, "benchmark_time": 1904.8970809672028, "edp": 1094.6990116903046, "flops_watt": 12226103.828016894, "occupancy": 96.40928136820962, "strategy_time": 0, "framework_time": 0.3915600245818496, "timestamp": "2025-02-18 02:33:46.049468+00:00"},
"2,128,4,2": {"block_size_x": 2, "block_size_y": 128, "tile_size_x": 4, "tile_size_y": 2, "sm__warps_active.avg.pct_of_peak_sustained_active": 96.39376445926716, "sm__maximum_warps_per_active_cycle_pct": 96.39376445926716, "time": 97.80148642403739, "times": [98.76886749267578, 97.95030212402344, 97.74681854248047, 97.27337646484375, 97.53094482421875, 97.18809509277344, 98.1520004272461], "nvml_power": 115.495, "nvml_energy": 11.2955826745442, "compile_time": 252.91298504453152, "verification_time": 0, "benchmark_time": 1917.705210042186, "edp": 1104.7247755960266, "flops_watt": 12167495.68676376, "occupancy": 96.39376445926716, "strategy_time": 0, "framework_time": 0.4009598633274436, "timestamp": "2025-02-18 02:33:48.220512+00:00"},
"2,128,4,4": {"block_size_x": 2, "block_size_y": 128, "tile_size_x": 4, "tile_size_y": 4, "sm__warps_active.avg.pct_of_peak_sustained_active": 96.19511058106465, "sm__maximum_warps_per_active_cycle_pct": 96.19511058106465, "time": 97.53327941894531, "times": [98.65721893310547, 97.16108703613281, 96.3315200805664, 97.23919677734375, 97.46678161621094, 97.96166229248047, 97.91548919677734], "nvml_power": 115.452, "nvml_energy": 11.260412175476073, "compile_time": 253.2883450621739, "verification_time": 0, "benchmark_time": 1915.1465920731425, "edp": 1098.2649270832017, "flops_watt": 12205499.348534219, "occupancy": 96.19511058106465, "strategy_time": 0, "framework_time": 0.425799866206944, "timestamp": "2025-02-18 02:33:50.389398+00:00"},
"2,256,1,1": {"block_size_x": 2, "block_size_y": 256, "tile_size_x": 1, "tile_size_y": 1, "sm__warps_active.avg.pct_of_peak_sustained_active": 99.22439839009097, "sm__maximum_warps_per_active_cycle_pct": 99.22439839009097, "time": 175.43648856026786, "times": [175.72508239746094, 173.2376708984375, 172.09071350097656, 175.84889221191406, 179.17254638671875, 176.93894958496094, 175.04156494140625], "nvml_power": 114.784, "nvml_energy": 20.137301902901786, "compile_time": 255.2351530175656, "verification_time": 0, "benchmark_time": 2488.326458958909, "edp": 3532.8175349230896, "flops_watt": 6825092.762411982, "occupancy": 99.22439839009097, "strategy_time": 0, "framework_time": 0.41776010766625404, "timestamp": "2025-02-18 02:33:53.133402+00:00"},
"2,256,1,2": {"block_size_x": 2, "block_size_y": 256, "tile_size_x": 1, "tile_size_y": 2, "sm__warps_active.avg.pct_of_peak_sustained_active": 99.21398720986082, "sm__maximum_warps_per_active_cycle_pct": 99.21398720986082, "time": 175.02397809709822, "times": [175.26080322265625, 171.81443786621094, 171.66592407226562, 175.3838348388672, 179.9679718017578, 176.54351806640625, 174.53135681152344], "nvml_power": 115.23, "nvml_energy": 20.168012996128628, "compile_time": 250.80352695658803, "verification_time": 0, "benchmark_time": 2484.4599119387567, "edp": 3529.885864896409, "flops_watt": 6814699.767318785, "occupancy": 99.21398720986082, "strategy_time": 0, "framework_time": 0.4075800534337759, "timestamp": "2025-02-18 02:33:55.869098+00:00"},
"2,256,1,4": {"block_size_x": 2, "block_size_y": 256, "tile_size_x": 1, "tile_size_y": 4, "sm__warps_active.avg.pct_of_peak_sustained_active": 99.19778907422291, "sm__maximum_warps_per_active_cycle_pct": 99.19778907422291, "time": 175.26454162597656, "times": [174.52169799804688, 171.62991333007812, 171.70118713378906, 174.946533203125, 180.68528747558594, 178.80950927734375, 174.5576629638672], "nvml_power": 114.944, "nvml_energy": 20.145607472656252, "compile_time": 252.9711249517277, "verification_time": 0, "benchmark_time": 2485.373151022941, "edp": 3530.810659471946, "flops_watt": 6822278.933933697, "occupancy": 99.19778907422291, "strategy_time": 0, "framework_time": 0.4122700775042176, "timestamp": "2025-02-18 02:33:58.607878+00:00"},
"2,256,2,1": {"block_size_x": 2, "block_size_y": 256, "tile_size_x": 2, "tile_size_y": 1, "sm__warps_active.avg.pct_of_peak_sustained_active": 99.25821721675409, "sm__maximum_warps_per_active_cycle_pct": 99.25821721675409, "time": 174.76553344726562, "times": [175.4851531982422, 173.03082275390625, 171.88986206054688, 174.36399841308594, 178.63168334960938, 175.5269775390625, 174.43023681640625], "nvml_power": 114.972, "nvml_energy": 20.093142911499022, "compile_time": 253.92456504050642, "verification_time": 0, "benchmark_time": 2482.768794056028, "edp": 3511.5888395602706, "flops_watt": 6840092.367697521, "occupancy": 99.25821721675409, "strategy_time": 0, "framework_time": 0.392249901778996, "timestamp": "2025-02-18 02:34:01.344988+00:00"},
"2,256,2,2": {"block_size_x": 2, "block_size_y": 256, "tile_size_x": 2, "tile_size_y": 2, "sm__warps_active.avg.pct_of_peak_sustained_active": 99.2533593195267, "sm__maximum_warps_per_active_cycle_pct": 99.2533593195267, "time": 174.04156058175224, "times": [175.22682189941406, 171.6414794921875, 171.47821044921875, 174.17811584472656, 177.48226928710938, 174.90562438964844, 173.37840270996094], "nvml_power": 114.929, "nvml_energy": 20.002422516100204, "compile_time": 253.40585503727198, "verification_time": 0, "benchmark_time": 2472.9650520021096, "edp": 3481.2528301176585, "flops_watt": 6871115.404215347, "occupancy": 99.2533593195267, "strategy_time": 0, "framework_time": 0.4231089260429144, "timestamp": "2025-02-18 02:34:04.071806+00:00"},
"2,256,2,4": {"block_size_x": 2, "block_size_y": 256, "tile_size_x": 2, "tile_size_y": 4, "sm__warps_active.avg.pct_of_peak_sustained_active": 99.24941722273856, "sm__maximum_warps_per_active_cycle_pct": 99.24941722273856, "time": 174.85564749581474, "times": [174.654296875, 172.4833221435547, 171.32266235351562, 174.60870361328125, 178.99856567382812, 176.8574676513672, 175.06451416015625], "nvml_power": 114.704, "nvml_energy": 20.05664219035993, "compile_time": 252.53204605542123, "verification_time": 0, "benchmark_time": 2478.1293970299885, "edp": 3507.0171567872617, "flops_watt": 6852540.528347211, "occupancy": 99.24941722273856, "strategy_time": 0, "framework_time": 0.41013897862285376, "timestamp": "2025-02-18 02:34:06.802903+00:00"},
"2,256,4,1": {"block_size_x": 2, "block_size_y": 256, "tile_size_x": 4, "tile_size_y": 1, "sm__warps_active.avg.pct_of_peak_sustained_active": 98.97371171437422, "sm__maximum_warps_per_active_cycle_pct": 98.97371171437422, "time": 86.6480952671596, "times": [89.00115203857422, 86.55792236328125, 86.542236328125, 86.54332733154297, 85.97634887695312, 85.95750427246094, 85.95817565917969], "nvml_power": 115.072, "nvml_energy": 9.97076961858259, "compile_time": 255.04439393989742, "verification_time": 0, "benchmark_time": 1784.0923080220819, "edp": 863.948195797845, "flops_watt": 13784187.051705027, "occupancy": 98.97371171437422, "strategy_time": 0, "framework_time": 0.3999100299552083, "timestamp": "2025-02-18 02:34:08.842464+00:00"},
"2,256,4,2": {"block_size_x": 2, "block_size_y": 256, "tile_size_x": 4, "tile_size_y": 2, "sm__warps_active.avg.pct_of_peak_sustained_active": 98.96694113035389, "sm__maximum_warps_per_active_cycle_pct": 98.96694113035389, "time": 86.47453199114118, "times": [88.85215759277344, 86.37545776367188, 86.3670425415039, 86.36121368408203, 85.81298828125, 85.77766418457031, 85.77519989013672], "nvml_power": 115.171, "nvml_energy": 9.95935832395172, "compile_time": 255.53941307589412, "verification_time": 0, "benchmark_time": 1771.3164379820228, "edp": 861.2308499958012, "flops_watt": 13799980.78204162, "occupancy": 98.96694113035389, "strategy_time": 0, "framework_time": 0.3935998538509011, "timestamp": "2025-02-18 02:34:10.869737+00:00"},
"2,256,4,4": {"block_size_x": 2, "block_size_y": 256, "tile_size_x": 4, "tile_size_y": 4, "sm__warps_active.avg.pct_of_peak_sustained_active": 98.96345095196111, "sm__maximum_warps_per_active_cycle_pct": 98.96345095196111, "time": 86.3953377859933, "times": [88.92092895507812, 86.28614044189453, 86.2718734741211, 86.24240112304688, 85.6798095703125, 85.68179321289062, 85.68441772460938], "nvml_power": 115.307, "nvml_energy": 9.961987214089529, "compile_time": 255.77893399167806, "verification_time": 0, "benchmark_time": 1770.1647890498862, "edp": 860.6692503810112, "flops_watt": 13796339.075562762, "occupancy": 98.96345095196111, "strategy_time": 0, "framework_time": 0.39796996861696243, "timestamp": "2025-02-18 02:34:12.896102+00:00"},
"4,8,1,1": {"block_size_x": 4, "block_size_y": 8, "tile_size_x": 1, "tile_size_y": 1, "sm__warps_active.avg.pct_of_peak_sustained_active": 49.94040304637607, "sm__maximum_warps_per_active_cycle_pct": 49.94040304637607, "time": 143.7381112234933, "times": [141.9087371826172, 135.8850555419922, 135.83241271972656, 136.68170166015625, 150.8985595703125, 153.03756713867188, 151.92274475097656], "nvml_power": 115.37299999999999, "nvml_energy": 16.58349710618809, "compile_time": 251.7233369871974, "verification_time": 0, "benchmark_time": 2117.2957479720935, "edp": 2383.680551523743, "flops_watt": 8287694.241567118, "occupancy": 49.94040304637607, "strategy_time": 0, "framework_time": 0.38818910252302885, "timestamp": "2025-02-18 02:34:15.265534+00:00"},
"4,8,1,2": {"block_size_x": 4, "block_size_y": 8, "tile_size_x": 1, "tile_size_y": 2, "sm__warps_active.avg.pct_of_peak_sustained_active": 49.94370852903489, "sm__maximum_warps_per_active_cycle_pct": 49.94370852903489, "time": 137.8774130684989, "times": [133.79330444335938, 132.1378936767578, 132.7159423828125, 132.74050903320312, 134.6123809814453, 149.49559020996094, 149.64627075195312], "nvml_power": 114.729, "nvml_energy": 15.81853772393581, "compile_time": 253.29122599214315, "verification_time": 0, "benchmark_time": 2240.4359590727836, "edp": 2181.01905990273, "flops_watt": 8688473.983536059, "occupancy": 49.94370852903489, "strategy_time": 0, "framework_time": 0.4083198728039861, "timestamp": "2025-02-18 02:34:17.759694+00:00"},
"4,8,1,4": {"block_size_x": 4, "block_size_y": 8, "tile_size_x": 1, "tile_size_y": 4, "sm__warps_active.avg.pct_of_peak_sustained_active": 49.944550943659365, "sm__maximum_warps_per_active_cycle_pct": 49.944550943659365, "time": 136.18875122070312, "times": [133.57772827148438, 131.04701232910156, 130.4422149658203, 130.63632202148438, 132.32281494140625, 147.6775665283203, 147.6175994873047], "nvml_power": 114.692, "nvml_energy": 15.61976025500488, "compile_time": 252.60042492300272, "verification_time": 0, "benchmark_time": 2212.9914419492707, "edp": 2127.235643495886, "flops_watt": 8799043.725908779, "occupancy": 49.944550943659365, "strategy_time": 0, "framework_time": 0.40854013059288263, "timestamp": "2025-02-18 02:34:20.225719+00:00"},
