experiments/data/run1/power_tuning_float32.json
{
"device_name": "NVIDIA RTX 5000 Ada Generation",
"kernel_name": "tuned_matmul<float>",
"problem_size": [
4096,
4096
],
"tune_params_keys": [
"block_size_x",
"block_size_y",
"tile_size_x",
"tile_size_y"
],
"tune_params": {
"block_size_x": [
1,
2,
4,
8,
16,
32,
64,
128,
256
],
"block_size_y": [
1,
2,
4,
8,
16,
32,
64,
128,
256
],
"tile_size_x": [
1,
2,
4
],
"tile_size_y": [
1,
2,
4
]
},
"objective": "time",
"cache": {
"1,32,1,1": {"block_size_x": 1, "block_size_y": 32, "tile_size_x": 1, "tile_size_y": 1, "sm__warps_active.avg.pct_of_peak_sustained_active": 49.955740485148425, "sm__maximum_warps_per_active_cycle_pct": 49.955740485148425, "time": 426.6540788922991, "times": [418.5977783203125, 438.9184875488281, 411.58349609375, 444.3812561035156, 414.4120788574219, 432.3636779785156, 426.32177734375], "nvml_power": 115.952, "nvml_energy": 49.47139375571986, "compile_time": 250.7846769876778, "verification_time": 0, "benchmark_time": 4732.752498937771, "edp": 21107.171934364895, "flops_watt": 2778150.0183853093, "occupancy": 49.955740485148425, "strategy_time": 0, "framework_time": 0, "timestamp": "2025-02-18 02:44:31.488370+00:00"},
"1,32,1,2": {"block_size_x": 1, "block_size_y": 32, "tile_size_x": 1, "tile_size_y": 2, "sm__warps_active.avg.pct_of_peak_sustained_active": 49.9561357327965, "sm__maximum_warps_per_active_cycle_pct": 49.9561357327965, "time": 433.558602469308, "times": [425.0733337402344, 449.9433288574219, 415.0361633300781, 451.848388671875, 419.53436279296875, 440.2814636230469, 433.19317626953125], "nvml_power": 115.895, "nvml_energy": 50.247274233180455, "compile_time": 249.491557944566, "verification_time": 0, "benchmark_time": 4810.527416993864, "edp": 21785.137994429788, "flops_watt": 2735251.923003678, "occupancy": 49.9561357327965, "strategy_time": 0, "framework_time": 0.40419003926217556, "timestamp": "2025-02-18 02:44:36.548816+00:00"},
"1,32,1,4": {"block_size_x": 1, "block_size_y": 32, "tile_size_x": 1, "tile_size_y": 4, "sm__warps_active.avg.pct_of_peak_sustained_active": 49.95606618180952, "sm__maximum_warps_per_active_cycle_pct": 49.95606618180952, "time": 436.1179722377232, "times": [427.9949035644531, 452.7983703613281, 418.2760314941406, 454.56707763671875, 421.3188781738281, 443.2623596191406, 434.6081848144531], "nvml_power": 116.006, "nvml_energy": 50.592301487409316, "compile_time": 251.48644705768675, "verification_time": 0, "benchmark_time": 4844.6246980456635, "edp": 22064.2119355285, "flops_watt": 2716598.1667428953, "occupancy": 49.95606618180952, "strategy_time": 0, "framework_time": 0.4118499346077442, "timestamp": "2025-02-18 02:44:41.645364+00:00"},
"1,32,2,1": {"block_size_x": 1, "block_size_y": 32, "tile_size_x": 2, "tile_size_y": 1, "sm__warps_active.avg.pct_of_peak_sustained_active": 49.91169382391154, "sm__maximum_warps_per_active_cycle_pct": 49.91169382391154, "time": 230.70469229561942, "times": [221.957275390625, 220.82797241210938, 236.388671875, 246.95497131347656, 235.21385192871094, 222.1427764892578, 231.44732666015625], "nvml_power": 114.145, "nvml_energy": 26.33378710208348, "compile_time": 250.5914180073887, "verification_time": 0, "benchmark_time": 3053.32222499419, "edp": 6075.3282503645205, "flops_watt": 5219110.830478541, "occupancy": 49.91169382391154, "strategy_time": 0, "framework_time": 0.3997099120169878, "timestamp": "2025-02-18 02:44:44.949702+00:00"},
"1,32,2,2": {"block_size_x": 1, "block_size_y": 32, "tile_size_x": 2, "tile_size_y": 2, "sm__warps_active.avg.pct_of_peak_sustained_active": 49.91214066879096, "sm__maximum_warps_per_active_cycle_pct": 49.91214066879096, "time": 227.63591875348772, "times": [221.1546173095703, 220.11264038085938, 234.09170532226562, 243.8153533935547, 225.85621643066406, 220.27308654785156, 228.14781188964844], "nvml_power": 114.629, "nvml_energy": 26.093677730793544, "compile_time": 252.15597602073103, "verification_time": 0, "benchmark_time": 3012.886947952211, "edp": 5939.858303906611, "flops_watt": 5267136.158035945, "occupancy": 49.91214066879096, "strategy_time": 0, "framework_time": 0.4013000288978219, "timestamp": "2025-02-18 02:44:48.215171+00:00"},
"1,32,2,4": {"block_size_x": 1, "block_size_y": 32, "tile_size_x": 2, "tile_size_y": 4, "sm__warps_active.avg.pct_of_peak_sustained_active": 49.911855918782614, "sm__maximum_warps_per_active_cycle_pct": 49.911855918782614, "time": 232.37824140276228, "times": [223.566650390625, 222.18988037109375, 239.0311737060547, 247.40745544433594, 235.93417358398438, 223.33544921875, 235.1829071044922], "nvml_power": 114.226, "nvml_energy": 26.543637002471925, "compile_time": 250.79869804903865, "verification_time": 0, "benchmark_time": 3075.4650470335037, "edp": 6168.163687067715, "flops_watt": 5177849.345182077, "occupancy": 49.911855918782614, "strategy_time": 0, "framework_time": 0.41677895933389664, "timestamp": "2025-02-18 02:44:51.541877+00:00"},
"1,32,4,1": {"block_size_x": 1, "block_size_y": 32, "tile_size_x": 4, "tile_size_y": 1, "sm__warps_active.avg.pct_of_peak_sustained_active": 49.822727547926426, "sm__maximum_warps_per_active_cycle_pct": 49.822727547926426, "time": 120.51468222481864, "times": [119.79513549804688, 117.27772521972656, 117.26761627197266, 117.08688354492188, 117.50732421875, 124.72294616699219, 129.9451446533203], "nvml_power": 114.738, "nvml_energy": 13.827613609111243, "compile_time": 251.33886700496078, "verification_time": 0, "benchmark_time": 2107.7831080183387, "edp": 1666.430460029619, "flops_watt": 9939455.741042634, "occupancy": 49.822727547926426, "strategy_time": 0, "framework_time": 0.4018900217488408, "timestamp": "2025-02-18 02:44:53.901425+00:00"},
"1,32,4,2": {"block_size_x": 1, "block_size_y": 32, "tile_size_x": 4, "tile_size_y": 2, "sm__warps_active.avg.pct_of_peak_sustained_active": 49.824000953369804, "sm__maximum_warps_per_active_cycle_pct": 49.824000953369804, "time": 120.37669481549945, "times": [118.43599700927734, 117.31043243408203, 117.63581085205078, 117.30550384521484, 117.70012664794922, 124.94723510742188, 129.3017578125], "nvml_power": 115.555, "nvml_energy": 13.91012896940504, "compile_time": 248.44758003018796, "verification_time": 0, "benchmark_time": 2100.447903969325, "edp": 1674.4553497943084, "flops_watt": 9880494.54999974, "occupancy": 49.824000953369804, "strategy_time": 0, "framework_time": 0.3963490016758442, "timestamp": "2025-02-18 02:44:56.250742+00:00"},
"1,32,4,4": {"block_size_x": 1, "block_size_y": 32, "tile_size_x": 4, "tile_size_y": 4, "sm__warps_active.avg.pct_of_peak_sustained_active": 49.82257741037272, "sm__maximum_warps_per_active_cycle_pct": 49.82257741037272, "time": 121.94199589320591, "times": [119.92594909667969, 118.97702026367188, 118.69519805908203, 118.54275512695312, 118.72383880615234, 126.5334701538086, 132.19573974609375], "nvml_power": 113.83, "nvml_energy": 13.880657392523629, "compile_time": 253.5633749794215, "verification_time": 0, "benchmark_time": 2126.9440640462562, "edp": 1692.6350667541146, "flops_watt": 9901472.933553355, "occupancy": 49.82257741037272, "strategy_time": 0, "framework_time": 0.4105399129912257, "timestamp": "2025-02-18 02:44:58.631685+00:00"},
"1,64,1,1": {"block_size_x": 1, "block_size_y": 64, "tile_size_x": 1, "tile_size_y": 1, "sm__warps_active.avg.pct_of_peak_sustained_active": 98.82176403548365, "sm__maximum_warps_per_active_cycle_pct": 98.82176403548365, "time": 448.8030003138951, "times": [443.1363525390625, 462.0460205078125, 434.5708923339844, 465.1047668457031, 433.23046875, 463.96478271484375, 439.5677185058594], "nvml_power": 115.737, "nvml_energy": 51.943112847329274, "compile_time": 250.1895979512483, "verification_time": 0, "benchmark_time": 4987.918282975443, "edp": 23312.22489152461, "flops_watt": 2645951.4252824876, "occupancy": 98.82176403548365, "strategy_time": 0, "framework_time": 0.4055390600115061, "timestamp": "2025-02-18 02:45:03.870223+00:00"},
"1,64,1,2": {"block_size_x": 1, "block_size_y": 64, "tile_size_x": 1, "tile_size_y": 2, "sm__warps_active.avg.pct_of_peak_sustained_active": 98.87145785188439, "sm__maximum_warps_per_active_cycle_pct": 98.87145785188439, "time": 439.5317818777902, "times": [435.1653747558594, 447.4355163574219, 429.1165466308594, 455.3392639160156, 426.3455810546875, 452.44647216796875, 430.87371826171875], "nvml_power": 115.47, "nvml_energy": 50.75273485342843, "compile_time": 254.06598497647792, "verification_time": 0, "benchmark_time": 4892.25879998412, "edp": 22307.439985298424, "flops_watt": 2708010.787377614, "occupancy": 98.87145785188439, "strategy_time": 0, "framework_time": 0.39818999357521534, "timestamp": "2025-02-18 02:45:09.016969+00:00"},
"1,64,1,4": {"block_size_x": 1, "block_size_y": 64, "tile_size_x": 1, "tile_size_y": 4, "sm__warps_active.avg.pct_of_peak_sustained_active": 98.80269715519296, "sm__maximum_warps_per_active_cycle_pct": 98.80269715519296, "time": 449.88221958705356, "times": [443.6485290527344, 462.0526428222656, 436.0972900390625, 466.75091552734375, 436.0513610839844, 464.23974609375, 440.3350524902344], "nvml_power": 115.521, "nvml_energy": 51.970843888916015, "compile_time": 251.5595769509673, "verification_time": 0, "benchmark_time": 4996.452947030775, "edp": 23380.758602557795, "flops_watt": 2644539.5761855626, "occupancy": 98.80269715519296, "strategy_time": 0, "framework_time": 0.41911995504051447, "timestamp": "2025-02-18 02:45:14.265426+00:00"},
"1,64,2,1": {"block_size_x": 1, "block_size_y": 64, "tile_size_x": 2, "tile_size_y": 1, "sm__warps_active.avg.pct_of_peak_sustained_active": 96.53727584177722, "sm__maximum_warps_per_active_cycle_pct": 96.53727584177722, "time": 244.36176409040178, "times": [234.74278259277344, 233.1631317138672, 252.23936462402344, 255.8137969970703, 249.47987365722656, 235.81564331054688, 249.2777557373047], "nvml_power": 114.192, "nvml_energy": 27.90415856501116, "compile_time": 251.67338596656919, "verification_time": 0, "benchmark_time": 3223.146968986839, "edp": 6818.709412404421, "flops_watt": 4925393.222368432, "occupancy": 96.53727584177722, "strategy_time": 0, "framework_time": 0.40647899731993675, "timestamp": "2025-02-18 02:45:17.740678+00:00"},
"1,64,2,2": {"block_size_x": 1, "block_size_y": 64, "tile_size_x": 2, "tile_size_y": 2, "sm__warps_active.avg.pct_of_peak_sustained_active": 96.317375429591, "sm__maximum_warps_per_active_cycle_pct": 96.317375429591, "time": 242.7812282017299, "times": [233.6999053955078, 232.5478973388672, 250.97482299804688, 256.0688171386719, 245.23184204101562, 233.16848754882812, 247.77682495117188], "nvml_power": 114.3455, "nvml_energy": 27.760940929340908, "compile_time": 252.34707701019943, "verification_time": 0, "benchmark_time": 3205.310162040405, "edp": 6739.835334861059, "flops_watt": 4950803.138186824, "occupancy": 96.317375429591, "strategy_time": 0, "framework_time": 0.39517891127616167, "timestamp": "2025-02-18 02:45:21.198755+00:00"},
"1,64,2,4": {"block_size_x": 1, "block_size_y": 64, "tile_size_x": 2, "tile_size_y": 4, "sm__warps_active.avg.pct_of_peak_sustained_active": 96.5413400413655, "sm__maximum_warps_per_active_cycle_pct": 96.5413400413655, "time": 243.12862287248885, "times": [234.06483459472656, 233.1117401123047, 250.9286346435547, 256.2415466308594, 245.9698944091797, 233.6658172607422, 247.9178924560547], "nvml_power": 114.54, "nvml_energy": 27.847952463814874, "compile_time": 253.8382060592994, "verification_time": 0, "benchmark_time": 3209.544028970413, "edp": 6770.634332345843, "flops_watt": 4935334.245869089, "occupancy": 96.5413400413655, "strategy_time": 0, "framework_time": 0.40004902984946966, "timestamp": "2025-02-18 02:45:24.662561+00:00"},
"1,64,4,1": {"block_size_x": 1, "block_size_y": 64, "tile_size_x": 4, "tile_size_y": 1, "sm__warps_active.avg.pct_of_peak_sustained_active": 95.5306218503266, "sm__maximum_warps_per_active_cycle_pct": 95.5306218503266, "time": 128.62138475690568, "times": [125.6779556274414, 124.27391815185547, 124.89334106445312, 124.99302673339844, 124.9073257446289, 137.04473876953125, 138.55938720703125], "nvml_power": 113.73, "nvml_energy": 14.628110088402885, "compile_time": 251.60266598686576, "verification_time": 0, "benchmark_time": 2100.116914953105, "edp": 1881.487775946841, "flops_watt": 9395537.266359592, "occupancy": 95.5306218503266, "strategy_time": 0, "framework_time": 0.4031900316476822, "timestamp": "2025-02-18 02:45:27.014709+00:00"},
"1,64,4,2": {"block_size_x": 1, "block_size_y": 64, "tile_size_x": 4, "tile_size_y": 2, "sm__warps_active.avg.pct_of_peak_sustained_active": 95.59140558505243, "sm__maximum_warps_per_active_cycle_pct": 95.59140558505243, "time": 128.1910171508789, "times": [124.85164642333984, 124.90172576904297, 125.11952209472656, 124.67903900146484, 124.47132873535156, 135.56288146972656, 137.7509765625], "nvml_power": 115.652, "nvml_energy": 14.825547515533447, "compile_time": 252.9648260679096, "verification_time": 0, "benchmark_time": 2102.4082029471174, "edp": 1900.5020158349182, "flops_watt": 9270413.340755107, "occupancy": 95.59140558505243, "strategy_time": 0, "framework_time": 0.4399890312924981, "timestamp": "2025-02-18 02:45:29.370549+00:00"},
"1,64,4,4": {"block_size_x": 1, "block_size_y": 64, "tile_size_x": 4, "tile_size_y": 4, "sm__warps_active.avg.pct_of_peak_sustained_active": 95.57852754587928, "sm__maximum_warps_per_active_cycle_pct": 95.57852754587928, "time": 127.73482731410435, "times": [125.72988891601562, 123.44457244873047, 124.65090942382812, 123.85926055908203, 123.59839630126953, 134.4832000732422, 138.3775634765625], "nvml_power": 114.287, "nvml_energy": 14.598430209247045, "compile_time": 253.50498501211405, "verification_time": 0, "benchmark_time": 2078.8416620343924, "edp": 1864.7279618351756, "flops_watt": 9414639.211340848, "occupancy": 95.57852754587928, "strategy_time": 0, "framework_time": 0.7362299365922809, "timestamp": "2025-02-18 02:45:31.703665+00:00"},
"1,128,1,1": {"block_size_x": 1, "block_size_y": 128, "tile_size_x": 1, "tile_size_y": 1, "sm__warps_active.avg.pct_of_peak_sustained_active": 99.1510320957493, "sm__maximum_warps_per_active_cycle_pct": 99.1510320957493, "time": 469.7295575823103, "times": [465.9435119628906, 477.9619140625, 460.40496826171875, 482.7430114746094, 457.6321105957031, 486.3544921875, 457.06689453125], "nvml_power": 113.877, "nvml_energy": 53.49139282880075, "compile_time": 250.13433897402138, "verification_time": 0, "benchmark_time": 5233.564944006503, "edp": 25126.488287934142, "flops_watt": 2569365.7652900065, "occupancy": 99.1510320957493, "strategy_time": 0, "framework_time": 0.3927890211343765, "timestamp": "2025-02-18 02:45:37.187781+00:00"},
"1,128,1,2": {"block_size_x": 1, "block_size_y": 128, "tile_size_x": 1, "tile_size_y": 2, "sm__warps_active.avg.pct_of_peak_sustained_active": 99.14379592671986, "sm__maximum_warps_per_active_cycle_pct": 99.14379592671986, "time": 452.9633353097098, "times": [451.16259765625, 459.14703369140625, 443.99658203125, 466.2252197265625, 439.3126220703125, 469.33819580078125, 441.56109619140625], "nvml_power": 114.52, "nvml_energy": 51.873361159667965, "compile_time": 251.95253698620945, "verification_time": 0, "benchmark_time": 5050.64922303427, "edp": 23496.73068460836, "flops_watt": 2649509.312669334, "occupancy": 99.14379592671986, "strategy_time": 0, "framework_time": 0.4018099280074239, "timestamp": "2025-02-18 02:45:42.490808+00:00"},
"1,128,1,4": {"block_size_x": 1, "block_size_y": 128, "tile_size_x": 1, "tile_size_y": 4, "sm__warps_active.avg.pct_of_peak_sustained_active": 99.13107163061727, "sm__maximum_warps_per_active_cycle_pct": 99.13107163061727, "time": 452.1311776297433, "times": [450.72528076171875, 457.66064453125, 445.2834167480469, 464.9088134765625, 440.74566650390625, 466.4234924316406, 439.1709289550781], "nvml_power": 114.513, "nvml_energy": 51.7748975439148, "compile_time": 252.74928600993007, "verification_time": 0, "benchmark_time": 5040.593681042083, "edp": 23409.0453981895, "flops_watt": 2654548.0530487974, "occupancy": 99.13107163061727, "strategy_time": 0, "framework_time": 0.3930189413949847, "timestamp": "2025-02-18 02:45:47.784567+00:00"},
"1,128,2,1": {"block_size_x": 1, "block_size_y": 128, "tile_size_x": 2, "tile_size_y": 1, "sm__warps_active.avg.pct_of_peak_sustained_active": 98.89906874510737, "sm__maximum_warps_per_active_cycle_pct": 98.89906874510737, "time": 253.84445190429688, "times": [244.3256378173828, 241.83766174316406, 266.4137878417969, 266.4183349609375, 246.48745727539062, 246.62374877929688, 264.8045349121094], "nvml_power": 114.173, "nvml_energy": 28.982182607269287, "compile_time": 251.8089759396389, "verification_time": 0, "benchmark_time": 3086.8549190927297, "edp": 7356.966258932518, "flops_watt": 4742187.82396077, "occupancy": 98.89906874510737, "strategy_time": 0, "framework_time": 0.4067899426445365, "timestamp": "2025-02-18 02:45:51.123662+00:00"},
"1,128,2,2": {"block_size_x": 1, "block_size_y": 128, "tile_size_x": 2, "tile_size_y": 2, "sm__warps_active.avg.pct_of_peak_sustained_active": 98.89080677127363, "sm__maximum_warps_per_active_cycle_pct": 98.89080677127363, "time": 251.30572945731026, "times": [244.2156219482422, 240.6845703125, 263.7508544921875, 257.39556884765625, 245.3002166748047, 245.19171142578125, 262.6015625], "nvml_power": 114.562, "nvml_energy": 28.79008697808838, "compile_time": 249.98964800033718, "verification_time": 0, "benchmark_time": 3050.7145669544116, "edp": 7235.1138091679095, "flops_watt": 4773829.04666465, "occupancy": 98.89080677127363, "strategy_time": 0, "framework_time": 0.4142291145399213, "timestamp": "2025-02-18 02:45:54.424805+00:00"},
"1,128,2,4": {"block_size_x": 1, "block_size_y": 128, "tile_size_x": 2, "tile_size_y": 4, "sm__warps_active.avg.pct_of_peak_sustained_active": 98.88303126057369, "sm__maximum_warps_per_active_cycle_pct": 98.88303126057369, "time": 253.5226767403739, "times": [243.23117065429688, 241.6025848388672, 264.79559326171875, 266.6642761230469, 246.897216796875, 247.24041748046875, 264.22747802734375], "nvml_power": 114.437, "nvml_energy": 29.012374558138166, "compile_time": 248.83565900381655, "verification_time": 0, "benchmark_time": 3087.3728579608724, "edp": 7355.2948565735105, "flops_watt": 4737252.829704952, "occupancy": 98.88303126057369, "strategy_time": 0, "framework_time": 0.41930004954338074, "timestamp": "2025-02-18 02:45:57.761458+00:00"},
"1,128,4,1": {"block_size_x": 1, "block_size_y": 128, "tile_size_x": 4, "tile_size_y": 1, "sm__warps_active.avg.pct_of_peak_sustained_active": 98.46153182299689, "sm__maximum_warps_per_active_cycle_pct": 98.46153182299689, "time": 133.7265145438058, "times": [131.23500061035156, 129.25318908691406, 128.98959350585938, 129.58726501464844, 130.4053497314453, 143.0359344482422, 143.5792694091797], "nvml_power": 113.721, "nvml_energy": 15.207512960436139, "compile_time": 251.18162704166025, "verification_time": 0, "benchmark_time": 2175.03510392271, "edp": 2033.6477030788783, "flops_watt": 9037569.37965867, "occupancy": 98.46153182299689, "strategy_time": 0, "framework_time": 0.4023701185360551, "timestamp": "2025-02-18 02:46:00.188102+00:00"},
"1,128,4,2": {"block_size_x": 1, "block_size_y": 128, "tile_size_x": 4, "tile_size_y": 2, "sm__warps_active.avg.pct_of_peak_sustained_active": 98.41037848501554, "sm__maximum_warps_per_active_cycle_pct": 98.41037848501554, "time": 133.44086565290178, "times": [130.27130126953125, 128.191162109375, 128.32421875, 128.37855529785156, 130.03768920898438, 144.3270721435547, 144.55606079101562], "nvml_power": 113.447, "nvml_energy": 15.138465885724749, "compile_time": 252.05741601530463, "verification_time": 0, "benchmark_time": 2189.8679320001975, "edp": 2020.089992448033, "flops_watt": 9078790.051084504, "occupancy": 98.41037848501554, "strategy_time": 0, "framework_time": 0.4073500167578459, "timestamp": "2025-02-18 02:46:02.630459+00:00"},
"1,128,4,4": {"block_size_x": 1, "block_size_y": 128, "tile_size_x": 4, "tile_size_y": 4, "sm__warps_active.avg.pct_of_peak_sustained_active": 98.46882960509504, "sm__maximum_warps_per_active_cycle_pct": 98.46882960509504, "time": 133.88941737583704, "times": [130.35964965820312, 128.51171875, 128.78933715820312, 128.77711486816406, 132.72288513183594, 144.6643524169922, 143.40086364746094], "nvml_power": 113.972, "nvml_energy": 15.259644677158898, "compile_time": 251.34729698766023, "verification_time": 0, "benchmark_time": 2198.1475059874356, "edp": 2043.1049351870977, "flops_watt": 9006694.21731181, "occupancy": 98.46882960509504, "strategy_time": 0, "framework_time": 0.4016400780528784, "timestamp": "2025-02-18 02:46:05.080381+00:00"},
"1,256,1,1": {"block_size_x": 1, "block_size_y": 256, "tile_size_x": 1, "tile_size_y": 1, "sm__warps_active.avg.pct_of_peak_sustained_active": 98.24262335625772, "sm__maximum_warps_per_active_cycle_pct": 98.24262335625772, "time": 449.8106471470424, "times": [445.7208557128906, 455.8330383300781, 440.090087890625, 465.3747863769531, 436.46539306640625, 466.3009338378906, 438.8894348144531], "nvml_power": 115.504, "nvml_energy": 51.954928988071984, "compile_time": 251.7077869269997, "verification_time": 0, "benchmark_time": 5013.29115300905, "edp": 23369.880230603292, "flops_watt": 2645349.6549587003, "occupancy": 98.24262335625772, "strategy_time": 0, "framework_time": 0.41725009214133024, "timestamp": "2025-02-18 02:46:10.345821+00:00"},
"1,256,1,2": {"block_size_x": 1, "block_size_y": 256, "tile_size_x": 1, "tile_size_y": 2, "sm__warps_active.avg.pct_of_peak_sustained_active": 98.23497924800186, "sm__maximum_warps_per_active_cycle_pct": 98.23497924800186, "time": 456.80186680385043, "times": [452.3793029785156, 467.4903869628906, 444.9548034667969, 474.8721008300781, 443.4279479980469, 472.7520446777344, 441.7364807128906], "nvml_power": 115.305, "nvml_energy": 52.671539251817975, "compile_time": 251.88973697368056, "verification_time": 0, "benchmark_time": 5070.6835659220815, "edp": 24060.457457662735, "flops_watt": 2609358.9711687844, "occupancy": 98.23497924800186, "strategy_time": 0, "framework_time": 0.3953101113438606, "timestamp": "2025-02-18 02:46:15.668814+00:00"},
"1,256,1,4": {"block_size_x": 1, "block_size_y": 256, "tile_size_x": 1, "tile_size_y": 4, "sm__warps_active.avg.pct_of_peak_sustained_active": 98.20717859756179, "sm__maximum_warps_per_active_cycle_pct": 98.20717859756179, "time": 446.8719787597656, "times": [445.2886657714844, 451.505859375, 438.2391052246094, 459.7851867675781, 433.387939453125, 463.7964782714844, 436.1006164550781], "nvml_power": 115.279, "nvml_energy": 51.51495483944702, "compile_time": 250.22024801000953, "verification_time": 0, "benchmark_time": 4980.184179032221, "edp": 23020.589804823656, "flops_watt": 2667942.8119532703, "occupancy": 98.20717859756179, "strategy_time": 0, "framework_time": 0.4125499399378896, "timestamp": "2025-02-18 02:46:20.899654+00:00"},
"1,256,2,1": {"block_size_x": 1, "block_size_y": 256, "tile_size_x": 2, "tile_size_y": 1, "sm__warps_active.avg.pct_of_peak_sustained_active": 98.06458086802917, "sm__maximum_warps_per_active_cycle_pct": 98.06458086802917, "time": 250.3289293561663, "times": [239.9601593017578, 239.90867614746094, 262.50360107421875, 259.27398681640625, 243.22665405273438, 243.24009704589844, 264.1893310546875], "nvml_power": 114.239, "nvml_energy": 28.597326560719083, "compile_time": 250.5005879793316, "verification_time": 0, "benchmark_time": 3042.5465640146285, "edp": 7158.738140393465, "flops_watt": 4806007.064338118, "occupancy": 98.06458086802917, "strategy_time": 0, "framework_time": 0.39914995431900024, "timestamp": "2025-02-18 02:46:24.193124+00:00"},
"1,256,2,2": {"block_size_x": 1, "block_size_y": 256, "tile_size_x": 2, "tile_size_y": 2, "sm__warps_active.avg.pct_of_peak_sustained_active": 98.05765716439257, "sm__maximum_warps_per_active_cycle_pct": 98.05765716439257, "time": 249.77794320242745, "times": [240.723388671875, 238.6683807373047, 263.776611328125, 257.8047180175781, 242.13174438476562, 242.68450927734375, 262.65625], "nvml_power": 114.12, "nvml_energy": 28.50465887826102, "compile_time": 249.3557189591229, "verification_time": 0, "benchmark_time": 3293.0785620119423, "edp": 7119.8350662988505, "flops_watt": 4821631.230844771, "occupancy": 98.05765716439257, "strategy_time": 0, "framework_time": 0.3981089685112238, "timestamp": "2025-02-18 02:46:27.735981+00:00"},
"1,256,2,4": {"block_size_x": 1, "block_size_y": 256, "tile_size_x": 2, "tile_size_y": 4, "sm__warps_active.avg.pct_of_peak_sustained_active": 98.03816890797317, "sm__maximum_warps_per_active_cycle_pct": 98.03816890797317, "time": 249.79007829938615, "times": [240.3270721435547, 238.71267700195312, 262.23126220703125, 258.56414794921875, 243.03855895996094, 243.52230834960938, 262.134521484375], "nvml_power": 113.919, "nvml_energy": 28.45583592978777, "compile_time": 250.05425896961242, "verification_time": 0, "benchmark_time": 3297.5009680958465, "edp": 7107.985484976173, "flops_watt": 4829903.91886987, "occupancy": 98.03816890797317, "strategy_time": 0, "framework_time": 0.39969885256141424, "timestamp": "2025-02-18 02:46:31.283960+00:00"},
"1,256,4,1": {"block_size_x": 1, "block_size_y": 256, "tile_size_x": 4, "tile_size_y": 1, "sm__warps_active.avg.pct_of_peak_sustained_active": 97.66578308030287, "sm__maximum_warps_per_active_cycle_pct": 97.66578308030287, "time": 135.48454938616072, "times": [132.64749145507812, 130.0009002685547, 130.59376525878906, 129.81695556640625, 132.61538696289062, 146.9607391357422, 145.75660705566406], "nvml_power": 114.195, "nvml_energy": 15.471658117152623, "compile_time": 253.18055599927902, "verification_time": 0, "benchmark_time": 2203.9888510480523, "edp": 2096.170628259159, "flops_watt": 8883272.395970834, "occupancy": 97.66578308030287, "strategy_time": 0, "framework_time": 0.4039589548483491, "timestamp": "2025-02-18 02:46:33.741558+00:00"},
"1,256,4,2": {"block_size_x": 1, "block_size_y": 256, "tile_size_x": 4, "tile_size_y": 2, "sm__warps_active.avg.pct_of_peak_sustained_active": 97.66232177025948, "sm__maximum_warps_per_active_cycle_pct": 97.66232177025948, "time": 135.07671683175224, "times": [130.6860809326172, 130.3554229736328, 129.14889526367188, 130.6234893798828, 131.78489685058594, 146.59689331054688, 146.34133911132812], "nvml_power": 113.371, "nvml_energy": 15.313782463932583, "compile_time": 248.58756898902357, "verification_time": 0, "benchmark_time": 2209.812285960652, "edp": 2068.5354575036745, "flops_watt": 8974853.456074603, "occupancy": 97.66232177025948, "strategy_time": 0, "framework_time": 0.39133999962359667, "timestamp": "2025-02-18 02:46:36.200373+00:00"},
"1,256,4,4": {"block_size_x": 1, "block_size_y": 256, "tile_size_x": 4, "tile_size_y": 4, "sm__warps_active.avg.pct_of_peak_sustained_active": 97.65208937216974, "sm__maximum_warps_per_active_cycle_pct": 97.65208937216974, "time": 134.25018310546875, "times": [130.4181365966797, 128.26214599609375, 128.81475830078125, 129.24928283691406, 131.39117431640625, 146.1116485595703, 145.50413513183594], "nvml_power": 113.315, "nvml_energy": 15.21255949859619, "compile_time": 249.72980900201946, "verification_time": 0, "benchmark_time": 2200.3718039486557, "edp": 2042.2888981893764, "flops_watt": 9034571.301738068, "occupancy": 97.65208937216974, "strategy_time": 0, "framework_time": 0.4016089951619506, "timestamp": "2025-02-18 02:46:38.650901+00:00"},
"2,16,1,1": {"block_size_x": 2, "block_size_y": 16, "tile_size_x": 1, "tile_size_y": 1, "sm__warps_active.avg.pct_of_peak_sustained_active": 49.95629429662642, "sm__maximum_warps_per_active_cycle_pct": 49.95629429662642, "time": 225.3807089669364, "times": [219.69418334960938, 218.05477905273438, 229.5924530029297, 241.08901977539062, 228.86265563964844, 217.72618103027344, 222.64569091796875], "nvml_power": 114.549, "nvml_energy": 25.8171348314536, "compile_time": 250.73689804412425, "verification_time": 0, "benchmark_time": 2990.8164660446346, "edp": 5818.684151808, "flops_watt": 5323555.6295950785, "occupancy": 49.95629429662642, "strategy_time": 0, "framework_time": 0.408138963393867, "timestamp": "2025-02-18 02:46:41.892888+00:00"},
"2,16,1,2": {"block_size_x": 2, "block_size_y": 16, "tile_size_x": 1, "tile_size_y": 2, "sm__warps_active.avg.pct_of_peak_sustained_active": 49.95668837923977, "sm__maximum_warps_per_active_cycle_pct": 49.95668837923977, "time": 230.83231026785714, "times": [222.39334106445312, 220.73849487304688, 236.02578735351562, 246.10147094726562, 238.6398468017578, 221.49874877929688, 230.42848205566406], "nvml_power": 114.576, "nvml_energy": 26.44784278125, "compile_time": 249.15052903816104, "verification_time": 0, "benchmark_time": 3056.8633129587397, "edp": 6105.016650797005, "flops_watt": 5196603.541875117, "occupancy": 49.95668837923977, "strategy_time": 0, "framework_time": 0.41194900404661894, "timestamp": "2025-02-18 02:46:45.199338+00:00"},
"2,16,1,4": {"block_size_x": 2, "block_size_y": 16, "tile_size_x": 1, "tile_size_y": 4, "sm__warps_active.avg.pct_of_peak_sustained_active": 49.9575064932016, "sm__maximum_warps_per_active_cycle_pct": 49.9575064932016, "time": 230.73205348423548, "times": [222.17295837402344, 220.27664184570312, 236.2606964111328, 246.78073120117188, 239.78880310058594, 221.1807403564453, 228.66380310058594], "nvml_power": 114.602, "nvml_energy": 26.442354793400355, "compile_time": 250.49495697021484, "verification_time": 0, "benchmark_time": 3054.8428340116516, "edp": 6101.098820439981, "flops_watt": 5197682.072789632, "occupancy": 49.9575064932016, "strategy_time": 0, "framework_time": 0.3992400597780943, "timestamp": "2025-02-18 02:46:48.505099+00:00"},
"2,16,2,1": {"block_size_x": 2, "block_size_y": 16, "tile_size_x": 2, "tile_size_y": 1, "sm__warps_active.avg.pct_of_peak_sustained_active": 49.961319848142864, "sm__maximum_warps_per_active_cycle_pct": 49.961319848142864, "time": 255.4288548060826, "times": [244.6029052734375, 241.43136596679688, 267.8782653808594, 267.9018859863281, 255.22128295898438, 247.85784912109375, 263.1084289550781], "nvml_power": 114.837, "nvml_energy": 29.332683399366104, "compile_time": 249.0929689956829, "verification_time": 0, "benchmark_time": 3110.1486689876765, "edp": 7492.413729089474, "flops_watt": 4685522.684739104, "occupancy": 49.961319848142864, "strategy_time": 0, "framework_time": 0.3983100177720189, "timestamp": "2025-02-18 02:46:51.864763+00:00"},
"2,16,2,2": {"block_size_x": 2, "block_size_y": 16, "tile_size_x": 2, "tile_size_y": 2, "sm__warps_active.avg.pct_of_peak_sustained_active": 49.960158048295696, "sm__maximum_warps_per_active_cycle_pct": 49.960158048295696, "time": 250.35049874441964, "times": [241.75865173339844, 238.86880493164062, 262.9877014160156, 261.310302734375, 242.05197143554688, 242.67701721191406, 262.7990417480469], "nvml_power": 114.061, "nvml_energy": 28.55522823728725, "compile_time": 251.0755870025605, "verification_time": 0, "benchmark_time": 3056.809661909938, "edp": 7148.815630965598, "flops_watt": 4813092.451228704, "occupancy": 49.960158048295696, "strategy_time": 0, "framework_time": 0.40965003427118063, "timestamp": "2025-02-18 02:46:55.173081+00:00"},
"2,16,2,4": {"block_size_x": 2, "block_size_y": 16, "tile_size_x": 2, "tile_size_y": 4, "sm__warps_active.avg.pct_of_peak_sustained_active": 49.95940351335884, "sm__maximum_warps_per_active_cycle_pct": 49.95940351335884, "time": 256.0126211983817, "times": [245.72726440429688, 243.0326385498047, 268.27374267578125, 269.3490295410156, 252.1634521484375, 249.2637481689453, 264.2784729003906], "nvml_power": 114.309, "nvml_energy": 29.264546716565814, "compile_time": 252.69092596136034, "verification_time": 0, "benchmark_time": 3115.847134962678, "edp": 7492.093313090508, "flops_watt": 4696431.993399022, "occupancy": 49.95940351335884, "strategy_time": 0, "framework_time": 0.3987901145592332, "timestamp": "2025-02-18 02:46:58.542043+00:00"},
"2,16,4,1": {"block_size_x": 2, "block_size_y": 16, "tile_size_x": 4, "tile_size_y": 1, "sm__warps_active.avg.pct_of_peak_sustained_active": 49.91455759363432, "sm__maximum_warps_per_active_cycle_pct": 49.91455759363432, "time": 127.0771953037807, "times": [124.68704223632812, 123.1180191040039, 123.2465591430664, 123.19462585449219, 123.1592025756836, 133.4700164794922, 138.66490173339844], "nvml_power": 114.083, "nvml_energy": 14.497347671841213, "compile_time": 255.0663339206949, "verification_time": 0, "benchmark_time": 2069.2545489873737, "edp": 1842.2822814813762, "flops_watt": 9480282.64086908, "occupancy": 49.91455759363432, "strategy_time": 0, "framework_time": 0.40067010559141636, "timestamp": "2025-02-18 02:47:00.866789+00:00"},
"2,16,4,2": {"block_size_x": 2, "block_size_y": 16, "tile_size_x": 4, "tile_size_y": 2, "sm__warps_active.avg.pct_of_peak_sustained_active": 49.91803710803702, "sm__maximum_warps_per_active_cycle_pct": 49.91803710803702, "time": 126.23294939313617, "times": [123.8790054321289, 121.95641326904297, 122.6698226928711, 122.67497253417969, 123.26105499267578, 132.2809295654297, 136.908447265625], "nvml_power": 114.691, "nvml_energy": 14.477783198848181, "compile_time": 252.47233593836427, "verification_time": 0, "benchmark_time": 2063.606465002522, "edp": 1827.5732738649995, "flops_watt": 9493093.768867483, "occupancy": 49.91803710803702, "strategy_time": 0, "framework_time": 0.39782002568244934, "timestamp": "2025-02-18 02:47:03.183290+00:00"},
"2,16,4,4": {"block_size_x": 2, "block_size_y": 16, "tile_size_x": 4, "tile_size_y": 4, "sm__warps_active.avg.pct_of_peak_sustained_active": 49.9172411112663, "sm__maximum_warps_per_active_cycle_pct": 49.9172411112663, "time": 127.96882738385882, "times": [125.4735336303711, 124.07222747802734, 123.58499145507812, 124.2227554321289, 125.06924438476562, 134.37997436523438, 138.97906494140625], "nvml_power": 116.447, "nvml_energy": 14.901586042368207, "compile_time": 254.24851500429213, "verification_time": 0, "benchmark_time": 2088.819333934225, "edp": 1906.938492001537, "flops_watt": 9223109.075854974, "occupancy": 49.9172411112663, "strategy_time": 0, "framework_time": 0.4195100627839565, "timestamp": "2025-02-18 02:47:05.526803+00:00"},
"2,32,1,1": {"block_size_x": 2, "block_size_y": 32, "tile_size_x": 1, "tile_size_y": 1, "sm__warps_active.avg.pct_of_peak_sustained_active": 99.2779341462493, "sm__maximum_warps_per_active_cycle_pct": 99.2779341462493, "time": 257.2407466343471, "times": [247.6212158203125, 245.34739685058594, 271.4947204589844, 266.1072082519531, 248.47695922851562, 249.599365234375, 272.0383605957031], "nvml_power": 114.693, "nvml_energy": 29.50371295373317, "compile_time": 251.22501701116562, "verification_time": 0, "benchmark_time": 3113.435797044076, "edp": 7589.557148703779, "flops_watt": 4658361.260751405, "occupancy": 99.2779341462493, "strategy_time": 0, "framework_time": 0.40640903171151876, "timestamp": "2025-02-18 02:47:08.891896+00:00"},
"2,32,1,2": {"block_size_x": 2, "block_size_y": 32, "tile_size_x": 1, "tile_size_y": 2, "sm__warps_active.avg.pct_of_peak_sustained_active": 99.29353368872799, "sm__maximum_warps_per_active_cycle_pct": 99.29353368872799, "time": 257.77306474958147, "times": [247.73916625976562, 245.75794982910156, 274.1131286621094, 264.9041748046875, 247.35769653320312, 250.88671875, 273.6526184082031], "nvml_power": 114.869, "nvml_energy": 29.610134174719672, "compile_time": 251.14597694482654, "verification_time": 0, "benchmark_time": 3123.9121190737933, "edp": 7632.695033863809, "flops_watt": 4641618.732999247, "occupancy": 99.29353368872799, "strategy_time": 0, "framework_time": 0.4124100087210536, "timestamp": "2025-02-18 02:47:12.267391+00:00"},
"2,32,1,4": {"block_size_x": 2, "block_size_y": 32, "tile_size_x": 1, "tile_size_y": 4, "sm__warps_active.avg.pct_of_peak_sustained_active": 99.30028908418144, "sm__maximum_warps_per_active_cycle_pct": 99.30028908418144, "time": 262.2716761997768, "times": [251.8269500732422, 250.56431579589844, 278.163818359375, 274.5841064453125, 251.36143493652344, 255.1309051513672, 274.27020263671875], "nvml_power": 114.937, "nvml_energy": 30.14471964737374, "compile_time": 254.7562849940732, "verification_time": 0, "benchmark_time": 3174.385276972316, "edp": 7906.106150489055, "flops_watt": 4559304.418144553, "occupancy": 99.30028908418144, "strategy_time": 0, "framework_time": 0.39749895222485065, "timestamp": "2025-02-18 02:47:15.696954+00:00"},
"2,32,2,1": {"block_size_x": 2, "block_size_y": 32, "tile_size_x": 2, "tile_size_y": 1, "sm__warps_active.avg.pct_of_peak_sustained_active": 99.30713889777545, "sm__maximum_warps_per_active_cycle_pct": 99.30713889777545, "time": 293.5880344935826, "times": [277.4435119628906, 289.3408508300781, 309.19635009765625, 290.4784851074219, 280.8235778808594, 306.4314880371094, 301.4019775390625], "nvml_power": 115.165, "nvml_energy": 33.81106599245344, "compile_time": 248.54566901922226, "verification_time": 0, "benchmark_time": 3538.5707339737564, "edp": 9926.524408857218, "flops_watt": 4064910.3906595577, "occupancy": 99.30713889777545, "strategy_time": 0, "framework_time": 0.4005000228062272, "timestamp": "2025-02-18 02:47:19.484494+00:00"},
"2,32,2,2": {"block_size_x": 2, "block_size_y": 32, "tile_size_x": 2, "tile_size_y": 2, "sm__warps_active.avg.pct_of_peak_sustained_active": 99.30773775355995, "sm__maximum_warps_per_active_cycle_pct": 99.30773775355995, "time": 289.2484610421317, "times": [277.532470703125, 283.478271484375, 304.9451904296875, 283.83770751953125, 278.7753601074219, 302.30908203125, 293.86114501953125], "nvml_power": 115.495, "nvml_energy": 33.406751008061, "compile_time": 252.68052599858493, "verification_time": 0, "benchmark_time": 3483.7329069850966, "edp": 9662.851317499326, "flops_watt": 4114107.1587247793, "occupancy": 99.30773775355995, "strategy_time": 0, "framework_time": 0.42050995398312807, "timestamp": "2025-02-18 02:47:23.221354+00:00"},
"2,32,2,4": {"block_size_x": 2, "block_size_y": 32, "tile_size_x": 2, "tile_size_y": 4, "sm__warps_active.avg.pct_of_peak_sustained_active": 99.31407057171712, "sm__maximum_warps_per_active_cycle_pct": 99.31407057171712, "time": 295.91434151785717, "times": [280.6174621582031, 291.776123046875, 314.02838134765625, 291.1790771484375, 282.9617004394531, 309.67626953125, 301.161376953125], "nvml_power": 115.195, "nvml_energy": 34.087852571149554, "compile_time": 251.09836703632027, "verification_time": 0, "benchmark_time": 3565.0421120226383, "edp": 10087.084447349514, "flops_watt": 4031904.1272879196, "occupancy": 99.31407057171712, "strategy_time": 0, "framework_time": 0.4014598671346903, "timestamp": "2025-02-18 02:47:27.037920+00:00"},
"2,32,4,1": {"block_size_x": 2, "block_size_y": 32, "tile_size_x": 4, "tile_size_y": 1, "sm__warps_active.avg.pct_of_peak_sustained_active": 97.53337605655454, "sm__maximum_warps_per_active_cycle_pct": 97.53337605655454, "time": 150.59000941685267, "times": [146.724609375, 144.5749053955078, 143.9852752685547, 143.84104919433594, 156.27734375, 161.68211364746094, 157.04476928710938], "nvml_power": 113.763, "nvml_energy": 17.13157124128941, "compile_time": 251.46180705633014, "verification_time": 0, "benchmark_time": 2277.474652044475, "edp": 2579.8434745512545, "flops_watt": 8022553.8881543735, "occupancy": 97.53337605655454, "strategy_time": 0, "framework_time": 0.3997799940407276, "timestamp": "2025-02-18 02:47:29.567282+00:00"},
"2,32,4,2": {"block_size_x": 2, "block_size_y": 32, "tile_size_x": 4, "tile_size_y": 2, "sm__warps_active.avg.pct_of_peak_sustained_active": 97.5117924196615, "sm__maximum_warps_per_active_cycle_pct": 97.5117924196615, "time": 152.73987034388952, "times": [146.0214385986328, 145.36534118652344, 145.80035400390625, 145.84005737304688, 160.8411865234375, 162.82077026367188, 162.4899444580078], "nvml_power": 114.552, "nvml_energy": 17.496657627633233, "compile_time": 251.6984569374472, "verification_time": 0, "benchmark_time": 2316.4808599976823, "edp": 2672.437217496126, "flops_watt": 7855154.7613834925, "occupancy": 97.5117924196615, "strategy_time": 0, "framework_time": 0.406568986363709, "timestamp": "2025-02-18 02:47:32.135892+00:00"},
"2,32,4,4": {"block_size_x": 2, "block_size_y": 32, "tile_size_x": 4, "tile_size_y": 4, "sm__warps_active.avg.pct_of_peak_sustained_active": 97.52244634955942, "sm__maximum_warps_per_active_cycle_pct": 97.52244634955942, "time": 152.15904235839844, "times": [148.84005737304688, 145.712158203125, 145.60646057128906, 146.05775451660156, 159.24560546875, 163.45823669433594, 156.19302368164062], "nvml_power": 114.496, "nvml_energy": 17.421601713867187, "compile_time": 251.18570704944432, "verification_time": 0, "benchmark_time": 2303.761341026984, "edp": 2650.854233131464, "flops_watt": 7888996.415444501, "occupancy": 97.52244634955942, "strategy_time": 0, "framework_time": 0.4069498972967267, "timestamp": "2025-02-18 02:47:34.691272+00:00"},
"2,64,1,1": {"block_size_x": 2, "block_size_y": 64, "tile_size_x": 1, "tile_size_y": 1, "sm__warps_active.avg.pct_of_peak_sustained_active": 98.06963816243055, "sm__maximum_warps_per_active_cycle_pct": 98.06963816243055, "time": 262.02445329938615, "times": [250.18614196777344, 249.69158935546875, 275.5900573730469, 276.74432373046875, 251.95347595214844, 254.48291015625, 275.5226745605469], "nvml_power": 114.812, "nvml_energy": 30.083551532209125, "compile_time": 250.66126801539212, "verification_time": 0, "benchmark_time": 3179.120733984746, "edp": 7882.626143531006, "flops_watt": 4568574.735095696, "occupancy": 98.06963816243055, "strategy_time": 0, "framework_time": 0.3992989659309387, "timestamp": "2025-02-18 02:47:38.121477+00:00"},
"2,64,1,2": {"block_size_x": 2, "block_size_y": 64, "tile_size_x": 1, "tile_size_y": 2, "sm__warps_active.avg.pct_of_peak_sustained_active": 98.14535839794361, "sm__maximum_warps_per_active_cycle_pct": 98.14535839794361, "time": 262.2669154575893, "times": [251.2857666015625, 249.79344177246094, 277.1754150390625, 275.1756286621094, 251.5361328125, 255.76060485839844, 275.14141845703125], "nvml_power": 114.791, "nvml_energy": 30.10588149229213, "compile_time": 250.93042699154466, "verification_time": 0, "benchmark_time": 3176.070905989036, "edp": 7895.7766761151815, "flops_watt": 4565186.158298931, "occupancy": 98.14535839794361, "strategy_time": 0, "framework_time": 0.41267997585237026, "timestamp": "2025-02-18 02:47:41.548916+00:00"},
"2,64,1,4": {"block_size_x": 2, "block_size_y": 64, "tile_size_x": 1, "tile_size_y": 4, "sm__warps_active.avg.pct_of_peak_sustained_active": 98.1498356416407, "sm__maximum_warps_per_active_cycle_pct": 98.1498356416407, "time": 263.0000196184431, "times": [250.79251098632812, 250.35586547851562, 279.1372985839844, 275.2432861328125, 251.37315368652344, 256.34088134765625, 277.75714111328125], "nvml_power": 114.41, "nvml_energy": 30.089832244546074, "compile_time": 250.87606708984822, "verification_time": 0, "benchmark_time": 3187.878997065127, "edp": 7913.6264706312795, "flops_watt": 4567621.12713046, "occupancy": 98.1498356416407, "strategy_time": 0, "framework_time": 0.4114197799935937, "timestamp": "2025-02-18 02:47:44.988107+00:00"},
"2,64,2,1": {"block_size_x": 2, "block_size_y": 64, "tile_size_x": 2, "tile_size_y": 1, "sm__warps_active.avg.pct_of_peak_sustained_active": 98.11929927190862, "sm__maximum_warps_per_active_cycle_pct": 98.11929927190862, "time": 294.39078194754467, "times": [280.5928039550781, 289.5617980957031, 308.9059753417969, 292.17578125, 282.16259765625, 306.014404296875, 301.3221130371094], "nvml_power": 115.507, "nvml_energy": 34.00419605041504, "compile_time": 249.60712797474116, "verification_time": 0, "benchmark_time": 3550.395493977703, "edp": 10010.521864779294, "flops_watt": 4041823.3463961715, "occupancy": 98.11929927190862, "strategy_time": 0, "framework_time": 0.40125008672475815, "timestamp": "2025-02-18 02:47:48.788534+00:00"},
"2,64,2,2": {"block_size_x": 2, "block_size_y": 64, "tile_size_x": 2, "tile_size_y": 2, "sm__warps_active.avg.pct_of_peak_sustained_active": 98.20680265062585, "sm__maximum_warps_per_active_cycle_pct": 98.20680265062585, "time": 294.4967346191406, "times": [279.8321838378906, 289.1301574707031, 311.45989990234375, 291.732421875, 282.26397705078125, 304.5056457519531, 302.5528564453125], "nvml_power": 115.537, "nvml_energy": 34.02526922769165, "compile_time": 252.72704602684826, "verification_time": 0, "benchmark_time": 3547.8609659476206, "edp": 10020.33068209232, "flops_watt": 4039320.0874409117, "occupancy": 98.20680265062585, "strategy_time": 0, "framework_time": 0.3998300526291132, "timestamp": "2025-02-18 02:47:52.589547+00:00"},
"2,64,2,4": {"block_size_x": 2, "block_size_y": 64, "tile_size_x": 2, "tile_size_y": 4, "sm__warps_active.avg.pct_of_peak_sustained_active": 98.21327395944695, "sm__maximum_warps_per_active_cycle_pct": 98.21327395944695, "time": 294.64605712890625, "times": [280.5798034667969, 289.1108093261719, 312.2362060546875, 289.4997863769531, 282.01641845703125, 307.3726501464844, 301.70672607421875], "nvml_power": 115.923, "nvml_energy": 34.1562548805542, "compile_time": 254.8114740056917, "verification_time": 0, "benchmark_time": 3548.0203059269115, "edp": 10064.005826845256, "flops_watt": 4023829.7188210343, "occupancy": 98.21327395944695, "strategy_time": 0, "framework_time": 0.4089600406587124, "timestamp": "2025-02-18 02:47:56.392811+00:00"},
"2,64,4,1": {"block_size_x": 2, "block_size_y": 64, "tile_size_x": 4, "tile_size_y": 1, "sm__warps_active.avg.pct_of_peak_sustained_active": 97.87680434646336, "sm__maximum_warps_per_active_cycle_pct": 97.87680434646336, "time": 156.43513924734933, "times": [150.3442840576172, 149.12396240234375, 149.37974548339844, 148.51434326171875, 164.57289123535156, 166.9475860595703, 166.1631622314453], "nvml_power": 113.76, "nvml_energy": 17.796061440778463, "compile_time": 249.17962902691215, "verification_time": 0, "benchmark_time": 2369.920057011768, "edp": 2783.9293495425627, "flops_watt": 7722998.3684517965, "occupancy": 97.87680434646336, "strategy_time": 0, "framework_time": 0.4325299523770809, "timestamp": "2025-02-18 02:47:59.012368+00:00"},
"2,64,4,2": {"block_size_x": 2, "block_size_y": 64, "tile_size_x": 4, "tile_size_y": 2, "sm__warps_active.avg.pct_of_peak_sustained_active": 97.95339963109588, "sm__maximum_warps_per_active_cycle_pct": 97.95339963109588, "time": 157.24493844168526, "times": [151.11007690429688, 149.733154296875, 149.98074340820312, 150.37779235839844, 165.4602508544922, 167.49655151367188, 166.55599975585938], "nvml_power": 114.26, "nvml_energy": 17.96680666634696, "compile_time": 249.7097790474072, "verification_time": 0, "benchmark_time": 2380.167979048565, "edp": 2825.1894082433882, "flops_watt": 7649603.851386257, "occupancy": 97.95339963109588, "strategy_time": 0, "framework_time": 0.40066882502287626, "timestamp": "2025-02-18 02:48:01.642673+00:00"},
"2,64,4,4": {"block_size_x": 2, "block_size_y": 64, "tile_size_x": 4, "tile_size_y": 4, "sm__warps_active.avg.pct_of_peak_sustained_active": 97.96084139244063, "sm__maximum_warps_per_active_cycle_pct": 97.96084139244063, "time": 156.02872140066964, "times": [150.96339416503906, 149.27040100097656, 150.4767303466797, 149.7783966064453, 165.46534729003906, 166.9405059814453, 159.3062744140625], "nvml_power": 114.957, "nvml_energy": 17.93659372605678, "compile_time": 250.86077803280205, "verification_time": 0, "benchmark_time": 2359.9007750162855, "edp": 2798.6237853599123, "flops_watt": 7662489.075188239, "occupancy": 97.96084139244063, "strategy_time": 0, "framework_time": 0.3996689338237047, "timestamp": "2025-02-18 02:48:04.253858+00:00"},
"2,128,1,1": {"block_size_x": 2, "block_size_y": 128, "tile_size_x": 1, "tile_size_y": 1, "sm__warps_active.avg.pct_of_peak_sustained_active": 95.71775649799295, "sm__maximum_warps_per_active_cycle_pct": 95.71775649799295, "time": 250.64151654924666, "times": [239.20469665527344, 238.11276245117188, 261.3221435546875, 264.4538269042969, 250.46429443359375, 241.21878051757812, 259.714111328125], "nvml_power": 114.635, "nvml_energy": 28.732290249622892, "compile_time": 251.71294598840177, "verification_time": 0, "benchmark_time": 3037.779167992994, "edp": 7201.504802098614, "flops_watt": 4783431.890668857, "occupancy": 95.71775649799295, "strategy_time": 0, "framework_time": 0.39381009992212057, "timestamp": "2025-02-18 02:48:07.543767+00:00"},
"2,128,1,2": {"block_size_x": 2, "block_size_y": 128, "tile_size_x": 1, "tile_size_y": 2, "sm__warps_active.avg.pct_of_peak_sustained_active": 95.86990821947886, "sm__maximum_warps_per_active_cycle_pct": 95.86990821947886, "time": 246.06982639857702, "times": [237.81861877441406, 235.1365509033203, 257.32965087890625, 258.87005615234375, 239.28997802734375, 236.5241241455078, 257.5198059082031], "nvml_power": 113.281, "nvml_energy": 27.875036004257204, "compile_time": 251.9548760028556, "verification_time": 0, "benchmark_time": 3249.1084579378366, "edp": 6859.205270421654, "flops_watt": 4930539.047591174, "occupancy": 95.86990821947886, "strategy_time": 0, "framework_time": 0.40193996392190456, "timestamp": "2025-02-18 02:48:11.045257+00:00"},
"2,128,1,4": {"block_size_x": 2, "block_size_y": 128, "tile_size_x": 1, "tile_size_y": 4, "sm__warps_active.avg.pct_of_peak_sustained_active": 95.83259227408209, "sm__maximum_warps_per_active_cycle_pct": 95.83259227408209, "time": 247.3993682861328, "times": [239.41587829589844, 237.04905700683594, 258.86761474609375, 258.6867370605469, 239.5937957763672, 238.24819946289062, 259.9342956542969], "nvml_power": 113.762, "nvml_energy": 28.144646934967042, "compile_time": 248.65017901174724, "verification_time": 0, "benchmark_time": 3264.2780049936846, "edp": 6962.967872347091, "flops_watt": 4883307.073973104, "occupancy": 95.83259227408209, "strategy_time": 0, "framework_time": 0.4059099592268467, "timestamp": "2025-02-18 02:48:14.558615+00:00"},
"2,128,2,1": {"block_size_x": 2, "block_size_y": 128, "tile_size_x": 2, "tile_size_y": 1, "sm__warps_active.avg.pct_of_peak_sustained_active": 95.86701438995078, "sm__maximum_warps_per_active_cycle_pct": 95.86701438995078, "time": 283.4576982770647, "times": [266.7741394042969, 273.94512939453125, 298.02252197265625, 291.5112609863281, 265.6048278808594, 290.860107421875, 297.48590087890625], "nvml_power": 113.517, "nvml_energy": 32.17726753531755, "compile_time": 254.52777510508895, "verification_time": 0, "benchmark_time": 3429.018141934648, "edp": 9120.894192406431, "flops_watt": 4271305.92494058, "occupancy": 95.86701438995078, "strategy_time": 0, "framework_time": 0.41606894228607416, "timestamp": "2025-02-18 02:48:18.242602+00:00"},
"2,128,2,2": {"block_size_x": 2, "block_size_y": 128, "tile_size_x": 2, "tile_size_y": 2, "sm__warps_active.avg.pct_of_peak_sustained_active": 95.96685314272176, "sm__maximum_warps_per_active_cycle_pct": 95.96685314272176, "time": 279.84027099609375, "times": [267.4436340332031, 270.3487548828125, 297.529541015625, 279.2727966308594, 265.3133544921875, 287.93634033203125, 291.0374755859375], "nvml_power": 113.862, "nvml_energy": 31.863172936157227, "compile_time": 254.06579510308802, "verification_time": 0, "benchmark_time": 3379.3730820761994, "edp": 8916.59894924964, "flops_watt": 4313410.775109563, "occupancy": 95.96685314272176, "strategy_time": 0, "framework_time": 0.39720977656543255, "timestamp": "2025-02-18 02:48:21.876462+00:00"},
"2,128,2,4": {"block_size_x": 2, "block_size_y": 128, "tile_size_x": 2, "tile_size_y": 4, "sm__warps_active.avg.pct_of_peak_sustained_active": 95.89452239070697, "sm__maximum_warps_per_active_cycle_pct": 95.89452239070697, "time": 286.0989074707031, "times": [272.4428405761719, 276.16375732421875, 301.498046875, 289.9427490234375, 270.27325439453125, 294.8707580566406, 297.5009460449219], "nvml_power": 114.221, "nvml_energy": 32.67850331021118, "compile_time": 249.4890090310946, "verification_time": 0, "benchmark_time": 3455.1424710080028, "edp": 9349.284094829174, "flops_watt": 4205790.949705274, "occupancy": 95.89452239070697, "strategy_time": 0, "framework_time": 0.40010898374021053, "timestamp": "2025-02-18 02:48:25.581519+00:00"},
"2,128,4,1": {"block_size_x": 2, "block_size_y": 128, "tile_size_x": 4, "tile_size_y": 1, "sm__warps_active.avg.pct_of_peak_sustained_active": 95.71641345892252, "sm__maximum_warps_per_active_cycle_pct": 95.71641345892252, "time": 152.3174067905971, "times": [146.81021118164062, 145.16146850585938, 145.8791961669922, 145.14883422851562, 158.20664978027344, 162.55416870117188, 162.46131896972656], "nvml_power": 113.514, "nvml_energy": 17.290158114427836, "compile_time": 254.72815393004566, "verification_time": 0, "benchmark_time": 2305.3319989703596, "edp": 2633.592046989048, "flops_watt": 7948970.307987731, "occupancy": 95.71641345892252, "strategy_time": 0, "framework_time": 0.4147901199758053, "timestamp": "2025-02-18 02:48:28.142019+00:00"},
"2,128,4,2": {"block_size_x": 2, "block_size_y": 128, "tile_size_x": 4, "tile_size_y": 2, "sm__warps_active.avg.pct_of_peak_sustained_active": 95.82841015808917, "sm__maximum_warps_per_active_cycle_pct": 95.82841015808917, "time": 151.09263610839844, "times": [146.19436645507812, 144.70150756835938, 145.62112426757812, 145.42416381835938, 156.65187072753906, 162.0549774169922, 157.0004425048828], "nvml_power": 114.193, "nvml_energy": 17.25372139512634, "compile_time": 254.05584496911615, "verification_time": 0, "benchmark_time": 2286.359563935548, "edp": 2606.910248269513, "flops_watt": 7965757.086515979, "occupancy": 95.82841015808917, "strategy_time": 0, "framework_time": 0.4009801195934415, "timestamp": "2025-02-18 02:48:30.682858+00:00"},
"2,128,4,4": {"block_size_x": 2, "block_size_y": 128, "tile_size_x": 4, "tile_size_y": 4, "sm__warps_active.avg.pct_of_peak_sustained_active": 95.76265025069196, "sm__maximum_warps_per_active_cycle_pct": 95.76265025069196, "time": 153.46315438406808, "times": [147.98809814453125, 146.70672607421875, 146.6980438232422, 146.69430541992188, 159.74649047851562, 163.9384002685547, 162.4700164794922], "nvml_power": 113.769, "nvml_energy": 17.45934961112104, "compile_time": 251.21558702085167, "verification_time": 0, "benchmark_time": 2319.562957971357, "edp": 2679.3668648168873, "flops_watt": 7871940.051217935, "occupancy": 95.76265025069196, "strategy_time": 0, "framework_time": 0.4208700265735388, "timestamp": "2025-02-18 02:48:33.254082+00:00"},
"2,256,1,1": {"block_size_x": 2, "block_size_y": 256, "tile_size_x": 1, "tile_size_y": 1, "sm__warps_active.avg.pct_of_peak_sustained_active": 90.87885117489337, "sm__maximum_warps_per_active_cycle_pct": 90.87885117489337, "time": 224.6750967843192, "times": [219.78688049316406, 217.67724609375, 231.77734375, 235.86671447753906, 226.64370727539062, 218.13046264648438, 222.84332275390625], "nvml_power": 114.434, "nvml_energy": 25.710470025416782, "compile_time": 253.82380501832813, "verification_time": 0, "benchmark_time": 2971.880170982331, "edp": 5776.502341330854, "flops_watt": 5345641.419084559, "occupancy": 90.87885117489337, "strategy_time": 0, "framework_time": 0.40756002999842167, "timestamp": "2025-02-18 02:48:36.480218+00:00"},
"2,256,1,2": {"block_size_x": 2, "block_size_y": 256, "tile_size_x": 1, "tile_size_y": 2, "sm__warps_active.avg.pct_of_peak_sustained_active": 90.99661965680666, "sm__maximum_warps_per_active_cycle_pct": 90.99661965680666, "time": 223.46825299944197, "times": [218.78956604003906, 216.75343322753906, 232.08438110351562, 233.69903564453125, 225.31289672851562, 216.97267150878906, 220.66578674316406], "nvml_power": 114.917, "nvml_energy": 25.680301229936873, "compile_time": 251.93750602193177, "verification_time": 0, "benchmark_time": 2957.812483073212, "edp": 5738.7320523534145, "flops_watt": 5351921.390695378, "occupancy": 90.99661965680666, "strategy_time": 0, "framework_time": 0.4042498767375946, "timestamp": "2025-02-18 02:48:39.690397+00:00"},
"2,256,1,4": {"block_size_x": 2, "block_size_y": 256, "tile_size_x": 1, "tile_size_y": 4, "sm__warps_active.avg.pct_of_peak_sustained_active": 90.75948383021016, "sm__maximum_warps_per_active_cycle_pct": 90.75948383021016, "time": 222.10112871442522, "times": [217.95587158203125, 214.41384887695312, 229.68902587890625, 232.96290588378906, 223.8461151123047, 216.28912353515625, 219.55101013183594], "nvml_power": 114.127, "nvml_energy": 25.347735516791207, "compile_time": 251.71710597351193, "verification_time": 0, "benchmark_time": 2946.6739520430565, "edp": 5629.760668634051, "flops_watt": 5422139.322108507, "occupancy": 90.75948383021016, "strategy_time": 0, "framework_time": 0.39995997212827206, "timestamp": "2025-02-18 02:48:42.889212+00:00"},
"2,256,2,1": {"block_size_x": 2, "block_size_y": 256, "tile_size_x": 2, "tile_size_y": 1, "sm__warps_active.avg.pct_of_peak_sustained_active": 92.78916625124766, "sm__maximum_warps_per_active_cycle_pct": 92.78916625124766, "time": 239.27537318638392, "times": [232.2457275390625, 229.81788635253906, 252.07369995117188, 249.82496643066406, 232.47900390625, 232.3311004638672, 246.1552276611328], "nvml_power": 113.884, "nvml_energy": 27.249636599958148, "compile_time": 248.88267903588712, "verification_time": 0, "benchmark_time": 3172.913189046085, "edp": 6520.166966648331, "flops_watt": 5043698.581734888, "occupancy": 92.78916625124766, "strategy_time": 0, "framework_time": 0.39611896499991417, "timestamp": "2025-02-18 02:48:46.311428+00:00"},
"2,256,2,2": {"block_size_x": 2, "block_size_y": 256, "tile_size_x": 2, "tile_size_y": 2, "sm__warps_active.avg.pct_of_peak_sustained_active": 92.88773934698467, "sm__maximum_warps_per_active_cycle_pct": 92.88773934698467, "time": 239.01141357421875, "times": [229.91094970703125, 232.1265869140625, 250.43292236328125, 248.8272705078125, 232.9654998779297, 231.19302368164062, 247.62364196777344], "nvml_power": 114.2105, "nvml_energy": 27.29761305001831, "compile_time": 250.44775800779462, "verification_time": 0, "benchmark_time": 3177.353154984303, "edp": 6524.441082286917, "flops_watt": 5034834.116087956, "occupancy": 92.88773934698467, "strategy_time": 0, "framework_time": 0.39995007682591677, "timestamp": "2025-02-18 02:48:49.739653+00:00"},
"2,256,2,4": {"block_size_x": 2, "block_size_y": 256, "tile_size_x": 2, "tile_size_y": 4, "sm__warps_active.avg.pct_of_peak_sustained_active": 92.53247098084513, "sm__maximum_warps_per_active_cycle_pct": 92.53247098084513, "time": 237.37407793317522, "times": [229.4530487060547, 227.65139770507812, 250.05584716796875, 247.8865966796875, 233.10195922851562, 228.69369506835938, 244.7760009765625], "nvml_power": 113.388, "nvml_energy": 26.91537194868687, "compile_time": 253.5057149361819, "verification_time": 0, "benchmark_time": 3156.6592019516975, "edp": 6389.011598547995, "flops_watt": 5106336.770453038, "occupancy": 92.53247098084513, "strategy_time": 0, "framework_time": 0.4151600878685713, "timestamp": "2025-02-18 02:48:53.150257+00:00"},
"2,256,4,1": {"block_size_x": 2, "block_size_y": 256, "tile_size_x": 4, "tile_size_y": 1, "sm__warps_active.avg.pct_of_peak_sustained_active": 92.37428983530201, "sm__maximum_warps_per_active_cycle_pct": 92.37428983530201, "time": 125.79070826939174, "times": [125.81327819824219, 121.89695739746094, 121.8544921875, 121.92918395996094, 122.28192138671875, 132.5369873046875, 134.22213745117188], "nvml_power": 114.109, "nvml_energy": 14.35385192991202, "compile_time": 251.8710569711402, "verification_time": 0, "benchmark_time": 2083.4633780177683, "edp": 1805.5812006576086, "flops_watt": 9575057.214125965, "occupancy": 92.37428983530201, "strategy_time": 0, "framework_time": 0.4022399662062526, "timestamp": "2025-02-18 02:48:55.486018+00:00"},
"2,256,4,2": {"block_size_x": 2, "block_size_y": 256, "tile_size_x": 4, "tile_size_y": 2, "sm__warps_active.avg.pct_of_peak_sustained_active": 92.34861431418575, "sm__maximum_warps_per_active_cycle_pct": 92.34861431418575, "time": 125.41149248395648, "times": [126.59769439697266, 121.56572723388672, 120.73241424560547, 121.2979507446289, 121.94834899902344, 132.0316162109375, 133.70669555664062], "nvml_power": 113.814, "nvml_energy": 14.273583605569021, "compile_time": 254.78299392852932, "verification_time": 0, "benchmark_time": 2065.992273041047, "edp": 1790.0714230689437, "flops_watt": 9628903.10309854, "occupancy": 92.34861431418575, "strategy_time": 0, "framework_time": 0.4309600917622447, "timestamp": "2025-02-18 02:48:57.807248+00:00"},
"2,256,4,4": {"block_size_x": 2, "block_size_y": 256, "tile_size_x": 4, "tile_size_y": 4, "sm__warps_active.avg.pct_of_peak_sustained_active": 92.0536384569839, "sm__maximum_warps_per_active_cycle_pct": 92.0536384569839, "time": 122.9792229788644, "times": [124.1746597290039, 119.09645080566406, 119.60358428955078, 119.150146484375, 118.81017303466797, 128.30438232421875, 131.7151641845703], "nvml_power": 114.228, "nvml_energy": 14.047670682429722, "compile_time": 253.04900493938476, "verification_time": 0, "benchmark_time": 2146.095167961903, "edp": 1727.5716251881809, "flops_watt": 9783753.946047673, "occupancy": 92.0536384569839, "strategy_time": 0, "framework_time": 0.40024914778769016, "timestamp": "2025-02-18 02:49:00.206816+00:00"},
"4,8,1,1": {"block_size_x": 4, "block_size_y": 8, "tile_size_x": 1, "tile_size_y": 1, "sm__warps_active.avg.pct_of_peak_sustained_active": 49.94723624531523, "sm__maximum_warps_per_active_cycle_pct": 49.94723624531523, "time": 156.4883793422154, "times": [151.46742248535156, 149.2281951904297, 149.21087646484375, 149.43638610839844, 165.23008728027344, 168.55148315429688, 162.29420471191406], "nvml_power": 114.543, "nvml_energy": 17.92464843499538, "compile_time": 253.57921503018588, "verification_time": 0, "benchmark_time": 2363.7961730128154, "edp": 2804.999183871405, "flops_watt": 7667595.488437563, "occupancy": 49.94723624531523, "strategy_time": 0, "framework_time": 0.39674993604421616, "timestamp": "2025-02-18 02:49:02.824613+00:00"},
"4,8,1,2": {"block_size_x": 4, "block_size_y": 8, "tile_size_x": 1, "tile_size_y": 2, "sm__warps_active.avg.pct_of_peak_sustained_active": 49.94798880027717, "sm__maximum_warps_per_active_cycle_pct": 49.94798880027717, "time": 157.58878871372767, "times": [152.45925903320312, 151.0223388671875, 150.7415313720703, 149.85507202148438, 168.11465454101562, 169.28005981445312, 161.6486053466797], "nvml_power": 114.593, "nvml_energy": 18.058572065072195, "compile_time": 250.71306806057692, "verification_time": 0, "benchmark_time": 2373.352564056404, "edp": 2845.8284976342866, "flops_watt": 7610732.065456391, "occupancy": 49.94798880027717, "strategy_time": 0, "framework_time": 0.40868890937417746, "timestamp": "2025-02-18 02:49:05.449112+00:00"},
"4,8,1,4": {"block_size_x": 4, "block_size_y": 8, "tile_size_x": 1, "tile_size_y": 4, "sm__warps_active.avg.pct_of_peak_sustained_active": 49.947807074295184, "sm__maximum_warps_per_active_cycle_pct": 49.947807074295184, "time": 159.45511082240515, "times": [153.0353546142578, 150.6411895751953, 151.21192932128906, 151.9208984375, 168.7573699951172, 169.9813690185547, 170.63766479492188], "nvml_power": 113.607, "nvml_energy": 18.11521677520098, "compile_time": 248.38446895591915, "verification_time": 0, "benchmark_time": 2410.802453989163, "edp": 2888.5638984615653, "flops_watt": 7586933.967036405, "occupancy": 49.947807074295184, "strategy_time": 0, "framework_time": 0.39751012809574604, "timestamp": "2025-02-18 02:49:08.108721+00:00"},
