experiments/data/run4/bayes_opt_float64.json
{
"device_name": "NVIDIA RTX 5000 Ada Generation",
"kernel_name": "tuned_matmul<double>",
"problem_size": [
4096,
4096
],
"tune_params_keys": [
"block_size_x",
"block_size_y",
"tile_size_x",
"tile_size_y",
"nvml_pwr_limit"
],
"tune_params": {
"block_size_x": [
1,
2,
4,
8,
16,
32,
64,
128,
256,
512,
1024
],
"block_size_y": [
1,
2,
4,
8,
16,
32,
64,
128,
256,
512,
1024
],
"tile_size_x": [
2,
4,
8,
16,
32
],
"tile_size_y": [
2,
4,
8,
16,
32
],
"nvml_pwr_limit": [
100,
115,
135,
150,
165,
185,
200,
215,
235,
250
]
},
"objective": "objective",
"cache": {
"2,16,4,8,235": {"block_size_x": 2, "block_size_y": 16, "tile_size_x": 4, "tile_size_y": 8, "nvml_pwr_limit": 235, "sm__warps_active.avg.pct_of_peak_sustained_active": 49.827666955585336, "dram__bytes.sum.per_second": 177626870828.98294, "time": 88.26291765485492, "times": [88.31334686279297, 88.22022247314453, 88.26921844482422, 88.24877166748047, 88.26573181152344, 88.28031921386719, 88.24281311035156], "nvml_power": 237.156, "nvml_energy": 20.93208049935477, "compile_time": 243.86127898469567, "verification_time": 0, "benchmark_time": 1801.4606211800128, "edp": 1847.5264974593447, "throughput_penalty": 1000000.0, "objective": 1001847.5264974594, "strategy_time": 455.377756152302, "framework_time": 0, "timestamp": "2025-02-20 07:49:57.375967+00:00"},
"1,64,8,4,150": {"block_size_x": 1, "block_size_y": 64, "tile_size_x": 8, "tile_size_y": 4, "nvml_pwr_limit": 150, "sm__warps_active.avg.pct_of_peak_sustained_active": 95.08521966384433, "dram__bytes.sum.per_second": 46438794110.563126, "time": 85.51915522984096, "times": [84.2061767578125, 86.23238372802734, 86.15229034423828, 85.50141143798828, 85.48371124267578, 85.35724639892578, 85.70086669921875], "nvml_power": 152.022, "nvml_energy": 13.000793016350883, "compile_time": 234.0755918994546, "verification_time": 0, "benchmark_time": 1774.4355381000787, "edp": 1111.8168360763434, "throughput_penalty": 1000000.0, "objective": 1001111.8168360763, "strategy_time": 0.15577999874949455, "framework_time": 53.68373403325677, "timestamp": "2025-02-20 07:49:59.438342+00:00"},
"64,2,2,2,115": {"block_size_x": 64, "block_size_y": 2, "tile_size_x": 2, "tile_size_y": 2, "nvml_pwr_limit": 115, "sm__warps_active.avg.pct_of_peak_sustained_active": 99.52446275652484, "dram__bytes.sum.per_second": 509838403.0617397, "time": 337.03002493722096, "times": [322.1348876953125, 342.7144470214844, 353.8372802734375, 323.7443542480469, 343.4129333496094, 349.9990539550781, 323.3672180175781], "nvml_power": 114.76, "nvml_energy": 38.67756566179548, "compile_time": 248.2442338950932, "verification_time": 0, "benchmark_time": 3720.9287399891764, "edp": 13035.50091950593, "throughput_penalty": 1000000.0, "objective": 1013035.500919506, "strategy_time": 0.1320911105722189, "framework_time": 50.598907051607966, "timestamp": "2025-02-20 07:50:03.458270+00:00"},
"4,32,32,32,200": {"block_size_x": 4, "block_size_y": 32, "tile_size_x": 32, "tile_size_y": 32, "nvml_pwr_limit": 200, "sm__warps_active.avg.pct_of_peak_sustained_active": 97.83444501588876, "dram__bytes.sum.per_second": 34481053868.03903, "time": 19.762463978358678, "times": [18.126911163330078, 19.657407760620117, 20.25712013244629, 20.12112045288086, 20.189855575561523, 19.98736000061035, 19.997472763061523], "nvml_power": 202.945, "nvml_energy": 4.010693252088001, "compile_time": 246.94433202967048, "verification_time": 0, "benchmark_time": 1222.8300240822136, "edp": 79.26118092263533, "throughput_penalty": 1000000.0, "objective": 1000079.2611809226, "strategy_time": 0.2656409051269293, "framework_time": 51.448001991957426, "timestamp": "2025-02-20 07:50:04.979781+00:00"},
"4,32,16,8,185": {"block_size_x": 4, "block_size_y": 32, "tile_size_x": 16, "tile_size_y": 8, "nvml_pwr_limit": 185, "sm__warps_active.avg.pct_of_peak_sustained_active": 98.76798561409811, "dram__bytes.sum.per_second": 88991186085.6232, "time": 43.916443416050505, "times": [47.91084671020508, 43.66543960571289, 43.093727111816406, 43.23494338989258, 43.04121780395508, 43.27830505371094, 43.19062423706055], "nvml_power": 187.233, "nvml_energy": 8.222607450117385, "compile_time": 249.52091183513403, "verification_time": 0, "benchmark_time": 1404.126418987289, "edp": 361.1076748154755, "throughput_penalty": 1000000.0, "objective": 1000361.1076748155, "strategy_time": 0.2528608310967684, "framework_time": 56.371633196249604, "timestamp": "2025-02-20 07:50:06.690079+00:00"},
"8,32,4,4,165": {"block_size_x": 8, "block_size_y": 32, "tile_size_x": 4, "tile_size_y": 4, "nvml_pwr_limit": 165, "sm__warps_active.avg.pct_of_peak_sustained_active": 99.54370733296514, "dram__bytes.sum.per_second": 22104960804.777187, "time": 164.04765101841517, "times": [162.46946716308594, 162.1736602783203, 162.02694702148438, 161.20303344726562, 167.59222412109375, 167.06410217285156, 165.8041229248047], "nvml_power": 163.616, "nvml_energy": 26.84082046902902, "compile_time": 244.4019780959934, "verification_time": 0, "benchmark_time": 2493.0088710971177, "edp": 4403.173549351207, "throughput_penalty": 1000000.0, "objective": 1004403.1735493512, "strategy_time": 0.2758810296654701, "framework_time": 60.89052255265415, "timestamp": "2025-02-20 07:50:09.488681+00:00"},
"2,32,2,8,165": {"block_size_x": 2, "block_size_y": 32, "tile_size_x": 2, "tile_size_y": 8, "nvml_pwr_limit": 165, "sm__warps_active.avg.pct_of_peak_sustained_active": 98.97168748814134, "dram__bytes.sum.per_second": 53602339067.763214, "time": 354.3254961286272, "times": [335.7855529785156, 363.692138671875, 365.8350524902344, 340.0322570800781, 370.5402526855469, 358.3448181152344, 346.04840087890625], "nvml_power": 165.538, "nvml_energy": 58.65433397814069, "compile_time": 249.17588382959366, "verification_time": 0, "benchmark_time": 3916.820995043963, "edp": 20782.7259868989, "throughput_penalty": 1000000.0, "objective": 1020782.7259868989, "strategy_time": 0.25229109451174736, "framework_time": 0.5575038958340883, "timestamp": "2025-02-20 07:50:13.655513+00:00"},
"2,256,16,2,235": {"block_size_x": 2, "block_size_y": 256, "tile_size_x": 16, "tile_size_y": 2, "nvml_pwr_limit": 235, "sm__warps_active.avg.pct_of_peak_sustained_active": 95.88899674688304, "dram__bytes.sum.per_second": 27753910335.220776, "time": 23.518093381609237, "times": [22.687776565551758, 23.562143325805664, 23.671072006225586, 23.6092472076416, 23.74367904663086, 23.619104385375977, 23.733631134033203], "nvml_power": 237.335, "nvml_energy": 5.581666692724228, "compile_time": 252.34170397743583, "verification_time": 0, "benchmark_time": 1241.781914839521, "edp": 131.27015850450638, "throughput_penalty": 1000000.0, "objective": 1000131.2701585045, "strategy_time": 0.20943093113601208, "framework_time": 54.69613429158926, "timestamp": "2025-02-20 07:50:15.204566+00:00"},
"64,16,32,2,150": {"block_size_x": 64, "block_size_y": 16, "tile_size_x": 32, "tile_size_y": 2, "nvml_pwr_limit": 150, "sm__warps_active.avg.pct_of_peak_sustained_active": 65.99717180457057, "dram__bytes.sum.per_second": 22083030495.54498, "time": 159.37738037109375, "times": [158.18780517578125, 157.6233673095703, 156.83251953125, 157.26853942871094, 160.6654052734375, 163.19509887695312, 161.86892700195312], "nvml_power": 148.932, "nvml_energy": 23.736392013427732, "compile_time": 248.59657511115074, "verification_time": 0, "benchmark_time": 2421.8949910718948, "edp": 3783.0439785614635, "throughput_penalty": 1000000.0, "objective": 1003783.0439785614, "strategy_time": 0.3183120861649513, "framework_time": 58.80122072994709, "timestamp": "2025-02-20 07:50:17.934200+00:00"},
"2,128,4,8,150": {"block_size_x": 2, "block_size_y": 128, "tile_size_x": 4, "tile_size_y": 8, "nvml_pwr_limit": 150, "sm__warps_active.avg.pct_of_peak_sustained_active": 92.92086198833431, "dram__bytes.sum.per_second": 30235467615.286663, "time": 170.63433837890625, "times": [162.84664916992188, 163.0735321044922, 163.76034545898438, 167.06640625, 182.89663696289062, 181.4233856201172, 173.3734130859375], "nvml_power": 150.691, "nvml_energy": 25.71305908465576, "compile_time": 252.37516802735627, "verification_time": 0, "benchmark_time": 2411.9258949067444, "edp": 4387.53082460796, "throughput_penalty": 1000000.0, "objective": 1004387.5308246079, "strategy_time": 0.30524213798344135, "framework_time": 0.5507429596036673, "timestamp": "2025-02-20 07:50:20.599381+00:00"},
"8,16,8,4,235": {"block_size_x": 8, "block_size_y": 16, "tile_size_x": 8, "tile_size_y": 4, "nvml_pwr_limit": 235, "sm__warps_active.avg.pct_of_peak_sustained_active": 99.6850571360758, "dram__bytes.sum.per_second": 230941547502.2312, "time": 149.97594342912947, "times": [148.92428588867188, 148.42784118652344, 148.42037963867188, 148.53689575195312, 149.82447814941406, 153.10092163085938, 152.5968017578125], "nvml_power": 235.337, "nvml_energy": 35.29488859878104, "compile_time": 249.5167430024594, "verification_time": 0, "benchmark_time": 2285.5837971437722, "edp": 5293.384215828212, "throughput_penalty": 1000000.0, "objective": 1005293.3842158283, "strategy_time": 0.25052111595869064, "framework_time": 55.59154460206628, "timestamp": "2025-02-20 07:50:23.190347+00:00"},
"8,64,32,32,150": {"block_size_x": 8, "block_size_y": 64, "tile_size_x": 32, "tile_size_y": 32, "nvml_pwr_limit": 150, "sm__warps_active.avg.pct_of_peak_sustained_active": 98.69270086949481, "dram__bytes.sum.per_second": 22308675931.506042, "time": 42.25677217755999, "times": [44.97292709350586, 42.24620819091797, 41.42076873779297, 41.75859069824219, 41.78656005859375, 41.80665588378906, 41.805694580078125], "nvml_power": 152.5585, "nvml_energy": 6.446629778250285, "compile_time": 252.40240106359124, "verification_time": 0, "benchmark_time": 1381.7561429459602, "edp": 272.4137658525964, "throughput_penalty": 1000000.0, "objective": 1000272.4137658526, "strategy_time": 0.299651175737381, "framework_time": 50.88653485290706, "timestamp": "2025-02-20 07:50:24.875717+00:00"},
"1,512,32,32,150": {"block_size_x": 1, "block_size_y": 512, "tile_size_x": 32, "tile_size_y": 32, "nvml_pwr_limit": 150, "sm__warps_active.avg.pct_of_peak_sustained_active": 92.6247203220459, "dram__bytes.sum.per_second": 11170400099.321724, "time": 14.927177156720843, "times": [13.244864463806152, 14.721887588500977, 14.939423561096191, 15.26688003540039, 15.443455696105957, 15.309056282043457, 15.564672470092773], "nvml_power": 155.23, "nvml_energy": 2.317145710037776, "compile_time": 251.21401506476104, "verification_time": 0, "benchmark_time": 1287.1896070428193, "edp": 34.58844451166959, "throughput_penalty": 1000000.0, "objective": 1000034.5884445116, "strategy_time": 0.2481511328369379, "framework_time": 0.5604727193713188, "timestamp": "2025-02-20 07:50:26.414953+00:00"},
"4,16,32,8,115": {"block_size_x": 4, "block_size_y": 16, "tile_size_x": 32, "tile_size_y": 8, "nvml_pwr_limit": 115, "sm__warps_active.avg.pct_of_peak_sustained_active": 88.49528590543187, "dram__bytes.sum.per_second": 28662085846.903343, "time": 41.38898794991629, "times": [35.840545654296875, 44.261470794677734, 41.929439544677734, 42.18182373046875, 42.124961853027344, 41.62678527832031, 41.75788879394531], "nvml_power": 116.609, "nvml_energy": 4.826328495851789, "compile_time": 252.2853680420667, "verification_time": 0, "benchmark_time": 1433.9558109641075, "edp": 199.75685195714732, "throughput_penalty": 1000000.0, "objective": 1000199.7568519572, "strategy_time": 0.21348102018237114, "framework_time": 54.94631105102599, "timestamp": "2025-02-20 07:50:28.156379+00:00"},
"4,128,2,32,115": {"block_size_x": 4, "block_size_y": 128, "tile_size_x": 2, "tile_size_y": 32, "nvml_pwr_limit": 115, "sm__warps_active.avg.pct_of_peak_sustained_active": 99.42999568021622, "dram__bytes.sum.per_second": 7905357378.335697, "time": 293.82667759486606, "times": [278.8037414550781, 287.49603271484375, 311.1573791503906, 292.1709289550781, 278.7952880859375, 305.19158935546875, 303.1717834472656], "nvml_power": 115.689, "nvml_energy": 33.99251450427246, "compile_time": 248.03340691141784, "verification_time": 0, "benchmark_time": 3539.1216699499637, "edp": 9987.907599885672, "throughput_penalty": 1000000.0, "objective": 1009987.9075998857, "strategy_time": 0.2552010118961334, "framework_time": 0.5730122793465853, "timestamp": "2025-02-20 07:50:31.944387+00:00"},
"16,2,4,2,200": {"block_size_x": 16, "block_size_y": 2, "tile_size_x": 4, "tile_size_y": 2, "nvml_pwr_limit": 200, "sm__warps_active.avg.pct_of_peak_sustained_active": 49.94477757995075, "dram__bytes.sum.per_second": 1512141001.262797, "time": 152.54509626116072, "times": [150.6318359375, 151.77513122558594, 151.76351928710938, 151.7592010498047, 153.3080291748047, 154.81951904296875, 153.75843811035156], "nvml_power": 201.412, "nvml_energy": 30.724412928152905, "compile_time": 251.05705601163208, "verification_time": 0, "benchmark_time": 2322.4403609056026, "edp": 4686.858527692736, "throughput_penalty": 1000000.0, "objective": 1004686.8585276927, "strategy_time": 0.29330095276236534, "framework_time": 55.77737418934703, "timestamp": "2025-02-20 07:50:34.573980+00:00"},
"8,4,2,4,250": {"block_size_x": 8, "block_size_y": 4, "tile_size_x": 2, "tile_size_y": 4, "nvml_pwr_limit": 250, "sm__warps_active.avg.pct_of_peak_sustained_active": 49.944749666878124, "dram__bytes.sum.per_second": 1476602090.2568917, "time": 139.7311728341239, "times": [139.77203369140625, 139.73199462890625, 139.7375030517578, 139.7294464111328, 139.71104431152344, 139.72047424316406, 139.71571350097656], "nvml_power": 239.505, "nvml_energy": 33.46631454963684, "compile_time": 251.20955402962863, "verification_time": 0, "benchmark_time": 2266.0957179032266, "edp": 4676.28738245646, "throughput_penalty": 1000000.0, "objective": 1004676.2873824565, "strategy_time": 0.2945619635283947, "framework_time": 54.58946619182825, "timestamp": "2025-02-20 07:50:37.146194+00:00"},
"128,4,32,2,165": {"block_size_x": 128, "block_size_y": 4, "tile_size_x": 32, "tile_size_y": 2, "nvml_pwr_limit": 165, "sm__warps_active.avg.pct_of_peak_sustained_active": 99.41421918541266, "dram__bytes.sum.per_second": 682565636.5909017, "time": 166.66517857142858, "times": [164.90538024902344, 164.66143798828125, 164.6426544189453, 164.79367065429688, 170.176025390625, 169.7406005859375, 167.73648071289062], "nvml_power": 164.227, "nvml_energy": 27.370922281250003, "compile_time": 250.71356794796884, "verification_time": 0, "benchmark_time": 2528.543597087264, "edp": 4561.779649669225, "throughput_penalty": 1000000.0, "objective": 1004561.7796496692, "strategy_time": 0.34443195909261703, "framework_time": 52.51902714371681, "timestamp": "2025-02-20 07:50:39.978339+00:00"},
"2,128,8,16,100": {"block_size_x": 2, "block_size_y": 128, "tile_size_x": 8, "tile_size_y": 16, "nvml_pwr_limit": 100, "sm__warps_active.avg.pct_of_peak_sustained_active": 93.26183310189016, "dram__bytes.sum.per_second": 18179289371.974182, "time": 177.14769635881697, "times": [169.7005157470703, 169.80096435546875, 170.73843383789062, 174.0581512451172, 192.5114288330078, 188.9154510498047, 174.30892944335938], "nvml_power": 101.276, "nvml_energy": 17.94081009643555, "compile_time": 250.6735441274941, "verification_time": 0, "benchmark_time": 2467.512770090252, "edp": 3178.1731793945623, "throughput_penalty": 1000000.0, "objective": 1003178.1731793946, "strategy_time": 0.33297203481197357, "framework_time": 54.677905747666955, "timestamp": "2025-02-20 07:50:42.751562+00:00"},
"2,64,32,32,115": {"block_size_x": 2, "block_size_y": 64, "tile_size_x": 32, "tile_size_y": 32, "nvml_pwr_limit": 115, "sm__warps_active.avg.pct_of_peak_sustained_active": 96.30176867415996, "dram__bytes.sum.per_second": 25669568052.539345, "time": 27.98098714011056, "times": [13.348992347717285, 21.075071334838867, 33.05436706542969, 32.09574508666992, 33.082462310791016, 31.260223388671875, 31.950048446655273], "nvml_power": 116.073, "nvml_energy": 3.247837120314053, "compile_time": 249.63111686520278, "verification_time": 0, "benchmark_time": 1432.2437809314579, "edp": 90.87768869668123, "throughput_penalty": 1000000.0, "objective": 1000090.8776886967, "strategy_time": 0.21255086176097393, "framework_time": 51.90380453132093, "timestamp": "2025-02-20 07:50:44.485577+00:00"},
"2,256,32,2,135": {"block_size_x": 2, "block_size_y": 256, "tile_size_x": 32, "tile_size_y": 2, "nvml_pwr_limit": 135, "sm__warps_active.avg.pct_of_peak_sustained_active": 94.33805343142956, "dram__bytes.sum.per_second": 15716735467.939371, "time": 18.531547818865096, "times": [11.957728385925293, 14.00915241241455, 21.355615615844727, 21.31808090209961, 20.51513671875, 20.276351928710938, 20.288768768310547], "nvml_power": 139.213, "nvml_energy": 2.5798323665076666, "compile_time": 249.1464731283486, "verification_time": 0, "benchmark_time": 1302.38754209131, "edp": 47.80828686459273, "throughput_penalty": 1000000.0, "objective": 1000047.8082868645, "strategy_time": 19.675484858453274, "framework_time": 47.43283474817872, "timestamp": "2025-02-20 07:50:46.104244+00:00"},
"2,128,16,4,150": {"block_size_x": 2, "block_size_y": 128, "tile_size_x": 16, "tile_size_y": 4, "nvml_pwr_limit": 150, "sm__warps_active.avg.pct_of_peak_sustained_active": 96.2649757052766, "dram__bytes.sum.per_second": 48893931816.5216, "time": 41.510280064174104, "times": [37.11564636230469, 43.27267074584961, 41.58937454223633, 42.42310333251953, 41.902015686035156, 42.212318420410156, 42.05683135986328], "nvml_power": 151.971, "nvml_energy": 6.308358771632603, "compile_time": 230.2399801556021, "verification_time": 0, "benchmark_time": 1442.6958139520139, "edp": 261.8617393557587, "throughput_penalty": 1000000.0, "objective": 1000261.8617393557, "strategy_time": 2.3555101361125708, "framework_time": 54.407853865996, "timestamp": "2025-02-20 07:50:47.833968+00:00"},
"2,512,32,2,135": {"block_size_x": 2, "block_size_y": 512, "tile_size_x": 32, "tile_size_y": 2, "nvml_pwr_limit": 135, "sm__warps_active.avg.pct_of_peak_sustained_active": 64.37174126986115, "dram__bytes.sum.per_second": 24937855866.12049, "time": 17.726866177150182, "times": [11.699423789978027, 12.529855728149414, 19.10361671447754, 20.859359741210938, 20.18899154663086, 19.959775924682617, 19.747039794921875], "nvml_power": 138.617, "nvml_energy": 2.457245008878026, "compile_time": 242.56052100099623, "verification_time": 0, "benchmark_time": 1323.3251709025353, "edp": 43.55925343685098, "throughput_penalty": 1000000.0, "objective": 1000043.5592534369, "strategy_time": 1.5815969090908766, "framework_time": 50.35800626501441, "timestamp": "2025-02-20 07:50:49.451817+00:00"},
"1,32,32,16,250": {"block_size_x": 1, "block_size_y": 32, "tile_size_x": 32, "tile_size_y": 16, "nvml_pwr_limit": 250, "sm__warps_active.avg.pct_of_peak_sustained_active": 48.5320774183085, "dram__bytes.sum.per_second": 28052354185.868397, "time": 9.985810279846191, "times": [9.842975616455078, 10.049087524414062, 9.939264297485352, 10.001376152038574, 9.972000122070312, 10.029088020324707, 10.066880226135254], "nvml_power": 252.748, "nvml_energy": 2.523893576610565, "compile_time": 250.8929439354688, "verification_time": 0, "benchmark_time": 1124.256120994687, "edp": 25.20312242255555, "throughput_penalty": 1000000.0, "objective": 1000025.2031224226, "strategy_time": 13.658168958500028, "framework_time": 47.5310031324625, "timestamp": "2025-02-20 07:50:50.888179+00:00"},
"1,32,16,8,250": {"block_size_x": 1, "block_size_y": 32, "tile_size_x": 16, "tile_size_y": 8, "nvml_pwr_limit": 250, "sm__warps_active.avg.pct_of_peak_sustained_active": 49.24614755030534, "dram__bytes.sum.per_second": 69437911995.0891, "time": 19.5966671534947, "times": [18.981599807739258, 19.020383834838867, 19.740095138549805, 19.87353515625, 19.799968719482422, 19.759071350097656, 20.002016067504883], "nvml_power": 251.855, "nvml_energy": 4.9355186059434075, "compile_time": 231.11960804089904, "verification_time": 0, "benchmark_time": 1223.1741861905903, "edp": 96.71971535055313, "throughput_penalty": 1000000.0, "objective": 1000096.7197153505, "strategy_time": 2.104389015585184, "framework_time": 0.513601815328002, "timestamp": "2025-02-20 07:50:52.345114+00:00"},
"1,32,32,8,250": {"block_size_x": 1, "block_size_y": 32, "tile_size_x": 32, "tile_size_y": 8, "nvml_pwr_limit": 250, "sm__warps_active.avg.pct_of_peak_sustained_active": 48.763701094082116, "dram__bytes.sum.per_second": 14629828292.784147, "time": 9.241705213274274, "times": [9.221535682678223, 9.251808166503906, 9.231840133666992, 9.236576080322266, 9.253376007080078, 9.251456260681152, 9.245344161987305], "nvml_power": 248.459, "nvml_energy": 2.296184835584913, "compile_time": 229.64865993708372, "verification_time": 0, "benchmark_time": 1121.7547659762204, "edp": 21.22066336566642, "throughput_penalty": 1000000.0, "objective": 1000021.2206633657, "strategy_time": 1.3176749926060438, "framework_time": 0.547243282198906, "timestamp": "2025-02-20 07:50:53.698406+00:00"},
"1,32,32,2,165": {"block_size_x": 1, "block_size_y": 32, "tile_size_x": 32, "tile_size_y": 2, "nvml_pwr_limit": 165, "sm__warps_active.avg.pct_of_peak_sustained_active": 48.72721674962373, "dram__bytes.sum.per_second": 9182816820.95863, "time": 10.382468496050153, "times": [9.223039627075195, 9.814175605773926, 9.815232276916504, 10.920512199401855, 10.99619197845459, 10.983263969421387, 10.924863815307617], "nvml_power": 169.139, "nvml_energy": 1.756080338953427, "compile_time": 252.74257897399366, "verification_time": 0, "benchmark_time": 1187.6040289644152, "edp": 18.23244879571703, "throughput_penalty": 1000000.0, "objective": 1000018.2324487957, "strategy_time": 13.404675992205739, "framework_time": 47.178809996694326, "timestamp": "2025-02-20 07:50:55.199359+00:00"},
"1,64,16,2,150": {"block_size_x": 1, "block_size_y": 64, "tile_size_x": 16, "tile_size_y": 2, "nvml_pwr_limit": 150, "sm__warps_active.avg.pct_of_peak_sustained_active": 92.97048213961007, "dram__bytes.sum.per_second": 38041592546.14164, "time": 39.7148072378976, "times": [37.09183883666992, 39.641441345214844, 40.07574462890625, 40.71241760253906, 39.824161529541016, 40.41875076293945, 40.239295959472656], "nvml_power": 152.44, "nvml_energy": 6.054125215345111, "compile_time": 228.96877489984035, "verification_time": 0, "benchmark_time": 1413.7723818421364, "edp": 240.43841592152637, "throughput_penalty": 1000000.0, "objective": 1000240.4384159215, "strategy_time": 2.2889699321240187, "framework_time": 43.817125260829926, "timestamp": "2025-02-20 07:50:56.888231+00:00"},
"1,32,32,2,150": {"block_size_x": 1, "block_size_y": 32, "tile_size_x": 32, "tile_size_y": 2, "nvml_pwr_limit": 150, "sm__warps_active.avg.pct_of_peak_sustained_active": 48.716596375254134, "dram__bytes.sum.per_second": 9516856422.615583, "time": 11.38832460130964, "times": [9.225728034973145, 10.293503761291504, 10.916895866394043, 12.22435188293457, 12.465984344482422, 12.216192245483398, 12.375616073608398], "nvml_power": 155.218, "nvml_energy": 1.7676729679660794, "compile_time": 240.38906185887754, "verification_time": 0, "benchmark_time": 1252.5387860368937, "edp": 20.13083354815813, "throughput_penalty": 1000000.0, "objective": 1000020.1308335481, "strategy_time": 1.5333460178226233, "framework_time": 0.5268522072583437, "timestamp": "2025-02-20 07:50:58.383244+00:00"},
"1,1024,16,2,215": {"block_size_x": 1, "block_size_y": 1024, "tile_size_x": 16, "tile_size_y": 2, "nvml_pwr_limit": 215, "sm__warps_active.avg.pct_of_peak_sustained_active": 65.86348459007209, "dram__bytes.sum.per_second": 18925448069.35436, "time": 29.91471563066755, "times": [29.468128204345703, 30.152671813964844, 29.819583892822266, 30.141632080078125, 29.82352066040039, 30.140960693359375, 29.85651206970215], "nvml_power": 218.961, "nvml_energy": 6.550156049206598, "compile_time": 252.79587181285024, "verification_time": 0, "benchmark_time": 1295.826492132619, "edp": 195.94605554851225, "throughput_penalty": 1000000.0, "objective": 1000195.9460555485, "strategy_time": 13.440146809443831, "framework_time": 42.81368223018944, "timestamp": "2025-02-20 07:50:59.988145+00:00"},
"4,32,32,8,165": {"block_size_x": 4, "block_size_y": 32, "tile_size_x": 32, "tile_size_y": 8, "nvml_pwr_limit": 165, "sm__warps_active.avg.pct_of_peak_sustained_active": 97.72985833297572, "dram__bytes.sum.per_second": 14417308716.144392, "time": 21.004777090890066, "times": [18.702367782592773, 21.07004737854004, 21.564863204956055, 21.408832550048828, 21.402944564819336, 21.451711654663086, 21.43267250061035], "nvml_power": 168.63, "nvml_energy": 3.5420355608367915, "compile_time": 231.16350802592933, "verification_time": 0, "benchmark_time": 1242.4348960630596, "edp": 74.39966740338258, "throughput_penalty": 1000000.0, "objective": 1000074.3996674034, "strategy_time": 2.1758289076387882, "framework_time": 41.983498027548194, "timestamp": "2025-02-20 07:51:01.505926+00:00"},
"1,1024,16,2,235": {"block_size_x": 1, "block_size_y": 1024, "tile_size_x": 16, "tile_size_y": 2, "nvml_pwr_limit": 235, "sm__warps_active.avg.pct_of_peak_sustained_active": 65.8661309252588, "dram__bytes.sum.per_second": 18689604219.287216, "time": 29.38146264212472, "times": [29.758047103881836, 29.182079315185547, 29.427200317382812, 29.173599243164062, 29.441600799560547, 29.187103271484375, 29.500608444213867], "nvml_power": 234.488, "nvml_energy": 6.8896004120265415, "compile_time": 226.4061481691897, "verification_time": 0, "benchmark_time": 1291.683244984597, "edp": 202.42653712512492, "throughput_penalty": 1000000.0, "objective": 1000202.4265371251, "strategy_time": 1.3675361406058073, "framework_time": 74.69187467359006, "timestamp": "2025-02-20 07:51:03.100099+00:00"},
"1,128,32,4,115": {"block_size_x": 1, "block_size_y": 128, "tile_size_x": 32, "tile_size_y": 4, "nvml_pwr_limit": 115, "sm__warps_active.avg.pct_of_peak_sustained_active": 95.10026554755818, "dram__bytes.sum.per_second": 5347421075.059838, "time": 22.41921833583287, "times": [18.74064064025879, 19.606975555419922, 22.72150421142578, 24.683679580688477, 24.105119705200195, 23.56278419494629, 23.513824462890625], "nvml_power": 117.105, "nvml_energy": 2.6254025632177083, "compile_time": 254.95339487679303, "verification_time": 0, "benchmark_time": 1349.4959108065814, "edp": 58.85947328423306, "throughput_penalty": 1000000.0, "objective": 1000058.8594732842, "strategy_time": 18.42010789550841, "framework_time": 42.170538334175944, "timestamp": "2025-02-20 07:51:04.765162+00:00"},
"1,128,16,4,135": {"block_size_x": 1, "block_size_y": 128, "tile_size_x": 16, "tile_size_y": 4, "nvml_pwr_limit": 135, "sm__warps_active.avg.pct_of_peak_sustained_active": 97.34562608453012, "dram__bytes.sum.per_second": 20778256216.33522, "time": 47.5333251953125, "times": [44.649375915527344, 48.431392669677734, 47.662750244140625, 48.50716781616211, 48.07027053833008, 47.969600677490234, 47.442718505859375], "nvml_power": 135.735, "nvml_energy": 6.451935895385742, "compile_time": 231.4395650755614, "verification_time": 0, "benchmark_time": 1482.8658299520612, "edp": 306.68196705468023, "throughput_penalty": 1000000.0, "objective": 1000306.6819670547, "strategy_time": 2.2853289265185595, "framework_time": 48.13569295220077, "timestamp": "2025-02-20 07:51:06.529913+00:00"},
"1,256,32,4,100": {"block_size_x": 1, "block_size_y": 256, "tile_size_x": 32, "tile_size_y": 4, "nvml_pwr_limit": 100, "sm__warps_active.avg.pct_of_peak_sustained_active": 93.94551966154138, "dram__bytes.sum.per_second": 6267118105.385796, "time": 28.082317897251674, "times": [17.04489517211914, 23.834272384643555, 32.614688873291016, 28.84992027282715, 32.85753631591797, 29.503360748291016, 31.871551513671875], "nvml_power": 101.324, "nvml_energy": 2.8454127786211285, "compile_time": 240.57939206250012, "verification_time": 0, "benchmark_time": 1382.5867781415582, "edp": 79.90578619814073, "throughput_penalty": 1000000.0, "objective": 1000079.9057861981, "strategy_time": 1.5600870829075575, "framework_time": 47.53940878435969, "timestamp": "2025-02-20 07:51:08.202202+00:00"},
"8,128,8,2,150": {"block_size_x": 8, "block_size_y": 128, "tile_size_x": 8, "tile_size_y": 2, "nvml_pwr_limit": 150, "sm__warps_active.avg.pct_of_peak_sustained_active": 65.97306407257739, "dram__bytes.sum.per_second": 26244498941.8799, "time": 170.6723414829799, "times": [167.9001007080078, 166.35235595703125, 166.36221313476562, 172.2607421875, 176.3665313720703, 176.60873413085938, 168.855712890625], "nvml_power": 149.962, "nvml_energy": 25.59436567347063, "compile_time": 253.7534439470619, "verification_time": 0, "benchmark_time": 2423.153896117583, "edp": 4368.250318262838, "throughput_penalty": 1000000.0, "objective": 1004368.2503182628, "strategy_time": 15.289944130927324, "framework_time": 39.85217772424221, "timestamp": "2025-02-20 07:51:10.934277+00:00"},
"8,64,16,4,165": {"block_size_x": 8, "block_size_y": 64, "tile_size_x": 16, "tile_size_y": 4, "nvml_pwr_limit": 165, "sm__warps_active.avg.pct_of_peak_sustained_active": 99.4407483988476, "dram__bytes.sum.per_second": 53493226817.15173, "time": 82.45459747314453, "times": [83.15805053710938, 82.44825744628906, 82.0080337524414, 82.42940521240234, 82.43215942382812, 82.43177795410156, 82.27449798583984], "nvml_power": 166.868, "nvml_energy": 13.759033771148681, "compile_time": 232.72786289453506, "verification_time": 0, "benchmark_time": 1784.327768953517, "edp": 1134.4955912194664, "throughput_penalty": 1000000.0, "objective": 1001134.4955912195, "strategy_time": 2.2578199859708548, "framework_time": 42.51373908482492, "timestamp": "2025-02-20 07:51:12.996127+00:00"},
"8,128,16,2,135": {"block_size_x": 8, "block_size_y": 128, "tile_size_x": 16, "tile_size_y": 2, "nvml_pwr_limit": 135, "sm__warps_active.avg.pct_of_peak_sustained_active": 65.980110956326, "dram__bytes.sum.per_second": 24003227416.035812, "time": 95.76046643938336, "times": [97.88400268554688, 96.00032043457031, 95.51158142089844, 95.59091186523438, 94.95772552490234, 95.270751953125, 95.10797119140625], "nvml_power": 135.463, "nvml_energy": 12.972000065278188, "compile_time": 237.31392994523048, "verification_time": 0, "benchmark_time": 1901.851532049477, "edp": 1242.2047769027506, "throughput_penalty": 1000000.0, "objective": 1001242.2047769028, "strategy_time": 1.5042668674141169, "framework_time": 46.17400327697396, "timestamp": "2025-02-20 07:51:15.182996+00:00"},
"8,128,32,8,100": {"block_size_x": 8, "block_size_y": 128, "tile_size_x": 32, "tile_size_y": 8, "nvml_pwr_limit": 100, "sm__warps_active.avg.pct_of_peak_sustained_active": 65.99669744118427, "dram__bytes.sum.per_second": 10535084660.389788, "time": 68.19379207066127, "times": [73.678466796875, 66.40959930419922, 67.34947204589844, 68.04124450683594, 67.56233978271484, 67.22268676757812, 67.09273529052734], "nvml_power": 101.188, "nvml_energy": 6.900393432046073, "compile_time": 258.2837250083685, "verification_time": 0, "benchmark_time": 1608.6050050798804, "edp": 470.56399491070664, "throughput_penalty": 1000000.0, "objective": 1000470.5639949107, "strategy_time": 18.775679171085358, "framework_time": 43.15231880173087, "timestamp": "2025-02-20 07:51:17.111836+00:00"},
"4,128,32,4,115": {"block_size_x": 4, "block_size_y": 128, "tile_size_x": 32, "tile_size_y": 4, "nvml_pwr_limit": 115, "sm__warps_active.avg.pct_of_peak_sustained_active": 97.55541866184608, "dram__bytes.sum.per_second": 9264820613.35439, "time": 32.40622629438128, "times": [26.20992088317871, 34.280033111572266, 33.56499099731445, 32.93382263183594, 33.221343994140625, 33.54972839355469, 33.083744049072266], "nvml_power": 118.45, "nvml_energy": 3.8385175045694626, "compile_time": 239.76924689486623, "verification_time": 0, "benchmark_time": 1369.250848190859, "edp": 124.39186688802172, "throughput_penalty": 1000000.0, "objective": 1000124.391866888, "strategy_time": 2.4380700197070837, "framework_time": 41.807062923908234, "timestamp": "2025-02-20 07:51:18.765125+00:00"},
"8,128,32,4,100": {"block_size_x": 8, "block_size_y": 128, "tile_size_x": 32, "tile_size_y": 4, "nvml_pwr_limit": 100, "sm__warps_active.avg.pct_of_peak_sustained_active": 65.99728452151612, "dram__bytes.sum.per_second": 9582511315.973993, "time": 67.1742172241211, "times": [72.95606231689453, 65.67743682861328, 66.39094543457031, 66.1968994140625, 66.61395263671875, 66.0511703491211, 66.33305358886719], "nvml_power": 100.634, "nvml_energy": 6.760010176132202, "compile_time": 238.1070088595152, "verification_time": 0, "benchmark_time": 1590.4404940083623, "edp": 454.0983920087736, "throughput_penalty": 1000000.0, "objective": 1000454.0983920088, "strategy_time": 1.6637970693409443, "framework_time": 47.66880813986063, "timestamp": "2025-02-20 07:51:20.643029+00:00"},
"1,256,32,4,215": {"block_size_x": 1, "block_size_y": 256, "tile_size_x": 32, "tile_size_y": 4, "nvml_pwr_limit": 215, "sm__warps_active.avg.pct_of_peak_sustained_active": 94.10960344274731, "dram__bytes.sum.per_second": 5804454981.115665, "time": 14.418912070138115, "times": [14.313407897949219, 14.200384140014648, 14.178336143493652, 14.631199836730957, 14.594271659851074, 14.450624465942383, 14.564160346984863], "nvml_power": 219.27, "nvml_energy": 3.1616348496191846, "compile_time": 255.37027791142464, "verification_time": 0, "benchmark_time": 1174.0598089527339, "edp": 45.58733489454336, "throughput_penalty": 1000000.0, "objective": 1000045.5873348946, "strategy_time": 28.36724789813161, "framework_time": 44.50759501196444, "timestamp": "2025-02-20 07:51:22.145358+00:00"},
"1,256,16,2,235": {"block_size_x": 1, "block_size_y": 256, "tile_size_x": 16, "tile_size_y": 2, "nvml_pwr_limit": 235, "sm__warps_active.avg.pct_of_peak_sustained_active": 96.3256124900323, "dram__bytes.sum.per_second": 17903381431.19435, "time": 28.429257256644114, "times": [28.024032592773438, 28.24790382385254, 28.48454475402832, 28.78700828552246, 28.295616149902344, 28.594175338745117, 28.57151985168457], "nvml_power": 236.312, "nvml_energy": 6.718174640832085, "compile_time": 225.6327928043902, "verification_time": 0, "benchmark_time": 1287.3185600619763, "edp": 190.992715159278, "throughput_penalty": 1000000.0, "objective": 1000190.9927151593, "strategy_time": 2.0784391090273857, "framework_time": 48.553969943895936, "timestamp": "2025-02-20 07:51:23.708963+00:00"},
"1,128,32,8,200": {"block_size_x": 1, "block_size_y": 128, "tile_size_x": 32, "tile_size_y": 8, "nvml_pwr_limit": 200, "sm__warps_active.avg.pct_of_peak_sustained_active": 95.21083698386784, "dram__bytes.sum.per_second": 6037267080.745342, "time": 16.640571321759904, "times": [16.162752151489258, 16.83500862121582, 16.67100715637207, 16.59993553161621, 16.769887924194336, 16.738208770751953, 16.707199096679688], "nvml_power": 205.827, "nvml_energy": 3.4250788734438755, "compile_time": 241.59207800403237, "verification_time": 0, "benchmark_time": 1201.2089150957763, "edp": 56.99526927619587, "throughput_penalty": 1000000.0, "objective": 1000056.9952692762, "strategy_time": 1.332275103777647, "framework_time": 48.690501833334565, "timestamp": "2025-02-20 07:51:25.201812+00:00"},
"1,64,16,4,150": {"block_size_x": 1, "block_size_y": 64, "tile_size_x": 16, "tile_size_y": 4, "nvml_pwr_limit": 150, "sm__warps_active.avg.pct_of_peak_sustained_active": 92.51862768036881, "dram__bytes.sum.per_second": 38974758054.40187, "time": 40.17115456717355, "times": [35.694400787353516, 38.97724914550781, 41.8842887878418, 41.72403335571289, 40.94540786743164, 40.8355827331543, 41.13711929321289], "nvml_power": 149.97, "nvml_energy": 6.024468050439017, "compile_time": 248.6150551121682, "verification_time": 0, "benchmark_time": 1394.1598131787032, "edp": 242.00983723918446, "throughput_penalty": 1000000.0, "objective": 1000242.0098372392, "strategy_time": 15.904666157439351, "framework_time": 43.049006490036845, "timestamp": "2025-02-20 07:51:26.903564+00:00"},
"1,128,16,4,150": {"block_size_x": 1, "block_size_y": 128, "tile_size_x": 16, "tile_size_y": 4, "nvml_pwr_limit": 150, "sm__warps_active.avg.pct_of_peak_sustained_active": 97.56290042106677, "dram__bytes.sum.per_second": 20955966547.65399, "time": 40.140228271484375, "times": [39.38003158569336, 39.82815933227539, 40.737022399902344, 40.40083312988281, 39.906654357910156, 40.45683288574219, 40.272064208984375], "nvml_power": 151.128, "nvml_energy": 6.06631241821289, "compile_time": 236.75904516130686, "verification_time": 0, "benchmark_time": 1380.8984979987144, "edp": 243.5031652332058, "throughput_penalty": 1000000.0, "objective": 1000243.5031652332, "strategy_time": 2.3084389977157116, "framework_time": 0.5136816762387753, "timestamp": "2025-02-20 07:51:28.524068+00:00"},
"2,16,32,16,215": {"block_size_x": 2, "block_size_y": 16, "tile_size_x": 32, "tile_size_y": 16, "nvml_pwr_limit": 215, "sm__warps_active.avg.pct_of_peak_sustained_active": 49.14440629151285, "dram__bytes.sum.per_second": 35518598319.82612, "time": 10.815785135541644, "times": [9.927103996276855, 9.989791870117188, 10.506336212158203, 10.829376220703125, 11.39628791809082, 11.505599975585938, 11.555999755859375], "nvml_power": 219.405, "nvml_energy": 2.373037337663514, "compile_time": 241.91988399252295, "verification_time": 0, "benchmark_time": 1202.2110761608928, "edp": 25.66626196278635, "throughput_penalty": 1000000.0, "objective": 1000025.6662619627, "strategy_time": 1.5715060289949179, "framework_time": 51.1423097923398, "timestamp": "2025-02-20 07:51:30.020939+00:00"},
"4,16,32,2,135": {"block_size_x": 4, "block_size_y": 16, "tile_size_x": 32, "tile_size_y": 2, "nvml_pwr_limit": 135, "sm__warps_active.avg.pct_of_peak_sustained_active": 89.38859476658193, "dram__bytes.sum.per_second": 16042298782.119797, "time": 27.86966868809291, "times": [24.750560760498047, 26.670303344726562, 28.376895904541016, 29.364896774291992, 28.40265655517578, 29.230783462524414, 28.291584014892578], "nvml_power": 138.614, "nvml_energy": 3.863126255531311, "compile_time": 249.9523051083088, "verification_time": 0, "benchmark_time": 1322.418699041009, "edp": 107.6640488419306, "throughput_penalty": 1000000.0, "objective": 1000107.6640488419, "strategy_time": 16.598808113485575, "framework_time": 41.22460959479213, "timestamp": "2025-02-20 07:51:31.651159+00:00"},
"4,32,32,4,135": {"block_size_x": 4, "block_size_y": 32, "tile_size_x": 32, "tile_size_y": 4, "nvml_pwr_limit": 135, "sm__warps_active.avg.pct_of_peak_sustained_active": 97.72321720127259, "dram__bytes.sum.per_second": 10904105758.959616, "time": 26.34363910130092, "times": [25.388383865356445, 26.029600143432617, 25.99331283569336, 26.480735778808594, 27.034496307373047, 26.51024055480957, 26.968704223632812], "nvml_power": 138.461, "nvml_energy": 3.6475666136052265, "compile_time": 230.3769940044731, "verification_time": 0, "benchmark_time": 1287.5505189877003, "edp": 96.09017846677042, "throughput_penalty": 1000000.0, "objective": 1000096.0901784668, "strategy_time": 2.214169129729271, "framework_time": 0.5368809215724468, "timestamp": "2025-02-20 07:51:33.171862+00:00"},
"4,32,32,2,115": {"block_size_x": 4, "block_size_y": 32, "tile_size_x": 32, "tile_size_y": 2, "nvml_pwr_limit": 115, "sm__warps_active.avg.pct_of_peak_sustained_active": 97.75657758350987, "dram__bytes.sum.per_second": 9484624595.64277, "time": 32.88675199236189, "times": [29.36534309387207, 31.73084831237793, 34.102272033691406, 34.032447814941406, 33.093536376953125, 33.87385559082031, 34.00896072387695], "nvml_power": 118.901, "nvml_energy": 3.9102676986438203, "compile_time": 232.66093991696835, "verification_time": 0, "benchmark_time": 1373.5471910331398, "edp": 128.596004029043, "throughput_penalty": 1000000.0, "objective": 1000128.596004029, "strategy_time": 1.464286120608449, "framework_time": 52.08880384452641, "timestamp": "2025-02-20 07:51:34.831648+00:00"},
"4,256,32,32,135": {"block_size_x": 4, "block_size_y": 256, "tile_size_x": 32, "tile_size_y": 32, "nvml_pwr_limit": 135, "sm__warps_active.avg.pct_of_peak_sustained_active": 65.9594852367108, "dram__bytes.sum.per_second": 11152149262.047953, "time": 25.12387193952288, "times": [22.563232421875, 24.0196475982666, 25.59174346923828, 25.588159561157227, 26.344255447387695, 25.948352813720703, 25.81171226501465], "nvml_power": 138.656, "nvml_energy": 3.4835755876464845, "compile_time": 252.1627510432154, "verification_time": 0, "benchmark_time": 1303.6793561186641, "edp": 87.52090695567843, "throughput_penalty": 1000000.0, "objective": 1000087.5209069557, "strategy_time": 17.353361006826162, "framework_time": 45.65044678747654, "timestamp": "2025-02-20 07:51:36.450518+00:00"},
"2,256,32,2,115": {"block_size_x": 2, "block_size_y": 256, "tile_size_x": 32, "tile_size_y": 2, "nvml_pwr_limit": 115, "sm__warps_active.avg.pct_of_peak_sustained_active": 94.32330627442921, "dram__bytes.sum.per_second": 15497609974.164207, "time": 23.720104898725236, "times": [13.153632164001465, 21.72640037536621, 28.5447998046875, 26.763296127319336, 25.47337532043457, 25.19183921813965, 25.18739128112793], "nvml_power": 118.087, "nvml_energy": 2.801036027175767, "compile_time": 230.7884399779141, "verification_time": 0, "benchmark_time": 1342.4430838786066, "edp": 66.44086838971778, "throughput_penalty": 1000000.0, "objective": 1000066.4408683897, "strategy_time": 2.467249985784292, "framework_time": 43.681549141183496, "timestamp": "2025-02-20 07:51:38.069922+00:00"},
"2,512,32,32,135": {"block_size_x": 2, "block_size_y": 512, "tile_size_x": 32, "tile_size_y": 32, "nvml_pwr_limit": 135, "sm__warps_active.avg.pct_of_peak_sustained_active": 64.46798162118657, "dram__bytes.sum.per_second": 25667389876.872704, "time": 17.547794478280203, "times": [11.050080299377441, 11.87161636352539, 19.2476806640625, 21.853952407836914, 20.176223754882812, 19.37491226196289, 19.260095596313477], "nvml_power": 138.004, "nvml_energy": 2.421665829180581, "compile_time": 233.3529000170529, "verification_time": 0, "benchmark_time": 1305.7260769419372, "edp": 42.494894265534846, "throughput_penalty": 1000000.0, "objective": 1000042.4948942655, "strategy_time": 1.6251669730991125, "framework_time": 52.41047218441963, "timestamp": "2025-02-20 07:51:39.663060+00:00"},
"1,1024,32,8,150": {"block_size_x": 1, "block_size_y": 1024, "tile_size_x": 32, "tile_size_y": 8, "nvml_pwr_limit": 150, "sm__warps_active.avg.pct_of_peak_sustained_active": 65.89778584554881, "dram__bytes.sum.per_second": 18251028203.958847, "time": 17.662628446306503, "times": [16.873567581176758, 17.311519622802734, 17.525503158569336, 17.810911178588867, 17.949888229370117, 17.963136672973633, 18.203872680664062], "nvml_power": 153.848, "nvml_energy": 2.717360061207363, "compile_time": 254.99370601028204, "verification_time": 0, "benchmark_time": 1223.349713953212, "edp": 47.995721115938345, "throughput_penalty": 1000000.0, "objective": 1000047.995721116, "strategy_time": 18.370545003563166, "framework_time": 43.140514055266976, "timestamp": "2025-02-20 07:51:41.202939+00:00"},
"1,1024,32,4,135": {"block_size_x": 1, "block_size_y": 1024, "tile_size_x": 32, "tile_size_y": 4, "nvml_pwr_limit": 135, "sm__warps_active.avg.pct_of_peak_sustained_active": 65.89352442083819, "dram__bytes.sum.per_second": 17923347873.363197, "time": 19.514953340802872, "times": [16.42304039001465, 17.85478401184082, 20.57097625732422, 20.93071937561035, 20.338016510009766, 20.084320068359375, 20.402816772460938], "nvml_power": 138.369, "nvml_energy": 2.700264578813553, "compile_time": 231.0289959423244, "verification_time": 0, "benchmark_time": 1289.9523549713194, "edp": 52.695537263369204, "throughput_penalty": 1000000.0, "objective": 1000052.6955372634, "strategy_time": 2.1805590949952602, "framework_time": 45.48530699685216, "timestamp": "2025-02-20 07:51:42.771610+00:00"},
"1,1024,32,8,135": {"block_size_x": 1, "block_size_y": 1024, "tile_size_x": 32, "tile_size_y": 8, "nvml_pwr_limit": 135, "sm__warps_active.avg.pct_of_peak_sustained_active": 65.90375933489018, "dram__bytes.sum.per_second": 17915500871.071007, "time": 19.823652539934432, "times": [16.7192325592041, 19.38492774963379, 21.25119972229004, 20.86115264892578, 20.290239334106445, 20.121023178100586, 20.137792587280273], "nvml_power": 137.744, "nvml_energy": 2.730589195460728, "compile_time": 240.01568206585944, "verification_time": 0, "benchmark_time": 1260.62653795816, "edp": 54.13025144011258, "throughput_penalty": 1000000.0, "objective": 1000054.1302514401, "strategy_time": 1.4261759351938963, "framework_time": 0.5242119077593088, "timestamp": "2025-02-20 07:51:44.274227+00:00"},
"2,512,32,16,215": {"block_size_x": 2, "block_size_y": 512, "tile_size_x": 32, "tile_size_y": 16, "nvml_pwr_limit": 215, "sm__warps_active.avg.pct_of_peak_sustained_active": 64.48718046037965, "dram__bytes.sum.per_second": 24850625103.932034, "time": 11.148461750575475, "times": [10.478240013122559, 10.494784355163574, 10.983807563781738, 11.127103805541992, 11.672896385192871, 11.649888038635254, 11.632512092590332], "nvml_power": 215.957, "nvml_energy": 2.407588354269028, "compile_time": 259.6193088684231, "verification_time": 0, "benchmark_time": 1170.292787021026, "edp": 26.840906678699213, "throughput_penalty": 1000000.0, "objective": 1000026.8409066787, "strategy_time": 21.006355993449688, "framework_time": 46.41806613653898, "timestamp": "2025-02-20 07:51:45.771589+00:00"},
"2,64,32,16,200": {"block_size_x": 2, "block_size_y": 64, "tile_size_x": 32, "tile_size_y": 16, "nvml_pwr_limit": 200, "sm__warps_active.avg.pct_of_peak_sustained_active": 96.20866425571778, "dram__bytes.sum.per_second": 17406368965.59778, "time": 11.811958857945033, "times": [10.854496002197266, 10.884415626525879, 11.529984474182129, 11.892895698547363, 12.42627239227295, 12.524319648742676, 12.571328163146973], "nvml_power": 203.794, "nvml_energy": 2.4072063434960502, "compile_time": 237.3026069253683, "verification_time": 0, "benchmark_time": 1190.928952069953, "edp": 28.433822291959643, "throughput_penalty": 1000000.0, "objective": 1000028.4338222919, "strategy_time": 2.394889947026968, "framework_time": 44.558440102264285, "timestamp": "2025-02-20 07:51:47.246798+00:00"},
"2,512,32,16,200": {"block_size_x": 2, "block_size_y": 512, "tile_size_x": 32, "tile_size_y": 16, "nvml_pwr_limit": 200, "sm__warps_active.avg.pct_of_peak_sustained_active": 64.41659599730603, "dram__bytes.sum.per_second": 25419420763.044926, "time": 11.662660598754883, "times": [10.46566390991211, 11.323967933654785, 11.858880043029785, 12.026304244995117, 12.003040313720703, 11.931743621826172, 12.029024124145508], "nvml_power": 202.957, "nvml_energy": 2.3670186071414947, "compile_time": 239.67295489273965, "verification_time": 0, "benchmark_time": 1160.5683828238398, "edp": 27.605734646028772, "throughput_penalty": 1000000.0, "objective": 1000027.605734646, "strategy_time": 1.626916928216815, "framework_time": 0.5422832909971476, "timestamp": "2025-02-20 07:51:48.649233+00:00"},
"1,32,32,4,215": {"block_size_x": 1, "block_size_y": 32, "tile_size_x": 32, "tile_size_y": 4, "nvml_pwr_limit": 215, "sm__warps_active.avg.pct_of_peak_sustained_active": 48.72621561539352, "dram__bytes.sum.per_second": 11285065236.843384, "time": 9.494235447474889, "times": [9.238688468933105, 9.200287818908691, 9.21673583984375, 9.732864379882812, 9.693023681640625, 9.67033576965332, 9.707712173461914], "nvml_power": 220.829, "nvml_energy": 2.0966025196304323, "compile_time": 250.3759479150176, "verification_time": 0, "benchmark_time": 1141.96338201873, "edp": 19.905637961140418, "throughput_penalty": 1000000.0, "objective": 1000019.9056379611, "strategy_time": 18.323094118386507, "framework_time": 46.85068782418966, "timestamp": "2025-02-20 07:51:50.106770+00:00"},
"4,32,32,16,185": {"block_size_x": 4, "block_size_y": 32, "tile_size_x": 32, "tile_size_y": 16, "nvml_pwr_limit": 185, "sm__warps_active.avg.pct_of_peak_sustained_active": 97.8139525847205, "dram__bytes.sum.per_second": 21216084039.516544, "time": 20.088096073695592, "times": [18.285375595092773, 20.06540870666504, 20.569120407104492, 20.524511337280273, 20.40985679626465, 20.407520294189453, 20.35487937927246], "nvml_power": 189.579, "nvml_energy": 3.8082811655551367, "compile_time": 230.8834979776293, "verification_time": 0, "benchmark_time": 1225.3240598365664, "edp": 76.50111792931702, "throughput_penalty": 1000000.0, "objective": 1000076.5011179294, "strategy_time": 2.186667872592807, "framework_time": 45.85207439959049, "timestamp": "2025-02-20 07:51:51.611041+00:00"},
"1,32,32,4,200": {"block_size_x": 1, "block_size_y": 32, "tile_size_x": 32, "tile_size_y": 4, "nvml_pwr_limit": 200, "sm__warps_active.avg.pct_of_peak_sustained_active": 48.740529229425725, "dram__bytes.sum.per_second": 10157015729.338758, "time": 9.631396566118513, "times": [9.190176010131836, 9.246208190917969, 9.457023620605469, 9.708383560180664, 9.824319839477539, 10.036224365234375, 9.957440376281738], "nvml_power": 205.893, "nvml_energy": 1.9830371331878387, "compile_time": 232.15766088105738, "verification_time": 0, "benchmark_time": 1161.6132580675185, "edp": 19.09941703507085, "throughput_penalty": 1000000.0, "objective": 1000019.0994170351, "strategy_time": 1.4350060373544693, "framework_time": 43.21043309755623, "timestamp": "2025-02-20 07:51:53.049482+00:00"},
"2,16,16,16,250": {"block_size_x": 2, "block_size_y": 16, "tile_size_x": 16, "tile_size_y": 16, "nvml_pwr_limit": 250, "sm__warps_active.avg.pct_of_peak_sustained_active": 49.21871507394848, "dram__bytes.sum.per_second": 125858191747.75961, "time": 21.663103921072825, "times": [20.38585662841797, 21.128063201904297, 22.053504943847656, 22.063135147094727, 21.99305534362793, 21.983423233032227, 22.03468894958496], "nvml_power": 253.66899999999998, "nvml_energy": 5.495257908554622, "compile_time": 252.3649709764868, "verification_time": 0, "benchmark_time": 1244.8267629370093, "edp": 119.04434314611609, "throughput_penalty": 1000000.0, "objective": 1000119.0443431461, "strategy_time": 18.660465022549033, "framework_time": 43.36133319884539, "timestamp": "2025-02-20 07:51:54.608718+00:00"},
"4,64,32,16,115": {"block_size_x": 4, "block_size_y": 64, "tile_size_x": 32, "tile_size_y": 16, "nvml_pwr_limit": 115, "sm__warps_active.avg.pct_of_peak_sustained_active": 97.58388167800017, "dram__bytes.sum.per_second": 13251030225.94912, "time": 34.11168452671596, "times": [31.70899200439453, 33.72687911987305, 34.95510482788086, 34.82076644897461, 34.493919372558594, 34.514305114746094, 34.561824798583984], "nvml_power": 118.598, "nvml_energy": 4.045577561499459, "compile_time": 240.245042135939, "verification_time": 0, "benchmark_time": 1375.3877950366586, "edp": 138.0014655062304, "throughput_penalty": 1000000.0, "objective": 1000138.0014655063, "strategy_time": 2.406128915026784, "framework_time": 48.200742807239294, "timestamp": "2025-02-20 07:51:56.274983+00:00"},
"2,16,8,16,250": {"block_size_x": 2, "block_size_y": 16, "tile_size_x": 8, "tile_size_y": 16, "nvml_pwr_limit": 250, "sm__warps_active.avg.pct_of_peak_sustained_active": 49.763480239823004, "dram__bytes.sum.per_second": 135352494709.6314, "time": 43.534111567905974, "times": [43.90313720703125, 43.585182189941406, 43.450782775878906, 43.451969146728516, 43.41660690307617, 43.426239013671875, 43.50486373901367], "nvml_power": 251.046, "nvml_energy": 10.929064572676522, "compile_time": 231.3017339911312, "verification_time": 0, "benchmark_time": 1383.8539011776447, "edp": 475.78711643974833, "throughput_penalty": 1000000.0, "objective": 1000475.7871164398, "strategy_time": 1.6217269003391266, "framework_time": 47.412338899448514, "timestamp": "2025-02-20 07:51:57.939197+00:00"},
"4,16,32,4,165": {"block_size_x": 4, "block_size_y": 16, "tile_size_x": 32, "tile_size_y": 4, "nvml_pwr_limit": 165, "sm__warps_active.avg.pct_of_peak_sustained_active": 88.86597088371428, "dram__bytes.sum.per_second": 20087943166.175373, "time": 21.8751038142613, "times": [21.06729507446289, 21.391807556152344, 22.561216354370117, 22.28758430480957, 22.00912094116211, 21.898527145385742, 21.910175323486328], "nvml_power": 170.535, "nvml_energy": 3.730470828965051, "compile_time": 252.26783496327698, "verification_time": 0, "benchmark_time": 1248.1227309908718, "edp": 81.6044366596839, "throughput_penalty": 1000000.0, "objective": 1000081.6044366597, "strategy_time": 25.294170947745442, "framework_time": 47.308159060776234, "timestamp": "2025-02-20 07:51:59.512214+00:00"},
"1,32,32,8,235": {"block_size_x": 1, "block_size_y": 32, "tile_size_x": 32, "tile_size_y": 8, "nvml_pwr_limit": 235, "sm__warps_active.avg.pct_of_peak_sustained_active": 48.79135315277841, "dram__bytes.sum.per_second": 13734127793.78149, "time": 9.356347492762975, "times": [9.230463981628418, 9.291520118713379, 9.273664474487305, 9.408191680908203, 9.399871826171875, 9.445440292358398, 9.445280075073242], "nvml_power": 241.024, "nvml_energy": 2.2551042980957035, "compile_time": 230.85730895400047, "verification_time": 0, "benchmark_time": 1128.0872060451657, "edp": 21.099539445406744, "throughput_penalty": 1000000.0, "objective": 1000021.0995394454, "strategy_time": 2.181949093937874, "framework_time": 47.88200999610126, "timestamp": "2025-02-20 07:52:00.921246+00:00"},
"2,16,32,2,165": {"block_size_x": 2, "block_size_y": 16, "tile_size_x": 32, "tile_size_y": 2, "nvml_pwr_limit": 165, "sm__warps_active.avg.pct_of_peak_sustained_active": 49.164585365624056, "dram__bytes.sum.per_second": 19767393053.7226, "time": 13.075757707868304, "times": [9.80406379699707, 9.8154878616333, 12.814144134521484, 14.186240196228027, 15.473600387573242, 14.836544036865234, 14.600223541259766], "nvml_power": 168.767, "nvml_energy": 2.20675640108381, "compile_time": 243.1703459005803, "verification_time": 0, "benchmark_time": 1274.9134220648557, "edp": 28.85501202085935, "throughput_penalty": 1000000.0, "objective": 1000028.8550120209, "strategy_time": 1.4014560729265213, "framework_time": 61.166632920503616, "timestamp": "2025-02-20 07:52:02.501922+00:00"},
"1,1024,32,4,215": {"block_size_x": 1, "block_size_y": 1024, "tile_size_x": 32, "tile_size_y": 4, "nvml_pwr_limit": 215, "sm__warps_active.avg.pct_of_peak_sustained_active": 65.89172918242056, "dram__bytes.sum.per_second": 18904987448.790432, "time": 15.536644526890345, "times": [15.224639892578125, 15.250495910644531, 15.329183578491211, 15.746111869812012, 15.708512306213379, 15.768159866333008, 15.729408264160156], "nvml_power": 219.722, "nvml_energy": 3.4137426087374005, "compile_time": 246.68756895698607, "verification_time": 0, "benchmark_time": 1182.0213869214058, "edp": 53.03810541825231, "throughput_penalty": 1000000.0, "objective": 1000053.0381054182, "strategy_time": 20.281129982322454, "framework_time": 43.195672100409865, "timestamp": "2025-02-20 07:52:03.994132+00:00"},
"2,256,32,32,135": {"block_size_x": 2, "block_size_y": 256, "tile_size_x": 32, "tile_size_y": 32, "nvml_pwr_limit": 135, "sm__warps_active.avg.pct_of_peak_sustained_active": 92.54391477951248, "dram__bytes.sum.per_second": 17820037872.479538, "time": 18.293211664472306, "times": [10.413344383239746, 12.536064147949219, 20.814720153808594, 22.08121681213379, 21.125791549682617, 20.67535972595215, 20.40598487854004], "nvml_power": 138.727, "nvml_energy": 2.53776237457725, "compile_time": 225.25351191870868, "verification_time": 0, "benchmark_time": 1314.7437439765781, "edp": 46.42382427227549, "throughput_penalty": 1000000.0, "objective": 1000046.4238242722, "strategy_time": 2.3768688552081585, "framework_time": 76.18065224960446, "timestamp": "2025-02-20 07:52:05.612710+00:00"},
"1,1024,32,8,215": {"block_size_x": 1, "block_size_y": 1024, "tile_size_x": 32, "tile_size_y": 8, "nvml_pwr_limit": 215, "sm__warps_active.avg.pct_of_peak_sustained_active": 65.88451686168486, "dram__bytes.sum.per_second": 18722302375.203903, "time": 15.581408091953822, "times": [15.313376426696777, 15.300928115844727, 15.388544082641602, 15.830911636352539, 15.759872436523438, 15.73737621307373, 15.738847732543945], "nvml_power": 217.7, "nvml_energy": 3.392072541618347, "compile_time": 235.72199186310172, "verification_time": 0, "benchmark_time": 1181.955672102049, "edp": 52.85326654846648, "throughput_penalty": 1000000.0, "objective": 1000052.8532665485, "strategy_time": 1.630587037652731, "framework_time": 48.76526305451989, "timestamp": "2025-02-20 07:52:07.080809+00:00"},
"2,512,32,32,165": {"block_size_x": 2, "block_size_y": 512, "tile_size_x": 32, "tile_size_y": 32, "nvml_pwr_limit": 165, "sm__warps_active.avg.pct_of_peak_sustained_active": 64.40416256754602, "dram__bytes.sum.per_second": 25219445986.053135, "time": 13.864973613194056, "times": [10.753024101257324, 11.761280059814453, 14.04969596862793, 16.044191360473633, 15.178239822387695, 14.677375793457031, 14.591008186340332], "nvml_power": 168.525, "nvml_energy": 2.3365946781635287, "compile_time": 247.8842290583998, "verification_time": 0, "benchmark_time": 1223.1664569117129, "edp": 32.39682355746699, "throughput_penalty": 1000000.0, "objective": 1000032.3968235574, "strategy_time": 22.216337034478784, "framework_time": 40.8168809954077, "timestamp": "2025-02-20 07:52:08.614917+00:00"},
"2,512,32,32,150": {"block_size_x": 2, "block_size_y": 512, "tile_size_x": 32, "tile_size_y": 32, "nvml_pwr_limit": 150, "sm__warps_active.avg.pct_of_peak_sustained_active": 64.43672114828489, "dram__bytes.sum.per_second": 25627756709.09925, "time": 15.617627143859863, "times": [10.900032043457031, 12.29535961151123, 16.811904907226562, 18.433727264404297, 17.26540756225586, 16.870527267456055, 16.746431350708008], "nvml_power": 153.409, "nvml_energy": 2.3958845625123977, "compile_time": 224.92000693455338, "verification_time": 0, "benchmark_time": 1262.0697931852192, "edp": 37.418031777048434, "throughput_penalty": 1000000.0, "objective": 1000037.418031777, "strategy_time": 2.22422881051898, "framework_time": 46.49684298783541, "timestamp": "2025-02-20 07:52:10.150652+00:00"},
"2,256,16,8,150": {"block_size_x": 2, "block_size_y": 256, "tile_size_x": 16, "tile_size_y": 8, "nvml_pwr_limit": 150, "sm__warps_active.avg.pct_of_peak_sustained_active": 95.1918197558166, "dram__bytes.sum.per_second": 29668486884.382164, "time": 36.60344696044922, "times": [33.256160736083984, 37.5148811340332, 37.15711975097656, 36.938079833984375, 37.031105041503906, 37.05846405029297, 37.26831817626953], "nvml_power": 153.438, "nvml_energy": 5.616359694717406, "compile_time": 235.51598703488708, "verification_time": 0, "benchmark_time": 1385.4644009843469, "edp": 205.57812419639336, "throughput_penalty": 1000000.0, "objective": 1000205.5781241964, "strategy_time": 1.4275158755481243, "framework_time": 0.5309309344738722, "timestamp": "2025-02-20 07:52:11.773614+00:00"},
"1,1024,32,32,150": {"block_size_x": 1, "block_size_y": 1024, "tile_size_x": 32, "tile_size_y": 32, "nvml_pwr_limit": 150, "sm__warps_active.avg.pct_of_peak_sustained_active": 65.89500470442931, "dram__bytes.sum.per_second": 18948715383.717632, "time": 17.833696092878068, "times": [17.007104873657227, 17.59440040588379, 17.877344131469727, 17.94723129272461, 18.070592880249023, 18.186527252197266, 18.152671813964844], "nvml_power": 153.09, "nvml_energy": 2.7301605348587037, "compile_time": 254.02703904546797, "verification_time": 0, "benchmark_time": 1234.863739926368, "edp": 48.68885326343956, "throughput_penalty": 1000000.0, "objective": 1000048.6888532634, "strategy_time": 18.72087293304503, "framework_time": 0.5552431102842093, "timestamp": "2025-02-20 07:52:13.281804+00:00"},
"1,512,32,2,135": {"block_size_x": 1, "block_size_y": 512, "tile_size_x": 32, "tile_size_y": 2, "nvml_pwr_limit": 135, "sm__warps_active.avg.pct_of_peak_sustained_active": 92.69942297585968, "dram__bytes.sum.per_second": 9197335157.62734, "time": 17.127602577209473, "times": [14.05788803100586, 15.593184471130371, 16.01043128967285, 17.25574493408203, 18.777408599853516, 19.165536880493164, 19.033023834228516], "nvml_power": 138.516, "nvml_energy": 2.3724469985847474, "compile_time": 234.5813310239464, "verification_time": 0, "benchmark_time": 1316.2590130232275, "edp": 40.634329327253, "throughput_penalty": 1000000.0, "objective": 1000040.6343293273, "strategy_time": 2.357339020818472, "framework_time": 44.94851594790816, "timestamp": "2025-02-20 07:52:14.879973+00:00"},
"1,512,32,2,115": {"block_size_x": 1, "block_size_y": 512, "tile_size_x": 32, "tile_size_y": 2, "nvml_pwr_limit": 115, "sm__warps_active.avg.pct_of_peak_sustained_active": 92.80560504758787, "dram__bytes.sum.per_second": 9141760812.368387, "time": 21.899730273655482, "times": [14.983712196350098, 18.249887466430664, 22.664064407348633, 23.868064880371094, 24.75606346130371, 24.883647918701172, 23.892671585083008], "nvml_power": 117.908, "nvml_energy": 2.5821533971061705, "compile_time": 226.8571590539068, "verification_time": 0, "benchmark_time": 1354.2064719367772, "edp": 56.548462921828346, "throughput_penalty": 1000000.0, "objective": 1000056.5484629219, "strategy_time": 1.6065759118646383, "framework_time": 47.76560724712908, "timestamp": "2025-02-20 07:52:16.510433+00:00"},
"1,64,32,2,115": {"block_size_x": 1, "block_size_y": 64, "tile_size_x": 32, "tile_size_y": 2, "nvml_pwr_limit": 115, "sm__warps_active.avg.pct_of_peak_sustained_active": 90.34602155909124, "dram__bytes.sum.per_second": 6066156294.298252, "time": 20.75146974836077, "times": [16.283552169799805, 18.717248916625977, 20.67158317565918, 23.02979278564453, 22.1114559173584, 22.034912109375, 22.4117431640625], "nvml_power": 116.141, "nvml_energy": 2.4100964480443685, "compile_time": 255.1473081111908, "verification_time": 0, "benchmark_time": 1372.757735894993, "edp": 50.01304353222446, "throughput_penalty": 1000000.0, "objective": 1000050.0130435323, "strategy_time": 18.525772960856557, "framework_time": 0.5557129625231028, "timestamp": "2025-02-20 07:52:18.157443+00:00"},
"2,64,32,2,115": {"block_size_x": 2, "block_size_y": 64, "tile_size_x": 32, "tile_size_y": 2, "nvml_pwr_limit": 115, "sm__warps_active.avg.pct_of_peak_sustained_active": 95.58019764050793, "dram__bytes.sum.per_second": 8914760330.996218, "time": 24.48633589063372, "times": [11.329279899597168, 20.930591583251953, 28.009599685668945, 27.115615844726562, 29.021728515625, 27.442399978637695, 27.55513572692871], "nvml_power": 116.88, "nvml_energy": 2.861962938897269, "compile_time": 229.91155786439776, "verification_time": 0, "benchmark_time": 1392.0526129659265, "edp": 70.07898582838375, "throughput_penalty": 1000000.0, "objective": 1000070.0789858284, "strategy_time": 2.18709884211421, "framework_time": 0.5244615022093058, "timestamp": "2025-02-20 07:52:19.782142+00:00"},
"2,512,32,4,235": {"block_size_x": 2, "block_size_y": 512, "tile_size_x": 32, "tile_size_y": 4, "nvml_pwr_limit": 235, "sm__warps_active.avg.pct_of_peak_sustained_active": 64.3747386196473, "dram__bytes.sum.per_second": 25120274415.14365, "time": 10.918249130249023, "times": [10.453760147094727, 10.465696334838867, 10.672831535339355, 11.144319534301758, 11.207327842712402, 11.295680046081543, 11.188128471374512], "nvml_power": 238.26, "nvml_energy": 2.6013820377731323, "compile_time": 239.68579503707588, "verification_time": 0, "benchmark_time": 1148.6876348499209, "edp": 28.402537171361935, "throughput_penalty": 1000000.0, "objective": 1000028.4025371714, "strategy_time": 1.4910059981048107, "framework_time": 44.50931423343718, "timestamp": "2025-02-20 07:52:21.216540+00:00"},
