experiments/data/run4/bayes_opt_float16.json
{
"device_name": "NVIDIA RTX 5000 Ada Generation",
"kernel_name": "tuned_matmul<__half>",
"problem_size": [
4096,
4096
],
"tune_params_keys": [
"block_size_x",
"block_size_y",
"tile_size_x",
"tile_size_y",
"nvml_pwr_limit"
],
"tune_params": {
"block_size_x": [
1,
2,
4,
8,
16,
32,
64,
128,
256,
512,
1024
],
"block_size_y": [
1,
2,
4,
8,
16,
32,
64,
128,
256,
512,
1024
],
"tile_size_x": [
2,
4,
8,
16,
32
],
"tile_size_y": [
2,
4,
8,
16,
32
],
"nvml_pwr_limit": [
100,
115,
135,
150,
165,
185,
200,
215,
235,
250
]
},
"objective": "objective",
"cache": {
"32,16,4,2,200": {"block_size_x": 32, "block_size_y": 16, "tile_size_x": 4, "tile_size_y": 2, "nvml_pwr_limit": 200, "sm__warps_active.avg.pct_of_peak_sustained_active": 99.64059584386156, "dram__bytes.sum.per_second": 0.0, "time": 37.715080806187224, "times": [37.436832427978516, 37.46281433105469, 37.67232131958008, 37.82124710083008, 37.909759521484375, 37.908382415771484, 37.79420852661133], "nvml_power": 203.708, "nvml_energy": 7.682863680866787, "compile_time": 233.12955209985375, "verification_time": 0, "benchmark_time": 1358.4762171376497, "edp": 289.7598245468119, "throughput_penalty": 1000000.0, "objective": 1000289.7598245469, "strategy_time": 464.34204187244177, "framework_time": 0, "timestamp": "2025-02-20 07:44:38.084367+00:00"},
"64,4,16,2,200": {"block_size_x": 64, "block_size_y": 4, "tile_size_x": 16, "tile_size_y": 2, "nvml_pwr_limit": 200, "sm__warps_active.avg.pct_of_peak_sustained_active": 99.38747573290017, "dram__bytes.sum.per_second": 452849990.8075244, "time": 39.53491701398577, "times": [40.09388732910156, 39.69523239135742, 39.46278381347656, 39.44144058227539, 39.349632263183594, 39.34870529174805, 39.35273742675781], "nvml_power": 206.458, "nvml_energy": 8.162299896873474, "compile_time": 250.68339495919645, "verification_time": 0, "benchmark_time": 1376.7911919858307, "edp": 322.6958490661574, "throughput_penalty": 1000000.0, "objective": 1000322.6958490661, "strategy_time": 0.24684006348252296, "framework_time": 0.6102300249040127, "timestamp": "2025-02-20 07:44:39.712729+00:00"},
"2,256,2,32,150": {"block_size_x": 2, "block_size_y": 256, "tile_size_x": 2, "tile_size_y": 32, "nvml_pwr_limit": 150, "sm__warps_active.avg.pct_of_peak_sustained_active": 99.25320022611923, "dram__bytes.sum.per_second": 194980456.51556426, "time": 149.43428257533483, "times": [148.93081665039062, 147.72320556640625, 147.71766662597656, 147.7130889892578, 149.69410705566406, 152.254150390625, 152.00694274902344], "nvml_power": 151.019, "nvml_energy": 22.567415920244493, "compile_time": 242.49033886007965, "verification_time": 0, "benchmark_time": 2278.6719920113683, "edp": 3372.3456076209254, "throughput_penalty": 1000000.0, "objective": 1003372.3456076209, "strategy_time": 0.26071094907820225, "framework_time": 56.444746209308505, "timestamp": "2025-02-20 07:44:42.290622+00:00"},
"16,32,16,32,185": {"block_size_x": 16, "block_size_y": 32, "tile_size_x": 16, "tile_size_y": 32, "nvml_pwr_limit": 185, "sm__warps_active.avg.pct_of_peak_sustained_active": 99.66451540155423, "dram__bytes.sum.per_second": 1996228019.69201, "time": 39.6155150277274, "times": [35.67475128173828, 40.493438720703125, 40.144161224365234, 40.25481414794922, 40.1262092590332, 40.370880126953125, 40.24435043334961], "nvml_power": 189.39, "nvml_energy": 7.502782391101292, "compile_time": 241.16810993291438, "verification_time": 0, "benchmark_time": 1401.381416944787, "edp": 297.2265885644417, "throughput_penalty": 1000000.0, "objective": 1000297.2265885645, "strategy_time": 0.16973982565104961, "framework_time": 47.40910115651786, "timestamp": "2025-02-20 07:44:43.980774+00:00"},
"1,128,8,4,115": {"block_size_x": 1, "block_size_y": 128, "tile_size_x": 8, "tile_size_y": 4, "nvml_pwr_limit": 115, "sm__warps_active.avg.pct_of_peak_sustained_active": 97.50992578510451, "dram__bytes.sum.per_second": 171258697.7882051, "time": 46.76189204624721, "times": [50.06969451904297, 45.95964813232422, 47.040191650390625, 46.136287689208984, 45.50019073486328, 46.31999969482422, 46.30723190307617], "nvml_power": 115.944, "nvml_energy": 5.4217608114100875, "compile_time": 247.0368528738618, "verification_time": 0, "benchmark_time": 1431.522071128711, "edp": 253.5317937637322, "throughput_penalty": 1000000.0, "objective": 1000253.5317937637, "strategy_time": 0.23657013662159443, "framework_time": 48.915792955085635, "timestamp": "2025-02-20 07:44:45.708511+00:00"},
"8,16,2,8,165": {"block_size_x": 8, "block_size_y": 16, "tile_size_x": 2, "tile_size_y": 8, "nvml_pwr_limit": 165, "sm__warps_active.avg.pct_of_peak_sustained_active": 92.73621015932906, "dram__bytes.sum.per_second": 572857178.8864309, "time": 61.20400401524135, "times": [62.124000549316406, 60.882591247558594, 61.17737579345703, 60.90351867675781, 61.15599822998047, 60.913822174072266, 61.270721435546875], "nvml_power": 166.279, "nvml_energy": 10.176940583650316, "compile_time": 243.0559319909662, "verification_time": 0, "benchmark_time": 1583.4793359972537, "edp": 622.8695123446066, "throughput_penalty": 1000000.0, "objective": 1000622.8695123446, "strategy_time": 0.23111002519726753, "framework_time": 55.285956943407655, "timestamp": "2025-02-20 07:44:47.590589+00:00"},
"1,512,8,2,135": {"block_size_x": 1, "block_size_y": 512, "tile_size_x": 8, "tile_size_y": 2, "nvml_pwr_limit": 135, "sm__warps_active.avg.pct_of_peak_sustained_active": 96.99545646017302, "dram__bytes.sum.per_second": 79933652.894535, "time": 37.94548961094448, "times": [38.875038146972656, 38.093441009521484, 37.72953414916992, 37.7454719543457, 37.724735260009766, 37.72524642944336, 37.72496032714844], "nvml_power": 137.905, "nvml_energy": 5.232872744797298, "compile_time": 250.8243981283158, "verification_time": 0, "benchmark_time": 1363.3464528247714, "edp": 198.5639183731004, "throughput_penalty": 1000000.0, "objective": 1000198.5639183731, "strategy_time": 0.2340299542993307, "framework_time": 54.98055717907846, "timestamp": "2025-02-20 07:44:49.259997+00:00"},
"8,128,4,2,135": {"block_size_x": 8, "block_size_y": 128, "tile_size_x": 4, "tile_size_y": 2, "nvml_pwr_limit": 135, "sm__warps_active.avg.pct_of_peak_sustained_active": 65.9322693298567, "dram__bytes.sum.per_second": 41592.91061071849, "time": 62.13019452776228, "times": [63.30710220336914, 61.40358352661133, 62.00617599487305, 61.99651336669922, 62.18038558959961, 62.01548767089844, 62.002113342285156], "nvml_power": 134.893, "nvml_energy": 8.380928330433438, "compile_time": 250.7466881070286, "verification_time": 0, "benchmark_time": 1625.6852720398456, "edp": 520.7087074930635, "throughput_penalty": 1000000.0, "objective": 1000520.708707493, "strategy_time": 0.24644006043672562, "framework_time": 0.5702807102352381, "timestamp": "2025-02-20 07:44:51.137270+00:00"},
"32,16,16,4,165": {"block_size_x": 32, "block_size_y": 16, "tile_size_x": 16, "tile_size_y": 4, "nvml_pwr_limit": 165, "sm__warps_active.avg.pct_of_peak_sustained_active": 99.64846056480113, "dram__bytes.sum.per_second": 64054180.24552782, "time": 41.76702117919922, "times": [44.79094314575195, 41.88236618041992, 41.288734436035156, 41.067710876464844, 41.065120697021484, 41.06572723388672, 41.20854568481445], "nvml_power": 171.058, "nvml_energy": 7.14458310887146, "compile_time": 251.23533885926008, "verification_time": 0, "benchmark_time": 1394.98171210289, "edp": 298.4079540247833, "throughput_penalty": 1000000.0, "objective": 1000298.4079540247, "strategy_time": 0.3309100866317749, "framework_time": 56.947099044919014, "timestamp": "2025-02-20 07:44:52.840790+00:00"},
"1,512,2,16,115": {"block_size_x": 1, "block_size_y": 512, "tile_size_x": 2, "tile_size_y": 16, "nvml_pwr_limit": 115, "sm__warps_active.avg.pct_of_peak_sustained_active": 98.83016110697636, "dram__bytes.sum.per_second": 3085648.9096132275, "time": 163.3550763811384, "times": [163.09164428710938, 161.92306518554688, 160.77206420898438, 160.62637329101562, 165.98780822753906, 165.9271697998047, 165.15740966796875], "nvml_power": 114.534, "nvml_energy": 18.709710318237306, "compile_time": 249.43696917034686, "verification_time": 0, "benchmark_time": 2482.000882970169, "edp": 3056.326158104628, "throughput_penalty": 1000000.0, "objective": 1003056.3261581046, "strategy_time": 0.27982983738183975, "framework_time": 50.969763891771436, "timestamp": "2025-02-20 07:44:55.623503+00:00"},
"16,64,16,8,250": {"block_size_x": 16, "block_size_y": 64, "tile_size_x": 16, "tile_size_y": 8, "nvml_pwr_limit": 250, "sm__warps_active.avg.pct_of_peak_sustained_active": 66.06914003099567, "dram__bytes.sum.per_second": 154135.62807448886, "time": 34.881124768938335, "times": [35.27824020385742, 34.91465759277344, 34.74153518676758, 34.76051330566406, 34.72358322143555, 34.88908767700195, 34.86025619506836], "nvml_power": 249.311, "nvml_energy": 8.696248097268786, "compile_time": 252.15710001066327, "verification_time": 0, "benchmark_time": 1323.307631071657, "edp": 303.33491490247513, "throughput_penalty": 1000000.0, "objective": 1000303.3349149025, "strategy_time": 0.2586301416158676, "framework_time": 47.65706369653344, "timestamp": "2025-02-20 07:44:57.246909+00:00"},
"128,2,32,2,165": {"block_size_x": 128, "block_size_y": 2, "tile_size_x": 32, "tile_size_y": 2, "nvml_pwr_limit": 165, "sm__warps_active.avg.pct_of_peak_sustained_active": 99.25781707459987, "dram__bytes.sum.per_second": 787948188.4406649, "time": 53.97356850760324, "times": [56.92607879638672, 53.85638427734375, 53.40947341918945, 53.18377685546875, 53.669185638427734, 53.396480560302734, 53.373600006103516], "nvml_power": 167.049, "nvml_energy": 9.016230645626614, "compile_time": 252.139532007277, "verification_time": 0, "benchmark_time": 1501.4684058260173, "edp": 486.6381424320798, "throughput_penalty": 1000000.0, "objective": 1000486.6381424321, "strategy_time": 0.36634993739426136, "framework_time": 54.59209834225476, "timestamp": "2025-02-20 07:44:59.055499+00:00"},
"2,512,32,4,100": {"block_size_x": 2, "block_size_y": 512, "tile_size_x": 32, "tile_size_y": 4, "nvml_pwr_limit": 100, "sm__warps_active.avg.pct_of_peak_sustained_active": 65.67945389750484, "dram__bytes.sum.per_second": 2174606212.180202, "time": 11.478207996913365, "times": [10.402400016784668, 10.869952201843262, 11.363167762756348, 11.46729564666748, 12.104063987731934, 12.094400405883789, 12.046175956726074], "nvml_power": 102.364, "nvml_energy": 1.1749552833960397, "compile_time": 250.4423118662089, "verification_time": 0, "benchmark_time": 1206.8463780451566, "edp": 13.486381129892033, "throughput_penalty": 1000000.0, "objective": 1000013.48638113, "strategy_time": 0.3187109250575304, "framework_time": 56.97379820048809, "timestamp": "2025-02-20 07:45:00.570104+00:00"},
"2,128,4,4,100": {"block_size_x": 2, "block_size_y": 128, "tile_size_x": 4, "tile_size_y": 4, "nvml_pwr_limit": 100, "sm__warps_active.avg.pct_of_peak_sustained_active": 96.67027352506435, "dram__bytes.sum.per_second": 112413887.28804387, "time": 108.12702178955078, "times": [108.34758758544922, 107.31059265136719, 107.01686096191406, 106.89667510986328, 106.9537582397461, 106.91849517822266, 113.44518280029297], "nvml_power": 100.642, "nvml_energy": 10.88211972694397, "compile_time": 246.4649579487741, "verification_time": 0, "benchmark_time": 1997.6731049828231, "edp": 1176.651196831771, "throughput_penalty": 1000000.0, "objective": 1001176.6511968317, "strategy_time": 0.21908991038799286, "framework_time": 0.5633020773530006, "timestamp": "2025-02-20 07:45:02.815049+00:00"},
"1,32,8,2,100": {"block_size_x": 1, "block_size_y": 32, "tile_size_x": 8, "tile_size_y": 2, "nvml_pwr_limit": 100, "sm__warps_active.avg.pct_of_peak_sustained_active": 49.64251759627347, "dram__bytes.sum.per_second": 4070830.394620615, "time": 47.203172956194194, "times": [52.63011169433594, 46.75574493408203, 45.89161682128906, 46.24201583862305, 46.51718521118164, 46.2083854675293, 46.17715072631836], "nvml_power": 100.595, "nvml_energy": 4.748403183528355, "compile_time": 253.23493499308825, "verification_time": 0, "benchmark_time": 1459.57577903755, "edp": 224.13969673783205, "throughput_penalty": 1000000.0, "objective": 1000224.1396967379, "strategy_time": 0.17354986630380154, "framework_time": 0.559651292860508, "timestamp": "2025-02-20 07:45:04.528617+00:00"},
"32,8,4,2,115": {"block_size_x": 32, "block_size_y": 8, "tile_size_x": 4, "tile_size_y": 2, "nvml_pwr_limit": 115, "sm__warps_active.avg.pct_of_peak_sustained_active": 99.57656399081785, "dram__bytes.sum.per_second": 136619032.87174267, "time": 76.21258980887276, "times": [78.9742431640625, 75.32412719726562, 75.54966735839844, 75.78047943115234, 75.90284729003906, 75.90745544433594, 76.04930877685547], "nvml_power": 115.179, "nvml_energy": 8.778089881596156, "compile_time": 251.73781416378915, "verification_time": 0, "benchmark_time": 1732.1733620483428, "edp": 669.0009634515043, "throughput_penalty": 1000000.0, "objective": 1000669.0009634515, "strategy_time": 0.2590310759842396, "framework_time": 53.276856895536184, "timestamp": "2025-02-20 07:45:06.566089+00:00"},
"64,8,32,2,165": {"block_size_x": 64, "block_size_y": 8, "tile_size_x": 32, "tile_size_y": 2, "nvml_pwr_limit": 165, "sm__warps_active.avg.pct_of_peak_sustained_active": 99.58785997667108, "dram__bytes.sum.per_second": 60456115.60912907, "time": 43.03205435616629, "times": [43.622432708740234, 42.71331024169922, 42.75913619995117, 42.857662200927734, 42.911582946777344, 43.177982330322266, 43.182273864746094], "nvml_power": 165.518, "nvml_energy": 7.122579572923932, "compile_time": 254.66175680048764, "verification_time": 0, "benchmark_time": 1454.2044829577208, "edp": 306.49923133818237, "throughput_penalty": 1000000.0, "objective": 1000306.4992313382, "strategy_time": 0.3653902094811201, "framework_time": 62.166843097656965, "timestamp": "2025-02-20 07:45:08.337512+00:00"},
"8,8,32,4,115": {"block_size_x": 8, "block_size_y": 8, "tile_size_x": 32, "tile_size_y": 4, "nvml_pwr_limit": 115, "sm__warps_active.avg.pct_of_peak_sustained_active": 96.24556839136426, "dram__bytes.sum.per_second": 1954488865.9212627, "time": 21.36677019936698, "times": [12.430879592895508, 15.781599998474121, 23.00124740600586, 24.578144073486328, 24.54921531677246, 24.632896423339844, 24.593408584594727], "nvml_power": 117.2795, "nvml_energy": 2.5058841255966593, "compile_time": 252.8927370440215, "verification_time": 0, "benchmark_time": 1388.7370510492474, "edp": 53.54265025786548, "throughput_penalty": 1000000.0, "objective": 1000053.5426502578, "strategy_time": 0.33488101325929165, "framework_time": 55.640657898038626, "timestamp": "2025-02-20 07:45:10.035142+00:00"},
"64,8,2,4,215": {"block_size_x": 64, "block_size_y": 8, "tile_size_x": 2, "tile_size_y": 4, "nvml_pwr_limit": 215, "sm__warps_active.avg.pct_of_peak_sustained_active": 99.55725178871795, "dram__bytes.sum.per_second": 156448631.8351891, "time": 36.95781489780971, "times": [33.85078430175781, 36.84406280517578, 37.77385711669922, 37.568992614746094, 37.55763244628906, 37.554752349853516, 37.554622650146484], "nvml_power": 218.766, "nvml_energy": 8.08511333393424, "compile_time": 254.1342880576849, "verification_time": 0, "benchmark_time": 1389.3528950866312, "edp": 298.8081220233548, "throughput_penalty": 1000000.0, "objective": 1000298.8081220234, "strategy_time": 0.3354011569172144, "framework_time": 52.81738564372063, "timestamp": "2025-02-20 07:45:11.731807+00:00"},
"4,32,8,2,165": {"block_size_x": 4, "block_size_y": 32, "tile_size_x": 8, "tile_size_y": 2, "nvml_pwr_limit": 165, "sm__warps_active.avg.pct_of_peak_sustained_active": 94.2662193396126, "dram__bytes.sum.per_second": 70391892.1752201, "time": 44.051958901541575, "times": [44.78105545043945, 43.988670349121094, 43.78927993774414, 43.932193756103516, 43.940895080566406, 43.86188888549805, 44.06972885131836], "nvml_power": 167.908, "nvml_energy": 7.396676315240041, "compile_time": 251.30004691891372, "verification_time": 0, "benchmark_time": 1407.8395208343863, "edp": 325.83808104696027, "throughput_penalty": 1000000.0, "objective": 1000325.8380810469, "strategy_time": 0.3107399679720402, "framework_time": 50.477826269343495, "timestamp": "2025-02-20 07:45:13.441760+00:00"},
"1,128,32,2,115": {"block_size_x": 1, "block_size_y": 128, "tile_size_x": 32, "tile_size_y": 2, "nvml_pwr_limit": 115, "sm__warps_active.avg.pct_of_peak_sustained_active": 93.31333285682231, "dram__bytes.sum.per_second": 4164202.3857697723, "time": 10.448740550449916, "times": [9.774463653564453, 9.660896301269531, 10.202816009521484, 10.404704093933105, 10.74937629699707, 11.422207832336426, 10.926719665527344], "nvml_power": 118.038, "nvml_energy": 1.233348437094007, "compile_time": 246.60243396647274, "verification_time": 0, "benchmark_time": 1185.412036953494, "edp": 12.88693782749818, "throughput_penalty": 1000000.0, "objective": 1000012.8869378275, "strategy_time": 27.233178028836846, "framework_time": 39.966039126738906, "timestamp": "2025-02-20 07:45:14.940997+00:00"},
"1,256,32,2,115": {"block_size_x": 1, "block_size_y": 256, "tile_size_x": 32, "tile_size_y": 2, "nvml_pwr_limit": 115, "sm__warps_active.avg.pct_of_peak_sustained_active": 91.69231217818204, "dram__bytes.sum.per_second": 592512.7928898465, "time": 10.72051647731236, "times": [9.512895584106445, 10.300479888916016, 11.013343811035156, 11.049152374267578, 11.05958366394043, 11.062527656555176, 11.045632362365723], "nvml_power": 117.848, "nvml_energy": 1.263391425818307, "compile_time": 226.7855298705399, "verification_time": 0, "benchmark_time": 1167.5742459483445, "edp": 13.544208597780317, "throughput_penalty": 1000000.0, "objective": 1000013.5442085977, "strategy_time": 1.9660110119730234, "framework_time": 0.5188521463423967, "timestamp": "2025-02-20 07:45:16.337865+00:00"},
"1,128,32,2,135": {"block_size_x": 1, "block_size_y": 128, "tile_size_x": 32, "tile_size_y": 2, "nvml_pwr_limit": 135, "sm__warps_active.avg.pct_of_peak_sustained_active": 92.65865813099896, "dram__bytes.sum.per_second": 487692.53694948315, "time": 9.8458651133946, "times": [9.44057559967041, 9.674464225769043, 9.51308822631836, 10.093759536743164, 9.882335662841797, 10.16592025756836, 10.150912284851074], "nvml_power": 137.669, "nvml_energy": 1.3554704042959214, "compile_time": 234.36765605583787, "verification_time": 0, "benchmark_time": 1153.2236391212791, "edp": 13.345778765896087, "throughput_penalty": 1000000.0, "objective": 1000013.3457787659, "strategy_time": 1.1928700841963291, "framework_time": 42.40174079313874, "timestamp": "2025-02-20 07:45:17.769074+00:00"},
"2,512,32,2,115": {"block_size_x": 2, "block_size_y": 512, "tile_size_x": 32, "tile_size_y": 2, "nvml_pwr_limit": 115, "sm__warps_active.avg.pct_of_peak_sustained_active": 65.67505891194199, "dram__bytes.sum.per_second": 136395699.1515647, "time": 10.767273085457939, "times": [9.808639526367188, 10.454943656921387, 10.588800430297852, 11.084128379821777, 11.115615844726562, 11.160639762878418, 11.158143997192383], "nvml_power": 117.876, "nvml_energy": 1.26920308222144, "compile_time": 257.4887031223625, "verification_time": 0, "benchmark_time": 1162.5328280497342, "edp": 13.66585618718317, "throughput_penalty": 1000000.0, "objective": 1000013.6658561872, "strategy_time": 15.521641122177243, "framework_time": 44.43151177838445, "timestamp": "2025-02-20 07:45:19.249073+00:00"},
"1,128,16,2,135": {"block_size_x": 1, "block_size_y": 128, "tile_size_x": 16, "tile_size_y": 2, "nvml_pwr_limit": 135, "sm__warps_active.avg.pct_of_peak_sustained_active": 96.05713191352501, "dram__bytes.sum.per_second": 1478484.0283434498, "time": 20.410235268729075, "times": [20.01433563232422, 20.039743423461914, 20.400896072387695, 20.59894371032715, 20.549856185913086, 20.516416549682617, 20.751455307006836], "nvml_power": 136.975, "nvml_energy": 2.795691975934165, "compile_time": 227.11588279344141, "verification_time": 0, "benchmark_time": 1209.9230638705194, "edp": 57.06073096771437, "throughput_penalty": 1000000.0, "objective": 1000057.0607309677, "strategy_time": 2.0454709883779287, "framework_time": 46.13944236189127, "timestamp": "2025-02-20 07:45:20.734321+00:00"},
"4,256,32,2,115": {"block_size_x": 4, "block_size_y": 256, "tile_size_x": 32, "tile_size_y": 2, "nvml_pwr_limit": 115, "sm__warps_active.avg.pct_of_peak_sustained_active": 65.72597335517104, "dram__bytes.sum.per_second": 143083.38184076772, "time": 12.006633077348981, "times": [10.343520164489746, 10.612895965576172, 11.611104011535645, 11.954431533813477, 13.073920249938965, 13.185215950012207, 13.26534366607666], "nvml_power": 119.35, "nvml_energy": 1.4329916577816009, "compile_time": 246.88623589463532, "verification_time": 0, "benchmark_time": 1284.9625109229237, "edp": 17.205405037885722, "throughput_penalty": 1000000.0, "objective": 1000017.2054050379, "strategy_time": 1.2494800612330437, "framework_time": 51.332948030903935, "timestamp": "2025-02-20 07:45:22.318776+00:00"},
"1,32,32,4,115": {"block_size_x": 1, "block_size_y": 32, "tile_size_x": 32, "tile_size_y": 4, "nvml_pwr_limit": 115, "sm__warps_active.avg.pct_of_peak_sustained_active": 48.76007782749599, "dram__bytes.sum.per_second": 8918102.810717596, "time": 9.728658403669085, "times": [8.876288414001465, 8.997695922851562, 10.000608444213867, 10.012703895568848, 10.078975677490234, 10.068256378173828, 10.066080093383789], "nvml_power": 116.684, "nvml_energy": 1.1351787771737236, "compile_time": 251.77987082861364, "verification_time": 0, "benchmark_time": 1152.9657181818038, "edp": 11.043766550217942, "throughput_penalty": 1000000.0, "objective": 1000011.0437665503, "strategy_time": 15.516481129452586, "framework_time": 0.576679827645421, "timestamp": "2025-02-20 07:45:23.739640+00:00"},
"1,64,32,4,115": {"block_size_x": 1, "block_size_y": 64, "tile_size_x": 32, "tile_size_y": 4, "nvml_pwr_limit": 115, "sm__warps_active.avg.pct_of_peak_sustained_active": 87.63331458461568, "dram__bytes.sum.per_second": 199615.40764793166, "time": 10.662473133632115, "times": [9.888959884643555, 10.330559730529785, 10.537376403808594, 11.183327674865723, 10.821663856506348, 11.076767921447754, 10.798656463623047], "nvml_power": 117.802, "nvml_energy": 1.2560606600881306, "compile_time": 231.51264595799148, "verification_time": 0, "benchmark_time": 1181.3308510463685, "edp": 13.392713042401914, "throughput_penalty": 1000000.0, "objective": 1000013.3927130424, "strategy_time": 1.9824218470603228, "framework_time": 0.5367600824683905, "timestamp": "2025-02-20 07:45:25.155027+00:00"},
"1,32,32,8,115": {"block_size_x": 1, "block_size_y": 32, "tile_size_x": 32, "tile_size_y": 8, "nvml_pwr_limit": 115, "sm__warps_active.avg.pct_of_peak_sustained_active": 48.761034735851446, "dram__bytes.sum.per_second": 324105946.91132206, "time": 9.73197705405099, "times": [8.989184379577637, 9.176863670349121, 9.527775764465332, 9.957247734069824, 10.032735824584961, 10.222559928894043, 10.217472076416016], "nvml_power": 118.557, "nvml_energy": 1.1537940035971233, "compile_time": 239.5973929669708, "verification_time": 0, "benchmark_time": 1165.7551520038396, "edp": 11.22869676810883, "throughput_penalty": 1000000.0, "objective": 1000011.228696768, "strategy_time": 1.1997311376035213, "framework_time": 0.5528898909687996, "timestamp": "2025-02-20 07:45:26.562157+00:00"},
"4,8,32,8,150": {"block_size_x": 4, "block_size_y": 8, "tile_size_x": 32, "tile_size_y": 8, "nvml_pwr_limit": 150, "sm__warps_active.avg.pct_of_peak_sustained_active": 49.49605424612657, "dram__bytes.sum.per_second": 4673683244.150666, "time": 11.657133511134557, "times": [9.819775581359863, 10.597855567932129, 10.849151611328125, 12.686176300048828, 12.633855819702148, 12.597855567932129, 12.415264129638672], "nvml_power": 155.246, "nvml_energy": 1.8097233490695954, "compile_time": 252.49348185025156, "verification_time": 0, "benchmark_time": 1214.8072400595993, "edp": 21.09618669832184, "throughput_penalty": 1000000.0, "objective": 1000021.0961866983, "strategy_time": 15.772632090374827, "framework_time": 40.768199134618044, "timestamp": "2025-02-20 07:45:28.086023+00:00"},
"4,8,32,8,135": {"block_size_x": 4, "block_size_y": 8, "tile_size_x": 32, "tile_size_y": 8, "nvml_pwr_limit": 135, "sm__warps_active.avg.pct_of_peak_sustained_active": 49.490497949177495, "dram__bytes.sum.per_second": 7146122803.097026, "time": 13.307264055524554, "times": [9.990880012512207, 11.102751731872559, 12.627424240112305, 15.146528244018555, 15.030240058898926, 14.70956802368164, 14.543456077575684], "nvml_power": 139.8, "nvml_energy": 1.860355514962333, "compile_time": 237.5553329475224, "verification_time": 0, "benchmark_time": 1276.570956921205, "edp": 24.756242074755125, "throughput_penalty": 1000000.0, "objective": 1000024.7562420748, "strategy_time": 2.0367910619825125, "framework_time": 55.185290053486824, "timestamp": "2025-02-20 07:45:29.657395+00:00"},
"4,8,32,8,165": {"block_size_x": 4, "block_size_y": 8, "tile_size_x": 32, "tile_size_y": 8, "nvml_pwr_limit": 165, "sm__warps_active.avg.pct_of_peak_sustained_active": 49.49420608015954, "dram__bytes.sum.per_second": 7149653291.268198, "time": 10.885353224618095, "times": [9.773344039916992, 10.02137565612793, 10.361023902893066, 11.481120109558105, 11.497568130493164, 11.531200408935547, 11.531840324401855], "nvml_power": 167.287, "nvml_energy": 1.8209780848866874, "compile_time": 236.29693081602454, "verification_time": 0, "benchmark_time": 1183.6880210321397, "edp": 19.821989668280185, "throughput_penalty": 1000000.0, "objective": 1000019.8219896683, "strategy_time": 1.2847709003835917, "framework_time": 55.37730222567916, "timestamp": "2025-02-20 07:45:31.134067+00:00"},
"32,16,32,16,215": {"block_size_x": 32, "block_size_y": 16, "tile_size_x": 32, "tile_size_y": 16, "nvml_pwr_limit": 215, "sm__warps_active.avg.pct_of_peak_sustained_active": 99.65771128619954, "dram__bytes.sum.per_second": 2814395117.5634894, "time": 37.03570284162249, "times": [37.24620819091797, 36.62547302246094, 37.134910583496094, 37.08339309692383, 37.05315017700195, 37.05356979370117, 37.05321502685547], "nvml_power": 220.471, "nvml_energy": 8.165298441195352, "compile_time": 253.44367395155132, "verification_time": 0, "benchmark_time": 1369.494890095666, "edp": 302.4075666812744, "throughput_penalty": 1000000.0, "objective": 1000302.4075666813, "strategy_time": 16.413190867751837, "framework_time": 43.36102306842804, "timestamp": "2025-02-20 07:45:32.816803+00:00"},
"1,512,32,2,100": {"block_size_x": 1, "block_size_y": 512, "tile_size_x": 32, "tile_size_y": 2, "nvml_pwr_limit": 100, "sm__warps_active.avg.pct_of_peak_sustained_active": 92.11448044916209, "dram__bytes.sum.per_second": 1147537916.7501838, "time": 12.015035493033272, "times": [9.845151901245117, 11.174912452697754, 11.857855796813965, 13.042176246643066, 12.951711654663086, 12.797344207763672, 12.43609619140625], "nvml_power": 103.16, "nvml_energy": 1.2394710614613123, "compile_time": 237.50076303258538, "verification_time": 0, "benchmark_time": 1195.570285897702, "edp": 14.89228879604529, "throughput_penalty": 1000000.0, "objective": 1000014.892288796, "strategy_time": 2.1068209316581488, "framework_time": 47.5889362860471, "timestamp": "2025-02-20 07:45:34.299594+00:00"},
"64,16,32,16,235": {"block_size_x": 64, "block_size_y": 16, "tile_size_x": 32, "tile_size_y": 16, "nvml_pwr_limit": 235, "sm__warps_active.avg.pct_of_peak_sustained_active": 66.24096054858435, "dram__bytes.sum.per_second": 1759791710.4354873, "time": 35.631277901785715, "times": [35.890689849853516, 35.380062103271484, 35.659488677978516, 35.65436935424805, 35.64527893066406, 35.6016960144043, 35.58736038208008], "nvml_power": 238.15, "nvml_energy": 8.485588832310269, "compile_time": 239.01969497092068, "verification_time": 0, "benchmark_time": 1353.276033885777, "edp": 302.3523738443365, "throughput_penalty": 1000000.0, "objective": 1000302.3523738444, "strategy_time": 1.3457308523356915, "framework_time": 54.60765026509762, "timestamp": "2025-02-20 07:45:35.947867+00:00"},
"16,2,2,2,250": {"block_size_x": 16, "block_size_y": 2, "tile_size_x": 2, "tile_size_y": 2, "nvml_pwr_limit": 250, "sm__warps_active.avg.pct_of_peak_sustained_active": 49.900711956875874, "dram__bytes.sum.per_second": 471089967.5284693, "time": 41.277527400425505, "times": [41.4257926940918, 41.1995849609375, 41.289249420166016, 41.2204475402832, 41.29017639160156, 41.14060974121094, 41.3768310546875], "nvml_power": 256.1, "nvml_energy": 10.571174767248973, "compile_time": 253.26073681935668, "verification_time": 0, "benchmark_time": 1407.4617070145905, "edp": 436.35195610980617, "throughput_penalty": 1000000.0, "objective": 1000436.3519561097, "strategy_time": 17.55268289707601, "framework_time": 56.90077133476734, "timestamp": "2025-02-20 07:45:37.683066+00:00"},
"1,128,32,4,115": {"block_size_x": 1, "block_size_y": 128, "tile_size_x": 32, "tile_size_y": 4, "nvml_pwr_limit": 115, "sm__warps_active.avg.pct_of_peak_sustained_active": 93.13058990155007, "dram__bytes.sum.per_second": 2052512560.311077, "time": 10.568447930472237, "times": [9.776576042175293, 10.018336296081543, 10.374143600463867, 10.68835163116455, 10.980159759521484, 11.071231842041016, 11.07033634185791], "nvml_power": 117.271, "nvml_energy": 1.2393724572544098, "compile_time": 235.6423840392381, "verification_time": 0, "benchmark_time": 1193.4666309971362, "edp": 13.098243280954659, "throughput_penalty": 1000000.0, "objective": 1000013.098243281, "strategy_time": 2.0511720795184374, "framework_time": 47.61159489862621, "timestamp": "2025-02-20 07:45:39.161862+00:00"},
"1,512,32,2,135": {"block_size_x": 1, "block_size_y": 512, "tile_size_x": 32, "tile_size_y": 2, "nvml_pwr_limit": 135, "sm__warps_active.avg.pct_of_peak_sustained_active": 92.11087195380401, "dram__bytes.sum.per_second": 380243133.66334975, "time": 10.019693647112165, "times": [9.597567558288574, 9.700639724731445, 9.78332805633545, 10.278656005859375, 10.253567695617676, 10.2575044631958, 10.266592025756836], "nvml_power": 138.62, "nvml_energy": 1.3889299333626883, "compile_time": 243.49429993890226, "verification_time": 0, "benchmark_time": 1147.3602298647165, "edp": 13.91665242959805, "throughput_penalty": 1000000.0, "objective": 1000013.9166524296, "strategy_time": 1.2066909112036228, "framework_time": 51.11037823371589, "timestamp": "2025-02-20 07:45:40.605065+00:00"},
"1,32,32,4,100": {"block_size_x": 1, "block_size_y": 32, "tile_size_x": 32, "tile_size_y": 4, "nvml_pwr_limit": 100, "sm__warps_active.avg.pct_of_peak_sustained_active": 48.73988592139943, "dram__bytes.sum.per_second": 22773326.795076117, "time": 10.59841809953962, "times": [8.88976001739502, 10.153247833251953, 10.16755199432373, 11.356800079345703, 11.292767524719238, 11.184255599975586, 11.144543647766113], "nvml_power": 102.681, "nvml_energy": 1.0882561688788277, "compile_time": 253.26845701783895, "verification_time": 0, "benchmark_time": 1187.0945419650525, "edp": 11.533793877181013, "throughput_penalty": 1000000.0, "objective": 1000011.5337938772, "strategy_time": 16.47673104889691, "framework_time": 40.67493206821382, "timestamp": "2025-02-20 07:45:42.102603+00:00"},
"2,512,32,2,100": {"block_size_x": 2, "block_size_y": 512, "tile_size_x": 32, "tile_size_y": 2, "nvml_pwr_limit": 100, "sm__warps_active.avg.pct_of_peak_sustained_active": 65.67427890715621, "dram__bytes.sum.per_second": 26368.43961462526, "time": 12.179327964782715, "times": [9.70633602142334, 11.627103805541992, 12.56220817565918, 13.111871719360352, 12.928447723388672, 12.800127983093262, 12.519200325012207], "nvml_power": 102.405, "nvml_energy": 1.247224080233574, "compile_time": 245.01931201666594, "verification_time": 0, "benchmark_time": 1199.4959530420601, "edp": 15.190351118739168, "throughput_penalty": 1000000.0, "objective": 1000015.1903511187, "strategy_time": 2.0251621026545763, "framework_time": 0.5350508727133274, "timestamp": "2025-02-20 07:45:43.549703+00:00"},
"4,256,32,2,135": {"block_size_x": 4, "block_size_y": 256, "tile_size_x": 32, "tile_size_y": 2, "nvml_pwr_limit": 135, "sm__warps_active.avg.pct_of_peak_sustained_active": 65.72618375024516, "dram__bytes.sum.per_second": 142874.30632900706, "time": 10.890765735081263, "times": [9.839391708374023, 9.855968475341797, 11.055904388427734, 11.178624153137207, 11.468704223632812, 11.442655563354492, 11.394111633300781], "nvml_power": 138.972, "nvml_energy": 1.5135114957357134, "compile_time": 241.9551000930369, "verification_time": 0, "benchmark_time": 1187.241786159575, "edp": 16.4832991374101, "throughput_penalty": 1000000.0, "objective": 1000016.4832991374, "strategy_time": 1.3348308857530355, "framework_time": 43.63006190396845, "timestamp": "2025-02-20 07:45:45.023889+00:00"},
"2,16,32,4,115": {"block_size_x": 2, "block_size_y": 16, "tile_size_x": 32, "tile_size_y": 4, "nvml_pwr_limit": 115, "sm__warps_active.avg.pct_of_peak_sustained_active": 49.126268087766185, "dram__bytes.sum.per_second": 756895329.3028357, "time": 10.868877819606237, "times": [9.174112319946289, 10.235136032104492, 10.362591743469238, 11.593600273132324, 11.613504409790039, 11.579584121704102, 11.523615837097168], "nvml_power": 117.959, "nvml_energy": 1.282081958722932, "compile_time": 252.2700480185449, "verification_time": 0, "benchmark_time": 1195.7351348828524, "edp": 13.934792164080994, "throughput_penalty": 1000000.0, "objective": 1000013.9347921641, "strategy_time": 20.896867150440812, "framework_time": 48.41712606139481, "timestamp": "2025-02-20 07:45:46.541233+00:00"},
"1,512,32,2,115": {"block_size_x": 1, "block_size_y": 512, "tile_size_x": 32, "tile_size_y": 2, "nvml_pwr_limit": 115, "sm__warps_active.avg.pct_of_peak_sustained_active": 92.10507961116639, "dram__bytes.sum.per_second": 840016.8003360068, "time": 10.811277662004743, "times": [9.595744132995605, 10.508064270019531, 10.758367538452148, 11.19923210144043, 11.195743560791016, 11.171808242797852, 11.249983787536621], "nvml_power": 117.674, "nvml_energy": 1.2722062875987463, "compile_time": 238.85652888566256, "verification_time": 0, "benchmark_time": 1165.0883241090924, "edp": 13.754175418578308, "throughput_penalty": 1000000.0, "objective": 1000013.7541754185, "strategy_time": 2.0135820377618074, "framework_time": 0.5492300260812044, "timestamp": "2025-02-20 07:45:47.947765+00:00"},
"1,256,32,4,100": {"block_size_x": 1, "block_size_y": 256, "tile_size_x": 32, "tile_size_y": 4, "nvml_pwr_limit": 100, "sm__warps_active.avg.pct_of_peak_sustained_active": 91.93588660619059, "dram__bytes.sum.per_second": 377278.40788511874, "time": 11.977746146065849, "times": [10.177599906921387, 10.31612777709961, 11.972319602966309, 12.232735633850098, 12.736895561218262, 13.196096420288086, 13.212448120117188], "nvml_power": 102.703, "nvml_energy": 1.230150462439401, "compile_time": 242.75359301827848, "verification_time": 0, "benchmark_time": 1262.6302500721067, "edp": 14.734429960564658, "throughput_penalty": 1000000.0, "objective": 1000014.7344299606, "strategy_time": 1.243700971826911, "framework_time": 48.92511572688818, "timestamp": "2025-02-20 07:45:49.503341+00:00"},
"2,16,32,8,115": {"block_size_x": 2, "block_size_y": 16, "tile_size_x": 32, "tile_size_y": 8, "nvml_pwr_limit": 115, "sm__warps_active.avg.pct_of_peak_sustained_active": 49.11524936812386, "dram__bytes.sum.per_second": 1929562641.5751874, "time": 11.15691430228097, "times": [9.212896347045898, 10.40009593963623, 10.510656356811523, 12.084575653076172, 12.055999755859375, 11.981375694274902, 11.852800369262695], "nvml_power": 118.939, "nvml_energy": 1.3269922301989963, "compile_time": 249.65295800939202, "verification_time": 0, "benchmark_time": 1224.4618739932775, "edp": 14.805138592122903, "throughput_penalty": 1000000.0, "objective": 1000014.8051385921, "strategy_time": 39.14052993059158, "framework_time": 47.09792509675026, "timestamp": "2025-02-20 07:45:51.063718+00:00"},
"1,256,32,2,135": {"block_size_x": 1, "block_size_y": 256, "tile_size_x": 32, "tile_size_y": 2, "nvml_pwr_limit": 135, "sm__warps_active.avg.pct_of_peak_sustained_active": 92.08458411224133, "dram__bytes.sum.per_second": 351905049.63897395, "time": 9.993668692452568, "times": [9.47817611694336, 9.618271827697754, 9.60319995880127, 10.32256031036377, 10.306976318359375, 10.306048393249512, 10.32044792175293], "nvml_power": 136.323, "nvml_energy": 1.3623668971612115, "compile_time": 228.1087830197066, "verification_time": 0, "benchmark_time": 1155.9324241243303, "edp": 13.615043407793747, "throughput_penalty": 1000000.0, "objective": 1000013.6150434078, "strategy_time": 2.183231059461832, "framework_time": 45.405053766444325, "timestamp": "2025-02-20 07:45:52.495372+00:00"},
"2,16,32,8,135": {"block_size_x": 2, "block_size_y": 16, "tile_size_x": 32, "tile_size_y": 8, "nvml_pwr_limit": 135, "sm__warps_active.avg.pct_of_peak_sustained_active": 49.11298329001785, "dram__bytes.sum.per_second": 2468202912.8007727, "time": 10.024324689592634, "times": [9.185248374938965, 9.204928398132324, 10.098688125610352, 10.280096054077148, 10.435808181762695, 10.482975959777832, 10.482527732849121], "nvml_power": 137.863, "nvml_energy": 1.3819834746813093, "compile_time": 249.87738905474544, "verification_time": 0, "benchmark_time": 1163.480130955577, "edp": 13.853451065856866, "throughput_penalty": 1000000.0, "objective": 1000013.8534510658, "strategy_time": 1.2731209862977266, "framework_time": 0.5630610976368189, "timestamp": "2025-02-20 07:45:53.910589+00:00"},
"1,32,32,2,100": {"block_size_x": 1, "block_size_y": 32, "tile_size_x": 32, "tile_size_y": 2, "nvml_pwr_limit": 100, "sm__warps_active.avg.pct_of_peak_sustained_active": 48.783445389563965, "dram__bytes.sum.per_second": 460067394.3722819, "time": 10.581010273524694, "times": [8.847455978393555, 10.106911659240723, 10.166463851928711, 11.360223770141602, 11.295904159545898, 11.189536094665527, 11.100576400756836], "nvml_power": 102.451, "nvml_energy": 1.0840350835328785, "compile_time": 257.8416159376502, "verification_time": 0, "benchmark_time": 1169.053768971935, "edp": 11.470186355722587, "throughput_penalty": 1000000.0, "objective": 1000011.4701863558, "strategy_time": 19.798044813796878, "framework_time": 43.91325335018337, "timestamp": "2025-02-20 07:45:55.401220+00:00"},
"1,256,32,2,100": {"block_size_x": 1, "block_size_y": 256, "tile_size_x": 32, "tile_size_y": 2, "nvml_pwr_limit": 100, "sm__warps_active.avg.pct_of_peak_sustained_active": 91.82319652864604, "dram__bytes.sum.per_second": 834609.3657978429, "time": 12.14598832811628, "times": [9.52131175994873, 11.305407524108887, 11.722847938537598, 13.140128135681152, 13.303263664245605, 13.21513557434082, 12.813823699951172], "nvml_power": 102.036, "nvml_energy": 1.2393280650476728, "compile_time": 227.32585296034813, "verification_time": 0, "benchmark_time": 1222.864330979064, "edp": 15.052864212775967, "throughput_penalty": 1000000.0, "objective": 1000015.0528642128, "strategy_time": 1.9571920856833458, "framework_time": 0.5079400725662708, "timestamp": "2025-02-20 07:45:56.853898+00:00"},
"2,512,32,2,135": {"block_size_x": 2, "block_size_y": 512, "tile_size_x": 32, "tile_size_y": 2, "nvml_pwr_limit": 135, "sm__warps_active.avg.pct_of_peak_sustained_active": 65.67347557137593, "dram__bytes.sum.per_second": 235288688.77909216, "time": 10.039030756269183, "times": [9.706144332885742, 9.734527587890625, 9.905471801757812, 10.01904010772705, 10.20479965209961, 10.328895568847656, 10.374336242675781], "nvml_power": 138.949, "nvml_energy": 1.394913284552847, "compile_time": 249.2719499859959, "verification_time": 0, "benchmark_time": 1161.5982768125832, "edp": 14.003577365954497, "throughput_penalty": 1000000.0, "objective": 1000014.003577366, "strategy_time": 1.2448709458112717, "framework_time": 47.53063712269068, "timestamp": "2025-02-20 07:45:58.313568+00:00"},
"8,128,32,2,135": {"block_size_x": 8, "block_size_y": 128, "tile_size_x": 32, "tile_size_y": 2, "nvml_pwr_limit": 135, "sm__warps_active.avg.pct_of_peak_sustained_active": 65.97929333798537, "dram__bytes.sum.per_second": 1696802.5876239461, "time": 14.888246944972447, "times": [10.87116813659668, 13.907072067260742, 15.341856002807617, 16.346336364746094, 16.13327980041504, 15.863679885864258, 15.7543363571167], "nvml_power": 140.024, "nvml_energy": 2.084711890222822, "compile_time": 254.1858849581331, "verification_time": 0, "benchmark_time": 1259.973084088415, "edp": 31.03770543075767, "throughput_penalty": 1000000.0, "objective": 1000031.0377054308, "strategy_time": 17.430393025279045, "framework_time": 0.550079857930541, "timestamp": "2025-02-20 07:45:59.845732+00:00"},
"2,256,32,4,115": {"block_size_x": 2, "block_size_y": 256, "tile_size_x": 32, "tile_size_y": 4, "nvml_pwr_limit": 115, "sm__warps_active.avg.pct_of_peak_sustained_active": 95.32709205022459, "dram__bytes.sum.per_second": 633366.722774697, "time": 10.45693724496024, "times": [9.396256446838379, 10.010880470275879, 10.132384300231934, 10.833727836608887, 10.880255699157715, 10.98367977142334, 10.961376190185547], "nvml_power": 118.452, "nvml_energy": 1.2386451305400303, "compile_time": 228.84182585403323, "verification_time": 0, "benchmark_time": 1163.7564930133522, "edp": 12.952434398832683, "throughput_penalty": 1000000.0, "objective": 1000012.9524343988, "strategy_time": 2.0912319887429476, "framework_time": 47.91652620770037, "timestamp": "2025-02-20 07:46:01.288361+00:00"},
"4,8,32,4,115": {"block_size_x": 4, "block_size_y": 8, "tile_size_x": 32, "tile_size_y": 4, "nvml_pwr_limit": 115, "sm__warps_active.avg.pct_of_peak_sustained_active": 49.50027413207405, "dram__bytes.sum.per_second": 2114202454.2904036, "time": 15.257343973432269, "times": [10.247584342956543, 11.689567565917969, 15.235456466674805, 17.79100799560547, 17.511455535888672, 17.153919219970703, 17.17241668701172], "nvml_power": 118.438, "nvml_energy": 1.8070493055253711, "compile_time": 234.37332990579307, "verification_time": 0, "benchmark_time": 1321.516006020829, "edp": 27.57077283135249, "throughput_penalty": 1000000.0, "objective": 1000027.5707728313, "strategy_time": 1.3233711943030357, "framework_time": 0.5261208862066269, "timestamp": "2025-02-20 07:46:02.846123+00:00"},
"8,16,32,16,165": {"block_size_x": 8, "block_size_y": 16, "tile_size_x": 32, "tile_size_y": 16, "nvml_pwr_limit": 165, "sm__warps_active.avg.pct_of_peak_sustained_active": 92.55104763398833, "dram__bytes.sum.per_second": 5322651765.36194, "time": 14.308649063110352, "times": [11.30844783782959, 11.661503791809082, 13.969504356384277, 15.4585599899292, 16.158592224121094, 15.84124755859375, 15.762687683105469], "nvml_power": 168.976, "nvml_energy": 2.417818284088135, "compile_time": 266.8680059723556, "verification_time": 0, "benchmark_time": 1289.185734000057, "edp": 34.595713325388765, "throughput_penalty": 1000000.0, "objective": 1000034.5957133254, "strategy_time": 25.06268909201026, "framework_time": 45.4550648573786, "timestamp": "2025-02-20 07:46:04.472719+00:00"},
"2,256,32,4,100": {"block_size_x": 2, "block_size_y": 256, "tile_size_x": 32, "tile_size_y": 4, "nvml_pwr_limit": 100, "sm__warps_active.avg.pct_of_peak_sustained_active": 95.32127085629821, "dram__bytes.sum.per_second": 573747805.4322007, "time": 11.463634354727608, "times": [9.950847625732422, 10.500960350036621, 10.954208374023438, 11.300671577453613, 12.430208206176758, 12.556768417358398, 12.551775932312012], "nvml_power": 103.648, "nvml_energy": 1.188182773598807, "compile_time": 239.85885502770543, "verification_time": 0, "benchmark_time": 1245.436322875321, "edp": 13.62089286312282, "throughput_penalty": 1000000.0, "objective": 1000013.6208928631, "strategy_time": 2.081942046061158, "framework_time": 48.28380816616118, "timestamp": "2025-02-20 07:46:06.008403+00:00"},
"1,256,32,4,115": {"block_size_x": 1, "block_size_y": 256, "tile_size_x": 32, "tile_size_y": 4, "nvml_pwr_limit": 115, "sm__warps_active.avg.pct_of_peak_sustained_active": 91.99748928943006, "dram__bytes.sum.per_second": 201863.8764593076, "time": 10.6586241040911, "times": [9.856224060058594, 10.190879821777344, 10.50928020477295, 10.732128143310547, 11.051424026489258, 11.125568389892578, 11.144864082336426], "nvml_power": 117.042, "nvml_energy": 1.2475066823910306, "compile_time": 243.20380808785558, "verification_time": 0, "benchmark_time": 1187.9727500490844, "edp": 13.29670479494776, "throughput_penalty": 1000000.0, "objective": 1000013.296704795, "strategy_time": 1.2614410370588303, "framework_time": 47.2618667408824, "timestamp": "2025-02-20 07:46:07.488129+00:00"},
"1,1024,32,2,115": {"block_size_x": 1, "block_size_y": 1024, "tile_size_x": 32, "tile_size_y": 2, "nvml_pwr_limit": 115, "sm__warps_active.avg.pct_of_peak_sustained_active": 65.7089004564015, "dram__bytes.sum.per_second": 1129877693.6517181, "time": 11.835044588361468, "times": [10.617088317871094, 10.647551536560059, 11.9399995803833, 12.084128379821777, 12.27724838256836, 12.616767883300781, 12.662528038024902], "nvml_power": 116.844, "nvml_energy": 1.3828539498825074, "compile_time": 243.96262899972498, "verification_time": 0, "benchmark_time": 1207.9652678221464, "edp": 16.36613815605125, "throughput_penalty": 1000000.0, "objective": 1000016.366138156, "strategy_time": 34.321486949920654, "framework_time": 0.6978714372962713, "timestamp": "2025-02-20 07:46:08.975109+00:00"},
"1,64,32,2,100": {"block_size_x": 1, "block_size_y": 64, "tile_size_x": 32, "tile_size_y": 2, "nvml_pwr_limit": 100, "sm__warps_active.avg.pct_of_peak_sustained_active": 87.46707963656544, "dram__bytes.sum.per_second": 665723.5582924191, "time": 11.95100348336356, "times": [10.465920448303223, 10.968799591064453, 11.619711875915527, 11.71782398223877, 12.314335823059082, 13.099488258361816, 13.47094440460205], "nvml_power": 101.853, "nvml_energy": 1.2172455577910286, "compile_time": 230.18886987119913, "verification_time": 0, "benchmark_time": 1230.7445688638836, "edp": 14.547305901269404, "throughput_penalty": 1000000.0, "objective": 1000014.5473059013, "strategy_time": 2.0494810305535793, "framework_time": 49.34831825084984, "timestamp": "2025-02-20 07:46:10.487465+00:00"},
"1,128,32,2,100": {"block_size_x": 1, "block_size_y": 128, "tile_size_x": 32, "tile_size_y": 2, "nvml_pwr_limit": 100, "sm__warps_active.avg.pct_of_peak_sustained_active": 92.63776235304383, "dram__bytes.sum.per_second": 108449.21018473645, "time": 11.638199125017438, "times": [10.289600372314453, 10.686400413513184, 11.156767845153809, 11.633472442626953, 12.581952095031738, 12.396384239196777, 12.722816467285156], "nvml_power": 101.904, "nvml_energy": 1.185979043635777, "compile_time": 230.21092009730637, "verification_time": 0, "benchmark_time": 1280.7689998298883, "edp": 13.80266026793092, "throughput_penalty": 1000000.0, "objective": 1000013.8026602679, "strategy_time": 1.2538409791886806, "framework_time": 0.5305102095007896, "timestamp": "2025-02-20 07:46:12.000253+00:00"},
"1,128,32,4,100": {"block_size_x": 1, "block_size_y": 128, "tile_size_x": 32, "tile_size_y": 4, "nvml_pwr_limit": 100, "sm__warps_active.avg.pct_of_peak_sustained_active": 92.63569819721124, "dram__bytes.sum.per_second": 760518.2388570497, "time": 11.714912005833217, "times": [9.708000183105469, 10.3603515625, 11.476544380187988, 12.724160194396973, 12.529791831970215, 12.770015716552734, 12.43552017211914], "nvml_power": 101.663, "nvml_energy": 1.1909730992490222, "compile_time": 254.62235906161368, "verification_time": 0, "benchmark_time": 1292.721071979031, "edp": 13.952145059016765, "throughput_penalty": 1000000.0, "objective": 1000013.952145059, "strategy_time": 22.419497836381197, "framework_time": 0.5682101473212242, "timestamp": "2025-02-20 07:46:13.570607+00:00"},
"1,64,32,4,100": {"block_size_x": 1, "block_size_y": 64, "tile_size_x": 32, "tile_size_y": 4, "nvml_pwr_limit": 100, "sm__warps_active.avg.pct_of_peak_sustained_active": 87.68603385076793, "dram__bytes.sum.per_second": 0.0, "time": 12.241833278111049, "times": [9.915936470031738, 11.200703620910645, 11.601216316223145, 13.326944351196289, 13.532383918762207, 13.342592239379883, 12.773056030273438], "nvml_power": 101.725, "nvml_energy": 1.2453004902158464, "compile_time": 242.3119500745088, "verification_time": 0, "benchmark_time": 1210.421758936718, "edp": 15.244760982372352, "throughput_penalty": 1000000.0, "objective": 1000015.2447609823, "strategy_time": 1.974161947146058, "framework_time": 0.5076900124549866, "timestamp": "2025-02-20 07:46:15.025847+00:00"},
"2,256,32,2,115": {"block_size_x": 2, "block_size_y": 256, "tile_size_x": 32, "tile_size_y": 2, "nvml_pwr_limit": 115, "sm__warps_active.avg.pct_of_peak_sustained_active": 95.28614085681045, "dram__bytes.sum.per_second": 13728.673363971157, "time": 10.316032000950404, "times": [9.566271781921387, 9.806591987609863, 10.143648147583008, 10.423935890197754, 10.652383804321289, 10.79196834564209, 10.827424049377441], "nvml_power": 117.593, "nvml_energy": 1.213093151087761, "compile_time": 239.73811883479357, "verification_time": 0, "benchmark_time": 1175.9040639735758, "edp": 12.514307766755106, "throughput_penalty": 1000000.0, "objective": 1000012.5143077668, "strategy_time": 1.258961157873273, "framework_time": 45.79839622601867, "timestamp": "2025-02-20 07:46:16.488570+00:00"},
"2,128,32,4,115": {"block_size_x": 2, "block_size_y": 128, "tile_size_x": 32, "tile_size_y": 4, "nvml_pwr_limit": 115, "sm__warps_active.avg.pct_of_peak_sustained_active": 95.16768158562776, "dram__bytes.sum.per_second": 0.0, "time": 10.875227519444056, "times": [9.498592376708984, 9.80134391784668, 11.270048141479492, 11.376864433288574, 11.532735824584961, 11.257247924804688, 11.38976001739502], "nvml_power": 117.427, "nvml_energy": 1.2770453419257572, "compile_time": 253.0675691086799, "verification_time": 0, "benchmark_time": 1161.2485549412668, "edp": 13.88815864608884, "throughput_penalty": 1000000.0, "objective": 1000013.8881586461, "strategy_time": 21.045066881924868, "framework_time": 0.5584899336099625, "timestamp": "2025-02-20 07:46:17.924513+00:00"},
"2,256,32,2,135": {"block_size_x": 2, "block_size_y": 256, "tile_size_x": 32, "tile_size_y": 2, "nvml_pwr_limit": 135, "sm__warps_active.avg.pct_of_peak_sustained_active": 95.3221362187882, "dram__bytes.sum.per_second": 0.0, "time": 9.678601128714424, "times": [9.301535606384277, 9.318719863891602, 9.533984184265137, 9.783967971801758, 9.856415748596191, 9.964320182800293, 9.991264343261719], "nvml_power": 139.577, "nvml_energy": 1.3509101097425733, "compile_time": 232.6699940022081, "verification_time": 0, "benchmark_time": 1163.1695879623294, "edp": 13.074920112946197, "throughput_penalty": 1000000.0, "objective": 1000013.074920113, "strategy_time": 2.0946410950273275, "framework_time": 41.61847406066954, "timestamp": "2025-02-20 07:46:19.364089+00:00"},
"1,64,32,2,115": {"block_size_x": 1, "block_size_y": 64, "tile_size_x": 32, "tile_size_y": 2, "nvml_pwr_limit": 115, "sm__warps_active.avg.pct_of_peak_sustained_active": 87.07320600849768, "dram__bytes.sum.per_second": 0.0, "time": 10.630834306989398, "times": [10.023455619812012, 9.97606372833252, 10.436896324157715, 10.580927848815918, 10.947648048400879, 11.236384391784668, 11.21446418762207], "nvml_power": 117.66, "nvml_energy": 1.2508239645603725, "compile_time": 250.89906807988882, "verification_time": 0, "benchmark_time": 1191.2559228949249, "edp": 13.297302314452898, "throughput_penalty": 1000000.0, "objective": 1000013.2973023144, "strategy_time": 1.3229711912572384, "framework_time": 54.245173931121826, "timestamp": "2025-02-20 07:46:20.861837+00:00"},
"4,32,32,4,115": {"block_size_x": 4, "block_size_y": 32, "tile_size_x": 32, "tile_size_y": 4, "nvml_pwr_limit": 115, "sm__warps_active.avg.pct_of_peak_sustained_active": 94.91750342416238, "dram__bytes.sum.per_second": 0.0, "time": 14.140786307198661, "times": [9.84006404876709, 10.702943801879883, 14.499103546142578, 16.033151626586914, 16.310144424438477, 15.954848289489746, 15.645248413085938], "nvml_power": 118.226, "nvml_energy": 1.671808601954869, "compile_time": 256.4436439424753, "verification_time": 0, "benchmark_time": 1282.575158169493, "edp": 23.64068818678035, "throughput_penalty": 1000000.0, "objective": 1000023.6406881867, "strategy_time": 20.990645978599787, "framework_time": 0.5756900645792484, "timestamp": "2025-02-20 07:46:22.422447+00:00"},
"1,32,32,2,115": {"block_size_x": 1, "block_size_y": 32, "tile_size_x": 32, "tile_size_y": 2, "nvml_pwr_limit": 115, "sm__warps_active.avg.pct_of_peak_sustained_active": 48.75319915394312, "dram__bytes.sum.per_second": 0.0, "time": 9.719172613961357, "times": [8.870944023132324, 9.394304275512695, 9.81817626953125, 9.925344467163086, 9.996735572814941, 10.021984100341797, 10.006719589233398], "nvml_power": 117.239, "nvml_energy": 1.1394660780882155, "compile_time": 240.55924103595316, "verification_time": 0, "benchmark_time": 1151.3834348879755, "edp": 11.074667500692938, "throughput_penalty": 1000000.0, "objective": 1000011.0746675007, "strategy_time": 2.050901995971799, "framework_time": 0.5201702006161213, "timestamp": "2025-02-20 07:46:23.816985+00:00"},
"2,128,32,2,115": {"block_size_x": 2, "block_size_y": 128, "tile_size_x": 32, "tile_size_y": 2, "nvml_pwr_limit": 115, "sm__warps_active.avg.pct_of_peak_sustained_active": 95.16690105318513, "dram__bytes.sum.per_second": 13397.4625205986, "time": 10.761056082589286, "times": [9.555359840393066, 9.86303997039795, 11.05833625793457, 11.20304012298584, 11.300992012023926, 11.180992126464844, 11.165632247924805], "nvml_power": 116.945, "nvml_energy": 1.258451703578404, "compile_time": 241.46479205228388, "verification_time": 0, "benchmark_time": 1170.8420631475747, "edp": 13.542269359437233, "throughput_penalty": 1000000.0, "objective": 1000013.5422693595, "strategy_time": 1.2866419274359941, "framework_time": 0.5600599106401205, "timestamp": "2025-02-20 07:46:25.231164+00:00"},
"1,32,32,4,135": {"block_size_x": 1, "block_size_y": 32, "tile_size_x": 32, "tile_size_y": 4, "nvml_pwr_limit": 135, "sm__warps_active.avg.pct_of_peak_sustained_active": 48.7449250099322, "dram__bytes.sum.per_second": 0.0, "time": 9.117284502301898, "times": [8.87286376953125, 8.894399642944336, 8.89136028289795, 9.234463691711426, 9.326047897338867, 9.324864387512207, 9.276991844177246], "nvml_power": 138.067, "nvml_energy": 1.2587961193793162, "compile_time": 254.26239310763776, "verification_time": 0, "benchmark_time": 1137.1831079013646, "edp": 11.47680235077481, "throughput_penalty": 1000000.0, "objective": 1000011.4768023507, "strategy_time": 18.25659512542188, "framework_time": 39.65505096130073, "timestamp": "2025-02-20 07:46:26.680547+00:00"},
"2,32,32,4,115": {"block_size_x": 2, "block_size_y": 32, "tile_size_x": 32, "tile_size_y": 4, "nvml_pwr_limit": 115, "sm__warps_active.avg.pct_of_peak_sustained_active": 91.62446109053344, "dram__bytes.sum.per_second": 0.0, "time": 11.077055931091309, "times": [9.470879554748535, 10.711359977722168, 10.717472076416016, 11.534432411193848, 11.5763521194458, 11.795519828796387, 11.733375549316406], "nvml_power": 118.555, "nvml_energy": 1.3132403659105303, "compile_time": 228.25781302526593, "verification_time": 0, "benchmark_time": 1202.45471294038, "edp": 14.54683698415776, "throughput_penalty": 1000000.0, "objective": 1000014.5468369841, "strategy_time": 2.0964019931852818, "framework_time": 48.96176792681217, "timestamp": "2025-02-20 07:46:28.162341+00:00"},
"2,64,32,4,115": {"block_size_x": 2, "block_size_y": 64, "tile_size_x": 32, "tile_size_y": 4, "nvml_pwr_limit": 115, "sm__warps_active.avg.pct_of_peak_sustained_active": 95.93024739661814, "dram__bytes.sum.per_second": 0.0, "time": 11.058555466788155, "times": [9.461888313293457, 10.54371166229248, 11.037088394165039, 11.62332820892334, 11.649984359741211, 11.467583656311035, 11.626303672790527], "nvml_power": 118.321, "nvml_energy": 1.3084593413858412, "compile_time": 232.18885599635541, "verification_time": 0, "benchmark_time": 1198.938871966675, "edp": 14.469670202752424, "throughput_penalty": 1000000.0, "objective": 1000014.4696702027, "strategy_time": 1.3486510142683983, "framework_time": 0.5367910489439964, "timestamp": "2025-02-20 07:46:29.595377+00:00"},
"2,16,32,4,100": {"block_size_x": 2, "block_size_y": 16, "tile_size_x": 32, "tile_size_y": 4, "nvml_pwr_limit": 100, "sm__warps_active.avg.pct_of_peak_sustained_active": 49.12684347490151, "dram__bytes.sum.per_second": 12160986.297923196, "time": 12.707972526550293, "times": [9.33948802947998, 10.823136329650879, 11.797439575195312, 14.51251220703125, 14.397151947021484, 14.209280014038086, 13.876799583435059], "nvml_power": 103.52, "nvml_energy": 1.3155293159484862, "compile_time": 255.8856150135398, "verification_time": 0, "benchmark_time": 1275.4688949789852, "edp": 16.717710404944864, "throughput_penalty": 1000000.0, "objective": 1000016.7177104049, "strategy_time": 18.427814822643995, "framework_time": 46.09622713178396, "timestamp": "2025-02-20 07:46:31.191280+00:00"},
"4,128,32,2,115": {"block_size_x": 4, "block_size_y": 128, "tile_size_x": 32, "tile_size_y": 2, "nvml_pwr_limit": 115, "sm__warps_active.avg.pct_of_peak_sustained_active": 97.45562325962082, "dram__bytes.sum.per_second": 0.0, "time": 12.57931900024414, "times": [10.162976264953613, 11.412480354309082, 12.324543952941895, 13.751456260681152, 13.62662410736084, 13.463423728942871, 13.313728332519531], "nvml_power": 117.756, "nvml_energy": 1.481290288192749, "compile_time": 226.89831303432584, "verification_time": 0, "benchmark_time": 1228.440450038761, "edp": 18.633623067140167, "throughput_penalty": 1000000.0, "objective": 1000018.6336230672, "strategy_time": 2.0861721131950617, "framework_time": 47.846027882769704, "timestamp": "2025-02-20 07:46:32.696575+00:00"},
"2,128,32,2,135": {"block_size_x": 2, "block_size_y": 128, "tile_size_x": 32, "tile_size_y": 2, "nvml_pwr_limit": 135, "sm__warps_active.avg.pct_of_peak_sustained_active": 95.17193199906184, "dram__bytes.sum.per_second": 0.0, "time": 10.088086809430804, "times": [9.575551986694336, 9.5895357131958, 9.836480140686035, 10.305184364318848, 10.377023696899414, 10.472576141357422, 10.46025562286377], "nvml_power": 137.74, "nvml_energy": 1.3895330771309988, "compile_time": 247.06511897966266, "verification_time": 0, "benchmark_time": 1161.8672891054302, "edp": 14.017730306673025, "throughput_penalty": 1000000.0, "objective": 1000014.0177303067, "strategy_time": 1.3631409965455532, "framework_time": 51.84912192635238, "timestamp": "2025-02-20 07:46:34.158744+00:00"},
"2,64,32,4,135": {"block_size_x": 2, "block_size_y": 64, "tile_size_x": 32, "tile_size_y": 4, "nvml_pwr_limit": 135, "sm__warps_active.avg.pct_of_peak_sustained_active": 95.83923971113644, "dram__bytes.sum.per_second": 13519.679583593868, "time": 10.089755603245326, "times": [9.45680046081543, 9.379008293151855, 9.912192344665527, 10.201248168945312, 10.464639663696289, 10.608863830566406, 10.605536460876465], "nvml_power": 137.776, "nvml_energy": 1.3901261679927281, "compile_time": 245.51677890121937, "verification_time": 0, "benchmark_time": 1177.2157929372042, "edp": 14.026033292722582, "throughput_penalty": 1000000.0, "objective": 1000014.0260332928, "strategy_time": 16.626572934910655, "framework_time": 0.516640255227685, "timestamp": "2025-02-20 07:46:35.598644+00:00"},
"4,128,32,2,135": {"block_size_x": 4, "block_size_y": 128, "tile_size_x": 32, "tile_size_y": 2, "nvml_pwr_limit": 135, "sm__warps_active.avg.pct_of_peak_sustained_active": 97.50005982466354, "dram__bytes.sum.per_second": 0.0, "time": 10.967460632324219, "times": [10.108063697814941, 10.168448448181152, 10.887871742248535, 11.137280464172363, 11.470784187316895, 11.504256248474121, 11.495519638061523], "nvml_power": 139.008, "nvml_energy": 1.524564767578125, "compile_time": 238.64404298365116, "verification_time": 0, "benchmark_time": 1189.8142348509282, "edp": 16.72060406984161, "throughput_penalty": 1000000.0, "objective": 1000016.7206040699, "strategy_time": 2.1645519882440567, "framework_time": 0.5436802748590708, "timestamp": "2025-02-20 07:46:37.029833+00:00"},
"2,64,32,2,115": {"block_size_x": 2, "block_size_y": 64, "tile_size_x": 32, "tile_size_y": 2, "nvml_pwr_limit": 115, "sm__warps_active.avg.pct_of_peak_sustained_active": 95.69210919673947, "dram__bytes.sum.per_second": 0.0, "time": 11.019451413835798, "times": [9.763615608215332, 10.41478443145752, 10.86137580871582, 11.592927932739258, 11.538368225097656, 11.51478385925293, 11.45030403137207], "nvml_power": 116.883, "nvml_energy": 1.2879865396033696, "compile_time": 248.04711202159524, "verification_time": 0, "benchmark_time": 1194.0146300476044, "edp": 14.192905094833828, "throughput_penalty": 1000000.0, "objective": 1000014.1929050948, "strategy_time": 1.3905109371989965, "framework_time": 45.91000685468316, "timestamp": "2025-02-20 07:46:38.519219+00:00"},
"2,16,32,2,100": {"block_size_x": 2, "block_size_y": 16, "tile_size_x": 32, "tile_size_y": 2, "nvml_pwr_limit": 100, "sm__warps_active.avg.pct_of_peak_sustained_active": 49.14378256560266, "dram__bytes.sum.per_second": 28061.904561462587, "time": 12.682710920061384, "times": [9.303487777709961, 10.781824111938477, 11.806431770324707, 14.64083194732666, 14.35587215423584, 14.063872337341309, 13.826656341552734], "nvml_power": 102.064, "nvml_energy": 1.294448207345145, "compile_time": 250.04762294702232, "verification_time": 0, "benchmark_time": 1235.876837046817, "edp": 16.417112414750154, "throughput_penalty": 1000000.0, "objective": 1000016.4171124147, "strategy_time": 20.105016883462667, "framework_time": 44.67289615422487, "timestamp": "2025-02-20 07:46:40.069946+00:00"},
"2,32,32,4,135": {"block_size_x": 2, "block_size_y": 32, "tile_size_x": 32, "tile_size_y": 4, "nvml_pwr_limit": 135, "sm__warps_active.avg.pct_of_peak_sustained_active": 91.76222551468636, "dram__bytes.sum.per_second": 0.0, "time": 10.146711077008929, "times": [9.466848373413086, 9.799872398376465, 9.797344207763672, 10.453887939453125, 10.450336456298828, 10.501055717468262, 10.557632446289062], "nvml_power": 138.236, "nvml_energy": 1.402640752441406, "compile_time": 234.53758098185062, "verification_time": 0, "benchmark_time": 1164.2191300634295, "edp": 14.232190459861352, "throughput_penalty": 1000000.0, "objective": 1000014.2321904599, "strategy_time": 2.074451884254813, "framework_time": 49.18734007515013, "timestamp": "2025-02-20 07:46:41.519989+00:00"},
"1,64,32,4,135": {"block_size_x": 1, "block_size_y": 64, "tile_size_x": 32, "tile_size_y": 4, "nvml_pwr_limit": 135, "sm__warps_active.avg.pct_of_peak_sustained_active": 87.48862937157978, "dram__bytes.sum.per_second": 0.0, "time": 10.014239992414202, "times": [9.613951683044434, 9.740768432617188, 9.687295913696289, 10.244000434875488, 10.114975929260254, 10.286879539489746, 10.411808013916016], "nvml_power": 137.851, "nvml_energy": 1.3804729971942902, "compile_time": 237.18305281363428, "verification_time": 0, "benchmark_time": 1151.6328011639416, "edp": 13.82438789695096, "throughput_penalty": 1000000.0, "objective": 1000013.8243878969, "strategy_time": 1.2967621441930532, "framework_time": 0.5459708627313375, "timestamp": "2025-02-20 07:46:42.910671+00:00"},
"2,16,32,8,150": {"block_size_x": 2, "block_size_y": 16, "tile_size_x": 32, "tile_size_y": 8, "nvml_pwr_limit": 150, "sm__warps_active.avg.pct_of_peak_sustained_active": 49.10943161062742, "dram__bytes.sum.per_second": 2107688444.3142343, "time": 9.633193288530622, "times": [9.203200340270996, 9.19865608215332, 9.184896469116211, 9.941472053527832, 9.989279747009277, 9.96127986907959, 9.953568458557129], "nvml_power": 153.147, "nvml_energy": 1.475294652558599, "compile_time": 250.8300649933517, "verification_time": 0, "benchmark_time": 1142.9184470325708, "edp": 14.211798545632613, "throughput_penalty": 1000000.0, "objective": 1000014.2117985457, "strategy_time": 19.384365994483232, "framework_time": 46.65882885456085, "timestamp": "2025-02-20 07:46:44.370487+00:00"},
