experiments/data/run4/bayes_opt_float32.json
{
"device_name": "NVIDIA RTX 5000 Ada Generation",
"kernel_name": "tuned_matmul<float>",
"problem_size": [
4096,
4096
],
"tune_params_keys": [
"block_size_x",
"block_size_y",
"tile_size_x",
"tile_size_y",
"nvml_pwr_limit"
],
"tune_params": {
"block_size_x": [
1,
2,
4,
8,
16,
32,
64,
128,
256,
512,
1024
],
"block_size_y": [
1,
2,
4,
8,
16,
32,
64,
128,
256,
512,
1024
],
"tile_size_x": [
2,
4,
8,
16,
32
],
"tile_size_y": [
2,
4,
8,
16,
32
],
"nvml_pwr_limit": [
100,
115,
135,
150,
165,
185,
200,
215,
235,
250
]
},
"objective": "objective",
"cache": {
"1,64,16,8,165": {"block_size_x": 1, "block_size_y": 64, "tile_size_x": 16, "tile_size_y": 8, "nvml_pwr_limit": 165, "sm__warps_active.avg.pct_of_peak_sustained_active": 91.76416761135104, "dram__bytes.sum.per_second": 12202172559.330244, "time": 20.508434295654297, "times": [19.310815811157227, 20.721920013427734, 20.808448791503906, 20.64579200744629, 20.683807373046875, 20.612384796142578, 20.77587127685547], "nvml_power": 170.011, "nvml_energy": 3.4866594230384824, "compile_time": 246.73848086968064, "verification_time": 0, "benchmark_time": 1218.0848219431937, "edp": 71.50592568870864, "throughput_penalty": 1000000.0, "objective": 1000071.5059256887, "strategy_time": 439.19576494954526, "framework_time": 0, "timestamp": "2025-02-20 07:47:16.186212+00:00"},
"4,32,8,4,100": {"block_size_x": 4, "block_size_y": 32, "tile_size_x": 8, "tile_size_y": 4, "nvml_pwr_limit": 100, "sm__warps_active.avg.pct_of_peak_sustained_active": 93.03772165891603, "dram__bytes.sum.per_second": 10188912185.984077, "time": 111.40364401681083, "times": [113.30524444580078, 109.97261047363281, 109.62413024902344, 109.61939239501953, 109.9659194946289, 110.06371307373047, 117.27449798583984], "nvml_power": 100.868, "nvml_energy": 11.237062764687673, "compile_time": 241.33281712420285, "verification_time": 0, "benchmark_time": 1926.5784719027579, "edp": 1251.8497400318256, "throughput_penalty": 1000000.0, "objective": 1001251.8497400319, "strategy_time": 0.13961992226541042, "framework_time": 47.794350888580084, "timestamp": "2025-02-20 07:47:18.402082+00:00"},
"256,4,8,2,165": {"block_size_x": 256, "block_size_y": 4, "tile_size_x": 8, "tile_size_y": 2, "nvml_pwr_limit": 165, "sm__warps_active.avg.pct_of_peak_sustained_active": 66.53246673001546, "dram__bytes.sum.per_second": 1038257337.1220341, "time": 57.90563201904297, "times": [58.23574447631836, 57.85532760620117, 57.85590362548828, 57.851905822753906, 57.84601593017578, 57.84931182861328, 57.84521484375], "nvml_power": 166.77, "nvml_energy": 9.656922251815796, "compile_time": 252.29983683675528, "verification_time": 0, "benchmark_time": 1563.5776640847325, "edp": 559.1901863501533, "throughput_penalty": 1000000.0, "objective": 1000559.1901863501, "strategy_time": 0.18425006419420242, "framework_time": 54.07182592898607, "timestamp": "2025-02-20 07:47:20.272239+00:00"},
"32,8,32,8,185": {"block_size_x": 32, "block_size_y": 8, "tile_size_x": 32, "tile_size_y": 8, "nvml_pwr_limit": 185, "sm__warps_active.avg.pct_of_peak_sustained_active": 98.74033288572134, "dram__bytes.sum.per_second": 37551338778.45656, "time": 48.34410967145647, "times": [54.97372817993164, 48.90227127075195, 46.89664077758789, 47.09609603881836, 46.70320129394531, 46.737022399902344, 47.09980773925781], "nvml_power": 188.764, "nvml_energy": 9.12562751802281, "compile_time": 243.0068999528885, "verification_time": 0, "benchmark_time": 1428.4399810712785, "edp": 441.17033755215584, "throughput_penalty": 1000000.0, "objective": 1000441.1703375522, "strategy_time": 0.26511005125939846, "framework_time": 50.11886195279658, "timestamp": "2025-02-20 07:47:21.994094+00:00"},
"4,64,16,8,215": {"block_size_x": 4, "block_size_y": 64, "tile_size_x": 16, "tile_size_y": 8, "nvml_pwr_limit": 215, "sm__warps_active.avg.pct_of_peak_sustained_active": 86.50402534646561, "dram__bytes.sum.per_second": 18373164814.68016, "time": 20.45569392613002, "times": [19.71459197998047, 20.38265609741211, 20.662944793701172, 20.59760093688965, 20.690847396850586, 20.579072952270508, 20.562143325805664], "nvml_power": 221.362, "nvml_energy": 4.528113318875993, "compile_time": 246.58775283023715, "verification_time": 0, "benchmark_time": 1216.0815100651234, "edp": 92.6257001137601, "throughput_penalty": 1000000.0, "objective": 1000092.6257001137, "strategy_time": 0.2397000789642334, "framework_time": 53.788135992363095, "timestamp": "2025-02-20 07:47:23.510816+00:00"},
"2,512,4,2,215": {"block_size_x": 2, "block_size_y": 512, "tile_size_x": 4, "tile_size_y": 2, "nvml_pwr_limit": 215, "sm__warps_active.avg.pct_of_peak_sustained_active": 65.72923826208795, "dram__bytes.sum.per_second": 9127866674.495459, "time": 72.3584725516183, "times": [72.54595184326172, 72.34575653076172, 72.32915496826172, 72.32032012939453, 72.3220443725586, 72.32672119140625, 72.3193588256836], "nvml_power": 211.642, "nvml_energy": 15.3140918477696, "compile_time": 252.2971590515226, "verification_time": 0, "benchmark_time": 1618.5040990822017, "edp": 1108.1042946197983, "throughput_penalty": 1000000.0, "objective": 1001108.1042946198, "strategy_time": 0.18906989134848118, "framework_time": 0.5619400180876255, "timestamp": "2025-02-20 07:47:25.382393+00:00"},
"16,64,2,2,250": {"block_size_x": 16, "block_size_y": 64, "tile_size_x": 2, "tile_size_y": 2, "nvml_pwr_limit": 250, "sm__warps_active.avg.pct_of_peak_sustained_active": 66.12074828147372, "dram__bytes.sum.per_second": 304408598.29677194, "time": 35.92316763741629, "times": [34.517822265625, 36.10182571411133, 36.18150329589844, 36.165374755859375, 36.17417526245117, 36.15510559082031, 36.16636657714844], "nvml_power": 254.888, "nvml_energy": 9.156384352765764, "compile_time": 247.80938494950533, "verification_time": 0, "benchmark_time": 1364.4026529509574, "edp": 328.92633005702004, "throughput_penalty": 1000000.0, "objective": 1000328.926330057, "strategy_time": 0.17156009562313557, "framework_time": 53.03084594197571, "timestamp": "2025-02-20 07:47:27.047832+00:00"},
"2,32,16,2,150": {"block_size_x": 2, "block_size_y": 32, "tile_size_x": 16, "tile_size_y": 2, "nvml_pwr_limit": 150, "sm__warps_active.avg.pct_of_peak_sustained_active": 95.03043906528069, "dram__bytes.sum.per_second": 13003762717.564955, "time": 22.697316578456334, "times": [21.471424102783203, 21.683008193969727, 23.143232345581055, 22.946592330932617, 22.915584564208984, 23.280479431152344, 23.440895080566406], "nvml_power": 154.853, "nvml_energy": 3.5147475641236987, "compile_time": 244.14608208462596, "verification_time": 0, "benchmark_time": 1281.3069229014218, "edp": 79.77533815627385, "throughput_penalty": 1000000.0, "objective": 1000079.7753381563, "strategy_time": 0.2728800754994154, "framework_time": 53.96682699210942, "timestamp": "2025-02-20 07:47:28.627549+00:00"},
"64,2,16,2,215": {"block_size_x": 64, "block_size_y": 2, "tile_size_x": 16, "tile_size_y": 2, "nvml_pwr_limit": 215, "sm__warps_active.avg.pct_of_peak_sustained_active": 97.71279881460127, "dram__bytes.sum.per_second": 1852027808.0768402, "time": 58.68293925694057, "times": [59.31145477294922, 59.30195236206055, 58.956417083740234, 58.94976043701172, 57.843711853027344, 58.030975341796875, 58.38630294799805], "nvml_power": 218.496, "nvml_energy": 12.821987495884487, "compile_time": 251.1987080797553, "verification_time": 0, "benchmark_time": 1585.166339064017, "edp": 752.4319133742409, "throughput_penalty": 1000000.0, "objective": 1000752.4319133742, "strategy_time": 0.29129115864634514, "framework_time": 56.240508798509836, "timestamp": "2025-02-20 07:47:30.520470+00:00"},
"2,64,2,8,135": {"block_size_x": 2, "block_size_y": 64, "tile_size_x": 2, "tile_size_y": 8, "nvml_pwr_limit": 135, "sm__warps_active.avg.pct_of_peak_sustained_active": 98.18762007350261, "dram__bytes.sum.per_second": 6170496294.419459, "time": 228.0532945905413, "times": [221.06121826171875, 220.16429138183594, 227.8244171142578, 241.65919494628906, 238.76205444335938, 222.74447631835938, 224.15740966796875], "nvml_power": 135.448, "nvml_energy": 30.889362645699638, "compile_time": 250.58814883232117, "verification_time": 0, "benchmark_time": 3018.4377359692007, "edp": 7044.420919153802, "throughput_penalty": 1000000.0, "objective": 1007044.4209191538, "strategy_time": 0.3032099921256304, "framework_time": 60.01894315704703, "timestamp": "2025-02-20 07:47:33.849842+00:00"},
"1,512,16,4,185": {"block_size_x": 1, "block_size_y": 512, "tile_size_x": 16, "tile_size_y": 4, "nvml_pwr_limit": 185, "sm__warps_active.avg.pct_of_peak_sustained_active": 94.8601690043646, "dram__bytes.sum.per_second": 14531832885.709963, "time": 19.427515302385604, "times": [18.5231990814209, 19.37366485595703, 19.680831909179688, 19.635263442993164, 19.56438446044922, 19.59836769104004, 19.61689567565918], "nvml_power": 189.288, "nvml_energy": 3.677395516557967, "compile_time": 247.14973685331643, "verification_time": 0, "benchmark_time": 1215.566233964637, "edp": 71.44265767085412, "throughput_penalty": 1000000.0, "objective": 1000071.4426576708, "strategy_time": 0.20262994803488255, "framework_time": 51.07040423899889, "timestamp": "2025-02-20 07:47:35.363854+00:00"},
"4,256,2,4,200": {"block_size_x": 4, "block_size_y": 256, "tile_size_x": 2, "tile_size_y": 4, "nvml_pwr_limit": 200, "sm__warps_active.avg.pct_of_peak_sustained_active": 65.82261148403154, "dram__bytes.sum.per_second": 448457915.97210246, "time": 79.24410574776786, "times": [79.61443328857422, 79.15340423583984, 79.20806121826172, 79.1608657836914, 79.15299224853516, 79.14995574951172, 79.26902770996094], "nvml_power": 201.896, "nvml_energy": 15.999067974051338, "compile_time": 251.48263992741704, "verification_time": 0, "benchmark_time": 1707.6030289754272, "edp": 1267.8318344014504, "throughput_penalty": 1000000.0, "objective": 1001267.8318344015, "strategy_time": 0.2234908752143383, "framework_time": 50.633294275030494, "timestamp": "2025-02-20 07:47:37.373820+00:00"},
"2,16,32,16,215": {"block_size_x": 2, "block_size_y": 16, "tile_size_x": 32, "tile_size_y": 16, "nvml_pwr_limit": 215, "sm__warps_active.avg.pct_of_peak_sustained_active": 49.09362102045071, "dram__bytes.sum.per_second": 32918359291.140648, "time": 9.34033829825265, "times": [9.209792137145996, 9.228096008300781, 9.214143753051758, 9.255647659301758, 9.45952033996582, 9.484928131103516, 9.530240058898926], "nvml_power": 221.407, "nvml_energy": 2.0680162816012246, "compile_time": 253.3098019193858, "verification_time": 0, "benchmark_time": 1136.5982089191675, "edp": 19.315971676449955, "throughput_penalty": 1000000.0, "objective": 1000019.3159716765, "strategy_time": 0.22932980209589005, "framework_time": 60.17750431783497, "timestamp": "2025-02-20 07:47:38.824160+00:00"},
"2,64,4,32,100": {"block_size_x": 2, "block_size_y": 64, "tile_size_x": 4, "tile_size_y": 32, "nvml_pwr_limit": 100, "sm__warps_active.avg.pct_of_peak_sustained_active": 97.92197712254128, "dram__bytes.sum.per_second": 8877385516.808655, "time": 202.31480407714844, "times": [196.8329315185547, 195.91439819335938, 195.4384307861328, 216.07504272460938, 214.13235473632812, 201.88035583496094, 195.93011474609375], "nvml_power": 100.068, "nvml_energy": 20.24523781439209, "compile_time": 250.90793101117015, "verification_time": 0, "benchmark_time": 2649.5450660586357, "edp": 4095.9113219140127, "throughput_penalty": 1000000.0, "objective": 1004095.911321914, "strategy_time": 0.195810804143548, "framework_time": 80.74563113041222, "timestamp": "2025-02-20 07:47:41.805580+00:00"},
"16,16,4,2,150": {"block_size_x": 16, "block_size_y": 16, "tile_size_x": 4, "tile_size_y": 2, "nvml_pwr_limit": 150, "sm__warps_active.avg.pct_of_peak_sustained_active": 98.72508511371035, "dram__bytes.sum.per_second": 486228958.9795373, "time": 69.37543705531529, "times": [68.19225311279297, 68.83232116699219, 69.49820709228516, 69.28460693359375, 69.89299011230469, 70.1085433959961, 69.81913757324219], "nvml_power": 148.077, "nvml_energy": 10.272906592839922, "compile_time": 249.55289997160435, "verification_time": 0, "benchmark_time": 1635.3494259528816, "edp": 712.6873847066994, "throughput_penalty": 1000000.0, "objective": 1000712.6873847067, "strategy_time": 0.2684900537133217, "framework_time": 53.69729804806411, "timestamp": "2025-02-20 07:47:43.744472+00:00"},
"64,8,2,2,100": {"block_size_x": 64, "block_size_y": 8, "tile_size_x": 2, "tile_size_y": 2, "nvml_pwr_limit": 100, "sm__warps_active.avg.pct_of_peak_sustained_active": 99.18424034830828, "dram__bytes.sum.per_second": 159516255.29372388, "time": 100.6227286202567, "times": [102.8272933959961, 100.20861053466797, 100.19779205322266, 100.19792175292969, 100.89004516601562, 100.19190216064453, 99.84553527832031], "nvml_power": 101.086, "nvml_energy": 10.171549145307267, "compile_time": 248.06058988906443, "verification_time": 0, "benchmark_time": 1844.9838450178504, "edp": 1023.4890292958571, "throughput_penalty": 1000000.0, "objective": 1001023.4890292959, "strategy_time": 0.35423110239207745, "framework_time": 55.50176906399429, "timestamp": "2025-02-20 07:47:45.893396+00:00"},
"4,32,2,8,200": {"block_size_x": 4, "block_size_y": 32, "tile_size_x": 2, "tile_size_y": 8, "nvml_pwr_limit": 200, "sm__warps_active.avg.pct_of_peak_sustained_active": 94.54462287592374, "dram__bytes.sum.per_second": 299254992.9941558, "time": 84.80675179617745, "times": [84.90614318847656, 84.7162857055664, 84.7171859741211, 84.7688980102539, 84.84786987304688, 84.98774719238281, 84.70313262939453], "nvml_power": 203.792, "nvml_energy": 17.282937562046598, "compile_time": 250.69168210029602, "verification_time": 0, "benchmark_time": 1741.890758043155, "edp": 1465.7097961333182, "throughput_penalty": 1000000.0, "objective": 1001465.7097961333, "strategy_time": 0.3144610673189163, "framework_time": 54.51897764578462, "timestamp": "2025-02-20 07:47:47.940836+00:00"},
"2,32,32,4,115": {"block_size_x": 2, "block_size_y": 32, "tile_size_x": 32, "tile_size_y": 4, "nvml_pwr_limit": 115, "sm__warps_active.avg.pct_of_peak_sustained_active": 92.71709539952326, "dram__bytes.sum.per_second": 11540549427.34815, "time": 14.354848044259208, "times": [9.77017593383789, 10.993056297302246, 14.239935874938965, 16.264799118041992, 16.290496826171875, 16.4268798828125, 16.498592376708984], "nvml_power": 118.98, "nvml_energy": 1.7079398203059608, "compile_time": 250.02461206167936, "verification_time": 0, "benchmark_time": 1333.4937579929829, "edp": 24.517216589231445, "throughput_penalty": 1000000.0, "objective": 1000024.5172165892, "strategy_time": 0.23298989981412888, "framework_time": 57.34780104830861, "timestamp": "2025-02-20 07:47:49.581958+00:00"},
"64,8,16,4,115": {"block_size_x": 64, "block_size_y": 8, "tile_size_x": 16, "tile_size_y": 4, "nvml_pwr_limit": 115, "sm__warps_active.avg.pct_of_peak_sustained_active": 99.24671325291477, "dram__bytes.sum.per_second": 1385512275.4470313, "time": 79.7481188092913, "times": [82.7350082397461, 79.08367919921875, 79.34550476074219, 79.05577850341797, 79.31526184082031, 79.33206176757812, 79.36953735351562], "nvml_power": 116.124, "nvml_energy": 9.260670548610141, "compile_time": 250.24574296548963, "verification_time": 0, "benchmark_time": 1718.8860340975225, "edp": 738.5210551642664, "throughput_penalty": 1000000.0, "objective": 1000738.5210551643, "strategy_time": 0.3175509627908468, "framework_time": 0.5854100454598665, "timestamp": "2025-02-20 07:47:51.552016+00:00"},
"32,16,4,16,235": {"block_size_x": 32, "block_size_y": 16, "tile_size_x": 4, "tile_size_y": 16, "nvml_pwr_limit": 235, "sm__warps_active.avg.pct_of_peak_sustained_active": 92.19212528553669, "dram__bytes.sum.per_second": 1634724603.5389497, "time": 37.80595179966518, "times": [34.89033508300781, 37.966880798339844, 38.60771179199219, 38.45097732543945, 38.31670379638672, 38.20595169067383, 38.203102111816406], "nvml_power": 237.857, "nvml_energy": 8.99241027721296, "compile_time": 251.4294849243015, "verification_time": 0, "benchmark_time": 1375.798761146143, "edp": 339.96662950312697, "throughput_penalty": 1000000.0, "objective": 1000339.9666295032, "strategy_time": 0.37205987609922886, "framework_time": 53.33400797098875, "timestamp": "2025-02-20 07:47:53.232974+00:00"},
"1,64,32,4,185": {"block_size_x": 1, "block_size_y": 64, "tile_size_x": 32, "tile_size_y": 4, "nvml_pwr_limit": 185, "sm__warps_active.avg.pct_of_peak_sustained_active": 88.53244661424114, "dram__bytes.sum.per_second": 7001938668.78077, "time": 9.889860698154994, "times": [9.811712265014648, 9.738240242004395, 9.723775863647461, 9.907232284545898, 10.020416259765625, 10.008768081665039, 10.018879890441895], "nvml_power": 189.876, "nvml_energy": 1.8778471899228777, "compile_time": 249.7928140219301, "verification_time": 0, "benchmark_time": 1142.6283540204167, "edp": 18.571647120759064, "throughput_penalty": 1000000.0, "objective": 1000018.5716471208, "strategy_time": 23.978461045771837, "framework_time": 47.51953179948032, "timestamp": "2025-02-20 07:47:54.696917+00:00"},
"1,64,32,8,165": {"block_size_x": 1, "block_size_y": 64, "tile_size_x": 32, "tile_size_y": 8, "nvml_pwr_limit": 165, "sm__warps_active.avg.pct_of_peak_sustained_active": 88.26305522974471, "dram__bytes.sum.per_second": 8082715356.167831, "time": 10.337357657296318, "times": [9.770879745483398, 9.683712005615234, 10.195808410644531, 10.793567657470703, 10.691295623779297, 10.59881591796875, 10.627424240112305], "nvml_power": 168.935, "nvml_energy": 1.7463415158353535, "compile_time": 229.6611659694463, "verification_time": 0, "benchmark_time": 1167.2257569152862, "edp": 18.05255684097505, "throughput_penalty": 1000000.0, "objective": 1000018.0525568409, "strategy_time": 2.2652519401162863, "framework_time": 45.83679139614105, "timestamp": "2025-02-20 07:47:56.141929+00:00"},
"1,64,32,2,185": {"block_size_x": 1, "block_size_y": 64, "tile_size_x": 32, "tile_size_y": 2, "nvml_pwr_limit": 185, "sm__warps_active.avg.pct_of_peak_sustained_active": 88.0508948452751, "dram__bytes.sum.per_second": 4686260349.995548, "time": 9.821385247366768, "times": [9.80777645111084, 9.732992172241211, 9.648927688598633, 9.79804801940918, 9.747584342956543, 10.064255714416504, 9.950112342834473], "nvml_power": 189.37, "nvml_energy": 1.8598757242938448, "compile_time": 237.3230829834938, "verification_time": 0, "benchmark_time": 1130.9764459729195, "edp": 18.266556000515152, "throughput_penalty": 1000000.0, "objective": 1000018.2665560006, "strategy_time": 1.443132059648633, "framework_time": 52.06514592282474, "timestamp": "2025-02-20 07:47:57.563762+00:00"},
"8,32,32,2,100": {"block_size_x": 8, "block_size_y": 32, "tile_size_x": 32, "tile_size_y": 2, "nvml_pwr_limit": 100, "sm__warps_active.avg.pct_of_peak_sustained_active": 95.68578749294157, "dram__bytes.sum.per_second": 8855624953.485575, "time": 30.26081371307373, "times": [14.448063850402832, 34.15670394897461, 35.88361740112305, 32.532958984375, 31.604671478271484, 31.583711624145508, 31.615968704223633], "nvml_power": 103.17, "nvml_energy": 3.1220081507778166, "compile_time": 259.9772932007909, "verification_time": 0, "benchmark_time": 1363.310217158869, "edp": 94.47450706138531, "throughput_penalty": 1000000.0, "objective": 1000094.4745070614, "strategy_time": 20.900520030409098, "framework_time": 47.3140524700284, "timestamp": "2025-02-20 07:47:59.255288+00:00"},
"4,32,32,2,100": {"block_size_x": 4, "block_size_y": 32, "tile_size_x": 32, "tile_size_y": 2, "nvml_pwr_limit": 100, "sm__warps_active.avg.pct_of_peak_sustained_active": 93.50838676911144, "dram__bytes.sum.per_second": 13564173524.547514, "time": 23.571734837123326, "times": [10.518783569335938, 16.72969627380371, 31.285696029663086, 27.97577667236328, 26.20467185974121, 26.522815704345703, 25.76470375061035], "nvml_power": 101.979, "nvml_energy": 2.4038219469549995, "compile_time": 224.9901129398495, "verification_time": 0, "benchmark_time": 1361.1706979572773, "edp": 56.66225352928078, "throughput_penalty": 1000000.0, "objective": 1000056.6622535293, "strategy_time": 2.1134319249540567, "framework_time": 0.5094702355563641, "timestamp": "2025-02-20 07:48:00.844095+00:00"},
"16,64,32,2,100": {"block_size_x": 16, "block_size_y": 64, "tile_size_x": 32, "tile_size_y": 2, "nvml_pwr_limit": 100, "sm__warps_active.avg.pct_of_peak_sustained_active": 66.31281067828255, "dram__bytes.sum.per_second": 13307623318.38565, "time": 48.062710353306365, "times": [40.959327697753906, 50.95596694946289, 48.91980743408203, 48.90262222290039, 48.90070343017578, 48.90019226074219, 48.900352478027344], "nvml_power": 100.74, "nvml_energy": 4.841837440992083, "compile_time": 231.7846880760044, "verification_time": 0, "benchmark_time": 1465.0643339846283, "edp": 232.71183050419657, "throughput_penalty": 1000000.0, "objective": 1000232.7118305042, "strategy_time": 1.357660861685872, "framework_time": 0.5311411805450916, "timestamp": "2025-02-20 07:48:02.542857+00:00"},
"4,16,16,2,185": {"block_size_x": 4, "block_size_y": 16, "tile_size_x": 16, "tile_size_y": 2, "nvml_pwr_limit": 185, "sm__warps_active.avg.pct_of_peak_sustained_active": 96.48140027922999, "dram__bytes.sum.per_second": 15569828473.384861, "time": 22.237046922956193, "times": [21.291584014892578, 21.78870391845703, 22.570240020751953, 22.600927352905273, 22.430400848388672, 22.422143936157227, 22.555328369140625], "nvml_power": 186.929, "nvml_energy": 4.156748944261278, "compile_time": 251.83120695874095, "verification_time": 0, "benchmark_time": 1225.8043189067394, "edp": 92.43382132048666, "throughput_penalty": 1000000.0, "objective": 1000092.4338213205, "strategy_time": 31.680640066042542, "framework_time": 45.21308117546141, "timestamp": "2025-02-20 07:48:04.097410+00:00"},
"2,32,32,2,150": {"block_size_x": 2, "block_size_y": 32, "tile_size_x": 32, "tile_size_y": 2, "nvml_pwr_limit": 150, "sm__warps_active.avg.pct_of_peak_sustained_active": 92.60486061522055, "dram__bytes.sum.per_second": 7804250508.861295, "time": 10.452731541224889, "times": [9.184736251831055, 9.85587215423584, 9.883392333984375, 11.036224365234375, 11.121343612670898, 11.048255920410156, 11.03929615020752], "nvml_power": 153.231, "nvml_energy": 1.601682506793431, "compile_time": 234.57976197823882, "verification_time": 0, "benchmark_time": 1185.7923450879753, "edp": 16.741957257787845, "throughput_penalty": 1000000.0, "objective": 1000016.7419572577, "strategy_time": 2.298021921887994, "framework_time": 48.64733503200114, "timestamp": "2025-02-20 07:48:05.568751+00:00"},
"4,8,32,2,150": {"block_size_x": 4, "block_size_y": 8, "tile_size_x": 32, "tile_size_y": 2, "nvml_pwr_limit": 150, "sm__warps_active.avg.pct_of_peak_sustained_active": 49.477146792667156, "dram__bytes.sum.per_second": 12086317710.537453, "time": 12.38322285243443, "times": [9.639200210571289, 9.988672256469727, 12.56118392944336, 13.307807922363281, 14.201279640197754, 13.5731840133667, 13.411231994628906], "nvml_power": 155.175, "nvml_energy": 1.921566606126513, "compile_time": 243.02166001871228, "verification_time": 0, "benchmark_time": 1235.876152990386, "edp": 23.795187509460707, "throughput_penalty": 1000000.0, "objective": 1000023.7951875095, "strategy_time": 1.5504618640989065, "framework_time": 0.5205501802265644, "timestamp": "2025-02-20 07:48:07.049744+00:00"},
"1,512,32,16,200": {"block_size_x": 1, "block_size_y": 512, "tile_size_x": 32, "tile_size_y": 16, "nvml_pwr_limit": 200, "sm__warps_active.avg.pct_of_peak_sustained_active": 91.56073745994333, "dram__bytes.sum.per_second": 9821650927.246315, "time": 9.660338265555245, "times": [9.6079683303833, 9.587295532226562, 9.658464431762695, 9.613056182861328, 9.690176010131836, 9.732447624206543, 9.732959747314453], "nvml_power": 202.691, "nvml_energy": 1.9580636233836584, "compile_time": 254.8219219315797, "verification_time": 0, "benchmark_time": 1128.9467772003263, "edp": 18.91555694736491, "throughput_penalty": 1000000.0, "objective": 1000018.9155569474, "strategy_time": 15.762653900310397, "framework_time": 43.39714883826673, "timestamp": "2025-02-20 07:48:08.492697+00:00"},
"1,256,32,4,185": {"block_size_x": 1, "block_size_y": 256, "tile_size_x": 32, "tile_size_y": 4, "nvml_pwr_limit": 185, "sm__warps_active.avg.pct_of_peak_sustained_active": 92.28941397414117, "dram__bytes.sum.per_second": 7230672760.53552, "time": 10.20649596623012, "times": [9.796223640441895, 9.981887817382812, 9.908224105834961, 10.56383991241455, 10.490752220153809, 10.367199897766113, 10.3373441696167], "nvml_power": 188.909, "nvml_energy": 1.9280989464845657, "compile_time": 233.0797619652003, "verification_time": 0, "benchmark_time": 1134.1728630941361, "edp": 19.679134119787264, "throughput_penalty": 1000000.0, "objective": 1000019.6791341198, "strategy_time": 2.007921924814582, "framework_time": 45.66594213247299, "timestamp": "2025-02-20 07:48:09.907648+00:00"},
"1,512,32,32,200": {"block_size_x": 1, "block_size_y": 512, "tile_size_x": 32, "tile_size_y": 32, "nvml_pwr_limit": 200, "sm__warps_active.avg.pct_of_peak_sustained_active": 91.600215075128, "dram__bytes.sum.per_second": 9868734300.164116, "time": 9.63816683632987, "times": [9.573887825012207, 9.589983940124512, 9.567296028137207, 9.673407554626465, 9.692992210388184, 9.704480171203613, 9.665120124816895], "nvml_power": 203.243, "nvml_energy": 1.9588899423161916, "compile_time": 244.55222394317389, "verification_time": 0, "benchmark_time": 1121.5562529396266, "edp": 18.88010807805205, "throughput_penalty": 1000000.0, "objective": 1000018.880108078, "strategy_time": 1.2395509984344244, "framework_time": 48.57820295728743, "timestamp": "2025-02-20 07:48:11.323599+00:00"},
"4,8,32,4,100": {"block_size_x": 4, "block_size_y": 8, "tile_size_x": 32, "tile_size_y": 4, "nvml_pwr_limit": 100, "sm__warps_active.avg.pct_of_peak_sustained_active": 49.458913266820595, "dram__bytes.sum.per_second": 23046827118.98097, "time": 26.500749860491073, "times": [10.419584274291992, 27.76697540283203, 33.951168060302734, 29.49603271484375, 28.229568481445312, 27.969600677490234, 27.672319412231445], "nvml_power": 102.784, "nvml_energy": 2.7238530736607145, "compile_time": 249.94274810887873, "verification_time": 0, "benchmark_time": 1332.0434971246868, "edp": 72.18414896181235, "throughput_penalty": 1000000.0, "objective": 1000072.1841489618, "strategy_time": 13.907491927966475, "framework_time": 44.57289166748524, "timestamp": "2025-02-20 07:48:12.964090+00:00"},
"1,64,16,4,185": {"block_size_x": 1, "block_size_y": 64, "tile_size_x": 16, "tile_size_y": 4, "nvml_pwr_limit": 185, "sm__warps_active.avg.pct_of_peak_sustained_active": 92.03056085689387, "dram__bytes.sum.per_second": 10527999660.845695, "time": 19.409897123064315, "times": [18.622655868530273, 19.337343215942383, 19.495264053344727, 19.595552444458008, 19.602367401123047, 19.610368728637695, 19.605728149414062], "nvml_power": 188.133, "nvml_energy": 3.6516421754534587, "compile_time": 229.7063998412341, "verification_time": 0, "benchmark_time": 1212.3435598332435, "edp": 70.87799895579441, "throughput_penalty": 1000000.0, "objective": 1000070.8779989558, "strategy_time": 2.2775321267545223, "framework_time": 45.106422156095505, "timestamp": "2025-02-20 07:48:14.453548+00:00"},
"4,8,32,8,100": {"block_size_x": 4, "block_size_y": 8, "tile_size_x": 32, "tile_size_y": 8, "nvml_pwr_limit": 100, "sm__warps_active.avg.pct_of_peak_sustained_active": 49.44064158755634, "dram__bytes.sum.per_second": 40290117730.07017, "time": 29.954198564801896, "times": [13.957344055175781, 31.35919952392578, 35.600128173828125, 32.65785598754883, 31.727392196655273, 32.3779182434082, 31.99955177307129], "nvml_power": 102.774, "nvml_energy": 3.07851280329895, "compile_time": 239.6653899922967, "verification_time": 0, "benchmark_time": 1384.2272888869047, "edp": 92.21438379430167, "throughput_penalty": 1000000.0, "objective": 1000092.2143837943, "strategy_time": 1.5224609524011612, "framework_time": 44.56032998859882, "timestamp": "2025-02-20 07:48:16.123548+00:00"},
"1,32,32,32,200": {"block_size_x": 1, "block_size_y": 32, "tile_size_x": 32, "tile_size_y": 32, "nvml_pwr_limit": 200, "sm__warps_active.avg.pct_of_peak_sustained_active": 48.731042604727676, "dram__bytes.sum.per_second": 26195641003.682453, "time": 9.106852531433105, "times": [8.951199531555176, 8.93779182434082, 8.921567916870117, 9.19212818145752, 9.248991966247559, 9.248160362243652, 9.248127937316895], "nvml_power": 204.663, "nvml_energy": 1.8638357596406938, "compile_time": 256.02047494612634, "verification_time": 0, "benchmark_time": 1128.5922569222748, "edp": 16.973677405859398, "throughput_penalty": 1000000.0, "objective": 1000016.9736774059, "strategy_time": 17.887925961986184, "framework_time": 41.82585817761719, "timestamp": "2025-02-20 07:48:17.567899+00:00"},
"1,512,32,8,185": {"block_size_x": 1, "block_size_y": 512, "tile_size_x": 32, "tile_size_y": 8, "nvml_pwr_limit": 185, "sm__warps_active.avg.pct_of_peak_sustained_active": 91.6322894200273, "dram__bytes.sum.per_second": 10178769188.458584, "time": 9.827145167759486, "times": [9.544960021972656, 9.587231636047363, 9.58620834350586, 9.985919952392578, 10.04150390625, 10.025919914245605, 10.018272399902344], "nvml_power": 189.662, "nvml_energy": 1.8638360068075996, "compile_time": 240.5693109612912, "verification_time": 0, "benchmark_time": 1133.6255320347846, "edp": 18.31618700779544, "throughput_penalty": 1000000.0, "objective": 1000018.3161870078, "strategy_time": 1.99427199549973, "framework_time": 41.47634794935584, "timestamp": "2025-02-20 07:48:18.985588+00:00"},
"1,32,32,32,215": {"block_size_x": 1, "block_size_y": 32, "tile_size_x": 32, "tile_size_y": 32, "nvml_pwr_limit": 215, "sm__warps_active.avg.pct_of_peak_sustained_active": 48.73642220145488, "dram__bytes.sum.per_second": 25366022518.423355, "time": 8.981673104422432, "times": [9.008543968200684, 8.892959594726562, 8.910688400268555, 8.981760025024414, 8.97555160522461, 9.018239974975586, 9.083968162536621], "nvml_power": 220.098, "nvml_energy": 1.9768482869371684, "compile_time": 236.22258799150586, "verification_time": 0, "benchmark_time": 1116.0458179656416, "edp": 17.755405090307125, "throughput_penalty": 1000000.0, "objective": 1000017.7554050903, "strategy_time": 1.2231520377099514, "framework_time": 45.70284113287926, "timestamp": "2025-02-20 07:48:20.384807+00:00"},
"16,64,8,2,200": {"block_size_x": 16, "block_size_y": 64, "tile_size_x": 8, "tile_size_y": 2, "nvml_pwr_limit": 200, "sm__warps_active.avg.pct_of_peak_sustained_active": 66.11502047572188, "dram__bytes.sum.per_second": 956564108.9497534, "time": 39.1360593523298, "times": [36.23961639404297, 39.4950065612793, 39.584129333496094, 39.552574157714844, 39.739776611328125, 39.64400100708008, 39.69731140136719], "nvml_power": 203.988, "nvml_energy": 7.983286475163053, "compile_time": 249.33956004679203, "verification_time": 0, "benchmark_time": 1382.376535097137, "edp": 312.434373318633, "throughput_penalty": 1000000.0, "objective": 1000312.4343733187, "strategy_time": 16.836676048114896, "framework_time": 40.27338698506355, "timestamp": "2025-02-20 07:48:22.073658+00:00"},
"1,64,32,4,165": {"block_size_x": 1, "block_size_y": 64, "tile_size_x": 32, "tile_size_y": 4, "nvml_pwr_limit": 165, "sm__warps_active.avg.pct_of_peak_sustained_active": 88.57611314889647, "dram__bytes.sum.per_second": 6035572188.300178, "time": 10.220269884381976, "times": [9.846752166748047, 9.559776306152344, 9.670528411865234, 10.674816131591797, 10.476832389831543, 10.700127601623535, 10.613056182861328], "nvml_power": 167.809, "nvml_energy": 1.715053269028255, "compile_time": 234.2438967898488, "verification_time": 0, "benchmark_time": 1149.6194519568235, "edp": 17.528307275560334, "throughput_penalty": 1000000.0, "objective": 1000017.5283072756, "strategy_time": 2.326421905308962, "framework_time": 50.95187737606466, "timestamp": "2025-02-20 07:48:23.510823+00:00"},
"32,32,8,2,200": {"block_size_x": 32, "block_size_y": 32, "tile_size_x": 8, "tile_size_y": 2, "nvml_pwr_limit": 200, "sm__warps_active.avg.pct_of_peak_sustained_active": 66.0663947762332, "dram__bytes.sum.per_second": 516022852.67340255, "time": 39.018039158412385, "times": [39.420928955078125, 38.8776969909668, 38.847198486328125, 39.01491165161133, 38.986080169677734, 38.99001693725586, 38.98944091796875], "nvml_power": 206.262, "nvml_energy": 8.047938792892456, "compile_time": 230.48482299782336, "verification_time": 0, "benchmark_time": 1363.4742619469762, "edp": 314.0147909655839, "throughput_penalty": 1000000.0, "objective": 1000314.0147909656, "strategy_time": 1.6218319069594145, "framework_time": 48.09759417548776, "timestamp": "2025-02-20 07:48:25.154526+00:00"},
"8,128,8,32,250": {"block_size_x": 8, "block_size_y": 128, "tile_size_x": 8, "tile_size_y": 32, "nvml_pwr_limit": 250, "sm__warps_active.avg.pct_of_peak_sustained_active": 66.62602411451202, "dram__bytes.sum.per_second": 30852601731.30666, "time": 48.58104269845145, "times": [48.81769561767578, 48.42940902709961, 48.47196960449219, 48.44892883300781, 48.629791259765625, 48.60976028442383, 48.65974426269531], "nvml_power": 251.578, "nvml_energy": 12.221921559991019, "compile_time": 240.29820202849805, "verification_time": 0, "benchmark_time": 1442.7162979263812, "edp": 593.7536931630481, "throughput_penalty": 1000000.0, "objective": 1000593.753693163, "strategy_time": 31.033990206196904, "framework_time": 45.875761890783906, "timestamp": "2025-02-20 07:48:26.914474+00:00"},
"1,64,16,8,185": {"block_size_x": 1, "block_size_y": 64, "tile_size_x": 16, "tile_size_y": 8, "nvml_pwr_limit": 185, "sm__warps_active.avg.pct_of_peak_sustained_active": 91.51276424243233, "dram__bytes.sum.per_second": 11979539321.561483, "time": 19.62845720563616, "times": [18.62326431274414, 19.581567764282227, 19.863136291503906, 19.852895736694336, 19.882816314697266, 19.75017547607422, 19.84534454345703], "nvml_power": 189.35, "nvml_energy": 3.7166483718872065, "compile_time": 226.4879101421684, "verification_time": 0, "benchmark_time": 1202.9994579497725, "edp": 72.95207351598535, "throughput_penalty": 1000000.0, "objective": 1000072.952073516, "strategy_time": 2.069961978122592, "framework_time": 88.094730861485, "timestamp": "2025-02-20 07:48:28.434150+00:00"},
"4,256,16,32,235": {"block_size_x": 4, "block_size_y": 256, "tile_size_x": 16, "tile_size_y": 32, "nvml_pwr_limit": 235, "sm__warps_active.avg.pct_of_peak_sustained_active": 66.2316110613421, "dram__bytes.sum.per_second": 20013462113.83619, "time": 19.46576472691127, "times": [19.34662437438965, 19.325151443481445, 19.509376525878906, 19.516416549682617, 19.522560119628906, 19.519935607910156, 19.520288467407227], "nvml_power": 237.358, "nvml_energy": 4.620354984050206, "compile_time": 228.6900421604514, "verification_time": 0, "benchmark_time": 1207.1989830583334, "edp": 89.93874307433317, "throughput_penalty": 1000000.0, "objective": 1000089.9387430743, "strategy_time": 1.302171964198351, "framework_time": 49.790925811976194, "timestamp": "2025-02-20 07:48:29.921157+00:00"},
"4,256,32,32,200": {"block_size_x": 4, "block_size_y": 256, "tile_size_x": 32, "tile_size_y": 32, "nvml_pwr_limit": 200, "sm__warps_active.avg.pct_of_peak_sustained_active": 66.04471419505552, "dram__bytes.sum.per_second": 14098753894.080996, "time": 10.285494804382324, "times": [9.856127738952637, 9.974464416503906, 10.235615730285645, 10.323807716369629, 10.537407875061035, 10.534879684448242, 10.536160469055176], "nvml_power": 205.702, "nvml_energy": 2.115746852251053, "compile_time": 253.95096698775887, "verification_time": 0, "benchmark_time": 1156.92755789496, "edp": 21.76150325621646, "throughput_penalty": 1000000.0, "objective": 1000021.7615032562, "strategy_time": 16.845205798745155, "framework_time": 52.52361833117902, "timestamp": "2025-02-20 07:48:31.401429+00:00"},
"2,256,32,32,215": {"block_size_x": 2, "block_size_y": 256, "tile_size_x": 32, "tile_size_y": 32, "nvml_pwr_limit": 215, "sm__warps_active.avg.pct_of_peak_sustained_active": 91.17554200998114, "dram__bytes.sum.per_second": 14461716274.925957, "time": 9.404018129621234, "times": [9.330431938171387, 9.360032081604004, 9.325759887695312, 9.355135917663574, 9.425215721130371, 9.498047828674316, 9.533503532409668], "nvml_power": 218.613, "nvml_energy": 2.055840615370887, "compile_time": 226.08080110512674, "verification_time": 0, "benchmark_time": 1126.8302809912711, "edp": 19.333162418559496, "throughput_penalty": 1000000.0, "objective": 1000019.3331624186, "strategy_time": 2.3671318776905537, "framework_time": 74.31843900121748, "timestamp": "2025-02-20 07:48:32.831050+00:00"},
"2,256,32,32,200": {"block_size_x": 2, "block_size_y": 256, "tile_size_x": 32, "tile_size_y": 32, "nvml_pwr_limit": 200, "sm__warps_active.avg.pct_of_peak_sustained_active": 90.65704103787438, "dram__bytes.sum.per_second": 14420321486.911282, "time": 9.546313285827637, "times": [9.30345630645752, 9.339936256408691, 9.405632019042969, 9.543935775756836, 9.605279922485352, 9.801312446594238, 9.824640274047852], "nvml_power": 204.221, "nvml_energy": 1.9495576455450059, "compile_time": 249.77312283590436, "verification_time": 0, "benchmark_time": 1142.1569171361625, "edp": 18.611088053153136, "throughput_penalty": 1000000.0, "objective": 1000018.6110880532, "strategy_time": 1.5759309753775597, "framework_time": 50.25687790475786, "timestamp": "2025-02-20 07:48:34.274837+00:00"},
"2,16,32,4,150": {"block_size_x": 2, "block_size_y": 16, "tile_size_x": 32, "tile_size_y": 4, "nvml_pwr_limit": 150, "sm__warps_active.avg.pct_of_peak_sustained_active": 49.09790025086972, "dram__bytes.sum.per_second": 13394882602.09493, "time": 10.253705160958427, "times": [9.231424331665039, 9.541376113891602, 9.549375534057617, 10.86195182800293, 10.867679595947266, 10.86838436126709, 10.855744361877441], "nvml_power": 151.762, "nvml_energy": 1.5561228026373728, "compile_time": 251.2932950630784, "verification_time": 0, "benchmark_time": 1177.1145509555936, "edp": 15.95602441248792, "throughput_penalty": 1000000.0, "objective": 1000015.9560244125, "strategy_time": 18.689207965508103, "framework_time": 46.156903030350804, "timestamp": "2025-02-20 07:48:35.768116+00:00"},
"2,512,32,32,200": {"block_size_x": 2, "block_size_y": 512, "tile_size_x": 32, "tile_size_y": 32, "nvml_pwr_limit": 200, "sm__warps_active.avg.pct_of_peak_sustained_active": 65.72860999285868, "dram__bytes.sum.per_second": 15071754639.05302, "time": 9.73946053641183, "times": [9.706815719604492, 9.723711967468262, 9.713279724121094, 9.756928443908691, 9.756287574768066, 9.758720397949219, 9.760479927062988], "nvml_power": 202.384, "nvml_energy": 1.9711109812011716, "compile_time": 224.6692911721766, "verification_time": 0, "benchmark_time": 1125.9641950018704, "edp": 19.197557614296812, "throughput_penalty": 1000000.0, "objective": 1000019.1975576143, "strategy_time": 2.0747720263898373, "framework_time": 45.703691663220525, "timestamp": "2025-02-20 07:48:37.166551+00:00"},
"2,16,32,8,165": {"block_size_x": 2, "block_size_y": 16, "tile_size_x": 32, "tile_size_y": 8, "nvml_pwr_limit": 165, "sm__warps_active.avg.pct_of_peak_sustained_active": 49.10747870662439, "dram__bytes.sum.per_second": 23405254556.534264, "time": 10.01379667009626, "times": [9.25369644165039, 9.266112327575684, 9.621888160705566, 10.258560180664062, 10.438559532165527, 10.64134407043457, 10.616415977478027], "nvml_power": 169.035, "nvml_energy": 1.6926821201297213, "compile_time": 244.9414199218154, "verification_time": 0, "benchmark_time": 1176.4331941958517, "edp": 16.950174578086482, "throughput_penalty": 1000000.0, "objective": 1000016.9501745781, "strategy_time": 1.2962420005351305, "framework_time": 50.82872696220875, "timestamp": "2025-02-20 07:48:38.640075+00:00"},
"4,32,32,8,100": {"block_size_x": 4, "block_size_y": 32, "tile_size_x": 32, "tile_size_y": 8, "nvml_pwr_limit": 100, "sm__warps_active.avg.pct_of_peak_sustained_active": 92.87025341559378, "dram__bytes.sum.per_second": 20779772713.76594, "time": 26.62546730041504, "times": [10.941120147705078, 27.250207901000977, 34.51737594604492, 29.233631134033203, 28.83660888671875, 27.948223114013672, 27.651103973388672], "nvml_power": 102.198, "nvml_energy": 2.721069507167816, "compile_time": 244.78059983812273, "verification_time": 0, "benchmark_time": 1342.7056819200516, "edp": 72.44974718525316, "throughput_penalty": 1000000.0, "objective": 1000072.4497471852, "strategy_time": 43.35482092574239, "framework_time": 44.2910713609308, "timestamp": "2025-02-20 07:48:40.315232+00:00"},
"2,16,32,16,200": {"block_size_x": 2, "block_size_y": 16, "tile_size_x": 32, "tile_size_y": 16, "nvml_pwr_limit": 200, "sm__warps_active.avg.pct_of_peak_sustained_active": 49.10471630693723, "dram__bytes.sum.per_second": 33993020326.40643, "time": 9.598573820931572, "times": [9.273183822631836, 9.297632217407227, 9.259679794311523, 9.822272300720215, 9.856160163879395, 9.848320007324219, 9.832768440246582], "nvml_power": 204.832, "nvml_energy": 1.9660950728890556, "compile_time": 225.54094204679132, "verification_time": 0, "benchmark_time": 1145.8750979509205, "edp": 18.87170869609544, "throughput_penalty": 1000000.0, "objective": 1000018.8717086961, "strategy_time": 2.359142992645502, "framework_time": 45.025461819022894, "timestamp": "2025-02-20 07:48:41.734056+00:00"},
"4,16,32,2,135": {"block_size_x": 4, "block_size_y": 16, "tile_size_x": 32, "tile_size_y": 2, "nvml_pwr_limit": 135, "sm__warps_active.avg.pct_of_peak_sustained_active": 94.97215634815247, "dram__bytes.sum.per_second": 12420873679.251188, "time": 14.444219725472587, "times": [9.928607940673828, 10.015520095825195, 14.945664405822754, 16.61952018737793, 16.916959762573242, 16.552640914916992, 16.130624771118164], "nvml_power": 139.293, "nvml_energy": 2.011978698220253, "compile_time": 247.70561303012073, "verification_time": 0, "benchmark_time": 1313.6752089485526, "edp": 29.06146240006364, "throughput_penalty": 1000000.0, "objective": 1000029.0614624, "strategy_time": 1.5761309769004583, "framework_time": 54.349001962691545, "timestamp": "2025-02-20 07:48:43.351386+00:00"},
"2,256,16,8,200": {"block_size_x": 2, "block_size_y": 256, "tile_size_x": 16, "tile_size_y": 8, "nvml_pwr_limit": 200, "sm__warps_active.avg.pct_of_peak_sustained_active": 90.93451570297178, "dram__bytes.sum.per_second": 21371559681.52934, "time": 19.302715301513672, "times": [18.258560180664062, 19.62236785888672, 19.536224365234375, 19.433088302612305, 19.433727264404297, 19.42323112487793, 19.411808013916016], "nvml_power": 204.991, "nvml_energy": 3.9568829123725897, "compile_time": 252.10933783091605, "verification_time": 0, "benchmark_time": 1209.391692187637, "edp": 76.37858433895236, "throughput_penalty": 1000000.0, "objective": 1000076.3785843389, "strategy_time": 17.780255991965532, "framework_time": 45.22915300913155, "timestamp": "2025-02-20 07:48:44.875921+00:00"},
"1,32,32,8,165": {"block_size_x": 1, "block_size_y": 32, "tile_size_x": 32, "tile_size_y": 8, "nvml_pwr_limit": 165, "sm__warps_active.avg.pct_of_peak_sustained_active": 48.80142675250441, "dram__bytes.sum.per_second": 12145135158.181974, "time": 9.358569145202637, "times": [8.956128120422363, 9.01801586151123, 9.147295951843262, 9.404352188110352, 9.469120025634766, 9.738368034362793, 9.776703834533691], "nvml_power": 168.618, "nvml_energy": 1.5780232121257782, "compile_time": 230.29844812117517, "verification_time": 0, "benchmark_time": 1154.770001070574, "edp": 14.768039343413863, "throughput_penalty": 1000000.0, "objective": 1000014.7680393434, "strategy_time": 2.070422051474452, "framework_time": 48.36297477595508, "timestamp": "2025-02-20 07:48:46.311447+00:00"},
"1,512,32,4,185": {"block_size_x": 1, "block_size_y": 512, "tile_size_x": 32, "tile_size_y": 4, "nvml_pwr_limit": 185, "sm__warps_active.avg.pct_of_peak_sustained_active": 91.58000930023107, "dram__bytes.sum.per_second": 9817203045.837654, "time": 9.788507325308663, "times": [9.571871757507324, 9.5731840133667, 9.70083236694336, 9.769824028015137, 9.8984956741333, 9.975071907043457, 10.030271530151367], "nvml_power": 191.042, "nvml_energy": 1.8700160164416175, "compile_time": 239.26031705923378, "verification_time": 0, "benchmark_time": 1155.9387838933617, "edp": 18.3046654753833, "throughput_penalty": 1000000.0, "objective": 1000018.3046654754, "strategy_time": 1.2873809318989515, "framework_time": 53.53897111490369, "timestamp": "2025-02-20 07:48:47.761497+00:00"},
"8,8,16,2,150": {"block_size_x": 8, "block_size_y": 8, "tile_size_x": 16, "tile_size_y": 2, "nvml_pwr_limit": 150, "sm__warps_active.avg.pct_of_peak_sustained_active": 97.59027507916016, "dram__bytes.sum.per_second": 17758470406.298325, "time": 40.180018288748606, "times": [37.738399505615234, 40.60163116455078, 40.49683380126953, 40.70383834838867, 40.578590393066406, 40.48835372924805, 40.65248107910156], "nvml_power": 153.584, "nvml_energy": 6.171007928859166, "compile_time": 254.27587097510695, "verification_time": 0, "benchmark_time": 1388.0658270791173, "edp": 247.95121144157395, "throughput_penalty": 1000000.0, "objective": 1000247.9512114415, "strategy_time": 21.808141143992543, "framework_time": 41.90392862074077, "timestamp": "2025-02-20 07:48:49.467575+00:00"},
"2,16,32,2,150": {"block_size_x": 2, "block_size_y": 16, "tile_size_x": 32, "tile_size_y": 2, "nvml_pwr_limit": 150, "sm__warps_active.avg.pct_of_peak_sustained_active": 49.10133642860811, "dram__bytes.sum.per_second": 8002402852.866929, "time": 10.165577207292829, "times": [9.185664176940918, 9.724255561828613, 10.158432006835938, 10.388031959533691, 10.582112312316895, 10.584192276000977, 10.536352157592773], "nvml_power": 153.721, "nvml_energy": 1.562662693882261, "compile_time": 224.89966312423348, "verification_time": 0, "benchmark_time": 1158.268460072577, "edp": 15.885368263616323, "throughput_penalty": 1000000.0, "objective": 1000015.8853682636, "strategy_time": 2.382652135565877, "framework_time": 0.5178607534617186, "timestamp": "2025-02-20 07:48:50.853667+00:00"},
"2,16,32,2,135": {"block_size_x": 2, "block_size_y": 16, "tile_size_x": 32, "tile_size_y": 2, "nvml_pwr_limit": 135, "sm__warps_active.avg.pct_of_peak_sustained_active": 49.09282535277754, "dram__bytes.sum.per_second": 8357074414.893433, "time": 10.473906108311244, "times": [9.361248016357422, 9.668895721435547, 10.124383926391602, 10.892895698547363, 10.99728012084961, 11.132831573486328, 11.13980770111084], "nvml_power": 137.958, "nvml_energy": 1.4449591388904026, "compile_time": 240.74919801205397, "verification_time": 0, "benchmark_time": 1203.4863338340074, "edp": 15.134366351084344, "throughput_penalty": 1000000.0, "objective": 1000015.1343663511, "strategy_time": 1.568581210449338, "framework_time": 52.35023074783385, "timestamp": "2025-02-20 07:48:52.351845+00:00"},
"2,32,32,32,200": {"block_size_x": 2, "block_size_y": 32, "tile_size_x": 32, "tile_size_y": 32, "nvml_pwr_limit": 200, "sm__warps_active.avg.pct_of_peak_sustained_active": 92.64632754749476, "dram__bytes.sum.per_second": 34207940082.138783, "time": 9.98551777430943, "times": [9.277152061462402, 9.335712432861328, 9.480799674987793, 10.509984016418457, 10.408960342407227, 10.455455780029297, 10.430560111999512], "nvml_power": 203.178, "nvml_energy": 2.0288375303486412, "compile_time": 265.41216182522476, "verification_time": 0, "benchmark_time": 1162.011575885117, "edp": 20.258993220482406, "throughput_penalty": 1000000.0, "objective": 1000020.2589932205, "strategy_time": 18.717457074671984, "framework_time": 43.95767441019416, "timestamp": "2025-02-20 07:48:53.841968+00:00"},
"2,32,16,2,165": {"block_size_x": 2, "block_size_y": 32, "tile_size_x": 16, "tile_size_y": 2, "nvml_pwr_limit": 165, "sm__warps_active.avg.pct_of_peak_sustained_active": 95.13020008606743, "dram__bytes.sum.per_second": 13497487437.18593, "time": 21.19298771449498, "times": [18.948863983154297, 21.308128356933594, 21.583776473999023, 21.64614486694336, 21.642528533935547, 21.579391479492188, 21.642080307006836], "nvml_power": 167.956, "nvml_energy": 3.5594894445757186, "compile_time": 227.8658370487392, "verification_time": 0, "benchmark_time": 1249.2559310048819, "edp": 75.43621606876776, "throughput_penalty": 1000000.0, "objective": 1000075.4362160688, "strategy_time": 2.0646019838750362, "framework_time": 44.074721867218614, "timestamp": "2025-02-20 07:48:55.365252+00:00"},
"2,64,32,32,200": {"block_size_x": 2, "block_size_y": 64, "tile_size_x": 32, "tile_size_y": 32, "nvml_pwr_limit": 200, "sm__warps_active.avg.pct_of_peak_sustained_active": 95.4595989476239, "dram__bytes.sum.per_second": 22219400808.82555, "time": 9.757549694606237, "times": [9.274880409240723, 9.313887596130371, 9.510368347167969, 10.030207633972168, 10.045087814331055, 10.057984352111816, 10.07043170928955], "nvml_power": 204.838, "nvml_energy": 1.9987169643437521, "compile_time": 238.85443806648254, "verification_time": 0, "benchmark_time": 1152.3585298564285, "edp": 19.50258010503668, "throughput_penalty": 1000000.0, "objective": 1000019.5025801051, "strategy_time": 1.3208419550210238, "framework_time": 47.04354517161846, "timestamp": "2025-02-20 07:48:56.804853+00:00"},
"4,8,16,8,215": {"block_size_x": 4, "block_size_y": 8, "tile_size_x": 16, "tile_size_y": 8, "nvml_pwr_limit": 215, "sm__warps_active.avg.pct_of_peak_sustained_active": 49.76306769315695, "dram__bytes.sum.per_second": 34269666914.08579, "time": 21.077161243983678, "times": [20.230815887451172, 20.50864028930664, 21.273439407348633, 21.389440536499023, 21.386240005493164, 21.370176315307617, 21.381376266479492], "nvml_power": 220.188, "nvml_energy": 4.6409379799902775, "compile_time": 250.74159912765026, "verification_time": 0, "benchmark_time": 1230.458966922015, "edp": 97.81779812758298, "throughput_penalty": 1000000.0, "objective": 1000097.8177981275, "strategy_time": 20.314968889579177, "framework_time": 45.47368409112096, "timestamp": "2025-02-20 07:48:58.351867+00:00"},
"2,32,32,2,135": {"block_size_x": 2, "block_size_y": 32, "tile_size_x": 32, "tile_size_y": 2, "nvml_pwr_limit": 135, "sm__warps_active.avg.pct_of_peak_sustained_active": 92.6737796384383, "dram__bytes.sum.per_second": 8130689937.429765, "time": 11.271862983703613, "times": [9.471872329711914, 9.683808326721191, 10.616064071655273, 11.201120376586914, 12.649503707885742, 12.743167877197266, 12.537504196166992], "nvml_power": 137.846, "nvml_energy": 1.5537812248516083, "compile_time": 233.270833035931, "verification_time": 0, "benchmark_time": 1255.6273019872606, "edp": 17.514009073178503, "throughput_penalty": 1000000.0, "objective": 1000017.5140090731, "strategy_time": 2.3756229784339666, "framework_time": 64.11605095490813, "timestamp": "2025-02-20 07:48:59.907280+00:00"},
"2,16,32,4,100": {"block_size_x": 2, "block_size_y": 16, "tile_size_x": 32, "tile_size_y": 4, "nvml_pwr_limit": 100, "sm__warps_active.avg.pct_of_peak_sustained_active": 49.10483893213326, "dram__bytes.sum.per_second": 13161156838.308554, "time": 17.762724467686244, "times": [9.466752052307129, 14.569439888000488, 20.58086395263672, 21.48089599609375, 19.890304565429688, 19.31782341003418, 19.032991409301758], "nvml_power": 103.371, "nvml_energy": 1.8361505909491946, "compile_time": 233.2347841002047, "verification_time": 0, "benchmark_time": 1301.3514990452677, "edp": 32.61503702820981, "throughput_penalty": 1000000.0, "objective": 1000032.6150370282, "strategy_time": 1.6122108791023493, "framework_time": 52.94711096212268, "timestamp": "2025-02-20 07:49:01.496451+00:00"},
"1,1024,32,32,215": {"block_size_x": 1, "block_size_y": 1024, "tile_size_x": 32, "tile_size_y": 32, "nvml_pwr_limit": 215, "sm__warps_active.avg.pct_of_peak_sustained_active": 65.856741115871, "dram__bytes.sum.per_second": 16608335857.514994, "time": 10.67470645904541, "times": [10.55510425567627, 10.58944034576416, 10.666080474853516, 10.761504173278809, 10.73414421081543, 10.723679542541504, 10.692992210388184], "nvml_power": 218.355, "nvml_energy": 2.3308755288648606, "compile_time": 256.1460661236197, "verification_time": 0, "benchmark_time": 1122.2194868605584, "edp": 24.881412063204614, "throughput_penalty": 1000000.0, "objective": 1000024.8814120633, "strategy_time": 17.493495950475335, "framework_time": 45.721454080194235, "timestamp": "2025-02-20 07:49:02.938056+00:00"},
"2,32,32,4,150": {"block_size_x": 2, "block_size_y": 32, "tile_size_x": 32, "tile_size_y": 4, "nvml_pwr_limit": 150, "sm__warps_active.avg.pct_of_peak_sustained_active": 92.97107287641848, "dram__bytes.sum.per_second": 11873440865.4279, "time": 10.753449167524066, "times": [9.185152053833008, 10.059231758117676, 10.050559997558594, 11.50819206237793, 11.5315523147583, 11.527008056640625, 11.412447929382324], "nvml_power": 154.206, "nvml_energy": 1.658246382327216, "compile_time": 237.5804882030934, "verification_time": 0, "benchmark_time": 1185.7080899644643, "edp": 17.831868179586394, "throughput_penalty": 1000000.0, "objective": 1000017.8318681796, "strategy_time": 2.077822107821703, "framework_time": 50.52458983846009, "timestamp": "2025-02-20 07:49:04.413971+00:00"},
"2,512,32,32,215": {"block_size_x": 2, "block_size_y": 512, "tile_size_x": 32, "tile_size_y": 32, "nvml_pwr_limit": 215, "sm__warps_active.avg.pct_of_peak_sustained_active": 65.72648968824896, "dram__bytes.sum.per_second": 14986171830.920855, "time": 9.700735909598214, "times": [9.69264030456543, 9.700063705444336, 9.710335731506348, 9.699295997619629, 9.697407722473145, 9.70479965209961, 9.700608253479004], "nvml_power": 214.158, "nvml_energy": 2.077490200927734, "compile_time": 233.72672405093908, "verification_time": 0, "benchmark_time": 1110.523529117927, "edp": 20.153183793978076, "throughput_penalty": 1000000.0, "objective": 1000020.153183794, "strategy_time": 1.3452910352498293, "framework_time": 48.16646780818701, "timestamp": "2025-02-20 07:49:05.807757+00:00"},
"1,128,32,2,165": {"block_size_x": 1, "block_size_y": 128, "tile_size_x": 32, "tile_size_y": 2, "nvml_pwr_limit": 165, "sm__warps_active.avg.pct_of_peak_sustained_active": 93.36180224357071, "dram__bytes.sum.per_second": 5858172929.441662, "time": 10.754107475280762, "times": [10.160544395446777, 10.510687828063965, 10.707136154174805, 10.84886360168457, 10.808544158935547, 11.120096206665039, 11.122879981994629], "nvml_power": 167.791, "nvml_energy": 1.8044424473848342, "compile_time": 252.7500840369612, "verification_time": 0, "benchmark_time": 1146.3971249759197, "edp": 19.405168012135157, "throughput_penalty": 1000000.0, "objective": 1000019.4051680121, "strategy_time": 18.4104279614985, "framework_time": 40.353887947276235, "timestamp": "2025-02-20 07:49:07.265693+00:00"},
"1,64,32,2,165": {"block_size_x": 1, "block_size_y": 64, "tile_size_x": 32, "tile_size_y": 2, "nvml_pwr_limit": 165, "sm__warps_active.avg.pct_of_peak_sustained_active": 88.28683181871293, "dram__bytes.sum.per_second": 4592247949.624523, "time": 10.224703788757324, "times": [9.54700756072998, 10.00175952911377, 10.139679908752441, 10.407072067260742, 10.57151985168457, 10.457183837890625, 10.44870376586914], "nvml_power": 166.963, "nvml_energy": 1.7071472186822891, "compile_time": 245.9983869921416, "verification_time": 0, "benchmark_time": 1146.8153879977763, "edp": 17.45507463482733, "throughput_penalty": 1000000.0, "objective": 1000017.4550746349, "strategy_time": 2.2717220708727837, "framework_time": 0.5434008780866861, "timestamp": "2025-02-20 07:49:08.661346+00:00"},
"1,128,32,4,165": {"block_size_x": 1, "block_size_y": 128, "tile_size_x": 32, "tile_size_y": 4, "nvml_pwr_limit": 165, "sm__warps_active.avg.pct_of_peak_sustained_active": 93.25537803824128, "dram__bytes.sum.per_second": 4853246781.949237, "time": 10.587250300816127, "times": [9.999551773071289, 9.991264343261719, 10.498720169067383, 10.671648025512695, 10.960288047790527, 10.929023742675781, 11.060256004333496], "nvml_power": 168.076, "nvml_energy": 1.7794626815599712, "compile_time": 240.0966810528189, "verification_time": 0, "benchmark_time": 1164.0649458859116, "edp": 18.839616810636876, "throughput_penalty": 1000000.0, "objective": 1000018.8396168107, "strategy_time": 1.529481029137969, "framework_time": 0.525331124663353, "timestamp": "2025-02-20 07:49:10.067586+00:00"},
"1,1024,32,32,200": {"block_size_x": 1, "block_size_y": 1024, "tile_size_x": 32, "tile_size_y": 32, "nvml_pwr_limit": 200, "sm__warps_active.avg.pct_of_peak_sustained_active": 65.87952867435449, "dram__bytes.sum.per_second": 16060036436.905033, "time": 10.825193268912178, "times": [10.598848342895508, 10.592032432556152, 10.696127891540527, 10.888192176818848, 10.934207916259766, 11.06163215637207, 11.005311965942383], "nvml_power": 203.696, "nvml_energy": 2.205048568104335, "compile_time": 251.0665829759091, "verification_time": 0, "benchmark_time": 1136.5038501098752, "edp": 23.870076917067482, "throughput_penalty": 1000000.0, "objective": 1000023.8700769171, "strategy_time": 18.612978048622608, "framework_time": 50.315128872171044, "timestamp": "2025-02-20 07:49:11.524109+00:00"},
"4,16,32,4,100": {"block_size_x": 4, "block_size_y": 16, "tile_size_x": 32, "tile_size_y": 4, "nvml_pwr_limit": 100, "sm__warps_active.avg.pct_of_peak_sustained_active": 95.2304112205598, "dram__bytes.sum.per_second": 17614094683.310833, "time": 25.345302854265487, "times": [14.424320220947266, 22.7838077545166, 28.924415588378906, 28.244415283203125, 27.352479934692383, 28.257600784301758, 27.43008041381836], "nvml_power": 102.636, "nvml_energy": 2.6013405037503925, "compile_time": 230.16894306056201, "verification_time": 0, "benchmark_time": 1362.888669827953, "edp": 65.93176289462124, "throughput_penalty": 1000000.0, "objective": 1000065.9317628946, "strategy_time": 2.1270320285111666, "framework_time": 46.857376117259264, "timestamp": "2025-02-20 07:49:13.166174+00:00"},
"2,32,32,8,165": {"block_size_x": 2, "block_size_y": 32, "tile_size_x": 32, "tile_size_y": 8, "nvml_pwr_limit": 165, "sm__warps_active.avg.pct_of_peak_sustained_active": 92.73060978985546, "dram__bytes.sum.per_second": 14850273466.78142, "time": 10.300347464425224, "times": [9.316991806030273, 9.309408187866211, 9.755647659301758, 10.810336112976074, 10.916128158569336, 10.978848457336426, 11.015071868896484], "nvml_power": 167.461, "nvml_energy": 1.7249064867401125, "compile_time": 246.95715005509555, "verification_time": 0, "benchmark_time": 1189.3120650202036, "edp": 17.76713615706414, "throughput_penalty": 1000000.0, "objective": 1000017.767136157, "strategy_time": 1.3514310121536255, "framework_time": 46.173503855243325, "timestamp": "2025-02-20 07:49:14.649993+00:00"},
"1,32,32,16,200": {"block_size_x": 1, "block_size_y": 32, "tile_size_x": 32, "tile_size_y": 16, "nvml_pwr_limit": 200, "sm__warps_active.avg.pct_of_peak_sustained_active": 48.8514219293423, "dram__bytes.sum.per_second": 16025385480.587154, "time": 9.036754199436732, "times": [8.981599807739258, 8.99731159210205, 8.98857593536377, 9.039936065673828, 9.115327835083008, 9.041888236999512, 9.092639923095703], "nvml_power": 203.715, "nvml_energy": 1.8409223817382538, "compile_time": 252.19795480370522, "verification_time": 0, "benchmark_time": 1115.4491330962628, "edp": 16.635963064010237, "throughput_penalty": 1000000.0, "objective": 1000016.635963064, "strategy_time": 18.112018005922437, "framework_time": 52.65290103852749, "timestamp": "2025-02-20 07:49:16.088428+00:00"},
"2,128,32,32,200": {"block_size_x": 2, "block_size_y": 128, "tile_size_x": 32, "tile_size_y": 32, "nvml_pwr_limit": 200, "sm__warps_active.avg.pct_of_peak_sustained_active": 93.9812673244592, "dram__bytes.sum.per_second": 17913249638.569473, "time": 9.459542955671038, "times": [9.08409595489502, 9.10972785949707, 9.40777587890625, 9.413408279418945, 9.70844841003418, 9.740447998046875, 9.752896308898926], "nvml_power": 200.738, "nvml_energy": 1.8988897338354929, "compile_time": 231.99828597716987, "verification_time": 0, "benchmark_time": 1141.8047710321844, "edp": 17.96262900529959, "throughput_penalty": 1000000.0, "objective": 1000017.9626290053, "strategy_time": 2.3460821248590946, "framework_time": 0.536670908331871, "timestamp": "2025-02-20 07:49:17.465139+00:00"},
"1,32,32,16,185": {"block_size_x": 1, "block_size_y": 32, "tile_size_x": 32, "tile_size_y": 16, "nvml_pwr_limit": 185, "sm__warps_active.avg.pct_of_peak_sustained_active": 48.871742352773865, "dram__bytes.sum.per_second": 16221512865.843075, "time": 9.176383972167969, "times": [8.947168350219727, 8.980287551879883, 9.049823760986328, 9.23583984375, 9.217023849487305, 9.3853120803833, 9.419232368469238], "nvml_power": 188.176, "nvml_energy": 1.7267752303466797, "compile_time": 244.64724794961512, "verification_time": 0, "benchmark_time": 1141.9224119745195, "edp": 15.845552547289923, "throughput_penalty": 1000000.0, "objective": 1000015.8455525473, "strategy_time": 1.57383200712502, "framework_time": 52.85856197588146, "timestamp": "2025-02-20 07:49:18.906165+00:00"},
"1,64,32,16,185": {"block_size_x": 1, "block_size_y": 64, "tile_size_x": 32, "tile_size_y": 16, "nvml_pwr_limit": 185, "sm__warps_active.avg.pct_of_peak_sustained_active": 88.27876558886909, "dram__bytes.sum.per_second": 12673992384.935587, "time": 10.401887893676758, "times": [9.82806396484375, 10.376704216003418, 10.360223770141602, 10.458463668823242, 10.642271995544434, 10.562848091125488, 10.584639549255371], "nvml_power": 186.316, "nvml_energy": 1.9380381447982789, "compile_time": 253.56229697354138, "verification_time": 0, "benchmark_time": 1146.6810889542103, "edp": 20.15925551586098, "throughput_penalty": 1000000.0, "objective": 1000020.1592555159, "strategy_time": 18.962217960506678, "framework_time": 0.5605812184512615, "timestamp": "2025-02-20 07:49:20.325955+00:00"},
"1,64,32,32,200": {"block_size_x": 1, "block_size_y": 64, "tile_size_x": 32, "tile_size_y": 32, "nvml_pwr_limit": 200, "sm__warps_active.avg.pct_of_peak_sustained_active": 88.4184882394286, "dram__bytes.sum.per_second": 20891202525.2011, "time": 10.529805864606585, "times": [10.14022445678711, 10.311424255371094, 10.568639755249023, 10.686528205871582, 10.72326374053955, 10.740544319152832, 10.538016319274902], "nvml_power": 204.813, "nvml_energy": 2.1566411285476685, "compile_time": 230.42717506177723, "verification_time": 0, "benchmark_time": 1136.3650099374354, "edp": 22.709012403233004, "throughput_penalty": 1000000.0, "objective": 1000022.7090124033, "strategy_time": 2.069801790639758, "framework_time": 45.2858442440629, "timestamp": "2025-02-20 07:49:21.740127+00:00"},
"2,16,32,4,135": {"block_size_x": 2, "block_size_y": 16, "tile_size_x": 32, "tile_size_y": 4, "nvml_pwr_limit": 135, "sm__warps_active.avg.pct_of_peak_sustained_active": 49.09041620010788, "dram__bytes.sum.per_second": 13709504577.933071, "time": 10.774916648864746, "times": [9.21014404296875, 9.183679580688477, 10.501312255859375, 11.07795238494873, 11.861856460571289, 11.927647590637207, 11.661824226379395], "nvml_power": 139.561, "nvml_energy": 1.5037581424322128, "compile_time": 238.208212191239, "verification_time": 0, "benchmark_time": 1216.4094489999115, "edp": 16.202868644758773, "throughput_penalty": 1000000.0, "objective": 1000016.2028686447, "strategy_time": 1.3206610456109047, "framework_time": 53.81023371592164, "timestamp": "2025-02-20 07:49:23.249899+00:00"},
