experiments/data/depr/power_tuning_float64.json
{
"device_name": "NVIDIA RTX 5000 Ada Generation",
"kernel_name": "tuned_matmul<double>",
"problem_size": [
4096,
4096
],
"tune_params_keys": [
"block_size_x",
"block_size_y",
"tile_size_x",
"tile_size_y"
],
"tune_params": {
"block_size_x": [
1,
2,
4,
8,
16,
32,
64,
128
],
"block_size_y": [
16,
32,
64,
128
],
"tile_size_x": [
1,
2,
4
],
"tile_size_y": [
1,
2,
4
]
},
"objective": "time",
"cache": {
"1,32,1,1": {"block_size_x": 1, "block_size_y": 32, "tile_size_x": 1, "tile_size_y": 1, "sm__warps_active.avg.pct_of_peak_sustained_active": 49.95787436515461, "sm__maximum_warps_per_active_cycle_pct": 49.95787436515461, "time": 948.0045601981027, "times": [946.8070678710938, 947.15380859375, 946.1134033203125, 946.7744750976562, 946.7125854492188, 949.1689453125, 953.3016357421875], "nvml_power": 114.724, "nvml_energy": 108.75887516416714, "compile_time": 251.02649303153157, "verification_time": 0, "benchmark_time": 9516.468766028993, "edp": 103103.90961764663, "flops_watt": 1263703.3369878223, "occupancy": 49.95787436515461, "strategy_time": 0, "framework_time": 0, "timestamp": "2025-02-18 02:12:23.221740+00:00"},
"1,32,1,2": {"block_size_x": 1, "block_size_y": 32, "tile_size_x": 1, "tile_size_y": 2, "sm__warps_active.avg.pct_of_peak_sustained_active": 49.957446613058266, "sm__maximum_warps_per_active_cycle_pct": 49.957446613058266, "time": 946.3008946010044, "times": [944.4544067382812, 945.0762329101562, 944.25927734375, 943.7696533203125, 945.34619140625, 948.907958984375, 952.2925415039062], "nvml_power": 114.922, "nvml_energy": 108.75079140933663, "compile_time": 267.09790097083896, "verification_time": 0, "benchmark_time": 9506.01860799361, "edp": 102910.97119922248, "flops_watt": 1263797.2716417436, "occupancy": 49.957446613058266, "strategy_time": 0, "framework_time": 0.4013699945062399, "timestamp": "2025-02-18 02:12:32.995284+00:00"},
"1,32,1,4": {"block_size_x": 1, "block_size_y": 32, "tile_size_x": 1, "tile_size_y": 4, "sm__warps_active.avg.pct_of_peak_sustained_active": 49.95757890084278, "sm__maximum_warps_per_active_cycle_pct": 49.95757890084278, "time": 947.712140764509, "times": [940.7015380859375, 945.6758422851562, 947.3950805664062, 949.9881591796875, 947.2498168945312, 951.8377685546875, 951.1367797851562], "nvml_power": 114.954, "nvml_energy": 108.94330142944335, "compile_time": 265.9569410607219, "verification_time": 0, "benchmark_time": 9504.699542070739, "edp": 103246.88941965095, "flops_watt": 1261564.0582639377, "occupancy": 49.95757890084278, "strategy_time": 0, "framework_time": 0.3980898763984442, "timestamp": "2025-02-18 02:12:42.766364+00:00"},
"1,32,2,1": {"block_size_x": 1, "block_size_y": 32, "tile_size_x": 2, "tile_size_y": 1, "sm__warps_active.avg.pct_of_peak_sustained_active": 49.91630675186015, "sm__maximum_warps_per_active_cycle_pct": 49.91630675186015, "time": 558.6103777204241, "times": [573.9948120117188, 536.1503295898438, 579.88916015625, 546.12890625, 565.0286865234375, 558.0908813476562, 550.9898681640625], "nvml_power": 115.374, "nvml_energy": 64.44911371911621, "compile_time": 270.7411869196221, "verification_time": 0, "benchmark_time": 5565.215494018048, "edp": 36001.943758382076, "flops_watt": 2132518.9058609866, "occupancy": 49.91630675186015, "strategy_time": 0, "framework_time": 0.40579005144536495, "timestamp": "2025-02-18 02:12:48.602753+00:00"},
"1,32,2,2": {"block_size_x": 1, "block_size_y": 32, "tile_size_x": 2, "tile_size_y": 2, "sm__warps_active.avg.pct_of_peak_sustained_active": 49.91742209144557, "sm__maximum_warps_per_active_cycle_pct": 49.91742209144557, "time": 566.2452218191964, "times": [576.47021484375, 545.0202026367188, 589.087890625, 549.7583618164062, 576.8726806640625, 566.8775634765625, 559.629638671875], "nvml_power": 114.448, "nvml_energy": 64.8056331467634, "compile_time": 261.3691450096667, "verification_time": 0, "benchmark_time": 5635.827035992406, "edp": 36695.88011632251, "flops_watt": 2120787.141462627, "occupancy": 49.91742209144557, "strategy_time": 0, "framework_time": 0.4096599295735359, "timestamp": "2025-02-18 02:12:54.500385+00:00"},
"1,32,2,4": {"block_size_x": 1, "block_size_y": 32, "tile_size_x": 2, "tile_size_y": 4, "sm__warps_active.avg.pct_of_peak_sustained_active": 49.91767174751287, "sm__maximum_warps_per_active_cycle_pct": 49.91767174751287, "time": 556.3557913643973, "times": [565.5564575195312, 534.7469482421875, 576.91943359375, 541.89892578125, 568.731201171875, 550.6986694335938, 555.9389038085938], "nvml_power": 115.05, "nvml_energy": 64.0087337964739, "compile_time": 268.04339000955224, "verification_time": 0, "benchmark_time": 5544.669771916233, "edp": 35611.62974557028, "flops_watt": 2147190.6304069273, "occupancy": 49.91767174751287, "strategy_time": 0, "framework_time": 0.4212300991639495, "timestamp": "2025-02-18 02:13:00.313544+00:00"},
"1,32,4,1": {"block_size_x": 1, "block_size_y": 32, "tile_size_x": 4, "tile_size_y": 1, "sm__warps_active.avg.pct_of_peak_sustained_active": 49.8320600663896, "sm__maximum_warps_per_active_cycle_pct": 49.8320600663896, "time": 327.6738804408482, "times": [308.2144775390625, 334.2781066894531, 338.595703125, 314.0482177734375, 340.6898193359375, 340.57220458984375, 317.3186340332031], "nvml_power": 114.151, "nvml_energy": 37.404301126203265, "compile_time": 263.5210530133918, "verification_time": 0, "benchmark_time": 3909.268917981535, "edp": 12256.412495201013, "flops_watt": 3674415.757917164, "occupancy": 49.8320600663896, "strategy_time": 0, "framework_time": 0.4193700151517987, "timestamp": "2025-02-18 02:13:04.486780+00:00"},
"1,32,4,2": {"block_size_x": 1, "block_size_y": 32, "tile_size_x": 4, "tile_size_y": 2, "sm__warps_active.avg.pct_of_peak_sustained_active": 49.83251631509204, "sm__maximum_warps_per_active_cycle_pct": 49.83251631509204, "time": 328.3653564453125, "times": [308.8422546386719, 335.4421081542969, 342.3623962402344, 313.53424072265625, 341.81396484375, 338.11334228515625, 318.4491882324219], "nvml_power": 114.867, "nvml_energy": 37.71834339880371, "compile_time": 269.54706909600645, "verification_time": 0, "benchmark_time": 3931.405200040899, "edp": 12385.39727467488, "flops_watt": 3643822.6360800103, "occupancy": 49.83251631509204, "strategy_time": 0, "framework_time": 0.39875879883766174, "timestamp": "2025-02-18 02:13:08.688155+00:00"},
"1,32,4,4": {"block_size_x": 1, "block_size_y": 32, "tile_size_x": 4, "tile_size_y": 4, "sm__warps_active.avg.pct_of_peak_sustained_active": 49.83266022494135, "sm__maximum_warps_per_active_cycle_pct": 49.83266022494135, "time": 326.672372000558, "times": [305.30743408203125, 332.75811767578125, 342.96697998046875, 312.8664245605469, 337.8951110839844, 338.94873046875, 315.96380615234375], "nvml_power": 114.486, "nvml_energy": 37.39941318085589, "compile_time": 268.60714808572084, "verification_time": 0, "benchmark_time": 3900.4428659100085, "edp": 12217.355015219127, "flops_watt": 3674895.9885379327, "occupancy": 49.83266022494135, "strategy_time": 0, "framework_time": 0.40214997716248035, "timestamp": "2025-02-18 02:13:12.857633+00:00"},
"1,64,1,1": {"block_size_x": 1, "block_size_y": 64, "tile_size_x": 1, "tile_size_y": 1, "sm__warps_active.avg.pct_of_peak_sustained_active": 98.84540865131811, "sm__maximum_warps_per_active_cycle_pct": 98.84540865131811, "time": 878.6420811244419, "times": [871.283203125, 879.478759765625, 885.1341552734375, 882.79345703125, 883.8031616210938, 877.5010986328125, 870.500732421875], "nvml_power": 115.178, "nvml_energy": 101.20023761975096, "compile_time": 251.9630929455161, "verification_time": 0, "benchmark_time": 8802.266379934736, "edp": 88918.78739250603, "flops_watt": 1358089.2367902547, "occupancy": 98.84540865131811, "strategy_time": 0, "framework_time": 0.39678020402789116, "timestamp": "2025-02-18 02:13:21.912285+00:00"},
"1,64,1,2": {"block_size_x": 1, "block_size_y": 64, "tile_size_x": 1, "tile_size_y": 2, "sm__warps_active.avg.pct_of_peak_sustained_active": 98.78277146643882, "sm__maximum_warps_per_active_cycle_pct": 98.78277146643882, "time": 864.9754289899554, "times": [853.484619140625, 869.76513671875, 873.5084838867188, 872.7384643554688, 869.0587768554688, 857.0419921875, 859.2305297851562], "nvml_power": 114.513, "nvml_energy": 99.05093129992676, "compile_time": 249.13721508346498, "verification_time": 0, "benchmark_time": 8687.390006962232, "edp": 85676.62179300874, "flops_watt": 1387558.4173543418, "occupancy": 98.78277146643882, "strategy_time": 0, "framework_time": 0.4128499422222376, "timestamp": "2025-02-18 02:13:30.849250+00:00"},
"1,64,1,4": {"block_size_x": 1, "block_size_y": 64, "tile_size_x": 1, "tile_size_y": 4, "sm__warps_active.avg.pct_of_peak_sustained_active": 98.7073018401943, "sm__maximum_warps_per_active_cycle_pct": 98.7073018401943, "time": 869.4240809849331, "times": [853.0680541992188, 869.1242065429688, 876.6248168945312, 879.6180419921875, 874.387451171875, 866.99951171875, 866.146484375], "nvml_power": 114.412, "nvml_energy": 99.47254795364817, "compile_time": 254.85899997875094, "verification_time": 0, "benchmark_time": 8722.457200055942, "edp": 86483.82858783026, "flops_watt": 1381677.2194881674, "occupancy": 98.7073018401943, "strategy_time": 0, "framework_time": 0.4236298846080899, "timestamp": "2025-02-18 02:13:39.827015+00:00"},
"1,64,2,1": {"block_size_x": 1, "block_size_y": 64, "tile_size_x": 2, "tile_size_y": 1, "sm__warps_active.avg.pct_of_peak_sustained_active": 96.04761127765568, "sm__maximum_warps_per_active_cycle_pct": 96.04761127765568, "time": 516.5367126464844, "times": [522.457275390625, 504.93817138671875, 526.5926513671875, 501.1415710449219, 528.8197631835938, 501.97906494140625, 529.8284912109375], "nvml_power": 114.739, "nvml_energy": 59.26690587234497, "compile_time": 250.65920397173613, "verification_time": 0, "benchmark_time": 5169.581338064745, "edp": 30613.53272802969, "flops_watt": 2318983.1061542146, "occupancy": 96.04761127765568, "strategy_time": 0, "framework_time": 0.40719006210565567, "timestamp": "2025-02-18 02:13:45.247689+00:00"},
"1,64,2,2": {"block_size_x": 1, "block_size_y": 64, "tile_size_x": 2, "tile_size_y": 2, "sm__warps_active.avg.pct_of_peak_sustained_active": 95.95737395460506, "sm__maximum_warps_per_active_cycle_pct": 95.95737395460506, "time": 522.6223754882812, "times": [528.0545043945312, 513.7285766601562, 534.1204833984375, 502.7020263671875, 534.743896484375, 505.36846923828125, 539.638671875], "nvml_power": 114.97, "nvml_energy": 60.085894509887694, "compile_time": 252.4666819954291, "verification_time": 0, "benchmark_time": 5231.604258064181, "edp": 31402.232922095784, "flops_watt": 2287374.675754942, "occupancy": 95.95737395460506, "strategy_time": 0, "framework_time": 0.4141199169680476, "timestamp": "2025-02-18 02:13:50.732199+00:00"},
"1,64,2,4": {"block_size_x": 1, "block_size_y": 64, "tile_size_x": 2, "tile_size_y": 4, "sm__warps_active.avg.pct_of_peak_sustained_active": 96.21503260897168, "sm__maximum_warps_per_active_cycle_pct": 96.21503260897168, "time": 524.0888105119977, "times": [526.4241333007812, 515.1547241210938, 533.118896484375, 510.3656921386719, 537.8070068359375, 508.310791015625, 537.4404296875], "nvml_power": 114.889, "nvml_energy": 60.2120393509129, "compile_time": 252.12260300759226, "verification_time": 0, "benchmark_time": 5237.481113057584, "edp": 31556.456081921544, "flops_watt": 2282582.602310018, "occupancy": 96.21503260897168, "strategy_time": 0, "framework_time": 0.4351988900452852, "timestamp": "2025-02-18 02:13:56.222266+00:00"},
"1,64,4,1": {"block_size_x": 1, "block_size_y": 64, "tile_size_x": 4, "tile_size_y": 1, "sm__warps_active.avg.pct_of_peak_sustained_active": 95.30886661384612, "sm__maximum_warps_per_active_cycle_pct": 95.30886661384612, "time": 304.65638514927457, "times": [288.7038269042969, 309.60858154296875, 318.4855651855469, 292.75653076171875, 303.15008544921875, 319.8643493652344, 300.0257568359375], "nvml_power": 115.678, "nvml_energy": 35.24204132129778, "compile_time": 250.56415400467813, "verification_time": 0, "benchmark_time": 3650.6276660365984, "edp": 10736.712914227946, "flops_watt": 3899857.906044213, "occupancy": 95.30886661384612, "strategy_time": 0, "framework_time": 0.7099598878994584, "timestamp": "2025-02-18 02:14:00.124201+00:00"},
"1,64,4,2": {"block_size_x": 1, "block_size_y": 64, "tile_size_x": 4, "tile_size_y": 2, "sm__warps_active.avg.pct_of_peak_sustained_active": 95.33342869002188, "sm__maximum_warps_per_active_cycle_pct": 95.33342869002188, "time": 303.0923156738281, "times": [288.892822265625, 305.5672607421875, 317.8301086425781, 291.093994140625, 302.90509033203125, 318.8946533203125, 296.4622802734375], "nvml_power": 115.442, "nvml_energy": 34.98958310601806, "compile_time": 249.43042499944568, "verification_time": 0, "benchmark_time": 3645.543880062178, "edp": 10605.073768064869, "flops_watt": 3927996.314090438, "occupancy": 95.33342869002188, "strategy_time": 0, "framework_time": 0.41194004006683826, "timestamp": "2025-02-18 02:14:04.019613+00:00"},
"1,64,4,4": {"block_size_x": 1, "block_size_y": 64, "tile_size_x": 4, "tile_size_y": 4, "sm__warps_active.avg.pct_of_peak_sustained_active": 95.31851025268026, "sm__maximum_warps_per_active_cycle_pct": 95.31851025268026, "time": 303.45272391183033, "times": [287.4963073730469, 307.34246826171875, 319.6763916015625, 292.04632568359375, 302.2872314453125, 319.33343505859375, 295.9869079589844], "nvml_power": 115.757, "nvml_energy": 35.126776961861744, "compile_time": 250.17919507808983, "verification_time": 0, "benchmark_time": 3640.53926395718, "edp": 10659.316151320274, "flops_watt": 3912654.8280026326, "occupancy": 95.31851025268026, "strategy_time": 0, "framework_time": 0.4127899883314967, "timestamp": "2025-02-18 02:14:07.910769+00:00"},
"1,128,1,1": {"block_size_x": 1, "block_size_y": 128, "tile_size_x": 1, "tile_size_y": 1, "sm__warps_active.avg.pct_of_peak_sustained_active": 98.6594321768415, "sm__maximum_warps_per_active_cycle_pct": 98.6594321768415, "time": 803.9774257114956, "times": [799.0888061523438, 810.5628662109375, 809.8173828125, 798.1763305664062, 792.3125610351562, 802.0662231445312, 815.8178100585938], "nvml_power": 114.383, "nvml_energy": 91.96134988515799, "compile_time": 247.70703702233732, "verification_time": 0, "benchmark_time": 8065.055287093855, "edp": 73934.84934562346, "flops_watt": 1494529.5348930259, "occupancy": 98.6594321768415, "strategy_time": 0, "framework_time": 0.40023995097726583, "timestamp": "2025-02-18 02:14:16.223956+00:00"},
"1,128,1,2": {"block_size_x": 1, "block_size_y": 128, "tile_size_x": 1, "tile_size_y": 2, "sm__warps_active.avg.pct_of_peak_sustained_active": 98.60162746659967, "sm__maximum_warps_per_active_cycle_pct": 98.60162746659967, "time": 820.1702183314732, "times": [818.5631713867188, 827.51904296875, 826.8861083984375, 816.7125244140625, 810.0608520507812, 815.2105712890625, 826.2392578125], "nvml_power": 114.549, "nvml_energy": 93.94967833965192, "compile_time": 250.53444399964064, "verification_time": 0, "benchmark_time": 8223.36299996823, "edp": 77054.728196004, "flops_watt": 1462899.6703439825, "occupancy": 98.60162746659967, "strategy_time": 0, "framework_time": 0.40096999146044254, "timestamp": "2025-02-18 02:14:24.698280+00:00"},
"1,128,1,4": {"block_size_x": 1, "block_size_y": 128, "tile_size_x": 1, "tile_size_y": 4, "sm__warps_active.avg.pct_of_peak_sustained_active": 98.59957556443499, "sm__maximum_warps_per_active_cycle_pct": 98.59957556443499, "time": 822.1200823102679, "times": [820.3353881835938, 829.204833984375, 833.0172119140625, 819.1954345703125, 813.75439453125, 814.9322509765625, 824.4010620117188], "nvml_power": 114.859, "nvml_energy": 94.42789053407506, "compile_time": 251.7843839013949, "verification_time": 0, "benchmark_time": 8248.58026090078, "edp": 77631.06513825875, "flops_watt": 1455491.0916113714, "occupancy": 98.59957556443499, "strategy_time": 0, "framework_time": 0.400249264203012, "timestamp": "2025-02-18 02:14:33.199069+00:00"},
"1,128,2,1": {"block_size_x": 1, "block_size_y": 128, "tile_size_x": 2, "tile_size_y": 1, "sm__warps_active.avg.pct_of_peak_sustained_active": 98.59376507158959, "sm__maximum_warps_per_active_cycle_pct": 98.59376507158959, "time": 464.4840654645647, "times": [457.8941955566406, 474.24945068359375, 454.3345947265625, 480.7126770019531, 450.4024353027344, 482.90252685546875, 450.892578125], "nvml_power": 114.556, "nvml_energy": 53.209436603358675, "compile_time": 253.3251220593229, "verification_time": 0, "benchmark_time": 5135.513683082536, "edp": 24714.935434607058, "flops_watt": 2582980.806515899, "occupancy": 98.59376507158959, "strategy_time": 0, "framework_time": 0.40869880467653275, "timestamp": "2025-02-18 02:14:38.588341+00:00"},
"1,128,2,2": {"block_size_x": 1, "block_size_y": 128, "tile_size_x": 2, "tile_size_y": 2, "sm__warps_active.avg.pct_of_peak_sustained_active": 98.6103675968837, "sm__maximum_warps_per_active_cycle_pct": 98.6103675968837, "time": 457.07257080078125, "times": [454.2097473144531, 462.8653259277344, 449.433349609375, 470.9881896972656, 444.54144287109375, 471.5537109375, 445.9162292480469], "nvml_power": 114.685, "nvml_energy": 52.419367782287594, "compile_time": 248.73786605894566, "verification_time": 0, "benchmark_time": 5056.283178040758, "edp": 23959.45519200184, "flops_watt": 2621911.6957461736, "occupancy": 98.6103675968837, "strategy_time": 0, "framework_time": 0.42378995567560196, "timestamp": "2025-02-18 02:14:43.893811+00:00"},
"1,128,2,4": {"block_size_x": 1, "block_size_y": 128, "tile_size_x": 2, "tile_size_y": 4, "sm__warps_active.avg.pct_of_peak_sustained_active": 98.51185043880342, "sm__maximum_warps_per_active_cycle_pct": 98.51185043880342, "time": 463.5885009765625, "times": [455.73529052734375, 474.0921630859375, 449.6809997558594, 482.52825927734375, 449.24554443359375, 484.2101745605469, 449.6270751953125], "nvml_power": 114.593, "nvml_energy": 53.12399709240723, "compile_time": 251.4605940086767, "verification_time": 0, "benchmark_time": 5126.077812048607, "edp": 24627.674177952333, "flops_watt": 2587135.0236114576, "occupancy": 98.51185043880342, "strategy_time": 0, "framework_time": 0.40780892595648766, "timestamp": "2025-02-18 02:14:49.271782+00:00"},
"1,128,4,1": {"block_size_x": 1, "block_size_y": 128, "tile_size_x": 4, "tile_size_y": 1, "sm__warps_active.avg.pct_of_peak_sustained_active": 98.43536494413931, "sm__maximum_warps_per_active_cycle_pct": 98.43536494413931, "time": 268.08238002232144, "times": [254.3627471923828, 253.9153289794922, 289.076904296875, 269.97576904296875, 258.3032531738281, 267.619384765625, 283.3232727050781], "nvml_power": 113.858, "nvml_energy": 30.523323624581476, "compile_time": 251.99729402083904, "verification_time": 0, "benchmark_time": 3226.1770280310884, "edp": 8182.765243469354, "flops_watt": 4502751.900887874, "occupancy": 98.43536494413931, "strategy_time": 0, "framework_time": 0.3994189901277423, "timestamp": "2025-02-18 02:14:52.750381+00:00"},
"1,128,4,2": {"block_size_x": 1, "block_size_y": 128, "tile_size_x": 4, "tile_size_y": 2, "sm__warps_active.avg.pct_of_peak_sustained_active": 98.46549363554054, "sm__maximum_warps_per_active_cycle_pct": 98.46549363554054, "time": 268.04769461495533, "times": [254.98294067382812, 256.79681396484375, 290.4591979980469, 266.46484375, 256.9264221191406, 269.91717529296875, 280.7864685058594], "nvml_power": 115.24, "nvml_energy": 30.88981632742745, "compile_time": 253.2455320470035, "verification_time": 0, "benchmark_time": 3222.786391968839, "edp": 8279.944053646333, "flops_watt": 4449328.931424117, "occupancy": 98.46549363554054, "strategy_time": 0, "framework_time": 0.4067800473421812, "timestamp": "2025-02-18 02:14:56.226845+00:00"},
"1,128,4,4": {"block_size_x": 1, "block_size_y": 128, "tile_size_x": 4, "tile_size_y": 4, "sm__warps_active.avg.pct_of_peak_sustained_active": 98.39785908054787, "sm__maximum_warps_per_active_cycle_pct": 98.39785908054787, "time": 272.32678658621654, "times": [258.3427734375, 260.7258605957031, 293.0326843261719, 271.8171081542969, 261.01739501953125, 273.5579528808594, 287.7937316894531], "nvml_power": 114.221, "nvml_energy": 31.10543789066424, "compile_time": 252.32928397599608, "verification_time": 0, "benchmark_time": 3276.564866071567, "edp": 8470.843946121735, "flops_watt": 4418486.373832722, "occupancy": 98.39785908054787, "strategy_time": 0, "framework_time": 0.40407897904515266, "timestamp": "2025-02-18 02:14:59.756169+00:00"},
"2,16,1,1": {"block_size_x": 2, "block_size_y": 16, "tile_size_x": 1, "tile_size_y": 1, "sm__warps_active.avg.pct_of_peak_sustained_active": 49.954657407244746, "sm__maximum_warps_per_active_cycle_pct": 49.954657407244746, "time": 397.2220982142857, "times": [381.99188232421875, 415.3851318359375, 384.0863342285156, 404.1014709472656, 397.6047058105469, 387.5555725097656, 409.82958984375], "nvml_power": 114.601, "nvml_energy": 45.52204967745536, "compile_time": 250.7748150965199, "verification_time": 0, "benchmark_time": 4386.694359011017, "edp": 18082.364087893766, "flops_watt": 3019173.2236535517, "occupancy": 49.954657407244746, "strategy_time": 0, "framework_time": 0.40106987580657005, "timestamp": "2025-02-18 02:15:04.394065+00:00"},
"2,16,1,2": {"block_size_x": 2, "block_size_y": 16, "tile_size_x": 1, "tile_size_y": 2, "sm__warps_active.avg.pct_of_peak_sustained_active": 49.95476378177772, "sm__maximum_warps_per_active_cycle_pct": 49.95476378177772, "time": 401.93846348353793, "times": [383.78717041015625, 420.8218688964844, 385.52459716796875, 409.8075866699219, 405.6513977050781, 391.1971740722656, 416.7794494628906], "nvml_power": 114.977, "nvml_energy": 46.21367871594674, "compile_time": 253.40739300008863, "verification_time": 0, "benchmark_time": 4433.945189928636, "edp": 18575.055015009515, "flops_watt": 2973988.59581751, "occupancy": 49.95476378177772, "strategy_time": 0, "framework_time": 0.4159091040492058, "timestamp": "2025-02-18 02:15:09.081859+00:00"},
"2,16,1,4": {"block_size_x": 2, "block_size_y": 16, "tile_size_x": 1, "tile_size_y": 4, "sm__warps_active.avg.pct_of_peak_sustained_active": 49.954927399589444, "sm__maximum_warps_per_active_cycle_pct": 49.954927399589444, "time": 409.80775669642856, "times": [390.83587646484375, 432.5725402832031, 391.00335693359375, 422.29486083984375, 408.5518493652344, 400.9936828613281, 422.4021301269531], "nvml_power": 115.059, "nvml_energy": 47.15207067773437, "compile_time": 251.5406939201057, "verification_time": 0, "benchmark_time": 4506.213891902007, "edp": 19323.28430803377, "flops_watt": 2914802.075424015, "occupancy": 49.954927399589444, "strategy_time": 0, "framework_time": 0.4092901945114136, "timestamp": "2025-02-18 02:15:13.840048+00:00"},
"2,16,2,1": {"block_size_x": 2, "block_size_y": 16, "tile_size_x": 2, "tile_size_y": 1, "sm__warps_active.avg.pct_of_peak_sustained_active": 49.955135562361455, "sm__maximum_warps_per_active_cycle_pct": 49.955135562361455, "time": 719.3318132672991, "times": [725.9161376953125, 722.7460327148438, 698.8713989257812, 718.4361572265625, 736.9383544921875, 720.6137084960938, 711.8009033203125], "nvml_power": 114.668, "nvml_energy": 82.48434036373466, "compile_time": 252.46227299794555, "verification_time": 0, "benchmark_time": 7165.203765965998, "edp": 59333.610120002326, "flops_watt": 1666242.9846190158, "occupancy": 49.955135562361455, "strategy_time": 0, "framework_time": 0.39658008608967066, "timestamp": "2025-02-18 02:15:21.258136+00:00"},
"2,16,2,2": {"block_size_x": 2, "block_size_y": 16, "tile_size_x": 2, "tile_size_y": 2, "sm__warps_active.avg.pct_of_peak_sustained_active": 49.95534190650662, "sm__maximum_warps_per_active_cycle_pct": 49.95534190650662, "time": 718.9887084960938, "times": [727.0769653320312, 723.5726318359375, 697.6968383789062, 716.9070434570312, 734.0584716796875, 717.3362426757812, 716.2727661132812], "nvml_power": 114.63650000000001, "nvml_energy": 82.42234908151246, "compile_time": 251.3884640065953, "verification_time": 0, "benchmark_time": 7157.702283933759, "edp": 59260.73831733085, "flops_watt": 1667496.1949468132, "occupancy": 49.95534190650662, "strategy_time": 0, "framework_time": 0.39913004729896784, "timestamp": "2025-02-18 02:15:28.667651+00:00"},
"2,16,2,4": {"block_size_x": 2, "block_size_y": 16, "tile_size_x": 2, "tile_size_y": 4, "sm__warps_active.avg.pct_of_peak_sustained_active": 49.9554403773528, "sm__maximum_warps_per_active_cycle_pct": 49.9554403773528, "time": 718.0682547433036, "times": [726.747802734375, 722.3091430664062, 700.554443359375, 720.765380859375, 733.7886962890625, 712.63134765625, 709.6809692382812], "nvml_power": 114.597, "nvml_energy": 82.28846778881835, "compile_time": 250.05664594937116, "verification_time": 0, "benchmark_time": 7122.265763930045, "edp": 59088.73645061735, "flops_watt": 1670209.169828238, "occupancy": 49.9554403773528, "strategy_time": 0, "framework_time": 0.3994191065430641, "timestamp": "2025-02-18 02:15:36.040397+00:00"},
"2,16,4,1": {"block_size_x": 2, "block_size_y": 16, "tile_size_x": 4, "tile_size_y": 1, "sm__warps_active.avg.pct_of_peak_sustained_active": 49.90944853536806, "sm__maximum_warps_per_active_cycle_pct": 49.90944853536806, "time": 444.9001159667969, "times": [406.971435546875, 480.58441162109375, 416.8719482421875, 471.1448059082031, 427.2193908691406, 460.8651428222656, 450.6436767578125], "nvml_power": 115.364, "nvml_energy": 51.325456978393554, "compile_time": 248.65066702477634, "verification_time": 0, "benchmark_time": 4823.250795016065, "edp": 22834.701761736134, "flops_watt": 2677793.078975558, "occupancy": 49.90944853536806, "strategy_time": 0, "framework_time": 0.4160889657214284, "timestamp": "2025-02-18 02:15:41.112738+00:00"},
"2,16,4,2": {"block_size_x": 2, "block_size_y": 16, "tile_size_x": 4, "tile_size_y": 2, "sm__warps_active.avg.pct_of_peak_sustained_active": 49.910136760730545, "sm__maximum_warps_per_active_cycle_pct": 49.910136760730545, "time": 431.51077706473217, "times": [410.0197448730469, 479.57000732421875, 415.9233093261719, 461.91339111328125, 340.95941162109375, 483.7732238769531, 428.4163513183594], "nvml_power": 116.186, "nvml_energy": 50.13551114404297, "compile_time": 251.41408399213105, "verification_time": 0, "benchmark_time": 4734.5189480111, "edp": 21634.01337230352, "flops_watt": 2741349.4015674414, "occupancy": 49.910136760730545, "strategy_time": 0, "framework_time": 0.41177996899932623, "timestamp": "2025-02-18 02:15:46.099108+00:00"},
"2,16,4,4": {"block_size_x": 2, "block_size_y": 16, "tile_size_x": 4, "tile_size_y": 4, "sm__warps_active.avg.pct_of_peak_sustained_active": 49.90887312893177, "sm__maximum_warps_per_active_cycle_pct": 49.90887312893177, "time": 430.1049543108259, "times": [405.5682678222656, 480.15020751953125, 416.95599365234375, 470.2665100097656, 337.0606689453125, 468.1167907714844, 432.6162414550781], "nvml_power": 114.534, "nvml_energy": 49.26164083703614, "compile_time": 250.52637502085418, "verification_time": 0, "benchmark_time": 4706.971231033094, "edp": 21187.675781489746, "flops_watt": 2789979.20362957, "occupancy": 49.90887312893177, "strategy_time": 0, "framework_time": 0.40827004704624414, "timestamp": "2025-02-18 02:15:51.057038+00:00"},
"2,32,1,1": {"block_size_x": 2, "block_size_y": 32, "tile_size_x": 1, "tile_size_y": 1, "sm__warps_active.avg.pct_of_peak_sustained_active": 98.86610124426679, "sm__maximum_warps_per_active_cycle_pct": 98.86610124426679, "time": 488.91015625, "times": [484.69818115234375, 488.3996276855469, 485.9277038574219, 496.2544250488281, 486.3108215332031, 494.6271057128906, 486.1532287597656], "nvml_power": 114.985, "nvml_energy": 56.21733431640625, "compile_time": 251.0374749545008, "verification_time": 0, "benchmark_time": 5365.043282974511, "edp": 27485.225704592667, "flops_watt": 2444778.912825298, "occupancy": 98.86610124426679, "strategy_time": 0, "framework_time": 0.4089600406587124, "timestamp": "2025-02-18 02:15:56.673557+00:00"},
"2,32,1,2": {"block_size_x": 2, "block_size_y": 32, "tile_size_x": 1, "tile_size_y": 2, "sm__warps_active.avg.pct_of_peak_sustained_active": 98.8478057468439, "sm__maximum_warps_per_active_cycle_pct": 98.8478057468439, "time": 491.7008710588728, "times": [487.9285888671875, 490.1222839355469, 491.576904296875, 495.87017822265625, 490.7776184082031, 494.1912536621094, 491.43927001953125], "nvml_power": 114.752, "nvml_energy": 56.42365835574777, "compile_time": 251.9115440081805, "verification_time": 0, "benchmark_time": 5397.8206779574975, "edp": 27743.561961849424, "flops_watt": 2435839.1050338433, "occupancy": 98.8478057468439, "strategy_time": 0, "framework_time": 0.40579994674772024, "timestamp": "2025-02-18 02:16:02.323720+00:00"},
"2,32,1,4": {"block_size_x": 2, "block_size_y": 32, "tile_size_x": 1, "tile_size_y": 4, "sm__warps_active.avg.pct_of_peak_sustained_active": 98.80641201172163, "sm__maximum_warps_per_active_cycle_pct": 98.80641201172163, "time": 492.8901628766741, "times": [497.1764831542969, 488.8294982910156, 497.15972900390625, 486.4468078613281, 496.53448486328125, 489.054931640625, 495.0292053222656], "nvml_power": 115.77, "nvml_energy": 57.061894156232555, "compile_time": 252.0446249982342, "verification_time": 0, "benchmark_time": 5415.609712945297, "edp": 28125.246304717002, "flops_watt": 2408594.308063086, "occupancy": 98.80641201172163, "strategy_time": 0, "framework_time": 0.4072091542184353, "timestamp": "2025-02-18 02:16:07.991807+00:00"},
"2,32,2,1": {"block_size_x": 2, "block_size_y": 32, "tile_size_x": 2, "tile_size_y": 1, "sm__warps_active.avg.pct_of_peak_sustained_active": 98.90716504904508, "sm__maximum_warps_per_active_cycle_pct": 98.90716504904508, "time": 699.2288643973214, "times": [706.2667236328125, 705.7474365234375, 680.0936889648438, 700.9481201171875, 715.04052734375, 694.6981811523438, 691.807373046875], "nvml_power": 114.618, "nvml_energy": 80.14421397949219, "compile_time": 252.31478293426335, "verification_time": 0, "benchmark_time": 6965.784248081036, "edp": 56039.14772889626, "flops_watt": 1714895.5195588884, "occupancy": 98.90716504904508, "strategy_time": 0, "framework_time": 0.41127006988972425, "timestamp": "2025-02-18 02:16:15.210342+00:00"},
"2,32,2,2": {"block_size_x": 2, "block_size_y": 32, "tile_size_x": 2, "tile_size_y": 2, "sm__warps_active.avg.pct_of_peak_sustained_active": 98.96431396071908, "sm__maximum_warps_per_active_cycle_pct": 98.96431396071908, "time": 699.1377737862723, "times": [704.9920043945312, 703.4290161132812, 684.1095581054688, 700.9772338867188, 712.2677612304688, 694.0037231445312, 694.1851196289062], "nvml_power": 114.644, "nvml_energy": 80.1519509379534, "compile_time": 253.5815720912069, "verification_time": 0, "benchmark_time": 6962.559651932679, "edp": 56037.25654338726, "flops_watt": 1714729.983034264, "occupancy": 98.96431396071908, "strategy_time": 0, "framework_time": 0.4035999299958348, "timestamp": "2025-02-18 02:16:22.426911+00:00"},
"2,32,2,4": {"block_size_x": 2, "block_size_y": 32, "tile_size_x": 2, "tile_size_y": 4, "sm__warps_active.avg.pct_of_peak_sustained_active": 98.94817777854482, "sm__maximum_warps_per_active_cycle_pct": 98.94817777854482, "time": 699.2835083007812, "times": [704.7001953125, 708.1035766601562, 681.7638549804688, 698.9183959960938, 713.5980224609375, 692.3928833007812, 695.5076293945312], "nvml_power": 114.48349999999999, "nvml_energy": 80.05642352255248, "compile_time": 253.65253200288862, "verification_time": 0, "benchmark_time": 6956.431607017294, "edp": 55982.13670286369, "flops_watt": 1716776.0864720924, "occupancy": 98.94817777854482, "strategy_time": 0, "framework_time": 0.40517991874367, "timestamp": "2025-02-18 02:16:29.637425+00:00"},
"2,32,4,1": {"block_size_x": 2, "block_size_y": 32, "tile_size_x": 4, "tile_size_y": 1, "sm__warps_active.avg.pct_of_peak_sustained_active": 98.0009324098564, "sm__maximum_warps_per_active_cycle_pct": 98.0009324098564, "time": 412.1715829031808, "times": [384.5486755371094, 437.3045349121094, 392.634033203125, 426.0778503417969, 409.1593017578125, 406.4225158691406, 429.0541687011719], "nvml_power": 114.788, "nvml_energy": 47.31235165829032, "compile_time": 248.09062702115625, "verification_time": 0, "benchmark_time": 4471.838057041168, "edp": 19500.806873869453, "flops_watt": 2904927.543332487, "occupancy": 98.0009324098564, "strategy_time": 0, "framework_time": 0.39906997699290514, "timestamp": "2025-02-18 02:16:34.357778+00:00"},
"2,32,4,2": {"block_size_x": 2, "block_size_y": 32, "tile_size_x": 4, "tile_size_y": 2, "sm__warps_active.avg.pct_of_peak_sustained_active": 98.01593462433475, "sm__maximum_warps_per_active_cycle_pct": 98.01593462433475, "time": 412.7751944405692, "times": [382.92218017578125, 437.10980224609375, 393.623779296875, 428.3671569824219, 410.0235290527344, 408.08966064453125, 429.2902526855469], "nvml_power": 114.843, "nvml_energy": 47.40434165513829, "compile_time": 251.72989501152188, "verification_time": 0, "benchmark_time": 4489.302593981847, "edp": 19567.33634402688, "flops_watt": 2899290.416727106, "occupancy": 98.01593462433475, "strategy_time": 0, "framework_time": 0.4006399540230632, "timestamp": "2025-02-18 02:16:39.099237+00:00"},
"2,32,4,4": {"block_size_x": 2, "block_size_y": 32, "tile_size_x": 4, "tile_size_y": 4, "sm__warps_active.avg.pct_of_peak_sustained_active": 97.97895405213785, "sm__maximum_warps_per_active_cycle_pct": 97.97895405213785, "time": 414.1789071219308, "times": [384.77423095703125, 438.7760314941406, 396.6219482421875, 430.8376770019531, 411.6915283203125, 410.4795837402344, 426.07135009765625], "nvml_power": 115.216, "nvml_energy": 47.72003696296038, "compile_time": 250.13971596490592, "verification_time": 0, "benchmark_time": 4500.534505001269, "edp": 19764.63275713707, "flops_watt": 2880109.954203895, "occupancy": 97.97895405213785, "strategy_time": 0, "framework_time": 0.41824893560260534, "timestamp": "2025-02-18 02:16:43.850354+00:00"},
"2,64,1,1": {"block_size_x": 2, "block_size_y": 64, "tile_size_x": 1, "tile_size_y": 1, "sm__warps_active.avg.pct_of_peak_sustained_active": 97.62569042156252, "sm__maximum_warps_per_active_cycle_pct": 97.62569042156252, "time": 494.7022181919643, "times": [491.4989013671875, 496.67462158203125, 491.99310302734375, 498.6763000488281, 490.75408935546875, 501.21185302734375, 492.1066589355469], "nvml_power": 114.608, "nvml_energy": 56.696831822544645, "compile_time": 252.475673914887, "verification_time": 0, "benchmark_time": 5446.533623035066, "edp": 28048.048467069584, "flops_watt": 2424102.882894234, "occupancy": 97.62569042156252, "strategy_time": 0, "framework_time": 0.3945401404052973, "timestamp": "2025-02-18 02:16:49.549783+00:00"},
"2,64,1,2": {"block_size_x": 2, "block_size_y": 64, "tile_size_x": 1, "tile_size_y": 2, "sm__warps_active.avg.pct_of_peak_sustained_active": 97.59569183202404, "sm__maximum_warps_per_active_cycle_pct": 97.59569183202404, "time": 495.9189671107701, "times": [493.2372741699219, 497.5758056640625, 492.0556945800781, 499.60614013671875, 493.6695861816406, 499.434814453125, 495.85345458984375], "nvml_power": 114.896, "nvml_energy": 56.979105645159045, "compile_time": 253.28351301141083, "verification_time": 0, "benchmark_time": 5455.851256032474, "edp": 28257.01921844272, "flops_watt": 2412093.9055784713, "occupancy": 97.59569183202404, "strategy_time": 0, "framework_time": 0.40610996074974537, "timestamp": "2025-02-18 02:16:55.259350+00:00"},
"2,64,1,4": {"block_size_x": 2, "block_size_y": 64, "tile_size_x": 1, "tile_size_y": 4, "sm__warps_active.avg.pct_of_peak_sustained_active": 97.62859488431457, "sm__maximum_warps_per_active_cycle_pct": 97.62859488431457, "time": 496.9855215890067, "times": [496.2675476074219, 498.9930419921875, 495.6181945800781, 497.1879577636719, 496.10748291015625, 498.64581298828125, 496.07861328125], "nvml_power": 114.839, "nvml_energy": 57.073320313759936, "compile_time": 253.6552029196173, "verification_time": 0, "benchmark_time": 5463.175480021164, "edp": 28364.613864950432, "flops_watt": 2408112.1041570897, "occupancy": 97.62859488431457, "strategy_time": 0, "framework_time": 0.4101390950381756, "timestamp": "2025-02-18 02:17:00.976615+00:00"},
"2,64,2,1": {"block_size_x": 2, "block_size_y": 64, "tile_size_x": 2, "tile_size_y": 1, "sm__warps_active.avg.pct_of_peak_sustained_active": 97.56858054040441, "sm__maximum_warps_per_active_cycle_pct": 97.56858054040441, "time": 608.9319981166294, "times": [621.9373168945312, 585.474853515625, 619.8303833007812, 610.9874267578125, 598.0036010742188, 627.984130859375, 598.3062744140625], "nvml_power": 114.365, "nvml_energy": 69.64050796460832, "compile_time": 249.15804690681398, "verification_time": 0, "benchmark_time": 6068.8595559913665, "edp": 42406.33366474599, "flops_watt": 1973548.9801689445, "occupancy": 97.56858054040441, "strategy_time": 0, "framework_time": 0.40234008338302374, "timestamp": "2025-02-18 02:17:07.295060+00:00"},
"2,64,2,2": {"block_size_x": 2, "block_size_y": 64, "tile_size_x": 2, "tile_size_y": 2, "sm__warps_active.avg.pct_of_peak_sustained_active": 97.64527294021292, "sm__maximum_warps_per_active_cycle_pct": 97.64527294021292, "time": 597.8882184709821, "times": [609.4889526367188, 577.4598999023438, 611.9495239257812, 596.0557250976562, 595.1929321289062, 611.3495483398438, 583.720947265625], "nvml_power": 114.189, "nvml_energy": 68.27225777898296, "compile_time": 250.95919496379793, "verification_time": 0, "benchmark_time": 5974.900373956189, "edp": 40819.178574467776, "flops_watt": 2013101.0448919036, "occupancy": 97.64527294021292, "strategy_time": 0, "framework_time": 0.41186006274074316, "timestamp": "2025-02-18 02:17:13.521357+00:00"},
"2,64,2,4": {"block_size_x": 2, "block_size_y": 64, "tile_size_x": 2, "tile_size_y": 4, "sm__warps_active.avg.pct_of_peak_sustained_active": 97.604621294561, "sm__maximum_warps_per_active_cycle_pct": 97.604621294561, "time": 600.7840837751116, "times": [611.29541015625, 580.9431762695312, 610.5604248046875, 604.7052612304688, 592.28564453125, 616.2683715820312, 589.4302978515625], "nvml_power": 114.449, "nvml_energy": 68.75913760397775, "compile_time": 251.85814406722784, "verification_time": 0, "benchmark_time": 6004.477291018702, "edp": 41309.3954865726, "flops_watt": 1998846.3826231742, "occupancy": 97.604621294561, "strategy_time": 0, "framework_time": 0.4071698058396578, "timestamp": "2025-02-18 02:17:19.778125+00:00"},
"2,64,4,1": {"block_size_x": 2, "block_size_y": 64, "tile_size_x": 4, "tile_size_y": 1, "sm__warps_active.avg.pct_of_peak_sustained_active": 97.64251673799484, "sm__maximum_warps_per_active_cycle_pct": 97.64251673799484, "time": 356.6041259765625, "times": [338.0832824707031, 375.1531982421875, 355.0419006347656, 343.701416015625, 377.2317199707031, 349.33624267578125, 357.6811218261719], "nvml_power": 114.802, "nvml_energy": 40.93886687036133, "compile_time": 251.55563501175493, "verification_time": 0, "benchmark_time": 3906.900212052278, "edp": 14598.968838776053, "flops_watt": 3357175.3196594263, "occupancy": 97.64251673799484, "strategy_time": 0, "framework_time": 0.3957089502364397, "timestamp": "2025-02-18 02:17:23.937002+00:00"},
"2,64,4,2": {"block_size_x": 2, "block_size_y": 64, "tile_size_x": 4, "tile_size_y": 2, "sm__warps_active.avg.pct_of_peak_sustained_active": 97.68281637725354, "sm__maximum_warps_per_active_cycle_pct": 97.68281637725354, "time": 350.0321132114955, "times": [332.0938415527344, 365.90460205078125, 349.4893493652344, 338.1002502441406, 371.4067687988281, 344.7561950683594, 348.4737854003906], "nvml_power": 114.72999999999999, "nvml_energy": 40.15918434875488, "compile_time": 251.75909500103444, "verification_time": 0, "benchmark_time": 3846.320091979578, "edp": 14057.004162444686, "flops_watt": 3422354.2061620895, "occupancy": 97.68281637725354, "strategy_time": 0, "framework_time": 0.41265005711466074, "timestamp": "2025-02-18 02:17:28.035518+00:00"},
"2,64,4,4": {"block_size_x": 2, "block_size_y": 64, "tile_size_x": 4, "tile_size_y": 4, "sm__warps_active.avg.pct_of_peak_sustained_active": 97.62736768876916, "sm__maximum_warps_per_active_cycle_pct": 97.62736768876916, "time": 351.1600559779576, "times": [331.98699951171875, 367.718505859375, 350.8636779785156, 338.063720703125, 372.8497314453125, 347.2901306152344, 349.3476257324219], "nvml_power": 115.127, "nvml_energy": 40.42800376457432, "compile_time": 252.7904330054298, "verification_time": 0, "benchmark_time": 3865.957767004147, "edp": 14196.700065044999, "flops_watt": 3399597.8201731807, "occupancy": 97.62736768876916, "strategy_time": 0, "framework_time": 0.41411002166569233, "timestamp": "2025-02-18 02:17:32.154706+00:00"},
"2,128,1,1": {"block_size_x": 2, "block_size_y": 128, "tile_size_x": 1, "tile_size_y": 1, "sm__warps_active.avg.pct_of_peak_sustained_active": 94.62296398070063, "sm__maximum_warps_per_active_cycle_pct": 94.62296398070063, "time": 451.2914821079799, "times": [441.4690246582031, 466.2195129394531, 435.2955017089844, 471.6578674316406, 434.1064147949219, 466.1846923828125, 444.10736083984375], "nvml_power": 115.4355, "nvml_energy": 52.09505788287572, "compile_time": 250.96959597431123, "verification_time": 0, "benchmark_time": 4970.8112850785255, "edp": 23510.055882463985, "flops_watt": 2638234.010239537, "occupancy": 94.62296398070063, "strategy_time": 0, "framework_time": 0.4086688859388232, "timestamp": "2025-02-18 02:17:37.376922+00:00"},
"2,128,1,2": {"block_size_x": 2, "block_size_y": 128, "tile_size_x": 1, "tile_size_y": 2, "sm__warps_active.avg.pct_of_peak_sustained_active": 94.41168265316287, "sm__maximum_warps_per_active_cycle_pct": 94.41168265316287, "time": 449.6786455426897, "times": [439.5952453613281, 465.4752502441406, 431.4928283691406, 471.574951171875, 433.2666931152344, 468.55682373046875, 437.7887268066406], "nvml_power": 115.181, "nvml_energy": 51.794436072252545, "compile_time": 252.597424085252, "verification_time": 0, "benchmark_time": 4955.467908992432, "edp": 23290.851859617953, "flops_watt": 2653546.672084131, "occupancy": 94.41168265316287, "strategy_time": 0, "framework_time": 0.43105881195515394, "timestamp": "2025-02-18 02:17:42.585445+00:00"},
"2,128,1,4": {"block_size_x": 2, "block_size_y": 128, "tile_size_x": 1, "tile_size_y": 4, "sm__warps_active.avg.pct_of_peak_sustained_active": 94.52693573430713, "sm__maximum_warps_per_active_cycle_pct": 94.52693573430713, "time": 450.6923261369978, "times": [440.6866149902344, 465.39642333984375, 434.8499755859375, 471.6884765625, 432.3509826660156, 469.43402099609375, 440.4397888183594], "nvml_power": 115.327, "nvml_energy": 51.976993896401545, "compile_time": 251.83381501119584, "verification_time": 0, "benchmark_time": 4959.722415078431, "edp": 23425.63228477775, "flops_watt": 2644226.6697057895, "occupancy": 94.52693573430713, "strategy_time": 0, "framework_time": 0.4103899700567126, "timestamp": "2025-02-18 02:17:47.797436+00:00"},
"2,128,2,1": {"block_size_x": 2, "block_size_y": 128, "tile_size_x": 2, "tile_size_y": 1, "sm__warps_active.avg.pct_of_peak_sustained_active": 92.33148440104107, "sm__maximum_warps_per_active_cycle_pct": 92.33148440104107, "time": 488.4112025669643, "times": [484.9002380371094, 489.5782775878906, 484.8411865234375, 494.38201904296875, 484.3742980957031, 495.7342529296875, 485.0681457519531], "nvml_power": 114.109, "nvml_energy": 55.732113913713725, "compile_time": 249.79484698269516, "verification_time": 0, "benchmark_time": 5399.942956981249, "edp": 27220.188778195963, "flops_watt": 2466063.8870577826, "occupancy": 92.33148440104107, "strategy_time": 0, "framework_time": 0.40137802716344595, "timestamp": "2025-02-18 02:17:53.447600+00:00"},
"2,128,2,2": {"block_size_x": 2, "block_size_y": 128, "tile_size_x": 2, "tile_size_y": 2, "sm__warps_active.avg.pct_of_peak_sustained_active": 92.4662015526096, "sm__maximum_warps_per_active_cycle_pct": 92.4662015526096, "time": 486.7167489188058, "times": [486.7177734375, 484.744384765625, 484.9288330078125, 489.0490417480469, 485.1269836425781, 495.5943908691406, 480.8558349609375], "nvml_power": 114.088, "nvml_energy": 55.52854045064872, "compile_time": 252.22200492862612, "verification_time": 0, "benchmark_time": 5386.139967944473, "edp": 27026.670680346146, "flops_watt": 2475104.736349942, "occupancy": 92.4662015526096, "strategy_time": 0, "framework_time": 0.42662012856453657, "timestamp": "2025-02-18 02:17:59.086416+00:00"},
"2,128,2,4": {"block_size_x": 2, "block_size_y": 128, "tile_size_x": 2, "tile_size_y": 4, "sm__warps_active.avg.pct_of_peak_sustained_active": 92.15040446639345, "sm__maximum_warps_per_active_cycle_pct": 92.15040446639345, "time": 486.11134556361606, "times": [485.40057373046875, 485.2722473144531, 483.3916931152344, 491.6784973144531, 483.57098388671875, 494.2909240722656, 479.17449951171875], "nvml_power": 113.791, "nvml_energy": 55.315096123029434, "compile_time": 254.82610205654055, "verification_time": 0, "benchmark_time": 5369.398512993939, "edp": 26889.2958063466, "flops_watt": 2484655.4214841146, "occupancy": 92.15040446639345, "strategy_time": 0, "framework_time": 0.678329961374402, "timestamp": "2025-02-18 02:18:04.711352+00:00"},
"2,128,4,1": {"block_size_x": 2, "block_size_y": 128, "tile_size_x": 4, "tile_size_y": 1, "sm__warps_active.avg.pct_of_peak_sustained_active": 92.7655729973061, "sm__maximum_warps_per_active_cycle_pct": 92.7655729973061, "time": 279.28846958705356, "times": [264.2611389160156, 266.4372863769531, 301.759521484375, 276.6363525390625, 265.33673095703125, 288.75909423828125, 291.82916259765625], "nvml_power": 114.648, "nvml_energy": 32.019864461216514, "compile_time": 251.60019495524466, "verification_time": 0, "benchmark_time": 3349.2674599401653, "edp": 8942.778941758046, "flops_watt": 4292302.787179829, "occupancy": 92.7655729973061, "strategy_time": 0, "framework_time": 0.41478907223790884, "timestamp": "2025-02-18 02:18:08.312660+00:00"},
"2,128,4,2": {"block_size_x": 2, "block_size_y": 128, "tile_size_x": 4, "tile_size_y": 2, "sm__warps_active.avg.pct_of_peak_sustained_active": 93.69771604721835, "sm__maximum_warps_per_active_cycle_pct": 93.69771604721835, "time": 278.2088099888393, "times": [263.5030212402344, 266.7861022949219, 299.0765075683594, 277.7323913574219, 265.30316162109375, 284.8887023925781, 290.1717834472656], "nvml_power": 114.459, "nvml_energy": 31.84350218251256, "compile_time": 252.19976401422173, "verification_time": 0, "benchmark_time": 3324.951000045985, "edp": 8859.142848073825, "flops_watt": 4316075.307428877, "occupancy": 93.69771604721835, "strategy_time": 0, "framework_time": 0.4053299780935049, "timestamp": "2025-02-18 02:18:11.890242+00:00"},
"2,128,4,4": {"block_size_x": 2, "block_size_y": 128, "tile_size_x": 4, "tile_size_y": 4, "sm__warps_active.avg.pct_of_peak_sustained_active": 92.51313004792749, "sm__maximum_warps_per_active_cycle_pct": 92.51313004792749, "time": 277.5468444824219, "times": [263.37396240234375, 264.8699951171875, 297.3263244628906, 278.49005126953125, 264.6954040527344, 283.8555908203125, 290.2165832519531], "nvml_power": 114.195, "nvml_energy": 31.694461905670167, "compile_time": 251.92941399291158, "verification_time": 0, "benchmark_time": 3327.25406892132, "edp": 8796.697889487083, "flops_watt": 4336371.2525251, "occupancy": 92.51313004792749, "strategy_time": 0, "framework_time": 0.4067900590598583, "timestamp": "2025-02-18 02:18:15.469856+00:00"},
"4,16,1,1": {"block_size_x": 4, "block_size_y": 16, "tile_size_x": 1, "tile_size_y": 1, "sm__warps_active.avg.pct_of_peak_sustained_active": 99.20949731459693, "sm__maximum_warps_per_active_cycle_pct": 99.20949731459693, "time": 286.2932870047433, "times": [275.8365783691406, 282.5226135253906, 301.8422546386719, 280.0522155761719, 275.575927734375, 299.6390686035156, 288.5843505859375], "nvml_power": 115.318, "nvml_energy": 33.01476927081299, "compile_time": 251.201624982059, "verification_time": 0, "benchmark_time": 3447.6995300501585, "edp": 9451.906814244245, "flops_watt": 4162953.6267425674, "occupancy": 99.20949731459693, "strategy_time": 0, "framework_time": 0.4035099409520626, "timestamp": "2025-02-18 02:18:19.169186+00:00"},
"4,16,1,2": {"block_size_x": 4, "block_size_y": 16, "tile_size_x": 1, "tile_size_y": 2, "sm__warps_active.avg.pct_of_peak_sustained_active": 99.3383936532314, "sm__maximum_warps_per_active_cycle_pct": 99.3383936532314, "time": 285.70552716936385, "times": [274.53076171875, 282.6228942871094, 302.52508544921875, 279.20037841796875, 275.1561584472656, 297.8250427246094, 288.078369140625], "nvml_power": 115.65899999999999, "nvml_energy": 33.044415566881455, "compile_time": 251.6882549971342, "verification_time": 0, "benchmark_time": 3430.421325028874, "edp": 9440.972169539398, "flops_watt": 4159218.770077062, "occupancy": 99.3383936532314, "strategy_time": 0, "framework_time": 0.39113895036280155, "timestamp": "2025-02-18 02:18:22.851712+00:00"},
"4,16,1,4": {"block_size_x": 4, "block_size_y": 16, "tile_size_x": 1, "tile_size_y": 4, "sm__warps_active.avg.pct_of_peak_sustained_active": 99.3337889368976, "sm__maximum_warps_per_active_cycle_pct": 99.3337889368976, "time": 291.5290309361049, "times": [277.3544006347656, 286.837158203125, 308.9219055175781, 283.5715026855469, 279.11761474609375, 304.60888671875, 300.291748046875], "nvml_power": 113.972, "nvml_energy": 33.226146713849744, "compile_time": 249.64242603164166, "verification_time": 0, "benchmark_time": 3499.4293090421706, "edp": 9686.386353229462, "flops_watt": 4136469.830692433, "occupancy": 99.3337889368976, "strategy_time": 0, "framework_time": 0.3957599401473999, "timestamp": "2025-02-18 02:18:26.601205+00:00"},
"4,16,2,1": {"block_size_x": 4, "block_size_y": 16, "tile_size_x": 2, "tile_size_y": 1, "sm__warps_active.avg.pct_of_peak_sustained_active": 99.60306135868355, "sm__maximum_warps_per_active_cycle_pct": 99.60306135868355, "time": 325.647208077567, "times": [314.0641784667969, 334.3946838378906, 331.88189697265625, 313.056884765625, 334.9836730957031, 335.5359191894531, 315.61322021484375], "nvml_power": 115.348, "nvml_energy": 37.56275415733119, "compile_time": 248.65882704034448, "verification_time": 0, "benchmark_time": 3945.5696060322225, "edp": 12232.206019038924, "flops_watt": 3658915.767899724, "occupancy": 99.60306135868355, "strategy_time": 0, "framework_time": 0.4151290049776435, "timestamp": "2025-02-18 02:18:30.795875+00:00"},
"4,16,2,2": {"block_size_x": 4, "block_size_y": 16, "tile_size_x": 2, "tile_size_y": 2, "sm__warps_active.avg.pct_of_peak_sustained_active": 99.60094990562574, "sm__maximum_warps_per_active_cycle_pct": 99.60094990562574, "time": 327.223641531808, "times": [313.33197021484375, 335.57733154296875, 336.389892578125, 314.7095031738281, 337.4041748046875, 336.5453796386719, 316.60723876953125], "nvml_power": 114.9, "nvml_energy": 37.59799641200475, "compile_time": 252.67142499797046, "verification_time": 0, "benchmark_time": 3965.58379905764, "edp": 12302.953300236046, "flops_watt": 3655486.1053212085, "occupancy": 99.60094990562574, "strategy_time": 0, "framework_time": 0.4111600574105978, "timestamp": "2025-02-18 02:18:35.014567+00:00"},
"4,16,2,4": {"block_size_x": 4, "block_size_y": 16, "tile_size_x": 2, "tile_size_y": 4, "sm__warps_active.avg.pct_of_peak_sustained_active": 99.61529191032712, "sm__maximum_warps_per_active_cycle_pct": 99.61529191032712, "time": 328.37110682896207, "times": [314.5079040527344, 338.6436767578125, 336.7648010253906, 315.9711608886719, 339.8630065917969, 336.52490234375, 316.3222961425781], "nvml_power": 115.096, "nvml_energy": 37.79420091158622, "compile_time": 250.84145495202392, "verification_time": 0, "benchmark_time": 3981.858135899529, "edp": 12410.523585053736, "flops_watt": 3636509.045224094, "occupancy": 99.61529191032712, "strategy_time": 0, "framework_time": 0.40473020635545254, "timestamp": "2025-02-18 02:18:39.247697+00:00"},
"4,16,4,1": {"block_size_x": 4, "block_size_y": 16, "tile_size_x": 4, "tile_size_y": 1, "sm__warps_active.avg.pct_of_peak_sustained_active": 99.66493403541801, "sm__maximum_warps_per_active_cycle_pct": 99.66493403541801, "time": 571.8640485491071, "times": [583.0300903320312, 542.9798583984375, 598.7447509765625, 552.7096557617188, 581.764404296875, 576.245361328125, 567.57421875], "nvml_power": 115.461, "nvml_energy": 66.02799490952846, "compile_time": 249.81167598161846, "verification_time": 0, "benchmark_time": 5713.780016056262, "edp": 37759.03648654278, "flops_watt": 2081525.475070367, "occupancy": 99.66493403541801, "strategy_time": 0, "framework_time": 0.3952599363401532, "timestamp": "2025-02-18 02:18:45.211709+00:00"},
"4,16,4,2": {"block_size_x": 4, "block_size_y": 16, "tile_size_x": 4, "tile_size_y": 2, "sm__warps_active.avg.pct_of_peak_sustained_active": 99.64493726146894, "sm__maximum_warps_per_active_cycle_pct": 99.64493726146894, "time": 569.0538940429688, "times": [577.478759765625, 539.7105102539062, 593.0614013671875, 554.4256591796875, 580.3944091796875, 571.0881958007812, 567.2183227539062], "nvml_power": 114.829, "nvml_energy": 65.34388959906006, "compile_time": 252.53771408461034, "verification_time": 0, "benchmark_time": 5693.48327210173, "edp": 37184.19482825897, "flops_watt": 2103317.6065169065, "occupancy": 99.64493726146894, "strategy_time": 0, "framework_time": 0.41071977466344833, "timestamp": "2025-02-18 02:18:51.158166+00:00"},
"4,16,4,4": {"block_size_x": 4, "block_size_y": 16, "tile_size_x": 4, "tile_size_y": 4, "sm__warps_active.avg.pct_of_peak_sustained_active": 99.653645216192, "sm__maximum_warps_per_active_cycle_pct": 99.653645216192, "time": 562.6565551757812, "times": [570.4298095703125, 535.8375854492188, 582.262939453125, 544.9317016601562, 577.69140625, 559.8942260742188, 567.5482177734375], "nvml_power": 115.456, "nvml_energy": 64.962075234375, "compile_time": 254.00417298078537, "verification_time": 0, "benchmark_time": 5621.852612006478, "edp": 36551.33746844337, "flops_watt": 2115679.848221251, "occupancy": 99.653645216192, "strategy_time": 0, "framework_time": 0.4180400865152478, "timestamp": "2025-02-18 02:18:57.034466+00:00"},
"4,32,1,1": {"block_size_x": 4, "block_size_y": 32, "tile_size_x": 1, "tile_size_y": 1, "sm__warps_active.avg.pct_of_peak_sustained_active": 99.48601810488059, "sm__maximum_warps_per_active_cycle_pct": 99.48601810488059, "time": 277.42759922572543, "times": [260.94903564453125, 266.3309631347656, 292.94482421875, 288.5565490722656, 260.456298828125, 280.6405944824219, 292.11492919921875], "nvml_power": 114.001, "nvml_energy": 31.627023739331925, "compile_time": 254.01985400822014, "verification_time": 0, "benchmark_time": 3346.2486050557345, "edp": 8774.209266657881, "flops_watt": 4345617.678247685, "occupancy": 99.48601810488059, "strategy_time": 0, "framework_time": 0.4060888895764947, "timestamp": "2025-02-18 02:19:00.635167+00:00"},
"4,32,1,2": {"block_size_x": 4, "block_size_y": 32, "tile_size_x": 1, "tile_size_y": 2, "sm__warps_active.avg.pct_of_peak_sustained_active": 99.48247633994721, "sm__maximum_warps_per_active_cycle_pct": 99.48247633994721, "time": 277.8902021135603, "times": [261.2792053222656, 267.86236572265625, 293.53070068359375, 288.2995300292969, 261.68560791015625, 281.85504150390625, 290.7189636230469], "nvml_power": 113.448, "nvml_energy": 31.52608764937919, "compile_time": 252.76766391471028, "verification_time": 0, "benchmark_time": 3351.6966209281236, "edp": 8760.7908687358, "flops_watt": 4359530.90661113, "occupancy": 99.48247633994721, "strategy_time": 0, "framework_time": 0.40300912223756313, "timestamp": "2025-02-18 02:19:04.240060+00:00"},
"4,32,1,4": {"block_size_x": 4, "block_size_y": 32, "tile_size_x": 1, "tile_size_y": 4, "sm__warps_active.avg.pct_of_peak_sustained_active": 99.48860376860604, "sm__maximum_warps_per_active_cycle_pct": 99.48860376860604, "time": 278.7710484095982, "times": [262.3467712402344, 269.7722473144531, 293.3103332519531, 288.7777404785156, 261.6549377441406, 282.6144714355469, 292.92083740234375], "nvml_power": 113.803, "nvml_energy": 31.724981622157504, "compile_time": 252.32546404004097, "verification_time": 0, "benchmark_time": 3361.552832997404, "edp": 8844.006387584084, "flops_watt": 4332199.6245384505, "occupancy": 99.48860376860604, "strategy_time": 0, "framework_time": 0.38459000643342733, "timestamp": "2025-02-18 02:19:07.854346+00:00"},
"4,32,2,1": {"block_size_x": 4, "block_size_y": 32, "tile_size_x": 2, "tile_size_y": 1, "sm__warps_active.avg.pct_of_peak_sustained_active": 99.58631710851418, "sm__maximum_warps_per_active_cycle_pct": 99.58631710851418, "time": 338.553466796875, "times": [323.68109130859375, 348.4367370605469, 347.534912109375, 325.3134460449219, 353.02520751953125, 345.0270690917969, 326.8558044433594], "nvml_power": 115.565, "nvml_energy": 39.12493139038086, "compile_time": 251.42057507764548, "verification_time": 0, "benchmark_time": 3740.912704030052, "edp": 13245.881160403318, "flops_watt": 3512822.862247634, "occupancy": 99.58631710851418, "strategy_time": 0, "framework_time": 0.40413986425846815, "timestamp": "2025-02-18 02:19:11.847108+00:00"},
"4,32,2,2": {"block_size_x": 4, "block_size_y": 32, "tile_size_x": 2, "tile_size_y": 2, "sm__warps_active.avg.pct_of_peak_sustained_active": 99.5782986486401, "sm__maximum_warps_per_active_cycle_pct": 99.5782986486401, "time": 337.5182320731027, "times": [322.7557373046875, 347.8765869140625, 348.5381774902344, 323.0706481933594, 350.2772216796875, 345.1825256347656, 324.9267272949219], "nvml_power": 115.433, "nvml_energy": 38.96074208289447, "compile_time": 250.71899604517967, "verification_time": 0, "benchmark_time": 3736.577608040534, "edp": 13149.960788074673, "flops_watt": 3527626.6858464675, "occupancy": 99.5782986486401, "strategy_time": 0, "framework_time": 0.39944984018802643, "timestamp": "2025-02-18 02:19:15.834829+00:00"},
"4,32,2,4": {"block_size_x": 4, "block_size_y": 32, "tile_size_x": 2, "tile_size_y": 4, "sm__warps_active.avg.pct_of_peak_sustained_active": 99.58440699934175, "sm__maximum_warps_per_active_cycle_pct": 99.58440699934175, "time": 337.6911097935268, "times": [322.5537414550781, 346.50048828125, 352.5783386230469, 322.8067626953125, 348.3352966308594, 346.4536437988281, 324.6094970703125], "nvml_power": 115.763, "nvml_energy": 39.09213594302804, "compile_time": 250.744535936974, "verification_time": 0, "benchmark_time": 3734.959949972108, "edp": 13201.066770800557, "flops_watt": 3515769.864105156, "occupancy": 99.58440699934175, "strategy_time": 0, "framework_time": 0.42157911229878664, "timestamp": "2025-02-18 02:19:19.820980+00:00"},
"4,32,4,1": {"block_size_x": 4, "block_size_y": 32, "tile_size_x": 4, "tile_size_y": 1, "sm__warps_active.avg.pct_of_peak_sustained_active": 99.69661281340811, "sm__maximum_warps_per_active_cycle_pct": 99.69661281340811, "time": 480.43629237583707, "times": [475.4979553222656, 481.90594482421875, 474.9076843261719, 485.7185974121094, 476.5356750488281, 492.5020751953125, 475.9861145019531], "nvml_power": 114.353, "nvml_energy": 54.939331342054096, "compile_time": 251.355336047709, "verification_time": 0, "benchmark_time": 5299.637756077573, "edp": 26394.84865558409, "flops_watt": 2501649.548959752, "occupancy": 99.69661281340811, "strategy_time": 0, "framework_time": 0.41211978532373905, "timestamp": "2025-02-18 02:19:25.372411+00:00"},
"4,32,4,2": {"block_size_x": 4, "block_size_y": 32, "tile_size_x": 4, "tile_size_y": 2, "sm__warps_active.avg.pct_of_peak_sustained_active": 99.69590623948923, "sm__maximum_warps_per_active_cycle_pct": 99.69590623948923, "time": 481.0191737583705, "times": [473.2255859375, 483.31829833984375, 477.5904541015625, 489.1531066894531, 473.2823181152344, 492.3504638671875, 478.2139892578125], "nvml_power": 114.453, "nvml_energy": 55.05408749416679, "compile_time": 252.4875639937818, "verification_time": 0, "benchmark_time": 5295.581359998323, "edp": 26482.07167846515, "flops_watt": 2496435.0464724754, "occupancy": 99.69590623948923, "strategy_time": 0, "framework_time": 0.4126100102439523, "timestamp": "2025-02-18 02:19:30.920918+00:00"},
"4,32,4,4": {"block_size_x": 4, "block_size_y": 32, "tile_size_x": 4, "tile_size_y": 4, "sm__warps_active.avg.pct_of_peak_sustained_active": 99.6973516811966, "sm__maximum_warps_per_active_cycle_pct": 99.6973516811966, "time": 487.173331124442, "times": [481.3557434082031, 494.0065002441406, 485.45806884765625, 492.5797424316406, 484.5397033691406, 490.6148681640625, 481.65869140625], "nvml_power": 114.625, "nvml_energy": 55.84224308013916, "compile_time": 250.04946603439748, "verification_time": 0, "benchmark_time": 5367.6682519726455, "edp": 27204.851578812213, "flops_watt": 2461200.44416485, "occupancy": 99.6973516811966, "strategy_time": 0, "framework_time": 0.4187199519947171, "timestamp": "2025-02-18 02:19:36.539081+00:00"},
"4,64,1,1": {"block_size_x": 4, "block_size_y": 64, "tile_size_x": 1, "tile_size_y": 1, "sm__warps_active.avg.pct_of_peak_sustained_active": 99.33413110757286, "sm__maximum_warps_per_active_cycle_pct": 99.33413110757286, "time": 260.1796678815569, "times": [249.06265258789062, 247.00282287597656, 273.4966125488281, 275.0540466308594, 251.58908081054688, 251.67208862304688, 273.38037109375], "nvml_power": 114.511, "nvml_energy": 29.79343394878496, "compile_time": 253.57320299372077, "verification_time": 0, "benchmark_time": 3147.8266990743577, "edp": 7751.645749845973, "flops_watt": 4613061.8480655225, "occupancy": 99.33413110757286, "strategy_time": 0, "framework_time": 0.4100289661437273, "timestamp": "2025-02-18 02:19:39.940916+00:00"},
"4,64,1,2": {"block_size_x": 4, "block_size_y": 64, "tile_size_x": 1, "tile_size_y": 2, "sm__warps_active.avg.pct_of_peak_sustained_active": 99.32187399562481, "sm__maximum_warps_per_active_cycle_pct": 99.32187399562481, "time": 255.80927385602678, "times": [246.87545776367188, 245.1965789794922, 269.4449462890625, 266.402587890625, 246.0630340576172, 247.325439453125, 269.35687255859375], "nvml_power": 114.443, "nvml_energy": 29.275580727905268, "compile_time": 251.4773749280721, "verification_time": 0, "benchmark_time": 3100.726447068155, "edp": 7488.965047718939, "flops_watt": 4694661.900967662, "occupancy": 99.32187399562481, "strategy_time": 0, "framework_time": 0.4336700076237321, "timestamp": "2025-02-18 02:19:43.293579+00:00"},
"4,64,1,4": {"block_size_x": 4, "block_size_y": 64, "tile_size_x": 1, "tile_size_y": 4, "sm__warps_active.avg.pct_of_peak_sustained_active": 99.31749696690153, "sm__maximum_warps_per_active_cycle_pct": 99.31749696690153, "time": 256.17881992885043, "times": [245.87493896484375, 244.56463623046875, 271.37359619140625, 266.5663757324219, 246.64649963378906, 247.58876037597656, 270.6369323730469], "nvml_power": 114.443, "nvml_energy": 29.31787268911743, "compile_time": 254.30780206806958, "verification_time": 0, "benchmark_time": 3104.100654949434, "edp": 7510.618028322376, "flops_watt": 4687889.702277624, "occupancy": 99.31749696690153, "strategy_time": 0, "framework_time": 0.40125998202711344, "timestamp": "2025-02-18 02:19:46.652414+00:00"},
"4,64,2,1": {"block_size_x": 4, "block_size_y": 64, "tile_size_x": 2, "tile_size_y": 1, "sm__warps_active.avg.pct_of_peak_sustained_active": 99.51175926326435, "sm__maximum_warps_per_active_cycle_pct": 99.51175926326435, "time": 308.41598074776783, "times": [296.6230773925781, 311.22955322265625, 322.3547058105469, 298.7077331542969, 306.34759521484375, 321.886474609375, 301.7627258300781], "nvml_power": 116.063, "nvml_energy": 35.79568397352818, "compile_time": 252.45176500175148, "verification_time": 0, "benchmark_time": 3725.0951789319515, "edp": 11039.960979232848, "flops_watt": 3839539.8052357268, "occupancy": 99.51175926326435, "strategy_time": 0, "framework_time": 0.40924909990280867, "timestamp": "2025-02-18 02:19:50.630395+00:00"},
