experiments/data/depr/power_tuning_float16.json
{
"device_name": "NVIDIA RTX 5000 Ada Generation",
"kernel_name": "tuned_matmul<__half>",
"problem_size": [
4096,
4096
],
"tune_params_keys": [
"block_size_x",
"block_size_y",
"tile_size_x",
"tile_size_y"
],
"tune_params": {
"block_size_x": [
1,
2,
4,
8,
16,
32,
64,
128
],
"block_size_y": [
16,
32,
64,
128
],
"tile_size_x": [
1,
2,
4
],
"tile_size_y": [
1,
2,
4
]
},
"objective": "time",
"cache": {
"1,32,1,1": {"block_size_x": 1, "block_size_y": 32, "tile_size_x": 1, "tile_size_y": 1, "sm__warps_active.avg.pct_of_peak_sustained_active": 49.954660709984424, "sm__maximum_warps_per_active_cycle_pct": 49.954660709984424, "time": 317.62545340401783, "times": [315.4801025390625, 317.1015625, 320.98028564453125, 317.2086181640625, 315.0313720703125, 319.9626770019531, 317.6135559082031], "nvml_power": 115.062, "nvml_energy": 36.5466199195731, "compile_time": 243.84015600662678, "verification_time": 0, "benchmark_time": 3848.0729170842096, "edp": 11608.136722338715, "flops_watt": 3760647.46273273, "occupancy": 49.954660709984424, "strategy_time": 0, "framework_time": 0, "timestamp": "2025-02-18 01:51:09.094413+00:00"},
"1,32,1,2": {"block_size_x": 1, "block_size_y": 32, "tile_size_x": 1, "tile_size_y": 2, "sm__warps_active.avg.pct_of_peak_sustained_active": 49.954795690964204, "sm__maximum_warps_per_active_cycle_pct": 49.954795690964204, "time": 317.3579668317522, "times": [315.9114685058594, 318.77215576171875, 316.7235107421875, 317.0453186035156, 317.5855407714844, 317.9782409667969, 317.4895324707031], "nvml_power": 114.933, "nvml_energy": 36.47490320187378, "compile_time": 246.64648296311498, "verification_time": 0, "benchmark_time": 3846.501686028205, "edp": 11575.601120531632, "flops_watt": 3768041.623341156, "occupancy": 49.954795690964204, "strategy_time": 0, "framework_time": 0.4361500032246113, "timestamp": "2025-02-18 01:51:13.188027+00:00"},
"1,32,1,4": {"block_size_x": 1, "block_size_y": 32, "tile_size_x": 1, "tile_size_y": 4, "sm__warps_active.avg.pct_of_peak_sustained_active": 49.95469742464514, "sm__maximum_warps_per_active_cycle_pct": 49.95469742464514, "time": 317.24649919782365, "times": [316.2274169921875, 318.8624572753906, 317.4619445800781, 315.64080810546875, 317.9052429199219, 319.3346862792969, 315.2929382324219], "nvml_power": 115.49, "nvml_energy": 36.63879819235665, "compile_time": 249.10756095778197, "verification_time": 0, "benchmark_time": 3848.965379060246, "edp": 11623.530461340697, "flops_watt": 3751186.181119653, "occupancy": 49.95469742464514, "strategy_time": 0, "framework_time": 0.42801990639418364, "timestamp": "2025-02-18 01:51:17.286554+00:00"},
"1,32,2,1": {"block_size_x": 1, "block_size_y": 32, "tile_size_x": 2, "tile_size_y": 1, "sm__warps_active.avg.pct_of_peak_sustained_active": 49.9114412121732, "sm__maximum_warps_per_active_cycle_pct": 49.9114412121732, "time": 160.1278577532087, "times": [159.97206115722656, 158.03817749023438, 158.28982543945312, 158.2995147705078, 162.28944396972656, 162.14617919921875, 161.85980224609375], "nvml_power": 114.371, "nvml_energy": 18.313983219092233, "compile_time": 252.66918900888413, "verification_time": 0, "benchmark_time": 2431.3135660486296, "edp": 2932.5788998014523, "flops_watt": 7504590.990818459, "occupancy": 49.9114412121732, "strategy_time": 0, "framework_time": 0.4214989021420479, "timestamp": "2025-02-18 01:51:19.970982+00:00"},
"1,32,2,2": {"block_size_x": 1, "block_size_y": 32, "tile_size_x": 2, "tile_size_y": 2, "sm__warps_active.avg.pct_of_peak_sustained_active": 49.91148753129213, "sm__maximum_warps_per_active_cycle_pct": 49.91148753129213, "time": 159.93232073102678, "times": [159.74278259277344, 157.93026733398438, 157.8306884765625, 157.67138671875, 161.6859893798828, 163.44979858398438, 161.21533203125], "nvml_power": 114.794, "nvml_energy": 18.359270825997488, "compile_time": 252.8507369570434, "verification_time": 0, "benchmark_time": 2442.3304080264643, "edp": 2936.240790131213, "flops_watt": 7486079.091843929, "occupancy": 49.91148753129213, "strategy_time": 0, "framework_time": 0.4075700417160988, "timestamp": "2025-02-18 01:51:22.666597+00:00"},
"1,32,2,4": {"block_size_x": 1, "block_size_y": 32, "tile_size_x": 2, "tile_size_y": 4, "sm__warps_active.avg.pct_of_peak_sustained_active": 49.91153811406669, "sm__maximum_warps_per_active_cycle_pct": 49.91153811406669, "time": 160.2936052594866, "times": [160.15916442871094, 158.77078247070312, 157.85157775878906, 158.20130920410156, 162.35714721679688, 163.17372131347656, 161.54153442382812], "nvml_power": 114.741, "nvml_energy": 18.392248561078752, "compile_time": 243.4314478887245, "verification_time": 0, "benchmark_time": 2433.231279021129, "edp": 2948.1598306839182, "flops_watt": 7472656.375623648, "occupancy": 49.91153811406669, "strategy_time": 0, "framework_time": 0.43385999742895365, "timestamp": "2025-02-18 01:51:25.343719+00:00"},
"1,32,4,1": {"block_size_x": 1, "block_size_y": 32, "tile_size_x": 4, "tile_size_y": 1, "sm__warps_active.avg.pct_of_peak_sustained_active": 49.82309324221728, "sm__maximum_warps_per_active_cycle_pct": 49.82309324221728, "time": 79.43962969098773, "times": [80.9665298461914, 79.08966064453125, 79.01798248291016, 79.18144226074219, 79.5337905883789, 79.11408233642578, 79.17391967773438], "nvml_power": 115.61, "nvml_energy": 9.184015588575091, "compile_time": 247.66689399257302, "verification_time": 0, "benchmark_time": 1703.0768370022997, "edp": 729.574797432664, "flops_watt": 14965017.442149593, "occupancy": 49.82309324221728, "strategy_time": 0, "framework_time": 0.4448499530553818, "timestamp": "2025-02-18 01:51:27.294934+00:00"},
"1,32,4,2": {"block_size_x": 1, "block_size_y": 32, "tile_size_x": 4, "tile_size_y": 2, "sm__warps_active.avg.pct_of_peak_sustained_active": 49.822686845287244, "sm__maximum_warps_per_active_cycle_pct": 49.822686845287244, "time": 79.43074689592633, "times": [80.65452575683594, 79.08755493164062, 78.9801254272461, 79.49676513671875, 79.4840316772461, 79.12361907958984, 79.18860626220703], "nvml_power": 116.127, "nvml_energy": 9.224054344783237, "compile_time": 246.74824404064566, "verification_time": 0, "benchmark_time": 1704.1954069864005, "edp": 732.6735260147469, "flops_watt": 14900058.94747683, "occupancy": 49.822686845287244, "strategy_time": 0, "framework_time": 0.4097799537703395, "timestamp": "2025-02-18 01:51:29.246313+00:00"},
"1,32,4,4": {"block_size_x": 1, "block_size_y": 32, "tile_size_x": 4, "tile_size_y": 4, "sm__warps_active.avg.pct_of_peak_sustained_active": 49.823827891293206, "sm__maximum_warps_per_active_cycle_pct": 49.823827891293206, "time": 79.32431902204242, "times": [80.69340515136719, 79.15068817138672, 78.98834991455078, 78.99638366699219, 79.08723449707031, 79.09503936767578, 79.2591323852539], "nvml_power": 115.685, "nvml_energy": 9.176633846064977, "compile_time": 254.06971795018762, "verification_time": 0, "benchmark_time": 1704.209488001652, "edp": 727.9302307537304, "flops_watt": 14977055.397163423, "occupancy": 49.823827891293206, "strategy_time": 0, "framework_time": 0.4223400028422475, "timestamp": "2025-02-18 01:51:31.205040+00:00"},
"1,64,1,1": {"block_size_x": 1, "block_size_y": 64, "tile_size_x": 1, "tile_size_y": 1, "sm__warps_active.avg.pct_of_peak_sustained_active": 98.72758549389253, "sm__maximum_warps_per_active_cycle_pct": 98.72758549389253, "time": 327.502694266183, "times": [324.5026550292969, 329.385009765625, 332.2601013183594, 324.67608642578125, 328.0189514160156, 329.4512023925781, 324.224853515625], "nvml_power": 115.618, "nvml_energy": 37.865206505667544, "compile_time": 251.02164095733315, "verification_time": 0, "benchmark_time": 3970.1006039977074, "edp": 12400.957149551523, "flops_watt": 3629689.790584625, "occupancy": 98.72758549389253, "strategy_time": 0, "framework_time": 0.39767008274793625, "timestamp": "2025-02-18 01:51:35.426589+00:00"},
"1,64,1,2": {"block_size_x": 1, "block_size_y": 64, "tile_size_x": 1, "tile_size_y": 2, "sm__warps_active.avg.pct_of_peak_sustained_active": 98.72608031186499, "sm__maximum_warps_per_active_cycle_pct": 98.72608031186499, "time": 327.05499267578125, "times": [323.75030517578125, 328.6328430175781, 329.01861572265625, 325.111328125, 328.31280517578125, 329.7594299316406, 324.79962158203125], "nvml_power": 115.265, "nvml_energy": 37.69799373077392, "compile_time": 250.57877111248672, "verification_time": 0, "benchmark_time": 3961.5671889623627, "edp": 12329.317063509912, "flops_watt": 3645789.5996678662, "occupancy": 98.72608031186499, "strategy_time": 0, "framework_time": 0.40529994294047356, "timestamp": "2025-02-18 01:51:39.639165+00:00"},
"1,64,1,4": {"block_size_x": 1, "block_size_y": 64, "tile_size_x": 1, "tile_size_y": 4, "sm__warps_active.avg.pct_of_peak_sustained_active": 98.71177398753645, "sm__maximum_warps_per_active_cycle_pct": 98.71177398753645, "time": 326.3056335449219, "times": [323.1124572753906, 327.3418273925781, 328.2236328125, 324.4576721191406, 327.5140380859375, 328.4626159667969, 325.0271911621094], "nvml_power": 115.477, "nvml_energy": 37.68079564486695, "compile_time": 251.6942509682849, "verification_time": 0, "benchmark_time": 3955.6733700446784, "edp": 12295.455895375042, "flops_watt": 3647453.5932662175, "occupancy": 98.71177398753645, "strategy_time": 0, "framework_time": 0.41870994027704, "timestamp": "2025-02-18 01:51:43.846976+00:00"},
"1,64,2,1": {"block_size_x": 1, "block_size_y": 64, "tile_size_x": 2, "tile_size_y": 1, "sm__warps_active.avg.pct_of_peak_sustained_active": 96.5428927208431, "sm__maximum_warps_per_active_cycle_pct": 96.5428927208431, "time": 173.97312709263392, "times": [172.0465545654297, 168.70086669921875, 168.8252410888672, 173.68655395507812, 181.352294921875, 180.9839630126953, 172.21641540527344], "nvml_power": 115.205, "nvml_energy": 20.04257410670689, "compile_time": 253.4027110086754, "verification_time": 0, "benchmark_time": 2466.97070391383, "edp": 3486.8692923296517, "flops_watt": 6857350.395227352, "occupancy": 96.5428927208431, "strategy_time": 0, "framework_time": 0.4217789974063635, "timestamp": "2025-02-18 01:51:46.567794+00:00"},
"1,64,2,2": {"block_size_x": 1, "block_size_y": 64, "tile_size_x": 2, "tile_size_y": 2, "sm__warps_active.avg.pct_of_peak_sustained_active": 96.51313665172881, "sm__maximum_warps_per_active_cycle_pct": 96.51313665172881, "time": 173.16705976213728, "times": [172.2744903564453, 168.51437377929688, 168.37738037109375, 170.4310760498047, 180.30259704589844, 180.23992919921875, 172.02957153320312], "nvml_power": 115.611, "nvml_energy": 20.020016946160453, "compile_time": 251.1733319843188, "verification_time": 0, "benchmark_time": 2457.24999695085, "edp": 3466.807470954768, "flops_watt": 6865076.779985383, "occupancy": 96.51313665172881, "strategy_time": 0, "framework_time": 0.40507002267986536, "timestamp": "2025-02-18 01:51:49.276648+00:00"},
"1,64,2,4": {"block_size_x": 1, "block_size_y": 64, "tile_size_x": 2, "tile_size_y": 4, "sm__warps_active.avg.pct_of_peak_sustained_active": 96.51991442025279, "sm__maximum_warps_per_active_cycle_pct": 96.51991442025279, "time": 173.15201677594865, "times": [171.88461303710938, 168.9015655517578, 168.95472717285156, 173.3870086669922, 179.9364471435547, 178.5581817626953, 170.4415740966797], "nvml_power": 114.676, "nvml_energy": 19.85638067579869, "compile_time": 250.06858399137855, "verification_time": 0, "benchmark_time": 2468.1344779673964, "edp": 3438.1723598855174, "flops_watt": 6921651.821447654, "occupancy": 96.51991442025279, "strategy_time": 0, "framework_time": 0.4046190297231078, "timestamp": "2025-02-18 01:51:51.995281+00:00"},
"1,64,4,1": {"block_size_x": 1, "block_size_y": 64, "tile_size_x": 4, "tile_size_y": 1, "sm__warps_active.avg.pct_of_peak_sustained_active": 95.72231055098352, "sm__maximum_warps_per_active_cycle_pct": 95.72231055098352, "time": 86.00503758021763, "times": [88.85871887207031, 85.25843048095703, 85.66761779785156, 85.37920379638672, 85.67494201660156, 85.52371215820312, 85.67263793945312], "nvml_power": 115.792, "nvml_energy": 9.95869531148856, "compile_time": 250.6668739952147, "verification_time": 0, "benchmark_time": 1773.904053028673, "edp": 856.4979645145107, "flops_watt": 13800899.532838156, "occupancy": 95.72231055098352, "strategy_time": 0, "framework_time": 0.3998889587819576, "timestamp": "2025-02-18 01:51:54.020276+00:00"},
"1,64,4,2": {"block_size_x": 1, "block_size_y": 64, "tile_size_x": 4, "tile_size_y": 2, "sm__warps_active.avg.pct_of_peak_sustained_active": 95.43741916632958, "sm__maximum_warps_per_active_cycle_pct": 95.43741916632958, "time": 85.66823359898159, "times": [87.53427124023438, 85.18211364746094, 85.4966049194336, 85.36930847167969, 85.47328186035156, 85.26441955566406, 85.35763549804688], "nvml_power": 115.967, "nvml_energy": 9.934688045773097, "compile_time": 252.44640198070556, "verification_time": 0, "benchmark_time": 1765.909551992081, "edp": 851.0871762382995, "flops_watt": 13834249.534435662, "occupancy": 95.43741916632958, "strategy_time": 0, "framework_time": 0.41625008452683687, "timestamp": "2025-02-18 01:51:56.039072+00:00"},
"1,64,4,4": {"block_size_x": 1, "block_size_y": 64, "tile_size_x": 4, "tile_size_y": 4, "sm__warps_active.avg.pct_of_peak_sustained_active": 95.69992889033695, "sm__maximum_warps_per_active_cycle_pct": 95.69992889033695, "time": 85.21749114990234, "times": [87.51216125488281, 84.55174255371094, 84.53571319580078, 85.01110076904297, 85.0025634765625, 84.98400115966797, 84.92515563964844], "nvml_power": 116.126, "nvml_energy": 9.89596637727356, "compile_time": 251.8168119713664, "verification_time": 0, "benchmark_time": 1764.7399560082704, "edp": 843.3094271750407, "flops_watt": 13888381.208290426, "occupancy": 95.69992889033695, "strategy_time": 0, "framework_time": 0.3882200689986348, "timestamp": "2025-02-18 01:51:58.056041+00:00"},
"1,128,1,1": {"block_size_x": 1, "block_size_y": 128, "tile_size_x": 1, "tile_size_y": 1, "sm__warps_active.avg.pct_of_peak_sustained_active": 99.07086972116026, "sm__maximum_warps_per_active_cycle_pct": 99.07086972116026, "time": 334.1900416782924, "times": [333.45654296875, 337.054443359375, 333.5016174316406, 332.8572998046875, 334.81805419921875, 334.8272399902344, 332.8150939941406], "nvml_power": 114.941, "nvml_energy": 38.41213758054461, "compile_time": 252.70880199968815, "verification_time": 0, "benchmark_time": 3716.9026500778273, "edp": 12836.953858994504, "flops_watt": 3578008.4663034105, "occupancy": 99.07086972116026, "strategy_time": 0, "framework_time": 0.4043679218739271, "timestamp": "2025-02-18 01:52:02.026081+00:00"},
"1,128,1,2": {"block_size_x": 1, "block_size_y": 128, "tile_size_x": 1, "tile_size_y": 2, "sm__warps_active.avg.pct_of_peak_sustained_active": 99.07176281210133, "sm__maximum_warps_per_active_cycle_pct": 99.07176281210133, "time": 333.87747628348217, "times": [331.66314697265625, 336.89056396484375, 335.0404968261719, 332.8258361816406, 332.7098693847656, 335.22210693359375, 332.7903137207031], "nvml_power": 114.9595, "nvml_energy": 38.38238773481097, "compile_time": 251.42041395884007, "verification_time": 0, "benchmark_time": 3715.5993359629065, "edp": 12815.014750632767, "flops_watt": 3580781.748691198, "occupancy": 99.07176281210133, "strategy_time": 0, "framework_time": 0.4044901579618454, "timestamp": "2025-02-18 01:52:05.993532+00:00"},
"1,128,1,4": {"block_size_x": 1, "block_size_y": 128, "tile_size_x": 1, "tile_size_y": 4, "sm__warps_active.avg.pct_of_peak_sustained_active": 99.05590025469779, "sm__maximum_warps_per_active_cycle_pct": 99.05590025469779, "time": 333.6193629673549, "times": [333.74951171875, 336.2086181640625, 332.8130187988281, 330.25408935546875, 335.26141357421875, 335.41168212890625, 331.63720703125], "nvml_power": 114.79, "nvml_energy": 38.29616667502267, "compile_time": 252.1036530379206, "verification_time": 0, "benchmark_time": 3717.597789946012, "edp": 12776.34273021271, "flops_watt": 3588843.620780451, "occupancy": 99.05590025469779, "strategy_time": 0, "framework_time": 0.39893900975584984, "timestamp": "2025-02-18 01:52:09.963658+00:00"},
"1,128,2,1": {"block_size_x": 1, "block_size_y": 128, "tile_size_x": 2, "tile_size_y": 1, "sm__warps_active.avg.pct_of_peak_sustained_active": 98.90298143212506, "sm__maximum_warps_per_active_cycle_pct": 98.90298143212506, "time": 181.75373186383928, "times": [176.8985595703125, 173.94729614257812, 174.51199340820312, 184.965087890625, 190.59091186523438, 190.94979858398438, 180.4124755859375], "nvml_power": 115.605, "nvml_energy": 21.01164017211914, "compile_time": 254.10076207481325, "verification_time": 0, "benchmark_time": 2591.144864913076, "edp": 3818.944013862816, "flops_watt": 6541086.38574399, "occupancy": 98.90298143212506, "strategy_time": 0, "framework_time": 0.403948943130672, "timestamp": "2025-02-18 01:52:12.809332+00:00"},
"1,128,2,2": {"block_size_x": 1, "block_size_y": 128, "tile_size_x": 2, "tile_size_y": 2, "sm__warps_active.avg.pct_of_peak_sustained_active": 98.88647036006738, "sm__maximum_warps_per_active_cycle_pct": 98.88647036006738, "time": 181.23971121651786, "times": [177.18336486816406, 174.17213439941406, 174.2685089111328, 183.94143676757812, 190.37347412109375, 189.77711486816406, 178.96194458007812], "nvml_power": 115.119, "nvml_energy": 20.86413431553432, "compile_time": 249.89568605087698, "verification_time": 0, "benchmark_time": 2580.5672080023214, "edp": 3781.4096781300805, "flops_watt": 6587330.746316673, "occupancy": 98.88647036006738, "strategy_time": 0, "framework_time": 0.4178498638793826, "timestamp": "2025-02-18 01:52:15.640238+00:00"},
"1,128,2,4": {"block_size_x": 1, "block_size_y": 128, "tile_size_x": 2, "tile_size_y": 4, "sm__warps_active.avg.pct_of_peak_sustained_active": 98.87094392370358, "sm__maximum_warps_per_active_cycle_pct": 98.87094392370358, "time": 180.15929521833147, "times": [175.48658752441406, 172.6625213623047, 173.3434295654297, 182.9273223876953, 189.3958740234375, 188.95703125, 178.34230041503906], "nvml_power": 115.541, "nvml_energy": 20.815785128821236, "compile_time": 249.5181169360876, "verification_time": 0, "benchmark_time": 2561.645288951695, "edp": 3750.1571782246588, "flops_watt": 6602631.254187189, "occupancy": 98.87094392370358, "strategy_time": 0, "framework_time": 0.4089990397915244, "timestamp": "2025-02-18 01:52:18.451836+00:00"},
"1,128,4,1": {"block_size_x": 1, "block_size_y": 128, "tile_size_x": 4, "tile_size_y": 1, "sm__warps_active.avg.pct_of_peak_sustained_active": 98.43024483465904, "sm__maximum_warps_per_active_cycle_pct": 98.43024483465904, "time": 90.50548553466797, "times": [92.49565124511719, 90.16854095458984, 90.11980438232422, 90.18342590332031, 90.8707504272461, 90.06745910644531, 89.63276672363281], "nvml_power": 115.357, "nvml_energy": 10.440441294822694, "compile_time": 247.9899669997394, "verification_time": 0, "benchmark_time": 1886.360150994733, "edp": 944.9172085841254, "flops_watt": 13164094.274458928, "occupancy": 98.43024483465904, "strategy_time": 0, "framework_time": 0.40318898390978575, "timestamp": "2025-02-18 01:52:20.586615+00:00"},
"1,128,4,2": {"block_size_x": 1, "block_size_y": 128, "tile_size_x": 4, "tile_size_y": 2, "sm__warps_active.avg.pct_of_peak_sustained_active": 98.42849289489882, "sm__maximum_warps_per_active_cycle_pct": 98.42849289489882, "time": 89.53295135498047, "times": [91.88966369628906, 89.02204895019531, 89.21881866455078, 89.17257690429688, 89.22303771972656, 89.32870483398438, 88.87580871582031], "nvml_power": 117.088, "nvml_energy": 10.483234208251954, "compile_time": 252.55461304914206, "verification_time": 0, "benchmark_time": 1851.2273560045287, "edp": 938.5948984102894, "flops_watt": 13110358.000378732, "occupancy": 98.42849289489882, "strategy_time": 0, "framework_time": 0.43182994704693556, "timestamp": "2025-02-18 01:52:22.690852+00:00"},
"1,128,4,4": {"block_size_x": 1, "block_size_y": 128, "tile_size_x": 4, "tile_size_y": 4, "sm__warps_active.avg.pct_of_peak_sustained_active": 98.43337617504164, "sm__maximum_warps_per_active_cycle_pct": 98.43337617504164, "time": 89.55483572823661, "times": [91.9807357788086, 89.0732192993164, 89.03987121582031, 89.178466796875, 89.15238189697266, 88.9552993774414, 89.50387573242188], "nvml_power": 116.621, "nvml_energy": 10.443974497462682, "compile_time": 251.74510397482663, "verification_time": 0, "benchmark_time": 1848.1723599834368, "edp": 935.308420470163, "flops_watt": 13159640.853718113, "occupancy": 98.43337617504164, "strategy_time": 0, "framework_time": 0.39701000787317753, "timestamp": "2025-02-18 01:52:24.791190+00:00"},
"2,16,1,1": {"block_size_x": 2, "block_size_y": 16, "tile_size_x": 1, "tile_size_y": 1, "sm__warps_active.avg.pct_of_peak_sustained_active": 49.950861655601706, "sm__maximum_warps_per_active_cycle_pct": 49.950861655601706, "time": 179.22999572753906, "times": [175.82614135742188, 172.65670776367188, 172.8486328125, 179.81663513183594, 186.5978546142578, 186.97389221191406, 179.89010620117188], "nvml_power": 114.832, "nvml_energy": 20.581338869384766, "compile_time": 253.56176297646016, "verification_time": 0, "benchmark_time": 2541.996967047453, "edp": 3688.7932776268653, "flops_watt": 6677843.183294733, "occupancy": 49.950861655601706, "strategy_time": 0, "framework_time": 0.420699012465775, "timestamp": "2025-02-18 01:52:27.587195+00:00"},
"2,16,1,2": {"block_size_x": 2, "block_size_y": 16, "tile_size_x": 1, "tile_size_y": 2, "sm__warps_active.avg.pct_of_peak_sustained_active": 49.950990020445914, "sm__maximum_warps_per_active_cycle_pct": 49.950990020445914, "time": 179.3394056047712, "times": [175.52610778808594, 172.6814727783203, 173.37277221679688, 179.72434997558594, 187.91961669921875, 187.2836456298828, 178.8678741455078], "nvml_power": 115.085, "nvml_energy": 20.639275494025092, "compile_time": 251.9867850933224, "verification_time": 0, "benchmark_time": 2544.8062350042164, "edp": 3701.4353992115807, "flops_watt": 6659097.772680417, "occupancy": 49.950990020445914, "strategy_time": 0, "framework_time": 0.4002489149570465, "timestamp": "2025-02-18 01:52:30.384412+00:00"},
"2,16,1,4": {"block_size_x": 2, "block_size_y": 16, "tile_size_x": 1, "tile_size_y": 4, "sm__warps_active.avg.pct_of_peak_sustained_active": 49.95253266260674, "sm__maximum_warps_per_active_cycle_pct": 49.95253266260674, "time": 179.07457188197546, "times": [175.0347137451172, 172.4897003173828, 172.6549072265625, 178.36883544921875, 186.4851837158203, 186.60060119628906, 181.8880615234375], "nvml_power": 114.928, "nvml_energy": 20.580682397251675, "compile_time": 253.57204396277666, "verification_time": 0, "benchmark_time": 2524.292317102663, "edp": 3685.476889326752, "flops_watt": 6678056.189738075, "occupancy": 49.95253266260674, "strategy_time": 0, "framework_time": 0.39697985630482435, "timestamp": "2025-02-18 01:52:33.162697+00:00"},
"2,16,2,1": {"block_size_x": 2, "block_size_y": 16, "tile_size_x": 2, "tile_size_y": 1, "sm__warps_active.avg.pct_of_peak_sustained_active": 49.95224614945043, "sm__maximum_warps_per_active_cycle_pct": 49.95224614945043, "time": 177.39849635532923, "times": [175.6375732421875, 172.2418212890625, 172.19017028808594, 176.49839782714844, 184.8395538330078, 184.10537719726562, 176.27658081054688], "nvml_power": 115.112, "nvml_energy": 20.420695712454656, "compile_time": 254.45875304285437, "verification_time": 0, "benchmark_time": 2517.4913669470698, "edp": 3622.6007139191743, "flops_watt": 6730375.664340147, "occupancy": 49.95224614945043, "strategy_time": 0, "framework_time": 0.40215998888015747, "timestamp": "2025-02-18 01:52:35.935073+00:00"},
"2,16,2,2": {"block_size_x": 2, "block_size_y": 16, "tile_size_x": 2, "tile_size_y": 2, "sm__warps_active.avg.pct_of_peak_sustained_active": 49.95201840266839, "sm__maximum_warps_per_active_cycle_pct": 49.95201840266839, "time": 177.61046709333147, "times": [176.09677124023438, 172.1899871826172, 172.89450073242188, 177.64649963378906, 184.95079040527344, 184.1961212158203, 175.29859924316406], "nvml_power": 115.326, "nvml_energy": 20.483104728005543, "compile_time": 255.68859209306538, "verification_time": 0, "benchmark_time": 2522.9160629678518, "edp": 3638.0137982626907, "flops_watt": 6709869.196933142, "occupancy": 49.95201840266839, "strategy_time": 0, "framework_time": 0.4036988830193877, "timestamp": "2025-02-18 01:52:38.714107+00:00"},
"2,16,2,4": {"block_size_x": 2, "block_size_y": 16, "tile_size_x": 2, "tile_size_y": 4, "sm__warps_active.avg.pct_of_peak_sustained_active": 49.95241904312803, "sm__maximum_warps_per_active_cycle_pct": 49.95241904312803, "time": 179.79470825195312, "times": [176.58746337890625, 173.05059814453125, 173.62509155273438, 181.31321716308594, 188.82179260253906, 188.03631591796875, 177.12847900390625], "nvml_power": 115.385, "nvml_energy": 20.745612411651614, "compile_time": 252.938944962807, "verification_time": 0, "benchmark_time": 2542.533576954156, "edp": 3729.9513310609996, "flops_watt": 6624964.871840007, "occupancy": 49.95241904312803, "strategy_time": 0, "framework_time": 0.40179002098739147, "timestamp": "2025-02-18 01:52:41.510006+00:00"},
"2,16,4,1": {"block_size_x": 2, "block_size_y": 16, "tile_size_x": 4, "tile_size_y": 1, "sm__warps_active.avg.pct_of_peak_sustained_active": 49.905508711206075, "sm__maximum_warps_per_active_cycle_pct": 49.905508711206075, "time": 88.14817701067243, "times": [91.15519714355469, 87.5330581665039, 87.60176086425781, 87.42662048339844, 87.49199676513672, 87.77938842773438, 88.0492172241211], "nvml_power": 114.986, "nvml_energy": 10.135806281749181, "compile_time": 255.3814920829609, "verification_time": 0, "benchmark_time": 1827.885370934382, "edp": 893.4528462695123, "flops_watt": 13559745.485613361, "occupancy": 49.905508711206075, "strategy_time": 0, "framework_time": 0.4118590150028467, "timestamp": "2025-02-18 01:52:43.593710+00:00"},
"2,16,4,2": {"block_size_x": 2, "block_size_y": 16, "tile_size_x": 4, "tile_size_y": 2, "sm__warps_active.avg.pct_of_peak_sustained_active": 49.90707581066195, "sm__maximum_warps_per_active_cycle_pct": 49.90707581066195, "time": 87.91660853794643, "times": [91.08611297607422, 87.01091003417969, 87.4208984375, 87.2557144165039, 87.34941101074219, 87.73715209960938, 87.55606079101562], "nvml_power": 115.345, "nvml_energy": 10.14074121180943, "compile_time": 254.58148401230574, "verification_time": 0, "benchmark_time": 1824.599944986403, "edp": 891.5395754032702, "flops_watt": 13553146.717909047, "occupancy": 49.90707581066195, "strategy_time": 0, "framework_time": 0.41107996366918087, "timestamp": "2025-02-18 01:52:45.673328+00:00"},
"2,16,4,4": {"block_size_x": 2, "block_size_y": 16, "tile_size_x": 4, "tile_size_y": 4, "sm__warps_active.avg.pct_of_peak_sustained_active": 49.907761622131666, "sm__maximum_warps_per_active_cycle_pct": 49.907761622131666, "time": 88.07972390311105, "times": [91.35932922363281, 87.31759643554688, 87.5389404296875, 87.80294036865234, 87.34210968017578, 87.54454040527344, 87.6526107788086], "nvml_power": 116.49, "nvml_energy": 10.260407037473405, "compile_time": 251.89720606431365, "verification_time": 0, "benchmark_time": 1822.5346979452297, "edp": 903.7338189941951, "flops_watt": 13395078.08706232, "occupancy": 49.907761622131666, "strategy_time": 0, "framework_time": 0.39212999399751425, "timestamp": "2025-02-18 01:52:47.748175+00:00"},
"2,32,1,1": {"block_size_x": 2, "block_size_y": 32, "tile_size_x": 1, "tile_size_y": 1, "sm__warps_active.avg.pct_of_peak_sustained_active": 99.23487572609062, "sm__maximum_warps_per_active_cycle_pct": 99.23487572609062, "time": 210.52869960239954, "times": [204.78866577148438, 202.82870483398438, 206.5364227294922, 223.93338012695312, 223.33030700683594, 208.493408203125, 203.79000854492188], "nvml_power": 115.119, "nvml_energy": 24.23585336952863, "compile_time": 241.62063596304506, "verification_time": 0, "benchmark_time": 2780.9833840001374, "edp": 5102.342693641296, "flops_watt": 5670893.918049525, "occupancy": 99.23487572609062, "strategy_time": 0, "framework_time": 0.39329007267951965, "timestamp": "2025-02-18 01:52:50.771196+00:00"},
"2,32,1,2": {"block_size_x": 2, "block_size_y": 32, "tile_size_x": 1, "tile_size_y": 2, "sm__warps_active.avg.pct_of_peak_sustained_active": 99.24224878399737, "sm__maximum_warps_per_active_cycle_pct": 99.24224878399737, "time": 211.79268537248885, "times": [206.09706115722656, 203.6334686279297, 213.98681640625, 225.42227172851562, 222.3007049560547, 205.93942260742188, 205.16905212402344], "nvml_power": 115.479, "nvml_energy": 24.45760751412964, "compile_time": 251.47319689858705, "verification_time": 0, "benchmark_time": 2766.093880054541, "edp": 5179.942373203879, "flops_watt": 5619476.614488919, "occupancy": 99.24224878399737, "strategy_time": 0, "framework_time": 0.3934700507670641, "timestamp": "2025-02-18 01:52:53.789180+00:00"},
"2,32,1,4": {"block_size_x": 2, "block_size_y": 32, "tile_size_x": 1, "tile_size_y": 4, "sm__warps_active.avg.pct_of_peak_sustained_active": 99.23824315976387, "sm__maximum_warps_per_active_cycle_pct": 99.23824315976387, "time": 207.8573237827846, "times": [204.25808715820312, 201.47695922851562, 204.48313903808594, 223.0833282470703, 216.46665954589844, 203.1146240234375, 202.11846923828125], "nvml_power": 116.015, "nvml_energy": 24.114567418659757, "compile_time": 251.82826700620353, "verification_time": 0, "benchmark_time": 2745.3373830066994, "edp": 5012.389447822149, "flops_watt": 5699416.086794502, "occupancy": 99.23824315976387, "strategy_time": 0, "framework_time": 0.4102200036868453, "timestamp": "2025-02-18 01:52:56.786780+00:00"},
"2,32,2,1": {"block_size_x": 2, "block_size_y": 32, "tile_size_x": 2, "tile_size_y": 1, "sm__warps_active.avg.pct_of_peak_sustained_active": 99.33058152263408, "sm__maximum_warps_per_active_cycle_pct": 99.33058152263408, "time": 207.9628666469029, "times": [203.72618103027344, 201.47308349609375, 204.9324188232422, 224.2198028564453, 215.65589904785156, 203.4838104248047, 202.24887084960938], "nvml_power": 116.361, "nvml_energy": 24.19876712590027, "compile_time": 251.86500698328018, "verification_time": 0, "benchmark_time": 2755.086446995847, "edp": 5032.4449808230565, "flops_watt": 5679584.94566846, "occupancy": 99.33058152263408, "strategy_time": 0, "framework_time": 0.39826007559895515, "timestamp": "2025-02-18 01:52:59.794154+00:00"},
"2,32,2,2": {"block_size_x": 2, "block_size_y": 32, "tile_size_x": 2, "tile_size_y": 2, "sm__warps_active.avg.pct_of_peak_sustained_active": 99.3256723424297, "sm__maximum_warps_per_active_cycle_pct": 99.3256723424297, "time": 208.91241891043526, "times": [204.45046997070312, 202.8904266357422, 206.45004272460938, 223.89500427246094, 217.46319580078125, 203.79344177246094, 203.44435119628906], "nvml_power": 116.335, "nvml_energy": 24.303826253945488, "compile_time": 250.18563901539892, "verification_time": 0, "benchmark_time": 2763.37413105648, "edp": 5077.371131490694, "flops_watt": 5655033.575204568, "occupancy": 99.3256723424297, "strategy_time": 0, "framework_time": 0.3982399357482791, "timestamp": "2025-02-18 01:53:02.808136+00:00"},
"2,32,2,4": {"block_size_x": 2, "block_size_y": 32, "tile_size_x": 2, "tile_size_y": 4, "sm__warps_active.avg.pct_of_peak_sustained_active": 99.32998721853889, "sm__maximum_warps_per_active_cycle_pct": 99.32998721853889, "time": 213.4270782470703, "times": [207.8224639892578, 205.24050903320312, 215.5157470703125, 225.90185546875, 224.2571258544922, 207.5945281982422, 207.65731811523438], "nvml_power": 114.775, "nvml_energy": 24.496092905807494, "compile_time": 253.04231594782323, "verification_time": 0, "benchmark_time": 2790.881267050281, "edp": 5228.12953735528, "flops_watt": 5610647.9511031, "occupancy": 99.32998721853889, "strategy_time": 0, "framework_time": 0.3966499352827668, "timestamp": "2025-02-18 01:53:05.852482+00:00"},
"2,32,4,1": {"block_size_x": 2, "block_size_y": 32, "tile_size_x": 4, "tile_size_y": 1, "sm__warps_active.avg.pct_of_peak_sustained_active": 97.45038020292914, "sm__maximum_warps_per_active_cycle_pct": 97.45038020292914, "time": 101.30951908656529, "times": [102.78966522216797, 100.89798736572266, 100.47264099121094, 100.63040161132812, 100.6460189819336, 100.75279998779297, 102.97711944580078], "nvml_power": 114.985, "nvml_energy": 11.649075052168708, "compile_time": 252.13036802597344, "verification_time": 0, "benchmark_time": 1906.0072189895436, "edp": 1180.1621913385172, "flops_watt": 11798271.781793782, "occupancy": 97.45038020292914, "strategy_time": 0, "framework_time": 0.40790997445583344, "timestamp": "2025-02-18 01:53:08.011053+00:00"},
"2,32,4,2": {"block_size_x": 2, "block_size_y": 32, "tile_size_x": 4, "tile_size_y": 2, "sm__warps_active.avg.pct_of_peak_sustained_active": 97.42824223546826, "sm__maximum_warps_per_active_cycle_pct": 97.42824223546826, "time": 100.203369140625, "times": [102.4384994506836, 99.80928039550781, 99.9710693359375, 99.92768096923828, 99.75504302978516, 99.87522888183594, 99.64678192138672], "nvml_power": 116.092, "nvml_energy": 11.632809530273438, "compile_time": 253.7050760583952, "verification_time": 0, "benchmark_time": 1866.1001588916406, "edp": 1165.6467075045698, "flops_watt": 11814768.660513725, "occupancy": 97.42824223546826, "strategy_time": 0, "framework_time": 0.39942003786563873, "timestamp": "2025-02-18 01:53:10.131283+00:00"},
"2,32,4,4": {"block_size_x": 2, "block_size_y": 32, "tile_size_x": 4, "tile_size_y": 4, "sm__warps_active.avg.pct_of_peak_sustained_active": 97.43452816386994, "sm__maximum_warps_per_active_cycle_pct": 97.43452816386994, "time": 99.83508954729352, "times": [101.58041381835938, 99.59040069580078, 99.23999786376953, 99.52473449707031, 99.13174438476562, 99.26576232910156, 100.5125732421875], "nvml_power": 114.325, "nvml_energy": 11.413646612494333, "compile_time": 247.5557029247284, "verification_time": 0, "benchmark_time": 1972.3243080079556, "edp": 1139.482431619535, "flops_watt": 12041633.85622504, "occupancy": 97.43452816386994, "strategy_time": 0, "framework_time": 0.40976901073008776, "timestamp": "2025-02-18 01:53:12.351597+00:00"},
"2,64,1,1": {"block_size_x": 2, "block_size_y": 64, "tile_size_x": 1, "tile_size_y": 1, "sm__warps_active.avg.pct_of_peak_sustained_active": 98.09338329926719, "sm__maximum_warps_per_active_cycle_pct": 98.09338329926719, "time": 214.6464080810547, "times": [208.56410217285156, 206.0431365966797, 212.58172607421875, 228.9969940185547, 227.26914978027344, 211.3456268310547, 207.72412109375], "nvml_power": 115.503, "nvml_energy": 24.79230407258606, "compile_time": 253.77833691891283, "verification_time": 0, "benchmark_time": 2838.2901600562036, "edp": 5321.579017233901, "flops_watt": 5543613.577407366, "occupancy": 98.09338329926719, "strategy_time": 0, "framework_time": 0.39616902358829975, "timestamp": "2025-02-18 01:53:15.444085+00:00"},
"2,64,1,2": {"block_size_x": 2, "block_size_y": 64, "tile_size_x": 1, "tile_size_y": 2, "sm__warps_active.avg.pct_of_peak_sustained_active": 98.0342997584009, "sm__maximum_warps_per_active_cycle_pct": 98.0342997584009, "time": 215.13716561453683, "times": [208.79568481445312, 206.64285278320312, 213.9593963623047, 228.96665954589844, 228.0213165283203, 210.96890258789062, 208.6053466796875], "nvml_power": 115.821, "nvml_energy": 24.91740165864127, "compile_time": 250.5045310826972, "verification_time": 0, "benchmark_time": 2842.409807955846, "edp": 5360.659167319041, "flops_watt": 5515781.91638359, "occupancy": 98.0342997584009, "strategy_time": 0, "framework_time": 0.40997902397066355, "timestamp": "2025-02-18 01:53:18.537434+00:00"},
"2,64,1,4": {"block_size_x": 2, "block_size_y": 64, "tile_size_x": 1, "tile_size_y": 4, "sm__warps_active.avg.pct_of_peak_sustained_active": 97.99557022113373, "sm__maximum_warps_per_active_cycle_pct": 97.99557022113373, "time": 212.04940795898438, "times": [207.54888916015625, 205.4752960205078, 209.6021728515625, 228.91110229492188, 220.71273803710938, 205.9870147705078, 206.108642578125], "nvml_power": 115.458, "nvml_energy": 24.48280054412842, "compile_time": 249.81481104623526, "verification_time": 0, "benchmark_time": 2801.0896909981966, "edp": 5191.563360560332, "flops_watt": 5613694.120665508, "occupancy": 97.99557022113373, "strategy_time": 0, "framework_time": 0.39550894871354103, "timestamp": "2025-02-18 01:53:21.588760+00:00"},
"2,64,2,1": {"block_size_x": 2, "block_size_y": 64, "tile_size_x": 2, "tile_size_y": 1, "sm__warps_active.avg.pct_of_peak_sustained_active": 98.02932947804518, "sm__maximum_warps_per_active_cycle_pct": 98.02932947804518, "time": 213.53297424316406, "times": [209.1967010498047, 207.02102661132812, 212.1631622314453, 229.43785095214844, 221.27520751953125, 207.8184051513672, 207.81846618652344], "nvml_power": 115.659, "nvml_energy": 24.697010267990112, "compile_time": 250.2724500373006, "verification_time": 0, "benchmark_time": 2827.157938037999, "edp": 5273.626057437891, "flops_watt": 5565003.698044177, "occupancy": 98.02932947804518, "strategy_time": 0, "framework_time": 0.4087799461558461, "timestamp": "2025-02-18 01:53:24.666625+00:00"},
"2,64,2,2": {"block_size_x": 2, "block_size_y": 64, "tile_size_x": 2, "tile_size_y": 2, "sm__warps_active.avg.pct_of_peak_sustained_active": 97.997270503506, "sm__maximum_warps_per_active_cycle_pct": 97.997270503506, "time": 212.48702784946985, "times": [208.536865234375, 206.2852783203125, 210.95529174804688, 229.52024841308594, 218.60086059570312, 206.44012451171875, 207.07052612304688], "nvml_power": 115.452, "nvml_energy": 24.532052339276994, "compile_time": 252.57292797323316, "verification_time": 0, "benchmark_time": 2812.5909550581127, "edp": 5212.742888620603, "flops_watt": 5602423.783025835, "occupancy": 97.997270503506, "strategy_time": 0, "framework_time": 0.4119699588045478, "timestamp": "2025-02-18 01:53:27.732225+00:00"},
"2,64,2,4": {"block_size_x": 2, "block_size_y": 64, "tile_size_x": 2, "tile_size_y": 4, "sm__warps_active.avg.pct_of_peak_sustained_active": 97.94986116932787, "sm__maximum_warps_per_active_cycle_pct": 97.94986116932787, "time": 213.8213609967913, "times": [208.92918395996094, 206.5972442626953, 212.57379150390625, 230.93064880371094, 221.47264099121094, 208.63145446777344, 207.61456298828125], "nvml_power": 115.569, "nvml_energy": 24.711120869038176, "compile_time": 252.99159798305482, "verification_time": 0, "benchmark_time": 2822.3386988975108, "edp": 5283.765495973955, "flops_watt": 5561825.956838901, "occupancy": 97.94986116932787, "strategy_time": 0, "framework_time": 0.3984192153438926, "timestamp": "2025-02-18 01:53:30.807978+00:00"},
"2,64,4,1": {"block_size_x": 2, "block_size_y": 64, "tile_size_x": 4, "tile_size_y": 1, "sm__warps_active.avg.pct_of_peak_sustained_active": 97.83291417962599, "sm__maximum_warps_per_active_cycle_pct": 97.83291417962599, "time": 104.69590977260044, "times": [105.82086181640625, 103.7109146118164, 104.06416320800781, 103.94064331054688, 103.97081756591797, 103.93020629882812, 107.43376159667969], "nvml_power": 114.216, "nvml_energy": 11.957948030587332, "compile_time": 251.32771104108542, "verification_time": 0, "benchmark_time": 1950.2059700898826, "edp": 1251.9482480758165, "flops_watt": 11493523.229942445, "occupancy": 97.83291417962599, "strategy_time": 0, "framework_time": 0.4012187710031867, "timestamp": "2025-02-18 01:53:33.009938+00:00"},
"2,64,4,2": {"block_size_x": 2, "block_size_y": 64, "tile_size_x": 4, "tile_size_y": 2, "sm__warps_active.avg.pct_of_peak_sustained_active": 97.81059729307088, "sm__maximum_warps_per_active_cycle_pct": 97.81059729307088, "time": 106.24816458565849, "times": [106.65318298339844, 104.9295654296875, 104.93065643310547, 105.27017974853516, 105.12115478515625, 104.92313385009766, 111.9092788696289], "nvml_power": 114.402, "nvml_energy": 12.155002524928502, "compile_time": 254.9415579997003, "verification_time": 0, "benchmark_time": 1981.901292107068, "edp": 1291.4467088076979, "flops_watt": 11307192.506963994, "occupancy": 97.81059729307088, "strategy_time": 0, "framework_time": 0.4011899000033736, "timestamp": "2025-02-18 01:53:35.247207+00:00"},
"2,64,4,4": {"block_size_x": 2, "block_size_y": 64, "tile_size_x": 4, "tile_size_y": 4, "sm__warps_active.avg.pct_of_peak_sustained_active": 97.76784288315824, "sm__maximum_warps_per_active_cycle_pct": 97.76784288315824, "time": 106.10203007289341, "times": [106.91763305664062, 104.75737762451172, 105.04771423339844, 104.97676849365234, 105.0670394897461, 104.8939208984375, 111.05375671386719], "nvml_power": 115.335, "nvml_energy": 12.237277638457162, "compile_time": 252.08190002012998, "verification_time": 0, "benchmark_time": 1982.758042984642, "edp": 1298.400000005928, "flops_watt": 11231170.651884293, "occupancy": 97.76784288315824, "strategy_time": 0, "framework_time": 0.41094899643212557, "timestamp": "2025-02-18 01:53:37.482483+00:00"},
"2,128,1,1": {"block_size_x": 2, "block_size_y": 128, "tile_size_x": 1, "tile_size_y": 1, "sm__warps_active.avg.pct_of_peak_sustained_active": 98.34034611290798, "sm__maximum_warps_per_active_cycle_pct": 98.34034611290798, "time": 181.30128043038505, "times": [179.44642639160156, 178.16954040527344, 178.3326416015625, 185.57017517089844, 184.50636291503906, 182.67015075683594, 180.41366577148438], "nvml_power": 115.263, "nvml_energy": 20.89732948624747, "compile_time": 252.5116699980572, "verification_time": 0, "benchmark_time": 2573.4363219235092, "edp": 3788.712593432307, "flops_watt": 6576866.846189535, "occupancy": 98.34034611290798, "strategy_time": 0, "framework_time": 0.3970790421590209, "timestamp": "2025-02-18 01:53:40.308853+00:00"},
"2,128,1,2": {"block_size_x": 2, "block_size_y": 128, "tile_size_x": 1, "tile_size_y": 2, "sm__warps_active.avg.pct_of_peak_sustained_active": 98.31655653165629, "sm__maximum_warps_per_active_cycle_pct": 98.31655653165629, "time": 182.77509416852678, "times": [180.39468383789062, 179.28512573242188, 179.1670379638672, 188.0358428955078, 189.06898498535156, 183.11167907714844, 180.3623046875], "nvml_power": 115.679, "nvml_energy": 21.14324011832101, "compile_time": 252.6059290394187, "verification_time": 0, "benchmark_time": 2590.0561079615727, "edp": 3864.457703653896, "flops_watt": 6500373.296754389, "occupancy": 98.31655653165629, "strategy_time": 0, "framework_time": 0.4214999498799443, "timestamp": "2025-02-18 01:53:43.151962+00:00"},
"2,128,1,4": {"block_size_x": 2, "block_size_y": 128, "tile_size_x": 1, "tile_size_y": 4, "sm__warps_active.avg.pct_of_peak_sustained_active": 97.72583575962102, "sm__maximum_warps_per_active_cycle_pct": 97.72583575962102, "time": 186.96335928780692, "times": [184.2163848876953, 182.07635498046875, 183.14230346679688, 193.5555877685547, 190.96759033203125, 189.18199157714844, 185.60330200195312], "nvml_power": 115.859, "nvml_energy": 21.661387843726022, "compile_time": 252.94725003186613, "verification_time": 0, "benchmark_time": 2658.323584939353, "edp": 4049.8858380990814, "flops_watt": 6344882.168379053, "occupancy": 97.72583575962102, "strategy_time": 0, "framework_time": 0.4296500701457262, "timestamp": "2025-02-18 01:53:46.063689+00:00"},
"2,128,2,1": {"block_size_x": 2, "block_size_y": 128, "tile_size_x": 2, "tile_size_y": 1, "sm__warps_active.avg.pct_of_peak_sustained_active": 96.2658162290008, "sm__maximum_warps_per_active_cycle_pct": 96.2658162290008, "time": 199.72581917898995, "times": [196.07833862304688, 194.4617919921875, 195.66111755371094, 209.04518127441406, 207.75523376464844, 199.9501495361328, 195.12892150878906], "nvml_power": 115.077, "nvml_energy": 22.983848093660626, "compile_time": 254.03132906649262, "verification_time": 0, "benchmark_time": 2840.576324961148, "edp": 4590.467888391835, "flops_watt": 5979806.032128634, "occupancy": 96.2658162290008, "strategy_time": 0, "framework_time": 0.40542997885495424, "timestamp": "2025-02-18 01:53:49.158727+00:00"},
"2,128,2,2": {"block_size_x": 2, "block_size_y": 128, "tile_size_x": 2, "tile_size_y": 2, "sm__warps_active.avg.pct_of_peak_sustained_active": 95.9381710159271, "sm__maximum_warps_per_active_cycle_pct": 95.9381710159271, "time": 196.91832406180245, "times": [194.4847412109375, 192.52207946777344, 193.5855712890625, 207.05856323242188, 203.72201538085938, 193.7078399658203, 193.3474578857422], "nvml_power": 115.28800000000001, "nvml_energy": 22.702319744437084, "compile_time": 254.9223090754822, "verification_time": 0, "benchmark_time": 2803.772972081788, "edp": 4470.502756389717, "flops_watt": 6053960.785468968, "occupancy": 95.9381710159271, "strategy_time": 0, "framework_time": 0.40092889685183764, "timestamp": "2025-02-18 01:53:52.217848+00:00"},
"2,128,2,4": {"block_size_x": 2, "block_size_y": 128, "tile_size_x": 2, "tile_size_y": 4, "sm__warps_active.avg.pct_of_peak_sustained_active": 95.69561314254777, "sm__maximum_warps_per_active_cycle_pct": 95.69561314254777, "time": 196.9503914969308, "times": [194.07708740234375, 192.8236083984375, 193.88377380371094, 206.826171875, 204.2024383544922, 193.51834106445312, 193.32131958007812], "nvml_power": 116.241, "nvml_energy": 22.893710457994732, "compile_time": 255.2523190388456, "verification_time": 0, "benchmark_time": 2803.1816449947655, "edp": 4508.925237519441, "flops_watt": 6003349.859961421, "occupancy": 95.69561314254777, "strategy_time": 0, "framework_time": 0.4119989462196827, "timestamp": "2025-02-18 01:53:55.276717+00:00"},
"2,128,4,1": {"block_size_x": 2, "block_size_y": 128, "tile_size_x": 4, "tile_size_y": 1, "sm__warps_active.avg.pct_of_peak_sustained_active": 96.4545308176673, "sm__maximum_warps_per_active_cycle_pct": 96.4545308176673, "time": 95.0677991594587, "times": [96.76297760009766, 94.5789794921875, 95.06771087646484, 95.06707000732422, 94.99581146240234, 94.51020812988281, 94.49183654785156], "nvml_power": 116.106, "nvml_energy": 11.037941889208112, "compile_time": 250.5547929322347, "verification_time": 0, "benchmark_time": 1857.1269729873165, "edp": 1049.3528426570128, "flops_watt": 12451501.81542224, "occupancy": 96.4545308176673, "strategy_time": 0, "framework_time": 0.4284291062504053, "timestamp": "2025-02-18 01:53:57.384852+00:00"},
"2,128,4,2": {"block_size_x": 2, "block_size_y": 128, "tile_size_x": 4, "tile_size_y": 2, "sm__warps_active.avg.pct_of_peak_sustained_active": 96.16253782510884, "sm__maximum_warps_per_active_cycle_pct": 96.16253782510884, "time": 95.49975694928851, "times": [96.85740661621094, 95.75820922851562, 95.50284576416016, 94.50953674316406, 94.99343872070312, 95.37996673583984, 95.49689483642578], "nvml_power": 115.772, "nvml_energy": 11.05619786153303, "compile_time": 252.74050096049905, "verification_time": 0, "benchmark_time": 1870.7766600418836, "edp": 1055.8642085596478, "flops_watt": 12430941.91993259, "occupancy": 96.16253782510884, "strategy_time": 0, "framework_time": 0.4128590226173401, "timestamp": "2025-02-18 01:53:59.508808+00:00"},
"2,128,4,4": {"block_size_x": 2, "block_size_y": 128, "tile_size_x": 4, "tile_size_y": 4, "sm__warps_active.avg.pct_of_peak_sustained_active": 96.1260145419406, "sm__maximum_warps_per_active_cycle_pct": 96.1260145419406, "time": 95.45608847481864, "times": [97.13235473632812, 94.69561767578125, 95.44617462158203, 95.62774658203125, 95.24748992919922, 95.0511703491211, 94.9920654296875], "nvml_power": 116.387, "nvml_energy": 11.109847769318717, "compile_time": 250.4367029760033, "verification_time": 0, "benchmark_time": 1869.5018830476329, "edp": 1060.502611609854, "flops_watt": 12370912.394637436, "occupancy": 96.1260145419406, "strategy_time": 0, "framework_time": 0.41960994713008404, "timestamp": "2025-02-18 01:54:01.629190+00:00"},
"4,16,1,1": {"block_size_x": 4, "block_size_y": 16, "tile_size_x": 1, "tile_size_y": 1, "sm__warps_active.avg.pct_of_peak_sustained_active": 97.48849732745414, "sm__maximum_warps_per_active_cycle_pct": 97.48849732745414, "time": 144.1110556466239, "times": [140.10330200195312, 138.78819274902344, 138.56944274902344, 138.746337890625, 145.77561950683594, 153.14041137695312, 153.65408325195312], "nvml_power": 114.104, "nvml_energy": 16.443647893502373, "compile_time": 250.14635303523391, "verification_time": 0, "benchmark_time": 2184.096916927956, "edp": 2369.7114566140103, "flops_watt": 8358179.058693438, "occupancy": 97.48849732745414, "strategy_time": 0, "framework_time": 0.39715005550533533, "timestamp": "2025-02-18 01:54:04.063854+00:00"},
"4,16,1,2": {"block_size_x": 4, "block_size_y": 16, "tile_size_x": 1, "tile_size_y": 2, "sm__warps_active.avg.pct_of_peak_sustained_active": 97.30663664741974, "sm__maximum_warps_per_active_cycle_pct": 97.30663664741974, "time": 143.85065351213728, "times": [139.22962951660156, 138.29161071777344, 138.4752655029297, 138.2428436279297, 144.61074829101562, 154.06434631347656, 154.04013061523438], "nvml_power": 113.89, "nvml_energy": 16.383150928497315, "compile_time": 250.83056290168315, "verification_time": 0, "benchmark_time": 2186.4690360380337, "edp": 2356.7269676523174, "flops_watt": 8389042.747139368, "occupancy": 97.30663664741974, "strategy_time": 0, "framework_time": 0.39681000635027885, "timestamp": "2025-02-18 01:54:06.501576+00:00"},
"4,16,1,4": {"block_size_x": 4, "block_size_y": 16, "tile_size_x": 1, "tile_size_y": 4, "sm__warps_active.avg.pct_of_peak_sustained_active": 97.26988220206351, "sm__maximum_warps_per_active_cycle_pct": 97.26988220206351, "time": 147.04903956821985, "times": [145.88348388671875, 139.79049682617188, 139.9529266357422, 139.81411743164062, 152.2972869873047, 156.48509216308594, 155.119873046875], "nvml_power": 113.044, "nvml_energy": 16.623011628949843, "compile_time": 253.23748006485403, "verification_time": 0, "benchmark_time": 2201.032213983126, "edp": 2444.397894768424, "flops_watt": 8267993.582621507, "occupancy": 97.26988220206351, "strategy_time": 0, "framework_time": 0.40018989238888025, "timestamp": "2025-02-18 01:54:08.956270+00:00"},
"4,16,2,1": {"block_size_x": 4, "block_size_y": 16, "tile_size_x": 2, "tile_size_y": 1, "sm__warps_active.avg.pct_of_peak_sustained_active": 97.18777881948827, "sm__maximum_warps_per_active_cycle_pct": 97.18777881948827, "time": 138.95418875558036, "times": [135.09280395507812, 134.36489868164062, 134.46604919433594, 133.98585510253906, 136.4085693359375, 150.2052764892578, 148.15586853027344], "nvml_power": 113.92, "nvml_energy": 15.829661183035714, "compile_time": 253.39579104911536, "verification_time": 0, "benchmark_time": 2241.8011070694774, "edp": 2199.597727964428, "flops_watt": 8682368.61691583, "occupancy": 97.18777881948827, "strategy_time": 0, "framework_time": 0.4260498099029064, "timestamp": "2025-02-18 01:54:11.451918+00:00"},
"4,16,2,2": {"block_size_x": 4, "block_size_y": 16, "tile_size_x": 2, "tile_size_y": 2, "sm__warps_active.avg.pct_of_peak_sustained_active": 96.95431645174043, "sm__maximum_warps_per_active_cycle_pct": 96.95431645174043, "time": 138.67034040178572, "times": [135.1546173095703, 134.2079315185547, 134.29510498046875, 134.0773468017578, 135.69158935546875, 149.20448303222656, 148.06130981445312], "nvml_power": 114.577, "nvml_energy": 15.888431592215403, "compile_time": 253.7786610191688, "verification_time": 0, "benchmark_time": 2244.8792250361294, "edp": 2203.254217342996, "flops_watt": 8650253.026821021, "occupancy": 96.95431645174043, "strategy_time": 0, "framework_time": 0.4010389093309641, "timestamp": "2025-02-18 01:54:13.951003+00:00"},
"4,16,2,4": {"block_size_x": 4, "block_size_y": 16, "tile_size_x": 2, "tile_size_y": 4, "sm__warps_active.avg.pct_of_peak_sustained_active": 96.5509921108404, "sm__maximum_warps_per_active_cycle_pct": 96.5509921108404, "time": 138.04536873953683, "times": [134.16854858398438, 133.0181427001953, 133.5305938720703, 132.94003295898438, 135.30380249023438, 148.44288635253906, 148.91357421875], "nvml_power": 114.648, "nvml_energy": 15.826625435250417, "compile_time": 254.57970099523664, "verification_time": 0, "benchmark_time": 2235.3586649987847, "edp": 2184.7923441116764, "flops_watt": 8684034.005498366, "occupancy": 96.5509921108404, "strategy_time": 0, "framework_time": 0.4024700028821826, "timestamp": "2025-02-18 01:54:16.441368+00:00"},
"4,16,4,1": {"block_size_x": 4, "block_size_y": 16, "tile_size_x": 4, "tile_size_y": 1, "sm__warps_active.avg.pct_of_peak_sustained_active": 97.1608460501559, "sm__maximum_warps_per_active_cycle_pct": 97.1608460501559, "time": 138.59537833077567, "times": [135.14012145996094, 133.5661163330078, 133.4884490966797, 133.60231018066406, 138.03680419921875, 148.5972137451172, 147.73663330078125], "nvml_power": 114.149, "nvml_energy": 15.820523841079712, "compile_time": 252.54505197517574, "verification_time": 0, "benchmark_time": 2247.1365759847686, "edp": 2192.6514871454992, "flops_watt": 8687383.227799626, "occupancy": 97.1608460501559, "strategy_time": 0, "framework_time": 0.3974901046603918, "timestamp": "2025-02-18 01:54:18.941471+00:00"},
"4,16,4,2": {"block_size_x": 4, "block_size_y": 16, "tile_size_x": 4, "tile_size_y": 2, "sm__warps_active.avg.pct_of_peak_sustained_active": 96.92358075238636, "sm__maximum_warps_per_active_cycle_pct": 96.92358075238636, "time": 138.5265372140067, "times": [134.9931182861328, 133.5045166015625, 133.18246459960938, 133.71116638183594, 137.9102325439453, 147.99232482910156, 148.39193725585938], "nvml_power": 114.53, "nvml_energy": 15.865444307120189, "compile_time": 253.74258100055158, "verification_time": 0, "benchmark_time": 2253.104872070253, "edp": 2197.785061227036, "flops_watt": 8662786.292743111, "occupancy": 96.92358075238636, "strategy_time": 0, "framework_time": 0.39800989907234907, "timestamp": "2025-02-18 01:54:21.448741+00:00"},
"4,16,4,4": {"block_size_x": 4, "block_size_y": 16, "tile_size_x": 4, "tile_size_y": 4, "sm__warps_active.avg.pct_of_peak_sustained_active": 96.5433653436073, "sm__maximum_warps_per_active_cycle_pct": 96.5433653436073, "time": 137.0987592424665, "times": [133.8739471435547, 132.43455505371094, 132.55372619628906, 132.35174560546875, 134.93948364257812, 146.70611572265625, 146.8317413330078], "nvml_power": 114.67, "nvml_energy": 15.721114722333635, "compile_time": 253.69838194455951, "verification_time": 0, "benchmark_time": 2227.718497044407, "edp": 2155.345322340415, "flops_watt": 8742316.044342091, "occupancy": 96.5433653436073, "strategy_time": 0, "framework_time": 0.41698000859469175, "timestamp": "2025-02-18 01:54:23.930601+00:00"},
"4,32,1,1": {"block_size_x": 4, "block_size_y": 32, "tile_size_x": 1, "tile_size_y": 1, "sm__warps_active.avg.pct_of_peak_sustained_active": 94.99652605975108, "sm__maximum_warps_per_active_cycle_pct": 94.99652605975108, "time": 144.75951494489397, "times": [139.9178924560547, 139.3099822998047, 139.23548889160156, 139.4769287109375, 145.99078369140625, 154.7605438232422, 154.62498474121094], "nvml_power": 113.702, "nvml_energy": 16.459446368264334, "compile_time": 254.2382120154798, "verification_time": 0, "benchmark_time": 2202.1768619306386, "edp": 2382.6614725314416, "flops_watt": 8350156.523915518, "occupancy": 94.99652605975108, "strategy_time": 0, "framework_time": 0.3980990732088685, "timestamp": "2025-02-18 01:54:26.387439+00:00"},
"4,32,1,2": {"block_size_x": 4, "block_size_y": 32, "tile_size_x": 1, "tile_size_y": 2, "sm__warps_active.avg.pct_of_peak_sustained_active": 94.78743262649324, "sm__maximum_warps_per_active_cycle_pct": 94.78743262649324, "time": 144.76504952566964, "times": [139.65647888183594, 139.07603454589844, 139.33743286132812, 139.37625122070312, 146.4943084716797, 154.78472900390625, 154.63011169433594], "nvml_power": 113.583, "nvml_energy": 16.442848620274134, "compile_time": 251.74917303957045, "verification_time": 0, "benchmark_time": 2209.319908055477, "edp": 2380.349794857074, "flops_watt": 8358585.342842415, "occupancy": 94.78743262649324, "strategy_time": 0, "framework_time": 0.4143099067732692, "timestamp": "2025-02-18 01:54:28.848947+00:00"},
"4,32,1,4": {"block_size_x": 4, "block_size_y": 32, "tile_size_x": 1, "tile_size_y": 4, "sm__warps_active.avg.pct_of_peak_sustained_active": 94.47729351457632, "sm__maximum_warps_per_active_cycle_pct": 94.47729351457632, "time": 144.9510977608817, "times": [140.24351501464844, 139.1103057861328, 139.22470092773438, 139.31298828125, 147.77305603027344, 154.5095977783203, 154.4835205078125], "nvml_power": 112.925, "nvml_energy": 16.36860271464757, "compile_time": 253.07143200188875, "verification_time": 0, "benchmark_time": 2203.1369250034913, "edp": 2372.6469322999133, "flops_watt": 8396498.825706834, "occupancy": 94.47729351457632, "strategy_time": 0, "framework_time": 0.42108003981411457, "timestamp": "2025-02-18 01:54:31.305601+00:00"},
"4,32,2,1": {"block_size_x": 4, "block_size_y": 32, "tile_size_x": 2, "tile_size_y": 1, "sm__warps_active.avg.pct_of_peak_sustained_active": 94.52907088446148, "sm__maximum_warps_per_active_cycle_pct": 94.52907088446148, "time": 142.40792846679688, "times": [138.00230407714844, 136.5680694580078, 136.91477966308594, 136.92306518554688, 143.04917907714844, 152.7995147705078, 152.5985870361328], "nvml_power": 114.415, "nvml_energy": 16.293603135528564, "compile_time": 256.08014897443354, "verification_time": 0, "benchmark_time": 2308.9940869249403, "edp": 2320.338269790729, "flops_watt": 8435147.973643186, "occupancy": 94.52907088446148, "strategy_time": 0, "framework_time": 0.40459015872329473, "timestamp": "2025-02-18 01:54:33.871105+00:00"},
"4,32,2,2": {"block_size_x": 4, "block_size_y": 32, "tile_size_x": 2, "tile_size_y": 2, "sm__warps_active.avg.pct_of_peak_sustained_active": 94.27419012686921, "sm__maximum_warps_per_active_cycle_pct": 94.27419012686921, "time": 141.9272199358259, "times": [137.59922790527344, 135.9851531982422, 136.51734924316406, 137.02642822265625, 141.75379943847656, 152.53756713867188, 152.07101440429688], "nvml_power": 114.561, "nvml_energy": 16.25932424306815, "compile_time": 252.1616539452225, "verification_time": 0, "benchmark_time": 2303.7788330111653, "edp": 2307.640687853839, "flops_watt": 8452931.463655045, "occupancy": 94.27419012686921, "strategy_time": 0, "framework_time": 0.4156100330874324, "timestamp": "2025-02-18 01:54:36.427487+00:00"},
"4,32,2,4": {"block_size_x": 4, "block_size_y": 32, "tile_size_x": 2, "tile_size_y": 4, "sm__warps_active.avg.pct_of_peak_sustained_active": 93.7841427778038, "sm__maximum_warps_per_active_cycle_pct": 93.7841427778038, "time": 138.74588884626115, "times": [135.2323455810547, 134.03875732421875, 134.02403259277344, 133.84474182128906, 135.70509338378906, 149.16864013671875, 149.20761108398438], "nvml_power": 114.803, "nvml_energy": 15.928444277217318, "compile_time": 253.84445302188396, "verification_time": 0, "benchmark_time": 2249.823314952664, "edp": 2210.0061591806584, "flops_watt": 8628523.356080726, "occupancy": 93.7841427778038, "strategy_time": 0, "framework_time": 0.4022889770567417, "timestamp": "2025-02-18 01:54:38.931582+00:00"},
"4,32,4,1": {"block_size_x": 4, "block_size_y": 32, "tile_size_x": 4, "tile_size_y": 1, "sm__warps_active.avg.pct_of_peak_sustained_active": 94.33419207134092, "sm__maximum_warps_per_active_cycle_pct": 94.33419207134092, "time": 139.52066258021765, "times": [134.90966796875, 134.03517150878906, 134.34169006347656, 134.34515380859375, 139.17315673828125, 150.15625, 149.6835479736328], "nvml_power": 114.312, "nvml_energy": 15.94888598086984, "compile_time": 251.19569594971836, "verification_time": 0, "benchmark_time": 2267.6167889731005, "edp": 2225.1991394673046, "flops_watt": 8617464.16877351, "occupancy": 94.33419207134092, "strategy_time": 0, "framework_time": 0.4035190213471651, "timestamp": "2025-02-18 01:54:41.450823+00:00"},
"4,32,4,2": {"block_size_x": 4, "block_size_y": 32, "tile_size_x": 4, "tile_size_y": 2, "sm__warps_active.avg.pct_of_peak_sustained_active": 94.03237950210872, "sm__maximum_warps_per_active_cycle_pct": 94.03237950210872, "time": 139.23273577008928, "times": [134.52207946777344, 133.85122680664062, 134.37965393066406, 134.42063903808594, 138.89984130859375, 149.34739685058594, 149.20831298828125], "nvml_power": 114.959, "nvml_energy": 16.006056071393694, "compile_time": 254.42793301772326, "verification_time": 0, "benchmark_time": 2258.477808907628, "edp": 2228.5669757095916, "flops_watt": 8586684.493604476, "occupancy": 94.03237950210872, "strategy_time": 0, "framework_time": 0.3929600352421403, "timestamp": "2025-02-18 01:54:43.964147+00:00"},
"4,32,4,4": {"block_size_x": 4, "block_size_y": 32, "tile_size_x": 4, "tile_size_y": 4, "sm__warps_active.avg.pct_of_peak_sustained_active": 93.49177305814948, "sm__maximum_warps_per_active_cycle_pct": 93.49177305814948, "time": 139.04065813337053, "times": [135.4159698486328, 133.97698974609375, 133.93991088867188, 134.21075439453125, 137.80703735351562, 149.0926055908203, 148.84133911132812], "nvml_power": 114.351, "nvml_energy": 15.899438298209052, "compile_time": 251.39749504160136, "verification_time": 0, "benchmark_time": 2264.8672650102526, "edp": 2210.6683649339034, "flops_watt": 8644264.715155467, "occupancy": 93.49177305814948, "strategy_time": 0, "framework_time": 0.4046600079163909, "timestamp": "2025-02-18 01:54:46.480841+00:00"},
"4,64,1,1": {"block_size_x": 4, "block_size_y": 64, "tile_size_x": 1, "tile_size_y": 1, "sm__warps_active.avg.pct_of_peak_sustained_active": 99.46311513913977, "sm__maximum_warps_per_active_cycle_pct": 99.46311513913977, "time": 117.86927141462054, "times": [117.65392303466797, 115.09878540039062, 115.17346954345703, 115.52140808105469, 115.37904357910156, 118.99667358398438, 127.2615966796875], "nvml_power": 114.727, "nvml_energy": 13.522787901585172, "compile_time": 250.6418360862881, "verification_time": 0, "benchmark_time": 2068.273329990916, "edp": 1593.9211574542896, "flops_watt": 10163507.293927837, "occupancy": 99.46311513913977, "strategy_time": 0, "framework_time": 0.4095599288120866, "timestamp": "2025-02-18 01:54:48.800190+00:00"},
"4,64,1,2": {"block_size_x": 4, "block_size_y": 64, "tile_size_x": 1, "tile_size_y": 2, "sm__warps_active.avg.pct_of_peak_sustained_active": 99.12941054353796, "sm__maximum_warps_per_active_cycle_pct": 99.12941054353796, "time": 119.35087149483817, "times": [118.91446685791016, 116.5296630859375, 116.63414764404297, 116.57193756103516, 117.33586883544922, 120.88435363769531, 128.58566284179688], "nvml_power": 114.783, "nvml_energy": 13.69945108279201, "compile_time": 253.09898401610553, "verification_time": 0, "benchmark_time": 2086.6805149707943, "edp": 1635.0414257321308, "flops_watt": 10032442.368777692, "occupancy": 99.12941054353796, "strategy_time": 0, "framework_time": 0.4133289912715554, "timestamp": "2025-02-18 01:54:51.140408+00:00"},
"4,64,1,4": {"block_size_x": 4, "block_size_y": 64, "tile_size_x": 1, "tile_size_y": 4, "sm__warps_active.avg.pct_of_peak_sustained_active": 98.5727062556251, "sm__maximum_warps_per_active_cycle_pct": 98.5727062556251, "time": 121.63232094900948, "times": [120.84076690673828, 118.98992156982422, 118.70572662353516, 119.14806365966797, 119.31110382080078, 124.59776306152344, 129.83290100097656], "nvml_power": 114.585, "nvml_energy": 13.93723949594225, "compile_time": 251.6470260452479, "verification_time": 0, "benchmark_time": 2113.7848199578, "edp": 1695.218787513659, "flops_watt": 9861275.147923991, "occupancy": 98.5727062556251, "strategy_time": 0, "framework_time": 0.40084891952574253, "timestamp": "2025-02-18 01:54:53.506266+00:00"},
