experiments/data/depr/power_tuning_float32.json
{
"device_name": "NVIDIA RTX 5000 Ada Generation",
"kernel_name": "tuned_matmul<float>",
"problem_size": [
4096,
4096
],
"tune_params_keys": [
"block_size_x",
"block_size_y",
"tile_size_x",
"tile_size_y"
],
"tune_params": {
"block_size_x": [
1,
2,
4,
8,
16,
32,
64,
128
],
"block_size_y": [
16,
32,
64,
128
],
"tile_size_x": [
1,
2,
4
],
"tile_size_y": [
1,
2,
4
]
},
"objective": "time",
"cache": {
"1,32,1,1": {"block_size_x": 1, "block_size_y": 32, "tile_size_x": 1, "tile_size_y": 1, "sm__warps_active.avg.pct_of_peak_sustained_active": 49.95553684173243, "sm__maximum_warps_per_active_cycle_pct": 49.95553684173243, "time": 364.3264857700893, "times": [354.7394104003906, 377.79608154296875, 362.8196716308594, 356.1514892578125, 375.28863525390625, 358.0755310058594, 365.4145812988281], "nvml_power": 114.485, "nvml_energy": 41.70991772338867, "compile_time": 232.55128203891218, "verification_time": 0, "benchmark_time": 4075.334317982197, "edp": 15196.027745921758, "flops_watt": 3295114.4709386863, "occupancy": 49.95553684173243, "strategy_time": 0, "framework_time": 0, "timestamp": "2025-02-18 02:04:03.566489+00:00"},
"1,32,1,2": {"block_size_x": 1, "block_size_y": 32, "tile_size_x": 1, "tile_size_y": 2, "sm__warps_active.avg.pct_of_peak_sustained_active": 49.955886977338174, "sm__maximum_warps_per_active_cycle_pct": 49.955886977338174, "time": 366.5779462541853, "times": [355.54376220703125, 382.6437683105469, 362.5068664550781, 359.6178283691406, 379.53875732421875, 357.7371826171875, 368.45745849609375], "nvml_power": 114.711, "nvml_energy": 42.05052279276384, "compile_time": 258.43052100390196, "verification_time": 0, "benchmark_time": 4089.32799694594, "edp": 15414.794284286178, "flops_watt": 3268424.3701162934, "occupancy": 49.955886977338174, "strategy_time": 0, "framework_time": 0.4255890380591154, "timestamp": "2025-02-18 02:04:07.914696+00:00"},
"1,32,1,4": {"block_size_x": 1, "block_size_y": 32, "tile_size_x": 1, "tile_size_y": 4, "sm__warps_active.avg.pct_of_peak_sustained_active": 49.95591715897712, "sm__maximum_warps_per_active_cycle_pct": 49.95591715897712, "time": 371.06195068359375, "times": [357.69329833984375, 385.0545349121094, 363.17138671875, 367.7651062011719, 384.4848327636719, 362.0386962890625, 377.2257995605469], "nvml_power": 114.748, "nvml_energy": 42.57861671704102, "compile_time": 263.29801697283983, "verification_time": 0, "benchmark_time": 4145.293290959671, "edp": 15799.304576434317, "flops_watt": 3227886.7673264155, "occupancy": 49.95591715897712, "strategy_time": 0, "framework_time": 0.4234390798956156, "timestamp": "2025-02-18 02:04:12.323735+00:00"},
"1,32,2,1": {"block_size_x": 1, "block_size_y": 32, "tile_size_x": 2, "tile_size_y": 1, "sm__warps_active.avg.pct_of_peak_sustained_active": 49.91117075571019, "sm__maximum_warps_per_active_cycle_pct": 49.91117075571019, "time": 196.9322509765625, "times": [193.08441162109375, 191.64822387695312, 191.98367309570312, 208.8546600341797, 207.59234619140625, 193.3783416748047, 191.98410034179688], "nvml_power": 116.149, "nvml_energy": 22.87348401867676, "compile_time": 264.54741589259356, "verification_time": 0, "benchmark_time": 2807.410517008975, "edp": 4504.526695474443, "flops_watt": 6008658.469334087, "occupancy": 49.91117075571019, "strategy_time": 0, "framework_time": 0.41881902143359184, "timestamp": "2025-02-18 02:04:15.396136+00:00"},
"1,32,2,2": {"block_size_x": 1, "block_size_y": 32, "tile_size_x": 2, "tile_size_y": 2, "sm__warps_active.avg.pct_of_peak_sustained_active": 49.911610751155585, "sm__maximum_warps_per_active_cycle_pct": 49.911610751155585, "time": 200.17333330426897, "times": [194.96669006347656, 192.78268432617188, 194.16989135742188, 212.46348571777344, 213.08380126953125, 199.59910583496094, 194.14767456054688], "nvml_power": 116.229, "nvml_energy": 23.265946356621875, "compile_time": 270.0239809928462, "verification_time": 0, "benchmark_time": 2649.994642008096, "edp": 4657.222034683313, "flops_watt": 5907301.227524862, "occupancy": 49.911610751155585, "strategy_time": 0, "framework_time": 0.4172499757260084, "timestamp": "2025-02-18 02:04:18.316597+00:00"},
"1,32,2,4": {"block_size_x": 1, "block_size_y": 32, "tile_size_x": 2, "tile_size_y": 4, "sm__warps_active.avg.pct_of_peak_sustained_active": 49.911407609468455, "sm__maximum_warps_per_active_cycle_pct": 49.911407609468455, "time": 199.6675545828683, "times": [194.91827392578125, 194.1407012939453, 194.6906280517578, 214.1990966796875, 209.73085021972656, 195.59100341796875, 194.40232849121094], "nvml_power": 116.582, "nvml_energy": 23.277642848379948, "compile_time": 265.8295849105343, "verification_time": 0, "benchmark_time": 2842.7849179133773, "edp": 4647.790023989417, "flops_watt": 5904332.941578977, "occupancy": 49.911407609468455, "strategy_time": 0, "framework_time": 0.4135791677981615, "timestamp": "2025-02-18 02:04:21.425649+00:00"},
"1,32,4,1": {"block_size_x": 1, "block_size_y": 32, "tile_size_x": 4, "tile_size_y": 1, "sm__warps_active.avg.pct_of_peak_sustained_active": 49.821228697255634, "sm__maximum_warps_per_active_cycle_pct": 49.821228697255634, "time": 103.55508531842914, "times": [104.05075073242188, 102.82351684570312, 102.96092987060547, 103.03670501708984, 102.6882553100586, 102.83699035644531, 106.48844909667969], "nvml_power": 115.826, "nvml_energy": 11.994371312092373, "compile_time": 270.2492509270087, "verification_time": 0, "benchmark_time": 1932.545940973796, "edp": 1242.0781445646444, "flops_watt": 11458620.872728702, "occupancy": 49.821228697255634, "strategy_time": 0, "framework_time": 0.42611011303961277, "timestamp": "2025-02-18 02:04:23.628895+00:00"},
"1,32,4,2": {"block_size_x": 1, "block_size_y": 32, "tile_size_x": 4, "tile_size_y": 2, "sm__warps_active.avg.pct_of_peak_sustained_active": 49.822014136671164, "sm__maximum_warps_per_active_cycle_pct": 49.822014136671164, "time": 104.0469720023019, "times": [105.36294555664062, 103.82665252685547, 103.49126434326172, 103.050048828125, 103.22950744628906, 103.25920104980469, 106.10918426513672], "nvml_power": 115.702, "nvml_energy": 12.038442754610333, "compile_time": 263.728916994296, "verification_time": 0, "benchmark_time": 1933.3120009396225, "edp": 1252.5635162402555, "flops_watt": 11416672.09567993, "occupancy": 49.822014136671164, "strategy_time": 0, "framework_time": 0.42035907972604036, "timestamp": "2025-02-18 02:04:25.826381+00:00"},
"1,32,4,4": {"block_size_x": 1, "block_size_y": 32, "tile_size_x": 4, "tile_size_y": 4, "sm__warps_active.avg.pct_of_peak_sustained_active": 49.82252586859441, "sm__maximum_warps_per_active_cycle_pct": 49.82252586859441, "time": 105.55798884800502, "times": [105.89430236816406, 104.36048126220703, 104.45216369628906, 104.97731018066406, 104.60099029541016, 104.56227111816406, 110.05840301513672], "nvml_power": 115.366, "nvml_energy": 12.177802941438946, "compile_time": 272.0661290222779, "verification_time": 0, "benchmark_time": 1969.7738410905004, "edp": 1285.464387085615, "flops_watt": 11286022.128369244, "occupancy": 49.82252586859441, "strategy_time": 0, "framework_time": 0.3998498432338238, "timestamp": "2025-02-18 02:04:28.068646+00:00"},
"1,64,1,1": {"block_size_x": 1, "block_size_y": 64, "tile_size_x": 1, "tile_size_y": 1, "sm__warps_active.avg.pct_of_peak_sustained_active": 98.8230044653793, "sm__maximum_warps_per_active_cycle_pct": 98.8230044653793, "time": 395.99967302594865, "times": [379.74072265625, 412.4010925292969, 389.9812927246094, 394.4847106933594, 407.1328430175781, 382.1039733886719, 406.153076171875], "nvml_power": 114.4195, "nvml_energy": 45.31008458779253, "compile_time": 249.54304890707135, "verification_time": 0, "benchmark_time": 4408.438034937717, "edp": 17942.778681543918, "flops_watt": 3033297.216775201, "occupancy": 98.8230044653793, "strategy_time": 0, "framework_time": 0.4030881682410836, "timestamp": "2025-02-18 02:04:32.727054+00:00"},
"1,64,1,2": {"block_size_x": 1, "block_size_y": 64, "tile_size_x": 1, "tile_size_y": 2, "sm__warps_active.avg.pct_of_peak_sustained_active": 98.87137668016311, "sm__maximum_warps_per_active_cycle_pct": 98.87137668016311, "time": 398.6743861607143, "times": [382.9533386230469, 414.84521484375, 389.66326904296875, 399.6515197753906, 405.0007019042969, 386.88824462890625, 411.7184143066406], "nvml_power": 115.016, "nvml_energy": 45.85393319866071, "compile_time": 249.25566907040775, "verification_time": 0, "benchmark_time": 4429.1290290420875, "edp": 18280.788671030456, "flops_watt": 2997320.9250458423, "occupancy": 98.87137668016311, "strategy_time": 0, "framework_time": 0.40011992678046227, "timestamp": "2025-02-18 02:04:37.405864+00:00"},
"1,64,1,4": {"block_size_x": 1, "block_size_y": 64, "tile_size_x": 1, "tile_size_y": 4, "sm__warps_active.avg.pct_of_peak_sustained_active": 98.81371686289322, "sm__maximum_warps_per_active_cycle_pct": 98.81371686289322, "time": 399.80997576032365, "times": [386.47637939453125, 417.26324462890625, 387.91290283203125, 401.4632568359375, 403.2854309082031, 389.2070007324219, 413.0616149902344], "nvml_power": 114.746, "nvml_energy": 45.8765954785941, "compile_time": 254.15824505034834, "verification_time": 0, "benchmark_time": 4441.366120008752, "edp": 18341.92052626288, "flops_watt": 2995840.2980475887, "occupancy": 98.81371686289322, "strategy_time": 0, "framework_time": 0.4235589876770973, "timestamp": "2025-02-18 02:04:42.101838+00:00"},
"1,64,2,1": {"block_size_x": 1, "block_size_y": 64, "tile_size_x": 2, "tile_size_y": 1, "sm__warps_active.avg.pct_of_peak_sustained_active": 96.4703401432823, "sm__maximum_warps_per_active_cycle_pct": 96.4703401432823, "time": 216.93659319196428, "times": [210.21104431152344, 209.9083251953125, 217.5476837158203, 229.07852172851562, 227.14002990722656, 213.03768920898438, 211.6328582763672], "nvml_power": 115.267, "nvml_energy": 25.005630287458146, "compile_time": 250.86763699073344, "verification_time": 0, "benchmark_time": 2864.7919360082597, "edp": 5424.636245178968, "flops_watt": 5496320.304348979, "occupancy": 96.4703401432823, "strategy_time": 0, "framework_time": 0.5417900392785668, "timestamp": "2025-02-18 02:04:45.218067+00:00"},
"1,64,2,2": {"block_size_x": 1, "block_size_y": 64, "tile_size_x": 2, "tile_size_y": 2, "sm__warps_active.avg.pct_of_peak_sustained_active": 96.70549159733393, "sm__maximum_warps_per_active_cycle_pct": 96.70549159733393, "time": 213.95443725585938, "times": [208.8750762939453, 208.05612182617188, 214.2933807373047, 228.1484832763672, 219.06585693359375, 209.88079833984375, 209.36134338378906], "nvml_power": 116.0, "nvml_energy": 24.81871472167969, "compile_time": 251.54527695849538, "verification_time": 0, "benchmark_time": 2831.4210349926725, "edp": 5310.07414169069, "flops_watt": 5537714.382604352, "occupancy": 96.70549159733393, "strategy_time": 0, "framework_time": 0.3977490123361349, "timestamp": "2025-02-18 02:04:48.301456+00:00"},
"1,64,2,4": {"block_size_x": 1, "block_size_y": 64, "tile_size_x": 2, "tile_size_y": 4, "sm__warps_active.avg.pct_of_peak_sustained_active": 96.44337544804425, "sm__maximum_warps_per_active_cycle_pct": 96.44337544804425, "time": 218.37791006905692, "times": [211.98902893066406, 211.27471923828125, 219.3955535888672, 231.078369140625, 228.58050537109375, 213.55909729003906, 212.76809692382812], "nvml_power": 116.167, "nvml_energy": 25.368306678992138, "compile_time": 254.34897490777075, "verification_time": 0, "benchmark_time": 2884.539751103148, "edp": 5539.877794549201, "flops_watt": 5417742.508837422, "occupancy": 96.44337544804425, "strategy_time": 0, "framework_time": 0.39872899651527405, "timestamp": "2025-02-18 02:04:51.440770+00:00"},
"1,64,4,1": {"block_size_x": 1, "block_size_y": 64, "tile_size_x": 4, "tile_size_y": 1, "sm__warps_active.avg.pct_of_peak_sustained_active": 95.82136767523345, "sm__maximum_warps_per_active_cycle_pct": 95.82136767523345, "time": 114.80071367536273, "times": [113.63807678222656, 112.54582214355469, 112.41958618164062, 113.05052947998047, 113.5208969116211, 113.97923278808594, 124.45085144042969], "nvml_power": 114.8, "nvml_energy": 13.17912192993164, "compile_time": 251.8827470485121, "verification_time": 0, "benchmark_time": 2004.5257749734446, "edp": 1512.972603170776, "flops_watt": 10428536.45354451, "occupancy": 95.82136767523345, "strategy_time": 0, "framework_time": 0.4139490192756057, "timestamp": "2025-02-18 02:04:53.697616+00:00"},
"1,64,4,2": {"block_size_x": 1, "block_size_y": 64, "tile_size_x": 4, "tile_size_y": 2, "sm__warps_active.avg.pct_of_peak_sustained_active": 95.46269250873178, "sm__maximum_warps_per_active_cycle_pct": 95.46269250873178, "time": 113.4918441772461, "times": [112.97347259521484, 111.36649322509766, 111.79961395263672, 112.08806610107422, 112.4151382446289, 112.60953521728516, 121.19058990478516], "nvml_power": 116.244, "nvml_energy": 13.192745934539793, "compile_time": 252.09170707967132, "verification_time": 0, "benchmark_time": 1979.9312859540805, "edp": 1497.2690658727872, "flops_watt": 10417767.017870972, "occupancy": 95.46269250873178, "strategy_time": 0, "framework_time": 0.4097298951819539, "timestamp": "2025-02-18 02:04:55.930073+00:00"},
"1,64,4,4": {"block_size_x": 1, "block_size_y": 64, "tile_size_x": 4, "tile_size_y": 4, "sm__warps_active.avg.pct_of_peak_sustained_active": 95.48184556804587, "sm__maximum_warps_per_active_cycle_pct": 95.48184556804587, "time": 114.78266361781529, "times": [114.3115234375, 112.44108581542969, 112.90502166748047, 113.12786865234375, 113.64105224609375, 113.57039642333984, 123.48169708251953], "nvml_power": 114.915, "nvml_energy": 13.190249789641245, "compile_time": 253.59966501127928, "verification_time": 0, "benchmark_time": 2005.3203949937597, "edp": 1514.01200463935, "flops_watt": 10419738.493499609, "occupancy": 95.48184556804587, "strategy_time": 0, "framework_time": 0.4003499634563923, "timestamp": "2025-02-18 02:04:58.189419+00:00"},
"1,128,1,1": {"block_size_x": 1, "block_size_y": 128, "tile_size_x": 1, "tile_size_y": 1, "sm__warps_active.avg.pct_of_peak_sustained_active": 99.15719010704078, "sm__maximum_warps_per_active_cycle_pct": 99.15719010704078, "time": 413.0628226143973, "times": [402.68115234375, 425.72113037109375, 399.7156982421875, 422.8731384277344, 408.43560791015625, 409.0320739746094, 422.98095703125], "nvml_power": 115.146, "nvml_energy": 47.562531772757396, "compile_time": 246.92276096902788, "verification_time": 0, "benchmark_time": 4585.018236073665, "edp": 19646.313624742124, "flops_watt": 2889647.5513257165, "occupancy": 99.15719010704078, "strategy_time": 0, "framework_time": 0.4162099212408066, "timestamp": "2025-02-18 02:05:03.021804+00:00"},
"1,128,1,2": {"block_size_x": 1, "block_size_y": 128, "tile_size_x": 1, "tile_size_y": 2, "sm__warps_active.avg.pct_of_peak_sustained_active": 99.15220959715508, "sm__maximum_warps_per_active_cycle_pct": 99.15220959715508, "time": 414.83365304129467, "times": [403.4307556152344, 427.70135498046875, 403.0195007324219, 426.4391784667969, 408.6316223144531, 413.2186584472656, 421.3945007324219], "nvml_power": 115.462, "nvml_energy": 47.89752324745397, "compile_time": 252.81106599140912, "verification_time": 0, "benchmark_time": 4610.907966038212, "edp": 19869.504540371665, "flops_watt": 2869437.5857796716, "occupancy": 99.15220959715508, "strategy_time": 0, "framework_time": 0.7243789732456207, "timestamp": "2025-02-18 02:05:07.886282+00:00"},
"1,128,1,4": {"block_size_x": 1, "block_size_y": 128, "tile_size_x": 1, "tile_size_y": 4, "sm__warps_active.avg.pct_of_peak_sustained_active": 99.1446067231597, "sm__maximum_warps_per_active_cycle_pct": 99.1446067231597, "time": 415.7150094168527, "times": [404.8135986328125, 427.9751892089844, 403.186279296875, 427.9658508300781, 409.03704833984375, 414.6378173828125, 422.3892822265625], "nvml_power": 115.746, "nvml_energy": 48.11734947996303, "compile_time": 250.14620809815824, "verification_time": 0, "benchmark_time": 4618.11687098816, "edp": 20003.104392176825, "flops_watt": 2856328.433660548, "occupancy": 99.1446067231597, "strategy_time": 0, "framework_time": 0.4100998630747199, "timestamp": "2025-02-18 02:05:12.754979+00:00"},
"1,128,2,1": {"block_size_x": 1, "block_size_y": 128, "tile_size_x": 2, "tile_size_y": 1, "sm__warps_active.avg.pct_of_peak_sustained_active": 98.90813140297861, "sm__maximum_warps_per_active_cycle_pct": 98.90813140297861, "time": 231.7298823765346, "times": [223.64227294921875, 222.2822723388672, 236.15919494628906, 245.0095672607422, 237.34828186035156, 223.58787536621094, 234.0797119140625], "nvml_power": 114.333, "nvml_energy": 26.49437264175633, "compile_time": 252.93963600415736, "verification_time": 0, "benchmark_time": 3064.4685339648277, "edp": 6139.53785591427, "flops_watt": 5187477.17979138, "occupancy": 98.90813140297861, "strategy_time": 0, "framework_time": 0.40381995495408773, "timestamp": "2025-02-18 02:05:16.072816+00:00"},
"1,128,2,2": {"block_size_x": 1, "block_size_y": 128, "tile_size_x": 2, "tile_size_y": 2, "sm__warps_active.avg.pct_of_peak_sustained_active": 98.90448517178393, "sm__maximum_warps_per_active_cycle_pct": 98.90448517178393, "time": 229.77842276436942, "times": [224.1197052001953, 222.2920379638672, 234.32701110839844, 243.58863830566406, 230.10812377929688, 222.74928283691406, 231.26416015625], "nvml_power": 113.824, "nvml_energy": 26.15429919273158, "compile_time": 250.54099806584418, "verification_time": 0, "benchmark_time": 3039.284866070375, "edp": 6009.693617013283, "flops_watt": 5254927.78297019, "occupancy": 98.90448517178393, "strategy_time": 0, "framework_time": 0.4275499377399683, "timestamp": "2025-02-18 02:05:19.363095+00:00"},
"1,128,2,4": {"block_size_x": 1, "block_size_y": 128, "tile_size_x": 2, "tile_size_y": 4, "sm__warps_active.avg.pct_of_peak_sustained_active": 98.90379479188263, "sm__maximum_warps_per_active_cycle_pct": 98.90379479188263, "time": 230.39740426199776, "times": [225.26010131835938, 223.11654663085938, 234.908447265625, 243.9760284423828, 229.76553344726562, 223.6525115966797, 232.1026611328125], "nvml_power": 114.195, "nvml_energy": 26.310231579698833, "compile_time": 252.9056459898129, "verification_time": 0, "benchmark_time": 3052.1619650535285, "edp": 6061.809061494652, "flops_watt": 5223783.494860946, "occupancy": 98.90379479188263, "strategy_time": 0, "framework_time": 0.40140992496162653, "timestamp": "2025-02-18 02:05:22.668589+00:00"},
"1,128,4,1": {"block_size_x": 1, "block_size_y": 128, "tile_size_x": 4, "tile_size_y": 1, "sm__warps_active.avg.pct_of_peak_sustained_active": 98.44839437098165, "sm__maximum_warps_per_active_cycle_pct": 98.44839437098165, "time": 123.33563886369977, "times": [122.0288314819336, 120.25068664550781, 121.33859252929688, 120.94236755371094, 120.8658218383789, 126.77565002441406, 131.14752197265625], "nvml_power": 114.431, "nvml_energy": 14.113420490812029, "compile_time": 246.72163208015263, "verification_time": 0, "benchmark_time": 2135.519968927838, "edp": 1740.6877327863328, "flops_watt": 9738174.637500107, "occupancy": 98.44839437098165, "strategy_time": 0, "framework_time": 0.39585994090884924, "timestamp": "2025-02-18 02:05:25.051251+00:00"},
"1,128,4,2": {"block_size_x": 1, "block_size_y": 128, "tile_size_x": 4, "tile_size_y": 2, "sm__warps_active.avg.pct_of_peak_sustained_active": 98.43304594268244, "sm__maximum_warps_per_active_cycle_pct": 98.43304594268244, "time": 123.13846261160714, "times": [121.81132507324219, 120.7913589477539, 120.19049835205078, 120.54601287841797, 120.29122924804688, 127.47388458251953, 130.86492919921875], "nvml_power": 113.611, "nvml_energy": 13.9898838757673, "compile_time": 250.28319901321083, "verification_time": 0, "benchmark_time": 2149.75800702814, "edp": 1722.692792576897, "flops_watt": 9824166.85459885, "occupancy": 98.43304594268244, "strategy_time": 0, "framework_time": 0.40483998600393534, "timestamp": "2025-02-18 02:05:27.451723+00:00"},
"1,128,4,4": {"block_size_x": 1, "block_size_y": 128, "tile_size_x": 4, "tile_size_y": 4, "sm__warps_active.avg.pct_of_peak_sustained_active": 98.43350088686236, "sm__maximum_warps_per_active_cycle_pct": 98.43350088686236, "time": 124.72226170131138, "times": [122.64141082763672, 121.9656982421875, 122.33686065673828, 122.27916717529297, 121.36914825439453, 129.63836669921875, 132.82518005371094], "nvml_power": 114.638, "nvml_energy": 14.297910636914935, "compile_time": 249.63918898720294, "verification_time": 0, "benchmark_time": 2166.910703992471, "edp": 1783.2677522392682, "flops_watt": 9612520.106060423, "occupancy": 98.43350088686236, "strategy_time": 0, "framework_time": 0.40132005233317614, "timestamp": "2025-02-18 02:05:29.868699+00:00"},
"2,16,1,1": {"block_size_x": 2, "block_size_y": 16, "tile_size_x": 1, "tile_size_y": 1, "sm__warps_active.avg.pct_of_peak_sustained_active": 49.95605774230341, "sm__maximum_warps_per_active_cycle_pct": 49.95605774230341, "time": 213.388179234096, "times": [207.60797119140625, 205.57763671875, 211.73910522460938, 226.29977416992188, 226.7220458984375, 210.004638671875, 205.76608276367188], "nvml_power": 114.781, "nvml_energy": 24.49290860066877, "compile_time": 251.40729697886854, "verification_time": 0, "benchmark_time": 2820.019833976403, "edp": 5226.4971704438385, "flops_watt": 5611377.387340893, "occupancy": 49.95605774230341, "strategy_time": 0, "framework_time": 0.41968002915382385, "timestamp": "2025-02-18 02:05:32.940571+00:00"},
"2,16,1,2": {"block_size_x": 2, "block_size_y": 16, "tile_size_x": 1, "tile_size_y": 2, "sm__warps_active.avg.pct_of_peak_sustained_active": 49.956832363845145, "sm__maximum_warps_per_active_cycle_pct": 49.956832363845145, "time": 207.35346112932478, "times": [202.78504943847656, 200.63754272460938, 204.21128845214844, 223.4944610595703, 217.23558044433594, 201.84310913085938, 201.26719665527344], "nvml_power": 115.042, "nvml_energy": 23.854356875239784, "compile_time": 250.59725798200816, "verification_time": 0, "benchmark_time": 2750.4313529934734, "edp": 4946.283461095074, "flops_watt": 5761587.042183398, "occupancy": 49.956832363845145, "strategy_time": 0, "framework_time": 0.41609001345932484, "timestamp": "2025-02-18 02:05:35.942041+00:00"},
"2,16,1,4": {"block_size_x": 2, "block_size_y": 16, "tile_size_x": 1, "tile_size_y": 4, "sm__warps_active.avg.pct_of_peak_sustained_active": 49.956661251665366, "sm__maximum_warps_per_active_cycle_pct": 49.956661251665366, "time": 214.52681623186385, "times": [208.63104248046875, 206.63536071777344, 213.7783966064453, 228.35955810546875, 227.3475799560547, 209.8481903076172, 207.08758544921875], "nvml_power": 114.401, "nvml_energy": 24.542082303741456, "compile_time": 255.5811540223658, "verification_time": 0, "benchmark_time": 2838.4390890132636, "edp": 5264.934780322021, "flops_watt": 5600134.160215384, "occupancy": 49.956661251665366, "strategy_time": 0, "framework_time": 0.39995997212827206, "timestamp": "2025-02-18 02:05:39.036486+00:00"},
"2,16,2,1": {"block_size_x": 2, "block_size_y": 16, "tile_size_x": 2, "tile_size_y": 1, "sm__warps_active.avg.pct_of_peak_sustained_active": 49.96191464791938, "sm__maximum_warps_per_active_cycle_pct": 49.96191464791938, "time": 233.60582624162947, "times": [228.53744506835938, 225.34652709960938, 240.77667236328125, 247.1576690673828, 231.0418243408203, 226.5259246826172, 235.85472106933594], "nvml_power": 114.84, "nvml_energy": 26.82729308558873, "compile_time": 248.6510300077498, "verification_time": 0, "benchmark_time": 3096.7762320069596, "edp": 6267.011967085309, "flops_watt": 5123101.799108848, "occupancy": 49.96191464791938, "strategy_time": 0, "framework_time": 0.39337005000561476, "timestamp": "2025-02-18 02:05:42.382332+00:00"},
"2,16,2,2": {"block_size_x": 2, "block_size_y": 16, "tile_size_x": 2, "tile_size_y": 2, "sm__warps_active.avg.pct_of_peak_sustained_active": 49.960098029777114, "sm__maximum_warps_per_active_cycle_pct": 49.960098029777114, "time": 233.6353541782924, "times": [227.63177490234375, 225.68063354492188, 240.6611785888672, 249.21539306640625, 230.64451599121094, 225.9997100830078, 235.61427307128906], "nvml_power": 113.724, "nvml_energy": 26.569947018572126, "compile_time": 250.18953892868012, "verification_time": 0, "benchmark_time": 3101.5692689688876, "edp": 6207.678982182563, "flops_watt": 5172722.150177099, "occupancy": 49.960098029777114, "strategy_time": 0, "framework_time": 0.40606013499200344, "timestamp": "2025-02-18 02:05:45.734522+00:00"},
"2,16,2,4": {"block_size_x": 2, "block_size_y": 16, "tile_size_x": 2, "tile_size_y": 4, "sm__warps_active.avg.pct_of_peak_sustained_active": 49.958976017085845, "sm__maximum_warps_per_active_cycle_pct": 49.958976017085845, "time": 232.46763174874442, "times": [226.20083618164062, 224.66213989257812, 239.6886749267578, 246.6075897216797, 229.20623779296875, 224.5385284423828, 236.36941528320312], "nvml_power": 114.384, "nvml_energy": 26.590577589948385, "compile_time": 250.42023893911391, "verification_time": 0, "benchmark_time": 3079.863477963954, "edp": 6181.448599166537, "flops_watt": 5168708.84083217, "occupancy": 49.958976017085845, "strategy_time": 0, "framework_time": 0.3968201344832778, "timestamp": "2025-02-18 02:05:49.065226+00:00"},
"2,16,4,1": {"block_size_x": 2, "block_size_y": 16, "tile_size_x": 4, "tile_size_y": 1, "sm__warps_active.avg.pct_of_peak_sustained_active": 49.912638155450125, "sm__maximum_warps_per_active_cycle_pct": 49.912638155450125, "time": 120.33077566964286, "times": [122.48639678955078, 117.33052825927734, 116.96768188476562, 117.1903076171875, 117.24835205078125, 121.96713256835938, 129.12503051757812], "nvml_power": 113.606, "nvml_energy": 13.670298100725446, "compile_time": 247.7751721162349, "verification_time": 0, "benchmark_time": 2073.8202349748462, "edp": 1644.9575740955386, "flops_watt": 10053837.338390337, "occupancy": 49.912638155450125, "strategy_time": 0, "framework_time": 0.4361388273537159, "timestamp": "2025-02-18 02:05:51.387283+00:00"},
"2,16,4,2": {"block_size_x": 2, "block_size_y": 16, "tile_size_x": 4, "tile_size_y": 2, "sm__warps_active.avg.pct_of_peak_sustained_active": 49.914795093634154, "sm__maximum_warps_per_active_cycle_pct": 49.914795093634154, "time": 120.17790113176618, "times": [118.6468505859375, 117.3570556640625, 118.10262298583984, 117.64681243896484, 117.3592300415039, 123.25929260253906, 128.87344360351562], "nvml_power": 113.661, "nvml_energy": 13.659540420537676, "compile_time": 249.47710102424026, "verification_time": 0, "benchmark_time": 2098.269663983956, "edp": 1641.5748981647405, "flops_watt": 10061755.318308875, "occupancy": 49.914795093634154, "strategy_time": 0, "framework_time": 0.40334893856197596, "timestamp": "2025-02-18 02:05:53.735460+00:00"},
"2,16,4,4": {"block_size_x": 2, "block_size_y": 16, "tile_size_x": 4, "tile_size_y": 4, "sm__warps_active.avg.pct_of_peak_sustained_active": 49.91794427309234, "sm__maximum_warps_per_active_cycle_pct": 49.91794427309234, "time": 119.85127258300781, "times": [119.0331802368164, 117.49638366699219, 117.67699432373047, 116.92886352539062, 116.97698974609375, 120.41731262207031, 130.42918395996094], "nvml_power": 115.969, "nvml_energy": 13.899032230178832, "compile_time": 248.61758993938565, "verification_time": 0, "benchmark_time": 2093.1393100181594, "edp": 1665.8167004591742, "flops_watt": 9888382.96047549, "occupancy": 49.91794427309234, "strategy_time": 0, "framework_time": 0.42166002094745636, "timestamp": "2025-02-18 02:05:56.077663+00:00"},
"2,32,1,1": {"block_size_x": 2, "block_size_y": 32, "tile_size_x": 1, "tile_size_y": 1, "sm__warps_active.avg.pct_of_peak_sustained_active": 99.28886101503103, "sm__maximum_warps_per_active_cycle_pct": 99.28886101503103, "time": 242.40067836216517, "times": [234.74374389648438, 233.47445678710938, 250.92877197265625, 256.1166076660156, 237.2744598388672, 234.79225158691406, 249.47445678710938], "nvml_power": 114.266, "nvml_energy": 27.698155913731167, "compile_time": 250.56275899987668, "verification_time": 0, "benchmark_time": 3195.8534519653767, "edp": 6714.051782869452, "flops_watt": 4962025.410647126, "occupancy": 99.28886101503103, "strategy_time": 0, "framework_time": 0.4067800473421812, "timestamp": "2025-02-18 02:05:59.524511+00:00"},
"2,32,1,2": {"block_size_x": 2, "block_size_y": 32, "tile_size_x": 1, "tile_size_y": 2, "sm__warps_active.avg.pct_of_peak_sustained_active": 99.28931681987679, "sm__maximum_warps_per_active_cycle_pct": 99.28931681987679, "time": 242.4541756766183, "times": [235.4317169189453, 234.16307067871094, 253.51548767089844, 253.621337890625, 236.7123565673828, 233.3011474609375, 250.43411254882812], "nvml_power": 113.668, "nvml_energy": 27.55928124080985, "compile_time": 248.860829975456, "verification_time": 0, "benchmark_time": 3195.6118039088324, "edp": 6681.862815480642, "flops_watt": 4987029.678716007, "occupancy": 99.28931681987679, "strategy_time": 0, "framework_time": 0.40037010330706835, "timestamp": "2025-02-18 02:06:02.969410+00:00"},
"2,32,1,4": {"block_size_x": 2, "block_size_y": 32, "tile_size_x": 1, "tile_size_y": 4, "sm__warps_active.avg.pct_of_peak_sustained_active": 99.29927775357109, "sm__maximum_warps_per_active_cycle_pct": 99.29927775357109, "time": 243.94955226353235, "times": [236.85162353515625, 234.46595764160156, 254.1643524169922, 255.7471923828125, 238.7552032470703, 235.75482177734375, 251.90771484375], "nvml_power": 113.587, "nvml_energy": 27.70949779295785, "compile_time": 247.82524106558412, "verification_time": 0, "benchmark_time": 3218.986514955759, "edp": 6759.719580039406, "flops_watt": 4959994.385280018, "occupancy": 99.29927775357109, "strategy_time": 0, "framework_time": 0.41493994649499655, "timestamp": "2025-02-18 02:06:06.436661+00:00"},
"2,32,2,1": {"block_size_x": 2, "block_size_y": 32, "tile_size_x": 2, "tile_size_y": 1, "sm__warps_active.avg.pct_of_peak_sustained_active": 99.30993566510374, "sm__maximum_warps_per_active_cycle_pct": 99.30993566510374, "time": 279.5098876953125, "times": [265.41070556640625, 268.14068603515625, 295.29095458984375, 288.9051513671875, 263.6390075683594, 282.7165832519531, 292.46612548828125], "nvml_power": 113.533, "nvml_energy": 31.733596079711912, "compile_time": 251.19697907939553, "verification_time": 0, "benchmark_time": 3378.87444102671, "edp": 8869.853876408686, "flops_watt": 4331023.598043091, "occupancy": 99.30993566510374, "strategy_time": 0, "framework_time": 0.4039888735860586, "timestamp": "2025-02-18 02:06:10.067162+00:00"},
"2,32,2,2": {"block_size_x": 2, "block_size_y": 32, "tile_size_x": 2, "tile_size_y": 2, "sm__warps_active.avg.pct_of_peak_sustained_active": 99.31312887612671, "sm__maximum_warps_per_active_cycle_pct": 99.31312887612671, "time": 280.9217049734933, "times": [264.92291259765625, 269.95098876953125, 295.0431213378906, 290.1616516113281, 265.7549743652344, 286.7131652832031, 293.9051208496094], "nvml_power": 113.991, "nvml_energy": 32.02254607163348, "compile_time": 249.9866100260988, "verification_time": 0, "benchmark_time": 3393.732068943791, "edp": 8995.828240035517, "flops_watt": 4291943.344059938, "occupancy": 99.31312887612671, "strategy_time": 0, "framework_time": 0.41274901013821363, "timestamp": "2025-02-18 02:06:13.711319+00:00"},
"2,32,2,4": {"block_size_x": 2, "block_size_y": 32, "tile_size_x": 2, "tile_size_y": 4, "sm__warps_active.avg.pct_of_peak_sustained_active": 99.32074767988142, "sm__maximum_warps_per_active_cycle_pct": 99.32074767988142, "time": 283.02205984933033, "times": [266.69415283203125, 272.4597473144531, 298.4626159667969, 289.9116516113281, 266.88037109375, 288.99005126953125, 297.7558288574219], "nvml_power": 113.518, "nvml_energy": 32.12809818997628, "compile_time": 249.9936199747026, "verification_time": 0, "benchmark_time": 3416.785079985857, "edp": 9092.960528768628, "flops_watt": 4277842.798515846, "occupancy": 99.32074767988142, "strategy_time": 0, "framework_time": 0.39927009493112564, "timestamp": "2025-02-18 02:06:17.378522+00:00"},
"2,32,4,1": {"block_size_x": 2, "block_size_y": 32, "tile_size_x": 4, "tile_size_y": 1, "sm__warps_active.avg.pct_of_peak_sustained_active": 97.493290944955, "sm__maximum_warps_per_active_cycle_pct": 97.493290944955, "time": 142.8492911202567, "times": [139.06924438476562, 137.4886016845703, 137.5160369873047, 137.52554321289062, 142.7302703857422, 153.49789428710938, 152.11744689941406], "nvml_power": 115.942, "nvml_energy": 16.562232511064803, "compile_time": 252.97360809054226, "verification_time": 0, "benchmark_time": 2312.1214190032333, "edp": 2365.903173574476, "flops_watt": 8298334.9847419765, "occupancy": 97.493290944955, "strategy_time": 0, "framework_time": 0.40302996058017015, "timestamp": "2025-02-18 02:06:19.944046+00:00"},
"2,32,4,2": {"block_size_x": 2, "block_size_y": 32, "tile_size_x": 4, "tile_size_y": 2, "sm__warps_active.avg.pct_of_peak_sustained_active": 97.51258394452836, "sm__maximum_warps_per_active_cycle_pct": 97.51258394452836, "time": 143.10264151436942, "times": [138.6372528076172, 137.29490661621094, 138.0182647705078, 138.15586853027344, 142.94493103027344, 153.90838623046875, 152.75888061523438], "nvml_power": 115.258, "nvml_energy": 16.49372425566319, "compile_time": 251.7866090638563, "verification_time": 0, "benchmark_time": 2171.441176906228, "edp": 2360.295509395029, "flops_watt": 8332802.909858867, "occupancy": 97.51258394452836, "strategy_time": 0, "framework_time": 0.40594907477498055, "timestamp": "2025-02-18 02:06:22.367705+00:00"},
"2,32,4,4": {"block_size_x": 2, "block_size_y": 32, "tile_size_x": 4, "tile_size_y": 4, "sm__warps_active.avg.pct_of_peak_sustained_active": 97.5486780004761, "sm__maximum_warps_per_active_cycle_pct": 97.5486780004761, "time": 145.99559892926897, "times": [141.56410217285156, 140.52867126464844, 140.04205322265625, 140.31948852539062, 147.70469665527344, 155.8939208984375, 155.916259765625], "nvml_power": 114.753, "nvml_energy": 16.753432963930404, "compile_time": 251.98228901717812, "verification_time": 0, "benchmark_time": 2222.156664938666, "edp": 2445.927479690377, "flops_watt": 8203629.296031541, "occupancy": 97.5486780004761, "strategy_time": 0, "framework_time": 0.413749017752707, "timestamp": "2025-02-18 02:06:24.842283+00:00"},
"2,64,1,1": {"block_size_x": 2, "block_size_y": 64, "tile_size_x": 1, "tile_size_y": 1, "sm__warps_active.avg.pct_of_peak_sustained_active": 98.0645156294233, "sm__maximum_warps_per_active_cycle_pct": 98.0645156294233, "time": 245.7254137311663, "times": [237.4138946533203, 236.59922790527344, 255.54226684570312, 258.593017578125, 239.78402709960938, 236.939453125, 255.2060089111328], "nvml_power": 113.271, "nvml_energy": 27.833563338742938, "compile_time": 250.75479899533093, "verification_time": 0, "benchmark_time": 3248.446314013563, "edp": 6839.4138670252305, "flops_watt": 4937885.667003039, "occupancy": 98.0645156294233, "strategy_time": 0, "framework_time": 0.43437990825623274, "timestamp": "2025-02-18 02:06:28.341946+00:00"},
"2,64,1,2": {"block_size_x": 2, "block_size_y": 64, "tile_size_x": 1, "tile_size_y": 2, "sm__warps_active.avg.pct_of_peak_sustained_active": 98.13807560103844, "sm__maximum_warps_per_active_cycle_pct": 98.13807560103844, "time": 247.74283054896765, "times": [239.5800018310547, 238.37379455566406, 259.46630859375, 258.4302062988281, 240.73992919921875, 238.40806579589844, 259.2015075683594], "nvml_power": 113.674, "nvml_energy": 28.16191851982335, "compile_time": 247.46832204982638, "verification_time": 0, "benchmark_time": 3263.7557520065457, "edp": 6976.91340779043, "flops_watt": 4880312.162513213, "occupancy": 98.13807560103844, "strategy_time": 0, "framework_time": 0.6969699170440435, "timestamp": "2025-02-18 02:06:31.853901+00:00"},
"2,64,1,4": {"block_size_x": 2, "block_size_y": 64, "tile_size_x": 1, "tile_size_y": 4, "sm__warps_active.avg.pct_of_peak_sustained_active": 98.14285889830802, "sm__maximum_warps_per_active_cycle_pct": 98.14285889830802, "time": 249.2392796107701, "times": [241.43923950195312, 238.94236755371094, 260.705810546875, 261.222412109375, 241.6958770751953, 240.76754760742188, 259.9017028808594], "nvml_power": 113.826, "nvml_energy": 28.369910240975518, "compile_time": 252.967637963593, "verification_time": 0, "benchmark_time": 3278.1780400546268, "edp": 7070.895991082947, "flops_watt": 4844532.545382987, "occupancy": 98.14285889830802, "strategy_time": 0, "framework_time": 0.39915996603667736, "timestamp": "2025-02-18 02:06:35.385470+00:00"},
"2,64,2,1": {"block_size_x": 2, "block_size_y": 64, "tile_size_x": 2, "tile_size_y": 1, "sm__warps_active.avg.pct_of_peak_sustained_active": 98.11732773197568, "sm__maximum_warps_per_active_cycle_pct": 98.11732773197568, "time": 278.82094029017856, "times": [266.9031066894531, 269.1331481933594, 297.091552734375, 277.83526611328125, 264.9635925292969, 284.8305358886719, 290.9893798828125], "nvml_power": 114.368, "nvml_energy": 31.88819329910714, "compile_time": 248.15971194766462, "verification_time": 0, "benchmark_time": 3365.9198679961264, "edp": 8891.096039812024, "flops_watt": 4310026.3531031795, "occupancy": 98.11732773197568, "strategy_time": 0, "framework_time": 0.3988300450146198, "timestamp": "2025-02-18 02:06:38.999973+00:00"},
"2,64,2,2": {"block_size_x": 2, "block_size_y": 64, "tile_size_x": 2, "tile_size_y": 2, "sm__warps_active.avg.pct_of_peak_sustained_active": 98.2069550509128, "sm__maximum_warps_per_active_cycle_pct": 98.2069550509128, "time": 280.3628583635603, "times": [267.42913818359375, 271.125, 297.7400207519531, 279.13232421875, 266.418701171875, 288.47088623046875, 292.22393798828125], "nvml_power": 113.761, "nvml_energy": 31.89435913029698, "compile_time": 244.70255407504737, "verification_time": 0, "benchmark_time": 3380.464687012136, "edp": 8941.993691443979, "flops_watt": 4309193.136959584, "occupancy": 98.2069550509128, "strategy_time": 0, "framework_time": 0.40454999543726444, "timestamp": "2025-02-18 02:06:42.625570+00:00"},
"2,64,2,4": {"block_size_x": 2, "block_size_y": 64, "tile_size_x": 2, "tile_size_y": 4, "sm__warps_active.avg.pct_of_peak_sustained_active": 98.20788331444383, "sm__maximum_warps_per_active_cycle_pct": 98.20788331444383, "time": 285.4543151855469, "times": [271.9918212890625, 277.4027099609375, 301.32501220703125, 288.43255615234375, 271.6307067871094, 290.4756774902344, 296.9217224121094], "nvml_power": 114.44, "nvml_energy": 32.66739182983398, "compile_time": 250.48253999557346, "verification_time": 0, "benchmark_time": 3439.1162279061973, "edp": 9325.047963683188, "flops_watt": 4207221.506630408, "occupancy": 98.20788331444383, "strategy_time": 0, "framework_time": 0.3921791212633252, "timestamp": "2025-02-18 02:06:46.315587+00:00"},
"2,64,4,1": {"block_size_x": 2, "block_size_y": 64, "tile_size_x": 4, "tile_size_y": 1, "sm__warps_active.avg.pct_of_peak_sustained_active": 97.87811717264923, "sm__maximum_warps_per_active_cycle_pct": 97.87811717264923, "time": 153.88265119280135, "times": [158.57852172851562, 145.09580993652344, 145.56771850585938, 147.8350067138672, 160.13702392578125, 160.384033203125, 159.5804443359375], "nvml_power": 114.3, "nvml_energy": 17.588787031337194, "compile_time": 250.22581999655813, "verification_time": 0, "benchmark_time": 2248.7260960042477, "edp": 2706.6091796477294, "flops_watt": 7814009.756734837, "occupancy": 97.87811717264923, "strategy_time": 0, "framework_time": 0.39884995203465223, "timestamp": "2025-02-18 02:06:48.814963+00:00"},
"2,64,4,2": {"block_size_x": 2, "block_size_y": 64, "tile_size_x": 4, "tile_size_y": 2, "sm__warps_active.avg.pct_of_peak_sustained_active": 97.95144280710755, "sm__maximum_warps_per_active_cycle_pct": 97.95144280710755, "time": 151.68436976841517, "times": [146.08621215820312, 145.10867309570312, 145.07228088378906, 145.3061065673828, 157.32713317871094, 161.9633026123047, 160.9268798828125], "nvml_power": 114.411, "nvml_energy": 17.35436042957415, "compile_time": 252.7253080625087, "verification_time": 0, "benchmark_time": 2306.3026380259544, "edp": 2632.3852244938776, "flops_watt": 7919563.157037216, "occupancy": 97.95144280710755, "strategy_time": 0, "framework_time": 0.3950399113819003, "timestamp": "2025-02-18 02:06:51.374410+00:00"},
"2,64,4,4": {"block_size_x": 2, "block_size_y": 64, "tile_size_x": 4, "tile_size_y": 4, "sm__warps_active.avg.pct_of_peak_sustained_active": 97.9661050519356, "sm__maximum_warps_per_active_cycle_pct": 97.9661050519356, "time": 152.87828717912947, "times": [147.40655517578125, 146.41127014160156, 146.8626251220703, 146.3775634765625, 158.9936981201172, 162.22618103027344, 161.8701171875], "nvml_power": 114.436, "nvml_energy": 17.49477967163086, "compile_time": 253.6661869380623, "verification_time": 0, "benchmark_time": 2316.7683799983934, "edp": 2674.5719507751787, "flops_watt": 7855997.963487812, "occupancy": 97.9661050519356, "strategy_time": 0, "framework_time": 0.3947201184928417, "timestamp": "2025-02-18 02:06:53.945264+00:00"},
"2,128,1,1": {"block_size_x": 2, "block_size_y": 128, "tile_size_x": 1, "tile_size_y": 1, "sm__warps_active.avg.pct_of_peak_sustained_active": 95.70812527731441, "sm__maximum_warps_per_active_cycle_pct": 95.70812527731441, "time": 242.09256635393416, "times": [232.8773193359375, 230.6714630126953, 250.55868530273438, 257.67047119140625, 241.6979217529297, 233.20375061035156, 247.96835327148438], "nvml_power": 114.255, "nvml_energy": 27.660286168768746, "compile_time": 250.57714094873518, "verification_time": 0, "benchmark_time": 3199.966109939851, "edp": 6696.349664681455, "flops_watt": 4968818.928098526, "occupancy": 95.70812527731441, "strategy_time": 0, "framework_time": 0.39871910121291876, "timestamp": "2025-02-18 02:06:57.396231+00:00"},
"2,128,1,2": {"block_size_x": 2, "block_size_y": 128, "tile_size_x": 1, "tile_size_y": 2, "sm__warps_active.avg.pct_of_peak_sustained_active": 95.86599172871414, "sm__maximum_warps_per_active_cycle_pct": 95.86599172871414, "time": 239.81917898995536, "times": [232.59695434570312, 230.6914520263672, 249.3074188232422, 254.22592163085938, 235.1328887939453, 230.26783752441406, 246.51177978515625], "nvml_power": 113.8845, "nvml_energy": 27.311687289681572, "compile_time": 251.56290899030864, "verification_time": 0, "benchmark_time": 3164.010421023704, "edp": 6549.866422641834, "flops_watt": 5032239.568879539, "occupancy": 95.86599172871414, "strategy_time": 0, "framework_time": 0.4229199839755893, "timestamp": "2025-02-18 02:07:00.812252+00:00"},
"2,128,1,4": {"block_size_x": 2, "block_size_y": 128, "tile_size_x": 1, "tile_size_y": 4, "sm__warps_active.avg.pct_of_peak_sustained_active": 95.8303409604817, "sm__maximum_warps_per_active_cycle_pct": 95.8303409604817, "time": 240.57076590401786, "times": [233.36752319335938, 231.96450805664062, 250.10963439941406, 252.83526611328125, 234.8251495361328, 232.10374450683594, 248.78953552246094], "nvml_power": 113.65, "nvml_energy": 27.34086754499163, "compile_time": 251.85285904444754, "verification_time": 0, "benchmark_time": 3185.8799339970574, "edp": 6577.413445778941, "flops_watt": 5026868.779706166, "occupancy": 95.8303409604817, "strategy_time": 0, "framework_time": 0.40228001307696104, "timestamp": "2025-02-18 02:07:04.250412+00:00"},
"2,128,2,1": {"block_size_x": 2, "block_size_y": 128, "tile_size_x": 2, "tile_size_y": 1, "sm__warps_active.avg.pct_of_peak_sustained_active": 95.8747293128449, "sm__maximum_warps_per_active_cycle_pct": 95.8747293128449, "time": 277.50696236746654, "times": [262.83203125, 265.7892761230469, 293.63641357421875, 283.8743591308594, 262.4056701660156, 282.16851806640625, 291.84246826171875], "nvml_power": 113.735, "nvml_energy": 31.562254364863804, "compile_time": 253.26247792690992, "verification_time": 0, "benchmark_time": 3358.774428954348, "edp": 8758.745334262667, "flops_watt": 4354535.385311443, "occupancy": 95.8747293128449, "strategy_time": 0, "framework_time": 0.40308013558387756, "timestamp": "2025-02-18 02:07:07.862876+00:00"},
"2,128,2,2": {"block_size_x": 2, "block_size_y": 128, "tile_size_x": 2, "tile_size_y": 2, "sm__warps_active.avg.pct_of_peak_sustained_active": 95.96788875981761, "sm__maximum_warps_per_active_cycle_pct": 95.96788875981761, "time": 279.7793404715402, "times": [264.0064392089844, 267.78350830078125, 296.1348876953125, 287.56475830078125, 263.640869140625, 284.66949462890625, 294.6554260253906], "nvml_power": 113.72, "nvml_energy": 31.816506598423548, "compile_time": 245.03481504507363, "verification_time": 0, "benchmark_time": 3379.3888030340895, "edp": 8901.601232215347, "flops_watt": 4319737.39941675, "occupancy": 95.96788875981761, "strategy_time": 0, "framework_time": 0.4035499878227711, "timestamp": "2025-02-18 02:07:11.487727+00:00"},
"2,128,2,4": {"block_size_x": 2, "block_size_y": 128, "tile_size_x": 2, "tile_size_y": 4, "sm__warps_active.avg.pct_of_peak_sustained_active": 95.89794182522674, "sm__maximum_warps_per_active_cycle_pct": 95.89794182522674, "time": 280.0269513811384, "times": [264.60760498046875, 270.38409423828125, 294.4618835449219, 284.9181823730469, 263.6967468261719, 288.24151611328125, 293.8786315917969], "nvml_power": 113.523, "nvml_energy": 31.789499601640976, "compile_time": 249.194590956904, "verification_time": 0, "benchmark_time": 3383.445310057141, "edp": 8901.916659379436, "flops_watt": 4323407.263224281, "occupancy": 95.89794182522674, "strategy_time": 0, "framework_time": 0.4075899487361312, "timestamp": "2025-02-18 02:07:15.120800+00:00"},
"2,128,4,1": {"block_size_x": 2, "block_size_y": 128, "tile_size_x": 4, "tile_size_y": 1, "sm__warps_active.avg.pct_of_peak_sustained_active": 95.71666176782061, "sm__maximum_warps_per_active_cycle_pct": 95.71666176782061, "time": 149.42910984584265, "times": [143.74911499023438, 142.27577209472656, 142.97193908691406, 143.21827697753906, 155.56600952148438, 158.68063354492188, 159.54202270507812], "nvml_power": 114.424, "nvml_energy": 17.0982764650007, "compile_time": 252.30222893878818, "verification_time": 0, "benchmark_time": 2266.6554249590263, "edp": 2554.9802320631757, "flops_watt": 8038175.880085371, "occupancy": 95.71666176782061, "strategy_time": 0, "framework_time": 0.4269500495865941, "timestamp": "2025-02-18 02:07:17.640209+00:00"},
"2,128,4,2": {"block_size_x": 2, "block_size_y": 128, "tile_size_x": 4, "tile_size_y": 2, "sm__warps_active.avg.pct_of_peak_sustained_active": 95.80897046758032, "sm__maximum_warps_per_active_cycle_pct": 95.80897046758032, "time": 148.77142116001673, "times": [143.3420867919922, 142.14944458007812, 142.89756774902344, 143.22918701171875, 153.83702087402344, 157.8461456298828, 158.09849548339844], "nvml_power": 113.676, "nvml_energy": 16.911740071786063, "compile_time": 251.85492890886962, "verification_time": 0, "benchmark_time": 2260.1664710091427, "edp": 2515.983604768416, "flops_watt": 8126836.912618476, "occupancy": 95.80897046758032, "strategy_time": 0, "framework_time": 0.4003500798717141, "timestamp": "2025-02-18 02:07:20.152657+00:00"},
"2,128,4,4": {"block_size_x": 2, "block_size_y": 128, "tile_size_x": 4, "tile_size_y": 4, "sm__warps_active.avg.pct_of_peak_sustained_active": 95.75121978152085, "sm__maximum_warps_per_active_cycle_pct": 95.75121978152085, "time": 148.8997802734375, "times": [144.44163513183594, 143.2545928955078, 143.25509643554688, 143.23779296875, 152.74351501464844, 160.19952392578125, 155.1663055419922], "nvml_power": 115.242, "nvml_energy": 17.159508478271487, "compile_time": 248.30796208698303, "verification_time": 0, "benchmark_time": 2252.5744379963726, "edp": 2555.047042014812, "flops_watt": 8009492.442399172, "occupancy": 95.75121978152085, "strategy_time": 0, "framework_time": 0.4073389573022723, "timestamp": "2025-02-18 02:07:22.653972+00:00"},
"4,16,1,1": {"block_size_x": 4, "block_size_y": 16, "tile_size_x": 1, "tile_size_y": 1, "sm__warps_active.avg.pct_of_peak_sustained_active": 98.34073412534097, "sm__maximum_warps_per_active_cycle_pct": 98.34073412534097, "time": 169.59680393763952, "times": [162.6980438232422, 161.48707580566406, 161.4517364501953, 167.62255859375, 179.68531799316406, 180.5636749267578, 173.66921997070312], "nvml_power": 114.409, "nvml_energy": 19.4034007417014, "compile_time": 253.02001810632646, "verification_time": 0, "benchmark_time": 2383.0420679878443, "edp": 3290.7547513137815, "flops_watt": 7083240.474264852, "occupancy": 98.34073412534097, "strategy_time": 0, "framework_time": 0.412939814850688, "timestamp": "2025-02-18 02:07:25.290473+00:00"},
"4,16,1,2": {"block_size_x": 4, "block_size_y": 16, "tile_size_x": 1, "tile_size_y": 2, "sm__warps_active.avg.pct_of_peak_sustained_active": 98.27327139027926, "sm__maximum_warps_per_active_cycle_pct": 98.27327139027926, "time": 170.11769104003906, "times": [162.60943603515625, 162.47219848632812, 162.14047241210938, 168.27903747558594, 181.71090698242188, 179.98182678222656, 173.6299591064453], "nvml_power": 114.876, "nvml_energy": 19.54243987591553, "compile_time": 252.47194897383451, "verification_time": 0, "benchmark_time": 2385.6493569910526, "edp": 3324.5147489795377, "flops_watt": 7032845.14854168, "occupancy": 98.27327139027926, "strategy_time": 0, "framework_time": 0.4095600452274084, "timestamp": "2025-02-18 02:07:27.929031+00:00"},
"4,16,1,4": {"block_size_x": 4, "block_size_y": 16, "tile_size_x": 1, "tile_size_y": 4, "sm__warps_active.avg.pct_of_peak_sustained_active": 98.11145907863585, "sm__maximum_warps_per_active_cycle_pct": 98.11145907863585, "time": 166.55140032087053, "times": [160.92982482910156, 159.6565704345703, 159.6580810546875, 162.59315490722656, 179.3995819091797, 177.9134063720703, 165.7091827392578], "nvml_power": 115.407, "nvml_energy": 19.221197456830705, "compile_time": 250.3200409701094, "verification_time": 0, "benchmark_time": 2505.575077026151, "edp": 3201.3173522791094, "flops_watt": 7150384.557501012, "occupancy": 98.11145907863585, "strategy_time": 0, "framework_time": 0.4353289259597659, "timestamp": "2025-02-18 02:07:30.685387+00:00"},
"4,16,2,1": {"block_size_x": 4, "block_size_y": 16, "tile_size_x": 2, "tile_size_y": 1, "sm__warps_active.avg.pct_of_peak_sustained_active": 97.90688942500947, "sm__maximum_warps_per_active_cycle_pct": 97.90688942500947, "time": 165.2358136858259, "times": [160.11654663085938, 156.5849609375, 157.52963256835938, 168.56719970703125, 175.00067138671875, 174.36032104492188, 164.49136352539062], "nvml_power": 115.383, "nvml_energy": 19.065403890511647, "compile_time": 250.7525699911639, "verification_time": 0, "benchmark_time": 2424.5837948983535, "edp": 3150.2875250976026, "flops_watt": 7208814.156850869, "occupancy": 97.90688942500947, "strategy_time": 0, "framework_time": 0.4074301104992628, "timestamp": "2025-02-18 02:07:33.361156+00:00"},
"4,16,2,2": {"block_size_x": 4, "block_size_y": 16, "tile_size_x": 2, "tile_size_y": 2, "sm__warps_active.avg.pct_of_peak_sustained_active": 97.59636890366711, "sm__maximum_warps_per_active_cycle_pct": 97.59636890366711, "time": 162.6874716622489, "times": [156.46800231933594, 155.38742065429688, 155.21267700195312, 158.55087280273438, 172.3690185546875, 172.08901977539062, 168.73529052734375], "nvml_power": 115.388, "nvml_energy": 18.772181980163577, "compile_time": 248.12899297103286, "verification_time": 0, "benchmark_time": 2450.3923929296434, "edp": 3053.998823936441, "flops_watt": 7321415.998269712, "occupancy": 97.59636890366711, "strategy_time": 0, "framework_time": 0.4014201695099473, "timestamp": "2025-02-18 02:07:36.060105+00:00"},
"4,16,2,4": {"block_size_x": 4, "block_size_y": 16, "tile_size_x": 2, "tile_size_y": 4, "sm__warps_active.avg.pct_of_peak_sustained_active": 97.25318437677004, "sm__maximum_warps_per_active_cycle_pct": 97.25318437677004, "time": 160.0916246686663, "times": [154.1124725341797, 151.95404052734375, 152.60018920898438, 153.76918029785156, 169.77842712402344, 170.26821899414062, 168.15884399414062], "nvml_power": 114.958, "nvml_energy": 18.40381298866054, "compile_time": 251.594310044311, "verification_time": 0, "benchmark_time": 2408.3174989791587, "edp": 2946.296321452969, "flops_watt": 7467960.772948662, "occupancy": 97.25318437677004, "strategy_time": 0, "framework_time": 0.40066998917609453, "timestamp": "2025-02-18 02:07:38.720443+00:00"},
"4,16,4,1": {"block_size_x": 4, "block_size_y": 16, "tile_size_x": 4, "tile_size_y": 1, "sm__warps_active.avg.pct_of_peak_sustained_active": 97.57451279039692, "sm__maximum_warps_per_active_cycle_pct": 97.57451279039692, "time": 177.39836992536272, "times": [172.46397399902344, 170.45773315429688, 171.3429718017578, 181.41322326660156, 190.8912353515625, 183.31298828125, 171.90646362304688], "nvml_power": 115.792, "nvml_energy": 20.541312050397597, "compile_time": 251.31173990666866, "verification_time": 0, "benchmark_time": 2505.545718013309, "edp": 3643.995273868744, "flops_watt": 6690855.634479286, "occupancy": 97.57451279039692, "strategy_time": 0, "framework_time": 0.4057700280100107, "timestamp": "2025-02-18 02:07:41.477730+00:00"},
"4,16,4,2": {"block_size_x": 4, "block_size_y": 16, "tile_size_x": 4, "tile_size_y": 2, "sm__warps_active.avg.pct_of_peak_sustained_active": 97.39121292826118, "sm__maximum_warps_per_active_cycle_pct": 97.39121292826118, "time": 175.8983895438058, "times": [170.2090606689453, 169.6842803955078, 169.73782348632812, 179.6980743408203, 188.7545928955078, 182.49667358398438, 170.70822143554688], "nvml_power": 116.262, "nvml_energy": 20.45029856514195, "compile_time": 250.27960096485913, "verification_time": 0, "benchmark_time": 2483.1381669500843, "edp": 3597.174583298471, "flops_watt": 6720633.10147795, "occupancy": 97.39121292826118, "strategy_time": 0, "framework_time": 0.4035800229758024, "timestamp": "2025-02-18 02:07:44.211575+00:00"},
"4,16,4,4": {"block_size_x": 4, "block_size_y": 16, "tile_size_x": 4, "tile_size_y": 4, "sm__warps_active.avg.pct_of_peak_sustained_active": 97.01685132412446, "sm__maximum_warps_per_active_cycle_pct": 97.01685132412446, "time": 171.26600864955358, "times": [165.84439086914062, 165.34197998046875, 165.71229553222656, 173.11305236816406, 184.02294921875, 178.37925720214844, 166.44813537597656], "nvml_power": 116.189, "nvml_energy": 19.89922627898298, "compile_time": 251.8806700827554, "verification_time": 0, "benchmark_time": 2415.809113997966, "edp": 3408.061060015723, "flops_watt": 6906748.611485426, "occupancy": 97.01685132412446, "strategy_time": 0, "framework_time": 0.40698994416743517, "timestamp": "2025-02-18 02:07:46.879697+00:00"},
"4,32,1,1": {"block_size_x": 4, "block_size_y": 32, "tile_size_x": 1, "tile_size_y": 1, "sm__warps_active.avg.pct_of_peak_sustained_active": 95.61152269942693, "sm__maximum_warps_per_active_cycle_pct": 95.61152269942693, "time": 165.51275416782923, "times": [160.35565185546875, 159.50160217285156, 159.24847412109375, 162.7749786376953, 178.42169189453125, 174.5318145751953, 163.75506591796875], "nvml_power": 116.077, "nvml_energy": 19.212223965539113, "compile_time": 243.82617697119713, "verification_time": 0, "benchmark_time": 2492.05585103482, "edp": 3179.8681022255523, "flops_watt": 7153724.301701025, "occupancy": 95.61152269942693, "strategy_time": 0, "framework_time": 0.4033090081065893, "timestamp": "2025-02-18 02:07:49.616008+00:00"},
"4,32,1,2": {"block_size_x": 4, "block_size_y": 32, "tile_size_x": 1, "tile_size_y": 2, "sm__warps_active.avg.pct_of_peak_sustained_active": 95.52079002988918, "sm__maximum_warps_per_active_cycle_pct": 95.52079002988918, "time": 169.22903442382812, "times": [162.198974609375, 160.87794494628906, 160.66578674316406, 166.33970642089844, 179.56405639648438, 180.3040008544922, 174.65277099609375], "nvml_power": 114.081, "nvml_energy": 19.305817476104735, "compile_time": 251.57490000128746, "verification_time": 0, "benchmark_time": 2387.345029041171, "edp": 3267.1048502438707, "flops_watt": 7119043.451131321, "occupancy": 95.52079002988918, "strategy_time": 0, "framework_time": 0.4003189969807863, "timestamp": "2025-02-18 02:07:52.255355+00:00"},
"4,32,1,4": {"block_size_x": 4, "block_size_y": 32, "tile_size_x": 1, "tile_size_y": 4, "sm__warps_active.avg.pct_of_peak_sustained_active": 95.4998648464978, "sm__maximum_warps_per_active_cycle_pct": 95.4998648464978, "time": 169.14090619768416, "times": [161.91651916503906, 160.99151611328125, 161.497314453125, 169.04640197753906, 179.7499237060547, 179.6580810546875, 171.1265869140625], "nvml_power": 115.545, "nvml_energy": 19.543386006611417, "compile_time": 249.58350195083767, "verification_time": 0, "benchmark_time": 2377.1688969573006, "edp": 3305.5860193293947, "flops_watt": 7032504.67577651, "occupancy": 95.4998648464978, "strategy_time": 0, "framework_time": 0.40938914753496647, "timestamp": "2025-02-18 02:07:54.882541+00:00"},
"4,32,2,1": {"block_size_x": 4, "block_size_y": 32, "tile_size_x": 2, "tile_size_y": 1, "sm__warps_active.avg.pct_of_peak_sustained_active": 94.87643703116075, "sm__maximum_warps_per_active_cycle_pct": 94.87643703116075, "time": 165.35477556501115, "times": [158.37388610839844, 156.59207153320312, 157.5577850341797, 161.06903076171875, 176.96681213378906, 175.17820739746094, 171.74563598632812], "nvml_power": 114.561, "nvml_energy": 18.943208443503245, "compile_time": 250.28179201763123, "verification_time": 0, "benchmark_time": 2486.6959860082716, "edp": 3132.3499806567033, "flops_watt": 7255315.480579849, "occupancy": 94.87643703116075, "strategy_time": 0, "framework_time": 0.41750993113964796, "timestamp": "2025-02-18 02:07:57.619962+00:00"},
"4,32,2,2": {"block_size_x": 4, "block_size_y": 32, "tile_size_x": 2, "tile_size_y": 2, "sm__warps_active.avg.pct_of_peak_sustained_active": 94.77662346015946, "sm__maximum_warps_per_active_cycle_pct": 94.77662346015946, "time": 161.39342607770647, "times": [156.280517578125, 154.8673553466797, 154.9385223388672, 155.5157470703125, 174.0743408203125, 172.03042602539062, 162.0470733642578], "nvml_power": 115.156, "nvml_energy": 18.585421373404365, "compile_time": 249.67383197508752, "verification_time": 0, "benchmark_time": 2429.0987050626427, "edp": 2999.5648305515633, "flops_watt": 7394987.216629609, "occupancy": 94.77662346015946, "strategy_time": 0, "framework_time": 0.41516893543303013, "timestamp": "2025-02-18 02:08:00.299174+00:00"},
"4,32,2,4": {"block_size_x": 4, "block_size_y": 32, "tile_size_x": 2, "tile_size_y": 4, "sm__warps_active.avg.pct_of_peak_sustained_active": 94.40853346151495, "sm__maximum_warps_per_active_cycle_pct": 94.40853346151495, "time": 162.54366193498885, "times": [156.44908142089844, 154.56442260742188, 154.99618530273438, 156.6940460205078, 172.489501953125, 172.52224731445312, 170.09014892578125], "nvml_power": 114.172, "nvml_energy": 18.557934970441547, "compile_time": 249.96580206789076, "verification_time": 0, "benchmark_time": 2444.6771520888433, "edp": 3016.474708046958, "flops_watt": 7405940.030014553, "occupancy": 94.40853346151495, "strategy_time": 0, "framework_time": 0.4036887548863888, "timestamp": "2025-02-18 02:08:02.994247+00:00"},
"4,32,4,1": {"block_size_x": 4, "block_size_y": 32, "tile_size_x": 4, "tile_size_y": 1, "sm__warps_active.avg.pct_of_peak_sustained_active": 94.20469787352923, "sm__maximum_warps_per_active_cycle_pct": 94.20469787352923, "time": 181.40157209123885, "times": [176.19052124023438, 175.04092407226562, 174.47914123535156, 186.78524780273438, 195.62733459472656, 185.9256591796875, 175.76217651367188], "nvml_power": 115.849, "nvml_energy": 21.015190725197932, "compile_time": 253.53727908805013, "verification_time": 0, "benchmark_time": 2561.9814050151035, "edp": 3812.188635348127, "flops_watt": 6539981.257805384, "occupancy": 94.20469787352923, "strategy_time": 0, "framework_time": 0.40343881119042635, "timestamp": "2025-02-18 02:08:05.810195+00:00"},
"4,32,4,2": {"block_size_x": 4, "block_size_y": 32, "tile_size_x": 4, "tile_size_y": 2, "sm__warps_active.avg.pct_of_peak_sustained_active": 93.96899876375417, "sm__maximum_warps_per_active_cycle_pct": 93.96899876375417, "time": 180.3551243373326, "times": [175.7906494140625, 173.8922576904297, 173.33673095703125, 185.7993927001953, 193.0550994873047, 185.57180786132812, 175.03993225097656], "nvml_power": 115.328, "nvml_energy": 20.799995779575895, "compile_time": 253.55671893339604, "verification_time": 0, "benchmark_time": 2546.9642280368134, "edp": 3751.3858250414037, "flops_watt": 6607643.334570059, "occupancy": 93.96899876375417, "strategy_time": 0, "framework_time": 0.4084890242666006, "timestamp": "2025-02-18 02:08:08.611149+00:00"},
"4,32,4,4": {"block_size_x": 4, "block_size_y": 32, "tile_size_x": 4, "tile_size_y": 4, "sm__warps_active.avg.pct_of_peak_sustained_active": 93.25783383347547, "sm__maximum_warps_per_active_cycle_pct": 93.25783383347547, "time": 177.60484967912947, "times": [173.08726501464844, 170.39596557617188, 170.87432861328125, 181.27337646484375, 192.02426147460938, 183.40701293945312, 172.17173767089844], "nvml_power": 115.504, "nvml_energy": 20.514070557338172, "compile_time": 250.3423619782552, "verification_time": 0, "benchmark_time": 2507.132490980439, "edp": 3643.3984176431018, "flops_watt": 6699740.701770969, "occupancy": 93.25783383347547, "strategy_time": 0, "framework_time": 0.3883590688928962, "timestamp": "2025-02-18 02:08:11.369038+00:00"},
"4,64,1,1": {"block_size_x": 4, "block_size_y": 64, "tile_size_x": 1, "tile_size_y": 1, "sm__warps_active.avg.pct_of_peak_sustained_active": 88.73064860469648, "sm__maximum_warps_per_active_cycle_pct": 88.73064860469648, "time": 150.11644417898995, "times": [145.70950317382812, 143.11407470703125, 143.83612060546875, 143.6209259033203, 156.30499267578125, 160.6539764404297, 157.5755157470703], "nvml_power": 114.09, "nvml_energy": 17.126785116380965, "compile_time": 248.41906304936856, "verification_time": 0, "benchmark_time": 2270.570839056745, "edp": 2571.012081888759, "flops_watt": 8024795.8118272945, "occupancy": 88.73064860469648, "strategy_time": 0, "framework_time": 0.4055788740515709, "timestamp": "2025-02-18 02:08:13.888461+00:00"},
"4,64,1,2": {"block_size_x": 4, "block_size_y": 64, "tile_size_x": 1, "tile_size_y": 2, "sm__warps_active.avg.pct_of_peak_sustained_active": 88.10323881783069, "sm__maximum_warps_per_active_cycle_pct": 88.10323881783069, "time": 148.9840807233538, "times": [144.0515594482422, 142.13241577148438, 141.75149536132812, 141.681884765625, 154.18077087402344, 160.24240112304688, 158.84803771972656], "nvml_power": 113.768, "nvml_energy": 16.949620895734515, "compile_time": 251.1601709993556, "verification_time": 0, "benchmark_time": 2258.181118988432, "edp": 2525.2236877603555, "flops_watt": 8108674.189083924, "occupancy": 88.10323881783069, "strategy_time": 0, "framework_time": 0.41962903924286366, "timestamp": "2025-02-18 02:08:16.398248+00:00"},
"4,64,1,4": {"block_size_x": 4, "block_size_y": 64, "tile_size_x": 1, "tile_size_y": 4, "sm__warps_active.avg.pct_of_peak_sustained_active": 87.44545755036475, "sm__maximum_warps_per_active_cycle_pct": 87.44545755036475, "time": 149.03214808872767, "times": [142.6065673828125, 141.13763427734375, 142.5389404296875, 140.92457580566406, 156.53050231933594, 159.6999969482422, 159.7868194580078], "nvml_power": 113.584, "nvml_energy": 16.927667508510044, "compile_time": 251.03225209750235, "verification_time": 0, "benchmark_time": 2277.472113026306, "edp": 2522.7666509250125, "flops_watt": 8119190.278454213, "occupancy": 87.44545755036475, "strategy_time": 0, "framework_time": 0.4006288945674896, "timestamp": "2025-02-18 02:08:18.927179+00:00"},
