experiments/bayes_opt_float32.json
{
"device_name": "NVIDIA RTX 5000 Ada Generation",
"kernel_name": "tuned_matmul<float>",
"problem_size": [
4096,
4096
],
"tune_params_keys": [
"block_size_x",
"block_size_y",
"tile_size_x",
"tile_size_y",
"nvml_pwr_limit"
],
"tune_params": {
"block_size_x": [
1,
2,
4,
8,
16,
32,
64,
128,
256,
512,
1024
],
"block_size_y": [
1,
2,
4,
8,
16,
32,
64,
128,
256,
512,
1024
],
"tile_size_x": [
2,
4,
8,
16,
32
],
"tile_size_y": [
2,
4,
8,
16,
32
],
"nvml_pwr_limit": [
100,
105,
110,
115,
120,
125,
130,
135,
140,
145,
150,
155,
160,
165,
170,
175,
180,
185,
190,
195,
200,
205,
210,
215,
220,
225,
230,
235,
240,
245,
250
]
},
"objective": "objective",
"cache": {
"4,8,32,8,235": {"block_size_x": 4, "block_size_y": 8, "tile_size_x": 32, "tile_size_y": 8, "nvml_pwr_limit": 235, "sm__warps_active.avg.pct_of_peak_sustained_active": 49.43263037042071, "dram__bytes.sum.per_second": 41136492361.56251, "time": 10.144909858703613, "times": [9.744704246520996, 9.882304191589355, 9.916607856750488, 10.20348834991455, 10.448960304260254, 10.42848014831543, 10.389823913574219], "nvml_power": 232.923, "nvml_energy": 2.362982839018822, "compile_time": 240.1341290678829, "verification_time": 0, "benchmark_time": 1145.9277810063213, "edp": 23.9722478995095, "throughput_penalty": 1000000.0, "objective": 1000023.9722478995, "strategy_time": 1338.140080915764, "framework_time": 0, "timestamp": "2025-02-20 07:56:56.901603+00:00"},
"2,64,32,32,125": {"block_size_x": 2, "block_size_y": 64, "tile_size_x": 32, "tile_size_y": 32, "nvml_pwr_limit": 125, "sm__warps_active.avg.pct_of_peak_sustained_active": 95.4833514421285, "dram__bytes.sum.per_second": 20851454465.318714, "time": 15.078445843287877, "times": [9.382304191589355, 11.913503646850586, 14.333120346069336, 19.254655838012695, 17.633024215698242, 16.682432174682617, 16.350080490112305], "nvml_power": 128.824, "nvml_energy": 1.9424657073157177, "compile_time": 241.11852096393704, "verification_time": 0, "benchmark_time": 1262.2320239897817, "edp": 29.28936397020393, "throughput_penalty": 1000000.0, "objective": 1000029.2893639702, "strategy_time": 0.2954800147563219, "framework_time": 53.73975494876504, "timestamp": "2025-02-20 07:56:58.459013+00:00"},
"128,4,32,4,220": {"block_size_x": 128, "block_size_y": 4, "tile_size_x": 32, "tile_size_y": 4, "nvml_pwr_limit": 220, "sm__warps_active.avg.pct_of_peak_sustained_active": 99.26755247856056, "dram__bytes.sum.per_second": 3134608373.1876144, "time": 39.95992224557059, "times": [40.05196762084961, 40.119102478027344, 39.787776947021484, 39.939552307128906, 39.9436149597168, 39.9376335144043, 39.9398078918457], "nvml_power": 220.369, "nvml_energy": 8.805928105334145, "compile_time": 248.35207196883857, "verification_time": 0, "benchmark_time": 1395.3435481525958, "edp": 351.88420238923715, "throughput_penalty": 1000000.0, "objective": 1000351.8842023893, "strategy_time": 0.24355994537472725, "framework_time": 48.816759837791324, "timestamp": "2025-02-20 07:57:00.151794+00:00"},
"32,8,2,4,100": {"block_size_x": 32, "block_size_y": 8, "tile_size_x": 2, "tile_size_y": 4, "nvml_pwr_limit": 100, "sm__warps_active.avg.pct_of_peak_sustained_active": 98.70939764767306, "dram__bytes.sum.per_second": 586695091.5194554, "time": 160.16595676967077, "times": [154.0292510986328, 156.25074768066406, 156.06069946289062, 155.34095764160156, 161.94422912597656, 170.39695739746094, 167.13885498046875], "nvml_power": 99.401, "nvml_energy": 15.920656268862043, "compile_time": 244.69509907066822, "verification_time": 0, "benchmark_time": 2355.6364600080997, "edp": 2549.947143703346, "throughput_penalty": 1000000.0, "objective": 1002549.9471437033, "strategy_time": 0.5345209501683712, "framework_time": 51.7599789891392, "timestamp": "2025-02-20 07:57:02.804444+00:00"},
"1,32,8,2,230": {"block_size_x": 1, "block_size_y": 32, "tile_size_x": 8, "tile_size_y": 2, "nvml_pwr_limit": 230, "sm__warps_active.avg.pct_of_peak_sustained_active": 49.64122459036792, "dram__bytes.sum.per_second": 18025843646.84593, "time": 35.13186754499163, "times": [35.15446472167969, 35.14998245239258, 35.1220817565918, 35.1308479309082, 35.1223030090332, 35.13926315307617, 35.104129791259766], "nvml_power": 216.456, "nvml_energy": 7.604503521318707, "compile_time": 250.02040504477918, "verification_time": 0, "benchmark_time": 1329.8167439643294, "edp": 267.1604104563912, "throughput_penalty": 1000000.0, "objective": 1000267.1604104564, "strategy_time": 0.49048103392124176, "framework_time": 54.73717674612999, "timestamp": "2025-02-20 07:57:04.439533+00:00"},
"32,8,16,8,210": {"block_size_x": 32, "block_size_y": 8, "tile_size_x": 16, "tile_size_y": 8, "nvml_pwr_limit": 210, "sm__warps_active.avg.pct_of_peak_sustained_active": 98.79190900543863, "dram__bytes.sum.per_second": 3585539282.1856937, "time": 42.65235301426479, "times": [47.5904655456543, 42.04684829711914, 41.94684982299805, 41.990657806396484, 41.568607330322266, 42.128448486328125, 41.294593811035156], "nvml_power": 213.148, "nvml_energy": 9.09126374028451, "compile_time": 249.11958095617592, "verification_time": 0, "benchmark_time": 1387.0990939904004, "edp": 387.7637903964002, "throughput_penalty": 1000000.0, "objective": 1000387.7637903964, "strategy_time": 0.5093109793961048, "framework_time": 55.51322014071047, "timestamp": "2025-02-20 07:57:06.131799+00:00"},
"1,128,4,8,245": {"block_size_x": 1, "block_size_y": 128, "tile_size_x": 4, "tile_size_y": 8, "nvml_pwr_limit": 245, "sm__warps_active.avg.pct_of_peak_sustained_active": 98.5182839746113, "dram__bytes.sum.per_second": 11495850381.699594, "time": 71.4999269757952, "times": [71.83869171142578, 71.42034912109375, 71.65017700195312, 71.47113800048828, 71.43657684326172, 71.31673431396484, 71.3658218383789], "nvml_power": 244.196, "nvml_energy": 17.459996167781284, "compile_time": 248.75087896361947, "verification_time": 0, "benchmark_time": 1605.850304942578, "edp": 1248.388450994026, "throughput_penalty": 1000000.0, "objective": 1001248.388450994, "strategy_time": 0.5194819532334805, "framework_time": 52.67210002057254, "timestamp": "2025-02-20 07:57:08.039616+00:00"},
"1,256,2,2,215": {"block_size_x": 1, "block_size_y": 256, "tile_size_x": 2, "tile_size_y": 2, "nvml_pwr_limit": 215, "sm__warps_active.avg.pct_of_peak_sustained_active": 98.13012017790358, "dram__bytes.sum.per_second": 7788597056.842769, "time": 143.52933175223214, "times": [142.7758026123047, 142.27865600585938, 142.31919860839844, 142.7767333984375, 142.8567352294922, 145.59861755371094, 146.09957885742188], "nvml_power": 215.43400000000003, "nvml_energy": 30.921098056710385, "compile_time": 249.22835896722972, "verification_time": 0, "benchmark_time": 2188.2764601614326, "edp": 4438.084541124886, "throughput_penalty": 1000000.0, "objective": 1004438.0845411249, "strategy_time": 0.20785094238817692, "framework_time": 57.14226304553449, "timestamp": "2025-02-20 07:57:10.534496+00:00"},
"1,32,16,32,100": {"block_size_x": 1, "block_size_y": 32, "tile_size_x": 16, "tile_size_y": 32, "nvml_pwr_limit": 100, "sm__warps_active.avg.pct_of_peak_sustained_active": 49.30257084206831, "dram__bytes.sum.per_second": 30183389845.70914, "time": 44.65599060058594, "times": [41.39129638671875, 49.274593353271484, 44.656639099121094, 44.15584182739258, 42.659454345703125, 44.108734130859375, 46.345375061035156], "nvml_power": 100.465, "nvml_energy": 4.486364095687866, "compile_time": 252.48390808701515, "verification_time": 0, "benchmark_time": 1413.3975140284747, "edp": 200.34303288784355, "throughput_penalty": 1000000.0, "objective": 1000200.3430328878, "strategy_time": 0.1895411405712366, "framework_time": 54.73066587001085, "timestamp": "2025-02-20 07:57:12.255324+00:00"},
"2,32,8,2,200": {"block_size_x": 2, "block_size_y": 32, "tile_size_x": 8, "tile_size_y": 2, "nvml_pwr_limit": 200, "sm__warps_active.avg.pct_of_peak_sustained_active": 96.7201379104835, "dram__bytes.sum.per_second": 21653258032.048874, "time": 39.967035566057476, "times": [40.941184997558594, 39.709632873535156, 39.761409759521484, 39.843265533447266, 39.66307067871094, 39.84966278076172, 40.00102233886719], "nvml_power": 204.003, "nvml_energy": 8.153395156582423, "compile_time": 249.60355809889734, "verification_time": 0, "benchmark_time": 1408.7012249510735, "edp": 325.86703420725047, "throughput_penalty": 1000000.0, "objective": 1000325.8670342072, "strategy_time": 0.24486100301146507, "framework_time": 52.02494794502854, "timestamp": "2025-02-20 07:57:13.965923+00:00"},
"8,32,4,4,200": {"block_size_x": 8, "block_size_y": 32, "tile_size_x": 4, "tile_size_y": 4, "nvml_pwr_limit": 200, "sm__warps_active.avg.pct_of_peak_sustained_active": 94.05275355454187, "dram__bytes.sum.per_second": 388224752.3719558, "time": 50.51021684919085, "times": [49.10259246826172, 50.704830169677734, 50.54275131225586, 50.82844924926758, 50.79542541503906, 50.79417419433594, 50.80329513549805], "nvml_power": 204.351, "nvml_energy": 10.321813323348998, "compile_time": 250.68268086761236, "verification_time": 0, "benchmark_time": 1451.664439868182, "edp": 521.3570292392251, "throughput_penalty": 1000000.0, "objective": 1000521.3570292392, "strategy_time": 0.48705097287893295, "framework_time": 0.5626222118735313, "timestamp": "2025-02-20 07:57:15.669343+00:00"},
"2,256,2,32,245": {"block_size_x": 2, "block_size_y": 256, "tile_size_x": 2, "tile_size_y": 32, "nvml_pwr_limit": 245, "sm__warps_active.avg.pct_of_peak_sustained_active": 91.90968280322302, "dram__bytes.sum.per_second": 7860592354.03898, "time": 144.02465166364397, "times": [144.08131408691406, 144.02365112304688, 144.01942443847656, 144.00204467773438, 144.00381469726562, 144.04640197753906, 143.99591064453125], "nvml_power": 239.86, "nvml_energy": 34.545752948041645, "compile_time": 249.3048149626702, "verification_time": 0, "benchmark_time": 2190.698239952326, "edp": 4975.4400348, "throughput_penalty": 1000000.0, "objective": 1004975.4400348, "strategy_time": 0.5108709447085857, "framework_time": 53.93826519139111, "timestamp": "2025-02-20 07:57:18.163821+00:00"},
"8,64,16,2,165": {"block_size_x": 8, "block_size_y": 64, "tile_size_x": 16, "tile_size_y": 2, "nvml_pwr_limit": 165, "sm__warps_active.avg.pct_of_peak_sustained_active": 99.22724404931031, "dram__bytes.sum.per_second": 22524529335.323746, "time": 33.39999498639788, "times": [36.23164749145508, 33.163455963134766, 32.89683151245117, 32.73942565917969, 33.025726318359375, 32.990718841552734, 32.752159118652344], "nvml_power": 169.972, "nvml_energy": 5.67706394782802, "compile_time": 250.929948175326, "verification_time": 0, "benchmark_time": 1312.6940471120179, "edp": 189.61390739491603, "throughput_penalty": 1000000.0, "objective": 1000189.6139073949, "strategy_time": 0.5406220443546772, "framework_time": 85.852479794994, "timestamp": "2025-02-20 07:57:19.813861+00:00"},
"1,512,16,8,185": {"block_size_x": 1, "block_size_y": 512, "tile_size_x": 16, "tile_size_y": 8, "nvml_pwr_limit": 185, "sm__warps_active.avg.pct_of_peak_sustained_active": 94.82853814200072, "dram__bytes.sum.per_second": 14416779217.211693, "time": 19.45498956952776, "times": [18.597183227539062, 19.606464385986328, 19.72038459777832, 19.517183303833008, 19.5830078125, 19.599071502685547, 19.56163215637207], "nvml_power": 185.786, "nvml_energy": 3.6144646921642845, "compile_time": 252.49831192195415, "verification_time": 0, "benchmark_time": 1221.5507568325847, "edp": 70.31937288548252, "throughput_penalty": 1000000.0, "objective": 1000070.3193728855, "strategy_time": 0.47649117186665535, "framework_time": 55.22622796706855, "timestamp": "2025-02-20 07:57:21.343637+00:00"},
"4,128,4,16,190": {"block_size_x": 4, "block_size_y": 128, "tile_size_x": 4, "tile_size_y": 16, "nvml_pwr_limit": 190, "sm__warps_active.avg.pct_of_peak_sustained_active": 97.54576874824086, "dram__bytes.sum.per_second": 15786533559.978548, "time": 86.83685520717076, "times": [87.21842956542969, 86.21376037597656, 86.82994842529297, 87.07555389404297, 86.65033721923828, 86.91779327392578, 86.95216369628906], "nvml_power": 191.546, "nvml_energy": 16.63325226751273, "compile_time": 249.02712111361325, "verification_time": 0, "benchmark_time": 1780.9634590521455, "edp": 1444.3793187783476, "throughput_penalty": 1000000.0, "objective": 1001444.3793187784, "strategy_time": 0.4050710704177618, "framework_time": 58.28045681118965, "timestamp": "2025-02-20 07:57:23.432337+00:00"},
"128,8,8,8,205": {"block_size_x": 128, "block_size_y": 8, "tile_size_x": 8, "tile_size_y": 8, "nvml_pwr_limit": 205, "sm__warps_active.avg.pct_of_peak_sustained_active": 66.4964951874436, "dram__bytes.sum.per_second": 2314938013.248341, "time": 40.1549072265625, "times": [40.25302505493164, 40.12083053588867, 40.221214294433594, 40.139137268066406, 40.12694549560547, 40.110687255859375, 40.112510681152344], "nvml_power": 206.517, "nvml_energy": 8.292670975708008, "compile_time": 250.83030597306788, "verification_time": 0, "benchmark_time": 1358.8653509505093, "edp": 332.9914336899626, "throughput_penalty": 1000000.0, "objective": 1000332.99143369, "strategy_time": 0.7613732013851404, "framework_time": 73.42490996234119, "timestamp": "2025-02-20 07:57:25.116243+00:00"},
"1,128,4,4,135": {"block_size_x": 1, "block_size_y": 128, "tile_size_x": 4, "tile_size_y": 4, "nvml_pwr_limit": 135, "sm__warps_active.avg.pct_of_peak_sustained_active": 98.43583634072439, "dram__bytes.sum.per_second": 8708306039.324104, "time": 100.89275469098773, "times": [101.95763397216797, 100.41168212890625, 101.2991714477539, 100.94044494628906, 100.2933120727539, 100.47049713134766, 100.87654113769531], "nvml_power": 135.998, "nvml_energy": 13.721212852464948, "compile_time": 250.6956341676414, "verification_time": 0, "benchmark_time": 1887.885055039078, "edp": 1384.370962386574, "throughput_penalty": 1000000.0, "objective": 1001384.3709623866, "strategy_time": 0.6033917888998985, "framework_time": 54.141584085300565, "timestamp": "2025-02-20 07:57:27.309594+00:00"},
"4,16,16,4,250": {"block_size_x": 4, "block_size_y": 16, "tile_size_x": 16, "tile_size_y": 4, "nvml_pwr_limit": 250, "sm__warps_active.avg.pct_of_peak_sustained_active": 96.7911389994319, "dram__bytes.sum.per_second": 19256084541.884926, "time": 19.568575722830637, "times": [19.25107192993164, 19.409984588623047, 19.63315200805664, 19.650463104248047, 19.750303268432617, 19.65692710876465, 19.628128051757812], "nvml_power": 252.152, "nvml_energy": 4.934255505663191, "compile_time": 251.3235150836408, "verification_time": 0, "benchmark_time": 1222.712631803006, "edp": 96.55635249836412, "throughput_penalty": 1000000.0, "objective": 1000096.5563524984, "strategy_time": 0.3406810574233532, "framework_time": 52.58129700087011, "timestamp": "2025-02-20 07:57:28.836577+00:00"},
"8,16,16,4,165": {"block_size_x": 8, "block_size_y": 16, "tile_size_x": 16, "tile_size_y": 4, "nvml_pwr_limit": 165, "sm__warps_active.avg.pct_of_peak_sustained_active": 91.85633997595748, "dram__bytes.sum.per_second": 19282935801.44029, "time": 34.9889098576137, "times": [30.24220848083496, 37.9791374206543, 35.77046585083008, 35.240352630615234, 35.082462310791016, 35.43119812011719, 35.176544189453125], "nvml_power": 170.661, "nvml_energy": 5.971242345210212, "compile_time": 250.99582388065755, "verification_time": 0, "benchmark_time": 1374.633332947269, "edp": 208.92726015452592, "throughput_penalty": 1000000.0, "objective": 1000208.9272601545, "strategy_time": 0.5598710849881172, "framework_time": 54.20111306011677, "timestamp": "2025-02-20 07:57:30.516992+00:00"},
"128,8,16,4,175": {"block_size_x": 128, "block_size_y": 8, "tile_size_x": 16, "tile_size_y": 4, "nvml_pwr_limit": 175, "sm__warps_active.avg.pct_of_peak_sustained_active": 66.53040601304424, "dram__bytes.sum.per_second": 1284048726.5482924, "time": 44.348603929792134, "times": [46.470176696777344, 44.05321502685547, 43.972190856933594, 44.015777587890625, 44.013633728027344, 44.01465606689453, 43.900577545166016], "nvml_power": 178.946, "nvml_energy": 7.936005278820583, "compile_time": 253.33338999189436, "verification_time": 0, "benchmark_time": 1411.3397679757327, "edp": 351.95075489515364, "throughput_penalty": 1000000.0, "objective": 1000351.9507548951, "strategy_time": 0.8107628673315048, "framework_time": 49.1330660879612, "timestamp": "2025-02-20 07:57:32.231633+00:00"},
"1,32,32,2,250": {"block_size_x": 1, "block_size_y": 32, "tile_size_x": 32, "tile_size_y": 2, "nvml_pwr_limit": 250, "sm__warps_active.avg.pct_of_peak_sustained_active": 48.73406688141404, "dram__bytes.sum.per_second": 6862626507.570841, "time": 8.956443514142718, "times": [8.941247940063477, 8.961567878723145, 8.964384078979492, 8.953568458557129, 8.964384078979492, 8.956000328063965, 8.953951835632324], "nvml_power": 193.578, "nvml_energy": 1.7337704225807191, "compile_time": 244.55234198831022, "verification_time": 0, "benchmark_time": 1100.9443330112845, "edp": 15.52841685633556, "throughput_penalty": 1000000.0, "objective": 1000015.5284168563, "strategy_time": 61.456985073164105, "framework_time": 51.9235257524997, "timestamp": "2025-02-20 07:57:33.690535+00:00"},
"1,32,16,2,245": {"block_size_x": 1, "block_size_y": 32, "tile_size_x": 16, "tile_size_y": 2, "nvml_pwr_limit": 245, "sm__warps_active.avg.pct_of_peak_sustained_active": 49.249873228303656, "dram__bytes.sum.per_second": 7290691830.721117, "time": 17.7156982421875, "times": [17.6759033203125, 17.71824073791504, 17.732704162597656, 17.74006462097168, 17.733055114746094, 17.717632293701172, 17.69228744506836], "nvml_power": 200.988, "nvml_energy": 3.5606427583007814, "compile_time": 224.1411202121526, "verification_time": 0, "benchmark_time": 1176.5486770309508, "edp": 63.079272654286804, "throughput_penalty": 1000000.0, "objective": 1000063.0792726543, "strategy_time": 5.574136972427368, "framework_time": 47.74934286251664, "timestamp": "2025-02-20 07:57:35.144572+00:00"},
"1,64,32,2,250": {"block_size_x": 1, "block_size_y": 64, "tile_size_x": 32, "tile_size_y": 2, "nvml_pwr_limit": 250, "sm__warps_active.avg.pct_of_peak_sustained_active": 88.0593228486432, "dram__bytes.sum.per_second": 4956007593.534948, "time": 9.667890276227679, "times": [9.71497631072998, 9.73151969909668, 9.832672119140625, 9.62070369720459, 9.436736106872559, 9.720704078674316, 9.617919921875], "nvml_power": 208.276, "nvml_energy": 2.013589515171596, "compile_time": 238.08796191588044, "verification_time": 0, "benchmark_time": 1115.934232948348, "edp": 19.46716249404148, "throughput_penalty": 1000000.0, "objective": 1000019.4671624941, "strategy_time": 3.4358100965619087, "framework_time": 57.31442989781499, "timestamp": "2025-02-20 07:57:36.559369+00:00"},
"1,128,32,8,175": {"block_size_x": 1, "block_size_y": 128, "tile_size_x": 32, "tile_size_y": 8, "nvml_pwr_limit": 175, "sm__warps_active.avg.pct_of_peak_sustained_active": 93.01690598349562, "dram__bytes.sum.per_second": 6288332995.420476, "time": 10.587684631347656, "times": [10.047231674194336, 10.44591999053955, 10.049152374267578, 10.920384407043457, 10.850624084472656, 10.839263916015625, 10.96121597290039], "nvml_power": 177.848, "nvml_energy": 1.882998536315918, "compile_time": 239.8061458952725, "verification_time": 0, "benchmark_time": 1144.8560059070587, "edp": 19.93659466380218, "throughput_penalty": 1000000.0, "objective": 1000019.9365946638, "strategy_time": 37.14291984215379, "framework_time": 49.707939149811864, "timestamp": "2025-02-20 07:57:38.030907+00:00"},
"1,512,32,8,180": {"block_size_x": 1, "block_size_y": 512, "tile_size_x": 32, "tile_size_y": 8, "nvml_pwr_limit": 180, "sm__warps_active.avg.pct_of_peak_sustained_active": 91.56667877237513, "dram__bytes.sum.per_second": 9349614344.385456, "time": 9.997243336268834, "times": [9.550911903381348, 9.577728271484375, 9.670495986938477, 10.284159660339355, 10.268927574157715, 10.31430435180664, 10.314175605773926], "nvml_power": 184.02, "nvml_energy": 1.8396927187401908, "compile_time": 224.1770380642265, "verification_time": 0, "benchmark_time": 1149.8132161796093, "edp": 18.391855773207666, "throughput_penalty": 1000000.0, "objective": 1000018.3918557732, "strategy_time": 5.522496998310089, "framework_time": 47.66393173485994, "timestamp": "2025-02-20 07:57:39.458108+00:00"},
"1,64,32,8,175": {"block_size_x": 1, "block_size_y": 64, "tile_size_x": 32, "tile_size_y": 8, "nvml_pwr_limit": 175, "sm__warps_active.avg.pct_of_peak_sustained_active": 88.19533427439742, "dram__bytes.sum.per_second": 9359150006.072323, "time": 10.20184258052281, "times": [9.662272453308105, 9.880000114440918, 10.080960273742676, 10.380000114440918, 10.43273639678955, 10.397472381591797, 10.579456329345703], "nvml_power": 177.125, "nvml_energy": 1.8070013670751026, "compile_time": 241.07260815799236, "verification_time": 0, "benchmark_time": 1165.0320191401988, "edp": 18.43474348968971, "throughput_penalty": 1000000.0, "objective": 1000018.4347434897, "strategy_time": 3.351290011778474, "framework_time": 44.30972272530198, "timestamp": "2025-02-20 07:57:40.911896+00:00"},
"16,4,16,2,195": {"block_size_x": 16, "block_size_y": 4, "tile_size_x": 16, "tile_size_y": 2, "nvml_pwr_limit": 195, "sm__warps_active.avg.pct_of_peak_sustained_active": 98.9071026372262, "dram__bytes.sum.per_second": 28102113171.124683, "time": 59.229444231305806, "times": [62.307071685791016, 59.24883270263672, 57.673728942871094, 58.62371063232422, 58.2374382019043, 59.04800033569336, 59.46732711791992], "nvml_power": 197.561, "nvml_energy": 11.701428231781007, "compile_time": 243.1872240267694, "verification_time": 0, "benchmark_time": 1533.539290074259, "edp": 693.0690908809005, "throughput_penalty": 1000000.0, "objective": 1000693.0690908809, "strategy_time": 38.354133954271674, "framework_time": 45.832586009055376, "timestamp": "2025-02-20 07:57:42.772833+00:00"},
"4,16,16,2,195": {"block_size_x": 4, "block_size_y": 16, "tile_size_x": 16, "tile_size_y": 2, "nvml_pwr_limit": 195, "sm__warps_active.avg.pct_of_peak_sustained_active": 96.47660274604132, "dram__bytes.sum.per_second": 15440146715.571857, "time": 21.33098520551409, "times": [19.149280548095703, 20.49603271484375, 21.603647232055664, 21.6910400390625, 22.343488693237305, 21.99407958984375, 22.03932762145996], "nvml_power": 198.859, "nvml_energy": 4.241858386983326, "compile_time": 229.6278728172183, "verification_time": 0, "benchmark_time": 1242.9874220397323, "edp": 90.48301849662718, "throughput_penalty": 1000000.0, "objective": 1000090.4830184967, "strategy_time": 6.06184802018106, "framework_time": 0.5109710618853569, "timestamp": "2025-02-20 07:57:44.252045+00:00"},
"8,4,16,2,195": {"block_size_x": 8, "block_size_y": 4, "tile_size_x": 16, "tile_size_y": 2, "nvml_pwr_limit": 195, "sm__warps_active.avg.pct_of_peak_sustained_active": 49.83493623287761, "dram__bytes.sum.per_second": 22964546659.222538, "time": 32.461298261369976, "times": [33.16022491455078, 32.03878402709961, 32.0043830871582, 32.50796890258789, 32.37648010253906, 32.73871994018555, 32.40252685546875], "nvml_power": 198.054, "nvml_energy": 6.429089965857369, "compile_time": 236.5925631020218, "verification_time": 0, "benchmark_time": 1302.3600149899721, "edp": 208.69660693087695, "throughput_penalty": 1000000.0, "objective": 1000208.6966069309, "strategy_time": 3.858960932120681, "framework_time": 0.5473308265209198, "timestamp": "2025-02-20 07:57:45.795429+00:00"},
"4,8,8,4,200": {"block_size_x": 4, "block_size_y": 8, "tile_size_x": 8, "tile_size_y": 4, "nvml_pwr_limit": 200, "sm__warps_active.avg.pct_of_peak_sustained_active": 49.883275333900215, "dram__bytes.sum.per_second": 21368594353.15926, "time": 43.77201407296317, "times": [44.899200439453125, 43.82992172241211, 43.47100830078125, 43.50783920288086, 43.58086395263672, 43.61587142944336, 43.499393463134766], "nvml_power": 203.102, "nvml_energy": 8.890183602246966, "compile_time": 251.57757615670562, "verification_time": 0, "benchmark_time": 1390.1893608272076, "edp": 389.14124174878054, "throughput_penalty": 1000000.0, "objective": 1000389.1412417488, "strategy_time": 42.8473970387131, "framework_time": 41.619602823629975, "timestamp": "2025-02-20 07:57:47.521688+00:00"},
"2,16,16,4,195": {"block_size_x": 2, "block_size_y": 16, "tile_size_x": 16, "tile_size_y": 4, "nvml_pwr_limit": 195, "sm__warps_active.avg.pct_of_peak_sustained_active": 49.58734408072329, "dram__bytes.sum.per_second": 13610714521.434948, "time": 18.81590407235282, "times": [18.388639450073242, 18.73107147216797, 18.914592742919922, 18.940704345703125, 18.9300479888916, 18.894559860229492, 18.911712646484375], "nvml_power": 199.38, "nvml_energy": 3.751514953945705, "compile_time": 231.44244495779276, "verification_time": 0, "benchmark_time": 1216.6309519670904, "edp": 70.58814549943949, "throughput_penalty": 1000000.0, "objective": 1000070.5881454995, "strategy_time": 5.617695860564709, "framework_time": 70.16917923465371, "timestamp": "2025-02-20 07:57:49.045572+00:00"},
"1,32,32,8,195": {"block_size_x": 1, "block_size_y": 32, "tile_size_x": 32, "tile_size_y": 8, "nvml_pwr_limit": 195, "sm__warps_active.avg.pct_of_peak_sustained_active": 48.806878717126445, "dram__bytes.sum.per_second": 12081163859.111792, "time": 9.01596805027553, "times": [8.946687698364258, 8.97606372833252, 9.016511917114258, 8.996224403381348, 9.049504280090332, 9.06380844116211, 9.062975883483887], "nvml_power": 199.066, "nvml_energy": 1.794772695896149, "compile_time": 230.6451729964465, "verification_time": 0, "benchmark_time": 1116.684152977541, "edp": 16.18161328370656, "throughput_penalty": 1000000.0, "objective": 1000016.1816132837, "strategy_time": 3.3552299719303846, "framework_time": 0.5567909684032202, "timestamp": "2025-02-20 07:57:50.396839+00:00"},
"1,32,32,2,185": {"block_size_x": 1, "block_size_y": 32, "tile_size_x": 32, "tile_size_y": 2, "nvml_pwr_limit": 185, "sm__warps_active.avg.pct_of_peak_sustained_active": 48.74318208227827, "dram__bytes.sum.per_second": 6544656013.504814, "time": 8.983095032828194, "times": [8.945664405822754, 8.961600303649902, 8.959648132324219, 9.00108814239502, 9.007904052734375, 9.005087852478027, 9.000672340393066], "nvml_power": 189.173, "nvml_energy": 1.6993590366452078, "compile_time": 238.92584606073797, "verification_time": 0, "benchmark_time": 1113.0036099348217, "edp": 15.265503721079272, "throughput_penalty": 1000000.0, "objective": 1000015.2655037211, "strategy_time": 38.23320288211107, "framework_time": 41.26822226680815, "timestamp": "2025-02-20 07:57:51.828294+00:00"},
"1,32,32,4,190": {"block_size_x": 1, "block_size_y": 32, "tile_size_x": 32, "tile_size_y": 4, "nvml_pwr_limit": 190, "sm__warps_active.avg.pct_of_peak_sustained_active": 48.738010377831884, "dram__bytes.sum.per_second": 8767195615.779758, "time": 8.996269634791783, "times": [8.975423812866211, 8.974335670471191, 8.987232208251953, 8.980159759521484, 8.97372817993164, 9.013983726501465, 9.069024085998535], "nvml_power": 194.512, "nvml_energy": 1.7498823992026193, "compile_time": 233.03411900997162, "verification_time": 0, "benchmark_time": 1122.4730431567878, "edp": 15.742413892403118, "throughput_penalty": 1000000.0, "objective": 1000015.7424138924, "strategy_time": 5.569265922531486, "framework_time": 41.25822079367936, "timestamp": "2025-02-20 07:57:53.230653+00:00"},
"1,64,32,2,185": {"block_size_x": 1, "block_size_y": 64, "tile_size_x": 32, "tile_size_y": 2, "nvml_pwr_limit": 185, "sm__warps_active.avg.pct_of_peak_sustained_active": 88.53092692290002, "dram__bytes.sum.per_second": 4805388769.6779995, "time": 9.840996606009346, "times": [9.741951942443848, 9.8155517578125, 9.7772798538208, 9.900256156921387, 9.77945613861084, 9.964608192443848, 9.907872200012207], "nvml_power": 189.384, "nvml_energy": 1.863727301232474, "compile_time": 237.18809010460973, "verification_time": 0, "benchmark_time": 1141.7451368179172, "edp": 18.340934045955734, "throughput_penalty": 1000000.0, "objective": 1000018.340934046, "strategy_time": 3.4953709691762924, "framework_time": 48.08117123320699, "timestamp": "2025-02-20 07:57:54.661188+00:00"},
"2,16,32,4,230": {"block_size_x": 2, "block_size_y": 16, "tile_size_x": 32, "tile_size_y": 4, "nvml_pwr_limit": 230, "sm__warps_active.avg.pct_of_peak_sustained_active": 49.107186180512834, "dram__bytes.sum.per_second": 13041216794.310911, "time": 9.22001348223005, "times": [9.241727828979492, 9.245439529418945, 9.180383682250977, 9.207327842712402, 9.201024055480957, 9.229791641235352, 9.234399795532227], "nvml_power": 220.078, "nvml_energy": 2.029122127142225, "compile_time": 241.71608197502792, "verification_time": 0, "benchmark_time": 1101.7713169567287, "edp": 18.70853336934263, "throughput_penalty": 1000000.0, "objective": 1000018.7085333694, "strategy_time": 39.08247500658035, "framework_time": 46.058216132223606, "timestamp": "2025-02-20 07:57:56.089841+00:00"},
"1,256,32,8,185": {"block_size_x": 1, "block_size_y": 256, "tile_size_x": 32, "tile_size_y": 8, "nvml_pwr_limit": 185, "sm__warps_active.avg.pct_of_peak_sustained_active": 92.53383508055141, "dram__bytes.sum.per_second": 7779843275.394497, "time": 10.077457972935267, "times": [9.666943550109863, 9.962335586547852, 9.916735649108887, 10.113247871398926, 10.315391540527344, 10.5, 10.067551612854004], "nvml_power": 186.782, "nvml_energy": 1.882287755100795, "compile_time": 239.8284268565476, "verification_time": 0, "benchmark_time": 1169.120921054855, "edp": 18.968675744998933, "throughput_penalty": 1000000.0, "objective": 1000018.968675745, "strategy_time": 5.537285935133696, "framework_time": 45.47637328505516, "timestamp": "2025-02-20 07:57:57.549828+00:00"},
"2,16,32,4,225": {"block_size_x": 2, "block_size_y": 16, "tile_size_x": 32, "tile_size_y": 4, "nvml_pwr_limit": 225, "sm__warps_active.avg.pct_of_peak_sustained_active": 49.08892959183322, "dram__bytes.sum.per_second": 13713733601.682648, "time": 9.20058046068464, "times": [9.189984321594238, 9.219615936279297, 9.191231727600098, 9.204447746276855, 9.210687637329102, 9.183263778686523, 9.204832077026367], "nvml_power": 220.187, "nvml_energy": 2.0258482098967687, "compile_time": 233.47164690494537, "verification_time": 0, "benchmark_time": 1102.594322990626, "edp": 18.638979456289164, "throughput_penalty": 1000000.0, "objective": 1000018.6389794563, "strategy_time": 3.4243399277329445, "framework_time": 46.004645293578506, "timestamp": "2025-02-20 07:57:58.935348+00:00"},
"1,32,32,32,105": {"block_size_x": 1, "block_size_y": 32, "tile_size_x": 32, "tile_size_y": 32, "nvml_pwr_limit": 105, "sm__warps_active.avg.pct_of_peak_sustained_active": 48.70963034285911, "dram__bytes.sum.per_second": 26328476954.339508, "time": 19.223872184753418, "times": [8.915488243103027, 15.477472305297852, 25.67136001586914, 23.40892791748047, 20.82192039489746, 20.269439697265625, 20.00249671936035], "nvml_power": 108.226, "nvml_energy": 2.080522791067123, "compile_time": 242.83429398201406, "verification_time": 0, "benchmark_time": 1276.9346910063177, "edp": 39.995704212940815, "throughput_penalty": 1000000.0, "objective": 1000039.9957042129, "strategy_time": 42.725465958938, "framework_time": 48.898712964728475, "timestamp": "2025-02-20 07:58:00.546766+00:00"},
"1,32,16,4,250": {"block_size_x": 1, "block_size_y": 32, "tile_size_x": 16, "tile_size_y": 4, "nvml_pwr_limit": 250, "sm__warps_active.avg.pct_of_peak_sustained_active": 49.24046916617322, "dram__bytes.sum.per_second": 9715572822.251934, "time": 17.755904061453684, "times": [17.74358367919922, 17.766687393188477, 17.764480590820312, 17.778783798217773, 17.72528076171875, 17.77065658569336, 17.74185562133789], "nvml_power": 205.27, "nvml_energy": 3.644754426694598, "compile_time": 231.59662983380258, "verification_time": 0, "benchmark_time": 1183.4862628020346, "edp": 64.7159099279479, "throughput_penalty": 1000000.0, "objective": 1000064.715909928, "strategy_time": 5.626485915854573, "framework_time": 44.38236146233976, "timestamp": "2025-02-20 07:58:02.011881+00:00"},
"1,32,32,32,110": {"block_size_x": 1, "block_size_y": 32, "tile_size_x": 32, "tile_size_y": 32, "nvml_pwr_limit": 110, "sm__warps_active.avg.pct_of_peak_sustained_active": 48.73874306067429, "dram__bytes.sum.per_second": 26284739556.14044, "time": 17.649974959237234, "times": [8.918368339538574, 14.079456329345703, 20.224863052368164, 21.807968139648438, 19.8604793548584, 19.431968688964844, 19.226720809936523], "nvml_power": 113.197, "nvml_energy": 1.9979242154607773, "compile_time": 234.6855979412794, "verification_time": 0, "benchmark_time": 1245.629291050136, "edp": 35.26331237333641, "throughput_penalty": 1000000.0, "objective": 1000035.2633123733, "strategy_time": 3.5278210416436195, "framework_time": 47.010238049551845, "timestamp": "2025-02-20 07:58:03.542759+00:00"},
"8,4,16,2,240": {"block_size_x": 8, "block_size_y": 4, "tile_size_x": 16, "tile_size_y": 2, "nvml_pwr_limit": 240, "sm__warps_active.avg.pct_of_peak_sustained_active": 49.83657762072611, "dram__bytes.sum.per_second": 23745982233.4923, "time": 25.182482038225448, "times": [23.865888595581055, 24.687103271484375, 25.036832809448242, 25.677791595458984, 25.671039581298828, 25.674463272094727, 25.664255142211914], "nvml_power": 241.894, "nvml_energy": 6.091491310154507, "compile_time": 239.48110197670758, "verification_time": 0, "benchmark_time": 1264.5360920578241, "edp": 153.39887050397226, "throughput_penalty": 1000000.0, "objective": 1000153.398870504, "strategy_time": 44.55706011503935, "framework_time": 44.619892025366426, "timestamp": "2025-02-20 07:58:05.135978+00:00"},
"1,32,32,4,195": {"block_size_x": 1, "block_size_y": 32, "tile_size_x": 32, "tile_size_y": 4, "nvml_pwr_limit": 195, "sm__warps_active.avg.pct_of_peak_sustained_active": 48.73777590042036, "dram__bytes.sum.per_second": 8402837447.727931, "time": 8.959277697971888, "times": [8.951168060302734, 8.967488288879395, 8.959839820861816, 8.963871955871582, 8.950559616088867, 8.964320182800293, 8.957695960998535], "nvml_power": 199.628, "nvml_energy": 1.7885226882907321, "compile_time": 225.50571989268064, "verification_time": 0, "benchmark_time": 1109.2872149311006, "edp": 16.023871433519883, "throughput_penalty": 1000000.0, "objective": 1000016.0238714336, "strategy_time": 5.648456979542971, "framework_time": 53.99691732600331, "timestamp": "2025-02-20 07:58:06.530441+00:00"},
"8,4,16,2,245": {"block_size_x": 8, "block_size_y": 4, "tile_size_x": 16, "tile_size_y": 2, "nvml_pwr_limit": 245, "sm__warps_active.avg.pct_of_peak_sustained_active": 49.83618330578091, "dram__bytes.sum.per_second": 23125109304.92144, "time": 24.99744442531041, "times": [23.925983428955078, 24.347871780395508, 24.984256744384766, 25.418848037719727, 25.44259262084961, 25.447359085083008, 25.415199279785156], "nvml_power": 249.704, "nvml_energy": 6.2419618627777105, "compile_time": 233.7024030275643, "verification_time": 0, "benchmark_time": 1284.9052159581333, "edp": 156.03309476969287, "throughput_penalty": 1000000.0, "objective": 1000156.0330947697, "strategy_time": 3.5326399374753237, "framework_time": 47.692549880594015, "timestamp": "2025-02-20 07:58:08.100299+00:00"},
"1,256,32,4,180": {"block_size_x": 1, "block_size_y": 256, "tile_size_x": 32, "tile_size_y": 4, "nvml_pwr_limit": 180, "sm__warps_active.avg.pct_of_peak_sustained_active": 92.23121157309613, "dram__bytes.sum.per_second": 7346278571.054971, "time": 10.28893266405378, "times": [9.795167922973633, 9.767680168151855, 9.836959838867188, 10.547648429870605, 10.698047637939453, 10.673600196838379, 10.703424453735352], "nvml_power": 182.376, "nvml_energy": 1.8764543835394722, "compile_time": 228.68942702189088, "verification_time": 0, "benchmark_time": 1155.728513840586, "edp": 19.306712799406174, "throughput_penalty": 1000000.0, "objective": 1000019.3067127994, "strategy_time": 79.4033429119736, "framework_time": 46.89375730231404, "timestamp": "2025-02-20 07:58:09.611039+00:00"},
"1,128,32,4,180": {"block_size_x": 1, "block_size_y": 128, "tile_size_x": 32, "tile_size_y": 4, "nvml_pwr_limit": 180, "sm__warps_active.avg.pct_of_peak_sustained_active": 93.27108892020544, "dram__bytes.sum.per_second": 5507057504.0321665, "time": 10.41212340763637, "times": [9.911968231201172, 10.234687805175781, 10.238271713256836, 10.446432113647461, 10.458720207214355, 10.761343955993652, 10.833439826965332], "nvml_power": 184.205, "nvml_energy": 1.9179651923036576, "compile_time": 225.90160905383527, "verification_time": 0, "benchmark_time": 1154.4264371041209, "edp": 19.970090273816705, "throughput_penalty": 1000000.0, "objective": 1000019.9700902738, "strategy_time": 5.703636212274432, "framework_time": 0.5194526165723801, "timestamp": "2025-02-20 07:58:10.997614+00:00"},
"1,256,32,32,100": {"block_size_x": 1, "block_size_y": 256, "tile_size_x": 32, "tile_size_y": 32, "nvml_pwr_limit": 100, "sm__warps_active.avg.pct_of_peak_sustained_active": 92.28937837078125, "dram__bytes.sum.per_second": 8763141667.951286, "time": 18.33268560682024, "times": [11.817760467529297, 14.30083179473877, 20.488544464111328, 21.161439895629883, 20.354656219482422, 20.112703323364258, 20.092863082885742], "nvml_power": 102.97, "nvml_energy": 1.8877166369342802, "compile_time": 238.09324414469302, "verification_time": 0, "benchmark_time": 1309.0930050238967, "edp": 34.60691561968019, "throughput_penalty": 1000000.0, "objective": 1000034.6069156197, "strategy_time": 3.6430400796234608, "framework_time": 48.875652719289064, "timestamp": "2025-02-20 07:58:12.597344+00:00"},
"2,16,32,2,195": {"block_size_x": 2, "block_size_y": 16, "tile_size_x": 32, "tile_size_y": 2, "nvml_pwr_limit": 195, "sm__warps_active.avg.pct_of_peak_sustained_active": 49.08921218035716, "dram__bytes.sum.per_second": 8713187710.737398, "time": 9.286930220467704, "times": [9.199007987976074, 9.206175804138184, 9.199935913085938, 9.313440322875977, 9.341728210449219, 9.387871742248535, 9.3603515625], "nvml_power": 196.895, "nvml_energy": 1.8285501257589887, "compile_time": 243.0869280360639, "verification_time": 0, "benchmark_time": 1121.544195106253, "edp": 16.981617422551174, "throughput_penalty": 1000000.0, "objective": 1000016.9816174225, "strategy_time": 44.62820012122393, "framework_time": 52.724072709679604, "timestamp": "2025-02-20 07:58:14.059351+00:00"},
"2,16,32,2,190": {"block_size_x": 2, "block_size_y": 16, "tile_size_x": 32, "tile_size_y": 2, "nvml_pwr_limit": 190, "sm__warps_active.avg.pct_of_peak_sustained_active": 49.09785800650629, "dram__bytes.sum.per_second": 8404120896.343715, "time": 9.272932597569056, "times": [9.187744140625, 9.198592185974121, 9.185888290405273, 9.194304466247559, 9.295647621154785, 9.42630386352539, 9.42204761505127], "nvml_power": 196.983, "nvml_energy": 1.8266100818669455, "compile_time": 229.47645792737603, "verification_time": 0, "benchmark_time": 1134.6691199578345, "edp": 16.938032171192283, "throughput_penalty": 1000000.0, "objective": 1000016.9380321712, "strategy_time": 5.64774707891047, "framework_time": 46.19340319186449, "timestamp": "2025-02-20 07:58:15.475362+00:00"},
"1,32,32,32,145": {"block_size_x": 1, "block_size_y": 32, "tile_size_x": 32, "tile_size_y": 32, "nvml_pwr_limit": 145, "sm__warps_active.avg.pct_of_peak_sustained_active": 48.735628494996185, "dram__bytes.sum.per_second": 26003073752.224194, "time": 10.93189035143171, "times": [8.955007553100586, 9.823904037475586, 9.915552139282227, 12.146016120910645, 12.24124813079834, 11.82688045501709, 11.6146240234375], "nvml_power": 149.593, "nvml_energy": 1.6353342733417235, "compile_time": 238.84218512102962, "verification_time": 0, "benchmark_time": 1167.1453109011054, "edp": 17.877294964109975, "throughput_penalty": 1000000.0, "objective": 1000017.8772949642, "strategy_time": 3.414010163396597, "framework_time": 51.537528866901994, "timestamp": "2025-02-20 07:58:16.936326+00:00"},
"1,32,32,4,240": {"block_size_x": 1, "block_size_y": 32, "tile_size_x": 32, "tile_size_y": 4, "nvml_pwr_limit": 240, "sm__warps_active.avg.pct_of_peak_sustained_active": 48.735090637209396, "dram__bytes.sum.per_second": 9232225931.41368, "time": 8.990880012512207, "times": [9.000927925109863, 8.999967575073242, 8.980192184448242, 9.018912315368652, 8.980704307556152, 8.986047744750977, 8.96940803527832], "nvml_power": 200.766, "nvml_energy": 1.8050630165920256, "compile_time": 247.98485985957086, "verification_time": 0, "benchmark_time": 1104.4925660826266, "edp": 16.229104997202235, "throughput_penalty": 1000000.0, "objective": 1000016.2291049972, "strategy_time": 46.86556593514979, "framework_time": 47.51959815621376, "timestamp": "2025-02-20 07:58:18.383212+00:00"},
"2,16,32,4,235": {"block_size_x": 2, "block_size_y": 16, "tile_size_x": 32, "tile_size_y": 4, "nvml_pwr_limit": 235, "sm__warps_active.avg.pct_of_peak_sustained_active": 49.095976154127044, "dram__bytes.sum.per_second": 13979739548.304136, "time": 9.195995467049736, "times": [9.179391860961914, 9.23033618927002, 9.185600280761719, 9.206624031066895, 9.171039581298828, 9.187040328979492, 9.211935997009277], "nvml_power": 219.892, "nvml_energy": 2.0221258352405003, "compile_time": 239.5650849211961, "verification_time": 0, "benchmark_time": 1104.3438029009849, "edp": 18.5954600146758, "throughput_penalty": 1000000.0, "objective": 1000018.5954600147, "strategy_time": 5.779757164418697, "framework_time": 47.14557598344982, "timestamp": "2025-02-20 07:58:19.780071+00:00"},
"1,64,32,32,125": {"block_size_x": 1, "block_size_y": 64, "tile_size_x": 32, "tile_size_y": 32, "nvml_pwr_limit": 125, "sm__warps_active.avg.pct_of_peak_sustained_active": 88.37384167998763, "dram__bytes.sum.per_second": 22318987116.949677, "time": 15.63059207371303, "times": [10.51852798461914, 12.309120178222656, 17.688032150268555, 18.937023162841797, 16.767744064331055, 16.56537628173828, 16.628320693969727], "nvml_power": 128.748, "nvml_energy": 2.0124074683064053, "compile_time": 242.03480198048055, "verification_time": 0, "benchmark_time": 1225.33915983513, "edp": 31.455120223191006, "throughput_penalty": 1000000.0, "objective": 1000031.4551202232, "strategy_time": 3.6223698407411575, "framework_time": 46.262564370408654, "timestamp": "2025-02-20 07:58:21.297354+00:00"},
"16,64,32,32,150": {"block_size_x": 16, "block_size_y": 64, "tile_size_x": 32, "tile_size_y": 32, "nvml_pwr_limit": 150, "sm__warps_active.avg.pct_of_peak_sustained_active": 66.36082464324537, "dram__bytes.sum.per_second": 23526405609.2547, "time": 28.38724081856864, "times": [25.115007400512695, 27.258079528808594, 29.26767921447754, 29.26995277404785, 29.2653751373291, 29.267200469970703, 29.267391204833984], "nvml_power": 153.66, "nvml_energy": 4.361983424181257, "compile_time": 247.625496936962, "verification_time": 0, "benchmark_time": 1342.343415133655, "edp": 123.82467390883798, "throughput_penalty": 1000000.0, "objective": 1000123.8246739089, "strategy_time": 44.788999017328024, "framework_time": 51.6337298322469, "timestamp": "2025-02-20 07:58:22.983770+00:00"},
"2,16,16,2,190": {"block_size_x": 2, "block_size_y": 16, "tile_size_x": 16, "tile_size_y": 2, "nvml_pwr_limit": 190, "sm__warps_active.avg.pct_of_peak_sustained_active": 49.58409044346768, "dram__bytes.sum.per_second": 9552750017.471521, "time": 18.772566931588308, "times": [18.441631317138672, 18.480255126953125, 18.763744354248047, 18.9385929107666, 18.953567504882812, 18.9256649017334, 18.904512405395508], "nvml_power": 191.63, "nvml_energy": 3.5973870011002673, "compile_time": 237.1582060586661, "verification_time": 0, "benchmark_time": 1212.9663859959692, "edp": 67.5321882569805, "throughput_penalty": 1000000.0, "objective": 1000067.532188257, "strategy_time": 5.864177132025361, "framework_time": 44.34112785384059, "timestamp": "2025-02-20 07:58:24.484124+00:00"},
"32,32,32,32,150": {"block_size_x": 32, "block_size_y": 32, "tile_size_x": 32, "tile_size_y": 32, "nvml_pwr_limit": 150, "sm__warps_active.avg.pct_of_peak_sustained_active": 66.26628764185453, "dram__bytes.sum.per_second": 29039742177.9889, "time": 55.349910736083984, "times": [57.76095962524414, 55.52275085449219, 54.734718322753906, 54.95532989501953, 54.9535026550293, 54.62656021118164, 54.89555358886719], "nvml_power": 150.907, "nvml_energy": 8.352688979450226, "compile_time": 242.7103309892118, "verification_time": 0, "benchmark_time": 1541.780092054978, "edp": 462.3205894188425, "throughput_penalty": 1000000.0, "objective": 1000462.3205894189, "strategy_time": 3.7825710605829954, "framework_time": 41.74087103456259, "timestamp": "2025-02-20 07:58:26.314163+00:00"},
"4,256,32,32,150": {"block_size_x": 4, "block_size_y": 256, "tile_size_x": 32, "tile_size_y": 32, "nvml_pwr_limit": 150, "sm__warps_active.avg.pct_of_peak_sustained_active": 66.03251414975678, "dram__bytes.sum.per_second": 13596085892.90568, "time": 11.933609145028251, "times": [9.899871826171875, 11.018560409545898, 11.92636775970459, 12.877951622009277, 12.8787202835083, 12.537343978881836, 12.396448135375977], "nvml_power": 155.426, "nvml_energy": 1.8547931349751607, "compile_time": 239.31576102040708, "verification_time": 0, "benchmark_time": 1192.2961689997464, "edp": 22.134376317675198, "throughput_penalty": 1000000.0, "objective": 1000022.1343763177, "strategy_time": 52.35586082562804, "framework_time": 0.5990122444927692, "timestamp": "2025-02-20 07:58:27.798753+00:00"},
"4,128,32,32,150": {"block_size_x": 4, "block_size_y": 128, "tile_size_x": 32, "tile_size_y": 32, "nvml_pwr_limit": 150, "sm__warps_active.avg.pct_of_peak_sustained_active": 97.34227947878063, "dram__bytes.sum.per_second": 16419086516.593029, "time": 12.06200681413923, "times": [10.379743576049805, 10.607744216918945, 11.529151916503906, 12.000896453857422, 13.373408317565918, 13.31123161315918, 13.231871604919434], "nvml_power": 155.389, "nvml_energy": 1.8743031768422806, "compile_time": 230.91518599539995, "verification_time": 0, "benchmark_time": 1237.3663960024714, "edp": 22.607857690834393, "throughput_penalty": 1000000.0, "objective": 1000022.6078576909, "strategy_time": 6.086887093260884, "framework_time": 0.5316920578479767, "timestamp": "2025-02-20 07:58:29.273679+00:00"},
"4,256,32,32,145": {"block_size_x": 4, "block_size_y": 256, "tile_size_x": 32, "tile_size_y": 32, "nvml_pwr_limit": 145, "sm__warps_active.avg.pct_of_peak_sustained_active": 66.034218898909, "dram__bytes.sum.per_second": 13748290359.016516, "time": 11.989453860691615, "times": [10.23136043548584, 10.652352333068848, 11.745535850524902, 12.36451244354248, 13.024224281311035, 12.976863861083984, 12.931327819824219], "nvml_power": 150.346, "nvml_energy": 1.8025664301395417, "compile_time": 240.25890207849443, "verification_time": 0, "benchmark_time": 1254.4474119786173, "edp": 21.61178704498963, "throughput_penalty": 1000000.0, "objective": 1000021.611787045, "strategy_time": 3.9729808922857046, "framework_time": 42.846474098041654, "timestamp": "2025-02-20 07:58:30.815230+00:00"},
"2,16,32,4,195": {"block_size_x": 2, "block_size_y": 16, "tile_size_x": 32, "tile_size_y": 4, "nvml_pwr_limit": 195, "sm__warps_active.avg.pct_of_peak_sustained_active": 49.09978454722893, "dram__bytes.sum.per_second": 13337814565.857452, "time": 9.329366956438337, "times": [9.209504127502441, 9.212703704833984, 9.260448455810547, 9.381983757019043, 9.417216300964355, 9.428128242492676, 9.395584106445312], "nvml_power": 202.018, "nvml_energy": 1.88470005380576, "compile_time": 238.72804688289762, "verification_time": 0, "benchmark_time": 1131.5272450447083, "edp": 17.583058404773013, "throughput_penalty": 1000000.0, "objective": 1000017.5830584047, "strategy_time": 60.5444039683789, "framework_time": 40.84665700793266, "timestamp": "2025-02-20 07:58:32.286901+00:00"},
"1,32,32,4,180": {"block_size_x": 1, "block_size_y": 32, "tile_size_x": 32, "tile_size_y": 4, "nvml_pwr_limit": 180, "sm__warps_active.avg.pct_of_peak_sustained_active": 48.74152237209349, "dram__bytes.sum.per_second": 8813062118.292797, "time": 9.049088069370814, "times": [8.963456153869629, 8.969535827636719, 8.99465560913086, 8.986592292785645, 9.055520057678223, 9.188544273376465, 9.185312271118164], "nvml_power": 184.734, "nvml_energy": 1.671674235407148, "compile_time": 225.68192915059626, "verification_time": 0, "benchmark_time": 1135.7789728790522, "edp": 15.127127379497402, "throughput_penalty": 1000000.0, "objective": 1000015.1271273795, "strategy_time": 5.5882069282233715, "framework_time": 40.19884509034455, "timestamp": "2025-02-20 07:58:33.694173+00:00"},
"8,128,32,8,165": {"block_size_x": 8, "block_size_y": 128, "tile_size_x": 32, "tile_size_y": 8, "nvml_pwr_limit": 165, "sm__warps_active.avg.pct_of_peak_sustained_active": 66.27947362321206, "dram__bytes.sum.per_second": 11570613425.793045, "time": 14.292621748788017, "times": [11.101568222045898, 13.534560203552246, 14.571231842041016, 15.57481575012207, 15.250016212463379, 15.059391975402832, 14.956768035888672], "nvml_power": 168.949, "nvml_energy": 2.4147241518359865, "compile_time": 238.2889639120549, "verification_time": 0, "benchmark_time": 1221.5921068564057, "edp": 34.51273892985472, "throughput_penalty": 1000000.0, "objective": 1000034.5127389298, "strategy_time": 3.6534410901367664, "framework_time": 81.66598412208259, "timestamp": "2025-02-20 07:58:35.239398+00:00"},
"2,16,16,4,235": {"block_size_x": 2, "block_size_y": 16, "tile_size_x": 16, "tile_size_y": 4, "nvml_pwr_limit": 235, "sm__warps_active.avg.pct_of_peak_sustained_active": 49.583769483994644, "dram__bytes.sum.per_second": 14001055045.152798, "time": 18.295689174107142, "times": [18.310815811157227, 18.320735931396484, 18.319520950317383, 18.316991806030273, 18.3121280670166, 18.238271713256836, 18.251359939575195], "nvml_power": 221.976, "nvml_energy": 4.061203900111607, "compile_time": 242.01024509966373, "verification_time": 0, "benchmark_time": 1176.193372812122, "edp": 74.30252422911364, "throughput_penalty": 1000000.0, "objective": 1000074.3025242292, "strategy_time": 47.75726702064276, "framework_time": 42.27675101719797, "timestamp": "2025-02-20 07:58:36.747661+00:00"},
"8,128,32,32,150": {"block_size_x": 8, "block_size_y": 128, "tile_size_x": 32, "tile_size_y": 32, "nvml_pwr_limit": 150, "sm__warps_active.avg.pct_of_peak_sustained_active": 66.27813422137929, "dram__bytes.sum.per_second": 15004341137.486479, "time": 16.174989427839005, "times": [11.733407974243164, 13.168767929077148, 16.96790313720703, 18.360511779785156, 17.893247604370117, 17.620512008666992, 17.480575561523438], "nvml_power": 155.042, "nvml_energy": 2.507802710871015, "compile_time": 232.8862778376788, "verification_time": 0, "benchmark_time": 1266.9475690927356, "edp": 40.56368233544466, "throughput_penalty": 1000000.0, "objective": 1000040.5636823354, "strategy_time": 6.059956969693303, "framework_time": 41.464678943157196, "timestamp": "2025-02-20 07:58:38.295043+00:00"},
"1,256,32,4,185": {"block_size_x": 1, "block_size_y": 256, "tile_size_x": 32, "tile_size_y": 4, "nvml_pwr_limit": 185, "sm__warps_active.avg.pct_of_peak_sustained_active": 92.53651143382753, "dram__bytes.sum.per_second": 6808375990.017063, "time": 10.234514236450195, "times": [9.824607849121094, 10.01030445098877, 9.925727844238281, 10.345536231994629, 10.435232162475586, 10.457663536071777, 10.64252758026123], "nvml_power": 188.564, "nvml_energy": 1.9298609424819944, "compile_time": 235.24169414304197, "verification_time": 0, "benchmark_time": 1142.3248799983412, "edp": 19.751189290201165, "throughput_penalty": 1000000.0, "objective": 1000019.7511892902, "strategy_time": 3.8909511640667915, "framework_time": 44.86832860857248, "timestamp": "2025-02-20 07:58:39.721392+00:00"},
"1,64,32,32,150": {"block_size_x": 1, "block_size_y": 64, "tile_size_x": 32, "tile_size_y": 32, "nvml_pwr_limit": 150, "sm__warps_active.avg.pct_of_peak_sustained_active": 88.58641907316974, "dram__bytes.sum.per_second": 21186156082.880257, "time": 12.191693714686803, "times": [10.367424011230469, 11.17187213897705, 11.889984130859375, 13.193375587463379, 13.085663795471191, 13.15993595123291, 12.473600387573242], "nvml_power": 152.342, "nvml_energy": 1.857307003882817, "compile_time": 236.7988070473075, "verification_time": 0, "benchmark_time": 1182.3198911733925, "edp": 22.643718125481918, "throughput_penalty": 1000000.0, "objective": 1000022.6437181255, "strategy_time": 54.300486110150814, "framework_time": 43.212622636929154, "timestamp": "2025-02-20 07:58:41.238048+00:00"},
"4,8,32,4,235": {"block_size_x": 4, "block_size_y": 8, "tile_size_x": 32, "tile_size_y": 4, "nvml_pwr_limit": 235, "sm__warps_active.avg.pct_of_peak_sustained_active": 49.46079816051029, "dram__bytes.sum.per_second": 22147140147.09412, "time": 10.002838815961566, "times": [9.679936408996582, 9.7042875289917, 9.718815803527832, 10.223872184753418, 10.192511558532715, 10.266719818115234, 10.233728408813477], "nvml_power": 237.452, "nvml_energy": 2.3751940825277056, "compile_time": 227.51656011678278, "verification_time": 0, "benchmark_time": 1131.7407730966806, "edp": 23.758683564150353, "throughput_penalty": 1000000.0, "objective": 1000023.7586835641, "strategy_time": 5.6028650142252445, "framework_time": 41.14743880927563, "timestamp": "2025-02-20 07:58:42.644080+00:00"},
"1,64,32,32,145": {"block_size_x": 1, "block_size_y": 64, "tile_size_x": 32, "tile_size_y": 32, "nvml_pwr_limit": 145, "sm__warps_active.avg.pct_of_peak_sustained_active": 88.11000542556296, "dram__bytes.sum.per_second": 21822066180.765423, "time": 12.540447916303362, "times": [9.991583824157715, 11.280192375183105, 12.24841594696045, 14.091103553771973, 13.64140796661377, 13.464703559875488, 13.065728187561035], "nvml_power": 148.783, "nvml_energy": 1.8658054623313631, "compile_time": 240.55383796803653, "verification_time": 0, "benchmark_time": 1183.4692279808223, "edp": 23.398036222320776, "throughput_penalty": 1000000.0, "objective": 1000023.3980362223, "strategy_time": 3.5492409951984882, "framework_time": 53.48397116176784, "timestamp": "2025-02-20 07:58:44.125160+00:00"},
"1,32,32,8,170": {"block_size_x": 1, "block_size_y": 32, "tile_size_x": 32, "tile_size_y": 8, "nvml_pwr_limit": 170, "sm__warps_active.avg.pct_of_peak_sustained_active": 48.79752162022359, "dram__bytes.sum.per_second": 12357755347.255154, "time": 9.316160065787178, "times": [8.998527526855469, 8.958016395568848, 8.95680046081543, 9.40176010131836, 9.638527870178223, 9.624544143676758, 9.634943962097168], "nvml_power": 174.907, "nvml_energy": 1.629461608626638, "compile_time": 237.95995907858014, "verification_time": 0, "benchmark_time": 1148.534354986623, "edp": 15.180325167020822, "throughput_penalty": 1000000.0, "objective": 1000015.180325167, "strategy_time": 50.68713496439159, "framework_time": 45.65883008763194, "timestamp": "2025-02-20 07:58:45.608024+00:00"},
"1,64,32,4,185": {"block_size_x": 1, "block_size_y": 64, "tile_size_x": 32, "tile_size_y": 4, "nvml_pwr_limit": 185, "sm__warps_active.avg.pct_of_peak_sustained_active": 87.03972396264203, "dram__bytes.sum.per_second": 7323222977.593628, "time": 9.890582765851702, "times": [9.77184009552002, 9.635168075561523, 9.64799976348877, 9.997759819030762, 10.107775688171387, 10.108287811279297, 9.965248107910156], "nvml_power": 189.722, "nvml_energy": 1.8764611435029166, "compile_time": 236.4827641285956, "verification_time": 0, "benchmark_time": 1142.1727139968425, "edp": 18.559294246720324, "throughput_penalty": 1000000.0, "objective": 1000018.5592942467, "strategy_time": 5.701905814930797, "framework_time": 45.95433105714619, "timestamp": "2025-02-20 07:58:47.038359+00:00"},
"1,64,32,32,100": {"block_size_x": 1, "block_size_y": 64, "tile_size_x": 32, "tile_size_y": 32, "nvml_pwr_limit": 100, "sm__warps_active.avg.pct_of_peak_sustained_active": 88.43719509707306, "dram__bytes.sum.per_second": 19745293158.167587, "time": 23.447341646466935, "times": [11.78825569152832, 21.601760864257812, 30.3024959564209, 27.34332847595215, 24.667999267578125, 23.86137580871582, 24.56617546081543], "nvml_power": 101.943, "nvml_energy": 2.3902923494657786, "compile_time": 232.78034199029207, "verification_time": 0, "benchmark_time": 1312.8681969828904, "edp": 56.046001352860245, "throughput_penalty": 1000000.0, "objective": 1000056.0460013528, "strategy_time": 3.603701014071703, "framework_time": 50.668454030528665, "timestamp": "2025-02-20 07:58:48.638304+00:00"},
"1,32,32,4,235": {"block_size_x": 1, "block_size_y": 32, "tile_size_x": 32, "tile_size_y": 4, "nvml_pwr_limit": 235, "sm__warps_active.avg.pct_of_peak_sustained_active": 48.73819787646102, "dram__bytes.sum.per_second": 8528977479.827615, "time": 8.957983834402901, "times": [8.947903633117676, 8.964863777160645, 8.956319808959961, 8.962495803833008, 8.914752006530762, 8.957695960998535, 9.001855850219727], "nvml_power": 199.24200000000002, "nvml_energy": 1.7848066151341029, "compile_time": 239.422800950706, "verification_time": 0, "benchmark_time": 1122.4912209436297, "edp": 15.988268805906653, "throughput_penalty": 1000000.0, "objective": 1000015.9882688059, "strategy_time": 61.19377398863435, "framework_time": 41.05116706341505, "timestamp": "2025-02-20 07:58:50.102488+00:00"},
"1,512,32,8,185": {"block_size_x": 1, "block_size_y": 512, "tile_size_x": 32, "tile_size_y": 8, "nvml_pwr_limit": 185, "sm__warps_active.avg.pct_of_peak_sustained_active": 91.60612852766029, "dram__bytes.sum.per_second": 9905466326.185686, "time": 9.876013483319964, "times": [9.543071746826172, 9.611104011535645, 9.556127548217773, 10.08080005645752, 10.104031562805176, 10.094559669494629, 10.142399787902832], "nvml_power": 189.183, "nvml_energy": 1.8683738588149206, "compile_time": 231.49885912425816, "verification_time": 0, "benchmark_time": 1141.2347918376327, "edp": 18.452085421538705, "throughput_penalty": 1000000.0, "objective": 1000018.4520854215, "strategy_time": 5.581696052104235, "framework_time": 50.94175413250923, "timestamp": "2025-02-20 07:58:51.531770+00:00"},
"1,32,32,2,235": {"block_size_x": 1, "block_size_y": 32, "tile_size_x": 32, "tile_size_y": 2, "nvml_pwr_limit": 235, "sm__warps_active.avg.pct_of_peak_sustained_active": 48.74262685291927, "dram__bytes.sum.per_second": 6380334814.878434, "time": 8.948141642979213, "times": [8.947680473327637, 8.961919784545898, 8.949119567871094, 8.962271690368652, 8.90771198272705, 8.951040267944336, 8.957247734069824], "nvml_power": 193.899, "nvml_energy": 1.7350357164320265, "compile_time": 235.5079590342939, "verification_time": 0, "benchmark_time": 1101.7356971278787, "edp": 15.52534534626169, "throughput_penalty": 1000000.0, "objective": 1000015.5253453463, "strategy_time": 3.4479000605642796, "framework_time": 47.92612581513822, "timestamp": "2025-02-20 07:58:52.920412+00:00"},
"1,128,32,32,115": {"block_size_x": 1, "block_size_y": 128, "tile_size_x": 32, "tile_size_y": 32, "nvml_pwr_limit": 115, "sm__warps_active.avg.pct_of_peak_sustained_active": 93.36913481752869, "dram__bytes.sum.per_second": 11543064570.707848, "time": 16.09376471383231, "times": [10.957344055175781, 12.626272201538086, 18.150848388671875, 19.16806411743164, 17.502912521362305, 17.130016326904297, 17.120895385742188], "nvml_power": 118.544, "nvml_energy": 1.9078192442365371, "compile_time": 241.53907410800457, "verification_time": 0, "benchmark_time": 1271.1112338583916, "edp": 30.70399403326421, "throughput_penalty": 1000000.0, "objective": 1000030.7039940333, "strategy_time": 50.96737504936755, "framework_time": 47.57027607411146, "timestamp": "2025-02-20 07:58:54.531623+00:00"},
"2,16,32,2,200": {"block_size_x": 2, "block_size_y": 16, "tile_size_x": 32, "tile_size_y": 2, "nvml_pwr_limit": 200, "sm__warps_active.avg.pct_of_peak_sustained_active": 49.09723862272861, "dram__bytes.sum.per_second": 8427878428.568938, "time": 9.20323657989502, "times": [9.199520111083984, 9.195712089538574, 9.210528373718262, 9.209471702575684, 9.20143985748291, 9.187711715698242, 9.21827220916748], "nvml_power": 204.964, "nvml_energy": 1.8863321823616026, "compile_time": 237.62416397221386, "verification_time": 0, "benchmark_time": 1122.5897299591452, "edp": 17.360361342543502, "throughput_penalty": 1000000.0, "objective": 1000017.3603613426, "strategy_time": 5.801496095955372, "framework_time": 40.789205115288496, "timestamp": "2025-02-20 07:58:55.938451+00:00"},
"1,32,32,4,175": {"block_size_x": 1, "block_size_y": 32, "tile_size_x": 32, "tile_size_y": 4, "nvml_pwr_limit": 175, "sm__warps_active.avg.pct_of_peak_sustained_active": 48.73710924667599, "dram__bytes.sum.per_second": 8689011916.512882, "time": 9.065458297729492, "times": [8.948831558227539, 8.986495971679688, 8.991935729980469, 8.974528312683105, 9.079680442810059, 9.243743896484375, 9.232992172241211], "nvml_power": 180.374, "nvml_energy": 1.6351729749946593, "compile_time": 240.13833003118634, "verification_time": 0, "benchmark_time": 1142.5287129823118, "edp": 14.823592414388354, "throughput_penalty": 1000000.0, "objective": 1000014.8235924144, "strategy_time": 3.7148799747228622, "framework_time": 45.87077093310654, "timestamp": "2025-02-20 07:58:57.370728+00:00"},
"2,256,32,4,180": {"block_size_x": 2, "block_size_y": 256, "tile_size_x": 32, "tile_size_y": 4, "nvml_pwr_limit": 180, "sm__warps_active.avg.pct_of_peak_sustained_active": 92.46717023127744, "dram__bytes.sum.per_second": 11634135195.78221, "time": 9.806139537266322, "times": [9.358495712280273, 9.378656387329102, 9.360671997070312, 10.044511795043945, 10.167712211608887, 10.167072296142578, 10.16585636138916], "nvml_power": 183.039, "nvml_energy": 1.7949059747616902, "compile_time": 239.65314798988402, "verification_time": 0, "benchmark_time": 1144.7636971715838, "edp": 17.601098444786157, "throughput_penalty": 1000000.0, "objective": 1000017.6010984448, "strategy_time": 65.14546391554177, "framework_time": 42.24841995164752, "timestamp": "2025-02-20 07:58:58.862562+00:00"},
"1,256,32,8,180": {"block_size_x": 1, "block_size_y": 256, "tile_size_x": 32, "tile_size_y": 8, "nvml_pwr_limit": 180, "sm__warps_active.avg.pct_of_peak_sustained_active": 92.18212734534534, "dram__bytes.sum.per_second": 7612867008.707685, "time": 10.28221252986363, "times": [9.85859203338623, 9.964863777160645, 10.243776321411133, 10.55519962310791, 10.44803237915039, 10.492095947265625, 10.412927627563477], "nvml_power": 181.82, "nvml_energy": 1.869511882179805, "compile_time": 224.27094401791692, "verification_time": 0, "benchmark_time": 1147.8946132119745, "edp": 19.222718499678127, "throughput_penalty": 1000000.0, "objective": 1000019.2227184997, "strategy_time": 5.656686145812273, "framework_time": 0.5178204737603664, "timestamp": "2025-02-20 07:59:00.240927+00:00"},
"1,64,32,8,170": {"block_size_x": 1, "block_size_y": 64, "tile_size_x": 32, "tile_size_y": 8, "nvml_pwr_limit": 170, "sm__warps_active.avg.pct_of_peak_sustained_active": 87.89342440311319, "dram__bytes.sum.per_second": 8380582850.749985, "time": 10.303638866969518, "times": [9.71174430847168, 9.98140811920166, 9.871071815490723, 10.565919876098633, 10.562911987304688, 10.774144172668457, 10.658271789550781], "nvml_power": 173.176, "nvml_energy": 1.7843429644263131, "compile_time": 225.58253700844944, "verification_time": 0, "benchmark_time": 1164.5337869413197, "edp": 18.385225520266566, "throughput_penalty": 1000000.0, "objective": 1000018.3852255202, "strategy_time": 3.4149191342294216, "framework_time": 41.86159884557128, "timestamp": "2025-02-20 07:59:01.676344+00:00"},
