experiments/bayes_opt_float64.json
{
"device_name": "NVIDIA RTX 5000 Ada Generation",
"kernel_name": "tuned_matmul<double>",
"problem_size": [
4096,
4096
],
"tune_params_keys": [
"block_size_x",
"block_size_y",
"tile_size_x",
"tile_size_y",
"nvml_pwr_limit"
],
"tune_params": {
"block_size_x": [
1,
2,
4,
8,
16,
32,
64,
128,
256,
512,
1024
],
"block_size_y": [
1,
2,
4,
8,
16,
32,
64,
128,
256,
512,
1024
],
"tile_size_x": [
2,
4,
8,
16,
32
],
"tile_size_y": [
2,
4,
8,
16,
32
],
"nvml_pwr_limit": [
100,
105,
110,
115,
120,
125,
130,
135,
140,
145,
150,
155,
160,
165,
170,
175,
180,
185,
190,
195,
200,
205,
210,
215,
220,
225,
230,
235,
240,
245,
250
]
},
"objective": "objective",
"cache": {
"16,2,2,2,120": {"block_size_x": 16, "block_size_y": 2, "tile_size_x": 2, "tile_size_y": 2, "nvml_pwr_limit": 120, "sm__warps_active.avg.pct_of_peak_sustained_active": 49.948254817743695, "dram__bytes.sum.per_second": 712165919.6184273, "time": 259.0194832938058, "times": [252.42051696777344, 252.98973083496094, 266.5699768066406, 264.605224609375, 254.77609252929688, 257.3078308105469, 264.4670104980469], "nvml_power": 119.099, "nvml_energy": 30.848961440808978, "compile_time": 241.0690060351044, "verification_time": 0, "benchmark_time": 3127.7136381249875, "edp": 7990.482052548881, "throughput_penalty": 1000000.0, "objective": 1007990.4820525489, "strategy_time": 1345.732175046578, "framework_time": 0, "timestamp": "2025-02-20 07:59:40.069167+00:00"},
"32,16,8,4,105": {"block_size_x": 32, "block_size_y": 16, "tile_size_x": 8, "tile_size_y": 4, "nvml_pwr_limit": 105, "sm__warps_active.avg.pct_of_peak_sustained_active": 99.31519679686069, "dram__bytes.sum.per_second": 336650823.38472545, "time": 211.63617815290178, "times": [207.157958984375, 205.11439514160156, 211.08615112304688, 221.9371795654297, 220.9107208251953, 209.4256591796875, 205.82118225097656], "nvml_power": 105.18, "nvml_energy": 22.259893218122212, "compile_time": 234.36951590701938, "verification_time": 0, "benchmark_time": 2792.8254089783877, "edp": 4710.998726775082, "throughput_penalty": 1000000.0, "objective": 1004710.998726775, "strategy_time": 0.41260081343352795, "framework_time": 48.825146397575736, "timestamp": "2025-02-20 07:59:43.145625+00:00"},
"1,32,4,16,190": {"block_size_x": 1, "block_size_y": 32, "tile_size_x": 4, "tile_size_y": 16, "nvml_pwr_limit": 190, "sm__warps_active.avg.pct_of_peak_sustained_active": 49.837204049526775, "dram__bytes.sum.per_second": 142613907435.3515, "time": 120.49263763427734, "times": [116.6984634399414, 117.69789123535156, 117.608642578125, 117.98697662353516, 118.23043060302734, 124.4959716796875, 130.73008728027344], "nvml_power": 192.061, "nvml_energy": 23.14193647667694, "compile_time": 247.79862188734114, "verification_time": 0, "benchmark_time": 2089.7399550303817, "edp": 2788.4329660396993, "throughput_penalty": 1000000.0, "objective": 1002788.4329660397, "strategy_time": 0.48397108912467957, "framework_time": 56.59539485350251, "timestamp": "2025-02-20 07:59:45.540268+00:00"},
"8,64,2,32,240": {"block_size_x": 8, "block_size_y": 64, "tile_size_x": 2, "tile_size_y": 32, "nvml_pwr_limit": 240, "sm__warps_active.avg.pct_of_peak_sustained_active": 99.30435009682546, "dram__bytes.sum.per_second": 960905362.1982068, "time": 138.04724993024553, "times": [138.025146484375, 138.05657958984375, 138.03701782226562, 138.0496063232422, 138.07212829589844, 138.0577850341797, 138.03248596191406], "nvml_power": 209.408, "nvml_energy": 28.908198513392854, "compile_time": 245.9335548337549, "verification_time": 0, "benchmark_time": 2234.526713145897, "edp": 3990.6973052114954, "throughput_penalty": 1000000.0, "objective": 1003990.6973052114, "strategy_time": 0.13350998051464558, "framework_time": 54.814502131193876, "timestamp": "2025-02-20 07:59:48.075701+00:00"},
"4,256,16,2,145": {"block_size_x": 4, "block_size_y": 256, "tile_size_x": 16, "tile_size_y": 2, "nvml_pwr_limit": 145, "sm__warps_active.avg.pct_of_peak_sustained_active": 65.97384757026997, "dram__bytes.sum.per_second": 16582212936.269024, "time": 50.298300061907085, "times": [53.56675338745117, 49.656864166259766, 49.60006332397461, 49.86921691894531, 49.76310348510742, 49.873313903808594, 49.758785247802734], "nvml_power": 146.1, "nvml_energy": 7.3485816390446255, "compile_time": 243.7058489304036, "verification_time": 0, "benchmark_time": 1470.7416710443795, "edp": 369.6211643100876, "throughput_penalty": 1000000.0, "objective": 1000369.6211643101, "strategy_time": 0.6083319894969463, "framework_time": 54.10145712085068, "timestamp": "2025-02-20 07:59:49.844881+00:00"},
"1,512,8,8,105": {"block_size_x": 1, "block_size_y": 512, "tile_size_x": 8, "tile_size_y": 8, "nvml_pwr_limit": 105, "sm__warps_active.avg.pct_of_peak_sustained_active": 96.66904613546492, "dram__bytes.sum.per_second": 8113588686.262835, "time": 116.62074497767857, "times": [114.79296112060547, 115.29302215576172, 115.18748474121094, 115.01318359375, 115.28179168701172, 115.28336334228516, 125.493408203125], "nvml_power": 104.855, "nvml_energy": 12.228268214634488, "compile_time": 245.64843298867345, "verification_time": 0, "benchmark_time": 2006.2459239270538, "edp": 1426.0697489775414, "throughput_penalty": 1000000.0, "objective": 1001426.0697489775, "strategy_time": 0.4179112147539854, "framework_time": 54.35593891888857, "timestamp": "2025-02-20 07:59:52.151573+00:00"},
"1,256,32,8,125": {"block_size_x": 1, "block_size_y": 256, "tile_size_x": 32, "tile_size_y": 8, "nvml_pwr_limit": 125, "sm__warps_active.avg.pct_of_peak_sustained_active": 93.94144408746374, "dram__bytes.sum.per_second": 6726378963.873445, "time": 18.569974899291992, "times": [15.35478401184082, 16.559904098510742, 17.43459129333496, 18.651519775390625, 19.734304428100586, 21.304672241210938, 20.950048446655273], "nvml_power": 127.768, "nvml_energy": 2.372648552932739, "compile_time": 251.61204813048244, "verification_time": 0, "benchmark_time": 1350.3493128810078, "edp": 44.060024072802435, "throughput_penalty": 1000000.0, "objective": 1000044.0600240728, "strategy_time": 0.24713086895644665, "framework_time": 53.67728695273399, "timestamp": "2025-02-20 07:59:53.807483+00:00"},
"16,16,2,4,195": {"block_size_x": 16, "block_size_y": 16, "tile_size_x": 2, "tile_size_y": 4, "nvml_pwr_limit": 195, "sm__warps_active.avg.pct_of_peak_sustained_active": 99.38441295999726, "dram__bytes.sum.per_second": 347267624.77343905, "time": 139.95321655273438, "times": [139.53135681152344, 138.75811767578125, 138.98675537109375, 138.98793029785156, 139.04393005371094, 141.97283935546875, 142.39158630371094], "nvml_power": 195.824, "nvml_energy": 27.40619867822266, "compile_time": 249.16169117204845, "verification_time": 0, "benchmark_time": 2281.502282945439, "edp": 3835.585658500558, "throughput_penalty": 1000000.0, "objective": 1003835.5856585006, "strategy_time": 0.49880100414156914, "framework_time": 52.740493789315224, "timestamp": "2025-02-20 07:59:56.391412+00:00"},
"64,16,16,16,125": {"block_size_x": 64, "block_size_y": 16, "tile_size_x": 16, "tile_size_y": 16, "nvml_pwr_limit": 125, "sm__warps_active.avg.pct_of_peak_sustained_active": 65.9876081921411, "dram__bytes.sum.per_second": 1279569205.666696, "time": 174.4692622593471, "times": [170.82456970214844, 167.82943725585938, 167.82675170898438, 171.29104614257812, 183.3551025390625, 183.21209716796875, 176.94583129882812], "nvml_power": 124.568, "nvml_energy": 21.733287061122347, "compile_time": 249.1931098047644, "verification_time": 0, "benchmark_time": 2481.7249688785523, "edp": 3791.7905600246295, "throughput_penalty": 1000000.0, "objective": 1003791.7905600247, "strategy_time": 0.840791966766119, "framework_time": 56.971436366438866, "timestamp": "2025-02-20 07:59:59.180167+00:00"},
"4,16,8,16,100": {"block_size_x": 4, "block_size_y": 16, "tile_size_x": 8, "tile_size_y": 16, "nvml_pwr_limit": 100, "sm__warps_active.avg.pct_of_peak_sustained_active": 95.89253854314326, "dram__bytes.sum.per_second": 47591406252.463135, "time": 366.9363316127232, "times": [318.8219299316406, 404.141357421875, 381.31195068359375, 353.5981750488281, 415.1042175292969, 349.2798156738281, 346.296875], "nvml_power": 100.4505, "nvml_energy": 36.85893797866385, "compile_time": 247.94966587796807, "verification_time": 0, "benchmark_time": 4031.7500228993595, "edp": 13524.883489031798, "throughput_penalty": 1000000.0, "objective": 1013524.8834890318, "strategy_time": 0.7110119331628084, "framework_time": 58.79115127027035, "timestamp": "2025-02-20 08:00:03.519393+00:00"},
"1,64,8,8,155": {"block_size_x": 1, "block_size_y": 64, "tile_size_x": 8, "tile_size_y": 8, "nvml_pwr_limit": 155, "sm__warps_active.avg.pct_of_peak_sustained_active": 95.15022405211927, "dram__bytes.sum.per_second": 51234726481.702484, "time": 82.0673599243164, "times": [80.0159683227539, 82.1839370727539, 81.1362533569336, 83.11750030517578, 82.73782348632812, 82.51805114746094, 82.7619857788086], "nvml_power": 157.7, "nvml_energy": 12.942022660064696, "compile_time": 249.6645578648895, "verification_time": 0, "benchmark_time": 1796.0683088749647, "edp": 1062.1176317921881, "throughput_penalty": 1000000.0, "objective": 1001062.1176317922, "strategy_time": 0.3267810679972172, "framework_time": 55.17699127085507, "timestamp": "2025-02-20 08:00:05.620654+00:00"},
"4,256,2,2,105": {"block_size_x": 4, "block_size_y": 256, "tile_size_x": 2, "tile_size_y": 2, "nvml_pwr_limit": 105, "sm__warps_active.avg.pct_of_peak_sustained_active": 66.01123182689679, "dram__bytes.sum.per_second": 4086328877.6460786, "time": 305.0079781668527, "times": [297.3769226074219, 304.680908203125, 313.58123779296875, 301.35955810546875, 302.42181396484375, 313.4659423828125, 302.1694641113281], "nvml_power": 105.197, "nvml_energy": 32.0859242792184, "compile_time": 251.24394288286567, "verification_time": 0, "benchmark_time": 3680.8645131532103, "edp": 9786.462892019135, "throughput_penalty": 1000000.0, "objective": 1009786.4628920192, "strategy_time": 0.3857009578496218, "framework_time": 61.34833605028689, "timestamp": "2025-02-20 08:00:09.614521+00:00"},
"4,32,32,8,245": {"block_size_x": 4, "block_size_y": 32, "tile_size_x": 32, "tile_size_y": 8, "nvml_pwr_limit": 245, "sm__warps_active.avg.pct_of_peak_sustained_active": 97.79364424182252, "dram__bytes.sum.per_second": 14200475976.026756, "time": 17.945997510637557, "times": [17.93414306640625, 17.950719833374023, 17.94428825378418, 17.949888229370117, 17.9136962890625, 17.957887649536133, 17.971359252929688], "nvml_power": 245.769, "nvml_energy": 4.410569862191882, "compile_time": 250.68529997952282, "verification_time": 0, "benchmark_time": 1181.0692090075463, "edp": 79.15207576738855, "throughput_penalty": 1000000.0, "objective": 1000079.1520757674, "strategy_time": 0.5319821648299694, "framework_time": 56.55901087448001, "timestamp": "2025-02-20 08:00:11.103390+00:00"},
"8,32,4,8,230": {"block_size_x": 8, "block_size_y": 32, "tile_size_x": 4, "tile_size_y": 8, "nvml_pwr_limit": 230, "sm__warps_active.avg.pct_of_peak_sustained_active": 99.58344066048164, "dram__bytes.sum.per_second": 26676122119.126823, "time": 139.44891139439173, "times": [139.49209594726562, 138.43072509765625, 138.42860412597656, 138.43064880371094, 138.78236389160156, 140.8341064453125, 141.74383544921875], "nvml_power": 230.66, "nvml_energy": 32.165285902230394, "compile_time": 252.97908391803503, "verification_time": 0, "benchmark_time": 2268.3377149514854, "edp": 4485.414103755404, "throughput_penalty": 1000000.0, "objective": 1004485.4141037554, "strategy_time": 0.6018220447003841, "framework_time": 54.45348797366023, "timestamp": "2025-02-20 08:00:13.679787+00:00"},
"16,32,4,16,230": {"block_size_x": 16, "block_size_y": 32, "tile_size_x": 4, "tile_size_y": 16, "nvml_pwr_limit": 230, "sm__warps_active.avg.pct_of_peak_sustained_active": 99.3095139129228, "dram__bytes.sum.per_second": 849502878.9959596, "time": 137.99601091657365, "times": [137.96893310546875, 138.01068115234375, 138.008544921875, 138.00119018554688, 137.99398803710938, 137.98976135253906, 137.9989776611328], "nvml_power": 197.724, "nvml_energy": 27.28512326246861, "compile_time": 251.56948994845152, "verification_time": 0, "benchmark_time": 2238.432895857841, "edp": 3765.238167587676, "throughput_penalty": 1000000.0, "objective": 1003765.2381675877, "strategy_time": 0.7285322062671185, "framework_time": 0.5594610702246428, "timestamp": "2025-02-20 08:00:16.171103+00:00"},
"4,256,32,4,215": {"block_size_x": 4, "block_size_y": 256, "tile_size_x": 32, "tile_size_y": 4, "nvml_pwr_limit": 215, "sm__warps_active.avg.pct_of_peak_sustained_active": 65.96132603354305, "dram__bytes.sum.per_second": 10301030089.455137, "time": 18.495337350027903, "times": [18.04742431640625, 18.356416702270508, 18.623552322387695, 18.609088897705078, 18.603967666625977, 18.60550308227539, 18.621408462524414], "nvml_power": 220.164, "nvml_energy": 4.072007452331543, "compile_time": 252.25277105346322, "verification_time": 0, "benchmark_time": 1212.349251145497, "edp": 75.31315152269956, "throughput_penalty": 1000000.0, "objective": 1000075.3131515227, "strategy_time": 0.6853509694337845, "framework_time": 55.30959973111749, "timestamp": "2025-02-20 08:00:17.691725+00:00"},
"64,16,8,8,170": {"block_size_x": 64, "block_size_y": 16, "tile_size_x": 8, "tile_size_y": 8, "nvml_pwr_limit": 170, "sm__warps_active.avg.pct_of_peak_sustained_active": 65.98442540981372, "dram__bytes.sum.per_second": 647367085.359808, "time": 149.2531258719308, "times": [148.70675659179688, 147.59523010253906, 147.9436798095703, 148.0063934326172, 148.67184448242188, 151.92025756835938, 151.92771911621094], "nvml_power": 169.77, "nvml_energy": 25.338703179277694, "compile_time": 250.51392591558397, "verification_time": 0, "benchmark_time": 2270.7400978542864, "edp": 3781.8806550482263, "throughput_penalty": 1000000.0, "objective": 1003781.8806550482, "strategy_time": 0.872442964464426, "framework_time": 49.55928330309689, "timestamp": "2025-02-20 08:00:20.263435+00:00"},
"1,512,16,4,105": {"block_size_x": 1, "block_size_y": 512, "tile_size_x": 16, "tile_size_y": 4, "nvml_pwr_limit": 105, "sm__warps_active.avg.pct_of_peak_sustained_active": 96.00404399080806, "dram__bytes.sum.per_second": 12785384713.50467, "time": 60.92345210484096, "times": [56.785118103027344, 60.98806381225586, 61.67766571044922, 61.76009750366211, 61.85142517089844, 61.716129302978516, 61.685665130615234], "nvml_power": 105.116, "nvml_energy": 6.4040295914524625, "compile_time": 246.03438191115856, "verification_time": 0, "benchmark_time": 1567.1185569372028, "edp": 390.15559009283834, "throughput_penalty": 1000000.0, "objective": 1000390.1555900929, "strategy_time": 0.6818820256739855, "framework_time": 55.72889209724963, "timestamp": "2025-02-20 08:00:22.133022+00:00"},
"1,128,8,32,110": {"block_size_x": 1, "block_size_y": 128, "tile_size_x": 8, "tile_size_y": 32, "nvml_pwr_limit": 110, "sm__warps_active.avg.pct_of_peak_sustained_active": 98.04293553845183, "dram__bytes.sum.per_second": 17604899034.921127, "time": 147.5705086844308, "times": [141.4372100830078, 142.5404510498047, 143.40325927734375, 141.6510772705078, 153.99874877929688, 157.7154541015625, 152.2473602294922], "nvml_power": 107.896, "nvml_energy": 15.922267605015344, "compile_time": 250.88158482685685, "verification_time": 0, "benchmark_time": 2221.6542521491647, "edp": 2349.657129881748, "throughput_penalty": 1000000.0, "objective": 1002349.6571298818, "strategy_time": 0.23294100537896156, "framework_time": 56.71179108321667, "timestamp": "2025-02-20 08:00:24.662527+00:00"},
"16,32,32,4,160": {"block_size_x": 16, "block_size_y": 32, "tile_size_x": 32, "tile_size_y": 4, "nvml_pwr_limit": 160, "sm__warps_active.avg.pct_of_peak_sustained_active": 99.16882745018063, "dram__bytes.sum.per_second": 30649505995.38461, "time": 77.0753152029855, "times": [77.83164978027344, 76.7320327758789, 77.08566284179688, 77.03763580322266, 76.90364837646484, 76.96649932861328, 76.97007751464844], "nvml_power": 162.782, "nvml_energy": 12.546473959372385, "compile_time": 252.65786820091307, "verification_time": 0, "benchmark_time": 1660.9004291240126, "edp": 967.023435104676, "throughput_penalty": 1000000.0, "objective": 1000967.0234351046, "strategy_time": 0.502750976011157, "framework_time": 55.45741971582174, "timestamp": "2025-02-20 08:00:26.632071+00:00"},
"1,1024,32,32,110": {"block_size_x": 1, "block_size_y": 1024, "tile_size_x": 32, "tile_size_y": 32, "nvml_pwr_limit": 110, "sm__warps_active.avg.pct_of_peak_sustained_active": 65.9151043068768, "dram__bytes.sum.per_second": 18748414376.321354, "time": 28.006825310843332, "times": [23.038848876953125, 25.61177635192871, 28.126976013183594, 28.947168350219727, 30.7260799407959, 28.816160202026367, 30.7807674407959], "nvml_power": 111.098, "nvml_energy": 3.1115022783840725, "compile_time": 239.56334311515093, "verification_time": 0, "benchmark_time": 1341.8573387898505, "edp": 87.14330076499374, "throughput_penalty": 1000000.0, "objective": 1000087.143300765, "strategy_time": 65.64486701972783, "framework_time": 47.20233520492911, "timestamp": "2025-02-20 08:00:28.326363+00:00"},
"1,1024,32,8,110": {"block_size_x": 1, "block_size_y": 1024, "tile_size_x": 32, "tile_size_y": 8, "nvml_pwr_limit": 110, "sm__warps_active.avg.pct_of_peak_sustained_active": 65.89964843302101, "dram__bytes.sum.per_second": 18051486297.79789, "time": 28.494811466762, "times": [22.175647735595703, 30.10041618347168, 28.841279983520508, 30.423551559448242, 29.10198402404785, 29.71321678161621, 29.10758399963379], "nvml_power": 110.864, "nvml_energy": 3.1590487784511025, "compile_time": 228.59963309019804, "verification_time": 0, "benchmark_time": 1349.564045900479, "edp": 90.01649935626897, "throughput_penalty": 1000000.0, "objective": 1000090.0164993563, "strategy_time": 5.967485951259732, "framework_time": 0.5190910305827856, "timestamp": "2025-02-20 08:00:29.911037+00:00"},
"1,1024,32,32,115": {"block_size_x": 1, "block_size_y": 1024, "tile_size_x": 32, "tile_size_y": 32, "nvml_pwr_limit": 115, "sm__warps_active.avg.pct_of_peak_sustained_active": 65.89064615831924, "dram__bytes.sum.per_second": 17974522931.868904, "time": 24.932425362723215, "times": [17.975263595581055, 23.76348876953125, 26.721471786499023, 25.752832412719727, 27.00707244873047, 27.409631729125977, 25.897216796875], "nvml_power": 115.088, "nvml_energy": 2.869422970145089, "compile_time": 239.6316220983863, "verification_time": 0, "benchmark_time": 1375.600763130933, "edp": 71.54167403722599, "throughput_penalty": 1000000.0, "objective": 1000071.5416740372, "strategy_time": 3.8059300277382135, "framework_time": 58.540175668895245, "timestamp": "2025-02-20 08:00:31.588641+00:00"},
"512,2,32,2,120": {"block_size_x": 512, "block_size_y": 2, "tile_size_x": 32, "tile_size_y": 2, "nvml_pwr_limit": 120, "sm__warps_active.avg.pct_of_peak_sustained_active": 65.9759372429572, "dram__bytes.sum.per_second": 641580214.1760645, "time": 314.7396240234375, "times": [307.1780700683594, 322.533447265625, 317.8179626464844, 310.39990234375, 315.2377014160156, 319.0399475097656, 310.9703369140625], "nvml_power": 120.322, "nvml_energy": 37.87010104174805, "compile_time": 253.0848269816488, "verification_time": 0, "benchmark_time": 3789.631478022784, "edp": 11919.22136360937, "throughput_penalty": 1000000.0, "objective": 1011919.2213636094, "strategy_time": 50.70381495170295, "framework_time": 49.36859314329922, "timestamp": "2025-02-20 08:00:35.731455+00:00"},
"1,512,32,4,110": {"block_size_x": 1, "block_size_y": 512, "tile_size_x": 32, "tile_size_y": 4, "nvml_pwr_limit": 110, "sm__warps_active.avg.pct_of_peak_sustained_active": 92.65303573550335, "dram__bytes.sum.per_second": 10333035503.888147, "time": 23.68080493382045, "times": [14.735584259033203, 19.191328048706055, 23.172639846801758, 27.697856903076172, 26.815168380737305, 25.924928665161133, 28.22812843322754], "nvml_power": 112.13, "nvml_energy": 2.655328657229287, "compile_time": 235.32916884869337, "verification_time": 0, "benchmark_time": 1406.8269438575953, "edp": 62.88031996703013, "throughput_penalty": 1000000.0, "objective": 1000062.880319967, "strategy_time": 5.8972458355128765, "framework_time": 42.066892609000206, "timestamp": "2025-02-20 08:00:37.421599+00:00"},
"512,2,32,2,115": {"block_size_x": 512, "block_size_y": 2, "tile_size_x": 32, "tile_size_y": 2, "nvml_pwr_limit": 115, "sm__warps_active.avg.pct_of_peak_sustained_active": 65.97495791139612, "dram__bytes.sum.per_second": 621727620.845287, "time": 336.8977617536272, "times": [322.4978942871094, 348.440185546875, 350.44866943359375, 322.41497802734375, 347.3747863769531, 345.31976318359375, 321.7880554199219], "nvml_power": 114.9615, "nvml_energy": 38.73027203783962, "compile_time": 236.8760018143803, "verification_time": 0, "benchmark_time": 3712.5598008278757, "edp": 13048.141961657262, "throughput_penalty": 1000000.0, "objective": 1013048.1419616572, "strategy_time": 3.789729904383421, "framework_time": 45.78824248164892, "timestamp": "2025-02-20 08:00:41.420637+00:00"},
"1,1024,32,32,250": {"block_size_x": 1, "block_size_y": 1024, "tile_size_x": 32, "tile_size_y": 32, "nvml_pwr_limit": 250, "sm__warps_active.avg.pct_of_peak_sustained_active": 65.89331407291816, "dram__bytes.sum.per_second": 19132162434.089954, "time": 15.35111767905099, "times": [15.35638427734375, 15.376192092895508, 15.362239837646484, 15.316864013671875, 15.378111839294434, 15.30953598022461, 15.358495712280273], "nvml_power": 241.131, "nvml_energy": 3.7016303570672444, "compile_time": 239.027617033571, "verification_time": 0, "benchmark_time": 1162.2657221741974, "edp": 56.8241632156868, "throughput_penalty": 1000000.0, "objective": 1000056.8241632157, "strategy_time": 45.44482100754976, "framework_time": 42.49748168513179, "timestamp": "2025-02-20 08:00:42.909895+00:00"},
"4,64,32,16,250": {"block_size_x": 4, "block_size_y": 64, "tile_size_x": 32, "tile_size_y": 16, "nvml_pwr_limit": 250, "sm__warps_active.avg.pct_of_peak_sustained_active": 97.58211224054652, "dram__bytes.sum.per_second": 13336142770.258356, "time": 17.755501338413783, "times": [17.7653751373291, 17.80575942993164, 17.75939178466797, 17.77347183227539, 17.74390411376953, 17.708831787109375, 17.731775283813477], "nvml_power": 251.798, "nvml_energy": 4.470799726009914, "compile_time": 238.42848394997418, "verification_time": 0, "benchmark_time": 1181.0465489979833, "edp": 79.381290518949, "throughput_penalty": 1000000.0, "objective": 1000079.3812905189, "strategy_time": 6.083826068788767, "framework_time": 0.504972180351615, "timestamp": "2025-02-20 08:00:44.335982+00:00"},
"2,512,32,32,250": {"block_size_x": 2, "block_size_y": 512, "tile_size_x": 32, "tile_size_y": 32, "nvml_pwr_limit": 250, "sm__warps_active.avg.pct_of_peak_sustained_active": 64.39894922572734, "dram__bytes.sum.per_second": 25964702858.78422, "time": 10.697225161961146, "times": [10.443039894104004, 10.47920036315918, 10.622559547424316, 10.767007827758789, 10.834912300109863, 10.865568161010742, 10.868288040161133], "nvml_power": 249.523, "nvml_energy": 2.6692037140880314, "compile_time": 229.1671389248222, "verification_time": 0, "benchmark_time": 1139.782498124987, "edp": 28.553073132742636, "throughput_penalty": 1000000.0, "objective": 1000028.5530731328, "strategy_time": 4.0214399341493845, "framework_time": 0.5277618765830994, "timestamp": "2025-02-20 08:00:45.709505+00:00"},
"1,1024,32,32,205": {"block_size_x": 1, "block_size_y": 1024, "tile_size_x": 32, "tile_size_y": 32, "nvml_pwr_limit": 205, "sm__warps_active.avg.pct_of_peak_sustained_active": 65.90013753541155, "dram__bytes.sum.per_second": 18400785542.6721, "time": 15.884754044669014, "times": [15.466464042663574, 15.564800262451172, 15.749343872070312, 16.16486358642578, 16.176063537597656, 16.10335922241211, 15.9683837890625], "nvml_power": 208.968, "nvml_energy": 3.319405283206395, "compile_time": 239.77263714186847, "verification_time": 0, "benchmark_time": 1170.7652669865638, "edp": 52.72793649830848, "throughput_penalty": 1000000.0, "objective": 1000052.7279364984, "strategy_time": 40.630638133734465, "framework_time": 46.11004190519452, "timestamp": "2025-02-20 08:00:47.206808+00:00"},
"4,128,32,2,145": {"block_size_x": 4, "block_size_y": 128, "tile_size_x": 32, "tile_size_y": 2, "nvml_pwr_limit": 145, "sm__warps_active.avg.pct_of_peak_sustained_active": 97.55947272906887, "dram__bytes.sum.per_second": 9628394388.39446, "time": 22.435881205967494, "times": [20.781984329223633, 21.334239959716797, 23.08412742614746, 23.017728805541992, 22.897567749023438, 22.901887893676758, 23.033632278442383], "nvml_power": 150.353, "nvml_energy": 3.373302046960831, "compile_time": 230.58762191794813, "verification_time": 0, "benchmark_time": 1283.576844027266, "edp": 75.68300399746019, "throughput_penalty": 1000000.0, "objective": 1000075.6830039974, "strategy_time": 5.644155200570822, "framework_time": 42.22939186729491, "timestamp": "2025-02-20 08:00:48.768870+00:00"},
"1,1024,32,32,200": {"block_size_x": 1, "block_size_y": 1024, "tile_size_x": 32, "tile_size_y": 32, "nvml_pwr_limit": 200, "sm__warps_active.avg.pct_of_peak_sustained_active": 65.88753426516821, "dram__bytes.sum.per_second": 18825370461.246796, "time": 15.930395671299525, "times": [15.31760025024414, 15.696672439575195, 15.899680137634277, 15.99392032623291, 16.17795181274414, 16.24073600769043, 16.186208724975586], "nvml_power": 202.941, "nvml_energy": 3.232930427929197, "compile_time": 240.81399803981185, "verification_time": 0, "benchmark_time": 1182.713374029845, "edp": 51.5018608946958, "throughput_penalty": 1000000.0, "objective": 1000051.5018608947, "strategy_time": 3.5320399329066277, "framework_time": 51.403515972197056, "timestamp": "2025-02-20 08:00:50.247357+00:00"},
"2,256,32,2,185": {"block_size_x": 2, "block_size_y": 256, "tile_size_x": 32, "tile_size_y": 2, "nvml_pwr_limit": 185, "sm__warps_active.avg.pct_of_peak_sustained_active": 94.35791740431965, "dram__bytes.sum.per_second": 15071225758.986563, "time": 12.297110830034528, "times": [11.19161605834961, 11.648672103881836, 12.320735931396484, 12.7456636428833, 12.725312232971191, 12.724255561828613, 12.723520278930664], "nvml_power": 189.224, "nvml_energy": 2.3269084997024536, "compile_time": 242.20872088335454, "verification_time": 0, "benchmark_time": 1193.858471000567, "edp": 28.614251712190438, "throughput_penalty": 1000000.0, "objective": 1000028.6142517122, "strategy_time": 38.45084202475846, "framework_time": 47.30195505544543, "timestamp": "2025-02-20 08:00:51.769200+00:00"},
"1,512,16,32,115": {"block_size_x": 1, "block_size_y": 512, "tile_size_x": 16, "tile_size_y": 32, "nvml_pwr_limit": 115, "sm__warps_active.avg.pct_of_peak_sustained_active": 96.27605434996165, "dram__bytes.sum.per_second": 13685589114.332918, "time": 51.131076267787385, "times": [48.302207946777344, 52.344608306884766, 51.50563049316406, 51.18569564819336, 51.52783966064453, 51.45881652832031, 51.592735290527344], "nvml_power": 116.507, "nvml_energy": 5.957128302731105, "compile_time": 233.83284895680845, "verification_time": 0, "benchmark_time": 1481.4337680581957, "edp": 304.59438158393897, "throughput_penalty": 1000000.0, "objective": 1000304.594381584, "strategy_time": 5.973926046863198, "framework_time": 49.547871109098196, "timestamp": "2025-02-20 08:00:53.540014+00:00"},
"1,256,32,2,180": {"block_size_x": 1, "block_size_y": 256, "tile_size_x": 32, "tile_size_y": 2, "nvml_pwr_limit": 180, "sm__warps_active.avg.pct_of_peak_sustained_active": 93.93168922948658, "dram__bytes.sum.per_second": 6433881504.843433, "time": 15.408374786376953, "times": [14.702303886413574, 15.161888122558594, 15.191904067993164, 15.74953556060791, 15.599648475646973, 15.752063751220703, 15.701279640197754], "nvml_power": 184.176, "nvml_energy": 2.8378528346557617, "compile_time": 231.73316288739443, "verification_time": 0, "benchmark_time": 1175.0836761202663, "edp": 43.7267000649582, "throughput_penalty": 1000000.0, "objective": 1000043.726700065, "strategy_time": 3.832640126347542, "framework_time": 52.461918676272035, "timestamp": "2025-02-20 08:00:55.003149+00:00"},
"32,32,32,32,250": {"block_size_x": 32, "block_size_y": 32, "tile_size_x": 32, "tile_size_y": 32, "nvml_pwr_limit": 250, "sm__warps_active.avg.pct_of_peak_sustained_active": 65.97711467092037, "dram__bytes.sum.per_second": 126814450057.934, "time": 138.36605181012834, "times": [138.61520385742188, 138.33984375, 138.31954956054688, 138.32374572753906, 138.31698608398438, 138.32611083984375, 138.3209228515625], "nvml_power": 224.022, "nvml_energy": 30.99703965860857, "compile_time": 239.21831115148962, "verification_time": 0, "benchmark_time": 2241.4196468889713, "edp": 4288.937995363636, "throughput_penalty": 1000000.0, "objective": 1004288.9379953636, "strategy_time": 59.978959150612354, "framework_time": 44.940998777747154, "timestamp": "2025-02-20 08:00:57.588732+00:00"},
"1,1024,32,8,105": {"block_size_x": 1, "block_size_y": 1024, "tile_size_x": 32, "tile_size_y": 8, "nvml_pwr_limit": 105, "sm__warps_active.avg.pct_of_peak_sustained_active": 65.8978622468073, "dram__bytes.sum.per_second": 18943812828.22671, "time": 30.710427148001536, "times": [18.929183959960938, 32.68230438232422, 31.52649688720703, 33.29804611206055, 34.0780143737793, 30.656896591186523, 33.80204772949219], "nvml_power": 105.027, "nvml_energy": 3.2254240320731573, "compile_time": 231.89507192000747, "verification_time": 0, "benchmark_time": 1347.334603080526, "edp": 99.05414975839606, "throughput_penalty": 1000000.0, "objective": 1000099.0541497584, "strategy_time": 5.836385069414973, "framework_time": 49.30179985240102, "timestamp": "2025-02-20 08:00:59.223125+00:00"},
"32,32,32,16,250": {"block_size_x": 32, "block_size_y": 32, "tile_size_x": 32, "tile_size_y": 16, "nvml_pwr_limit": 250, "sm__warps_active.avg.pct_of_peak_sustained_active": 65.97978393800199, "dram__bytes.sum.per_second": 126361668836.50943, "time": 138.37090846470423, "times": [138.44671630859375, 138.3370819091797, 138.40261840820312, 138.39846801757812, 138.34127807617188, 138.33544921875, 138.33474731445312], "nvml_power": 223.909, "nvml_energy": 30.98249174342346, "compile_time": 239.74905209615827, "verification_time": 0, "benchmark_time": 2244.8069641832262, "edp": 4287.075529037702, "throughput_penalty": 1000000.0, "objective": 1004287.0755290377, "strategy_time": 3.755229990929365, "framework_time": 44.69309654086828, "timestamp": "2025-02-20 08:01:01.756154+00:00"},
"1,64,32,16,245": {"block_size_x": 1, "block_size_y": 64, "tile_size_x": 32, "tile_size_y": 16, "nvml_pwr_limit": 245, "sm__warps_active.avg.pct_of_peak_sustained_active": 89.79491244392163, "dram__bytes.sum.per_second": 17179607726.079872, "time": 15.619780676705497, "times": [15.868160247802734, 15.829440116882324, 15.573568344116211, 15.361151695251465, 15.55072021484375, 15.561280250549316, 15.594143867492676], "nvml_power": 248.276, "nvml_energy": 3.8780166672897343, "compile_time": 240.56362290866673, "verification_time": 0, "benchmark_time": 1174.897941062227, "edp": 60.57376980367405, "throughput_penalty": 1000000.0, "objective": 1000060.5737698036, "strategy_time": 46.50137200951576, "framework_time": 39.5037648268044, "timestamp": "2025-02-20 08:01:03.257646+00:00"},
"2,64,32,16,245": {"block_size_x": 2, "block_size_y": 64, "tile_size_x": 32, "tile_size_y": 16, "nvml_pwr_limit": 245, "sm__warps_active.avg.pct_of_peak_sustained_active": 96.23791838547537, "dram__bytes.sum.per_second": 17019012109.10896, "time": 11.293046815054756, "times": [10.852319717407227, 11.109536170959473, 11.188608169555664, 11.465312004089355, 11.416959762573242, 11.499008178710938, 11.519583702087402], "nvml_power": 243.334, "nvml_energy": 2.747982253694534, "compile_time": 232.26190102286637, "verification_time": 0, "benchmark_time": 1141.7607220355421, "edp": 31.03309223791205, "throughput_penalty": 1000000.0, "objective": 1000031.0330922379, "strategy_time": 5.9187449514865875, "framework_time": 0.5111820064485073, "timestamp": "2025-02-20 08:01:04.638123+00:00"},
"1,64,32,32,245": {"block_size_x": 1, "block_size_y": 64, "tile_size_x": 32, "tile_size_y": 32, "nvml_pwr_limit": 245, "sm__warps_active.avg.pct_of_peak_sustained_active": 90.19927927636996, "dram__bytes.sum.per_second": 27987484044.326683, "time": 16.221759796142578, "times": [15.975008010864258, 16.181215286254883, 16.200191497802734, 16.329727172851562, 16.092191696166992, 16.45827293395996, 16.315711975097656], "nvml_power": 244.915, "nvml_energy": 3.9729523004722593, "compile_time": 234.00307493284345, "verification_time": 0, "benchmark_time": 1171.1419878993183, "edp": 64.44827789979307, "throughput_penalty": 1000000.0, "objective": 1000064.4482778998, "strategy_time": 3.831789828836918, "framework_time": 0.546351308003068, "timestamp": "2025-02-20 08:01:06.047670+00:00"},
"1,32,32,4,250": {"block_size_x": 1, "block_size_y": 32, "tile_size_x": 32, "tile_size_y": 4, "nvml_pwr_limit": 250, "sm__warps_active.avg.pct_of_peak_sustained_active": 48.72329005307969, "dram__bytes.sum.per_second": 10945824139.548622, "time": 9.182743072509766, "times": [9.23356819152832, 9.208512306213379, 9.19542407989502, 9.148256301879883, 9.187007904052734, 9.163552284240723, 9.1428804397583], "nvml_power": 255.038, "nvml_energy": 2.341948427726746, "compile_time": 250.37218700163066, "verification_time": 0, "benchmark_time": 1109.2860519420356, "edp": 21.505510700882915, "throughput_penalty": 1000000.0, "objective": 1000021.5055107009, "strategy_time": 43.335753958672285, "framework_time": 50.54837325587869, "timestamp": "2025-02-20 08:01:07.501238+00:00"},
"2,64,32,16,250": {"block_size_x": 2, "block_size_y": 64, "tile_size_x": 32, "tile_size_y": 16, "nvml_pwr_limit": 250, "sm__warps_active.avg.pct_of_peak_sustained_active": 96.23132631301267, "dram__bytes.sum.per_second": 17352492225.419247, "time": 11.182715552193779, "times": [10.812064170837402, 10.918880462646484, 10.991999626159668, 11.224896430969238, 11.50931167602539, 11.470720291137695, 11.351136207580566], "nvml_power": 251.863, "nvml_energy": 2.8165122871221815, "compile_time": 231.28144699148834, "verification_time": 0, "benchmark_time": 1155.2552508655936, "edp": 31.496255756146088, "throughput_penalty": 1000000.0, "objective": 1000031.4962557561, "strategy_time": 5.5196641478687525, "framework_time": 0.5332319997251034, "timestamp": "2025-02-20 08:01:08.893852+00:00"},
"1,64,32,4,250": {"block_size_x": 1, "block_size_y": 64, "tile_size_x": 32, "tile_size_y": 4, "nvml_pwr_limit": 250, "sm__warps_active.avg.pct_of_peak_sustained_active": 90.34319772053603, "dram__bytes.sum.per_second": 7594110544.52701, "time": 14.861933844430107, "times": [15.064895629882812, 14.836416244506836, 14.765536308288574, 14.865344047546387, 14.896896362304688, 14.827936172485352, 14.776512145996094], "nvml_power": 245.652, "nvml_energy": 3.6508637727519444, "compile_time": 241.11919291317463, "verification_time": 0, "benchmark_time": 1153.9055549073964, "edp": 54.258895865665906, "throughput_penalty": 1000000.0, "objective": 1000054.2588958656, "strategy_time": 3.458470106124878, "framework_time": 0.5470900796353817, "timestamp": "2025-02-20 08:01:10.292905+00:00"},
"2,512,32,32,220": {"block_size_x": 2, "block_size_y": 512, "tile_size_x": 32, "tile_size_y": 32, "nvml_pwr_limit": 220, "sm__warps_active.avg.pct_of_peak_sustained_active": 64.40864380642148, "dram__bytes.sum.per_second": 25022104204.676144, "time": 11.197023936680385, "times": [10.461088180541992, 10.491423606872559, 10.839167594909668, 11.6145601272583, 11.681599617004395, 11.727328300476074, 11.564000129699707], "nvml_power": 222.501, "nvml_energy": 2.491349022935322, "compile_time": 236.7729910183698, "verification_time": 0, "benchmark_time": 1168.3017499744892, "edp": 27.89569464443209, "throughput_penalty": 1000000.0, "objective": 1000027.8956946444, "strategy_time": 61.851650942116976, "framework_time": 39.880325086414814, "timestamp": "2025-02-20 08:01:11.799736+00:00"},
"2,32,32,8,245": {"block_size_x": 2, "block_size_y": 32, "tile_size_x": 32, "tile_size_y": 8, "nvml_pwr_limit": 245, "sm__warps_active.avg.pct_of_peak_sustained_active": 93.5213506453806, "dram__bytes.sum.per_second": 18207522920.05826, "time": 10.913700648716517, "times": [10.67187213897705, 10.741536140441895, 10.645088195800781, 10.649120330810547, 11.235487937927246, 11.231167793273926, 11.22163200378418], "nvml_power": 247.69, "nvml_energy": 2.7032145136805945, "compile_time": 231.65243701077998, "verification_time": 0, "benchmark_time": 1166.5115738287568, "edp": 29.50207399157581, "throughput_penalty": 1000000.0, "objective": 1000029.5020739916, "strategy_time": 6.052816053852439, "framework_time": 47.316882060840726, "timestamp": "2025-02-20 08:01:13.251292+00:00"},
"2,512,32,32,225": {"block_size_x": 2, "block_size_y": 512, "tile_size_x": 32, "tile_size_y": 32, "nvml_pwr_limit": 225, "sm__warps_active.avg.pct_of_peak_sustained_active": 64.3971004550927, "dram__bytes.sum.per_second": 25569395831.078075, "time": 11.067405836922783, "times": [10.494208335876465, 10.523455619812012, 10.927712440490723, 11.052736282348633, 11.476223945617676, 11.516863822937012, 11.480640411376953], "nvml_power": 226.103, "nvml_energy": 2.502373661945752, "compile_time": 232.95977897942066, "verification_time": 0, "benchmark_time": 1169.835870154202, "edp": 27.694784872380254, "throughput_penalty": 1000000.0, "objective": 1000027.6947848724, "strategy_time": 3.967809956520796, "framework_time": 48.49151778034866, "timestamp": "2025-02-20 08:01:14.706573+00:00"},
"2,512,32,8,205": {"block_size_x": 2, "block_size_y": 512, "tile_size_x": 32, "tile_size_y": 8, "nvml_pwr_limit": 205, "sm__warps_active.avg.pct_of_peak_sustained_active": 64.46683692979656, "dram__bytes.sum.per_second": 24868772449.590977, "time": 11.510870797293526, "times": [10.500703811645508, 10.565312385559082, 11.100031852722168, 12.08198356628418, 12.14675235748291, 12.173439979553223, 12.007871627807617], "nvml_power": 207.192, "nvml_energy": 2.3849603422328403, "compile_time": 237.0951201301068, "verification_time": 0, "benchmark_time": 1169.5037172175944, "edp": 27.452970356111173, "throughput_penalty": 1000000.0, "objective": 1000027.4529703561, "strategy_time": 47.8734050411731, "framework_time": 44.54251565039158, "timestamp": "2025-02-20 08:01:16.205612+00:00"},
"2,256,32,32,245": {"block_size_x": 2, "block_size_y": 256, "tile_size_x": 32, "tile_size_y": 32, "nvml_pwr_limit": 245, "sm__warps_active.avg.pct_of_peak_sustained_active": 92.38055788426765, "dram__bytes.sum.per_second": 17895635644.441437, "time": 10.649188722882952, "times": [10.341216087341309, 10.304032325744629, 10.474495887756348, 10.477472305297852, 10.912320137023926, 11.029024124145508, 11.005760192871094], "nvml_power": 245.775, "nvml_energy": 2.6173043583665576, "compile_time": 237.9098921082914, "verification_time": 0, "benchmark_time": 1153.4727921243757, "edp": 27.872168057469548, "throughput_penalty": 1000000.0, "objective": 1000027.8721680575, "strategy_time": 5.781535990536213, "framework_time": 46.81814066134393, "timestamp": "2025-02-20 08:01:17.649618+00:00"},
"1,512,32,8,160": {"block_size_x": 1, "block_size_y": 512, "tile_size_x": 32, "tile_size_y": 8, "nvml_pwr_limit": 160, "sm__warps_active.avg.pct_of_peak_sustained_active": 92.68385155876382, "dram__bytes.sum.per_second": 10379992822.759277, "time": 14.538061686924525, "times": [13.297727584838867, 13.84006404876709, 14.446016311645508, 15.086112022399902, 15.13974380493164, 14.997695922851562, 14.95907211303711], "nvml_power": 165.539, "nvml_energy": 2.4066161935917987, "compile_time": 243.77791699953377, "verification_time": 0, "benchmark_time": 1205.2580649033189, "edp": 34.98753467918907, "throughput_penalty": 1000000.0, "objective": 1000034.9875346792, "strategy_time": 3.515898948535323, "framework_time": 49.558669328689575, "timestamp": "2025-02-20 08:01:19.151754+00:00"},
"2,256,32,2,165": {"block_size_x": 2, "block_size_y": 256, "tile_size_x": 32, "tile_size_y": 2, "nvml_pwr_limit": 165, "sm__warps_active.avg.pct_of_peak_sustained_active": 94.36415407539283, "dram__bytes.sum.per_second": 15569172407.135029, "time": 13.968727111816406, "times": [11.344320297241211, 12.08505630493164, 14.438464164733887, 15.463616371154785, 15.095232009887695, 14.72704029083252, 14.627360343933105], "nvml_power": 170.548, "nvml_energy": 2.3823384714660647, "compile_time": 239.1257642302662, "verification_time": 0, "benchmark_time": 1223.6078109126538, "edp": 33.27823599589127, "throughput_penalty": 1000000.0, "objective": 1000033.2782359959, "strategy_time": 63.011903781443834, "framework_time": 41.8458990752697, "timestamp": "2025-02-20 08:01:20.719368+00:00"},
"2,64,32,8,250": {"block_size_x": 2, "block_size_y": 64, "tile_size_x": 32, "tile_size_y": 8, "nvml_pwr_limit": 250, "sm__warps_active.avg.pct_of_peak_sustained_active": 96.13545004357091, "dram__bytes.sum.per_second": 12215063098.464447, "time": 11.364292417253766, "times": [10.947615623474121, 11.04640007019043, 11.344575881958008, 11.625503540039062, 11.502528190612793, 11.626815795898438, 11.456607818603516], "nvml_power": 250.793, "nvml_energy": 2.8500849882003236, "compile_time": 224.78395607322454, "verification_time": 0, "benchmark_time": 1142.762347124517, "edp": 32.38919921993373, "throughput_penalty": 1000000.0, "objective": 1000032.3891992199, "strategy_time": 6.070464849472046, "framework_time": 46.0221809335053, "timestamp": "2025-02-20 08:01:22.139031+00:00"},
"2,256,32,2,170": {"block_size_x": 2, "block_size_y": 256, "tile_size_x": 32, "tile_size_y": 2, "nvml_pwr_limit": 170, "sm__warps_active.avg.pct_of_peak_sustained_active": 94.36878677660042, "dram__bytes.sum.per_second": 15385441700.948486, "time": 13.14417825426374, "times": [11.192543983459473, 11.489055633544922, 12.760191917419434, 13.844799995422363, 14.597311973571777, 14.10854434967041, 14.016799926757812], "nvml_power": 175.139, "nvml_energy": 2.3020582352734977, "compile_time": 239.96817599982023, "verification_time": 0, "benchmark_time": 1254.7526960261166, "edp": 30.258663796130673, "throughput_penalty": 1000000.0, "objective": 1000030.2586637961, "strategy_time": 3.94423003308475, "framework_time": 42.34248003922403, "timestamp": "2025-02-20 08:01:23.680062+00:00"},
"1,256,32,8,145": {"block_size_x": 1, "block_size_y": 256, "tile_size_x": 32, "tile_size_y": 8, "nvml_pwr_limit": 145, "sm__warps_active.avg.pct_of_peak_sustained_active": 94.08715286429167, "dram__bytes.sum.per_second": 6587948574.010433, "time": 16.372027260916575, "times": [15.118047714233398, 16.070144653320312, 16.21855926513672, 16.381376266479492, 16.694591522216797, 17.047199249267578, 17.07427215576172], "nvml_power": 150.334, "nvml_energy": 2.4612723462426325, "compile_time": 242.26683005690575, "verification_time": 0, "benchmark_time": 1288.322911132127, "edp": 40.29601794922448, "throughput_penalty": 1000000.0, "objective": 1000040.2960179492, "strategy_time": 47.94296505860984, "framework_time": 44.16202590800822, "timestamp": "2025-02-20 08:01:25.302781+00:00"},
"1,512,32,8,110": {"block_size_x": 1, "block_size_y": 512, "tile_size_x": 32, "tile_size_y": 8, "nvml_pwr_limit": 110, "sm__warps_active.avg.pct_of_peak_sustained_active": 92.68687489392656, "dram__bytes.sum.per_second": 9809475895.948624, "time": 24.01000213623047, "times": [14.702112197875977, 19.298751831054688, 24.317535400390625, 28.017120361328125, 26.95199966430664, 26.715679168701172, 28.066816329956055], "nvml_power": 111.568, "nvml_energy": 2.678747918334961, "compile_time": 233.61838702112436, "verification_time": 0, "benchmark_time": 1401.8405640963465, "edp": 64.31674324164534, "throughput_penalty": 1000000.0, "objective": 1000064.3167432416, "strategy_time": 5.617763847112656, "framework_time": 62.73009395226836, "timestamp": "2025-02-20 08:01:27.006613+00:00"},
"1,256,32,8,140": {"block_size_x": 1, "block_size_y": 256, "tile_size_x": 32, "tile_size_y": 8, "nvml_pwr_limit": 140, "sm__warps_active.avg.pct_of_peak_sustained_active": 93.97956906012418, "dram__bytes.sum.per_second": 6784856568.010707, "time": 16.76892307826451, "times": [15.040672302246094, 16.132415771484375, 16.525951385498047, 16.971519470214844, 17.186527252197266, 17.76825523376465, 17.75712013244629], "nvml_power": 144.138, "nvml_energy": 2.41703903465489, "compile_time": 247.2384120337665, "verification_time": 0, "benchmark_time": 1322.1120529342443, "edp": 40.53114164929056, "throughput_penalty": 1000000.0, "objective": 1000040.5311416492, "strategy_time": 3.442540066316724, "framework_time": 51.09687219373882, "timestamp": "2025-02-20 08:01:28.630527+00:00"},
"16,64,32,2,130": {"block_size_x": 16, "block_size_y": 64, "tile_size_x": 32, "tile_size_y": 2, "nvml_pwr_limit": 130, "sm__warps_active.avg.pct_of_peak_sustained_active": 65.98048286748335, "dram__bytes.sum.per_second": 17949577637.91898, "time": 85.53007507324219, "times": [89.26290893554688, 85.06937408447266, 84.62345886230469, 84.97577667236328, 85.2192611694336, 84.80217742919922, 84.757568359375], "nvml_power": 131.071, "nvml_energy": 11.210512469924927, "compile_time": 235.42806110344827, "verification_time": 0, "benchmark_time": 1781.9435829296708, "edp": 958.8359731621968, "throughput_penalty": 1000000.0, "objective": 1000958.8359731622, "strategy_time": 72.41588784381747, "framework_time": 41.62323893979192, "timestamp": "2025-02-20 08:01:30.761962+00:00"},
"1,512,32,32,250": {"block_size_x": 1, "block_size_y": 512, "tile_size_x": 32, "tile_size_y": 32, "nvml_pwr_limit": 250, "sm__warps_active.avg.pct_of_peak_sustained_active": 92.62999390815294, "dram__bytes.sum.per_second": 10776198844.584496, "time": 12.770486967904228, "times": [12.637696266174316, 12.892448425292969, 12.776448249816895, 12.80838394165039, 12.729056358337402, 12.804863929748535, 12.744511604309082], "nvml_power": 251.212, "nvml_energy": 3.208099572181157, "compile_time": 227.48411004431546, "verification_time": 0, "benchmark_time": 1141.8341100215912, "edp": 40.968993778278595, "throughput_penalty": 1000000.0, "objective": 1000040.9689937782, "strategy_time": 6.200885865837336, "framework_time": 40.59803509153426, "timestamp": "2025-02-20 08:01:32.178102+00:00"},
"16,64,32,2,125": {"block_size_x": 16, "block_size_y": 64, "tile_size_x": 32, "tile_size_y": 2, "nvml_pwr_limit": 125, "sm__warps_active.avg.pct_of_peak_sustained_active": 65.98190538946724, "dram__bytes.sum.per_second": 16254993341.490532, "time": 91.00085994175502, "times": [92.94796752929688, 91.0907211303711, 90.82518768310547, 90.63619232177734, 90.52146911621094, 90.47315216064453, 90.5113296508789], "nvml_power": 126.844, "nvml_energy": 11.542913078451974, "compile_time": 231.80414992384613, "verification_time": 0, "benchmark_time": 1806.765208952129, "edp": 1050.4150163720603, "throughput_penalty": 1000000.0, "objective": 1001050.4150163721, "strategy_time": 4.123731050640345, "framework_time": 54.571371991187334, "timestamp": "2025-02-20 08:01:34.275391+00:00"},
"1,256,32,2,150": {"block_size_x": 1, "block_size_y": 256, "tile_size_x": 32, "tile_size_y": 2, "nvml_pwr_limit": 150, "sm__warps_active.avg.pct_of_peak_sustained_active": 94.06932974370987, "dram__bytes.sum.per_second": 5764082278.481012, "time": 16.49390152522496, "times": [15.235360145568848, 16.157983779907227, 16.483936309814453, 16.88921546936035, 16.9769287109375, 16.792959213256836, 16.920927047729492], "nvml_power": 153.617, "nvml_energy": 2.5337436706004826, "compile_time": 243.55821986682713, "verification_time": 0, "benchmark_time": 1236.0590191092342, "edp": 41.791318593046384, "throughput_penalty": 1000000.0, "objective": 1000041.7913185931, "strategy_time": 48.17930515855551, "framework_time": 40.338163962587714, "timestamp": "2025-02-20 08:01:35.843551+00:00"},
"1,256,32,4,150": {"block_size_x": 1, "block_size_y": 256, "tile_size_x": 32, "tile_size_y": 4, "nvml_pwr_limit": 150, "sm__warps_active.avg.pct_of_peak_sustained_active": 93.97028803821146, "dram__bytes.sum.per_second": 6137869060.605519, "time": 16.388731684003556, "times": [14.227744102478027, 16.398080825805664, 16.462400436401367, 16.947872161865234, 16.93120002746582, 16.78540802001953, 16.968416213989258], "nvml_power": 155.119, "nvml_energy": 2.5422036700909474, "compile_time": 226.5156959183514, "verification_time": 0, "benchmark_time": 1253.225059946999, "edp": 41.663493835209636, "throughput_penalty": 1000000.0, "objective": 1000041.6634938353, "strategy_time": 5.492364056408405, "framework_time": 0.49979123286902905, "timestamp": "2025-02-20 08:01:37.329307+00:00"},
"1,256,32,2,155": {"block_size_x": 1, "block_size_y": 256, "tile_size_x": 32, "tile_size_y": 2, "nvml_pwr_limit": 155, "sm__warps_active.avg.pct_of_peak_sustained_active": 93.80544953220151, "dram__bytes.sum.per_second": 6182301596.390886, "time": 16.362408910478866, "times": [15.309503555297852, 15.966591835021973, 16.368032455444336, 16.827743530273438, 16.68217658996582, 16.762367248535156, 16.620447158813477], "nvml_power": 160.24, "nvml_energy": 2.6219124038151334, "compile_time": 237.10258305072784, "verification_time": 0, "benchmark_time": 1212.4181420076638, "edp": 42.9008028786798, "throughput_penalty": 1000000.0, "objective": 1000042.9008028787, "strategy_time": 3.437418956309557, "framework_time": 50.82143098115921, "timestamp": "2025-02-20 08:01:38.833110+00:00"},
"4,128,32,2,155": {"block_size_x": 4, "block_size_y": 128, "tile_size_x": 32, "tile_size_y": 2, "nvml_pwr_limit": 155, "sm__warps_active.avg.pct_of_peak_sustained_active": 97.55062845236749, "dram__bytes.sum.per_second": 9282355946.429224, "time": 21.21506745474679, "times": [18.530975341796875, 21.530303955078125, 22.15328025817871, 21.72140884399414, 21.482175827026367, 21.42425537109375, 21.66307258605957], "nvml_power": 158.886, "nvml_energy": 3.3707772076148985, "compile_time": 246.8090569600463, "verification_time": 0, "benchmark_time": 1256.037033163011, "edp": 71.5112658344731, "throughput_penalty": 1000000.0, "objective": 1000071.5112658344, "strategy_time": 48.00381395034492, "framework_time": 0.5863721016794443, "timestamp": "2025-02-20 08:01:40.384570+00:00"},
"4,128,32,2,150": {"block_size_x": 4, "block_size_y": 128, "tile_size_x": 32, "tile_size_y": 2, "nvml_pwr_limit": 150, "sm__warps_active.avg.pct_of_peak_sustained_active": 97.55663846431202, "dram__bytes.sum.per_second": 9152888959.916317, "time": 21.876256125313894, "times": [20.476064682006836, 20.705280303955078, 22.680095672607422, 22.51375961303711, 22.32534408569336, 22.217792510986328, 22.215456008911133], "nvml_power": 155.468, "nvml_energy": 3.4010577872903003, "compile_time": 234.49237388558686, "verification_time": 0, "benchmark_time": 1265.1222529821098, "edp": 74.40241125175595, "throughput_penalty": 1000000.0, "objective": 1000074.4024112518, "strategy_time": 6.221696035936475, "framework_time": 47.21993301063776, "timestamp": "2025-02-20 08:01:41.937651+00:00"},
"2,128,32,2,155": {"block_size_x": 2, "block_size_y": 128, "tile_size_x": 32, "tile_size_y": 2, "nvml_pwr_limit": 155, "sm__warps_active.avg.pct_of_peak_sustained_active": 95.04178298119977, "dram__bytes.sum.per_second": 12872912571.221516, "time": 14.711753027779716, "times": [11.504639625549316, 12.049407958984375, 13.749247550964355, 15.875167846679688, 16.647199630737305, 16.517120361328125, 16.639488220214844], "nvml_power": 158.836, "nvml_energy": 2.336756003920419, "compile_time": 241.50159279815853, "verification_time": 0, "benchmark_time": 1327.5714709889144, "edp": 34.37777721585865, "throughput_penalty": 1000000.0, "objective": 1000034.3777772159, "strategy_time": 4.035011166706681, "framework_time": 50.83310999907553, "timestamp": "2025-02-20 08:01:43.561616+00:00"},
"4,256,32,16,210": {"block_size_x": 4, "block_size_y": 256, "tile_size_x": 32, "tile_size_y": 16, "nvml_pwr_limit": 210, "sm__warps_active.avg.pct_of_peak_sustained_active": 65.96017972915111, "dram__bytes.sum.per_second": 10368307765.045475, "time": 18.677677427019393, "times": [18.2708797454834, 18.311647415161133, 18.732351303100586, 18.855775833129883, 18.867263793945312, 18.858335494995117, 18.847488403320312], "nvml_power": 213.633, "nvml_energy": 3.990168261766434, "compile_time": 241.70159315690398, "verification_time": 0, "benchmark_time": 1202.5955871213228, "edp": 74.52707567280413, "throughput_penalty": 1000000.0, "objective": 1000074.5270756728, "strategy_time": 54.403000976890326, "framework_time": 44.36240368522704, "timestamp": "2025-02-20 08:01:45.104704+00:00"},
"2,64,32,8,245": {"block_size_x": 2, "block_size_y": 64, "tile_size_x": 32, "tile_size_y": 8, "nvml_pwr_limit": 245, "sm__warps_active.avg.pct_of_peak_sustained_active": 96.17307439205892, "dram__bytes.sum.per_second": 12625736792.341671, "time": 11.360008920942034, "times": [10.9651517868042, 11.014047622680664, 11.292608261108398, 11.56499195098877, 11.590239524841309, 11.564607620239258, 11.52841567993164], "nvml_power": 249.461, "nvml_energy": 2.833879185427121, "compile_time": 232.1955480147153, "verification_time": 0, "benchmark_time": 1156.1435740441084, "edp": 32.19289282732404, "throughput_penalty": 1000000.0, "objective": 1000032.1928928273, "strategy_time": 5.773273995146155, "framework_time": 48.90074790455401, "timestamp": "2025-02-20 08:01:46.547741+00:00"},
"4,256,32,8,210": {"block_size_x": 4, "block_size_y": 256, "tile_size_x": 32, "tile_size_y": 8, "nvml_pwr_limit": 210, "sm__warps_active.avg.pct_of_peak_sustained_active": 65.96070745524074, "dram__bytes.sum.per_second": 10098362517.277048, "time": 18.763254983084543, "times": [18.275327682495117, 18.790016174316406, 18.86511993408203, 18.852928161621094, 18.85526466369629, 18.8654727935791, 18.838655471801758], "nvml_power": 214.311, "nvml_energy": 4.021171938679832, "compile_time": 239.32823608629405, "verification_time": 0, "benchmark_time": 1207.4284648988396, "edp": 75.4502744162741, "throughput_penalty": 1000000.0, "objective": 1000075.4502744162, "strategy_time": 3.685728879645467, "framework_time": 85.16443916596472, "timestamp": "2025-02-20 08:01:48.083373+00:00"},
"2,512,32,4,190": {"block_size_x": 2, "block_size_y": 512, "tile_size_x": 32, "tile_size_y": 4, "nvml_pwr_limit": 190, "sm__warps_active.avg.pct_of_peak_sustained_active": 64.39617563703179, "dram__bytes.sum.per_second": 24677062789.248173, "time": 11.786235400608607, "times": [10.487775802612305, 10.526975631713867, 11.798527717590332, 12.119551658630371, 12.532768249511719, 12.521856307983398, 12.516192436218262], "nvml_power": 192.784, "nvml_energy": 2.2721976054709296, "compile_time": 234.59601285867393, "verification_time": 0, "benchmark_time": 1202.0135389175266, "edp": 26.78065585477958, "throughput_penalty": 1000000.0, "objective": 1000026.7806558547, "strategy_time": 54.82751107774675, "framework_time": 45.18383601680398, "timestamp": "2025-02-20 08:01:49.620019+00:00"},
"2,512,32,4,210": {"block_size_x": 2, "block_size_y": 512, "tile_size_x": 32, "tile_size_y": 4, "nvml_pwr_limit": 210, "sm__warps_active.avg.pct_of_peak_sustained_active": 64.43761934228579, "dram__bytes.sum.per_second": 24266150478.499195, "time": 11.451145035879952, "times": [10.495136260986328, 10.501855850219727, 11.282719612121582, 12.139967918395996, 11.995455741882324, 11.92630386352539, 11.81657600402832], "nvml_power": 213.14, "nvml_energy": 2.4406970529474528, "compile_time": 224.66416819952428, "verification_time": 0, "benchmark_time": 1166.7634861078113, "edp": 27.948775941946053, "throughput_penalty": 1000000.0, "objective": 1000027.948775942, "strategy_time": 6.15954608656466, "framework_time": 48.50176349282265, "timestamp": "2025-02-20 08:01:51.066132+00:00"},
"2,512,32,8,215": {"block_size_x": 2, "block_size_y": 512, "tile_size_x": 32, "tile_size_y": 8, "nvml_pwr_limit": 215, "sm__warps_active.avg.pct_of_peak_sustained_active": 64.462676483232, "dram__bytes.sum.per_second": 24244363531.142246, "time": 11.296900612967354, "times": [10.483776092529297, 10.557536125183105, 11.190048217773438, 11.352895736694336, 11.782527923583984, 11.828351974487305, 11.88316822052002], "nvml_power": 217.315, "nvml_energy": 2.4549859567070005, "compile_time": 233.2879190798849, "verification_time": 0, "benchmark_time": 1170.6755438353866, "edp": 27.73373235914956, "throughput_penalty": 1000000.0, "objective": 1000027.7337323591, "strategy_time": 4.115961026400328, "framework_time": 54.05373708344996, "timestamp": "2025-02-20 08:01:52.528290+00:00"},
"1,1024,32,32,175": {"block_size_x": 1, "block_size_y": 1024, "tile_size_x": 32, "tile_size_y": 32, "nvml_pwr_limit": 175, "sm__warps_active.avg.pct_of_peak_sustained_active": 65.89901066618525, "dram__bytes.sum.per_second": 18389358201.4543, "time": 16.851305280412948, "times": [16.235872268676758, 16.53366470336914, 16.66761589050293, 17.07244873046875, 17.146047592163086, 17.133888244628906, 17.169599533081055], "nvml_power": 177.442, "nvml_energy": 2.9901293115670344, "compile_time": 239.7773638367653, "verification_time": 0, "benchmark_time": 1192.8262580186129, "edp": 50.3875818571271, "throughput_penalty": 1000000.0, "objective": 1000050.3875818572, "strategy_time": 46.36563011445105, "framework_time": 50.51395995542407, "timestamp": "2025-02-20 08:01:54.057797+00:00"},
"2,512,32,32,245": {"block_size_x": 2, "block_size_y": 512, "tile_size_x": 32, "tile_size_y": 32, "nvml_pwr_limit": 245, "sm__warps_active.avg.pct_of_peak_sustained_active": 64.43635573372305, "dram__bytes.sum.per_second": 25300504913.404636, "time": 10.883830887930733, "times": [10.488160133361816, 10.49942398071289, 10.715583801269531, 11.057920455932617, 11.140192031860352, 11.168383598327637, 11.117152214050293], "nvml_power": 246.726, "nvml_energy": 2.685324059655598, "compile_time": 224.67188606970012, "verification_time": 0, "benchmark_time": 1134.11993579939, "edp": 29.226612944583145, "throughput_penalty": 1000000.0, "objective": 1000029.2266129446, "strategy_time": 5.690963938832283, "framework_time": 49.163486110046506, "timestamp": "2025-02-20 08:01:55.471469+00:00"},
"1,512,32,8,170": {"block_size_x": 1, "block_size_y": 512, "tile_size_x": 32, "tile_size_y": 8, "nvml_pwr_limit": 170, "sm__warps_active.avg.pct_of_peak_sustained_active": 92.58002806566478, "dram__bytes.sum.per_second": 10215427982.329885, "time": 14.24680233001709, "times": [13.281023979187012, 13.715519905090332, 14.098112106323242, 14.569600105285645, 14.70742416381836, 14.678367614746094, 14.677568435668945], "nvml_power": 173.226, "nvml_energy": 2.46791658041954, "compile_time": 236.39418510720134, "verification_time": 0, "benchmark_time": 1191.0318189766258, "edp": 35.159919688208916, "throughput_penalty": 1000000.0, "objective": 1000035.1599196882, "strategy_time": 3.5894790198653936, "framework_time": 63.856254797428846, "timestamp": "2025-02-20 08:01:56.966366+00:00"},
"1,256,32,4,140": {"block_size_x": 1, "block_size_y": 256, "tile_size_x": 32, "tile_size_y": 4, "nvml_pwr_limit": 140, "sm__warps_active.avg.pct_of_peak_sustained_active": 94.0255261546037, "dram__bytes.sum.per_second": 6492752448.497129, "time": 16.928589820861816, "times": [15.494784355163574, 16.277568817138672, 16.971040725708008, 16.9215030670166, 17.403615951538086, 17.552799224853516, 17.878816604614258], "nvml_power": 144.527, "nvml_energy": 2.4466383010396955, "compile_time": 243.40338306501508, "verification_time": 0, "benchmark_time": 1314.831034047529, "edp": 41.418136238311234, "throughput_penalty": 1000000.0, "objective": 1000041.4181362384, "strategy_time": 42.50212898477912, "framework_time": 51.91915179602802, "timestamp": "2025-02-20 08:01:58.619046+00:00"},
"1,32,32,8,250": {"block_size_x": 1, "block_size_y": 32, "tile_size_x": 32, "tile_size_y": 8, "nvml_pwr_limit": 250, "sm__warps_active.avg.pct_of_peak_sustained_active": 48.76490305980965, "dram__bytes.sum.per_second": 13901688560.538458, "time": 9.243126732962471, "times": [9.267007827758789, 9.24073600769043, 9.213855743408203, 9.230239868164062, 9.250656127929688, 9.281439781188965, 9.217951774597168], "nvml_power": 250.025, "nvml_energy": 2.311012761408942, "compile_time": 230.87108111940324, "verification_time": 0, "benchmark_time": 1125.9696579072624, "edp": 21.360983835196414, "throughput_penalty": 1000000.0, "objective": 1000021.3609838352, "strategy_time": 5.939785158261657, "framework_time": 47.809331910684705, "timestamp": "2025-02-20 08:02:00.029661+00:00"},
"2,512,32,4,200": {"block_size_x": 2, "block_size_y": 512, "tile_size_x": 32, "tile_size_y": 4, "nvml_pwr_limit": 200, "sm__warps_active.avg.pct_of_peak_sustained_active": 64.33365891799627, "dram__bytes.sum.per_second": 25012656858.50281, "time": 11.466788428170341, "times": [10.484959602355957, 10.517184257507324, 11.327327728271484, 11.575072288513184, 12.122719764709473, 12.121055603027344, 12.119199752807617], "nvml_power": 203.507, "nvml_energy": 2.3335717126516617, "compile_time": 242.62189003638923, "verification_time": 0, "benchmark_time": 1201.8923009745777, "edp": 26.758573110939718, "throughput_penalty": 1000000.0, "objective": 1000026.7585731109, "strategy_time": 3.8726399652659893, "framework_time": 47.060339944437146, "timestamp": "2025-02-20 08:02:01.525138+00:00"},
"1,1024,32,32,155": {"block_size_x": 1, "block_size_y": 1024, "tile_size_x": 32, "tile_size_y": 32, "nvml_pwr_limit": 155, "sm__warps_active.avg.pct_of_peak_sustained_active": 65.89880154952931, "dram__bytes.sum.per_second": 18384674906.414036, "time": 17.559172766549246, "times": [16.234560012817383, 17.392255783081055, 17.765920639038086, 17.719743728637695, 17.86777687072754, 17.944255828857422, 17.989696502685547], "nvml_power": 159.761, "nvml_energy": 2.805271000356674, "compile_time": 241.95324815809727, "verification_time": 0, "benchmark_time": 1222.6417909841985, "edp": 49.25823815225327, "throughput_penalty": 1000000.0, "objective": 1000049.2582381523, "strategy_time": 50.25103804655373, "framework_time": 42.00307675637305, "timestamp": "2025-02-20 08:02:03.082012+00:00"},
"2,128,32,16,250": {"block_size_x": 2, "block_size_y": 128, "tile_size_x": 32, "tile_size_y": 16, "nvml_pwr_limit": 250, "sm__warps_active.avg.pct_of_peak_sustained_active": 95.00217022336268, "dram__bytes.sum.per_second": 16673871440.492796, "time": 11.066916738237653, "times": [10.807744026184082, 10.803680419921875, 10.925248146057129, 11.001888275146484, 11.321503639221191, 11.310848236083984, 11.297504425048828], "nvml_power": 255.013, "nvml_energy": 2.8222076381681984, "compile_time": 230.5234579835087, "verification_time": 0, "benchmark_time": 1153.7618630100042, "edp": 31.233136949625788, "throughput_penalty": 1000000.0, "objective": 1000031.2331369496, "strategy_time": 5.675464868545532, "framework_time": 50.446078181266785, "timestamp": "2025-02-20 08:02:04.522444+00:00"},
"2,512,32,32,210": {"block_size_x": 2, "block_size_y": 512, "tile_size_x": 32, "tile_size_y": 32, "nvml_pwr_limit": 210, "sm__warps_active.avg.pct_of_peak_sustained_active": 64.43076741395276, "dram__bytes.sum.per_second": 25496404349.06838, "time": 11.565211432320732, "times": [10.498720169067383, 11.539423942565918, 11.876511573791504, 11.80185604095459, 11.716352462768555, 11.726880073547363, 11.796735763549805], "nvml_power": 214.409, "nvml_energy": 2.4796854179924557, "compile_time": 237.01261403039098, "verification_time": 0, "benchmark_time": 1162.4694629572332, "edp": 28.67808614472536, "throughput_penalty": 1000000.0, "objective": 1000028.6780861447, "strategy_time": 3.626289078965783, "framework_time": 44.77281589061022, "timestamp": "2025-02-20 08:02:05.970350+00:00"},
