experiments/bayes_opt_float16.json
{
"device_name": "NVIDIA RTX 5000 Ada Generation",
"kernel_name": "tuned_matmul<__half>",
"problem_size": [
4096,
4096
],
"tune_params_keys": [
"block_size_x",
"block_size_y",
"tile_size_x",
"tile_size_y",
"nvml_pwr_limit"
],
"tune_params": {
"block_size_x": [
1,
2,
4,
8,
16,
32,
64,
128,
256,
512,
1024
],
"block_size_y": [
1,
2,
4,
8,
16,
32,
64,
128,
256,
512,
1024
],
"tile_size_x": [
2,
4,
8,
16,
32
],
"tile_size_y": [
2,
4,
8,
16,
32
],
"nvml_pwr_limit": [
100,
105,
110,
115,
120,
125,
130,
135,
140,
145,
150,
155,
160,
165,
170,
175,
180,
185,
190,
195,
200,
205,
210,
215,
220,
225,
230,
235,
240,
245,
250
]
},
"objective": "objective",
"cache": {
"64,8,8,8,235": {"block_size_x": 64, "block_size_y": 8, "tile_size_x": 8, "tile_size_y": 8, "nvml_pwr_limit": 235, "sm__warps_active.avg.pct_of_peak_sustained_active": 99.57042445833896, "dram__bytes.sum.per_second": 0.0, "time": 35.598336356026785, "times": [35.40208053588867, 35.4205436706543, 35.592769622802734, 35.69251251220703, 35.69171142578125, 35.6952018737793, 35.69353485107422], "nvml_power": 242.3, "nvml_energy": 8.62547689906529, "compile_time": 245.9603101015091, "verification_time": 0, "benchmark_time": 1354.3410210404545, "edp": 307.0526278840651, "throughput_penalty": 1000000.0, "objective": 1000307.0526278841, "strategy_time": 1374.2036339826882, "framework_time": 0, "timestamp": "2025-02-20 07:54:18.008266+00:00"},
"1,64,4,4,170": {"block_size_x": 1, "block_size_y": 64, "tile_size_x": 4, "tile_size_y": 4, "nvml_pwr_limit": 170, "sm__warps_active.avg.pct_of_peak_sustained_active": 95.4819813802845, "dram__bytes.sum.per_second": 501021862.1935739, "time": 71.8222416469029, "times": [72.5429458618164, 71.55363464355469, 71.76067352294922, 71.56432342529297, 71.70735931396484, 71.8255386352539, 71.80121612548828], "nvml_power": 171.873, "nvml_energy": 12.344304138578142, "compile_time": 251.90203892998397, "verification_time": 0, "benchmark_time": 1621.1786940693855, "edp": 886.5955948038228, "throughput_penalty": 1000000.0, "objective": 1000886.5955948038, "strategy_time": 0.5299518816173077, "framework_time": 47.2141660284251, "timestamp": "2025-02-20 07:54:19.929121+00:00"},
"2,128,4,2,190": {"block_size_x": 2, "block_size_y": 128, "tile_size_x": 4, "tile_size_y": 2, "nvml_pwr_limit": 190, "sm__warps_active.avg.pct_of_peak_sustained_active": 95.74636497140347, "dram__bytes.sum.per_second": 81971.1086723253, "time": 72.44190652029855, "times": [72.91986846923828, 72.37097930908203, 72.57472229003906, 72.21916961669922, 72.40275573730469, 72.17017364501953, 72.43567657470703], "nvml_power": 190.89749999999998, "nvml_energy": 13.82897884995869, "compile_time": 246.44854781217873, "verification_time": 0, "benchmark_time": 1630.81409689039, "edp": 1001.797593119893, "throughput_penalty": 1000000.0, "objective": 1001001.7975931199, "strategy_time": 0.15041092410683632, "framework_time": 48.93652116879821, "timestamp": "2025-02-20 07:54:21.855495+00:00"},
"16,64,16,16,150": {"block_size_x": 16, "block_size_y": 64, "tile_size_x": 16, "tile_size_y": 16, "nvml_pwr_limit": 150, "sm__warps_active.avg.pct_of_peak_sustained_active": 66.06214745256024, "dram__bytes.sum.per_second": 390251461.42583865, "time": 45.78327342442104, "times": [48.06934356689453, 45.594303131103516, 45.36764907836914, 45.363040924072266, 45.365089416503906, 45.35939025878906, 45.364097595214844], "nvml_power": 153.241, "nvml_energy": 7.015874602831705, "compile_time": 249.4448679499328, "verification_time": 0, "benchmark_time": 1435.274689923972, "edp": 321.20970525289533, "throughput_penalty": 1000000.0, "objective": 1000321.2097052529, "strategy_time": 0.24860096164047718, "framework_time": 57.61495931074023, "timestamp": "2025-02-20 07:54:23.598104+00:00"},
"16,32,32,4,215": {"block_size_x": 16, "block_size_y": 32, "tile_size_x": 32, "tile_size_y": 4, "nvml_pwr_limit": 215, "sm__warps_active.avg.pct_of_peak_sustained_active": 99.33576185458561, "dram__bytes.sum.per_second": 1372182.646268831, "time": 18.51168441772461, "times": [17.916831970214844, 18.469440460205078, 18.57721519470215, 18.63052749633789, 18.634464263916016, 18.677087783813477, 18.676223754882812], "nvml_power": 217.846, "nvml_energy": 4.0326964036636355, "compile_time": 251.14220310933888, "verification_time": 0, "benchmark_time": 1215.3812588658184, "edp": 74.6520031771142, "throughput_penalty": 1000000.0, "objective": 1000074.6520031771, "strategy_time": 0.45257085002958775, "framework_time": 65.97205926664174, "timestamp": "2025-02-20 07:54:25.131079+00:00"},
"8,128,2,4,165": {"block_size_x": 8, "block_size_y": 128, "tile_size_x": 2, "tile_size_y": 4, "nvml_pwr_limit": 165, "sm__warps_active.avg.pct_of_peak_sustained_active": 66.00428771835536, "dram__bytes.sum.per_second": 0.0, "time": 50.04540797642299, "times": [50.73775863647461, 50.073951721191406, 49.94825744628906, 49.95884704589844, 49.85273742675781, 49.806495666503906, 49.9398078918457], "nvml_power": 166.213, "nvml_energy": 8.318197395985194, "compile_time": 251.97935407049954, "verification_time": 0, "benchmark_time": 1441.6756781283766, "edp": 416.2875823104984, "throughput_penalty": 1000000.0, "objective": 1000416.2875823105, "strategy_time": 0.7229221519082785, "framework_time": 52.96302353963256, "timestamp": "2025-02-20 07:54:26.878444+00:00"},
"16,32,32,16,200": {"block_size_x": 16, "block_size_y": 32, "tile_size_x": 32, "tile_size_y": 16, "nvml_pwr_limit": 200, "sm__warps_active.avg.pct_of_peak_sustained_active": 99.32311910923016, "dram__bytes.sum.per_second": 1071887665.735646, "time": 18.983250209263392, "times": [17.670015335083008, 18.827007293701172, 19.29430389404297, 19.26361656188965, 19.260095596313477, 19.286848068237305, 19.280864715576172], "nvml_power": 206.923, "nvml_energy": 3.928071083051409, "compile_time": 252.12775287218392, "verification_time": 0, "benchmark_time": 1216.1843290086836, "edp": 74.56755620933714, "throughput_penalty": 1000000.0, "objective": 1000074.5675562093, "strategy_time": 0.7048118859529495, "framework_time": 54.8488013446331, "timestamp": "2025-02-20 07:54:28.402334+00:00"},
"1,1024,8,32,140": {"block_size_x": 1, "block_size_y": 1024, "tile_size_x": 8, "tile_size_y": 32, "nvml_pwr_limit": 140, "sm__warps_active.avg.pct_of_peak_sustained_active": 65.74940556387921, "dram__bytes.sum.per_second": 340911325.5700027, "time": 40.74444798060826, "times": [41.54777526855469, 40.73503875732422, 40.51919937133789, 40.58060836791992, 40.41107177734375, 40.792545318603516, 40.62489700317383], "nvml_power": 142.204, "nvml_energy": 5.794023480634417, "compile_time": 251.07547896914184, "verification_time": 0, "benchmark_time": 1381.797726964578, "edp": 236.0742883051318, "throughput_penalty": 1000000.0, "objective": 1000236.0742883051, "strategy_time": 0.5098120309412479, "framework_time": 50.652574049308896, "timestamp": "2025-02-20 07:54:30.086394+00:00"},
"2,512,8,16,105": {"block_size_x": 2, "block_size_y": 512, "tile_size_x": 8, "tile_size_y": 16, "nvml_pwr_limit": 105, "sm__warps_active.avg.pct_of_peak_sustained_active": 65.70589413700483, "dram__bytes.sum.per_second": 1401330.4217549812, "time": 44.23362295968192, "times": [47.50102233886719, 44.13670349121094, 43.60825729370117, 43.59648132324219, 43.596832275390625, 43.59737777709961, 43.59868621826172], "nvml_power": 105.87, "nvml_energy": 4.683013662741525, "compile_time": 251.45788793452084, "verification_time": 0, "benchmark_time": 1421.9154990278184, "edp": 207.1466606727476, "throughput_penalty": 1000000.0, "objective": 1000207.1466606727, "strategy_time": 0.3799009136855602, "framework_time": 55.6018422357738, "timestamp": "2025-02-20 07:54:31.815774+00:00"},
"1,512,16,32,115": {"block_size_x": 1, "block_size_y": 512, "tile_size_x": 16, "tile_size_y": 32, "nvml_pwr_limit": 115, "sm__warps_active.avg.pct_of_peak_sustained_active": 95.3433944732503, "dram__bytes.sum.per_second": 1165753.3768454855, "time": 20.641732624598912, "times": [19.298240661621094, 20.76495933532715, 20.927200317382812, 20.87558364868164, 20.822080612182617, 20.900543212890625, 20.903520584106445], "nvml_power": 117.486, "nvml_energy": 2.4251145991336283, "compile_time": 251.94155797362328, "verification_time": 0, "benchmark_time": 1234.1862530447543, "edp": 50.05856713932773, "throughput_penalty": 1000000.0, "objective": 1000050.0585671393, "strategy_time": 0.3527919761836529, "framework_time": 55.43235200457275, "timestamp": "2025-02-20 07:54:33.357711+00:00"},
"2,16,2,4,140": {"block_size_x": 2, "block_size_y": 16, "tile_size_x": 2, "tile_size_y": 4, "nvml_pwr_limit": 140, "sm__warps_active.avg.pct_of_peak_sustained_active": 49.95267358467398, "dram__bytes.sum.per_second": 55444.07336518199, "time": 160.82332066127233, "times": [160.42906188964844, 159.39865112304688, 159.75216674804688, 159.49305725097656, 162.68167114257812, 162.92239379882812, 161.08624267578125], "nvml_power": 139.799, "nvml_energy": 22.48293940512521, "compile_time": 254.3714758940041, "verification_time": 0, "benchmark_time": 2446.1890649981797, "edp": 3615.780973358407, "throughput_penalty": 1000000.0, "objective": 1003615.7809733584, "strategy_time": 0.28571090660989285, "framework_time": 61.70685216784477, "timestamp": "2025-02-20 07:54:36.120290+00:00"},
"4,16,32,2,105": {"block_size_x": 4, "block_size_y": 16, "tile_size_x": 32, "tile_size_y": 2, "nvml_pwr_limit": 105, "sm__warps_active.avg.pct_of_peak_sustained_active": 93.7687019998394, "dram__bytes.sum.per_second": 523724.73028176394, "time": 15.275524548121862, "times": [10.542783737182617, 11.072863578796387, 15.542943954467773, 17.365631103515625, 17.758464813232422, 17.439456939697266, 17.206527709960938], "nvml_power": 108.396, "nvml_energy": 1.6558057589182171, "compile_time": 252.06329603679478, "verification_time": 0, "benchmark_time": 1342.7183600142598, "edp": 25.293301517276774, "throughput_penalty": 1000000.0, "objective": 1000025.2933015173, "strategy_time": 0.373160932213068, "framework_time": 50.2480729483068, "timestamp": "2025-02-20 07:54:37.765716+00:00"},
"8,64,32,32,240": {"block_size_x": 8, "block_size_y": 64, "tile_size_x": 32, "tile_size_y": 32, "nvml_pwr_limit": 240, "sm__warps_active.avg.pct_of_peak_sustained_active": 98.77631885116043, "dram__bytes.sum.per_second": 1401223081.861609, "time": 11.757984025137764, "times": [11.735456466674805, 11.783647537231445, 11.77344036102295, 11.757120132446289, 11.761152267456055, 11.752415657043457, 11.742655754089355], "nvml_power": 241.621, "nvml_energy": 2.8409758581378117, "compile_time": 253.9136209525168, "verification_time": 0, "benchmark_time": 1134.887722088024, "edp": 33.404148755786444, "throughput_penalty": 1000000.0, "objective": 1000033.4041487558, "strategy_time": 0.5929118487983942, "framework_time": 53.422724129632115, "timestamp": "2025-02-20 07:54:39.208558+00:00"},
"8,32,16,2,240": {"block_size_x": 8, "block_size_y": 32, "tile_size_x": 16, "tile_size_y": 2, "nvml_pwr_limit": 240, "sm__warps_active.avg.pct_of_peak_sustained_active": 99.29043854863961, "dram__bytes.sum.per_second": 229305317.51508, "time": 23.043455941336497, "times": [22.983423233032227, 23.011775970458984, 23.029855728149414, 23.012128829956055, 23.02012825012207, 23.090879440307617, 23.1560001373291], "nvml_power": 245.683, "nvml_energy": 5.6613853860353744, "compile_time": 250.12255599722266, "verification_time": 0, "benchmark_time": 1239.3481840845197, "edp": 130.45788471003246, "throughput_penalty": 1000000.0, "objective": 1000130.45788471, "strategy_time": 0.6612930446863174, "framework_time": 0.5548119079321623, "timestamp": "2025-02-20 07:54:40.699270+00:00"},
"8,128,8,4,225": {"block_size_x": 8, "block_size_y": 128, "tile_size_x": 8, "tile_size_y": 4, "nvml_pwr_limit": 225, "sm__warps_active.avg.pct_of_peak_sustained_active": 66.01824107956719, "dram__bytes.sum.per_second": 150526.17753529618, "time": 44.25646155221121, "times": [44.614112854003906, 44.24419021606445, 44.165409088134766, 44.064735412597656, 44.24678421020508, 44.22902297973633, 44.23097610473633], "nvml_power": 229.069, "nvml_energy": 10.13778339130347, "compile_time": 251.1257901787758, "verification_time": 0, "benchmark_time": 1409.8875110503286, "edp": 448.66242088186743, "throughput_penalty": 1000000.0, "objective": 1000448.6624208819, "strategy_time": 0.6668821442872286, "framework_time": 55.11401849798858, "timestamp": "2025-02-20 07:54:42.416089+00:00"},
"32,16,2,4,230": {"block_size_x": 32, "block_size_y": 16, "tile_size_x": 2, "tile_size_y": 4, "nvml_pwr_limit": 230, "sm__warps_active.avg.pct_of_peak_sustained_active": 99.64353397212572, "dram__bytes.sum.per_second": 118512220.56169346, "time": 36.19824382237026, "times": [36.446014404296875, 36.246559143066406, 36.18988800048828, 36.182464599609375, 36.0681266784668, 36.10047912597656, 36.1541748046875], "nvml_power": 234.023, "nvml_energy": 8.471221614042555, "compile_time": 250.2748561091721, "verification_time": 0, "benchmark_time": 1346.091286977753, "edp": 306.64334545844537, "throughput_penalty": 1000000.0, "objective": 1000306.6433454584, "strategy_time": 0.775631982833147, "framework_time": 55.175649002194405, "timestamp": "2025-02-20 07:54:44.068432+00:00"},
"4,256,32,4,175": {"block_size_x": 4, "block_size_y": 256, "tile_size_x": 32, "tile_size_y": 4, "nvml_pwr_limit": 175, "sm__warps_active.avg.pct_of_peak_sustained_active": 65.73172943335415, "dram__bytes.sum.per_second": 11815934.575938875, "time": 9.949334689549037, "times": [9.808256149291992, 9.836959838867188, 9.88428783416748, 9.882271766662598, 10.047616004943848, 10.06719970703125, 10.118751525878906], "nvml_power": 180.321, "nvml_energy": 1.7940739805541719, "compile_time": 244.6357849985361, "verification_time": 0, "benchmark_time": 1141.4123019203544, "edp": 17.849842490344948, "throughput_penalty": 1000000.0, "objective": 1000017.8498424904, "strategy_time": 0.6955729331821203, "framework_time": 58.850419940426946, "timestamp": "2025-02-20 07:54:45.514051+00:00"},
"16,64,8,4,130": {"block_size_x": 16, "block_size_y": 64, "tile_size_x": 8, "tile_size_y": 4, "nvml_pwr_limit": 130, "sm__warps_active.avg.pct_of_peak_sustained_active": 66.04876801060311, "dram__bytes.sum.per_second": 237987.743631203, "time": 58.56546674455915, "times": [60.930015563964844, 58.32649612426758, 58.1431999206543, 58.13999938964844, 58.140830993652344, 58.13961410522461, 58.13811111450195], "nvml_power": 131.024, "nvml_energy": 7.673481714739118, "compile_time": 254.95274900458753, "verification_time": 0, "benchmark_time": 1582.8371699899435, "edp": 449.40103817953656, "throughput_penalty": 1000000.0, "objective": 1000449.4010381795, "strategy_time": 0.6944530177861452, "framework_time": 53.041601087898016, "timestamp": "2025-02-20 07:54:47.405601+00:00"},
"128,4,16,2,115": {"block_size_x": 128, "block_size_y": 4, "tile_size_x": 16, "tile_size_y": 2, "nvml_pwr_limit": 115, "sm__warps_active.avg.pct_of_peak_sustained_active": 99.43301512790379, "dram__bytes.sum.per_second": 60928417.19389597, "time": 78.14767129080636, "times": [81.40473937988281, 77.70547485351562, 77.62828826904297, 77.58038330078125, 77.57170867919922, 77.57561492919922, 77.56748962402344], "nvml_power": 115.908, "nvml_energy": 9.057940283974784, "compile_time": 255.0121678505093, "verification_time": 0, "benchmark_time": 1680.987216066569, "edp": 707.8569398838146, "throughput_penalty": 1000000.0, "objective": 1000707.8569398838, "strategy_time": 0.8435931522399187, "framework_time": 54.780164966359735, "timestamp": "2025-02-20 07:54:49.397249+00:00"},
"4,16,2,8,110": {"block_size_x": 4, "block_size_y": 16, "tile_size_x": 2, "tile_size_y": 8, "nvml_pwr_limit": 110, "sm__warps_active.avg.pct_of_peak_sustained_active": 96.40096874425325, "dram__bytes.sum.per_second": 37143983.61721564, "time": 148.36504473005022, "times": [144.08709716796875, 143.08653259277344, 142.39471435546875, 144.82850646972656, 153.14572143554688, 155.9385986328125, 155.0741424560547], "nvml_power": 108.603, "nvml_energy": 16.11288895281764, "compile_time": 255.90138882398605, "verification_time": 0, "benchmark_time": 2248.4935000538826, "edp": 2390.5894902151213, "throughput_penalty": 1000000.0, "objective": 1002390.5894902152, "strategy_time": 0.6787220481783152, "framework_time": 52.48104897327721, "timestamp": "2025-02-20 07:54:51.954829+00:00"},
"8,128,32,2,100": {"block_size_x": 8, "block_size_y": 128, "tile_size_x": 32, "tile_size_y": 2, "nvml_pwr_limit": 100, "sm__warps_active.avg.pct_of_peak_sustained_active": 65.98719307645715, "dram__bytes.sum.per_second": 233213529.84637484, "time": 22.194143840244838, "times": [12.505727767944336, 19.612064361572266, 26.228511810302734, 24.918495178222656, 24.32512092590332, 23.88822364807129, 23.880863189697266], "nvml_power": 103.009, "nvml_energy": 2.2861965628397805, "compile_time": 245.93920283950865, "verification_time": 0, "benchmark_time": 1342.5678780768067, "edp": 50.740175362739436, "throughput_penalty": 1000000.0, "objective": 1000050.7401753628, "strategy_time": 95.50751303322613, "framework_time": 47.00585990212858, "timestamp": "2025-02-20 07:54:53.685874+00:00"},
"2,512,32,16,110": {"block_size_x": 2, "block_size_y": 512, "tile_size_x": 32, "tile_size_y": 16, "nvml_pwr_limit": 110, "sm__warps_active.avg.pct_of_peak_sustained_active": 65.67639737270781, "dram__bytes.sum.per_second": 230831166.4312773, "time": 11.027369090488978, "times": [9.756863594055176, 10.71673583984375, 10.88150405883789, 11.462656021118164, 11.460607528686523, 11.45680046081543, 11.456416130065918], "nvml_power": 111.352, "nvml_energy": 1.2279196029641286, "compile_time": 233.24687010608613, "verification_time": 0, "benchmark_time": 1162.8223438747227, "edp": 13.54072267533213, "throughput_penalty": 1000000.0, "objective": 1000013.5407226754, "strategy_time": 5.775809986516833, "framework_time": 48.249832121655345, "timestamp": "2025-02-20 07:54:55.135995+00:00"},
"16,64,32,2,100": {"block_size_x": 16, "block_size_y": 64, "tile_size_x": 32, "tile_size_y": 2, "nvml_pwr_limit": 100, "sm__warps_active.avg.pct_of_peak_sustained_active": 66.05656534577214, "dram__bytes.sum.per_second": 531803.3376277076, "time": 40.931739807128906, "times": [34.585758209228516, 43.102783203125, 41.79500961303711, 41.75193786621094, 41.74272155761719, 41.79836654663086, 41.745601654052734], "nvml_power": 100.144, "nvml_energy": 4.099068151245118, "compile_time": 230.28304800391197, "verification_time": 0, "benchmark_time": 1425.4513359628618, "edp": 167.78199101845408, "throughput_penalty": 1000000.0, "objective": 1000167.7819910184, "strategy_time": 6.917482940480113, "framework_time": 51.38742411509156, "timestamp": "2025-02-20 07:54:56.850064+00:00"},
"16,64,32,2,125": {"block_size_x": 16, "block_size_y": 64, "tile_size_x": 32, "tile_size_y": 2, "nvml_pwr_limit": 125, "sm__warps_active.avg.pct_of_peak_sustained_active": 66.05791802834514, "dram__bytes.sum.per_second": 15042.429051443227, "time": 29.11808477129255, "times": [25.417184829711914, 28.061248779296875, 30.306400299072266, 30.012351989746094, 30.01148796081543, 30.010944366455078, 30.006975173950195], "nvml_power": 127.877, "nvml_energy": 3.7235333262985773, "compile_time": 239.0152660664171, "verification_time": 0, "benchmark_time": 1362.7921668812633, "edp": 108.4221590438949, "throughput_penalty": 1000000.0, "objective": 1000108.4221590438, "strategy_time": 60.990135883912444, "framework_time": 43.044596211984754, "timestamp": "2025-02-20 07:54:58.555931+00:00"},
"1,1024,32,32,115": {"block_size_x": 1, "block_size_y": 1024, "tile_size_x": 32, "tile_size_y": 32, "nvml_pwr_limit": 115, "sm__warps_active.avg.pct_of_peak_sustained_active": 65.71185272099335, "dram__bytes.sum.per_second": 344403308.4373727, "time": 12.137760026114327, "times": [10.656031608581543, 11.799391746520996, 12.184608459472656, 12.609024047851562, 12.616767883300781, 12.580096244812012, 12.518400192260742], "nvml_power": 116.568, "nvml_energy": 1.414874410724095, "compile_time": 226.66569403372705, "verification_time": 0, "benchmark_time": 1176.2231229804456, "edp": 17.173406064458984, "throughput_penalty": 1000000.0, "objective": 1000017.1734060645, "strategy_time": 5.844609113410115, "framework_time": 43.449536664411426, "timestamp": "2025-02-20 07:55:00.008139+00:00"},
"16,64,32,2,130": {"block_size_x": 16, "block_size_y": 64, "tile_size_x": 32, "tile_size_y": 2, "nvml_pwr_limit": 130, "sm__warps_active.avg.pct_of_peak_sustained_active": 66.05628126903059, "dram__bytes.sum.per_second": 1120741.1835026897, "time": 27.340648923601425, "times": [20.78838348388672, 27.90355110168457, 28.539520263671875, 28.53936004638672, 28.537599563598633, 28.5383358001709, 28.537792205810547], "nvml_power": 133.138, "nvml_energy": 3.6400793163904464, "compile_time": 249.42682893015444, "verification_time": 0, "benchmark_time": 1330.0059139728546, "edp": 99.52213064349426, "throughput_penalty": 1000000.0, "objective": 1000099.5221306435, "strategy_time": 3.634141990914941, "framework_time": 45.728184981271625, "timestamp": "2025-02-20 07:55:01.636958+00:00"},
"1,64,32,2,100": {"block_size_x": 1, "block_size_y": 64, "tile_size_x": 32, "tile_size_y": 2, "nvml_pwr_limit": 100, "sm__warps_active.avg.pct_of_peak_sustained_active": 87.8698063329579, "dram__bytes.sum.per_second": 3160942.4389725607, "time": 12.000402041843959, "times": [9.552576065063477, 11.4716157913208, 11.579039573669434, 12.67750358581543, 13.076671600341797, 13.22105598449707, 12.424351692199707], "nvml_power": 101.609, "nvml_energy": 1.2193488510697228, "compile_time": 244.02404110878706, "verification_time": 0, "benchmark_time": 1206.7576551344246, "edp": 14.632676442097187, "throughput_penalty": 1000000.0, "objective": 1000014.6326764422, "strategy_time": 41.13525780849159, "framework_time": 45.13392085209489, "timestamp": "2025-02-20 07:55:03.174033+00:00"},
"4,32,32,2,100": {"block_size_x": 4, "block_size_y": 32, "tile_size_x": 32, "tile_size_y": 2, "nvml_pwr_limit": 100, "sm__warps_active.avg.pct_of_peak_sustained_active": 95.33538123108501, "dram__bytes.sum.per_second": 415547.987676405, "time": 16.51208714076451, "times": [11.358783721923828, 12.59494400024414, 16.33344078063965, 18.720256805419922, 19.04844856262207, 18.88483238220215, 18.643903732299805], "nvml_power": 103.359, "nvml_energy": 1.706672814782279, "compile_time": 231.48205690085888, "verification_time": 0, "benchmark_time": 1321.2723438628018, "edp": 28.18073023845884, "throughput_penalty": 1000000.0, "objective": 1000028.1807302384, "strategy_time": 5.574757931753993, "framework_time": 0.5367824342101812, "timestamp": "2025-02-20 07:55:04.732923+00:00"},
"1,128,32,2,100": {"block_size_x": 1, "block_size_y": 128, "tile_size_x": 32, "tile_size_y": 2, "nvml_pwr_limit": 100, "sm__warps_active.avg.pct_of_peak_sustained_active": 92.70428225438694, "dram__bytes.sum.per_second": 81282.36477493252, "time": 11.936923435756139, "times": [9.653183937072754, 10.936863899230957, 12.733695983886719, 12.561920166015625, 12.470080375671387, 12.32483196258545, 12.877887725830078], "nvml_power": 101.987, "nvml_energy": 1.2174110104424611, "compile_time": 243.6370870564133, "verification_time": 0, "benchmark_time": 1236.1546731553972, "edp": 14.532142021498176, "throughput_penalty": 1000000.0, "objective": 1000014.5321420215, "strategy_time": 3.450060961768031, "framework_time": 0.5578228738158941, "timestamp": "2025-02-20 07:55:06.216747+00:00"},
"4,256,32,32,170": {"block_size_x": 4, "block_size_y": 256, "tile_size_x": 32, "tile_size_y": 32, "nvml_pwr_limit": 170, "sm__warps_active.avg.pct_of_peak_sustained_active": 65.73260966882121, "dram__bytes.sum.per_second": 770144.4999934733, "time": 10.00141702379499, "times": [9.799519538879395, 9.820799827575684, 9.829824447631836, 10.106880187988281, 10.114015579223633, 10.167167663574219, 10.171711921691895], "nvml_power": 173.38, "nvml_energy": 1.7340456835855753, "compile_time": 247.42556805722415, "verification_time": 0, "benchmark_time": 1128.2081860117614, "edp": 17.342914019850994, "throughput_penalty": 1000000.0, "objective": 1000017.3429140198, "strategy_time": 44.62747904472053, "framework_time": 47.587300883606076, "timestamp": "2025-02-20 07:55:07.684621+00:00"},
"4,256,32,8,170": {"block_size_x": 4, "block_size_y": 256, "tile_size_x": 32, "tile_size_y": 8, "nvml_pwr_limit": 170, "sm__warps_active.avg.pct_of_peak_sustained_active": 65.73196926867644, "dram__bytes.sum.per_second": 847507.3504964438, "time": 9.980845723833356, "times": [9.810527801513672, 9.836799621582031, 9.93273639678955, 9.93769645690918, 10.104991912841797, 10.121343612670898, 10.121824264526367], "nvml_power": 173.243, "nvml_energy": 1.7291116557340622, "compile_time": 231.48024501278996, "verification_time": 0, "benchmark_time": 1141.460485989228, "edp": 17.257996675163728, "throughput_penalty": 1000000.0, "objective": 1000017.2579966752, "strategy_time": 5.846560001373291, "framework_time": 0.5394909530878067, "timestamp": "2025-02-20 07:55:09.063972+00:00"},
"4,256,32,16,165": {"block_size_x": 4, "block_size_y": 256, "tile_size_x": 32, "tile_size_y": 16, "nvml_pwr_limit": 165, "sm__warps_active.avg.pct_of_peak_sustained_active": 65.73173594028857, "dram__bytes.sum.per_second": 0.0, "time": 10.07476098196847, "times": [9.814047813415527, 9.830047607421875, 9.970239639282227, 10.06441593170166, 10.205087661743164, 10.316384315490723, 10.323103904724121], "nvml_power": 168.212, "nvml_energy": 1.6946956942988802, "compile_time": 231.95666493847966, "verification_time": 0, "benchmark_time": 1153.9373530540615, "edp": 17.073654057232325, "throughput_penalty": 1000000.0, "objective": 1000017.0736540572, "strategy_time": 3.7239419762045145, "framework_time": 45.290732057765126, "timestamp": "2025-02-20 07:55:10.498905+00:00"},
"64,16,32,4,205": {"block_size_x": 64, "block_size_y": 16, "tile_size_x": 32, "tile_size_y": 4, "nvml_pwr_limit": 205, "sm__warps_active.avg.pct_of_peak_sustained_active": 66.25361245142919, "dram__bytes.sum.per_second": 12709974.937155923, "time": 36.782294682094026, "times": [34.737857818603516, 36.998207092285156, 37.13631820678711, 37.14060974121094, 37.14611053466797, 37.164608001708984, 37.15235137939453], "nvml_power": 208.425, "nvml_energy": 7.666349769115448, "compile_time": 247.4927669391036, "verification_time": 0, "benchmark_time": 1373.4647599048913, "edp": 281.98593634360793, "throughput_penalty": 1000000.0, "objective": 1000281.9859363436, "strategy_time": 37.72517596371472, "framework_time": 50.95551931299269, "timestamp": "2025-02-20 07:55:12.208568+00:00"},
"2,512,32,32,115": {"block_size_x": 2, "block_size_y": 512, "tile_size_x": 32, "tile_size_y": 32, "nvml_pwr_limit": 115, "sm__warps_active.avg.pct_of_peak_sustained_active": 65.67647514555901, "dram__bytes.sum.per_second": 198109.37618659262, "time": 10.791264125279017, "times": [9.747455596923828, 10.511263847351074, 10.5217924118042, 11.088288307189941, 11.179264068603516, 11.22374439239502, 11.267040252685547], "nvml_power": 117.88, "nvml_energy": 1.2720742150878905, "compile_time": 235.13323301449418, "verification_time": 0, "benchmark_time": 1163.3540340699255, "edp": 13.727288841970418, "throughput_penalty": 1000000.0, "objective": 1000013.727288842, "strategy_time": 5.991379963234067, "framework_time": 46.21169506572187, "timestamp": "2025-02-20 07:55:13.659283+00:00"},
"128,8,32,2,205": {"block_size_x": 128, "block_size_y": 8, "tile_size_x": 32, "tile_size_y": 2, "nvml_pwr_limit": 205, "sm__warps_active.avg.pct_of_peak_sustained_active": 66.48499599531968, "dram__bytes.sum.per_second": 303740.5081091216, "time": 37.636556897844585, "times": [37.831966400146484, 37.24755096435547, 37.56662368774414, 37.67030334472656, 37.852638244628906, 37.6833610534668, 37.60345458984375], "nvml_power": 212.081, "nvml_energy": 7.981998623451777, "compile_time": 232.30419401079416, "verification_time": 0, "benchmark_time": 1362.3686309438199, "edp": 300.41494535005995, "throughput_penalty": 1000000.0, "objective": 1000300.41494535, "strategy_time": 4.116554046049714, "framework_time": 49.184113973751664, "timestamp": "2025-02-20 07:55:15.307282+00:00"},
"2,16,32,16,250": {"block_size_x": 2, "block_size_y": 16, "tile_size_x": 32, "tile_size_y": 16, "nvml_pwr_limit": 250, "sm__warps_active.avg.pct_of_peak_sustained_active": 49.12091830056073, "dram__bytes.sum.per_second": 5299611981.129442, "time": 9.18354742867606, "times": [9.186464309692383, 9.172287940979004, 9.170687675476074, 9.16915225982666, 9.193216323852539, 9.196991920471191, 9.19603157043457], "nvml_power": 201.8835, "nvml_energy": 1.8540066973171234, "compile_time": 242.52897687256336, "verification_time": 0, "benchmark_time": 1101.89572093077, "edp": 17.026358437894864, "throughput_penalty": 1000000.0, "objective": 1000017.0263584378, "strategy_time": 48.45497105270624, "framework_time": 41.124186012893915, "timestamp": "2025-02-20 07:55:16.741311+00:00"},
"2,64,32,2,100": {"block_size_x": 2, "block_size_y": 64, "tile_size_x": 32, "tile_size_y": 2, "nvml_pwr_limit": 100, "sm__warps_active.avg.pct_of_peak_sustained_active": 95.81903200483525, "dram__bytes.sum.per_second": 338323727.75364643, "time": 12.97237491607666, "times": [10.050687789916992, 11.207584381103516, 12.973407745361328, 14.306048393249512, 14.007328033447266, 14.209504127502441, 14.052063941955566], "nvml_power": 103.083, "nvml_energy": 1.3372313234739304, "compile_time": 240.28267804533243, "verification_time": 0, "benchmark_time": 1249.7654960025102, "edp": 17.347066077625207, "throughput_penalty": 1000000.0, "objective": 1000017.3470660776, "strategy_time": 5.614259047433734, "framework_time": 41.504018008708954, "timestamp": "2025-02-20 07:55:18.278502+00:00"},
"2,16,32,16,245": {"block_size_x": 2, "block_size_y": 16, "tile_size_x": 32, "tile_size_y": 16, "nvml_pwr_limit": 245, "sm__warps_active.avg.pct_of_peak_sustained_active": 49.11468756669316, "dram__bytes.sum.per_second": 7233442545.406485, "time": 9.193860598972865, "times": [9.189984321594238, 9.17859172821045, 9.204768180847168, 9.2128324508667, 9.177408218383789, 9.202783584594727, 9.190655708312988], "nvml_power": 199.601, "nvml_energy": 1.8351037694155827, "compile_time": 242.5143241416663, "verification_time": 0, "benchmark_time": 1107.2514299303293, "edp": 16.87168824065651, "throughput_penalty": 1000000.0, "objective": 1000016.8716882407, "strategy_time": 3.43401194550097, "framework_time": 54.11196802742779, "timestamp": "2025-02-20 07:55:19.685838+00:00"},
"8,32,32,32,220": {"block_size_x": 8, "block_size_y": 32, "tile_size_x": 32, "tile_size_y": 32, "nvml_pwr_limit": 220, "sm__warps_active.avg.pct_of_peak_sustained_active": 98.64782061825218, "dram__bytes.sum.per_second": 6138187571.53437, "time": 11.830084664481026, "times": [11.396256446838379, 11.411680221557617, 11.770079612731934, 12.06710433959961, 12.108223915100098, 12.021087646484375, 12.036160469055176], "nvml_power": 226.221, "nvml_energy": 2.6762135828835625, "compile_time": 246.91621796227992, "verification_time": 0, "benchmark_time": 1154.6588519122452, "edp": 31.659833265746652, "throughput_penalty": 1000000.0, "objective": 1000031.6598332657, "strategy_time": 44.834848027676344, "framework_time": 41.87344922684133, "timestamp": "2025-02-20 07:55:21.174145+00:00"},
"4,256,32,2,105": {"block_size_x": 4, "block_size_y": 256, "tile_size_x": 32, "tile_size_y": 2, "nvml_pwr_limit": 105, "sm__warps_active.avg.pct_of_peak_sustained_active": 65.7208195419831, "dram__bytes.sum.per_second": 498003026.308099, "time": 13.674985340663365, "times": [10.618880271911621, 11.660256385803223, 13.614912033081055, 14.511296272277832, 15.068960189819336, 15.076128005981445, 15.174464225769043], "nvml_power": 108.896, "nvml_energy": 1.489151203656878, "compile_time": 232.3068380355835, "verification_time": 0, "benchmark_time": 1291.7989999987185, "edp": 20.36412088003901, "throughput_penalty": 1000000.0, "objective": 1000020.36412088, "strategy_time": 5.810139002278447, "framework_time": 48.089939868077636, "timestamp": "2025-02-20 07:55:22.752174+00:00"},
"8,32,32,32,215": {"block_size_x": 8, "block_size_y": 32, "tile_size_x": 32, "tile_size_y": 32, "nvml_pwr_limit": 215, "sm__warps_active.avg.pct_of_peak_sustained_active": 98.62634727705039, "dram__bytes.sum.per_second": 5677216798.648064, "time": 11.850482395717076, "times": [11.406399726867676, 11.431872367858887, 11.697983741760254, 11.885472297668457, 12.172096252441406, 12.176032066345215, 12.183520317077637], "nvml_power": 219.801, "nvml_energy": 2.6047478810610087, "compile_time": 238.61968889832497, "verification_time": 0, "benchmark_time": 1170.6554850097746, "edp": 30.867518909794843, "throughput_penalty": 1000000.0, "objective": 1000030.8675189097, "strategy_time": 3.7274120841175318, "framework_time": 55.821694899350405, "timestamp": "2025-02-20 07:55:24.221024+00:00"},
"8,128,32,4,170": {"block_size_x": 8, "block_size_y": 128, "tile_size_x": 32, "tile_size_y": 4, "nvml_pwr_limit": 170, "sm__warps_active.avg.pct_of_peak_sustained_active": 65.99626914338451, "dram__bytes.sum.per_second": 394855850.763143, "time": 11.95088005065918, "times": [10.848383903503418, 10.921695709228516, 11.957632064819336, 12.217535972595215, 12.566240310668945, 12.57583999633789, 12.568832397460938], "nvml_power": 174.063, "nvml_energy": 2.080206034257889, "compile_time": 243.7940938398242, "verification_time": 0, "benchmark_time": 1180.2355719264597, "edp": 24.860292796073452, "throughput_penalty": 1000000.0, "objective": 1000024.860292796, "strategy_time": 44.10429601557553, "framework_time": 74.66640626080334, "timestamp": "2025-02-20 07:55:25.763850+00:00"},
"4,256,32,4,170": {"block_size_x": 4, "block_size_y": 256, "tile_size_x": 32, "tile_size_y": 4, "nvml_pwr_limit": 170, "sm__warps_active.avg.pct_of_peak_sustained_active": 65.73199474323897, "dram__bytes.sum.per_second": 114111194.13455671, "time": 10.030089242117745, "times": [9.799519538879395, 9.835712432861328, 9.997632026672363, 9.998368263244629, 10.168319702148438, 10.174400329589844, 10.236672401428223], "nvml_power": 172.124, "nvml_energy": 1.7264190807102746, "compile_time": 239.0223068650812, "verification_time": 0, "benchmark_time": 1155.3614460863173, "edp": 17.31613744881893, "throughput_penalty": 1000000.0, "objective": 1000017.3161374488, "strategy_time": 5.933019099757075, "framework_time": 0.5366620607674122, "timestamp": "2025-02-20 07:55:27.164727+00:00"},
"1,512,32,16,100": {"block_size_x": 1, "block_size_y": 512, "tile_size_x": 32, "tile_size_y": 16, "nvml_pwr_limit": 100, "sm__warps_active.avg.pct_of_peak_sustained_active": 92.1371821413788, "dram__bytes.sum.per_second": 535568705.6767161, "time": 12.024388585771833, "times": [9.642848014831543, 11.35200023651123, 11.801119804382324, 12.98588752746582, 13.064127922058105, 12.930432319641113, 12.394304275512695], "nvml_power": 102.895, "nvml_energy": 1.2372494635329927, "compile_time": 234.5202318392694, "verification_time": 0, "benchmark_time": 1224.085127003491, "edp": 14.877168327058442, "throughput_penalty": 1000000.0, "objective": 1000014.8771683271, "strategy_time": 3.5495921038091183, "framework_time": 50.845976918935776, "timestamp": "2025-02-20 07:55:28.677754+00:00"},
"8,128,32,32,185": {"block_size_x": 8, "block_size_y": 128, "tile_size_x": 32, "tile_size_y": 32, "nvml_pwr_limit": 185, "sm__warps_active.avg.pct_of_peak_sustained_active": 66.00531616668735, "dram__bytes.sum.per_second": 743463840.1340872, "time": 10.898276601518903, "times": [10.849247932434082, 10.882335662841797, 10.882304191589355, 10.876607894897461, 10.852416038513184, 10.858016014099121, 11.087008476257324], "nvml_power": 189.675, "nvml_energy": 2.067130614393098, "compile_time": 247.6705340668559, "verification_time": 0, "benchmark_time": 1236.5260820370167, "edp": 22.52816120712369, "throughput_penalty": 1000000.0, "objective": 1000022.5281612071, "strategy_time": 57.05140787176788, "framework_time": 41.535157011821866, "timestamp": "2025-02-20 07:55:30.260560+00:00"},
"1,1024,16,32,115": {"block_size_x": 1, "block_size_y": 1024, "tile_size_x": 16, "tile_size_y": 32, "nvml_pwr_limit": 115, "sm__warps_active.avg.pct_of_peak_sustained_active": 65.73415184489862, "dram__bytes.sum.per_second": 279831489.5548894, "time": 23.546637671334402, "times": [23.17616081237793, 23.066303253173828, 23.368288040161133, 23.464799880981445, 23.589216232299805, 24.220224380493164, 23.941471099853516], "nvml_power": 118.328, "nvml_energy": 2.786226542373657, "compile_time": 235.73256307281554, "verification_time": 0, "benchmark_time": 1282.0493169128895, "edp": 65.60626686352735, "throughput_penalty": 1000000.0, "objective": 1000065.6062668635, "strategy_time": 5.766418995335698, "framework_time": 51.69742996804416, "timestamp": "2025-02-20 07:55:31.835829+00:00"},
"8,128,32,32,190": {"block_size_x": 8, "block_size_y": 128, "tile_size_x": 32, "tile_size_y": 32, "nvml_pwr_limit": 190, "sm__warps_active.avg.pct_of_peak_sustained_active": 65.99963471081251, "dram__bytes.sum.per_second": 3886052.438084495, "time": 11.513823917933873, "times": [10.855936050415039, 10.955679893493652, 11.339455604553223, 11.860896110534668, 11.864447593688965, 11.860671997070312, 11.85968017578125], "nvml_power": 195.91, "nvml_energy": 2.2556732437624247, "compile_time": 241.3075619842857, "verification_time": 0, "benchmark_time": 1163.7735341209918, "edp": 25.97142454507529, "throughput_penalty": 1000000.0, "objective": 1000025.971424545, "strategy_time": 3.6546329502016306, "framework_time": 47.298433957621455, "timestamp": "2025-02-20 07:55:33.291889+00:00"},
"1,256,32,16,105": {"block_size_x": 1, "block_size_y": 256, "tile_size_x": 32, "tile_size_y": 16, "nvml_pwr_limit": 105, "sm__warps_active.avg.pct_of_peak_sustained_active": 92.18684896617081, "dram__bytes.sum.per_second": 7252739.120050325, "time": 11.00672449384417, "times": [9.491999626159668, 9.539487838745117, 9.519743919372559, 11.639455795288086, 11.937024116516113, 12.389632225036621, 12.529727935791016], "nvml_power": 107.07, "nvml_energy": 1.178489991555895, "compile_time": 233.97183697670698, "verification_time": 0, "benchmark_time": 1256.1001721769571, "edp": 12.971314655808479, "throughput_penalty": 1000000.0, "objective": 1000012.9713146558, "strategy_time": 57.58239887654781, "framework_time": 44.14374311454594, "timestamp": "2025-02-20 07:55:34.883714+00:00"},
"1,512,32,32,115": {"block_size_x": 1, "block_size_y": 512, "tile_size_x": 32, "tile_size_y": 32, "nvml_pwr_limit": 115, "sm__warps_active.avg.pct_of_peak_sustained_active": 92.14203066271612, "dram__bytes.sum.per_second": 1623079.6606167038, "time": 10.754084587097168, "times": [9.672224044799805, 10.460351943969727, 10.572768211364746, 11.127776145935059, 11.153823852539062, 11.11631965637207, 11.175328254699707], "nvml_power": 117.731, "nvml_energy": 1.2660891325235366, "compile_time": 226.95764200761914, "verification_time": 0, "benchmark_time": 1170.4131760634482, "edp": 13.615629625962589, "throughput_penalty": 1000000.0, "objective": 1000013.615629626, "strategy_time": 5.563967861235142, "framework_time": 47.712877159938216, "timestamp": "2025-02-20 07:55:36.334385+00:00"},
"1,512,32,32,110": {"block_size_x": 1, "block_size_y": 512, "tile_size_x": 32, "tile_size_y": 32, "nvml_pwr_limit": 110, "sm__warps_active.avg.pct_of_peak_sustained_active": 92.15123340510995, "dram__bytes.sum.per_second": 0.0, "time": 10.965275491986956, "times": [9.708383560180664, 10.630975723266602, 10.779552459716797, 11.368639945983887, 11.414688110351562, 11.428000450134277, 11.426688194274902], "nvml_power": 112.178, "nvml_energy": 1.2300626741401128, "compile_time": 246.2639140430838, "verification_time": 0, "benchmark_time": 1191.5139809716493, "edp": 13.487976094356517, "throughput_penalty": 1000000.0, "objective": 1000013.4879760944, "strategy_time": 3.3975911792367697, "framework_time": 52.20076092518866, "timestamp": "2025-02-20 07:55:37.827787+00:00"},
"2,512,32,16,120": {"block_size_x": 2, "block_size_y": 512, "tile_size_x": 32, "tile_size_y": 16, "nvml_pwr_limit": 120, "sm__warps_active.avg.pct_of_peak_sustained_active": 65.67485937480276, "dram__bytes.sum.per_second": 0.0, "time": 10.533961023603167, "times": [9.8504638671875, 10.08579158782959, 10.415583610534668, 10.721535682678223, 10.78867244720459, 10.933664321899414, 10.942015647888184], "nvml_power": 122.077, "nvml_energy": 1.2859543598784038, "compile_time": 237.10820404812694, "verification_time": 0, "benchmark_time": 1166.9108560308814, "edp": 13.546193105091666, "throughput_penalty": 1000000.0, "objective": 1000013.546193105, "strategy_time": 59.137092903256416, "framework_time": 43.50586095824838, "timestamp": "2025-02-20 07:55:39.334473+00:00"},
"1,256,32,8,100": {"block_size_x": 1, "block_size_y": 256, "tile_size_x": 32, "tile_size_y": 8, "nvml_pwr_limit": 100, "sm__warps_active.avg.pct_of_peak_sustained_active": 91.22636700440782, "dram__bytes.sum.per_second": 0.0, "time": 11.934591974530901, "times": [10.153087615966797, 10.812800407409668, 11.694047927856445, 12.063039779663086, 12.93830394744873, 12.935775756835938, 12.945088386535645], "nvml_power": 102.573, "nvml_energy": 1.2241669026035582, "compile_time": 233.00612880848348, "verification_time": 0, "benchmark_time": 1267.5983998924494, "edp": 14.609932491298778, "throughput_penalty": 1000000.0, "objective": 1000014.6099324913, "strategy_time": 5.6223280262202024, "framework_time": 46.1750712711364, "timestamp": "2025-02-20 07:55:40.886899+00:00"},
"4,256,32,16,120": {"block_size_x": 4, "block_size_y": 256, "tile_size_x": 32, "tile_size_y": 16, "nvml_pwr_limit": 120, "sm__warps_active.avg.pct_of_peak_sustained_active": 65.73161943589888, "dram__bytes.sum.per_second": 0.0, "time": 11.543862887791224, "times": [10.224448204040527, 10.699616432189941, 11.061023712158203, 11.667296409606934, 12.379103660583496, 12.4202241897583, 12.355327606201172], "nvml_power": 124.454, "nvml_energy": 1.436679911837169, "compile_time": 242.72867990657687, "verification_time": 0, "benchmark_time": 1234.07191503793, "edp": 16.584835915892263, "throughput_penalty": 1000000.0, "objective": 1000016.584835916, "strategy_time": 3.5904310643672943, "framework_time": 54.64630899950862, "timestamp": "2025-02-20 07:55:42.421961+00:00"},
"2,512,32,16,165": {"block_size_x": 2, "block_size_y": 512, "tile_size_x": 32, "tile_size_y": 16, "nvml_pwr_limit": 165, "sm__warps_active.avg.pct_of_peak_sustained_active": 65.67498805041066, "dram__bytes.sum.per_second": 13199.621170872395, "time": 9.705344063895089, "times": [9.695743560791016, 9.711647987365723, 9.707584381103516, 9.705439567565918, 9.707072257995605, 9.70412826538086, 9.705792427062988], "nvml_power": 162.73, "nvml_energy": 1.5793506395176475, "compile_time": 240.920522948727, "verification_time": 0, "benchmark_time": 1111.2471311353147, "edp": 15.328141354051512, "throughput_penalty": 1000000.0, "objective": 1000015.328141354, "strategy_time": 49.503271002322435, "framework_time": 47.23996389657259, "timestamp": "2025-02-20 07:55:43.870894+00:00"},
"1,512,32,16,105": {"block_size_x": 1, "block_size_y": 512, "tile_size_x": 32, "tile_size_y": 16, "nvml_pwr_limit": 105, "sm__warps_active.avg.pct_of_peak_sustained_active": 92.16133125912404, "dram__bytes.sum.per_second": 26640.47020429911, "time": 11.735099383762904, "times": [9.587039947509766, 11.017727851867676, 11.280320167541504, 13.42630386352539, 12.450400352478027, 12.444543838500977, 11.939359664916992], "nvml_power": 107.979, "nvml_energy": 1.2671442963593347, "compile_time": 226.54144605621696, "verification_time": 0, "benchmark_time": 1187.4709338881075, "edp": 14.870064251345108, "throughput_penalty": 1000000.0, "objective": 1000014.8700642514, "strategy_time": 5.624468205496669, "framework_time": 46.86397174373269, "timestamp": "2025-02-20 07:55:45.337419+00:00"},
"2,512,32,32,165": {"block_size_x": 2, "block_size_y": 512, "tile_size_x": 32, "tile_size_y": 32, "nvml_pwr_limit": 165, "sm__warps_active.avg.pct_of_peak_sustained_active": 65.6755396460231, "dram__bytes.sum.per_second": 0.0, "time": 9.705824170793806, "times": [9.695487976074219, 9.710816383361816, 9.709024429321289, 9.706624031066895, 9.708959579467773, 9.704928398132324, 9.704928398132324], "nvml_power": 162.798, "nvml_energy": 1.58008876335689, "compile_time": 235.4413929861039, "verification_time": 0, "benchmark_time": 1111.1950930207968, "edp": 15.336063711388997, "throughput_penalty": 1000000.0, "objective": 1000015.3360637114, "strategy_time": 3.516630968078971, "framework_time": 48.45676803961396, "timestamp": "2025-02-20 07:55:46.736053+00:00"},
"16,64,32,32,200": {"block_size_x": 16, "block_size_y": 64, "tile_size_x": 32, "tile_size_y": 32, "nvml_pwr_limit": 200, "sm__warps_active.avg.pct_of_peak_sustained_active": 66.07276230406892, "dram__bytes.sum.per_second": 1154460746.441486, "time": 18.703273228236608, "times": [18.17401695251465, 18.360576629638672, 18.35353660583496, 18.46793556213379, 19.188255310058594, 19.194847106933594, 19.183744430541992], "nvml_power": 202.181, "nvml_energy": 3.7814464845581055, "compile_time": 240.88131007738411, "verification_time": 0, "benchmark_time": 1215.54657490924, "edp": 70.72542679864505, "throughput_penalty": 1000000.0, "objective": 1000070.7254267987, "strategy_time": 49.62798091582954, "framework_time": 46.79611301980913, "timestamp": "2025-02-20 07:55:48.288929+00:00"},
"2,512,32,32,120": {"block_size_x": 2, "block_size_y": 512, "tile_size_x": 32, "tile_size_y": 32, "nvml_pwr_limit": 120, "sm__warps_active.avg.pct_of_peak_sustained_active": 65.66989016339137, "dram__bytes.sum.per_second": 855945016.2746017, "time": 10.633590834481376, "times": [9.733535766601562, 10.44326400756836, 10.482208251953125, 10.927007675170898, 10.926112174987793, 10.924832344055176, 10.998175621032715], "nvml_power": 122.934, "nvml_energy": 1.3072298556461335, "compile_time": 237.0455269701779, "verification_time": 0, "benchmark_time": 1166.156501043588, "edp": 13.900547411559138, "throughput_penalty": 1000000.0, "objective": 1000013.9005474115, "strategy_time": 5.911238957196474, "framework_time": 44.24774390645325, "timestamp": "2025-02-20 07:55:49.742315+00:00"},
"16,64,32,32,205": {"block_size_x": 16, "block_size_y": 64, "tile_size_x": 32, "tile_size_y": 32, "nvml_pwr_limit": 205, "sm__warps_active.avg.pct_of_peak_sustained_active": 66.07335536668674, "dram__bytes.sum.per_second": 1187235195.723884, "time": 18.5720637185233, "times": [17.981216430664062, 18.202463150024414, 18.659168243408203, 18.855743408203125, 18.778240203857422, 18.76812744140625, 18.75948715209961], "nvml_power": 210.334, "nvml_energy": 3.90633645017188, "compile_time": 236.96412704885006, "verification_time": 0, "benchmark_time": 1206.9902890361845, "edp": 72.54872945858227, "throughput_penalty": 1000000.0, "objective": 1000072.5487294586, "strategy_time": 3.7898130249232054, "framework_time": 44.73921307362616, "timestamp": "2025-02-20 07:55:51.234823+00:00"},
"4,32,32,32,245": {"block_size_x": 4, "block_size_y": 32, "tile_size_x": 32, "tile_size_y": 32, "nvml_pwr_limit": 245, "sm__warps_active.avg.pct_of_peak_sustained_active": 94.4578609092655, "dram__bytes.sum.per_second": 5909105123.260541, "time": 9.793723378862653, "times": [9.821503639221191, 9.822367668151855, 9.799391746520996, 9.836447715759277, 9.745152473449707, 9.717535972595215, 9.813664436340332], "nvml_power": 241.691, "nvml_energy": 2.367054797160694, "compile_time": 244.99084101989865, "verification_time": 0, "benchmark_time": 1113.3543129544705, "edp": 23.182279906001682, "throughput_penalty": 1000000.0, "objective": 1000023.182279906, "strategy_time": 49.69136998988688, "framework_time": 50.07561203092337, "timestamp": "2025-02-20 07:55:52.692959+00:00"},
"2,512,32,16,115": {"block_size_x": 2, "block_size_y": 512, "tile_size_x": 32, "tile_size_y": 16, "nvml_pwr_limit": 115, "sm__warps_active.avg.pct_of_peak_sustained_active": 65.66858102719976, "dram__bytes.sum.per_second": 1068295193.602027, "time": 10.817238943917411, "times": [9.995807647705078, 10.392448425292969, 10.731200218200684, 11.011967658996582, 11.121024131774902, 11.155360221862793, 11.312864303588867], "nvml_power": 117.632, "nvml_energy": 1.272453451450893, "compile_time": 232.85029106773436, "verification_time": 0, "benchmark_time": 1182.33482982032, "edp": 13.764433029356722, "throughput_penalty": 1000000.0, "objective": 1000013.7644330293, "strategy_time": 5.758127896115184, "framework_time": 40.06768041290343, "timestamp": "2025-02-20 07:55:54.153995+00:00"},
"4,32,32,32,240": {"block_size_x": 4, "block_size_y": 32, "tile_size_x": 32, "tile_size_y": 32, "nvml_pwr_limit": 240, "sm__warps_active.avg.pct_of_peak_sustained_active": 94.62015046777663, "dram__bytes.sum.per_second": 6092979469.466613, "time": 9.789760044642858, "times": [9.797792434692383, 9.735199928283691, 9.913824081420898, 9.708415985107422, 9.880064010620117, 9.733951568603516, 9.759072303771973], "nvml_power": 244.918, "nvml_energy": 2.397688450613839, "compile_time": 241.8803689070046, "verification_time": 0, "benchmark_time": 1113.8703860342503, "edp": 23.472794593321, "throughput_penalty": 1000000.0, "objective": 1000023.4727945933, "strategy_time": 3.674671985208988, "framework_time": 48.628247110173106, "timestamp": "2025-02-20 07:55:55.562073+00:00"},
"4,8,32,2,250": {"block_size_x": 4, "block_size_y": 8, "tile_size_x": 32, "tile_size_y": 2, "nvml_pwr_limit": 250, "sm__warps_active.avg.pct_of_peak_sustained_active": 49.5047059135235, "dram__bytes.sum.per_second": 1737514212.6675122, "time": 9.740095955984932, "times": [9.745856285095215, 9.761823654174805, 9.735967636108398, 9.741408348083496, 9.717632293701172, 9.749247550964355, 9.72873592376709], "nvml_power": 243.773, "nvml_energy": 2.374372411478315, "compile_time": 248.66708111949265, "verification_time": 0, "benchmark_time": 1103.9211300667375, "edp": 23.12661512304213, "throughput_penalty": 1000000.0, "objective": 1000023.126615123, "strategy_time": 46.47462908178568, "framework_time": 45.99917773157358, "timestamp": "2025-02-20 07:55:57.007160+00:00"},
"4,256,32,8,175": {"block_size_x": 4, "block_size_y": 256, "tile_size_x": 32, "tile_size_y": 8, "nvml_pwr_limit": 175, "sm__warps_active.avg.pct_of_peak_sustained_active": 65.73225681333648, "dram__bytes.sum.per_second": 652541.3221792269, "time": 10.065065111432757, "times": [9.799615859985352, 9.947392463684082, 10.060480117797852, 10.116064071655273, 10.178367614746094, 10.176383972167969, 10.177151679992676], "nvml_power": 180.721, "nvml_energy": 1.8189686320032392, "compile_time": 236.40128993429244, "verification_time": 0, "benchmark_time": 1136.5501610562205, "edp": 18.30803771676637, "throughput_penalty": 1000000.0, "objective": 1000018.3080377168, "strategy_time": 5.796968005597591, "framework_time": 79.24456498585641, "timestamp": "2025-02-20 07:55:58.465177+00:00"},
"4,16,32,4,250": {"block_size_x": 4, "block_size_y": 16, "tile_size_x": 32, "tile_size_y": 4, "nvml_pwr_limit": 250, "sm__warps_active.avg.pct_of_peak_sustained_active": 94.07798620366613, "dram__bytes.sum.per_second": 10173480.123366557, "time": 9.806619235447474, "times": [9.820351600646973, 9.825247764587402, 9.791296005249023, 9.777183532714844, 9.81875228881836, 9.791839599609375, 9.821663856506348], "nvml_power": 229.211, "nvml_energy": 2.247785001576151, "compile_time": 235.22258503362536, "verification_time": 0, "benchmark_time": 1108.628757065162, "edp": 22.043171633607017, "throughput_penalty": 1000000.0, "objective": 1000022.0431716336, "strategy_time": 3.7133810110390186, "framework_time": 48.634596867486835, "timestamp": "2025-02-20 07:55:59.861400+00:00"},
"4,256,32,8,110": {"block_size_x": 4, "block_size_y": 256, "tile_size_x": 32, "tile_size_y": 8, "nvml_pwr_limit": 110, "sm__warps_active.avg.pct_of_peak_sustained_active": 65.73218625914294, "dram__bytes.sum.per_second": 39158.48417507758, "time": 13.191597666059222, "times": [9.799712181091309, 11.226367950439453, 12.497119903564453, 14.619423866271973, 14.737631797790527, 14.748064041137695, 14.71286392211914], "nvml_power": 114.052, "nvml_energy": 1.5045280970093864, "compile_time": 248.65608708932996, "verification_time": 0, "benchmark_time": 1261.8676139973104, "edp": 19.847129333029542, "throughput_penalty": 1000000.0, "objective": 1000019.8471293331, "strategy_time": 48.65233600139618, "framework_time": 42.98305790871382, "timestamp": "2025-02-20 07:56:01.463584+00:00"},
"2,32,32,2,100": {"block_size_x": 2, "block_size_y": 32, "tile_size_x": 32, "tile_size_y": 2, "nvml_pwr_limit": 100, "sm__warps_active.avg.pct_of_peak_sustained_active": 91.50059198646464, "dram__bytes.sum.per_second": 0.0, "time": 13.188457080296107, "times": [9.569215774536133, 11.462528228759766, 12.68166446685791, 14.85654354095459, 14.68175983428955, 14.599871635437012, 14.467616081237793], "nvml_power": 103.136, "nvml_energy": 1.3602047094334193, "compile_time": 227.13976702652872, "verification_time": 0, "benchmark_time": 1251.5132958069444, "edp": 17.93900143077929, "throughput_penalty": 1000000.0, "objective": 1000017.9390014308, "strategy_time": 5.720928078517318, "framework_time": 55.93212018720806, "timestamp": "2025-02-20 07:56:03.003915+00:00"},
"4,256,32,8,115": {"block_size_x": 4, "block_size_y": 256, "tile_size_x": 32, "tile_size_y": 8, "nvml_pwr_limit": 115, "sm__warps_active.avg.pct_of_peak_sustained_active": 65.7317440250314, "dram__bytes.sum.per_second": 26051.673494376097, "time": 12.016502789088658, "times": [10.299551963806152, 10.989439964294434, 11.70854377746582, 12.027359962463379, 13.028863906860352, 13.029376029968262, 13.032383918762207], "nvml_power": 119.318, "nvml_energy": 1.4337850797884806, "compile_time": 241.1824120208621, "verification_time": 0, "benchmark_time": 1282.8555011656135, "edp": 17.22908241023198, "throughput_penalty": 1000000.0, "objective": 1000017.2290824102, "strategy_time": 3.625420853495598, "framework_time": 52.09959694184363, "timestamp": "2025-02-20 07:56:04.583702+00:00"},
"8,16,32,8,225": {"block_size_x": 8, "block_size_y": 16, "tile_size_x": 32, "tile_size_y": 8, "nvml_pwr_limit": 225, "sm__warps_active.avg.pct_of_peak_sustained_active": 92.61067280534823, "dram__bytes.sum.per_second": 1773385046.7018201, "time": 11.646180697849818, "times": [10.83670425415039, 10.915360450744629, 11.427295684814453, 12.166144371032715, 12.110879898071289, 12.09068775177002, 11.976192474365234], "nvml_power": 229.0275, "nvml_energy": 2.6672956497767992, "compile_time": 243.34288807585835, "verification_time": 0, "benchmark_time": 1162.2568811289966, "edp": 31.063807111889346, "throughput_penalty": 1000000.0, "objective": 1000031.0638071119, "strategy_time": 54.58140396513045, "framework_time": 47.581251710653305, "timestamp": "2025-02-20 07:56:06.091488+00:00"},
"4,16,32,8,240": {"block_size_x": 4, "block_size_y": 16, "tile_size_x": 32, "tile_size_y": 8, "nvml_pwr_limit": 240, "sm__warps_active.avg.pct_of_peak_sustained_active": 94.37305433758495, "dram__bytes.sum.per_second": 2657126838.427037, "time": 9.793448993137904, "times": [9.803135871887207, 9.84768009185791, 9.829216003417969, 9.795999526977539, 9.788543701171875, 9.733247756958008, 9.756319999694824], "nvml_power": 233.537, "nvml_energy": 2.2871326975104465, "compile_time": 228.63066010177135, "verification_time": 0, "benchmark_time": 1109.6676501911134, "edp": 22.398917413606462, "throughput_penalty": 1000000.0, "objective": 1000022.3989174135, "strategy_time": 5.892008077353239, "framework_time": 53.22152958251536, "timestamp": "2025-02-20 07:56:07.488925+00:00"},
"4,16,32,8,235": {"block_size_x": 4, "block_size_y": 16, "tile_size_x": 32, "tile_size_y": 8, "nvml_pwr_limit": 235, "sm__warps_active.avg.pct_of_peak_sustained_active": 94.2529529062489, "dram__bytes.sum.per_second": 2700355480.4878526, "time": 9.784914425441197, "times": [9.761504173278809, 9.78486442565918, 9.747424125671387, 9.746432304382324, 9.836288452148438, 9.790207862854004, 9.827679634094238], "nvml_power": 234.035, "nvml_energy": 2.290012447558131, "compile_time": 247.3884189967066, "verification_time": 0, "benchmark_time": 1109.457704005763, "edp": 22.40757583255146, "throughput_penalty": 1000000.0, "objective": 1000022.4075758326, "strategy_time": 3.655751934275031, "framework_time": 48.87288506142795, "timestamp": "2025-02-20 07:56:08.898323+00:00"},
"1,32,32,32,250": {"block_size_x": 1, "block_size_y": 32, "tile_size_x": 32, "tile_size_y": 32, "nvml_pwr_limit": 250, "sm__warps_active.avg.pct_of_peak_sustained_active": 48.78580652742009, "dram__bytes.sum.per_second": 6339137785.291632, "time": 8.908146177019391, "times": [8.905119895935059, 8.90880012512207, 8.906463623046875, 8.912544250488281, 8.910847663879395, 8.902527809143066, 8.910719871520996], "nvml_power": 188.708, "nvml_energy": 1.6810384487729753, "compile_time": 239.3243119586259, "verification_time": 0, "benchmark_time": 1102.7298790868372, "edp": 14.974936230859587, "throughput_penalty": 1000000.0, "objective": 1000014.9749362308, "strategy_time": 59.96769084595144, "framework_time": 47.90282202884555, "timestamp": "2025-02-20 07:56:10.348273+00:00"},
"1,256,32,16,100": {"block_size_x": 1, "block_size_y": 256, "tile_size_x": 32, "tile_size_y": 16, "nvml_pwr_limit": 100, "sm__warps_active.avg.pct_of_peak_sustained_active": 91.99797355675021, "dram__bytes.sum.per_second": 865920829.0573846, "time": 12.65936006818499, "times": [9.715968132019043, 11.328384399414062, 12.234975814819336, 14.187616348266602, 13.93286418914795, 13.757887840270996, 13.457823753356934], "nvml_power": 103.105, "nvml_energy": 1.3052433198302136, "compile_time": 234.54009694978595, "verification_time": 0, "benchmark_time": 1209.1417028568685, "edp": 16.523545162323813, "throughput_penalty": 1000000.0, "objective": 1000016.5235451623, "strategy_time": 5.527166882529855, "framework_time": 47.69674222916365, "timestamp": "2025-02-20 07:56:11.845203+00:00"},
"2,128,32,2,100": {"block_size_x": 2, "block_size_y": 128, "tile_size_x": 32, "tile_size_y": 2, "nvml_pwr_limit": 100, "sm__warps_active.avg.pct_of_peak_sustained_active": 94.98541214592063, "dram__bytes.sum.per_second": 697279.9377811748, "time": 12.194509778703962, "times": [10.323616027832031, 10.692288398742676, 11.797216415405273, 12.296287536621094, 13.55081558227539, 13.449024200439453, 13.252320289611816], "nvml_power": 103.464, "nvml_energy": 1.2616927597438268, "compile_time": 232.67457890324295, "verification_time": 0, "benchmark_time": 1223.507455084473, "edp": 15.385724696416084, "throughput_penalty": 1000000.0, "objective": 1000015.3857246964, "strategy_time": 3.4892510157078505, "framework_time": 0.563842011615634, "timestamp": "2025-02-20 07:56:13.305462+00:00"},
"4,32,32,2,105": {"block_size_x": 4, "block_size_y": 32, "tile_size_x": 32, "tile_size_y": 2, "nvml_pwr_limit": 105, "sm__warps_active.avg.pct_of_peak_sustained_active": 95.36658225148538, "dram__bytes.sum.per_second": 168611.09850130673, "time": 16.11037254333496, "times": [9.996735572814941, 13.745696067810059, 17.25836753845215, 18.958688735961914, 17.92310333251953, 17.495616912841797, 17.394399642944336], "nvml_power": 108.116, "nvml_energy": 1.7417890378952028, "compile_time": 245.91649998910725, "verification_time": 0, "benchmark_time": 1302.6134110987186, "edp": 28.060870292388692, "throughput_penalty": 1000000.0, "objective": 1000028.0608702924, "strategy_time": 52.64499713666737, "framework_time": 43.70372882112861, "timestamp": "2025-02-20 07:56:14.950364+00:00"},
"2,32,32,32,250": {"block_size_x": 2, "block_size_y": 32, "tile_size_x": 32, "tile_size_y": 32, "nvml_pwr_limit": 250, "sm__warps_active.avg.pct_of_peak_sustained_active": 92.63072340487705, "dram__bytes.sum.per_second": 6565737808.954637, "time": 9.439414841788155, "times": [9.307488441467285, 9.324480056762695, 9.527263641357422, 9.418047904968262, 9.442943572998047, 9.517984390258789, 9.53769588470459], "nvml_power": 210.43200000000002, "nvml_energy": 1.9863549439871653, "compile_time": 240.91412406414747, "verification_time": 0, "benchmark_time": 1103.228674037382, "edp": 18.750028339331728, "throughput_penalty": 1000000.0, "objective": 1000018.7500283393, "strategy_time": 5.681948037818074, "framework_time": 47.304098727181554, "timestamp": "2025-02-20 07:56:16.347517+00:00"},
"1,128,32,4,100": {"block_size_x": 1, "block_size_y": 128, "tile_size_x": 32, "tile_size_y": 4, "nvml_pwr_limit": 100, "sm__warps_active.avg.pct_of_peak_sustained_active": 92.25317233699268, "dram__bytes.sum.per_second": 449714506.8538723, "time": 12.495556695120674, "times": [9.529120445251465, 11.198752403259277, 11.94422435760498, 14.183744430541992, 13.972543716430664, 13.604415893554688, 13.03609561920166], "nvml_power": 102.985, "nvml_energy": 1.2868549062470027, "compile_time": 236.117027932778, "verification_time": 0, "benchmark_time": 1242.0270398724824, "edp": 16.079968439403622, "throughput_penalty": 1000000.0, "objective": 1000016.0799684394, "strategy_time": 3.479280974715948, "framework_time": 46.67298821732402, "timestamp": "2025-02-20 07:56:17.875837+00:00"},
"2,512,32,32,170": {"block_size_x": 2, "block_size_y": 512, "tile_size_x": 32, "tile_size_y": 32, "nvml_pwr_limit": 170, "sm__warps_active.avg.pct_of_peak_sustained_active": 65.67821507879847, "dram__bytes.sum.per_second": 820926403.1837065, "time": 9.706249100821358, "times": [9.695167541503906, 9.709695816040039, 9.709343910217285, 9.709152221679688, 9.70678424835205, 9.707679748535156, 9.705920219421387], "nvml_power": 164.1775, "nvml_energy": 1.5935477117500987, "compile_time": 244.79691497981548, "verification_time": 0, "benchmark_time": 1110.8480407856405, "edp": 15.467371044290328, "throughput_penalty": 1000000.0, "objective": 1000015.4673710443, "strategy_time": 51.758924033492804, "framework_time": 50.14688731171191, "timestamp": "2025-02-20 07:56:19.333412+00:00"},
"4,256,32,32,175": {"block_size_x": 4, "block_size_y": 256, "tile_size_x": 32, "tile_size_y": 32, "nvml_pwr_limit": 175, "sm__warps_active.avg.pct_of_peak_sustained_active": 65.7325444560201, "dram__bytes.sum.per_second": 704209.2805654539, "time": 10.008630616324288, "times": [9.810015678405762, 9.824447631835938, 9.84768009185791, 10.114879608154297, 10.116640090942383, 10.176351547241211, 10.17039966583252], "nvml_power": 180.4, "nvml_energy": 1.8055569631849016, "compile_time": 226.3930649496615, "verification_time": 0, "benchmark_time": 1128.7254139315337, "edp": 18.07115270124991, "throughput_penalty": 1000000.0, "objective": 1000018.0711527013, "strategy_time": 5.816668039187789, "framework_time": 46.86174797825515, "timestamp": "2025-02-20 07:56:20.741233+00:00"},
"4,256,32,16,170": {"block_size_x": 4, "block_size_y": 256, "tile_size_x": 32, "tile_size_y": 16, "nvml_pwr_limit": 170, "sm__warps_active.avg.pct_of_peak_sustained_active": 65.73201264476529, "dram__bytes.sum.per_second": 0.0, "time": 10.063785144260951, "times": [9.807168006896973, 9.848159790039062, 9.964608192443848, 10.006879806518555, 10.241151809692383, 10.315648078918457, 10.262880325317383], "nvml_power": 172.221, "nvml_energy": 1.7331951413297653, "compile_time": 237.35484015196562, "verification_time": 0, "benchmark_time": 1148.892882047221, "edp": 17.44250351541975, "throughput_penalty": 1000000.0, "objective": 1000017.4425035154, "strategy_time": 3.8062219973653555, "framework_time": 50.869699800387025, "timestamp": "2025-02-20 07:56:22.182181+00:00"},
